case_id,vuln_type,audit_report,input_token_num,output_token_num,inference_time
177922,Exec Code Overflow," YES

The provided C++ code is vulnerable due to a potential buffer overflow in the `add_param_to_argv` function. The vulnerability arises from the fact that the function does not properly handle the case where the input string `parsestart` is longer than the allocated buffer size of `param_buffer[1024]`. If an attacker provides a specially crafted input that exceeds 1024 characters, it could lead to a buffer overflow, potentially allowing arbitrary code execution or crashing the program.

The vulnerability is similar to the one described in the CVE-ID CVE-2019-11360, where a buffer overflow in iptables-restore in netfilter iptables 1.8.2 allows an attacker to crash the program or potentially gain code execution via a specially crafted iptables-save file.

To fix this vulnerability, the `add_param_to_argv` function should be modified to ensure that the input string is properly truncated or handled in a way that prevents buffer overflow. This could be achieved by adding a check to ensure that the length of the input string does not exceed the allocated buffer size before copying it into the `param_buffer`.",2388,272,11.067389488220215
177923,Bypass," NO

The provided C++ code for the `move_uploaded_file` function does not appear to be vulnerable to the Bypass.cpp vulnerability described in the CVE-2015-2348. The vulnerability in the original PHP code was due to the handling of pathnames containing null bytes, which allowed attackers to bypass file extension restrictions.

In the provided code, there is no evidence of handling pathnames with null bytes or any other similar vulnerability. The code checks for the existence of the file in the `rfc1867_uploaded_files` hash and performs the move operation if the file exists. It also checks for the open-basedir restriction and performs file permissions adjustments if necessary.

However, it is essential to note that the code provided is not the complete implementation of the `move_uploaded_file` function, and without the full context, it is not possible to guarantee that there are no other vulnerabilities present.",1986,213,8.592516660690308
177926,Exec Code Overflow," NO

The provided code for `gst_vorbis_tag_add_coverart` does not appear to be vulnerable to the same integer overflow issue as the original function. The changes made to the code, such as using `g_try_malloc0` instead of `gst_malloc0` and the absence of the `img_len` calculation, do not introduce a new vulnerability. The code still checks the base64 length and handles errors appropriately.",1963,102,4.26285195350647
177927,nan," NO

The provided C++ code is not vulnerable to the specific vulnerability described in the PHP code. The PHP code has a vulnerability related to the handling of the `iv_len` variable, which could lead to an integer overflow if the IV length is too large. This could potentially cause a crash or unexpected behavior due to an interpretation error for negative numbers.

The C++ code, on the other hand, does not have this vulnerability. It correctly checks the size of the `iv_buf` array before using it to store the IV, and it does not perform any operations that could lead to an integer overflow in the same way as the PHP code.",4118,140,6.377166986465454
