case_id,vuln_type,audit_report,input_token_num,output_token_num,inference_time
177736,Bypass," NO

The provided code snippet is not vulnerable to the Bypass.C++ vulnerability described in the question. The code is a function that calculates the sum of remoteness for a given grid, which is unrelated to the Samba server's user account control and administrative privileges. The vulnerability mentioned in the question is specific to the Samba server's handling of user account control attributes and administrative privileges, which is not present in the given code snippet.",2650,100,4.4613118171691895
177740,DoS Exec Code Overflow Mem. Corr.," NO

The provided C++ code does not appear to be vulnerable to the DoS_Exec_Code_Overflow_Mem._Corr. vulnerability described in the context. The vulnerability in the original code snippet was related to improper parsing of time strings, which could lead to memory corruption or arbitrary code execution. The provided code is a function that calculates the sum of remoteness for a given grid, which is unrelated to time parsing or handling of certificates.",2129,102,4.415384292602539
177741,DoS Overflow, NO,1394,2,0.37224340438842773
177742,DoS Overflow," YES, the code is vulnerable.

The vulnerability in the provided `gnutls_session_get_data` function is similar to the one described in the original code snippet. The issue arises when the size of the data in the `gnutls_datum_t` structure (`psession.size`) is greater than the size of the buffer pointed to by `session_data` (indicated by `*session_data_size`). In such a case, the `memcpy` function will attempt to copy more data than the destination buffer can hold, leading to a buffer overflow.

This can be exploited by a remote attacker to cause a denial of service (DoS) by sending a large `SessionTicket` that exceeds the size of the allocated memory for `session_data`. The overflow can corrupt adjacent memory, potentially leading to a crash or other unintended behavior.

To fix this vulnerability, you should ensure that the size of the data being copied does not exceed the size of the destination buffer. You can add a check before the `memcpy` call to verify that `psession.size` is less than or equal to `*session_data_size`. If the size is greater, you should handle the error appropriellesly, such as by returning an error code or throwing an exception.

Here's an updated version of the function with the added",1364,301,11.498385190963745
177743,DoS," YES

The provided C++ code is vulnerable due to a potential integer overflow issue. The function `sumRemoteness` calculates the sum of the product of the total remoteness and the count of each group of connected cells in a grid. The variables `total` and `cnt` are both of type `int64_t`, which is a 64-bit integer type. However, the variable `result` used to accumulate the sum is also of type `int64_t`.

The vulnerability arises from the fact that the product of `total` and `cnt` could exceed the maximum value that an `int64_t` can hold, which is 2^63 - 1. If this happens, the result will wrap around and produce an incorrect value, leading to a potential integer overflow.

To fix this issue, you can change the type of the `result` variable to a larger integer type, such as `long double`, or use a larger integer type like `int128_t` if it is available on your platform. Alternatively, you can implement a check to ensure that the product of `total` and `cnt` does not exceed the maximum value of `int64_t` before performing the multiplication.",3996,272,11.458488702774048
177747,DoS," NO

The provided code snippet for the `bgp_attr_unknown` function does not appear to contain a DoS vulnerability based on the information given. The function processes BGP attributes and handles unknown attributes by logging them and setting flags appropriately. The vulnerability mentioned in the question (CVE-2013-6051) is related to the improper initialization of the `total` variable, but in the provided code snippet, `total` is being initialized within the function scope.",2279,107,4.645886421203613
177750,DoS Exec Code," NO

The provided code snippet for `begin_softmask` does not appear to be vulnerable based on the information given. The code does not exhibit any clear signs of a DoS, Exec, or Code vulnerability. It is a function that seems to be handling a soft mask for PDF processing, and it does not contain any obvious security flaws such as buffer overflows, use-after-free, or other common vulnerabilities.

The second code snippet is a function for calculating the sum of remoteness in a grid, which is unrelated to the `begin_softmask` function and does not appear to be vulnerable either. It is a simple algorithm that iterates over a grid and calculates a value based on the contents of the grid. There are no security-sensitive operations that would make it vulnerable to DoS, Exec, or Code vulnerabilities.

However, without a full understanding of the context in which these functions are used, and without a complete codebase, it is not possible to definitively say that there are no vulnerabilities. Security analysis should be thorough and consider the entire application and its environment.",2244,240,9.791802883148193
177766,DoS, NO,4581,2,1.0901975631713867
177767,DoS," NO

The provided C++ code for `decode_openldap_dereference` does not appear to be vulnerable to a Denial of Service (DoS) attack based on the code snippet alone. The vulnerability mentioned in the question (CVE-2015-7540) is specific to Samba 4.x before 4.1.22, where it does not check return values to ensure successful ASN.1 memory allocation, which could lead to a DoS. However, the provided code snippet does check the return values of memory allocation functions (`talloc` and `talloc_zero`) and the ASN.1 functions (`asn1_load`, `asn1_start_tag`, `asn1_read_OctetString_talloc`, `asn1_peek_tag`, `asn1_end_tag`), and it returns `false` if any of these functions fail. This indicates that the code is checking for successful memory allocation and ASN.1 operations, which should prevent the specific DoS vulnerability mentioned.

However, without the full context of the codebase and the implementation of the `talloc` and `asn1_*` functions, it is not possible to definitively say that the code is not vulnerable to any DoS attacks. The provided snippet does not contain any obvious vulnerabilities, but a thorough security review",2239,301,12.094646692276001
177768,DoS," NO

The provided C++ code for the `sparse_dump_region` function does not appear to be vulnerable based on the information given. The function is a part of the GNU Tar utility and is used for handling sparse files during archiving. The code does not exhibit any obvious vulnerabilities such as buffer overflows, use-after-free, or other common security issues. It is a straightforward implementation of reading and writing blocks of data from a sparse file.

However, without a complete context of how the function is used and the overall program structure, it is not possible to definitively say that there are no vulnerabilities. The code provided does not contain any user input or external data handling that could be exploited. It is important to review the entire program and its usage to ensure there are no vulnerabilities.",2707,172,7.2650065422058105
177770,Bypass," NO

The provided C++ code is not vulnerable to the same Bypass.cve.2017.17434 vulnerability as the original code snippet. The Bypass.cve.2017.17434 vulnerability is specific to the way the daemon in rsync version 3.1.2 and 3.1.3-2 before 2017-12-03 handles fnamecmp_type and sanitizes paths in the recv_file_list function.

In the provided code, the handling of fnamecmp_type and the recv_file_list function are not present, and the code is focused on calculating the sum of remoteness in a grid. The vulnerability is not relevant to this code.",3551,176,7.623988389968872
177771,nan, NO,1922,2,0.4961094856262207
177773,DoS Exec Code Overflow Mem. Corr., NO,1723,2,0.4434497356414795
177774,DoS Exec Code Overflow," NO

The provided C++ code for the `drawImage` function does not appear to be vulnerable to the DoS_Exec_Code_Overflow.exe.c vulnerability described in the question. The vulnerability is related to multiple integer overflows in Poppler and related libraries, which can lead to a denial of service (DoS) or arbitrary code execution.

The `drawImage` function is responsible for drawing an image using a given stream, color map, and other parameters. It does not involve any operations that could lead to integer overflows or arbitrary code execution. The function uses a color map to determine the number of pixel components and allocates memory accordingly. It then iterates over the image data and draws the image using the provided color map and source mode.

The function does not involve any file operations, memory allocations, or other operations that could lead to a DoS or arbitrary code execution vulnerability. Therefore, the provided code is not vulnerable to the DoS_Exec_Code_Overflow.exe.c vulnerability.",3397,223,9.401365756988525
177775,DoS Exec Code Overflow," NO

The provided C++ code for the `drawImage` function does not appear to be vulnerable to the DoS, Exec, or Code Overflow vulnerabilities described in the CVE-2009-3605 issue. The code does not involve any operations that would lead to a buffer overflow, integer overflow, or any other form of memory corruption that could be exploited for arbitrary code execution or denial of service. The code properly allocates and frees memory, and it does not perform any unsafe pointer arithmetic or indexing that could lead to vulnerabilities.",2619,121,5.2653186321258545
177777,DoS Exec Code Overflow," NO

The provided code does not appear to be vulnerable to the DoS_Exec_Overflow vulnerability described in the initial prompt. The code is a function that draws an image with a mask on a cairo surface, and it does not involve any operations that would lead to a buffer overflow or arbitrary code execution. The function properly allocates memory for the buffer, handles the image creation, and cleans up resources after use. There are no operations that would write beyond the allocated buffer size or execute user-controlled data as code.",3173,113,5.0956199169158936
177778,DoS Exec Code Overflow," NO

The provided C++ code for the `drawMaskedImage` function does not appear to be vulnerable to the DoS_Exec_Code_Overflow vulnerability described in the CVE-ID CVE-2009-3605. The function is a straightforward implementation of a masking operation using the Cairo graphics library, and it does not involve any operations that could lead to a buffer overflow or execution of arbitrary code.",3453,95,4.44088077545166
177779,DoS Exec Code Overflow," NO

The provided code does not appear to be vulnerable to the DoS_Exec_Code_Overflow. The code is a C++ function that performs a breadth-first search (BFS) on a grid to calculate the sum of all elements and the number of elements in each group of connected elements. It does not involve any external input that could be manipulated to cause a denial of service through code execution overflow.",3533,90,4.281462907791138
177780,DoS Exec Code Overflow," NO

The provided code for `GfxImageColorMap::GfxImageColorMap` does not appear to be vulnerable to the DoS, Exec_Code_Overflow, or Code_Injection vulnerabilities. The function is a constructor that initializes a color map based on the provided parameters. It does not execute any external code, handle user input in a way that could lead to a buffer overflow, or expose any vulnerabilities that could be exploited for code injection.",3723,100,4.721840143203735
177781,DoS Exec Code Overflow, NO,1517,2,0.3941831588745117
177783,DoS Exec Code Overflow, NO,1511,2,0.3940393924713135
177786,DoS Exec Code Overflow," NO

The provided code does not appear to be vulnerable to the DoS, Exec_Code, or Code_Overflow vulnerabilities as described in the CVE-2009-3605. The code is a function for drawing an image with various color modes and does not involve any operations that could lead to integer overflows or underflows that would cause a denial of service or execution of arbitrary code.",3393,90,4.2480456829071045
177787,DoS Exec Code Overflow," NO

The provided C++ function `drawSplashImage` is not vulnerable to a DoS_Exec_Code_Segment_Overflow. The function is a simple image drawing operation that does not involve executing any external code or handling untrusted input in a way that could lead to a buffer overflow or code execution vulnerability.",4499,72,3.798529624938965
177788,DoS Exec Code Overflow," NO

The provided C++ code does not appear to be vulnerable to a buffer overflow or any other common security vulnerability. The code implements a breadth-first search (BFS) algorithm to calculate the sum of all elements in a grid, excluding elements that have been visited. It uses a vector of vectors to represent the grid and a vector of pairs to represent the queue for BFS. The code checks for boundary conditions and ensures that only unvisited elements are added to the queue.",4211,105,5.003331422805786
177789,DoS Exec Code Overflow," NO

The provided code snippet for `poppler_page_prepare_output_dev` does not appear to be vulnerable to the DoS, Exec, Code, or Overflow vulnerabilities as described in the CVE-2009-3605. The vulnerability in the original code was due to integer overflows when calculating the `cairo_width` and `cairo_height`, which could lead to a buffer overflow when creating the `cairo_data` buffer. However, in the provided code snippet, the calculation of `cairo_width` and `cairo_height` is done using the `ceil` function, which should prevent integer overflows.

Additionally, the code checks for transparency and sets the `cairo_data` buffer to either all 0x00 or 0xff bytes, which is a safe operation. The creation of the `cairo_data` buffer and the `cairo_surface_t` is done using the calculated dimensions, and the `cairo_create` function is called with the correct surface.

The `sumRemoteness` function is unrelated to the `poppler_page_prepare_output_dev` function and does not appear to have any vulnerabilities related to the DoS, Exec, Code, or Overflow categories.

However, it is essential to note that without the full context of",1969,301,11.94372010231018
177792,DoS Exec Code Overflow, NO,1605,2,0.42313194274902344
177793,DoS Exec Code Overflow," NO

The provided code for the `SplashFTFont::makeGlyph` function does not appear to be vulnerable to the DoS_Exec_Overflow vulnerability described in the CVE-2009-3605. The function is responsible for creating a glyph from a font file, setting transformations, loading the glyph, rendering it, and then copying the rendered glyph data into a buffer.

The vulnerability in the original code was related to integer overflows that could lead to a denial of service or arbitrary code execution. However, the provided code does not contain any operations that could lead to such overflows. The glyph metrics are calculated using division by 64.0, which is a floating-point operation and does not lead to integer overflow. The buffer size for the glyph data is calculated based on the width of the glyph and whether anti-aliasing is enabled, and it is allocated using `gmalloc`. There is no direct evidence of vulnerable integer arithmetic that could lead to an overflow.

Additionally, the code does not execute any external code or system calls that could be exploited for arbitrary code execution. The function is a straightforward implementation of glyph processing and does not involve any unsafe functions or operations that are typically associated with vulnerabilities like buffer overflows or integer overflows.

Therefore, based on the provided code snippet, it does not appear to be vulner",2819,301,12.231324434280396
177794,nan," NO

The provided code snippet for the `DynamicMetadataProvider` constructor does not exhibit the vulnerability described in the CVE-ID CVE-2017-16853. The vulnerability mentioned is related to the improper configuration of the `DynamicMetadataProvider` class and the lack of security checks, which is not evident in the given constructor code. The constructor code focuses on initializing the class members and handling the refresh delay factor, which is not directly related to the vulnerability described.",1886,109,4.490890741348267
177795,nan," NO

The provided code snippet for the `DynamicMetadataProvider` constructor does not appear to be vulnerable to the specific CVE-2017-16852 issue described. The vulnerability mentioned in the description relates to improper configuration and security checks in the Shibboleth Service Provider's Dynamic Metadata Provider plugin. The code snippet you've provided is a constructor for a `DynamicMetadataProvider` class, which initializes the object based on a given `DOMElement`.

The vulnerability in the original code was due to the plugin not properly configuring itself with the MetadataFilter plugins and not performing critical security checks. The code you've provided does not show the configuration of MetadataFilter plugins or the execution of security checks. It only initializes the object with the provided XML element and sets up some internal state based on the XML content.

However, without the full context of how this `DynamicMetadataProvider` is used within the application, it's not possible to definitively say that there are no vulnerabilities. The security of the application would depend on how this class is used, how the XML is parsed, and how the resulting state is managed.

To ensure that there are no vulnerabilities, you would need to review the entire application, including how the `DynamicMetadataProvider` is used, how the XML is parsed and validated, and how the resulting state is managed",2011,301,12.021435976028442
177796,Overflow," NO

The provided code for the `nfs_readlink_req` function does not appear to be vulnerable to the same overflow issue as the original code snippet you provided. The vulnerability in the original code was due to the use of the `len` variable, which was calculated as the difference between two pointers, and then used directly in a memory operation without proper bounds checking.

In the modified `nfs_readlink_req` function, the `len` variable is still calculated in the same way, but it is not used in a memory operation that could lead to an overflow. Instead, it is used to read the length of the new path from the response, and then to allocate memory for the target string. The allocation is done using `xzalloc`, which is a zero-initializing memory allocation function, and it is not clear from the code snippet whether it is vulnerable or not. However, the use of `len + 1` for the allocation size suggests that the code is attempting to allocate enough memory for the new path length plus a null terminator, which is a common practice in C/C++ to prevent buffer overflows when dealing with strings.

The `sumRemoteness` function is unrelated to the `nfs_readlink_req` function and does not appear to be vulnerable to the same overflow issue. It is a separate function that calculates the sum of remoteness for",1779,301,11.642899513244629
177799,Overflow," NO

The provided code snippet for `_XcursorReadImage` does not appear to be vulnerable to the same overflow issue as described in the original code. The vulnerability in the original code was due to the potential for an integer overflow when calculating the number of pixels to read (`n = image->width * image->height`). However, in the provided code snippet, the same calculation is performed, and there is no indication that the width or height values could cause an overflow in this context.

The provided code snippet also includes checks to ensure that the width and height are within a reasonable range (`if (head.width >= 0x10000 || head.height > 0x10000)`), which would prevent the calculation of `n` from resulting in an overflow. Additionally, the code checks for zero or negative values for width and height, which would also prevent an overflow from occurring.

Therefore, based on the information given and the checks in place, the provided code snippet does not appear to be vulnerable to the same overflow issue as the original code.",1885,231,9.14121961593628
177807,Bypass," NO

The provided C++ code for `znumicc_components` does not appear to be vulnerable based on the information given. The code is a function that reads the number of components from a dictionary and sets up an ICC profile. There is no clear indication of a bypass vulnerability in the code snippet provided. The vulnerability mentioned (CVE-2018-19476) is related to a type confusion issue in Artifex Ghostscript, which is not evident in the given code.",2029,113,4.791356563568115
177809,Bypass," NO

The provided code snippet for the `restore_page_device` function does not appear to be vulnerable based on the information given. The function checks for the same device and ensures that there is enough stack space before proceeding with the operation. The vulnerability mentioned in the question (CVE-2018-19475) is related to a specific implementation of Ghostscript that allows bypassing intended access restrictions due to insufficient stack space checks. However, the provided code includes checks for stack space (`ref_stack_count` and `ref_stack_max_count`) before proceeding with the operation, which mitigates the risk of a stack overflow.

The second part of the code is a separate function `sumRemoteness` that calculates the sum of remoteness for a given grid. This function does not appear to be related to the Ghostscript vulnerability and does not seem to have any security issues based on the provided code snippet.",2355,210,8.679410457611084
177811,DoS," NO

The provided code for `aspath_put` does not appear to be vulnerable to a Denial of Service (DoS) attack based on the information given. The code is responsible for writing AS_PATH information to a stream, and it includes checks to ensure that the data being written does not exceed the stream's writable limit. The code also handles the normalization of AS_PATH data and the packing of segments when necessary.

The second code snippet provided is a function for calculating the sum of remoteness in a grid, which is unrelated to the `aspath_put` function and does not appear to be vulnerable to a DoS attack based on the information given.",2347,149,6.3212974071502686
177812,Bypass, NO,1566,2,0.4214975833892822
177815,Bypass," NO

The provided C++ code for calculating the sum of all elements in a grid using BFS is not vulnerable to the Bypass vulnerability described in the context of the rsync issue (CVE-2017-15994). The code is a simple algorithm for summing elements in a grid and does not involve file handling, checksum calculations, or any of the specific conditions that led to the vulnerability in the rsync code.",2194,99,4.336625099182129
177816,Bypass, NO,2234,2,0.5608060359954834
177821,DoS, NO,1274,2,0.34674930572509766
177823,Exec Code Overflow," NO

The provided C++ code for the `BufCompressedFill` function does not appear to be vulnerable to the Exec_Code_Overflow vulnerability described in the CVE-ID CVE-2011-2895. The function is a decompression routine that processes a compressed data stream and fills a buffer with decompressed data. The vulnerability in question is related to the handling of code words that are not present in the decompression table, which can lead to an infinite loop or a buffer overflow.

In the provided code, the `getcode` function is used to retrieve the next code word from the compressed data. If the code word is not found in the `file->free_ent` table, the function breaks out of the loop and returns `BufFILEEOF`. This prevents the infinite loop scenario.

Additionally, the code checks for the `CLEAR` code word and resets the decompression table if necessary. This ensures that the decompression table is properly maintained and prevents the possibility of a buffer overflow.

Overall, the provided code does not exhibit the vulnerability described in the CVE-ID CVE-2EE-2011-2895.",2419,266,10.8433358669281
177825,DoS, NO,1704,2,0.441617488861084
177826,DoS Exec Code Overflow," YES, the provided code is vulnerable due to a stack-based buffer overflow in the `sprintf` function call within the `extractPages` function.

The issue arises from the following line:

```cpp
sprintf(pathName, destFileName, pageNo);
```

The `sprintf` function is used to format the `pathName` string, which is a stack-allocated buffer of size 1024. The `destFileName` and `pageNo` are used as format specifiers. If the combined length of `destFileName` and `pageNo` exceeds the size of the `pathName` buffer, it will cause a stack-based buffer overflow.

This vulnerability can lead to a denial of service (DoS) and potentially arbitrary code execution, as mentioned in the CVE-ID CVE-2013-4473.",1577,195,7.637797832489014
177827,nan," NO

The provided C++ code for the `sumRemoteness` function is not vulnerable to the same type of vulnerability as the original `jffs2_get_acl` function. The `sumRemoteness` function is a completely different algorithm that calculates the sum of remoteness for a given grid, and it does not involve file system operations or POSIX ACL handling.",2116,88,3.8789315223693848
177831,nan," NO

The provided code snippet for `mcid_char_imp` does not appear to be vulnerable based on the information given. The function is responsible for handling the removal of certain strings from a PDF object if a flag is set. The code checks for the presence of strings and removes them if necessary. There is no clear indication of a buffer over-read or any other typical vulnerability in the provided code.",1739,88,3.673515558242798
