case_id,vuln_type,audit_report,gt,eval_score,eval_input_token_num,eval_output_token_num,eval_inference_time
177736,Bypass," NO

The provided code snippet is not vulnerable to the Bypass.c vulnerability described. The code snippet is a function for counting matching subarrays using the KMP algorithm, which is unrelated to the Samba domain account control vulnerability (CVE-2015-8467). The vulnerability in the original code was related to the improper checking of administrative privileges during the creation of machine accounts, which is not present in the provided code snippet.","The code contains a Bypass vulnerability. 
The CVE-ID is CVE-2015-8467. The CWE-ID is CWE-264.
Vulnerability summary:
The samldb_check_user_account_control_acl function in dsdb/samdb/ldb_modules/samldb.c in Samba 4.x before 4.1.22, 4.2.x before 4.2.7, and 4.3.x before 4.3.3 does not properly check for administrative privileges during creation of machine accounts, which allows remote authenticated users to bypass intended access restrictions by leveraging the existence of a domain with both a Samba DC and a Windows DC, a similar issue to CVE-2015-2535.
",1.0,754.0,6.0,1.6993963718414307
177740,DoS Exec Code Overflow Mem. Corr.," NO

The provided C++ code for `asn1_time_to_time_t` function is not vulnerable to the DoS_Exec_Code_Overflow_Mem._Corr. vulnerability described in the CVE-ID CVE-2013-6420. The vulnerability in the original code was due to incorrect parsing of time strings, which could lead to memory corruption or arbitrary code execution. However, the provided code snippet is a different function that counts matching subarrays using the KMP algorithm and does not involve parsing time strings or handling X.509 certificates.","The code contains a DoS_Exec_Code_Overflow_Mem._Corr. vulnerability. 
The CVE-ID is CVE-2013-6420. The CWE-ID is CWE-119.
Vulnerability summary:
The asn1_time_to_time_t function in ext/openssl/openssl.c in PHP before 5.3.28, 5.4.x before 5.4.23, and 5.5.x before 5.5.7 does not properly parse (1) notBefore and (2) notAfter timestamps in X.509 certificates, which allows remote attackers to execute arbitrary code or cause a denial of service (memory corruption) via a crafted certificate that is not properly handled by the openssl_x509_parse function.
",1.0,784.0,6.0,2.4020726680755615
177741,DoS Overflow, NO,"The code contains a DoS_Overflow vulnerability. 
The CVE-ID is CVE-2011-4128. The CWE-ID is CWE-119.
Vulnerability summary:
Buffer overflow in the gnutls_session_get_data function in lib/gnutls_session.c in GnuTLS 2.12.x before 2.12.14 and 3.x before 3.0.7, when used on a client that performs nonstandard session resumption, allows remote TLS servers to cause a denial of service (application crash) via a large SessionTicket.
",1.0,638.0,6.0,2.0872297286987305
177742,DoS Overflow, NO,"The code contains a DoS_Overflow vulnerability. 
The CVE-ID is CVE-2011-4128. The CWE-ID is CWE-119.
Vulnerability summary:
Buffer overflow in the gnutls_session_get_data function in lib/gnutls_session.c in GnuTLS 2.12.x before 2.12.14 and 3.x before 3.0.7, when used on a client that performs nonstandard session resumption, allows remote TLS servers to cause a denial of service (application crash) via a large SessionTicket.
",1.0,638.0,6.0,2.9135868549346924
177743,DoS," YES

The provided code is vulnerable due to a potential integer overflow issue. The function `countMatchingSubarrays` uses the KMP algorithm to count the number of matching subarrays between `nums` and `pattern`. However, the code does not handle the case where the size of `nums` or `pattern` is very large, which could lead to an integer overflow when calculating the size of the vectors or when accessing their elements.

For example, if `nums` and `pattern` are very large vectors, the expression `size(nums)` or `size(pattern)` could cause an integer overflow when calculating the size of the vectors. Additionally, the code does not check for integer overflow when accessing the elements of the vectors using the index `i` or `j`.

To fix this vulnerability, you should add checks to ensure that the size of the vectors and the indices used to access their elements do not cause an integer overflow. You can use the `std::numeric_limits` header to check for potential overflows and handle them approprielles.","The code contains a DoS vulnerability. 
The CVE-ID is CVE-2015-7804. The CWE-ID is CWE-189.
Vulnerability summary:
Off-by-one error in the phar_parse_zipfile function in ext/phar/zip.c in PHP before 5.5.30 and 5.6.x before 5.6.14 allows remote attackers to cause a denial of service (uninitialized pointer dereference and application crash) by including the / filename in a .zip PHAR archive.
",2.0,837.0,6.0,2.158691644668579
177747,DoS," NO

The provided code for `bgp_attr_unknown` does not appear to be vulnerable to a Denial of Service (DoS) attack based on the information given. The code is a function that processes unknown BGP attributes, and it does not contain any obvious vulnerabilities such as buffer overflows, integer overflows, or other common issues that could lead to a DoS condition.

The function `countMatchingSubarrays` is a separate piece of code that is not related to the `bgp_attr_unknown` function. It is a function that counts matching subarrays using the Knuth-Morris-Pratt (KMP) algorithm, which is a string matching algorithm. This function is not vulnerable to DoS attacks as it is a deterministic algorithm that runs in linear time with respect to the input size.

However, without a full context of how these functions are used within the application, it is not possible to definitively say that there are no vulnerabilities. The provided code snippets alone do not show any clear vulnerabilities.","The code contains a DoS vulnerability. 
The CVE-ID is CVE-2013-6051. The CWE-ID is nan.
Vulnerability summary:
The bgp_attr_unknown function in bgp_attr.c in Quagga 0.99.21 does not properly initialize the total variable, which allows remote attackers to cause a denial of service (bgpd crash) via a crafted BGP update.
",1.0,807.0,6.0,3.29353666305542
177750,DoS Exec Code," NO

The provided code snippet for `begin_rightsoft()` does not appear to be vulnerable based on the information given. The code does not exhibit any clear signs of a DoS_Exec_Code vulnerability, as it does not involve executing arbitrary code, reading memory, or causing a denial of service through a crafted file. The code is focused on handling soft masks in a PDF processing context and does not contain any obvious vulnerabilities related to heap use after free, buffer overflows, or other common security issues.

The additional function `countMatchingSubarrays()` is a separate piece of code that implements the Knuth-Morris-Pratt (KMP) algorithm for string matching and does not seem to be related to the vulnerability in question. It is a pure function that operates on vectors of integers and does not interact with any external resources or perform any file operations that could lead to a vulnerability.

However, without a full context of the application and its environment, it is not possible to definitively say that there are no vulnerabilities. A thorough security review and analysis would be required to confirm the absence of vulnerabilities.","The code contains a DoS_Exec_Code vulnerability. 
The CVE-ID is CVE-2018-1000039. The CWE-ID is CWE-416.
Vulnerability summary:
In MuPDF 1.12.0 and earlier, multiple heap use after free bugs in the PDF parser could allow an attacker to execute arbitrary code, read memory, or cause a denial of service via a crafted file.
",1.0,823.0,6.0,3.42531156539917
177766,DoS," NO

The provided C++ function `countMatchingSubarrays` is not vulnerable to a Denial of Service (DoS) attack. The function implements the Knuth-Morris-Pratt (KMP) algorithm to count the number of occurrences of a pattern within a text. The function does not interact with any external systems, databases, or network resources that could be exploited for a DoS attack. It only operates on the input vectors `nums` and `pattern`, which are passed as arguments.

The function's logic is focused on comparing elements within the input vectors and does not involve any operations that could lead to a DoS attack, such as infinite loops, excessive memory allocation, or system calls that could be manipulated by an attacker.","The code contains a DoS vulnerability. 
The CVE-ID is CVE-2015-7540. The CWE-ID is CWE-399.
Vulnerability summary:
The LDAP server in the AD domain controller in Samba 4.x before 4.1.22 does not check return values to ensure successful ASN.1 memory allocation, which allows remote attackers to cause a denial of service (memory consumption and daemon crash) via crafted packets.
",1.0,758.0,6.0,1.8002054691314697
177767,DoS, NO,"The code contains a DoS vulnerability. 
The CVE-ID is CVE-2015-7540. The CWE-ID is CWE-399.
Vulnerability summary:
The LDAP server in the AD domain controller in Samba 4.x before 4.1.22 does not check return values to ensure successful ASN.1 memory allocation, which allows remote attackers to cause a denial of service (memory consumption and daemon crash) via crafted packets.
",1.0,611.0,6.0,2.5949201583862305
177768,DoS," NO

The provided code snippet for `sparse_dump_region` does not appear to be vulnerable based on the information given. The code is a part of the GNU tar utility, which is used for archiving files. The vulnerability mentioned (CVE-2018-20482) is related to the handling of file shrinkage during read access when the `--sparse` option is used. However, the provided code snippet does not directly address file shrinkage or read access issues.

The `sparse_dump_region` function is responsible for dumping a sparse file region into an archive. It reads and writes blocks of data, handling the sparse map to ensure that only the non-empty parts of the file are written to the archive. The code does not seem to have any obvious vulnerabilities such as buffer overflows, integer overflows, or improper error handling that could lead to a denial of service.

It is important to note that without the full context of the codebase and the specific implementation details, it is not possible to definitively say that the code is free of vulnerabilities. However, based on the provided snippet and the description of the vulnerability, there is no clear indication that this code is vulnerable to the DoS issue described.","The code contains a DoS vulnerability. 
The CVE-ID is CVE-2018-20482. The CWE-ID is CWE-835.
Vulnerability summary:
GNU Tar through 1.30, when --sparse is used, mishandles file shrinkage during read access, which allows local users to cause a denial of service (infinite read loop in sparse_dump_region in sparse.c) by modifying a file that is supposed to be archived by a different user's process (e.g., a system backup running as root).
",1.0,875.0,6.0,2.851921796798706
177770,Bypass," NO

The provided C++ code is not vulnerable to the same Bypass.c vulnerability as described in the original code snippet. The C++ code is a different implementation that uses the KMP (Knuth-Morris-Pratt) algorithm to count matching subarrays in a given array. It does not involve file handling, network communication, or the specific vulnerabilities related to fnamecmp_type and xname follows strings.","The code contains a Bypass vulnerability. 
The CVE-ID is CVE-2017-17434. The CWE-ID is nan.
Vulnerability summary:
The daemon in rsync 3.1.2, and 3.1.3-development before 2017-12-03, does not check for fnamecmp filenames in the daemon_filter_list data structure (in the recv_files function in receiver.c) and also does not apply the sanitize_paths protection mechanism to pathnames found in ""xname follows"" strings (in the read_ndx_and_attrs function in rsync.c), which allows remote attackers to bypass intended access restrictions.
",1.0,732.0,6.0,2.0574378967285156
177771,, NO,"The code contains a nan vulnerability. 
The CVE-ID is CVE-2018-20103. The CWE-ID is CWE-835.
Vulnerability summary:
An issue was discovered in dns.c in HAProxy through 1.8.14. In the case of a compressed pointer, a crafted packet can trigger infinite recursion by making the pointer point to itself, or create a long chain of valid pointers resulting in stack exhaustion.
",1.0,609.0,6.0,3.254173517227173
177773,DoS Exec Code Overflow Mem. Corr., NO,"The code contains a DoS_Exec_Code_Overflow_Mem._Corr. vulnerability. 
The CVE-ID is CVE-2009-3607. The CWE-ID is CWE-189.
Vulnerability summary:
Integer overflow in the create_surface_from_thumbnail_data function in glib/poppler-page.cc in Poppler 0.x allows remote attackers to cause a denial of service (memory corruption) or possibly execute arbitrary code via a crafted PDF document that triggers a heap-based buffer overflow.  NOTE: some of these details are obtained from third party information.
",1.0,634.0,6.0,1.599618673324585
177774,DoS Exec Code Overflow," NO

The provided C++ code for the `drawImage` function does not appear to be vulnerable to the DoS_Exec_Overflow vulnerability described in the question. The function is responsible for drawing an image using a given stream, color map, and other parameters. It does not involve any operations that could lead to a denial of service or arbitrary code execution.

The additional code provided for counting matching subarrays using the KMP algorithm is also not related to the `drawImage` function and does not introduce any vulnerabilities. The KMP algorithm is a well-known string matching algorithm and does not involve any operations that could lead to a denial of service or arbitrary code execution.

However, it is essential to note that the absence of vulnerabilities in the provided code does not guarantee that the entire application is secure. Other parts of the application may still contain vulnerabilities that could lead to a denial of service or arbitrary code execution. It is crucial to perform a comprehensive security review of the entire application to identify and address any potential vulnerabilities.","The code contains a DoS_Exec_Code_Overflow vulnerability. 
The CVE-ID is CVE-2009-3605. The CWE-ID is CWE-189.
Vulnerability summary:
Multiple integer overflows in Poppler 0.10.5 and earlier allow remote attackers to cause a denial of service (application crash) or possibly execute arbitrary code via a crafted PDF file, related to (1) glib/poppler-page.cc; (2) ArthurOutputDev.cc, (3) CairoOutputDev.cc, (4) GfxState.cc, (5) JBIG2Stream.cc, (6) PSOutputDev.cc, and (7) SplashOutputDev.cc in poppler/; and (8) SplashBitmap.cc, (9) Splash.cc, and (10) SplashFTFont.cc in splash/.  NOTE: this may overlap CVE-2009-0791.
",1.0,908.0,6.0,2.2236838340759277
177775,DoS Exec Code Overflow," NO

The provided C++ code for the `countMatchingSubarrays` function is not vulnerable to the DoS_Exec_Overflow vulnerability described in the initial code snippet. The function implements the Knuth-Morris-Pratt (KMP) algorithm for string matching, which is a well-known and secure algorithm for finding occurrences of a ""pattern"" string within a ""text"" string. The function does not involve any operations that could lead to a buffer overflow, integer overflow, or execution of arbitrary code.","The code contains a DoS_Exec_Code_Overflow vulnerability. 
The CVE-ID is CVE-2009-3605. The CWE-ID is CWE-189.
Vulnerability summary:
Multiple integer overflows in Poppler 0.10.5 and earlier allow remote attackers to cause a denial of service (application crash) or possibly execute arbitrary code via a crafted PDF file, related to (1) glib/poppler-page.cc; (2) ArthurOutputDev.cc, (3) CairoOutputDev.cc, (4) GfxState.cc, (5) JBIG2Stream.cc, (6) PSOutputDev.cc, and (7) SplashOutputDev.cc in poppler/; and (8) SplashBitmap.cc, (9) Splash.cc, and (10) SplashFTFont.cc in splash/.  NOTE: this may overlap CVE-2009-0791.
",1.0,806.0,6.0,2.091388463973999
177777,DoS Exec Code Overflow," NO

The provided C++ code for the `drawImage` function does not appear to be vulnerable to the DoS_Exec_Code_Overflow vulnerability described in the CVE-ID CVE-2009-3605. The function does not execute any external code or perform any operations that could lead to a buffer overflow or denial of service. It is a straightforward image processing function that draws an image onto a surface using the Cairo graphics library.","The code contains a DoS_Exec_Code_Overflow vulnerability. 
The CVE-ID is CVE-2009-3605. The CWE-ID is CWE-189.
Vulnerability summary:
Multiple integer overflows in Poppler 0.10.5 and earlier allow remote attackers to cause a denial of service (application crash) or possibly execute arbitrary code via a crafted PDF file, related to (1) glib/poppler-page.cc; (2) ArthurOutputDev.cc, (3) CairoOutputDev.cc, (4) GfxState.cc, (5) JBIG2Stream.cc, (6) PSOutputDev.cc, and (7) SplashOutputDev.cc in poppler/; and (8) SplashBitmap.cc, (9) Splash.cc, and (10) SplashFTFont.cc in splash/.  NOTE: this may overlap CVE-2009-0791.
",1.0,793.0,6.0,2.235783338546753
177778,DoS Exec Code Overflow," NO

The provided C++ code for `drawMaskedImage` does not appear to be vulnerable to the types of issues described in the initial code snippet. The function is a pattern matching algorithm using the Knuth-Morris-Pratt (KMP) algorithm, which is a well-established and secure method for string matching. The code does not exhibit any clear signs of buffer overflows, integer overflows, or other common vulnerabilities.","The code contains a DoS_Exec_Code_Overflow vulnerability. 
The CVE-ID is CVE-2009-3605. The CWE-ID is CWE-189.
Vulnerability summary:
Multiple integer overflows in Poppler 0.10.5 and earlier allow remote attackers to cause a denial of service (application crash) or possibly execute arbitrary code via a crafted PDF file, related to (1) glib/poppler-page.cc; (2) ArthurOutputDev.cc, (3) CairoOutputDev.cc, (4) GfxState.cc, (5) JBIG2Stream.cc, (6) PSOutputDev.cc, and (7) SplashOutputDev.cc in poppler/; and (8) SplashBitmap.cc, (9) Splash.cc, and (10) SplashFTFont.cc in splash/.  NOTE: this may overlap CVE-2009-0791.
",1.0,790.0,6.0,3.997622489929199
177779,DoS Exec Code Overflow," NO

The provided C++ code for the function `countMatchingSubarrays` is not vulnerable to the DoS_Exec_Code_Overflow vulnerability described in the initial code snippet. The function implements the Knuth-Morris-Pratt (KMP) algorithm for string matching, which is a well-established algorithm for finding occurrences of a ""pattern"" string within a ""text"" string. The code does not involve any operations that could lead to a buffer overflow, such as unchecked array accesses or memory allocations that depend on user input.

The function `countMatchingSubarrays` takes two vectors of integers as input and converts them into a binary representation (1 for increasing, -1 for decreasing, and 0 for equal elements). It then applies the KMP algorithm to find matching subarrays. The conversion to binary representation and the KMP algorithm itself do not involve any operations that could lead to a buffer overflow or other memory-related vulnerabilities.

Therefore, the code provided for `countMatchingSubarrays` does not exhibit the DoS_Exec_Code_Overflow vulnerability or any other vulnerability of the types mentioned (DoS, Exec, Code, Overflow).","The code contains a DoS_Exec_Code_Overflow vulnerability. 
The CVE-ID is CVE-2009-3605. The CWE-ID is CWE-189.
Vulnerability summary:
Multiple integer overflows in Poppler 0.10.5 and earlier allow remote attackers to cause a denial of service (application crash) or possibly execute arbitrary code via a crafted PDF file, related to (1) glib/poppler-page.cc; (2) ArthurOutputDev.cc, (3) CairoOutputDev.cc, (4) GfxState.cc, (5) JBIG2Stream.cc, (6) PSOutputDev.cc, and (7) SplashOutputDev.cc in poppler/; and (8) SplashBitmap.cc, (9) Splash.cc, and (10) SplashFTFont.cc in splash/.  NOTE: this may overlap CVE-2009-0791.
",1.0,933.0,6.0,3.3431475162506104
177780,DoS Exec Code Overflow," NO

The provided code for `countMatchingSubarrays` is not vulnerable to the specified types of vulnerabilities (DoS, Exec, Code. Overflow, and Code. Exec). The function implements the Knuth-Morris-Pratt (KMP) algorithm for pattern searching, which is a well-established and safe algorithm for this purpose. The code does not contain any buffer overflows, integer overflows, or other unsafe operations that could lead to a denial of service or arbitrary code execution.","The code contains a DoS_Exec_Code_Overflow vulnerability. 
The CVE-ID is CVE-2009-3605. The CWE-ID is CWE-189.
Vulnerability summary:
Multiple integer overflows in Poppler 0.10.5 and earlier allow remote attackers to cause a denial of service (application crash) or possibly execute arbitrary code via a crafted PDF file, related to (1) glib/poppler-page.cc; (2) ArthurOutputDev.cc, (3) CairoOutputDev.cc, (4) GfxState.cc, (5) JBIG2Stream.cc, (6) PSOutputDev.cc, and (7) SplashOutputDev.cc in poppler/; and (8) SplashBitmap.cc, (9) Splash.cc, and (10) SplashFTFont.cc in splash/.  NOTE: this may overlap CVE-2009-0791.
",1.0,802.0,6.0,2.041682004928589
177781,DoS Exec Code Overflow, NO,"The code contains a DoS_Exec_Code_Overflow vulnerability. 
The CVE-ID is CVE-2009-3605. The CWE-ID is CWE-189.
Vulnerability summary:
Multiple integer overflows in Poppler 0.10.5 and earlier allow remote attackers to cause a denial of service (application crash) or possibly execute arbitrary code via a crafted PDF file, related to (1) glib/poppler-page.cc; (2) ArthurOutputDev.cc, (3) CairoOutputDev.cc, (4) GfxState.cc, (5) JBIG2Stream.cc, (6) PSOutputDev.cc, and (7) SplashOutputDev.cc in poppler/; and (8) SplashBitmap.cc, (9) Splash.cc, and (10) SplashFTFont.cc in splash/.  NOTE: this may overlap CVE-2009-0791.
",1.0,706.0,6.0,2.584908962249756
177783,DoS Exec Code Overflow, NO,"The code contains a DoS_Exec_Code_Overflow vulnerability. 
The CVE-ID is CVE-2009-3605. The CWE-ID is CWE-189.
Vulnerability summary:
Multiple integer overflows in Poppler 0.10.5 and earlier allow remote attackers to cause a denial of service (application crash) or possibly execute arbitrary code via a crafted PDF file, related to (1) glib/poppler-page.cc; (2) ArthurOutputDev.cc, (3) CairoOutputDev.cc, (4) GfxState.cc, (5) JBIG2Stream.cc, (6) PSOutputDev.cc, and (7) SplashOutputDev.cc in poppler/; and (8) SplashBitmap.cc, (9) Splash.cc, and (10) SplashFTFont.cc in splash/.  NOTE: this may overlap CVE-2009-0791.
",1.0,706.0,6.0,2.7840936183929443
177786,DoS Exec Code Overflow," NO

The provided C++ code does not appear to be vulnerable to the DoS_Exec_Code_Overflow vulnerability described in the initial prompt. The code is a function for drawing an image with various color modes and does not involve any operations that could lead to a buffer overflow or execution of arbitrary code. The additional function `countMatchingSubarrays` is a separate algorithm for pattern matching using the KMP algorithm and does not interact with the image drawing code.","The code contains a DoS_Exec_Code_Overflow vulnerability. 
The CVE-ID is CVE-2009-3605. The CWE-ID is CWE-189.
Vulnerability summary:
Multiple integer overflows in Poppler 0.10.5 and earlier allow remote attackers to cause a denial of service (application crash) or possibly execute arbitrary code via a crafted PDF file, related to (1) glib/poppler-page.cc; (2) ArthurOutputDev.cc, (3) CairoOutputDev.cc, (4) GfxState.cc, (5) JBIG2Stream.cc, (6) PSOutputDev.cc, and (7) SplashOutputDev.cc in poppler/; and (8) SplashBitmap.cc, (9) Splash.cc, and (10) SplashFTFont.cc in splash/.  NOTE: this may overlap CVE-2009-0791.
",1.0,796.0,6.0,2.973161458969116
177787,DoS Exec Code Overflow," NO

The provided C++ code for the `drawMaskedImage` function does not contain a DoS_Exec_Code_Overflow vulnerability. The function is designed to draw a masked image using a color map and a mask bitmap. It handles the input parameters and performs the necessary calculations to draw the image.

The `countMatchingSubarrays` function is a separate function that uses the Knuth-Morris-Pratt (KMP) algorithm to count the number of occurrences of a pattern within a text. This function also does not contain a DoS_Exec_Code_Overflow vulnerability. It uses a prefix array to efficiently search for the pattern in the text and returns the count of matching subarrays.

However, it is essential to ensure that the input parameters for both functions are validated and sanitized to prevent potential vulnerabilities in other aspects of the code.","The code contains a DoS_Exec_Code_Overflow vulnerability. 
The CVE-ID is CVE-2009-3605. The CWE-ID is CWE-189.
Vulnerability summary:
Multiple integer overflows in Poppler 0.10.5 and earlier allow remote attackers to cause a denial of service (application crash) or possibly execute arbitrary code via a crafted PDF file, related to (1) glib/poppler-page.cc; (2) ArthurOutputDev.cc, (3) CairoOutputDev.cc, (4) GfxState.cc, (5) JBIG2Stream.cc, (6) PSOutputDev.cc, and (7) SplashOutputDev.cc in poppler/; and (8) SplashBitmap.cc, (9) Splash.cc, and (10) SplashFTFont.cc in splash/.  NOTE: this may overlap CVE-2009-0791.
",1.0,872.0,6.0,2.4761974811553955
