case_id,vuln_type,audit_report,gt,eval_score,eval_input_token_num,eval_output_token_num,eval_inference_time
177736,Bypass," YES

The provided code is vulnerable due to the way it handles administrative privileges and the potential for a Bypass vulnerability. The code does not properly check for administrative privileges during the creation of machine accounts, which could allow remote authenticated users to bypass intended access restrictions. This is similar to the CVE-2015-8467 issue mentioned in the description.","The code contains a Bypass vulnerability. 
The CVE-ID is CVE-2015-8467. The CWE-ID is CWE-264.
Vulnerability summary:
The samldb_check_user_account_control_acl function in dsdb/samdb/ldb_modules/samldb.c in Samba 4.x before 4.1.22, 4.2.x before 4.2.7, and 4.3.x before 4.3.3 does not properly check for administrative privileges during creation of machine accounts, which allows remote authenticated users to bypass intended access restrictions by leveraging the existence of a domain with both a Samba DC and a Windows DC, a similar issue to CVE-2015-2535.
",3.0,739.0,6.0,3.7813191413879395
177740,DoS Exec Code Overflow Mem. Corr.," NO

The provided C++ code does not appear to be vulnerable to the DoS_Exec_Code_Overflow_Mem._Corr. vulnerability described in the context. The code is a simple implementation of a depth-first search (DFS) algorithm to find the maximum time taken to reach all nodes in a graph, which is unrelated to parsing X.509 certificates or handling time strings as in the vulnerable code snippet.","The code contains a DoS_Exec_Code_Overflow_Mem._Corr. vulnerability. 
The CVE-ID is CVE-2013-6420. The CWE-ID is CWE-119.
Vulnerability summary:
The asn1_time_to_time_t function in ext/openssl/openssl.c in PHP before 5.3.28, 5.4.x before 5.4.23, and 5.5.x before 5.5.7 does not properly parse (1) notBefore and (2) notAfter timestamps in X.509 certificates, which allows remote attackers to execute arbitrary code or cause a denial of service (memory corruption) via a crafted certificate that is not properly handled by the openssl_x509_parse function.
",1.0,756.0,6.0,2.3464746475219727
177741,DoS Overflow, NO,"The code contains a DoS_Overflow vulnerability. 
The CVE-ID is CVE-2011-4128. The CWE-ID is CWE-119.
Vulnerability summary:
Buffer overflow in the gnutls_session_get_data function in lib/gnutls_session.c in GnuTLS 2.12.x before 2.12.14 and 3.x before 3.0.7, when used on a client that performs nonstandard session resumption, allows remote TLS servers to cause a denial of service (application crash) via a large SessionTicket.
",1.0,638.0,6.0,1.818291425704956
177742,DoS Overflow, NO,"The code contains a DoS_Overflow vulnerability. 
The CVE-ID is CVE-2011-4128. The CWE-ID is CWE-119.
Vulnerability summary:
Buffer overflow in the gnutls_session_get_data function in lib/gnutls_session.c in GnuTLS 2.12.x before 2.12.14 and 3.x before 3.0.7, when used on a client that performs nonstandard session resumption, allows remote TLS servers to cause a denial of service (application crash) via a large SessionTicket.
",1.0,638.0,6.0,2.952409505844116
177743,DoS," NO

The provided C++ code is not vulnerable to the DoS (Denial of Service) vulnerability described in the CVE-2015-5070. The code is a solution to the problem of finding the maximum time taken to reach all nodes in a graph, which is unrelated to the specific vulnerability mentioned.","The code contains a DoS vulnerability. 
The CVE-ID is CVE-2015-7804. The CWE-ID is CWE-189.
Vulnerability summary:
Off-by-one error in the phar_parse_zipfile function in ext/phar/zip.c in PHP before 5.5.30 and 5.6.x before 5.6.14 allows remote attackers to cause a denial of service (uninitialized pointer dereference and application crash) by including the / filename in a .zip PHAR archive.
",1.0,691.0,6.0,3.4376063346862793
177747,DoS," NO

The provided C++ code for the `bgp_attr_unknown` function does not appear to be vulnerable based on the information given. The code is a part of a BGP (Border Gateway Protocol) attribute processing function, which is responsible for handling unknown BGP attributes. The function does not directly deal with user input or memory allocation that could lead to a DoS vulnerability.

The code provided for the `timeTaken` function is a separate function that calculates the time taken for a path in a graph, and it does not seem to be related to the BGP attribute processing function. It uses depth-first search (DFS) to traverse the graph and calculate the time taken for each path. This function does not appear to be vulnerable either.

However, without a complete understanding of the context and the entire codebase, it is not possible to definitively say that there are no vulnerabilities. It is always recommended to perform a thorough security review and testing to ensure the code is secure.","The code contains a DoS vulnerability. 
The CVE-ID is CVE-2013-6051. The CWE-ID is nan.
Vulnerability summary:
The bgp_attr_unknown function in bgp_attr.c in Quagga 0.99.21 does not properly initialize the total variable, which allows remote attackers to cause a denial of service (bgpd crash) via a crafted BGP update.
",1.0,800.0,6.0,3.7402572631835938
177750,DoS Exec Code," NO

The provided code snippet does not appear to be vulnerable based on the information given. The code is a function that handles soft masks in a PDF processing context, and there is no clear indication of a vulnerability in the code itself. The vulnerability mentioned (CVE-2018-1000039) is related to MuPDF 1.12.0 and earlier versions, and the code provided does not seem to be from that version or contain the specific issues that led to the vulnerability.","The code contains a DoS_Exec_Code vulnerability. 
The CVE-ID is CVE-2018-1000039. The CWE-ID is CWE-416.
Vulnerability summary:
In MuPDF 1.12.0 and earlier, multiple heap use after free bugs in the PDF parser could allow an attacker to execute arbitrary code, read memory, or cause a denial of service via a crafted file.
",1.0,702.0,6.0,2.2541756629943848
177766,DoS," NO

The provided C++ code for the `ldb_search` function is not directly vulnerable to the CWE-762 (Improper Input Handling) issue described in the question. The function is a helper function for handling LDAP search filters, and it does not directly interact with user input or perform any operations that could lead to a DoS vulnerability as described.

However, it's important to note that the vulnerability could still exist in the context of the larger application if the `ldb_search` function is used improperly or if the input to the function is not properly validated before being passed to it. For example, if the `ldb_parse_tree` structure is constructed based on user input without proper validation, it could lead to a vulnerability.

In summary, the provided `ldb_search` function itself is not vulnerable to CWE-762, but the overall security of the application depends on how the function is used and how the input is handled before being passed to the function.","The code contains a DoS vulnerability. 
The CVE-ID is CVE-2015-7540. The CWE-ID is CWE-399.
Vulnerability summary:
The LDAP server in the AD domain controller in Samba 4.x before 4.1.22 does not check return values to ensure successful ASN.1 memory allocation, which allows remote attackers to cause a denial of service (memory consumption and daemon crash) via crafted packets.
",1.0,800.0,6.0,2.276418685913086
177767,DoS," NO

The provided code snippet for `decode_openldap_dereference` does not appear to be vulnerable based on the information given. The vulnerability mentioned in the question (CVE-2015-7540) is related to memory allocation issues in Samba 4.x before version 4.1.22, which is not directly related to the provided C++ code snippet. The code snippet is a function that decodes LDAP data, and without further context or analysis, it does not exhibit the specific vulnerability described.","The code contains a DoS vulnerability. 
The CVE-ID is CVE-2015-7540. The CWE-ID is CWE-399.
Vulnerability summary:
The LDAP server in the AD domain controller in Samba 4.x before 4.1.22 does not check return values to ensure successful ASN.1 memory allocation, which allows remote attackers to cause a denial of service (memory consumption and daemon crash) via crafted packets.
",1.0,713.0,6.0,2.3589680194854736
177768,DoS," NO

The provided C++ code for the `sparse_dump_region` function does not appear to be vulnerable based on the information given. The code is a part of the GNU tar utility, which is used for archiving files. The function reads and writes blocks of data from a sparse file, handling file shrinkage during read access.

The vulnerability mentioned in the question (CVE-2018-20482) is related to GNU tar's handling of file shrinkage when using the `--sparse` option, which can lead to a denial of service (DoS) attack. However, the provided code snippet does not seem to be related to that specific vulnerability.

The code appears to be a part of the implementation for handling sparse files, and it does not contain any obvious vulnerabilities such as buffer overflows, use-after-free, or other common issues that could lead to a DoS attack.

It is essential to note that without a complete understanding of the context and the entire codebase, it is not possible to definitively say that the code is entirely free of vulnerabilities. However, based on the provided snippet, there is no clear indication of a DoS vulnerability.","The code contains a DoS vulnerability. 
The CVE-ID is CVE-2018-20482. The CWE-ID is CWE-835.
Vulnerability summary:
GNU Tar through 1.30, when --sparse is used, mishandles file shrinkage during read access, which allows local users to cause a denial of service (infinite read loop in sparse_dump_region in sparse.c) by modifying a file that is supposed to be archived by a different user's process (e.g., a system backup running as root).
",1.0,865.0,6.0,3.523123264312744
177770,Bypass," NO

The provided C++ code does not appear to be vulnerable to the Bypass.c vulnerability described earlier. The code is a function that reads file indices and attributes from a file descriptor, handling various cases and errors. It does not involve file name comparison or pathname sanitization that could be exploited for bypassing access restrictions.","The code contains a Bypass vulnerability. 
The CVE-ID is CVE-2017-17434. The CWE-ID is nan.
Vulnerability summary:
The daemon in rsync 3.1.2, and 3.1.3-development before 2017-12-03, does not check for fnamecmp filenames in the daemon_filter_list data structure (in the recv_files function in receiver.c) and also does not apply the sanitize_paths protection mechanism to pathnames found in ""xname follows"" strings (in the read_ndx_and_attrs function in rsync.c), which allows remote attackers to bypass intended access restrictions.
",1.0,715.0,6.0,2.813845157623291
177771,," NO

The provided C++ code for `dns_read_name` does not appear to be vulnerable to the same issue as described in the vulnerability summary for CVE-2018-20103. The vulnerability in the original code was due to the handling of compressed DNS names, which could lead to infinite recursion or stack exhaustion. The provided code snippet does not contain any DNS-related functionality and does not include the problematic compression handling.","The code contains a nan vulnerability. 
The CVE-ID is CVE-2018-20103. The CWE-ID is CWE-835.
Vulnerability summary:
An issue was discovered in dns.c in HAProxy through 1.8.14. In the case of a compressed pointer, a crafted packet can trigger infinite recursion by making the pointer point to itself, or create a long chain of valid pointers resulting in stack exhaustion.
",1.0,692.0,6.0,2.4744038581848145
177773,DoS Exec Code Overflow Mem. Corr., NO,"The code contains a DoS_Exec_Code_Overflow_Mem._Corr. vulnerability. 
The CVE-ID is CVE-2009-3607. The CWE-ID is CWE-189.
Vulnerability summary:
Integer overflow in the create_surface_from_thumbnail_data function in glib/poppler-page.cc in Poppler 0.x allows remote attackers to cause a denial of service (memory corruption) or possibly execute arbitrary code via a crafted PDF document that triggers a heap-based buffer overflow.  NOTE: some of these details are obtained from third party information.
",1.0,634.0,6.0,2.5904340744018555
177774,DoS Exec Code Overflow," NO

The provided C++ code for the `timeTaken` function does not appear to be vulnerable to the DoS, Exec, or Code.Overflow vulnerabilities described in the initial context. The function is implementing a dynamic programming approach to solve a problem related to graph traversal, which does not involve any of the vulnerable operations mentioned.","The code contains a DoS_Exec_Code_Overflow vulnerability. 
The CVE-ID is CVE-2009-3605. The CWE-ID is CWE-189.
Vulnerability summary:
Multiple integer overflows in Poppler 0.10.5 and earlier allow remote attackers to cause a denial of service (application crash) or possibly execute arbitrary code via a crafted PDF file, related to (1) glib/poppler-page.cc; (2) ArthurOutputDev.cc, (3) CairoOutputDev.cc, (4) GfxState.cc, (5) JBIG2Stream.cc, (6) PSOutputDev.cc, and (7) SplashOutputDev.cc in poppler/; and (8) SplashBitmap.cc, (9) Splash.cc, and (10) SplashFTFont.cc in splash/.  NOTE: this may overlap CVE-2009-0791.
",1.0,770.0,6.0,2.3552818298339844
177775,DoS Exec Code Overflow," NO

The provided C++ code for the `timeTaken` function does not exhibit the vulnerabilities described in the DoS_Exec_Overflow issue (CVE-2009-3605). The function is a simple implementation of a depth-first search (DFS) algorithm to find the longest path in a graph, which is unrelated to the vulnerabilities found in the Poppler library's image processing functions.","The code contains a DoS_Exec_Code_Overflow vulnerability. 
The CVE-ID is CVE-2009-3605. The CWE-ID is CWE-189.
Vulnerability summary:
Multiple integer overflows in Poppler 0.10.5 and earlier allow remote attackers to cause a denial of service (application crash) or possibly execute arbitrary code via a crafted PDF file, related to (1) glib/poppler-page.cc; (2) ArthurOutputDev.cc, (3) CairoOutputDev.cc, (4) GfxState.cc, (5) JBIG2Stream.cc, (6) PSOutputDev.cc, and (7) SplashOutputDev.cc in poppler/; and (8) SplashBitmap.cc, (9) Splash.cc, and (10) SplashFTFont.cc in splash/.  NOTE: this may overlap CVE-2009-0791.
",1.0,784.0,6.0,2.4279375076293945
177777,DoS Exec Code Overflow," NO

The provided C++ code for the `drawImage` function does not appear to be vulnerable to the DoS_Exec_Code_Overflow vulnerability described in the CVE-ID CVE-2009-3605. The code does not contain any obvious integer overflows, buffer management issues, or other common vulnerabilities that could lead to a denial of service or arbitrary code execution.

The code is responsible for drawing an image with optional masking, and it does not involve any operations that could lead to a buffer overflow or other vulnerabilities. The buffer allocation and deallocation are handled correctly, and the code does not execute any external commands or system calls that could be exploited.

However, it is essential to note that a thorough security review and analysis should be conducted to ensure the code's safety, as vulnerabilities may not always be immediately apparent.","The code contains a DoS_Exec_Code_Overflow vulnerability. 
The CVE-ID is CVE-2009-3605. The CWE-ID is CWE-189.
Vulnerability summary:
Multiple integer overflows in Poppler 0.10.5 and earlier allow remote attackers to cause a denial of service (application crash) or possibly execute arbitrary code via a crafted PDF file, related to (1) glib/poppler-page.cc; (2) ArthurOutputDev.cc, (3) CairoOutputDev.cc, (4) GfxState.cc, (5) JBIG2Stream.cc, (6) PSOutputDev.cc, and (7) SplashOutputDev.cc in poppler/; and (8) SplashBitmap.cc, (9) Splash.cc, and (10) SplashFTFont.cc in splash/.  NOTE: this may overlap CVE-2009-0791.
",1.0,871.0,6.0,2.5622246265411377
177778,DoS Exec Code Overflow," NO

The provided C++ code for the `drawMaskedImage` function does not appear to be vulnerable to the DoS_Exec_Code_Overflow vulnerability described in the initial prompt. The function is a graph algorithm that computes the time taken to traverse a graph using depth-first search (DFS) and dynamic programming (DP). It does not involve any operations that could lead to a buffer overflow, arbitrary code execution, or integer overflow as described in the vulnerability.","The code contains a DoS_Exec_Code_Overflow vulnerability. 
The CVE-ID is CVE-2009-3605. The CWE-ID is CWE-189.
Vulnerability summary:
Multiple integer overflows in Poppler 0.10.5 and earlier allow remote attackers to cause a denial of service (application crash) or possibly execute arbitrary code via a crafted PDF file, related to (1) glib/poppler-page.cc; (2) ArthurOutputDev.cc, (3) CairoOutputDev.cc, (4) GfxState.cc, (5) JBIG2Stream.cc, (6) PSOutputDev.cc, and (7) SplashOutputDev.cc in poppler/; and (8) SplashBitmap.cc, (9) Splash.cc, and (10) SplashFTFont.cc in splash/.  NOTE: this may overlap CVE-2009-0791.
",1.0,796.0,6.0,2.764411449432373
177779,DoS Exec Code Overflow," NO

The provided C++ code for the `drawSoftMaskedImage` function does not appear to be vulnerable to the DoS, Exec, or Code.Overflow vulnerabilities described in the initial code review. The function is a straightforward implementation of a graph algorithm (possibly a variant of DFS for finding the maximum path in a graph) and does not involve any operations that could lead to a buffer overflow, integer overflow, or execution of arbitrary code.","The code contains a DoS_Exec_Code_Overflow vulnerability. 
The CVE-ID is CVE-2009-3605. The CWE-ID is CWE-189.
Vulnerability summary:
Multiple integer overflows in Poppler 0.10.5 and earlier allow remote attackers to cause a denial of service (application crash) or possibly execute arbitrary code via a crafted PDF file, related to (1) glib/poppler-page.cc; (2) ArthurOutputDev.cc, (3) CairoOutputDev.cc, (4) GfxState.cc, (5) JBIG2Stream.cc, (6) PSOutputDev.cc, and (7) SplashOutputDev.cc in poppler/; and (8) SplashBitmap.cc, (9) Splash.cc, and (10) SplashFTFont.cc in splash/.  NOTE: this may overlap CVE-2009-0791.
",1.0,793.0,6.0,3.1797382831573486
177780,DoS Exec Code Overflow," NO

The provided code for the `timeTaken` function does not exhibit any of the vulnerabilities listed (DoS, Exec, Code. Overflow, or Code. Exec). The function is a simple implementation of a depth-first search (DFS) algorithm to find the longest path in a graph, which is a common algorithmic problem. The code does not involve any operations that could lead to a denial of service, arbitrary code execution, or buffer overflows.","The code contains a DoS_Exec_Code_Overflow vulnerability. 
The CVE-ID is CVE-2009-3605. The CWE-ID is CWE-189.
Vulnerability summary:
Multiple integer overflows in Poppler 0.10.5 and earlier allow remote attackers to cause a denial of service (application crash) or possibly execute arbitrary code via a crafted PDF file, related to (1) glib/poppler-page.cc; (2) ArthurOutputDev.cc, (3) CairoOutputDev.cc, (4) GfxState.cc, (5) JBIG2Stream.cc, (6) PSOutputDev.cc, and (7) SplashOutputDev.cc in poppler/; and (8) SplashBitmap.cc, (9) Splash.cc, and (10) SplashFTFont.cc in splash/.  NOTE: this may overlap CVE-2009-0791.
",1.0,796.0,6.0,2.749147415161133
177781,DoS Exec Code Overflow, NO,"The code contains a DoS_Exec_Code_Overflow vulnerability. 
The CVE-ID is CVE-2009-3605. The CWE-ID is CWE-189.
Vulnerability summary:
Multiple integer overflows in Poppler 0.10.5 and earlier allow remote attackers to cause a denial of service (application crash) or possibly execute arbitrary code via a crafted PDF file, related to (1) glib/poppler-page.cc; (2) ArthurOutputDev.cc, (3) CairoOutputDev.cc, (4) GfxState.cc, (5) JBIG2Stream.cc, (6) PSOutputDev.cc, and (7) SplashOutputDev.cc in poppler/; and (8) SplashBitmap.cc, (9) Splash.cc, and (10) SplashFTFont.cc in splash/.  NOTE: this may overlap CVE-2009-0791.
",1.0,706.0,6.0,2.007542133331299
177783,DoS Exec Code Overflow, NO,"The code contains a DoS_Exec_Code_Overflow vulnerability. 
The CVE-ID is CVE-2009-3605. The CWE-ID is CWE-189.
Vulnerability summary:
Multiple integer overflows in Poppler 0.10.5 and earlier allow remote attackers to cause a denial of service (application crash) or possibly execute arbitrary code via a crafted PDF file, related to (1) glib/poppler-page.cc; (2) ArthurOutputDev.cc, (3) CairoOutputDev.cc, (4) GfxState.cc, (5) JBIG2Stream.cc, (6) PSOutputDev.cc, and (7) SplashOutputDev.cc in poppler/; and (8) SplashBitmap.cc, (9) Splash.cc, and (10) SplashFTFont.cc in splash/.  NOTE: this may overlap CVE-2009-0791.
",1.0,706.0,6.0,2.3899998664855957
177786,DoS Exec Code Overflow," NO

The provided C++ code for the `timeTaken` function does not appear to be vulnerable to the DoS, Exec, or Code.Overflow vulnerabilities described in the context of the `SplashOutputDev::drawImage` function. The `timeTaken` function is a separate piece of code that calculates the time taken for a given set of edges in a graph, and it does not involve any operations that could lead to the vulnerabilities mentioned.","The code contains a DoS_Exec_Code_Overflow vulnerability. 
The CVE-ID is CVE-2009-3605. The CWE-ID is CWE-189.
Vulnerability summary:
Multiple integer overflows in Poppler 0.10.5 and earlier allow remote attackers to cause a denial of service (application crash) or possibly execute arbitrary code via a crafted PDF file, related to (1) glib/poppler-page.cc; (2) ArthurOutputDev.cc, (3) CairoOutputDev.cc, (4) GfxState.cc, (5) JBIG2Stream.cc, (6) PSOutputDev.cc, and (7) SplashOutputDev.cc in poppler/; and (8) SplashBitmap.cc, (9) Splash.cc, and (10) SplashFTFont.cc in splash/.  NOTE: this may overlap CVE-2009-0791.
",1.0,794.0,6.0,3.1138458251953125
177787,DoS Exec Code Overflow," NO

The provided code does not contain a DoS_Exec_Code_Overflow vulnerability. The code is a C++ function that implements a depth-first search (DFS) algorithm to find the maximum time taken to traverse a graph. It does not involve any execution of external code or data, and there are no buffer overflows or other common vulnerabilities present in the code.","The code contains a DoS_Exec_Code_Overflow vulnerability. 
The CVE-ID is CVE-2009-3605. The CWE-ID is CWE-189.
Vulnerability summary:
Multiple integer overflows in Poppler 0.10.5 and earlier allow remote attackers to cause a denial of service (application crash) or possibly execute arbitrary code via a crafted PDF file, related to (1) glib/poppler-page.cc; (2) ArthurOutputDev.cc, (3) CairoOutputDev.cc, (4) GfxState.cc, (5) JBIG2Stream.cc, (6) PSOutputDev.cc, and (7) SplashOutputDev.cc in poppler/; and (8) SplashBitmap.cc, (9) Splash.cc, and (10) SplashFTFont.cc in splash/.  NOTE: this may overlap CVE-2009-0791.
",1.0,778.0,6.0,3.2131056785583496
177788,DoS Exec Code Overflow," NO

The provided C++ code is a function that computes the time taken to reach each node in a graph using depth-first search (DFS) and dynamic programming (DP). The code does not contain any obvious vulnerabilities related to buffer overflows, use-after-free, or other common security issues. However, it's important to note that without a complete context or access to the rest of the codebase, it's not possible to definitively say there are no vulnerabilities. The code should be reviewed in the context of the entire application for a comprehensive security assessment.","The code contains a DoS_Exec_Code_Overflow vulnerability. 
The CVE-ID is CVE-2009-3605. The CWE-ID is CWE-189.
Vulnerability summary:
Multiple integer overflows in Poppler 0.10.5 and earlier allow remote attackers to cause a denial of service (application crash) or possibly execute arbitrary code via a crafted PDF file, related to (1) glib/poppler-page.cc; (2) ArthurOutputDev.cc, (3) CairoOutputDev.cc, (4) GfxState.cc, (5) JBIG2Stream.cc, (6) PSOutputDev.cc, and (7) SplashOutputDev.cc in poppler/; and (8) SplashBitmap.cc, (9) Splash.cc, and (10) SplashFTFont.cc in splash/.  NOTE: this may overlap CVE-2009-0791.
",1.0,814.0,6.0,2.9539597034454346
177789,DoS Exec Code Overflow," NO

The provided C++ code for `poppler_page_prepare_output_dev` does not appear to be vulnerable to the DoS, Exec, Code, or Overflow vulnerabilities as described in the CVE-ID CVE-2009-3605. The code does not exhibit any clear integer overflows, buffer overflows, or other common vulnerabilities that could lead to a denial of service or arbitrary code execution. The memory allocation for `cairo_data` is done using `gmalloc`, which should handle the allocation size properly, and the `memset` function is used to initialize the memory, which is a standard practice.

However, without a complete context of the codebase and the environment in which this function operates, it is not possible to definitively say that there are no vulnerabilities. It is always recommended to perform a thorough security review and testing to ensure the safety of the code.","The code contains a DoS_Exec_Code_Overflow vulnerability. 
The CVE-ID is CVE-2009-3605. The CWE-ID is CWE-189.
Vulnerability summary:
Multiple integer overflows in Poppler 0.10.5 and earlier allow remote attackers to cause a denial of service (application crash) or possibly execute arbitrary code via a crafted PDF file, related to (1) glib/poppler-page.cc; (2) ArthurOutputDev.cc, (3) CairoOutputDev.cc, (4) GfxState.cc, (5) JBIG2Stream.cc, (6) PSOutputDev.cc, and (7) SplashOutputDev.cc in poppler/; and (8) SplashBitmap.cc, (9) Splash.cc, and (10) SplashFTFont.cc in splash/.  NOTE: this may overlap CVE-2009-0791.
",1.0,883.0,6.0,3.227463960647583
