case_id,vuln_type,audit_report,gt,eval_score,eval_input_token_num,eval_output_token_num,eval_inference_time
11,access control," The answer is YES, the smart contract code is vulnerable due to potential access control issues. The vulnerability is in the `newOwner` function in the `MultiOwnable` contract. The function allows any external caller to set the owner without any checks to ensure that the caller is authorized to do so. This could allow an attacker to gain unauthorized access to the contract. The `onlyOwner` modifier is not used in this function, which is why the access control vulnerability exists.",access control,3.0,530.0,6.0,2.103469133377075
12,access control," No, the provided code is not vulnerable to the same access control vulnerability as the first contract. The `checkBalances` function does not have any modifiers restricting its access, but it is a constant function, which means it does not modify the contract state and therefore does not need access control. The `onlyowner` modifier is still only applied to the `withdraw` function, so the contract remains vulnerable to access control issues there if the owner address is set improperly.",access control,4.0,527.0,6.0,2.8188717365264893
13,access control," The provided code for the Rubixi contract contains a vulnerability related to access control. Specifically, the `creator` variable is set to `msg.sender` in the `DynamicPyramid` function, which is public and can be called by anyone. This means that the contract's creator can be set to any address, allowing for potential takeover or unauthorized access.

The `checkBalances` function, on the other hand, does not appear to contain any vulnerabilities as it is a constant function that simply returns the ether balance of a given array of addresses. However, it is always important to carefully consider the function's implementation and potential edge cases to ensure that it is indeed secure.

Therefore, the answer is:

* For the Rubixi contract: YES, it is vulnerable due to the `DynamicPyramid` function.
* For the `checkBalances` function: NO, it does not appear to be vulnerable based on the provided code.",access control,4.0,620.0,6.0,2.614741325378418
14,access control," NO, the provided code is not vulnerable to the 'access control' issue. The `withdraw` function checks if the `amount` is less or equal to the balance of the sender before transferring the funds. However, it's important to note that the code is still vulnerable to reentrancy attacks, as there is no restriction on who can call the `withdraw` function.

The `checkBalances` function is not related to the vulnerability in question, but it's worth noting that it has some issues. It creates a new storage array `balances` that shadows the state variable `balances`. This means that the function will return the ether balances of the addresses passed as an argument, not the balances stored in the contract's state. Additionally, the function should use `addresses[i].balance` instead of `balances[addresses[i]]` to get the ether balance of each address.",access control,2.0,609.0,6.0,2.4904086589813232
15,access control," No, the provided code is not vulnerable to the same access control vulnerability as the first contract. The `onlyowner` modifier is used correctly in the `withdraw` function to restrict it to the owner address. However, there is a potential vulnerability in the `checkBalances` function. This function uses `storage` for the `balances` variable, meaning that the changes made to this variable within the function will persist after the function is executed. If this function is called by an attacker, they could potentially fill up the contract's storage with large amounts of data, leading to potential issues or increased gas costs. To fix this, the `balances` variable should be declared as a local variable using the `memory` keyword, like so:

`uint256[] memory balances;`

This will ensure that the `balances` array is not stored in the contract's storage and will not persist after the function is executed.",access control,2.0,617.0,6.0,2.584254503250122
16,access control," The answer is YES, the smart contract code is vulnerable. The function `checkBalances` has a reentrancy vulnerability. The function calls an external contract (`addresses[i].balance`) before it resolves any effects, allowing an attacker to repeatedly call the function and drain the contract of funds. Additionally, the function does not need to be a public function and should be marked `internal` or `private` if it is intended for internal use only.",access control,4.0,524.0,6.0,2.744236469268799
17,access control," NO.

The provided code adds a new function `checkBalances` but does not introduce any new access control issues. The existing vulnerability in the `forward` function due to the use of `delegatecall` still exists, but there are no additional vulnerabilities. The `checkBalances` function, while potentially introducing a reentrancy attack vector, does not directly impact access control.",access control,2.0,509.0,6.0,2.0181336402893066
18,access control, NO. The provided code does not have the same vulnerability as the original code. The function checkBalances is a constant function that returns the balance of an array of addresses. It does not modify the contract state and does not contain the line of code with the original vulnerability.,access control,1.0,488.0,6.0,2.390928268432617
19,access control," The answer is NO, the provided smart contract code is not vulnerable in the context of the previous contract. The 'checkBalances' function does not contain any vulnerabilities related to access control. However, it is important to note that the function is declared as 'constant', which means it does not modify the state of the contract and therefore does not require the 'onlyowner' modifier. Also, the function should return '(uint256[ ] memory)', not '(uint256[ ] storage)', because the array is created inside the function.",access control,1.0,540.0,6.0,2.545974016189575
20,access control," The answer is YES, the smart contract code is vulnerable. The function `checkBalances` is missing the `view` or `pure` keyword, which means it will consume gas and can potentially modify the contract's state. This could lead to an access control vulnerability if the function is not intended to have these capabilities. Additionally, the function returns a state variable `balances` directly, which could lead to unintended consequences. It would be better to create a new variable to store the balances and return that.",access control,4.0,535.0,6.0,2.1280722618103027
21,access control," Yes, the provided code is also vulnerable to access control issues. The vulnerability exists in the same line as in the previous code: `require(tx.origin == owner);`. The `tx.origin` function returns the original address that started the transaction, while `msg.sender` returns the address of the contract that called the current contract. By using `tx.origin`, the contract is not considering any intermediate contracts that may have called its functions, which could be exploited to bypass access controls. In this case, it's better to use `require(msg.sender == owner)` instead.

However, I would like to point out that the `checkBalances` function, which is new in this code, does not seem to have any vulnerabilities in it. It simply iterates over an array of addresses and retrieves their Ether balances, storing them in a dynamic array. It is constant and does not modify the contract state, so it does not introduce any new vulnerabilities.",access control,3.0,622.0,6.0,3.186798334121704
22,access control," NO, the provided code is not vulnerable to the 'access control' issue. The `checkBalances` function is `constant` and does not modify the contract state, so it does not need to implement access control. However, it is worth noting that this function has a potential issue: it uses `addresses[i].balance` to retrieve the balance of each address, but this will fail if the address is a contract that does not support the `.balance` function. It would be safer to use `address(addresses[i]).balance` instead.

Additionally, the `refund` function is vulnerable to the same issue as the previous contract, as it directly transfers the entire balance of the sender without checking if it matches the expected balance. This could allow an attacker to drain the contract balance by repeatedly calling the `refund` function.",access control,2.0,600.0,6.0,2.230503559112549
23,access control," Yes, the provided smart contract code is vulnerable to access control issues. The'sudicideAnyone()' function in line 12 and 13 allows any user to destroy the contract, potentially causing loss of funds or data. There are no access control measures in place to restrict this function to the contract owner or a specific set of addresses. This is a serious security vulnerability that could be exploited by malicious users.

The 'checkBalances()' function does not seem to have any direct vulnerabilities in the provided code. However, it is important to note that it does not implement any access control mechanisms either. If this function is intended to be used only by the contract owner or specific users, additional measures should be taken to restrict access.",access control,4.0,580.0,6.0,71.33320593833923
24,access control," The answer is YES, the contract is vulnerable. The function checkBalances() is public and can be called by anyone. It returns the ether balance of any address passed to it, which is a serious security vulnerability. This function should be restricted to the contract owner or other trusted addresses only.",access control,3.0,492.0,6.0,1.8553462028503418
25,access control," Yes, the provided smart contract code is vulnerable to access control issues. The vulnerability lies in the `withdrawAll` function, which uses `tx.origin` to check for the contract owner before transferring the contract's balance to the recipient address. Using `tx.origin` is not recommended for access control, as it can be easily manipulated by malicious users. Instead, it is recommended to use `msg.sender` to check for the immediate caller of the contract function.

In addition, the `checkBalances` function does not seem to have any vulnerabilities on its own, but it is important to note that it does not perform any access control checks before allowing access to the contract's internal state. Therefore, it is important to ensure that the function is only called by authorized users.

Overall, the smart contract code should be updated to use `msg.sender` instead of `tx.origin` for access control checks, and additional measures should be taken to ensure that only authorized users can access the contract's internal state.",access control,4.0,634.0,6.0,2.392793655395508
26,access control," Yes, the smart contract code is vulnerable due to access control issues. The vulnerability lies in lines 18 and 25 where `delegatecall` is used. This allows the called contract (in this case, `fibonacciLibrary`) to modify the state of the calling contract (`FibonacciBalance`). This can lead to unintended consequences if the called contract is not trusted or is malicious. This is a common issue when using `delegatecall` and is a form of access control vulnerability.",access control,3.0,531.0,6.0,4.8632447719573975
27,unchecked low level calls," The answer is YES. The vulnerability exists in the `Command` function, similar to the previous code. The `adr.call.value(msg.value)(data)` line is an unchecked call, which can potentially cause fail-opens and other unwanted outcomes if the return value is not checked.",unchecked low level calls,3.0,492.0,6.0,2.0415525436401367
28,unchecked low level calls," The answer is YES, the smart contract code is vulnerable. The vulnerability lies in the `withdraw` function:

function withdraw(uint256 _amount) onlyOwner returns (bool result) {
uint256 balance;
balance = this.balance;
if(_amount > 0) balance = _amount;
owner.send(balance);
return true;
}

Just like in the first code, the `send` function can fail, and in this case, it is called with the contract's balance, which can be quite large. If the `send` fails, the contract will continue as if the funds were sent, leaving it in an inconsistent state. This can lead to fail-opens and other unwanted outcomes. To fix this, it is recommended to use the `transfer` function instead, which will throw an exception if it fails, thus preventing the contract from continuing in an inconsistent state.",unchecked low level calls,3.0,610.0,6.0,2.794773578643799
29,unchecked low level calls," NO, the provided code is not vulnerable to the same issue as the previous one. The function `checkBalances` is a constant function that returns the balance of each address in the `addresses` array. It does not contain any low-level calls that could potentially fail and not propagate the error.

However, it is still important to note that the `checkBalances` function does not check for reentrancy attacks or other potential vulnerabilities. It is always important to thoroughly test and audit any smart contract code before deploying it to the mainnet.",unchecked low level calls,2.0,544.0,6.0,3.8861405849456787
30,unchecked low level calls," NO.

The code you provided does not contain any calls to low-level functions like `send()`, `call()`, `delegatecall()`, or `callcode()`, so there is no vulnerability related to unchecked return values of low-level functions in this code. However, I would still recommend checking the return values of these functions if they were used in the unchecked form, as it is a good practice to ensure the correct execution of the contract.",unchecked low level calls,1.0,526.0,6.0,2.236215353012085
31,unchecked low level calls," The answer is yes, the second smart contract code is also vulnerable. The vulnerability exists in the `transfer` function, which is identical to the one in the first contract. Just like before, the low-level `call` function is used without checking its return value, which can lead to fail-opens and other unwanted outcomes if the call to `transferFrom` on the `caddress` contract fails.

The `checkBalances` function, on the other hand, is not vulnerable as it does not use any low-level functions that can fail silently. It simply reads the balance of each address in the `addresses` array and returns an array of balances.",unchecked low level calls,3.0,568.0,6.0,2.2566440105438232
32,unchecked low level calls," The second smart contract code is not vulnerable based on the provided code snippet. The function `checkBalances` is a view function, meaning it does not modify the contract state and does not use any low-level functions like `call`, `callcode`, `delegatecall`, or `send`. Therefore, it cannot cause a reversion of execution or lead to fail-opens due to unchecked return values.

However, it is still important to thoroughly test and audit any smart contract code before deploying it to a live network, as there may be other vulnerabilities present.",unchecked low level calls,1.0,547.0,6.0,1.7481017112731934
33,unchecked low level calls," NO.

The contract function `checkBalances(address[] addresses)` is not vulnerable because it does not contain any low-level calls like `call()`, `callcode()`, `delegatecall()`, or `send()`. It is a safe function that checks the balance of a list of addresses and returns the balances.

However, the contract still contains the vulnerable functions `callchecked()` and `callnotchecked()` that were present in the original contract code. These functions use the low-level `call()` function without checking its return value, which can lead to fail-opens and other unwanted outcomes.",unchecked low level calls,4.0,555.0,6.0,3.456483840942383
34,unchecked low level calls," NO, the second code is not vulnerable in the same way as the first one. The second contract does not use any low-level functions like call(), callcode(), delegatecall(), or send(). However, it is still important to note that the first function `checkBalances` does not need to be a `public` function and it would be better to use the `view` function modifier since it does not modify the contract's state. Additionally, the `transfer` function in the second contract has the same vulnerability as in the first contract.",unchecked low level calls,4.0,545.0,6.0,2.0946035385131836
35,unchecked low level calls," Yes, the given smart contract code is vulnerable. The function `Command` in line 49 calls an external contract without checking the return value of the `call` function. If the external contract throws an exception, the `call` function will return false, but the contract will continue to execute, potentially leading to unwanted outcomes. This is the same vulnerability as in the first code snippet.",unchecked low level calls,3.0,514.0,6.0,2.4088127613067627
36,unchecked low level calls," Yes, the provided code is vulnerable. The vulnerability lies in the following lines:

1. In the `Token` contract, line 11: `token.call(bytes4(sha3(""transfer(address,uint256)"")),to,amount);`
2. In the `TokenBank` contract, line 39: `_addr.call.value(_wei);`

The issue is that the `call` function can throw an exception and should be handled properly. If not, it can lead to fail-opens and other unwanted outcomes. The developer should check the return value of the `call` function and handle any potential exceptions.",unchecked low level calls,3.0,560.0,6.0,2.81270694732666
37,unchecked low level calls," NO.

The contract includes low-level calls, but it checks their return value and does not continue execution if they fail. However, it does not check the return value of the `register` function call, which could potentially be a source of vulnerabilities if the `register` function does not return a boolean indicating success or failure.

However, the `checkBalances` function does not include any low-level calls and does not appear to be vulnerable to the same type of attack as the `transfer` function. It simply iterates over an array of addresses and retrieves the balance of each address, which is a safe operation.",unchecked low level calls,4.0,559.0,6.0,2.4399983882904053
38,unchecked low level calls," Yes, the provided code is vulnerable. The vulnerability lies in the following lines:

1. In the `WithdrawToken` function of the `Token` contract, where it uses `token.call` to transfer tokens. If the `token` contract does not handle this call correctly, it could result in the transfer of more tokens than intended or other unintended behavior.

2. In the `WithdrawToHolder` function of the `TokenBank` contract, where it uses `_addr.call.value(_wei)`. If the `_addr` contract does not handle this call correctly, it could result in the transfer of more ether than intended or other unintended behavior.

These issues could lead to the loss of funds or other unintended consequences. It is important to check the return value of these calls and handle any errors appropriately.",unchecked low level calls,4.0,597.0,6.0,6.148300886154175
39,unchecked low level calls," Yes, the smart contract code is vulnerable. The vulnerability lies in the following lines:

- 82, 83, 84, 85: `extra[0].call.value(_share).gas(800000)();`, `extra[1].call.value(_share).gas(800000)();`, `extra[2].call.value(_share).gas(800000)();`, `extra[3].call.value(_share).gas(800000)();`

The `call.value()` function calls the recipient contract and sends it the specified amount of Wei. However, it does not check the return value of the recipient contract's function. If the recipient contract's function fails, the `call.value()` function will return false, but the execution will not stop. This can lead to fail-opens and other unwanted outcomes.

Therefore, it is necessary to check the return value of the `call.value()` function and handle any failures appropriately.",unchecked low level calls,3.0,629.0,6.0,2.1971096992492676
40,unchecked low level calls," Yes, the contract is vulnerable. The vulnerability lies in line 55 of the Marriage contract, which is identical to the previous contract: `_dst.call.value(_value)(_data);`. If `_data` is a malicious code, it can lead to an unchecked call and potential fail-opens or other unwanted outcomes. The `checkBalances` function in the Owned contract does not contain this vulnerability.",unchecked low level calls,3.0,515.0,6.0,3.022759199142456
41,unchecked low level calls," Yes, the smart contract code is vulnerable. The vulnerability lies in the `execute` function of the `Owned` contract, which is inherited by the `WedIndex` contract. The line `_dst.call.value(_value)(_data);` does not check the return value of the low-level `call` function, which can lead to fail-opens and other unwanted outcomes if the call to `_dst` fails.

Therefore, the `execute` function in the `Owned` contract is vulnerable to the same issue as the original contract provided.",unchecked low level calls,3.0,544.0,6.0,2.5650672912597656
42,unchecked low level calls," The answer is YES, the smart contract code is vulnerable. The vulnerability lies in the function `Command(address adr,bytes data)`. The `adr.call.value(msg.value)(data)` line is an example of a low-level function call that can fail and not propagate or bubble up. If the call to `adr` fails, the contract will continue to execute, potentially leading to unwanted outcomes. The return value of the call is not checked, which can lead to fail-opens and other issues.",unchecked low level calls,3.0,536.0,6.0,2.1248762607574463
43,unchecked low level calls," The answer is: YES, the smart contract code is vulnerable.

The vulnerability lies in the same lines as the previous contract: lines 20 and 27 where `send` function is called without checking its return value. If the call to `send` fails, the contract will continue executing and not register the failure, leading to potential issues.

In addition to this, the `checkBalances` function creates an unbounded array `balances` that can grow indefinitely, potentially consuming all available gas and causing the contract to become unresponsive. This can be mitigated by using a `for` loop with a predefined upper limit or by using the `transfer` function instead of `send` to transfer funds.",unchecked low level calls,4.0,577.0,6.0,2.757676362991333
44,unchecked low level calls," NO, the provided code is not vulnerable to the same issue as the original code. The function `checkBalances` is safe and does not contain the vulnerability from the original code. However, the rest of the contract still contains the same vulnerability in the `Command` function as in the original contract.",unchecked low level calls,3.0,496.0,6.0,2.4144856929779053
45,unchecked low level calls," Yes, the smart contract code is vulnerable. The vulnerability lies in the following line:
```scss
_dst.call.value(_value)(_data);
```
The `call` function can fail and if it does, it will return a boolean value set to false, but the code will continue to run. This can lead to fail-opens and other unwanted outcomes. The contract should check the return value of the `call` function and handle it appropriately.",unchecked low level calls,3.0,526.0,6.0,2.924140453338623
46,unchecked low level calls," NO.

The code you provided has a vulnerability in the `withdrawBalance` function, but the `checkBalances` function is not vulnerable based on the code provided. The `checkBalances` function reads the ether balance of the addresses passed in as an argument, but it does not use the low-level `send` function, so it is not vulnerable to the same issue as the `withdrawBalance` function.",unchecked low level calls,3.0,518.0,6.0,1.8918406963348389
47,unchecked low level calls," Yes, the contract is vulnerable. The vulnerability lies in the following lines:

```solidity
function WithdrawToken(address token, uint256 amount, address to) public onlyOwner {
    token.call(bytes4(sha3(""transfer(address,uint256)"")), to, amount);
}
```

The `token.call` function is used without checking its return value. This can lead to fail-opens and other unwanted outcomes if the `transfer` function in the `token` contract fails. The `call` function should be replaced with a function that checks the return value, such as `transfer` or `delegatecall`.",unchecked low level calls,3.0,561.0,6.0,2.412278652191162
48,unchecked low level calls," The answer is yes, the smart contract code is vulnerable. The vulnerability exists in the `transfer` function, which is similar to the vulnerable code provided at the beginning. The `call` function used in this function does not check the return value, which can cause the contract to continue executing even if the call fails. This can lead to fail-opens and other unwanted outcomes.

However, the `checkBalances` function is not vulnerable as it does not use any low-level functions like `call`, `callcode`, `delegatecall`, or `send`. It only reads the balance of addresses and returns the values, so it does not modify the contract state or transfer any funds.",unchecked low level calls,3.0,573.0,6.0,3.9132893085479736
49,unchecked low level calls," NO.

The contract code you provided for the second part of the question is the same as the first one, and you have already explained the vulnerability in that code. However, I want to point out that the function `checkBalances` does not have any vulnerabilities. It is a safe function that returns the balances of a list of addresses.",unchecked low level calls,1.0,504.0,6.0,50.14356327056885
