case_id,vuln_type,audit_report,gt,eval_score,eval_input_token_num,eval_output_token_num,eval_inference_time
90,arithmetic," NO.

The function `checkBalances` is constant and does not modify the contract state, so it cannot introduce any vulnerabilities related to state changes. It also does not perform any arithmetic operations that could result in overflows or underflows. Therefore, the provided code is not vulnerable to the same type of integer overflow vulnerability as the original code.

However, it's worth noting that the function `checkBalances` assumes that the `addresses` array contains valid addresses and that the `balance` property of an address returns a `uint256` value. If this is not the case, the function could throw an exception or return incorrect results. Therefore, it's important to ensure that the input to this function is validated and checked for errors.",arithmetic,1.0,578.0,6.0,3.44230580329895
91,bad randomness," The answer is NO. The function `checkBalances()` does not affect the contract's security, reliability, or efficiency. It only reads the balances of the given addresses and returns them, it does not perform any write operations or use any sources of randomness that could introduce vulnerabilities.",bad randomness,1.0,489.0,6.0,1.9363958835601807
92,bad randomness," Yes, the smart contract code is vulnerable due to the use of block.coinbase and msg.sender in the chooseWinner function to generate seed1 and seed2. The block.coinbase can be manipulated by miners and msg.sender can be controlled by the user, making the randomness predictable and subject to attacks. The use of block.number in various places also introduces predictability in the contract's behavior. The function checkBalances does not seem to introduce any new vulnerabilities.",bad randomness,4.0,525.0,6.0,3.3217973709106445
93,bad randomness," NO, the `checkBalances` function is not vulnerable according to the given code. The function is a read-only function (constant) that returns the ether balances of a given set of addresses. It does not contain any state-changing operations or rely on unpredictable values, so it is not susceptible to the vulnerabilities mentioned in the initial review.",bad randomness,1.0,501.0,6.0,3.3230435848236084
94,bad randomness," The answer is YES, the smart contract code is vulnerable. The vulnerability lies in the function `checkBalances()`. This function reveals the ether balance of any address, which is not a good practice as it can lead to information leakage and privacy issues. Moreover, it does not check if the caller has permission to view the balance of the given addresses, which can lead to unauthorized access.",bad randomness,2.0,511.0,6.0,1.6810266971588135
95,bad randomness," NO. The function `checkBalances` does not introduce any new vulnerabilities into the contract. It is a constant function that returns the Ethereum balance of each address passed to it as an array. However, the contract still has the same vulnerability as before in the line `answer = uint8(keccak256(block.blockhash(block.number - 1), now));` where predictable values are used to generate randomness.",bad randomness,3.0,516.0,6.0,3.650773763656616
96,bad randomness," The answer is yes, the second smart contract code is also vulnerable. The vulnerability lies in the `checkBalances` function, which allows an attacker to retrieve the ether balances of any addresses. This is a violation of privacy and can potentially be used for malicious purposes. The ether balances of addresses should not be publicly accessible without consent. The `salt` variable, which is used in the `random` function, is still initialized with `block.timestamp`, which is predictable and can be manipulated by miners, leading to the same vulnerability as in the first contract.",bad randomness,4.0,545.0,6.0,2.1345906257629395
97,reentrancy," Yes, the smart contract is vulnerable to a reentrancy attack. The vulnerability lies in the line `if(msg.sender.call.value(_am)())` inside the `Collect` function. This line allows the caller to execute arbitrary code before the `Collect` function execution is complete, which can lead to a reentrancy attack.",reentrancy,3.0,502.0,6.0,2.081690549850464
98,reentrancy," NO, the provided smart contract code is not vulnerable to the reentrancy attack. The `withdrawFunds` function uses the `call.value().gas()` pattern, which forwards all available gas to the recipient contract and doesn't allow the recipient to call back into the calling contract, thus preventing reentrancy attacks.

However, it is important to note that the `checkBalances` function has a potential issue. It uses `address.balance`, which is a view function and does not require the contract to have any ether to be called. But, the function is declared as `public` and not `constant` or `view`, which might lead users to believe that it modifies the contract state. To avoid confusion, it is recommended to declare it as `constant` or `view`.",reentrancy,2.0,592.0,6.0,3.353445291519165
99,reentrancy," Answer:

Yes, the first contract code is vulnerable to a reentrancy attack. The vulnerability lies in the `Collect` function, specifically in the line `if(msg.sender.call.value(_am)())`. This line allows for a call to be made from the contract to the sender's address, which can potentially be another contract. If this contract is malicious, it can call back into the `Collect` function, draining the contract of its funds.

The second contract code is not vulnerable as it does not contain the same function that allows for external calls, which is the root cause of the reentrancy vulnerability in the first contract.",reentrancy,3.0,563.0,6.0,2.9481379985809326
100,reentrancy," NO, the second contract code you provided is not vulnerable to the reentrancy attack. The reason is that it does not contain a function with a state-changing operation that calls an external contract before updating the contract's state. Instead, the `checkBalances` function is a constant function that returns the balance of an array of addresses, and it does not modify the contract's state. Therefore, it cannot be exploited by a reentrancy attack.

However, I would like to point out that the `withdraw` function in the first contract code is vulnerable to a reentrancy attack. The reason is that it calls the `call.value` function to send ether to the caller before updating the contract's state. This allows an attacker to repeatedly call the `withdraw` function and drain the contract's ether balance. To prevent this, the contract should first update the contract's state and then call the `call.value` function to send ether to the caller.",reentrancy,4.0,627.0,6.0,2.9881765842437744
101,reentrancy," No, the provided code is not vulnerable to reentrancy attacks. The `call.value(amount)()` function is called after the state change in line 17 (`credit[msg.sender]-=amount;`), so any changes made by the called contract will not affect the current execution of the `withdraw` function. However, it's worth noting that the use of the low-level `call` function can still introduce other potential vulnerabilities, such as lack of input validation or error handling.",reentrancy,2.0,531.0,6.0,2.4364616870880127
102,reentrancy," Yes, the smart contract is vulnerable to a reentrancy attack. The vulnerability lies in the line `if(msg.sender.call.value(_am)())` within the `Collect` function. This line allows the caller to execute arbitrary code before the `Collect` function has completed execution, which can lead to a reentrancy attack.",reentrancy,3.0,502.0,6.0,2.456198215484619
103,reentrancy," Yes, the smart contract code is vulnerable to a reentrancy attack. The vulnerability lies in the line 32: `if(msg.sender.call.value(_am)())`. This allows for a call to an external contract before the initial execution is complete, which can lead to the contract state changing in the middle of its execution. This is exactly the condition that allows for a reentrancy attack.",reentrancy,3.0,515.0,6.0,3.6920793056488037
104,reentrancy," The answer is YES, the smart contract code is vulnerable to a reentrancy attack. The vulnerability exists in the `getFirstWithdrawalBonus` function, which calls the `withdrawReward` function without checking its balance first. This allows for a reentrancy attack similar to the one described in the initial example. The `checkBalances` function does not affect the vulnerability, as it is a constant function that only reads data and does not modify the contract state.",reentrancy,3.0,528.0,6.0,3.173002243041992
105,reentrancy," Yes, the smart contract code is vulnerable to a reentrancy attack. The vulnerability lies in the line 32 of the MONEY_BOX contract:

`if(msg.sender.call.value(_am)())`

This line allows a call to the msg.sender address with the value of _am, without checking if the recipient is a contract or an external address. This can lead to a reentrancy attack, where the msg.sender contract calls back into the MONEY_BOX contract before the initial execution is complete, allowing the contract state to change in the middle of the execution.",reentrancy,3.0,547.0,6.0,2.429889678955078
106,reentrancy," Answer:

Yes, the smart contract code is vulnerable to a reentrancy attack. The vulnerability lies in the line 55 of the `ACCURAL_DEPOSIT` contract:

`if(msg.sender.call.value(_am)())`

This line allows a call to the `msg.sender` (the message sender) before the initial execution is complete, which is a condition for a reentrancy attack. The contract state may change in the middle of its execution as a result of a call to an untrusted contract or the use of a low-level function with an external address.",reentrancy,3.0,551.0,6.0,4.215967893600464
107,reentrancy," Yes, the smart contract code is vulnerable to a reentrancy attack. The vulnerability lies in the line `if(msg.sender.call.value(_am)())` within the `Collect` function. This allows for a call to an external contract before the initial execution is complete, potentially allowing the contract state to change in the middle of execution. This is the same line that was identified as vulnerable in the initial review, and the issue is still present in the updated code.",reentrancy,3.0,529.0,6.0,2.530630350112915
108,reentrancy," NO, the provided code does not have the same reentrancy vulnerability in the `WithdrawToHolder` function. The reason is that it transfers Wei (Ether) directly to the `_addr` address using the `.call.value()()` function, which does not allow for arbitrary code execution. However, it is still recommended to use the `transfer()` function instead for safety and simplicity, as it automatically handles gas and exceptions.

The reentrancy vulnerability exists when a contract calls an external contract before the initial execution is complete, allowing the external contract to call back into the initial contract, causing unintended state changes. In the previous example, the `.call.value()()` function was used without checking the return value, allowing a reentrancy attack. In this case, the `.call.value()()` function is used correctly, so no reentrancy vulnerability exists.

However, it is important to note that the `WithdrawToken` function in the `Token` contract still has the reentrancy vulnerability, as it uses `token.call()` without checking the return value. This should be addressed to secure the smart contract.",reentrancy,4.0,658.0,6.0,3.200573444366455
109,reentrancy," Answer:

Yes, the first smart contract code is vulnerable to a reentrancy attack. The vulnerability lies in the `airDrop()` function of the `ModifierEntrancy` contract, which allows the `attack` contract to call the `airDrop()` function recursively before the initial execution is complete, thereby changing the contract state in the middle of its execution.

In the second code, the `attack` contract's `supportsToken()` function calls the `airDrop()` function, but it does not execute any external contract calls before the initial execution is complete. Therefore, the second code is not vulnerable to a reentrancy attack.",reentrancy,3.0,562.0,6.0,3.313387632369995
110,reentrancy," Yes, the smart contract code is vulnerable to a reentrancy attack. The vulnerability lies in the `CashOut` function, specifically in the line `if(msg.sender.call.value(_am)())`. This line allows for a call to an external contract before the initial execution is complete, which means the contract state may change in the middle of its execution. This is exactly what happens in a reentrancy attack.",reentrancy,3.0,519.0,6.0,2.2369821071624756
111,reentrancy," Yes, the smart contract code is vulnerable to a reentrancy attack. The vulnerability lies in the `Collect` function, specifically in the line `if(msg.sender.call.value(_am)())`. This line allows for a call to an untrusted contract before the initial execution is complete, potentially changing the contract state in the middle of execution.",reentrancy,3.0,504.0,6.0,3.5487682819366455
112,reentrancy," Answer:

NO, the new provided code is not vulnerable to the reentrancy attack. The `checkBalances` function does not change the contract state and does not contain any external calls that could be exploited for a reentrancy attack. The `withdrawAll` function remains the same as before, but it is not called within the `checkBalances` function, so the contract is not vulnerable through this new function.",reentrancy,1.0,519.0,6.0,2.5123255252838135
113,reentrancy," NO, the new function `checkBalances` does not introduce any new vulnerabilities. However, the existing `withdrawBalance` function still contains the reentrancy vulnerability, as you've explained. It is essential to fix that vulnerability in order to secure the contract.

The `checkBalances` function is safe because it does not modify the contract state and does not call any external contracts. It only reads the balance of the given addresses, which are passed as an argument, and returns the balances as an array. Since it is a `constant` function, it cannot change the contract state, and it does not involve any external calls that could lead to reentrancy or other vulnerabilities.

Nonetheless, it is crucial to address the existing reentrancy vulnerability in the `withdrawBalance` function to secure the contract.",reentrancy,3.0,595.0,6.0,2.5733284950256348
114,reentrancy," Yes, the smart contract code is vulnerable to a reentrancy attack. The vulnerability lies in the `CashOut` function, specifically in the line `if(msg.sender.call.value(_am)())`. This line allows for a call to an external contract before the initial execution is complete, potentially allowing the state of the contract to change in the middle of its execution. This is exactly what happens in a reentrancy attack.",reentrancy,3.0,521.0,6.0,2.3518924713134766
115,reentrancy," Yes, the smart contract code is vulnerable to a reentrancy attack. The vulnerability lies in the `CashOut` function, specifically in the line `if(msg.sender.call.value(_am)())`. This line allows for a call to be made from the recipient of the funds (`msg.sender`) back to the contract, potentially before the balance of the sender has been updated. This can lead to a situation where the contract's balance is drained through repeated calls to the `CashOut` function. To prevent this, the contract should ensure that no further calls can be made after the `CashOut` function has been executed, for example by using the `transfer` function instead of `call` or by implementing a mutex to prevent reentrancy.",reentrancy,3.0,586.0,6.0,2.1360955238342285
116,reentrancy," Yes, the smart contract code is vulnerable to a reentrancy attack. The vulnerability lies in the line 29 of the `WALLET` contract: `if(msg.sender.call.value(_am)())`. This allows for a call to an external contract before the initial execution is complete, potentially allowing the state of the contract to change in the middle of its execution. This is exactly the definition of a reentrancy attack.",reentrancy,3.0,522.0,6.0,3.983766794204712
117,reentrancy," NO, the second contract is not vulnerable to the reentrancy attack. The reason is that the `checkBalances` function does not modify the contract state and does not call any external contracts, so there is no possibility of a reentrancy attack. The `transfer` and `withdrawBalance` functions have the same vulnerability as in the first contract, but since they are not called from within the `checkBalances` function, this function is safe from reentrancy attacks.

However, it is important to note that the `transfer` and `withdrawBalance` functions are still vulnerable to reentrancy attacks, as in the first contract. The `withdrawBalance` function should use the `transfer` function instead of the low-level `call` function to avoid this vulnerability. The `transfer` function should also include checks to prevent overflows and underflows, as mentioned in the step-by-step guide.",reentrancy,4.0,617.0,6.0,2.242948532104492
118,reentrancy," NO, the provided smart contract code is not vulnerable to the reentrancy attack. The `withdrawBalance` function uses `call.value` to send ether to the msg.sender, but it does not contain any external contract calls that could allow new calls to the contract before the initial execution is complete. Therefore, it is not susceptible to a reentrancy attack.

However, it is important to note that the `withdrawBalance` function still has potential vulnerabilities, such as not checking for underflow or overflow, and not checking the return value of the `call.value` function. It is always recommended to thoroughly test and audit smart contract code before deploying it to the mainnet.",reentrancy,2.0,571.0,6.0,2.762803316116333
119,reentrancy," Yes, the smart contract code is vulnerable to reentrancy attacks. The vulnerability lies in the `CashOut` function, specifically in this line: `if(msg.sender.call.value(_am)())`. This allows for a call to an external contract before the initial execution is complete, which is a condition for a reentrancy attack.",reentrancy,3.0,503.0,6.0,3.2084341049194336
120,reentrancy," Yes, the provided Smart Contract code is vulnerable to Reentrancy Attack. The vulnerability lies in the `CashOut` function at line 38: `if(msg.sender.call.value(_am)())`. This allows external contract calls to make new calls to the calling contract before the initial execution is complete, potentially changing the contract state in the middle of its execution.",reentrancy,3.0,508.0,6.0,2.4468488693237305
121,reentrancy," Yes, the provided smart contract code is vulnerable to a reentrancy attack. The vulnerability lies in the `Collect` function where it calls `msg.sender.call.value(_am)()`. This allows for the possibility of the msg.sender making another call to the `Collect` function before the current call is finished, allowing for a reentrancy attack. This is the same vulnerability as in the first code snippet.",reentrancy,3.0,518.0,6.0,3.1731526851654053
122,reentrancy," Yes, the provided Smart Contract code is vulnerable to Reentrancy Attack. The vulnerability lies in the `CashOut` function where it uses `msg.sender.call.value(_am)()` which allows external contract calls before the initial execution is complete. This can lead to a state change in the middle of the execution, allowing an attacker to repeatedly call the function and drain the contract of funds.

In the provided code, the `CashOut` function should have used `transfer` instead of `call.value()` to avoid the risk of Reentrancy Attack. The corrected code should look like this:
```scss
function CashOut(uint _am)
public
payable
",reentrancy,3.0,569.0,6.0,2.989382266998291
123,reentrancy," Yes, the smart contract is vulnerable to a reentrancy attack. The vulnerability lies in the line `if(msg.sender.call.value(_am)())` within the `Collect` function. This line allows the caller to execute arbitrary code before the `Collect` function has completed execution, which can lead to a reentrancy attack.",reentrancy,3.0,502.0,6.0,3.3746631145477295
124,reentrancy," Yes, the provided Smart Contract code is vulnerable to Reentrancy Attack. The vulnerability lies in the `CashOut` function at line 38: `if(msg.sender.call.value(_am)())`. This allows external contract calls to make new calls to the calling contract before the initial execution is complete, potentially changing the contract state in the middle of its execution.",reentrancy,3.0,508.0,6.0,2.7908246517181396
125,reentrancy," Answer:

Yes, the first contract code is vulnerable to a reentrancy attack. The vulnerability lies in the `Collect` function, specifically in the line `if(msg.sender.call.value(_am)())`. This line allows for a call to be made from the contract to the sender's address, which can potentially be another contract. If this contract is malicious, it can call back into the `Collect` function, draining the contract of its funds.

The second contract code is not vulnerable as it does not contain the same function that allows for external calls, which is the root cause of the reentrancy vulnerability in the first contract.",reentrancy,3.0,563.0,6.0,3.7139270305633545
126,reentrancy," Answer:

NO, the second contract is not vulnerable to the reentrancy attack. The reason is that the `withdrawBalance` function is not called inside any other function, so there is no way for a reentrancy attack to occur. However, the `withdrawBalance` function is still vulnerable to the same issues as in the first contract, such as not checking the return value of `call.value` and zeroing out the user balance before sending ether.

The `checkBalances` function is also safe because it does not modify the contract state and does not call any external contracts. It simply reads the balance of the given addresses and returns an array of balances.",reentrancy,2.0,569.0,6.0,1.5439608097076416
127,time manipulation," Yes, the provided code is vulnerable to timestamp manipulation. The function `checkBalances` does not have any vulnerabilities, but the `isSaleFinished` function is identical to the one in the original contract, and therefore has the same vulnerability. The `block.timestamp` value can be manipulated by the miner, which could cause the contract to behave unexpectedly if it relies on the current time.",time manipulation,3.0,511.0,6.0,3.386791706085205
128,time manipulation," NO, the function `checkBalances` and its usage do not introduce any new vulnerabilities related to time manipulation. However, the contract still has the original vulnerabilities in the `payOut` and `randomGen` functions.",time manipulation,4.0,478.0,6.0,3.471076250076294
129,time manipulation," Yes, the smart contract code is vulnerable to the same time manipulation attack. The function resetInvestment() still uses block.timestamp to check if a certain time has passed since the last investment. If a malicious miner includes their own transaction with a manipulated timestamp, they could potentially reset the investment and steal the funds.",time manipulation,3.0,495.0,6.0,2.7899200916290283
130,time manipulation," NO, the new function checkBalances does not affect the vulnerability in the fallback function. It is a constant function that does not modify the contract state, so it does not introduce any new vulnerabilities. However, the existing vulnerability in the fallback function still exists, where the contract's behavior can be manipulated by the miner through the use of the `now` variable.",time manipulation,3.0,506.0,6.0,3.594172716140747
131,time manipulation," NO. The additional function checkBalances does not introduce any new vulnerabilities to the contract. It is a constant function that checks the ether balances of an array of addresses, which does not interact with the contract's state or pose any security risks. However, the original vulnerability in the play function still exists, where the random number is generated using block.timestamp, which is subject to miner manipulation.",time manipulation,3.0,511.0,6.0,2.4190826416015625
132,short addresses," NO, the second code snippet is not vulnerable to the'short address' attack. The vulnerability in the first code snippet comes from the use of `tx.origin` in the constructor function, which is not used in the second code snippet. Additionally, the second code snippet includes a function `checkBalances()` that is not vulnerable to the'short address' attack because it does not use the `sendCoin()` function or any other function that could be vulnerable to this attack. However, it's worth noting that the `checkBalances()` function has some potential issues with how it handles arrays, but it is not directly related to the'short address' attack.",short addresses,2.0,565.0,6.0,2.630211353302002
133,denial of service," Yes, the contract is vulnerable to denial of service attacks. The vulnerability lies in the function emptyCreditors(). If the length of creditorAddresses is greater than 1500, the array is reset to a new address array of length 0. This can be exploited by an attacker to repeatedly call the emptyCreditors() function, causing the contract to become unresponsive and denying service to legitimate users. The function checkBalances() does not contain any vulnerabilities and does not affect the contract's susceptibility to denial of service attacks.",denial of service,3.0,539.0,6.0,4.232023000717163
