case_id,vuln_type,audit_report,gt,eval_score,eval_input_token_num,eval_output_token_num,eval_inference_time
11,access control," The first smart contract code is vulnerable, as it has an access control vulnerability in the `newOwner` function (line 38). The `onlyOwner` modifier is not used, making it possible for any address to call this function and potentially gain unauthorized access to the contract.

The second smart contract code is not vulnerable based on the provided code. The `onlyOwner` modifier is used correctly in the `withdrawAll` function (line 22) of the `TestContract` contract, ensuring that only the owner can call this function. However, it is important to note that the `MultiOwnable` contract still has the same access control vulnerability in the `newOwner` function, so further assessment of the entire contract's implementation and usage is necessary to ensure there are no other vulnerabilities.",access control,4.0,594.0,6.0,2.704892873764038
12,access control," Answer:

No, the second code is not vulnerable to the 'access control' vulnerability. The'missing' function in the first contract is setting the 'owner' variable without any checks, making it vulnerable. However, in the second contract, there is no such function, and the 'owner' variable is directly set in the constructor of the 'FileCoinCash' contract. Therefore, it is not vulnerable to the same access control issue.

However, it is essential to note that the second contract may still have other vulnerabilities, and a thorough audit should be conducted to ensure its security.",access control,2.0,552.0,6.0,3.437274694442749
13,access control," NO, the contract is not vulnerable at this point as the `onlyowner` modifier ensures that only the contract creator can call the functions using it. However, the `creator` variable and the functions using it should be declared `immutable` in the latest versions of Solidity to prevent its value from being changed after construction.",access control,3.0,498.0,6.0,2.7889249324798584
14,access control," NO, this contract does not appear to have the same access control vulnerability as the first contract. The `withdraw` function checks if the `amount` is less than or equal to the balance of the sender, which is a good practice to prevent unauthorized access. However, it's worth noting that this contract does not use the `SafeMath` library for arithmetic operations, which could lead to integer overflows or underflows. Additionally, the `migrateTo` function should also check the balance of the contract before transferring, to prevent losing funds in case of a bug or an attack.",access control,2.0,551.0,6.0,3.01267409324646
15,access control," No, the provided code is not vulnerable to the 'access control' vulnerability. The `onlyowner` modifier in the `Missing` contract correctly restricts the `withdraw` function to be called only by the owner of the contract. However, the `IamMissing` function in the `Missing` contract is still missing the `onlyowner` modifier, making it callable by anyone, which could potentially be a different type of vulnerability.

The rest of the code defines several contracts related to ERC20 tokens, but none of them have any obvious access control vulnerabilities in the provided code.",access control,4.0,550.0,6.0,2.1703383922576904
16,access control," NO, this contract does not have the same access control vulnerability as the previous one. The `withdraw` function correctly checks if the sender is the owner before transferring funds. However, it's important to note that this contract may still have other vulnerabilities.",access control,2.0,483.0,6.0,2.657768726348877
17,access control," NO.

The provided code includes a Proxy contract that uses delegatecall to forward data to another contract, a SafeMath library to prevent arithmetic overflows and underflows, and an ERC20 token implementation with basic and standard interfaces. The FileCoinCash contract is created as a StandardToken and initializes the token supply and distributes the tokens to two addresses. There are no visible access control vulnerabilities in the provided code. However, it is important to note that the security of the contract ultimately depends on the correctness of the callee contract and the data being passed in.",access control,1.0,545.0,6.0,2.309244155883789
18,access control," NO.

The code you provided is a combination of a simple wallet contract and some ERC20 token contracts. The wallet contract does have an access control vulnerability as you mentioned, but the rest of the code does not seem to have any immediately obvious vulnerabilities. However, it is important to note that a comprehensive audit would involve more thorough testing and analysis, including testing edge cases and potential attack scenarios.",access control,3.0,512.0,6.0,2.5252671241760254
19,access control," Answer:

NO.

The contract `FileCoinCash` does not show any obvious signs of access control vulnerabilities based on the provided code. The constructor function in this contract is already written correctly with the `public` visibility, contrary to the vulnerable contract `Missing`. Therefore, the contract `FileCoinCash` is not vulnerable to the same access control vulnerability.

However, it is essential to thoroughly test and audit the contract to ensure there are no other potential security issues.",access control,2.0,527.0,6.0,2.008415460586548
20,access control," The first smart contract code is vulnerable, as it has an access control vulnerability. The `initWallet` function in line 19-20 only sets the `creator` variable to the message sender, but it does not check if the caller is the contract deployer or has any special permissions. This means any account can call this function and set themselves as the contract creator, potentially gaining unauthorized access to the contract's functions.

The second smart contract code is not vulnerable based on the provided information. It includes an ERC20 token implementation, but the provided code does not have any custom access control functions like the first contract. However, it is essential to note that the ERC20 standard itself has some access control considerations, like checking `msg.sender` in token transfer functions, which might not be included in this code.

In summary, the answer is:
1. YES, the first smart contract code is vulnerable due to an access control issue.
2. NO, the second smart contract code is not vulnerable based on the provided information.",access control,4.0,640.0,6.0,1.607161045074463
21,access control," The provided smart contract code is vulnerable. The vulnerability lies in the `FileCoinCash` contract, which inherits from `StandardToken`. The `FileCoinCash` contract initializes the token supply and assigns tokens to two addresses in its constructor. However, it does not implement any access control mechanisms to prevent unauthorized access to these critical functions. As a result, any user can call these functions and manipulate the token supply or transfer tokens they do not own.

In particular, the `transfer` function inherited from `ERC20Basic` can be called by any user to transfer tokens they do not own, as there is no access control mechanism in place to prevent unauthorized access. This is a classic example of an access control vulnerability, as described in the OWASP Top 10.

Therefore, the answer is YES, the smart contract code is vulnerable.",access control,3.0,602.0,6.0,3.3656280040740967
22,access control," NO, the second code snippet is not vulnerable to the 'access control' vulnerability. The `transfer` function used in the `withdraw` function is a built-in function in Solidity that automatically checks for the availability of funds before making the transfer. However, it is always recommended to use the `SafeMath` library to prevent arithmetic overflows and underflows.

In the second code snippet, the `FileCoinCash` contract inherits from `StandardToken` which inherits from `BasicToken` and `ERC20`. The `ERC20` contract has a function `transferFrom` which can be used to transfer tokens from one address to another, but it requires the caller to have sufficient allowance for the transfer.

Therefore, the second code snippet is not vulnerable to the 'access control' vulnerability.",access control,2.0,593.0,6.0,2.3802521228790283
23,access control," The answer is YES, the contract FileCoinCash is vulnerable to access control issues. The vulnerability is in the constructor function of FileCoinCash contract (now called the fallback function in Solidity version 0.5.0 and later). The fallback function is not marked as payable, but it is assigning ether values to the balances mapping. This means that if the contract is called with a value transfer, the contract will throw an exception and the ether will be lost. This is a potential loss of funds and could have been avoided by marking the fallback function as payable.

In addition, the totalSupply\_ variable should be assigned in the constructor function instead of directly. This is because the constructor function is only called once during contract deployment, while the totalSupply\_ variable can be accessed and modified after deployment. By assigning the totalSupply\_ variable in the constructor function, it ensures that the total supply is set only once and cannot be modified after deployment.

Lastly, it is recommended to use the more recent version of Solidity and follow the best practices for smart contract development, such as using the `SafeMath` library for arithmetic operations and implementing modifiers for function access control.",access control,4.0,669.0,6.0,2.4905197620391846
24,access control," Answer:

NO.

The contract FileCoinCash does not show any obvious signs of access control vulnerabilities based on the provided code. The modifier onlyowner and the restricted function changeOwner have been removed, but that does not necessarily indicate a vulnerability if the contract's functionality does not require such protection.

However, it is still essential to check the contract's initialization, token allocation, and other functionalities to ensure complete security.",access control,1.0,516.0,6.0,2.1774768829345703
25,access control," The answer is YES, the contract is vulnerable due to access control issues. The 'withdrawAll' function uses 'tx.origin' to validate the caller, which is a deprecated and insecure practice. It makes the contract susceptible to a malicious contract posing as the owner and calling the 'withdrawAll' function, thereby draining the contract of its funds.

Here's the detailed explanation:

The 'withdrawAll' function in the FileCoinCash contract has the following line:
require(tx.origin == owner);

This line validates the caller based on 'tx.origin', which is the address of the external account that initiated the transaction. However, this is an insecure practice because it doesn't take into account any intermediate contracts that might have been called in the process.

A malicious contract could exploit this vulnerability by calling the 'withdrawAll' function, appearing as the 'owner' and draining the contract of its funds. To avoid this, it's recommended to use'msg.sender' instead of 'tx.origin' to validate the immediate caller.",access control,3.0,634.0,6.0,2.402966260910034
26,access control," Yes, the provided code is vulnerable to access control issues. Specifically, the `delegatecall` function is used in lines 31 and 38, which can potentially transfer control to the called contract and allow it to execute arbitrary code with the same privileges as the calling contract. This can lead to unintended actions and potential security breaches. The `delegatecall` function should be used with caution and only when necessary.",access control,3.0,516.0,6.0,3.7692883014678955
27,unchecked low level calls," Answer:

Yes, the provided smart contract code is vulnerable. The vulnerability lies in the `Command` function of the `Pie` contract, which calls an external contract using the low-level `call.value` function without checking its return value. This can lead to fail-opens and other unwanted outcomes if the external contract throws an exception or consumes all the gas.

The `call.value` function should be used with caution and its return value should always be checked to ensure that the external contract execution was successful. If the external contract execution fails, the contract should handle the error and take appropriate action.

Here is an example of how the `call.value` function should be used with error checking:
```csharp
(bool success, ) = adr.call.value(msg.value)(data);
require(success, ""External contract execution failed"");
```
In this example, the `call.value` function returns a tuple of two values: a boolean indicating success or failure, and the returned data. The `require` statement checks the boolean value and throws an exception if the external contract execution failed.",unchecked low level calls,3.0,651.0,6.0,3.5064942836761475
28,unchecked low level calls," The provided smart contract code is vulnerable. The vulnerability lies in the `withdraw` function in line 75 and 76:

`owner.send(balance);`

The `send` function can fail, and if it does, the contract will not throw an error or revert the transaction. This can lead to fail-opens and other unwanted outcomes. It is recommended to use the `transfer` function instead, which will throw an error if it fails, or use the low-level functions `call.value` or `transferEther` from a library that checks the return value and throws an error if it fails.",unchecked low level calls,3.0,556.0,6.0,4.800326108932495
29,unchecked low level calls," Yes, the provided code is vulnerable. The vulnerability lies in the `Command` function of the `Freebie` contract, which calls another contract using the low-level `call.value` function without checking its return value. This can lead to fail-opens and other unwanted outcomes if the called contract throws an exception or consumes all the available gas.

Here is the vulnerable line of code:
`adr.call.value(msg.value)(data);`

The rest of the contracts in the code do not seem to have the same vulnerability, but it's important to note that the `Freebie` contract is a child contract of the `FileCoinCash` contract, and it inherits the vulnerability from its parent.",unchecked low level calls,3.0,574.0,6.0,3.89043927192688
30,unchecked low level calls," Yes, the provided code is vulnerable to the same issue as the previous one. The vulnerability lies in the following lines:

1. msg.sender.send(valuePaid); in line 110
2. msg.sender.send(excessPaid); in line 118
3. currentMonarch.etherAddress.send(compensation); in line 132
4. wizardAddress.send(amount); in line 174

The reason for this vulnerability is that the send function can fail, and if the return value is not checked, it can lead to fail-opens and other unwanted outcomes.",unchecked low level calls,3.0,550.0,6.0,6.572253704071045
31,unchecked low level calls," The provided code is vulnerable, and the vulnerability exists in the `FileCoinCash` contract as well as in the `airPort` contract. The reason is that the low-level `.call()` function is used in the `transfer` function without checking its return value. This can lead to fail-opens and other unwanted outcomes if the called function fails.

In the `FileCoinCash` contract, the `.call()` function is used in the `FileCoinCash` constructor, which is equivalent to the `transfer` function in the `airPort` contract. The vulnerability is present in both contracts, and the same issue applies: the `.call()` function should not be used without checking its return value.",unchecked low level calls,3.0,578.0,6.0,3.2161824703216553
32,unchecked low level calls," NO, the new code is not vulnerable to the same issue as the original code. The new code does not contain any instances of the `send` function, which was the source of the vulnerability in the original code. The `send` function can fail and if it is not checked, it can lead to fail-opens and other unwanted outcomes. In the new code, there are no low-level calls that do not propagate errors and do not lead to a total reversion of the current execution, so it is not vulnerable to the same issue.",unchecked low level calls,3.0,546.0,6.0,2.00662899017334
33,unchecked low level calls," Answer:

The provided code includes a SafeMath library, which is used to prevent overflows and underflows in arithmetic operations. However, the low-level call function 'call' is still used without proper error checking in the 'callnotchecked' function of the 'ReturnValue' contract. Therefore, the code is vulnerable.

In the 'callnotchecked' function, the line 'callee.call();' does not check the return value, which can lead to fail-opens and other unwanted outcomes if the call fails. This is the same vulnerability as in the previous code.

So, the answer is YES, it is vulnerable due to the same reason as before.",unchecked low level calls,3.0,569.0,6.0,2.9195005893707275
34,unchecked low level calls," Yes, the provided code is vulnerable. The vulnerability lies in the `transfer` function of the `AirDropContract` contract, specifically in the following line:

`contract_address.call(id, msg.sender, tos[i], vs[i]);`

Just like in the first code snippet, the low-level `call` function is used without checking its return value. This can lead to fail-opens and other unwanted outcomes if the called contract's function fails.

In this case, the `transfer` function is trying to call the `transferFrom` function of another contract (identified by `contract_address`). If the called contract's `transferFrom` function fails, the `transfer` function will not be aware of it and will continue executing, potentially causing unintended consequences.",unchecked low level calls,3.0,588.0,6.0,4.759912490844727
35,unchecked low level calls," No, the contract is not vulnerable in the way described. The low-level `call` function is not used in this contract, so it is not susceptible to the specified vulnerability. However, this contract has other issues, such as the lack of access control in the `Command` function and the potential for integer overflows in the `transfer` function. It's also using an old version of Solidity, which may introduce additional vulnerabilities.",unchecked low level calls,2.0,522.0,6.0,3.640604257583618
36,unchecked low level calls," Yes, the provided code is vulnerable. The vulnerability lies in the following lines:

1. In the `TokenBank` contract, the `WithdrawToken` function calls the `transfer` function of the `token` contract using the low-level `call` function without checking its return value. This can lead to fail-opens and other unwanted outcomes if the `transfer` function fails.

2. In the `TokenBank` contract, the `WithdrawToHolder` function calls the `.call.value(_wei)` function without checking its return value. This can lead to fail-opens and other unwanted outcomes if the call fails.

These issues can be resolved by checking the return value of the low-level calls and handling any failures appropriately.",unchecked low level calls,3.0,582.0,6.0,3.5203964710235596
37,unchecked low level calls," The provided code is vulnerable, and the vulnerability is related to the use of low-level functions without proper error checking. Specifically, the line `contract_address.call(""register"", ""CentraToken"");` in the `Centra4` contract is vulnerable because it uses the `call` function without checking the return value. This means that if the `register` function call fails, the error will not be propagated or handled correctly, potentially leading to unwanted outcomes.

Additionally, the `Centra4` contract does not seem to have any direct interaction with the `FileCoinCash` contract, so the vulnerability is not directly related to the `FileCoinCash` contract itself. However, if the `register` function in the `contract_address` contract has any logic that interacts with the `FileCoinCash` contract, then there could be potential vulnerabilities in that logic as well.

Therefore, the code is vulnerable due to the unchecked low-level function call in the `Centra4` contract.",unchecked low level calls,3.0,635.0,6.0,2.782499074935913
38,unchecked low level calls," Yes, the provided code is vulnerable. The vulnerability lies in the following lines:

1. In the `TokenBank` contract, the `WithdrawToken` function calls the `transfer` function of the `token` contract using the low-level `call` function without checking its return value. This can lead to fail-opens and other unwanted outcomes if the `transfer` function fails.

2. In the `TokenBank` contract, the `WithdrawToHolder` function calls the `.call.value(_wei)` function without checking its return value. This can lead to fail-opens and other unwanted outcomes if the call fails.

These vulnerabilities can be exploited to steal funds or manipulate the contract's state. It is important to check the return value of low-level calls and handle failures appropriately to prevent such vulnerabilities.",unchecked low level calls,3.0,597.0,6.0,2.600020170211792
39,unchecked low level calls," Yes, the smart contract code is vulnerable. The vulnerability lies in the `fundPuppets()` function of the `Splitter` contract. The function calls the `call.value()` function on the `extra` array elements without checking the return value. This can lead to fail-opens and other unwanted outcomes if the call to these functions fails.

Here is the vulnerable code:
```go
function fundPuppets() public payable {
    require(msg.sender == owner);
    _share = SafeMath.div(msg.value, 4);
    extra[0].call.value(_share).gas(800000)();
    extra[1].call.value(_share).gas(800000)();
    extra[2].call.value(_share).gas(800000)();
    extra[3].call.value(_share).gas(800000)();
}
```
To fix this vulnerability, the contract should check the return value of the `call.value()` function and handle any failures appropriately. Here is an example of how the code can be modified to fix the vulnerability:
```go
function fundPuppets() public payable {
    require(msg.sender == owner);
    _share = SafeMath.div(",unchecked low level calls,3.0,679.0,6.0,2.354660987854004
40,unchecked low level calls," Yes, the contract is vulnerable. The vulnerability is in the `execute` function of the `Owned` contract, which is inherited by the `Marriage` contract. The line `_dst.call.value(_value)(_data);` does not check the return value of the low-level `call` function, which can lead to fail-opens and other unwanted outcomes if the called contract throws an exception. This is the same vulnerability as in the given code.",unchecked low level calls,3.0,526.0,6.0,2.6758835315704346
41,unchecked low level calls," Yes, the provided code is vulnerable. The vulnerability exists in the FileCoinCash contract in the constructor function. The constructor function is not defined as such, it is just a function named FileCoinCash(). In Solidity 0.4.16 and earlier, this function will be called when the contract is deployed, but it does not have the special constructor behavior introduced in Solidity 0.5.0. This means that the balance assignments for the deploying address (0x5F056029fcE54d5c40fc5d966Eb68bF509240ae0) and the zero address (0xb90c870D4259822353C02590eeb76BE8B18E4A60) are not protected by the contract's visibility modifiers. An attacker could potentially exploit this by interacting with the zero address, which is typically not allowed in a well-secured contract.

Additionally, the contract is missing the `require(bytes(_name).length > 0 && bytes(_symbol).length > 0);` check in the constructor, which is recommended to ensure that the name and symbol have been set correctly.

In summary, the contract is vulnerable due to the lack of proper constructor definition and missing checks",unchecked low level calls,2.0,687.0,6.0,2.3618104457855225
42,unchecked low level calls," Answer:

NO, the new code is not vulnerable to the same attack as the original code. The reason is that it does not use the low-level function `call`, `callcode`, `delegatecall`, or `send` which can return a boolean value and continue executing the code if not checked. Instead, it uses the `transfer` function which will propagate errors and revert the current execution if it fails.

However, it is still important to note that the `transfer` function can still fail due to various reasons such as insufficient balance or the recipient being a contract that throws an error. Therefore, it is still important to check the return value of `transfer` and handle any errors appropriately.

Additionally, the new code includes a SafeMath library, which can help prevent arithmetic overflows and underflows. It is a good practice to use libraries like SafeMath to ensure the correctness of arithmetic operations in Solidity.

Overall, while the new code is not vulnerable to the same attack as the original code, it is still important to thoroughly test and audit the code to ensure its security and reliability.",unchecked low level calls,4.0,655.0,6.0,2.3996474742889404
43,unchecked low level calls," NO, this contract is not vulnerable to the same issue as the previous one. The use of `send` in the `withdrawLeftOver` function has been replaced with a transfer from the `FileCoinCash` contract, which extends `StandardToken` and in turn uses the `SafeMath` library for arithmetic operations. This contract is still open to other potential vulnerabilities, but the specific issue of unchecked return values from `send` has been addressed.",unchecked low level calls,3.0,527.0,6.0,4.423710107803345
