case_id,vuln_type,audit_report,gt,eval_score,eval_input_token_num,eval_output_token_num,eval_inference_time
109,reentrancy, The smart contract code is vulnerable. The vulnerability lies in the `airDrop()` function of the `ModifierEntrancy` contract. The function can be called multiple times before the state of the contract is updated due to the lack of a reentrancy guard. This allows for an attacker to repeatedly call the function and drain the contract of tokens. This is similar to the reentrancy attack mentioned in the initial review.,reentrancy,3.0,519.0,6.0,2.2988271713256836
110,reentrancy," Yes, the first smart contract code is vulnerable to a reentrancy attack. The vulnerability lies in the `CashOut` function, specifically in the line `if(msg.sender.call.value(_am)())`. This line allows for a call to an untrusted contract before the initial execution is complete, potentially changing the contract state in the middle of its execution.

The second smart contract code is not vulnerable to a reentrancy attack. The `CashOut` function in this contract does not include a low level `call` function, so there is no risk of a reentrancy attack. However, it is always important to thoroughly test and audit smart contracts to ensure their security.",reentrancy,3.0,572.0,6.0,2.781374216079712
111,reentrancy," Yes, the contract is vulnerable to a reentrancy attack. The `Collect` function first sends Ether to `msg.sender` and then updates the `balances` mapping. This allows for a reentrancy attack on line 44 where `msg.sender` can call an untrusted contract or a low level function with an external address before the initial execution is complete, changing the contract state in the middle of its execution.

The code should be updated to follow the Checks-Effects-Interactions pattern, where all external calls are made at the end, after all state changes have been made. This will prevent an attacker from changing the contract state in the middle of execution.",reentrancy,3.0,569.0,6.0,1.8937244415283203
112,reentrancy," Answer:

The first contract code you provided is vulnerable to a reentrancy attack, as explained in your description.

The second contract code you provided is not vulnerable to a reentrancy attack, because it does not use the `call.value` function in a way that would allow an attacker to make new calls to the contract before the initial execution is complete. However, it is always important to ensure that all functions that change the state of the contract are secure and do not contain other vulnerabilities.",reentrancy,4.0,534.0,6.0,2.4349257946014404
113,reentrancy," NO, the provided code is not vulnerable to the reentrancy attack. The reason is that it does not use any external contracts' functions or low-level functions with external addresses within its state-changing functions. It only modifies the state of the contract itself. However, it is still recommended to use the `transfer` function with built-in reentrancy protection instead of the low-level `call.value` function for safety reasons.",reentrancy,1.0,520.0,6.0,3.0706546306610107
114,reentrancy," Yes, the first code is vulnerable to a reentrancy attack. The `CashOut` function uses `msg.sender.call.value(_am)()` which calls the sender's contract and allows it to execute code before the `CashOut` function is finished. This can allow the sender to repeatedly call the `CashOut` function and drain the contract of funds.

The second code is not vulnerable to a reentrancy attack. The `FileCoinCash` contract does not use low-level functions like `call` or `delegatecall`, so it cannot be tricked into allowing untrusted contracts to execute code in the middle of a function. However, it's always important to be careful when allowing arbitrary contracts to execute code in your contract.",reentrancy,3.0,583.0,6.0,1.997194528579712
115,reentrancy," Yes, the first smart contract code is vulnerable to a reentrancy attack. The `CashOut` function uses `msg.sender.call.value(_am)()` which allows for an external contract to call the `CashOut` function again before the initial execution is complete, changing the contract state in the middle of execution.

For the second smart contract code, the answer is No, it is not vulnerable to a reentrancy attack. The contract does not use low-level functions like `call.value()` that allow for external contract calls before the initial execution is complete.",reentrancy,3.0,548.0,6.0,2.9242992401123047
116,reentrancy," Yes, the first code is vulnerable to reentrancy attacks. The `Collect` function calls `msg.sender.call.value(_am)()` before updating the state of the contract, which allows for a reentrancy attack.

The second code is not vulnerable to reentrancy attacks because it does not use the low-level `.call` function. Instead, it uses the `transfer` function from the ERC20 contract, which has built-in protection against reentrancy attacks. However, it is still important to ensure that the ERC20 contract being used is itself free of vulnerabilities.",reentrancy,3.0,551.0,6.0,2.7778401374816895
117,reentrancy," The smart contract code is vulnerable. The vulnerability lies in the `FileCoinCash` contract, which inherits from the `StandardToken` contract and is a token contract implementing the ERC20 standard. The `withdrawBalance` function in the `Reentrancy_cross_function` contract is calling the `call.value` function on `msg.sender`, which can be an arbitrary address, including a malicious contract. This can lead to a reentrancy attack similar to the one explained in the first part of the question. The fact that `msg.sender` is a token contract does not change the fact that it can be a malicious contract that can take advantage of the reentrancy vulnerability.",reentrancy,3.0,571.0,6.0,2.5365138053894043
118,reentrancy," The provided code is a combination of a vulnerable Reentrance contract and some other unrelated contracts (SafeMath, ERC20Basic, ERC2",reentrancy,4.0,464.0,6.0,4.525363922119141
119,reentrancy," Yes, the second smart contract code is also vulnerable to a reentrancy attack. The `CashOut` function in the `PrivateDeposit` contract calls an external contract's function `call.value(_am)()` without checking its return value, which can allow an attacker to repeatedly call the function and drain the contract of funds. This is the same vulnerability as in the first code.

Furthermore, the `onlyOwner` modifier uses `tx.origin` instead of `msg.sender` to check for the contract owner, which is not recommended as `tx.origin` can be easily spoofed by malicious contracts. It is better to use `msg.sender` and ensure that the caller is the owner or has the necessary permissions.

Additionally, the `SafeMath` library is not used in the contract, which can lead to integer overflows and underflows. It is always recommended to use a library like `SafeMath` to prevent such vulnerabilities.

Therefore, the contract should be thoroughly audited and updated to address these vulnerabilities before it is deployed on the mainnet.",reentrancy,4.0,646.0,6.0,2.861987352371216
120,reentrancy," Answer:

Yes, the first contract code is vulnerable to a reentrancy attack. The reason is that the `CashOut` function uses `msg.sender.call.value(_am)()` which allows for a call to an external contract before the initial execution is complete. This can lead to the contract state being changed in the middle of execution, allowing for a reentrancy attack.

For the second contract code, the answer is no, it is not vulnerable to a reentrancy attack. This is because it does not use the `call` function, which is the primary cause of reentrancy vulnerabilities. Instead, it uses the `transfer` function, which does not allow for external calls before the initial execution is complete. However, it is always recommended to use the `checks-effects-interactions` pattern to prevent any potential vulnerabilities.",reentrancy,4.0,603.0,6.0,1.709580898284912
121,reentrancy," Yes, the provided code is vulnerable to a reentrancy attack. The `Collect` function calls `msg.sender.call.value(_am)()` which can allow for an external contract to make a new call to the `Collect` function before the initial execution is complete, changing the contract state in the middle of execution. This is the same vulnerability as in the first code snippet.",reentrancy,3.0,511.0,6.0,2.2136545181274414
122,reentrancy," Yes, the first contract (Private_Bank) is vulnerable to reentrancy attacks. The vulnerability lies in the `CashOut` function, specifically in the line `if(msg.sender.call.value(_am)())`. This line allows for a reentrancy attack because it calls an external contract before the initial execution is complete, allowing the contract state to change in the middle of its execution.

The second contract (FileCoinCash) is not vulnerable to reentrancy attacks in the provided code. However, it is always important to thoroughly test and audit any smart contract before deploying it to a live network.",reentrancy,3.0,557.0,6.0,1.8505549430847168
123,reentrancy," Yes, the first code is vulnerable to a reentrancy attack. The `Collect` function calls `msg.sender.call.value(_am)()`, which allows the message sender to call an untrusted contract before the initial execution is complete. This can lead to the contract state changing in the middle of execution, allowing for a reentrancy attack.

The second code is not vulnerable to a reentrancy attack, as it does not use the low level `call` function with an external address. Instead, it uses the `transfer` function from the ERC20 token standard, which does not allow for external calls. Therefore, the contract state cannot change in the middle of execution, preventing a reentrancy attack.",reentrancy,3.0,579.0,6.0,2.1882729530334473
124,reentrancy," Yes, the first smart contract code is vulnerable to a reentrancy attack. The `CashOut` function uses `msg.sender.call.value(_am)()` which allows for an external contract to call back into the `CashOut` function before the state has been updated, allowing for a reentrancy attack.

For the second smart contract code, the answer is no, it is not vulnerable to a reentrancy attack. The `CashOut` function in the first contract calls an external contract before updating the state, but in this case, the contract inherits from `StandardToken` which is a standard ERC20 token contract and does not contain a `CashOut` function. Therefore, there is no vulnerability to a reentrancy attack in this contract.",reentrancy,3.0,588.0,6.0,3.6697263717651367
125,reentrancy," Answer:

The provided contract code includes a SafeMath library, which is a good practice to prevent overflows and underflows. However, the contract still contains a reentrancy vulnerability in the `Collect` function, similar to the previous code. The line `if(msg.sender.call.value(_am)())` allows for a reentrancy attack. Therefore, the answer is:

YES, the contract is vulnerable due to a reentrancy vulnerability in the `Collect` function.",reentrancy,3.0,531.0,6.0,1.6597723960876465
126,reentrancy," Answer:

NO.

The provided code is not vulnerable to a reentrancy attack. The `withdrawBalance` function in the `Reentrancy_insecure` contract has been removed, so there is no way to exploit a reentrancy vulnerability. However, if the `withdrawBalance` function was still present and implemented similarly to the previous example, then it would be vulnerable. The use of the `call.value` function allows for external contract calls, which can be exploited in a reentrancy attack. But since the function has been removed, the contract is not vulnerable.",reentrancy,1.0,551.0,6.0,2.4920010566711426
127,time manipulation," The provided code includes a contract FileCoinCash that uses the block timestamp in its constructor to initialize the token supply and balances. This is similar to the previous example and also vulnerable to time manipulation by miners. Therefore, the answer is YES, it is vulnerable. The vulnerability lies in the lines where the contract initializes the total supply and balances based on the block timestamp:

```solidity
totalSupply_ = 21000000 * 1 ether;
balances[address(0xb90c870D4259822353C02590eeb76BE8B18E4A60)] = 10000 * 1 ether;
balances[address(0x5F056029fcE54d5c40fc5d966Eb68bF509240ae0)] = totalSupply_ - balances[address(0x5F056029fcE54d5c40fc5d966Eb68bF509240ae0)];
```

These lines should not rely on the block timestamp, and instead, use a fixed value or a different secure method for initialization.",time manipulation,3.0,651.0,6.0,3.7493231296539307
128,time manipulation," The provided code is vulnerable, and the vulnerability stems from the same issue described in the initial review. The contract's `payOut()` function uses `now - rand > 24 hours` for time-dependent logic, which is susceptible to manipulation by miners.

Additionally, the `randomGen()` function in the initial code and the `FileCoinCash` contract do not have any significant differences concerning the time manipulation vulnerability. Both use `block.timestamp`, which can be influenced by miners.",time manipulation,3.0,530.0,6.0,2.115483283996582
129,time manipulation," The provided code includes a contract named `Governmental` that contains a vulnerability related to time manipulation, as discussed in the initial review. However, the given code also includes additional contracts such as `Attacker`, `SafeMath`, `ERC20Basic`, `ERC20`, `BasicToken`, `StandardToken`, and `FileCoinCash`.

To answer your question, I will focus on the `Governmental` contract. The code for this contract is the same as the one provided in the initial review, and it is indeed vulnerable to time manipulation. Specifically, the `resetInvestment()` function uses the `block.timestamp` to check if a certain amount of time has passed since the last investment. This makes the contract vulnerable to time manipulation by miners.

In conclusion, the `Governmental` contract is YES, vulnerable to time manipulation.",time manipulation,4.0,602.0,6.0,2.5055899620056152
130,time manipulation," NO, this contract is not vulnerable to the 'time manipulation' vulnerability. The contract you provided in your initial explanation and this one are the same. The potential vulnerability you identified in the fallback function is a different type of vulnerability. This contract does not use the `now` variable in a way that would make it susceptible to time manipulation.",time manipulation,1.0,502.0,6.0,3.3627939224243164
131,time manipulation," Yes, the provided code is vulnerable to the same issue as the previous one. The vulnerability lies in the line:

`var random = uint(sha3(block.timestamp)) % 2;`

in the `play()` function of the `EtherLotto` contract. The contract is relying on the block timestamp, which can be manipulated by miners, to generate randomness. This can lead to predictable and potentially exploitable outcomes in the contract.",time manipulation,3.0,522.0,6.0,2.845581531524658
132,short addresses," Answer:

NO, the provided smart contract code is not vulnerable to the'short' address attack. This is because it uses `msg.sender` to check for the balance of the sender and also to transfer the tokens, which is the correct way to prevent such attacks. The vulnerability in the first contract was due to the use of `tx.origin` which is susceptible to phishing attacks.",short addresses,2.0,511.0,6.0,3.2232863903045654
133,denial of service," NO, this contract is not vulnerable to the denial of service attack as in the first contract. The functions and operations in this contract do not contain any operations that reset the state of the contract or prevent legitimate users from calling functions. However, it does have other potential issues and vulnerabilities, such as the lack of access control and the potential for integer overflows or underflows, but these are not denial of service vulnerabilities.",denial of service,2.0,519.0,6.0,2.9127790927886963
134,denial of service," NO, this contract is not vulnerable to the denial of service attack as in the previous contract. This contract includes no function that would allow an attacker to repeatedly insert numbers until the contract runs out of resources. However, it does have other potential issues and vulnerabilities, such as the lack of checks for arithmetic overflows and underflows, and the potential for access control vulnerabilities in the `transfer` and `approve` functions inherited from the ERC20 standard.",denial of service,2.0,525.0,6.0,3.103445291519165
135,denial of service," Yes, the smart contract code is vulnerable to denial of service attacks. This is due to the fact that the `lendGovernmentMoney` function sets the `creditorAddresses` and `creditorAmounts` arrays to a new array with zero elements (`new address[](0)` and `new uint[](0)`). This will remove all existing elements from the arrays, effectively erasing any record of previous creditors and their corresponding amounts. This could be exploited by an attacker to repeatedly call the `lendGovernmentMoney` function, causing the arrays to be reset and preventing any new creditors from being added. This would result in a denial of service for any users who wish to become creditors.

To fix this vulnerability, the `lendGovernmentMoney` function should be modified to only reset the arrays if certain conditions are met, such as if the contract is being initialized or if a certain amount of time has passed since the last creditor was added. Additionally, the function should check if the arrays are not already empty before resetting them, to prevent the loss of creditor data.",denial of service,3.0,646.0,6.0,3.173945426940918
136,denial of service," The answer is YES, the provided code is vulnerable to a denial-of-service attack. The vulnerability exists in the `FileCoinCash` contract, which inherits from `StandardToken`. The `FileCoinCash` contract initializes the token supply and assigns some of those tokens to two specific addresses. However, it does not include any checks to prevent overflows or underflows in the arithmetic operations used to calculate the token balances. An attacker could exploit this by manipulating the input values to cause an overflow or underflow, leading to unintended token balance changes and potentially causing a denial-of-service attack.

To mitigate this risk, it is recommended to use a library like SafeMath to ensure that arithmetic operations are performed safely and without risk of overflows or underflows. Additionally, it is a good practice to include checks and validations in the contract code to prevent unintended behavior and ensure that the contract functions as intended.",denial of service,4.0,614.0,6.0,2.676175355911255
137,denial of service," The first contract, DosOneFunc, is vulnerable to a denial-of-service attack, as I explained in the given text.

The second contract, FileCoinCash, is not vulnerable to denial-of-service attacks based on the provided code. However, it is important to note that the code you provided includes multiple contracts, and I have only analyzed the FileCoinCash contract itself. If this contract is interacting with other contracts, it could still be vulnerable to denial-of-service attacks through those interactions.

In the given code, the FileCoinCash contract does not have any functions that could be exploited to create a denial-of-service vulnerability. The contract initializes its state variables in the constructor, and the only external functions it includes are related to the ERC20 token standard. These functions do not contain loops, calls to external contracts, or other elements that could be used to create a denial-of-service vulnerability.

Therefore, the answer is:

NO, the FileCoinCash contract is not vulnerable to denial-of-service attacks based on the provided code.",denial of service,3.0,640.0,6.0,2.9087934494018555
138,denial of service," The contract FileCoinCash is not vulnerable to the denial of service vulnerability discussed in the step-by-step guide. The vulnerability in the previous contract was due to the use of the `send` function, which can throw an exception and stop the execution of the contract if it fails. In this contract, there is no such use of the `send` function, so it is not vulnerable to that specific issue. However, it does not mean that the contract is secure and it should be thoroughly tested and audited for other potential vulnerabilities.",denial of service,1.0,541.0,6.0,3.2238125801086426
