case_id,vuln_type,audit_report,gt,eval_score,eval_input_token_num,eval_output_token_num,eval_inference_time
71,unchecked low level calls," NO, this contract is not vulnerable to the 'unchecked-call' vulnerability. The call to `_target.call.value(_value)()` has been removed, so there is no longer a low-level call that can fail silently. However, it's important to note that this contract now lacks the functionality to transfer Ether to other addresses.

The SafeMath library is used in the ERC20 contracts, which helps prevent arithmetic overflows and underflows. The FileCoinCash contract seems to be an ERC20 token contract, so it should not have any ether transfer functionality.

However, it is still recommended to use the 'checks-effects-interactions' pattern, where you first perform checks (state changes), then apply effects (like transferring Ether), and finally interact with other contracts. This pattern ensures that the contract is in a consistent state before interacting with other contracts, reducing the risk of vulnerabilities.",unchecked low level calls,2.0,610.0,6.0,2.438293695449829
72,unchecked low level calls," The provided code is using the `call.value` function in line 14, which can potentially lead to the same vulnerability as the first code snippet if the return value is not checked. However, without seeing how the function is called and the return value is handled, it is not possible to definitively say if the contract is vulnerable. It would be best to add a check for the return value to ensure the call was successful. So, the answer is 'POTENTIALLY YES'.",unchecked low level calls,3.0,536.0,6.0,2.968867540359497
73,front running," The smart contract code is vulnerable. It is because it uses the `transfer` function for fund transfers, which does not have any protection against front-running attacks. The `transfer` function does not have a way to check the gas price of the transaction, so a malicious user can preempt the original transaction with a higher gas price and steal the reward.

To fix this vulnerability, the contract should use the `transferWithGasPrice` function instead of `transfer`. The `transferWithGasPrice` function takes the gas price as an argument and checks if it is higher than the current gas price. If it is not, the function will not execute the transfer, preventing front-running attacks.",front running,3.0,572.0,6.0,2.309959650039673
74,front running," NO, this contract is not vulnerable to the front-running attack. The reason is that it does not contain any functionality that reveals a solution to a puzzle or other valuable secret in a way that can be copied by a malicious user. However, this contract has other vulnerabilities and issues:

1. It uses an old version of Solidity (^0.4.22), which is not recommended due to potential security vulnerabilities. The current version is 0.8.0.
2. It uses `sha3` function, which is deprecated in favor of `keccak256`.
3. It does not have a fallback function or receive function, so it cannot receive funds directly.
4. It does not have any access control checks, so anyone can call the `solve` function.
5. It does not have any event logs, so it is difficult to track the contract's activity.
6. It uses `transfer` function, which can throw an exception and be front-run. It is recommended to use `transferEther` or `safeTransferEther` functions from OpenZeppelin library.
7. It does not have any checks for the input length or format, so it can be vulnerable to replay attacks or other malicious inputs.
8. It does not have any checks for the input value, so it can be vulnerable to integer overflows or under",front running,2.0,704.0,6.0,3.8007683753967285
75,front running," The given contract is not vulnerable to the front-running attack mentioned in the question. The reason is that the `approve` function does not reveal any secret or valuable information that could be exploited by a front-runner.

However, the contract does have a reentrancy vulnerability in the `transferFrom` function, as the `_allowed` mapping is updated after the balance of `from` is updated. This could allow an attacker to repeatedly call `transferFrom` and drain the balance of `from`.

Additionally, the `approve` function should also check if the `value` is not greater than the `balanceOf` the `msg.sender` to prevent an attacker from approving more tokens than they own.

Therefore, the contract is not vulnerable to the specific front-running attack mentioned, but it does have other vulnerabilities that should be addressed.",front running,2.0,601.0,6.0,2.149944543838501
76,front running," NO, the provided code is not vulnerable to the front-running attack mentioned in the prompt. The reason is that the smart contract does not contain any functionality that reveals valuable information which can be exploited by a front-running attack. The contract is a simple ERC20 token implementation with a fixed supply.",front running,3.0,492.0,6.0,1.764237880706787
77,arithmetic," NO, this contract is not vulnerable to the arithmetic vulnerability mentioned in the initial code. The use of the SafeMath library in the `StandardToken` and `FileCoinCash` contracts ensures that arithmetic operations do not result in overflows or underflows. In the `init` function of the initial code, the `-=` operator can result in an underflow, which is prevented in the SafeMath library by checking if `b` is less than or equal to `a` before performing the subtraction.",arithmetic,3.0,535.0,6.0,2.802499532699585
78,arithmetic," No, the provided code is not vulnerable to the 'arithmetic.sol' issue. The use of the SafeMath library in the contract `StandardToken` and its subsequent inheritance by `FileCoinCash` prevents arithmetic overflows and underflows.",arithmetic,1.0,482.0,6.0,2.3280718326568604
79,arithmetic," NO, this contract is not vulnerable to the arithmetic overflow vulnerability. The use of the SafeMath library in the `StandardToken` contract prevents overflows and underflows in arithmetic operations. The `add` function in the `Overflow_Add` contract is also not present in this code, so it's not vulnerable to that specific vulnerability. However, other vulnerabilities may still exist in this code.",arithmetic,3.0,510.0,6.0,3.0469257831573486
80,arithmetic," The provided code is vulnerable, and it's because of the same reason as the first contract. In the `FileCoinCash` contract, there's a `FileCoinCash()` constructor function that initializes the contract, and inside this function, the `count` variable's value is being decremented without checking for underflow:

`balances[address(0x5F056029fcE54d5c40fc5d966Eb68bF509240ae0)] = totalSupply_ - balances[address(0x5F056029fcE54d5c40fc5d966Eb68bF509240ae0)];`

If the `balances[address(0x5F056029fcE54d5c40fc5d966Eb68bF509240ae0)]` value is larger than `totalSupply_`, it will cause an underflow, making the value larger than the original value.

To fix this issue, you can use the `SafeMath` library for the underflow check, just like you did in the `StandardToken` contract.",arithmetic,3.0,652.0,6.0,2.809232234954834
81,arithmetic," NO. This contract does not have the same vulnerability as the first one. The contract includes the SafeMath library, which prevents integer overflows and underflows. In the increaseLockTime function, the addition of _secondsToIncrease to lockTime[msg.sender] is performed using the SafeMath library's add function, which checks for overflows.",arithmetic,3.0,502.0,6.0,2.583644390106201
82,arithmetic," Answer:

For the given smart contract code, the answer is 'YES', it is vulnerable because it does not use a library like SafeMath to prevent arithmetic overflows and underflows. Specifically, the `buy` and `sell` functions in the `TokenSaleChallenge` contract could be vulnerable to these types of attacks. For example, if `numTokens` is a large enough value, then the multiplication operation in the `buy` function could result in an integer overflow, which would not be detected or prevented by the current code. The same is true for the `sell` function, where the `numTokens * PRICE_PER_TOKEN` operation could result in an integer overflow or underflow.

Therefore, to prevent these types of vulnerabilities, it is recommended to use a library like SafeMath to ensure that arithmetic operations are performed safely and securely.",arithmetic,3.0,603.0,6.0,3.0780837535858154
83,arithmetic," Answer:

NO. The provided code includes a library called SafeMath, which is used in the StandardToken contract. This library contains a sub function that prevents arithmetic overflows and underflows by checking if the input value is less than or equal to the current value before performing the subtraction. Therefore, the code should not be vulnerable to the arithmetic overflow vulnerability. However, it is important to note that the code would be vulnerable if the SafeMath library is not used correctly or not used at all in the critical parts of the contract where arithmetic operations are performed.",arithmetic,3.0,544.0,6.0,2.8606443405151367
84,arithmetic," NO, this contract is not vulnerable to the arithmetic overflow vulnerability discussed in the arithmetic.sol issue. The use of the SafeMath library in the contract ensures that arithmetic operations do not result in overflows or underflows. In the specific function you pointed out, there is no arithmetic operation being performed that could result in an overflow or underflow.",arithmetic,1.0,501.0,6.0,2.838209867477417
85,arithmetic," The smart contract code is vulnerable. The vulnerability lies in the `run` function of the `IntegerOverflowMultiTxOneFuncFeasible` contract. The `count` variable is an unsigned integer, and the `run` function subtracts the `input` value from `count` without checking for overflows or underflows. This could lead to security vulnerabilities or incorrect contract behavior.

In the provided code, the `SafeMath` library is imported, but it is not used in the `IntegerOverflowMultiTxOneFuncFeasible` contract. Using `SafeMath` or similar libraries to check for overflows and underflows is a good practice to prevent such vulnerabilities.",arithmetic,3.0,568.0,6.0,3.0840537548065186
86,arithmetic," Yes, the smart contract code is vulnerable. The vulnerability lies in the `overflowaddtostate`, `overflowmultostate`, and `underflowtostate` functions in the `IntegerOverflowSingleTransaction` contract. The contract does not use a library like SafeMath to prevent overflows and underflows, so adding or multiplying a large input can result in an integer overflow or underflow. This can lead to security vulnerabilities and unintended behavior. The `overflowlocalonly`, `overflowmulocalonly`, and `underflowlocalonly` functions are also vulnerable, but they are local only and do not modify the contract state, so their impact is limited.

The `FileCoinCash` contract does not have any arithmetic operations that can result in integer overflows or underflows, so it is not vulnerable to the same type of vulnerability. However, it is always a good practice to use a library like SafeMath to prevent integer overflows and underflows in smart contract development.",arithmetic,4.0,631.0,6.0,3.0218043327331543
87,arithmetic," No, the second code is not vulnerable to the arithmetic vulnerability mentioned. The first code is vulnerable because it does not use a library like SafeMath to prevent integer overflows and underflows in the `transfer` function. However, the second code includes the SafeMath library and uses it in the `sub` function, which is used in the `transfer` function of the ERC20 contract. This prevents the integer overflow/underflow vulnerability.",arithmetic,3.0,522.0,6.0,3.2883996963500977
88,arithmetic," No, the provided code is not vulnerable to the 'arithmetic.sol' vulnerability. The inclusion of the SafeMath library in the contract ensures that arithmetic operations do not result in overflows or underflows. In this case, the 'add' function from SafeMath is used to perform the addition operation, which checks for and prevents overflows.",arithmetic,3.0,502.0,6.0,2.714522123336792
89,arithmetic," No, the second code is not vulnerable to the arithmetic overflow vulnerability. The second code includes the SafeMath library, which includes a sub function that checks if the input value is less than or equal to the current balance before performing the subtraction. This prevents the overflow condition from occurring. Therefore, the add function in the FileCoinCash contract will not result in an overflow.",arithmetic,3.0,507.0,6.0,2.6543636322021484
90,arithmetic," NO.

The provided code includes a library, SafeMath, which is used in the FileCoinCash contract. SafeMath is a library that provides arithmetic operations that include checks for overflows and underflows. In this case, the'sub' function is used in the FileCoinCash constructor to set the initial balances, and it uses SafeMath's'sub' function to perform the subtraction, which prevents integer overflows and underflows. Therefore, the FileCoinCash contract is not vulnerable to the type of vulnerability mentioned in the prompt.",arithmetic,1.0,541.0,6.0,2.5670366287231445
91,bad randomness," The smart contract code is vulnerable. The vulnerability lies in the line 35 of the PredictTheBlockHashChallenge contract, where the blockhash function is used to generate the 'answer'. The blockhash function is predictable and can be manipulated by miners, which makes it unsuitable for generating true randomness. This is the same vulnerability as pointed out in the first code snippet.",bad randomness,3.0,507.0,6.0,2.2073769569396973
92,bad randomness," Yes, the smart contract code is vulnerable due to the same reasons mentioned in the initial explanation. The contract is using block.number, block.coinbase, and block.difficulty for generating randomness, which are predictable and/or subject to miner's influence.

The vulnerabilities lie in lines:
- 13: uint public blockNumber = block.number;
- 72: address seed1 = contestants[uint(block.coinbase) % totalTickets].addr;
- 74: address seed2 = contestants[uint(msg.sender) % totalTickets].addr;
- 76: uint seed3 = block.difficulty;
- 127: blockNumber = block.number;
- 169: blockNumber = block.number;

These lines of code are using blockchain variables that are not truly random and can be manipulated by miners or predicted, making the contract's output vulnerable to attacks.",bad randomness,3.0,605.0,6.0,3.5227208137512207
93,bad randomness," The provided smart contract code is vulnerable due to the use of the `block.blockhash` function in the `rand` function. The `block.blockhash` function only returns the hash of the 256 most recent blocks, and it is predictable by miners. Therefore, using it for generating randomness is not secure. The vulnerability lies in lines 129-132 where `block.blockhash` is used to generate a ""random"" number.",bad randomness,3.0,522.0,6.0,3.3514556884765625
94,bad randomness," The first smart contract code is vulnerable, as stated in the prompt. The vulnerability lies in the generation of randomness for the `won` variable in the `makeBet()` function. The contract is determining the winner based on the parity of the current block number, which is predictable and can be manipulated by miners.

The second smart contract code is a different contract, not related to the first one. It is a token contract implementing the ERC20 standard. It does not contain any explicit randomness generation, so it is not vulnerable based on the provided information. However, it is important to note that the potential vulnerabilities in the token contract could still impact the lottery contract if they are used together.",bad randomness,4.0,571.0,6.0,2.269887685775757
95,bad randomness," NO, this contract is not vulnerable to the 'bad randomness' issue. The random number generation is the same as in the first contract, but this contract is not vulnerable because it is not used in a way that relies on its unpredictability. This contract does not have any function that relies on the random number generation for access control or other critical functionality. However, it still has the issue of using a predictable source of randomness, so it would not be a good idea to use this contract for applications that require true randomness.",bad randomness,3.0,539.0,6.0,2.2364020347595215
96,bad randomness," Yes, the smart contract code is vulnerable. The vulnerability lies in the following lines:

- `uint256 private salt = block.timestamp;`

The reason for this vulnerability is the same as explained before. The `block.timestamp` is not a reliable source of randomness as it can be manipulated by miners.

Moreover, the same function `random()` is defined in the `RandomNumberGenerator` contract and used in the `FileCoinCash` contract, which makes it susceptible to the same vulnerabilities.

Additionally, the `FileCoinCash` contract inherits from `StandardToken` contract, which in turn inherits from `BasicToken` and `ERC20` contracts. However, the `SafeMath` library is not used in the `FileCoinCash` contract, which can lead to integer overflow and underflow vulnerabilities.

Therefore, the `FileCoinCash` contract should use the `SafeMath` library to prevent integer overflow and underflow vulnerabilities, and use a more reliable source of randomness instead of `block.timestamp`.",bad randomness,4.0,637.0,6.0,4.198841571807861
97,reentrancy," Yes, the smart contract code is vulnerable to a reentrancy attack. The vulnerability lies in the `Collect` function, specifically at `if(msg.sender.call.value(_am)())`. This line allows for a call to an untrusted contract before the initial execution is complete, potentially changing the contract state in the middle of its execution.",reentrancy,3.0,503.0,6.0,2.715290069580078
98,reentrancy," Yes, the first smart contract code is vulnerable to a reentrancy attack. The `withdrawFunds` function uses `msg.sender.call.value(_weiToWithdraw)()` which allows for a call to an external contract before the initial execution is complete, potentially allowing an attacker to repeatedly call the function and drain the contract of funds.

No, the second smart contract code is not vulnerable to a reentrancy attack. The `withdrawFunds` function in the `EtherStore` contract is the same as in the first code, but this time it is not the only contract in the code. The second code includes several other contracts including `SafeMath`, `ERC20Basic`, `ERC20`, `BasicToken`, and `StandardToken`. The `FileCoinCash` contract inherits from `StandardToken` and does not override the `withdrawFunds` function. Therefore, the `withdrawFunds` function in the `EtherStore` contract is not called in the context of the `FileCoinCash` contract, and the potential for a reentrancy attack is eliminated.",reentrancy,3.0,649.0,6.0,4.451736688613892
99,reentrancy," Yes, the second smart contract code is also vulnerable to a reentrancy attack. The `Collect` function in the `DEP_BANK` contract calls an external contract (the token contract) using `msg.sender.call.value(_am)()`, which is a potential point of reentrancy. If the token contract is malicious or controlled by an attacker, it could call back into the `Collect` function before the balance of the sender has been updated, leading to a reentrancy attack.

The `Collect` function should use the `transfer` function of the ERC20 token contract instead of `call.value()` to transfer funds, which would prevent reentrancy attacks. Additionally, the contract should use a reentrancy guard pattern, such as the `Checks-Effects-Interactions` pattern, to ensure that the contract state is not modified before external calls are made.",reentrancy,4.0,610.0,6.0,4.592180967330933
100,reentrancy," NO, the provided code is not vulnerable to reentrancy attacks. The `withdraw` function uses the `call.value(_amount)()` function, which is a low-level function that forwards Ether to an address and executes a given function. This function does not allow for the contract to call external contracts before the initial execution is complete, thus preventing reentrancy attacks. However, it is still recommended to use the `transfer` function instead of `call.value()` for safety reasons.

It is important to note that the code provided is a combination of different contracts, including a SafeMath library, ERC20Basic, ERC20, BasicToken, StandardToken, and FileCoinCash. The FileCoinCash contract is the only one that inherits from the other contracts and is the only one that includes the `withdraw` function. Therefore, the reentrancy audit should only be performed on the FileCoinCash contract.",reentrancy,1.0,618.0,6.0,3.117039203643799
101,reentrancy," Yes, the first smart contract code is vulnerable to a reentrancy attack. The `withdraw` function uses `msg.sender.call.value(amount)()` which allows for a call to an external contract before the initial execution is complete, potentially changing the contract state in the middle of its execution.

No, the second smart contract code is not vulnerable to a reentrancy attack. The `withdraw` function in the first contract has been replaced with a function that transfers the token using the `transfer` function from the ERC20 token standard, which does not allow for external calls.",reentrancy,4.0,550.0,6.0,2.471247911453247
102,reentrancy," Yes, the given code is vulnerable to a reentrancy attack. The vulnerability lies in the `Collect` function where the contract calls an external contract (`msg.sender`) before the internal state has been updated. This allows for the possibility of the external contract calling back into the `Collect` function, causing an unchecked state change and potential security vulnerability. Specifically, the line `if(msg.sender.call.value(_am)())` is the culprit, as it allows for the external contract to call back into the `Collect` function and potentially drain the contract of funds.",reentrancy,3.0,548.0,6.0,2.8111493587493896
103,reentrancy," Yes, the first contract code is vulnerable to a reentrancy attack. The `Collect` function calls `msg.sender.call.value(_am)()` which can allow an attacker to make another call to the `Collect` function before the current call is finished, draining the contract of funds.

The second contract code is not vulnerable to a reentrancy attack because it does not use the low-level `call` function to transfer funds. Instead, it uses the `transfer` function from the ERC20 token standard, which does not allow for additional calls to be made before the current call is finished. However, it is important to note that the ERC20 token standard itself is not immune to reentrancy attacks, and care must be taken when implementing it.",reentrancy,4.0,587.0,6.0,3.9018518924713135
104,reentrancy," The first contract is vulnerable to a reentrancy attack, as explained in the provided information. The second contract is not vulnerable in the provided code snippet, because there is no function that calls an external contract before the initial execution is complete, as would be necessary for a reentrancy attack. However, it is important to note that the provided code snippet is a part of a larger contract, and the rest of the contract should also be analyzed for potential vulnerabilities.",reentrancy,3.0,528.0,6.0,2.4804611206054688
105,reentrancy," Yes, the first code is vulnerable to a reentrancy attack. The `Collect` function calls `msg.sender.call.value(_am)()` which can allow an attacker to call the `Collect` function again before the initial execution is complete, changing the contract state in the middle of execution.

The second code is not vulnerable to a reentrancy attack because it does not use the low level `call` function to transfer funds. Instead, it uses the `transfer` function from the ERC20 token standard, which does not allow for external contract calls before the initial execution is complete.",reentrancy,3.0,553.0,6.0,6.745914936065674
106,reentrancy," Yes, the first code is vulnerable to a reentrancy attack. The `Collect` function calls `msg.sender.call.value(_am)()` without checking its return value, which means it won't detect if the call resulted in a reentrancy attack. This can lead to an attacker repeatedly calling the `Collect` function and draining the contract of funds.

The second code is not vulnerable to a reentrancy attack, as it does not use the low-level `.call` function. Instead, it uses the `transfer` function from the ERC20 token standard, which includes checks against reentrancy attacks. However, it is important to note that the code still needs to be checked for other potential vulnerabilities.",reentrancy,4.0,577.0,6.0,2.8561816215515137
107,reentrancy," Yes, the smart contract code is vulnerable to a reentrancy attack. The vulnerability lies in the `Collect` function where `msg.sender.call.value(_am)()` is called before updating the balance of the sender. This allows for the possibility of reentrant calls, where the called contract can call back into the `Collect` function, causing unintended behavior and potential security vulnerabilities.",reentrancy,3.0,511.0,6.0,2.1739511489868164
108,reentrancy," Answer:

NO, the second code snippet is not vulnerable to the reentrancy attack based on the provided code. The reason is that it does not contain any external calls in a function that modifies the contract's state, which is a necessary condition for a reentrancy attack. However, it is always a good practice to use the `transfer` function instead of `call` for value transfer to avoid potential vulnerabilities.",reentrancy,1.0,519.0,6.0,2.3967394828796387
