case_id,vuln_type,audit_report,input_token_num,output_token_num,inference_time
80,arithmetic," Yes, the provided code is vulnerable to integer underflow. The vulnerability exists in the `run` function where `count` is decremented by the `input` value without checking for underflow. If `input` is a large number, it could result in an integer underflow, causing the `count` variable to wrap around and become a very large number. This could lead to security vulnerabilities or unintended behavior in the contract. The `transfer` function does not seem to have this specific vulnerability, but it has other issues such as using `.call` which could lead to reentrancy attacks.",539,129,11.92565393447876
81,arithmetic," The answer is YES, the smart contract code is vulnerable. The vulnerability lies in the `transfer` function:

1. The function uses `call` to execute a function of another contract, which is potentially dangerous and can lead to reentrancy attacks.
2. The function does not check the return value of `call`, which means it does not check if the execution was successful or not.
3. The function does not have any checks for the `tos` and `vs` arrays, which means that an attacker can pass an arbitrary number of addresses and values, potentially leading to integer overflows or underflows.

Therefore, the `transfer` function needs to be modified to include proper checks and protections against potential attacks.",844,159,14.587508201599121
82,arithmetic," The answer is YES, the smart contract code is vulnerable.

The vulnerability lies in the `transfer` function:

1. In line 18: `contract_address.call(id, msg.sender, tos[i], vs[i]);`

This line uses the low-level `.call` function, which is dangerous because it can allow arbitrary code execution and make the contract susceptible to reentrancy attacks. It also does not check for overflows or underflows in the calculation of `vs[i]`, which can lead to integer overflows or underflows.

Additionally, the function does not check the return value of the `.call` function, which can lead to unchecked return values and make the contract vulnerable to further attacks.

The function also does not check if the `tos` array contains valid addresses, making it vulnerable to attacks that use invalid addresses.

Therefore, the `transfer` function is vulnerable to integer overflows, underflows, reentrancy attacks, and unchecked return values.",974,232,21.054038047790527
83,arithmetic," Yes, the second smart contract code is also vulnerable due to the lack of overflow and underflow checks in the line:

`count -= input;`

Just like in the first contract, an integer overflow or underflow in this line could lead to security vulnerabilities. The `transfer` function, although it has some access control with the `validAddress` modifier, does not check for overflows or underflows in the `run` function it calls. Therefore, it is still susceptible to the same vulnerability type as the first contract: 'arithmetic.sol'.",647,123,11.412755966186523
84,arithmetic," Yes, the provided smart contract code is vulnerable. The vulnerability exists in the `transfer` function. The `call` function used in the `transfer` function can allow the contract at `contract_address` to execute arbitrary code, potentially leading to an arithmetic overflow or underflow if the code contains such a vulnerability. This can result in a security risk. The `run` function in this contract also has the same issue as the previous contract, where it does not check for underflow or overflow in the `uint res = count - input;` line.",550,118,11.008986711502075
85,arithmetic," The answer is yes, the second smart contract code is also vulnerable. The vulnerability exists in the `transfer` function. The `call` function used in the `transfer` function can allow the contract at `contract_address` to execute arbitrary code, which can include function calls that modify the state of the `IntegerOverflowMultiTxOneFuncFeasible` contract. This can lead to integer overflows or underflows if the `transferFrom` function of the contract at `contract_address` does not handle these cases correctly. The `transfer` function also does not check the return value of the `call` function, which can lead to the contract continuing execution even if the `call` failed, potentially leading to inconsistent state.

The vulnerability in the `run` function also still exists, as it does not check for underflow or overflow when decrementing the `count` variable.",627,189,17.17923378944397
86,arithmetic," Yes, the second smart contract code is also vulnerable to integer overflows and underflows. The vulnerabilities exist in the same lines as in the first contract, specifically in the functions: overflowaddtostate, overflowmultostate, underflowtostate, overflowlocalonly, overflowmulocalonly, and underflowlocalonly. The transfer function does not seem to have any arithmetic operations, but the state variables can still be modified by calling the aforementioned functions.

The reason the first contract is vulnerable is that Solidity does not handle overflow and underflow situations for unsigned integers. When a value exceeds its maximum value, it wraps around and starts from the minimum value. For example, if a uint256 variable with a value of 2^256-1 (the maximum value) is incremented by 1, it will result in 0 instead of an error. Similarly, if a uint256 variable with a value of 1 is decremented by 1, it will result in 2^256-1 instead of 0.

In the context of the provided code, if input is a large enough value, it can cause an overflow or underflow in the count variable, leading to unintended behavior and potential security issues.",968,276,24.819000482559204
87,arithmetic," The answer is YES, the provided smart contract code is vulnerable.

The vulnerability lies in the `transfer` function within the `transfer` method:

`contract_address.call(id, msg.sender, tos[i], vs[i]);`

Using the low-level `.call()` function can potentially introduce several vulnerabilities, including reentrancy attacks and the loss of ether. In this case, it can also lead to integer overflows and underflows due to the lack of proper checks.

The `.call()` function can allow the recipient contract to execute arbitrary code, which can include malicious code that takes advantage of integer overflows and underflows.

Additionally, the `require` statement `require(balances[msg.sender] - _value >= 0);` does not provide complete protection against integer overflows and underflows. It is still possible for the subtraction to result in a negative value due to an overflow or underflow.

Therefore, it is recommended to avoid using the low-level `.call()` function and instead use the safer `transfer` function or implement a custom function with proper checks to prevent integer overflows and underflows.",811,269,24.257216691970825
88,arithmetic," Yes, the provided code is vulnerable to integer overflow. The vulnerability exists in the `run` function where the value of `count` is incremented by `input` without checking for overflow:

```solidity
function run(uint256 input) public {
    count += input;
}
```

The `transfer` function does not seem to introduce new vulnerabilities directly related to integer overflows or underflows, but it does use `.call` which can introduce other security risks.

However, the question asked specifically about integer overflows and underflows, so my answer addresses only that issue.",537,138,12.695131301879883
89,arithmetic," Yes, the provided code is vulnerable to integer overflows and underflows. The function `add` in line 14 does not have checks to prevent an overflow or underflow from occurring when adding the `value` to `sellerBalance`. This could lead to security vulnerabilities or incorrect contract behavior.

Additionally, the `transfer` function has a potential security vulnerability. It calls an external contract's function `transferFrom` without checking its return value, which could result in the contract continuing execution even if the external function call fails. This could lead to security vulnerabilities if the external contract's state is not updated as expected.

Furthermore, the `transfer` function uses `call` to execute an external contract's function without checking its return value, which could result in the contract continuing execution even if the external function call fails. This could lead to security vulnerabilities if the external contract's state is not updated as expected. It is recommended to use the `transfer` function or the checked pattern to ensure the safety of the contract.

In summary, the code is vulnerable to integer overflows and underflows, and it has potential security vulnerabilities in the `transfer` function. It is recommended to modify the code to include checks to prevent overflows and underflows, and to add checks for external function call return values to ensure the safety of the contract.",561,295,26.60253095626831
90,arithmetic," Yes, the second smart contract code is also vulnerable. The vulnerability exists in the `transfer` function within the `call` method here: `contract_address.call(id, msg.sender, tos[i], vs[i]);`. This allows for a reentrancy attack, where `contract_address` could be a malicious contract, manipulating the `balanceOf` variable before the `transfer` function has finished executing. This could lead to an arithmetic overflow or underflow, causing a security risk.",628,112,10.476480484008789
91,bad randomness," The answer is yes, the contract is vulnerable due to the use of block.number as a source of randomness in the lockInGuess function. An attacker could manipulate the block.number by mining a new block with a specific number.

Additionally, the transfer function is unsafe as it uses the low-level call function without checking the return value, which could result in the contract continuing execution even if the call to the other contract failed. This could lead to the contract being stuck if the called contract throws an error. The use of the ""send"" function instead, which automatically reverts if the call fails, would be safer.",981,134,12.469197988510132
92,bad randomness," Yes, the smart contract code is vulnerable due to the following reasons:

1. The `blockNumber` variable is declared as a public variable and is set to `block.number` in the constructor. This means that it will store the number of the block in which the contract was deployed and will not change for the duration of the contract's life. This can lead to vulnerabilities as it reduces the randomness of the contract.
2. The `chooseWinner` function uses `block.coinbase`, `msg.sender`, and `block.difficulty` to generate the random number used to choose the winner. However, `block.coinbase` is the address of the miner who mined the block and is not truly random. `msg.sender` is the address of the user who initiated the function call and is also not random. `block.difficulty` can be influenced by miners and is not truly random. Therefore, the random number generated in this way is not truly random and can be manipulated by attackers.

Therefore, the smart contract is vulnerable to attacks due to the lack of true randomness in the generation of the random number used to choose the winner.",3084,254,23.44065284729004
93,bad randomness," NO, the provided code for the LuckyDoubler contract does not contain the same vulnerability related to randomness on lines 127, 128, 129, and 130 as the first contract. The function 'transfer' and its related code are different and unrelated to the issue of randomness. However, I would like to point out that the 'transfer' function is potentially unsafe because it uses 'call' and does not include any error handling. If any of the called contracts throw an exception or fail, the execution will continue, potentially causing issues. It is recommended to use the 'transfer' function from OpenZeppelin or another secure implementation instead.",3335,147,14.073511600494385
94,bad randomness," NO, the second code snippet is not vulnerable to the same issue as the first one. The first code snippet has a vulnerability because it uses the block number to determine if the bet is won, which is predictable and can be manipulated by miners. The second code snippet, on the other hand, does not have this vulnerability because it does not use the block number to determine the outcome of the bet. However, it is always important to thoroughly test and audit smart contract code to ensure that there are no other vulnerabilities.",1134,113,10.619825601577759
95,bad randomness," Yes, the second smart contract code is also vulnerable.

The vulnerability lies in the `transfer` function:

1. The function calls an external contract's function (`transferFrom`) without checking its return value. This can lead to the reentrancy attack.
2. The function uses `call` to execute an arbitrary function on an external contract, which can lead to a contract being vulnerable to an Ether delta attack.

The `transfer` function should check the return value of the `call` to ensure that the external function executed successfully. Additionally, it is recommended to use the `transfer` function from the OpenZeppelin library, which includes checks for reentrancy and Ether delta attacks.",805,153,14.053358316421509
96,bad randomness," Yes, the smart contract code is vulnerable. The vulnerability lies in the `transfer` function that uses `.call` to call an external function. This can allow for arbitrary code execution and is a re-entrancy attack vector. Additionally, the `random` function has the same vulnerabilities as the previous contract, with the salt value being predictable and used in a way that can be manipulated by miners.",878,87,8.324402570724487
97,reentrancy," Answer:

Yes, the smart contract code is vulnerable to a reentrancy attack. The vulnerability lies in the line 29 of the `W_WALLET` contract:

`if(msg.sender.call.value(_am)())`

This line allows a call to the `msg.sender` contract before the initial execution is complete, which can lead to a reentrancy attack. The contract state can change in the middle of its execution due to the call to the external contract, which is a potential security risk.",1395,117,11.018097639083862
98,reentrancy," The answer is YES, the smart contract code is vulnerable to a reentrancy attack. The vulnerability exists in the `transfer` function, specifically in the line:

`contract_address.call(id, msg.sender, tos[i], vs[i]);`

By using the low-level `call` function, the contract allows external contracts to make new calls to the calling contract before the initial execution is complete. This can lead to a reentrancy attack, where the external contract changes the contract state in the middle of its execution, leading to potential security issues.",930,125,11.6293625831604
99,reentrancy," Yes, the first contract code is vulnerable to a reentrancy attack. The vulnerability lies in the `Collect` function, specifically in the line `if(msg.sender.call.value(_am)())`. This line allows for a call to an untrusted contract before the initial execution is complete, potentially changing the contract state in the middle of execution.

For the second contract code, the answer is 'No', it is not vulnerable to a reentrancy attack in its current form. The `transfer` function in the `LogFile` contract uses the `call` function with a `bytes4` type, which is not vulnerable to a reentrancy attack. However, it is important to note that the `transfer` function has other potential issues, such as the lack of error handling and the use of `call` instead of the safer `transfer` or `delegatecall`.",1467,186,17.113231658935547
100,reentrancy," The answer is:

Yes, the smart contract code is vulnerable.

The vulnerability lies in the `transfer` function which calls an external contract using `call` without checking its return value. This allows for a reentrancy attack similar to the one in the initial contract. The `withdraw` function also has the same vulnerability, but it is also present in the `transfer` function which is a new function compared to the initial contract.",822,95,8.967081069946289
101,reentrancy," The answer is yes, the second smart contract code is also vulnerable to a reentrancy attack. The vulnerability exists in the `transfer` function, specifically in the line where `contract_address.call(id, msg.sender, tos[i], vs[i])` is called. This line allows for external contract calls, which, if made to an untrusted contract, could result in a reentrancy attack. The `transfer` function does not check the credit of the `tos[i]` address before making the call, making it susceptible to an attacker repeatedly calling the function and draining the contract of funds. The `withdraw` function also has the same vulnerability, as mentioned earlier in the guide.",758,155,14.203006744384766
102,reentrancy," Yes, the given smart contract code is vulnerable to reentrancy attacks. The vulnerability lies in the `Collect` function, specifically at `msg.sender.call.value(_am)()`. This allows for a call to an external contract before the initial execution is complete, potentially allowing the external contract to call back into the `Collect` function and draining the contract of funds. This is the same vulnerability present in the initial code provided.

The `transfer` function in the `Log` contract, when used with a valid address, does not directly introduce any new reentrancy vulnerabilities to the `MY_BANK` contract. However, the `transfer` function itself is vulnerable to reentrancy attacks due to the use of `call` without proper checks.",1391,162,14.988212585449219
103,reentrancy," Yes, the smart contract code is vulnerable to a reentrancy attack. The vulnerability lies in the `Collect` function where `msg.sender.call.value(_am)()` is called before updating the balance of the sender. This allows for the possibility of the caller to call the `Collect` function again before the balance has been updated, leading to a reentrancy attack.",1601,81,7.9382569789886475
104,reentrancy," The answer is yes, the smart contract code is vulnerable to a reentrancy attack. The vulnerability exists in the `transfer` function, specifically in how it calls the `contract_address` with the `call` function. This allows for the called contract to call back into the `withdrawReward` function before the initial execution is complete, leading to a reentrancy attack. The `transfer` function should use the `transfer` function instead of the low-level `call` function to prevent this attack.",913,108,10.155149221420288
105,reentrancy," Answer:

Yes, the first contract code is vulnerable to a reentrancy attack. The vulnerability lies in the `Collect` function, specifically in the line `if(msg.sender.call.value(_am)())`. This line allows for a call to an untrusted contract before the initial execution is complete, potentially changing the contract state in the middle of execution.

The second contract code, however, does not have the same vulnerability. It has a `validAddress` modifier that checks for invalid addresses, and its `transfer` function uses this modifier to ensure that the address being called is valid. This helps prevent reentrancy attacks by ensuring that the contract state is not changed in the middle of execution.",1597,154,14.393206357955933
106,reentrancy," Answer:

Yes, the first contract code is vulnerable to a reentrancy attack. The vulnerability lies in the `Collect` function, specifically in the line `if(msg.sender.call.value(_am)())`. This line allows for a call to an untrusted contract before the initial execution is complete, which is a potential security risk.

The second contract code is not vulnerable to a reentrancy attack, as it does not allow for external contract calls before the initial execution is complete. However, it is important to note that the `transfer` function in the `LogFile` contract is not secure and should not be used as is. It does not check the return value of the low-level `call` function, which can result in the contract continuing execution even if the called function fails. This can lead to security vulnerabilities.",1577,179,16.52564263343811
107,reentrancy," Answer:

Yes, the smart contract code is vulnerable to a reentrancy attack. The vulnerability lies in the line 29 of the `X_WALLET` contract:

`if(msg.sender.call.value(_am)())`

The `call.value` function is used to send ether to the `msg.sender` address, but it also allows the called contract to execute code. If `msg.sender` is an untrusted contract, it can call back into the `Collect` function before the state of the `X_WALLET` contract has been updated, leading to a reentrancy attack.

The `transfer` function in the `Log` contract also uses the low-level `call` function, which can be a potential security risk if not used carefully. It is recommended to use the safer `transfer` function or the `send` function instead, which automatically reverts if the call fails.",1395,205,18.72633409500122
108,reentrancy," The first smart contract code is vulnerable, as it uses `.call.value()()` without proper checks, which makes it susceptible to a reentrancy attack.

For the second smart contract code, the `transfer` function in `TokenBank` contract uses `call` with proper checks, but the `WithdrawToHolder` function still has the same issue as in the first contract. So, the answer is 'YES', it is vulnerable due to the `WithdrawToHolder` function's `.call.value()()` usage without proper checks.",1521,121,11.388928413391113
109,reentrancy," Answer:

Yes, the first smart contract code is vulnerable to a reentrancy attack. The vulnerability lies in the `airDrop()` function of the `ModifierEntrancy` contract. The function increases the token balance of the sender without checking if the sender has already received tokens in a previous call. This allows an attacker to repeatedly call the function and drain the contract of tokens.

The `attack` contract in the code demonstrates how an attacker can exploit this vulnerability. The `supportsToken()` function in the `attack` contract calls the `airDrop()` function in the `ModifierEntrancy` contract, allowing the attacker to receive tokens. The `transfer()` function in the `attack` contract can then be used to repeatedly call the `airDrop()` function and drain the contract of tokens.

The second smart contract code is not vulnerable to a reentrancy attack because the `transfer()` function uses the `call()` function to execute external contracts, which prevents the contract from being called again before the initial execution is complete. However, it is still important to ensure that the external contract being called is not vulnerable to a reentrancy attack.",1110,256,23.145965337753296
110,reentrancy," Yes, the smart contract code is vulnerable to a reentrancy attack. The vulnerability lies in the `CashOut` function, specifically in the line `if(msg.sender.call.value(_am)())`. This line allows for a call to be made to the sender's contract before the current execution is complete, which can lead to the contract state being changed in the middle of execution. This is exactly what happens in a reentrancy attack.",1357,97,9.260982513427734
111,reentrancy," Yes, the smart contract code is vulnerable to a reentrancy attack. The vulnerability lies in the `Collect` function where `msg.sender.call.value(_am)()` is called before updating the balance. This allows for the possibility of reentering the `Collect` function before the balance has been updated, potentially leading to unintended consequences such as infinite recursion or unauthorized token transfers. To fix this, the `balances[msg.sender] -= _am` statement should come before the `call.value(_am)()` statement.

Regarding the second contract, the `transfer` function is not vulnerable to a reentrancy attack as it is, because it uses the low-level `.call` method with explicit addresses and does not modify the contract state before executing the external call. However, it is important to note that the function `transfer` is not checking the return value of the external call, which could lead to issues if the called contract throws an exception. Additionally, the function `transfer` is not checking the input parameters, which could lead to potential security issues if the called contract has a malicious implementation.",1569,243,22.167992115020752
112,reentrancy," The answer is YES, the smart contract is vulnerable to a reentrancy attack. The vulnerability exists in the `transfer` function, specifically in the line where the contract address calls the `transferFrom` function using `call`:

`contract_address.call(id, msg.sender, tos[i], vs[i]);`

This allows the called contract to make another call before the initial execution is complete, potentially changing the contract state in the middle of the execution. This is similar to the vulnerability in the initial code provided.",793,118,11.009907484054565
