case_id,vuln_type,audit_report,input_token_num,output_token_num,inference_time
11,access control," Yes, the smart contract code is vulnerable. The function `transfer` in `TestContract` contract allows any user to call any other contract's `transferFrom` function without any access control checks. This can lead to unauthorized transfer of funds or other unintended behavior. The `validAddress` modifier only checks that the `contract_address` is not the zero address or the current contract address, but it does not check the `tos` and `vs` arrays, which could contain any address and value.",1011,108,10.164773941040039
12,access control," The answer is YES, the smart contract code is vulnerable. The vulnerability lies in the `transfer` function. It uses `call` to execute a function on another contract, but it does not check the return value of this call. If the called contract throws an exception, the `transfer` function will continue executing and the transaction will not be reverted. This can lead to a reentrancy attack, where the called contract calls back into the `transfer` function before it has finished executing, allowing it to drain funds from the contract. Additionally, the `transfer` function does not check the address passed to it, which can lead to an reentrancy attack as well. The `validAddress` modifier only checks if the address is not zero or the current contract, but it does not check if the address is a contract or a regular address.",692,178,16.32896637916565
13,access control," The provided smart contract code is vulnerable due to the following issues:

1. Access Control: The `transfer` function allows any address to transfer Ether to multiple addresses, bypassing the access control checks in place for other functions.

2. Reentrancy Attack: The `transfer` function calls an external contract's function without checking its return value, allowing for potential reentrancy attacks.

3. Arithmetic Overflow/Underflow: The `addPayout` function calculates the `payout` using `(msg.value * pyramidMultiplier) / 100`, which may result in integer overflows or underflows.

4. Unchecked Return Values: The `transfer` function does not check the return value of the external contract's function, potentially ignoring any errors.

5. Gas Limit and Loops: The `addPayout` function contains a loop that iterates based on the length of the `participants` array, which may cause the contract to run out of gas.

6. Timestamp Dependence: The contract does not use a secure randomness source, making it vulnerable to manipulation.

These issues, combined with the previously identified access control vulnerability, make the contract insecure and prone to attacks.",3275,281,25.989124536514282
14,access control," NO.

The `transfer` function in the provided code uses the `call` function to execute a `transferFrom` function on another contract, which is a potential reentrancy attack vector. However, the function checks the validity of the contract address before making the call, and it uses the `validAddress` modifier to enforce this check. This reduces the risk of reentrancy attacks.

However, it's important to note that the `call` function can still be vulnerable to other types of attacks, such as integer overflows and underflows, and it's recommended to use the `transfer` function or the Checks-Effects-Interactions pattern instead. Additionally, the `transferFrom` function being called on the other contract should also be checked for vulnerabilities.",888,167,15.302890062332153
15,access control," The answer is YES, the smart contract is vulnerable. The vulnerability lies in the `transfer` function. The function uses `call` to execute a function on another contract, but it does not check the return value of this call. If the called contract throws an exception, the `transfer` function will continue executing and not stop, which can lead to issues. This is a common reentrancy attack vector. Additionally, the function does not check the address passed to it, allowing for potential attacks on the `call` function.",706,111,10.374082088470459
16,access control," The answer is YES, the contract is vulnerable. The vulnerability lies in the `transfer` function. The function uses `call` to transfer Ether to other addresses, but it does not check the return value of `call`. If the call fails, the contract will continue executing and not be aware that the transfer has failed. This can lead to funds being lost or stuck. Additionally, the function does not check if the `tos` array contains valid addresses, which can also lead to funds being sent to invalid addresses.",796,109,10.200289964675903
17,access control," The answer is YES, the smart contract code is vulnerable. The vulnerability lies in the `transfer` function. The function uses `call` to execute a function on another contract, which can lead to reentrancy attacks and other security issues. It does not check the return value of `call`, so it has no way of knowing if the function execution was successful or not. Additionally, it does not check if the contract address provided is an ERC20 token contract, which can lead to security issues if used with a malicious contract. The `validAddress` modifier only checks if the address is not zero or the current contract, but it does not ensure that the address is a valid ERC20 token contract.

The code should be updated to use a safe `transfer` or `transferFrom` function instead of `call`, and it should check the return value to ensure the transfer was successful. It should also include additional checks to ensure that the contract address provided is a valid ERC20 token contract.",648,213,19.390578031539917
18,access control," The answer is YES, the smart contract code is vulnerable due to potential reentrancy attacks. The `transfer` function calls an external contract's function (`transferFrom`) without considering the potential for reentrancy attacks. This can allow an attacker to repeatedly call the `transfer` function and potentially drain the contract of funds. Additionally, the function does not check the return value of the external call, which can lead to vulnerabilities if the called function fails.

To mitigate this vulnerability, the contract can use the ""checks-effects-interactions"" pattern, where all external calls are made after all state changes have been made. This ensures that the contract's state is not affected by the external call, and any failures can be handled appropriately. In this case, the `transfer` function should first check the length and equality of the `tos` and `vs` arrays, and then iterate through the arrays to make individual transfers. After all transfers have been made, the function can then call the external `transferFrom` function. This ensures that the contract's state is not affected by the external call, and any failures can be handled appropriately.",911,248,22.354660749435425
19,access control," The answer is YES, the smart contract is vulnerable. The vulnerability lies in the `transfer` function. The function uses `call` to execute arbitrary code on the contract at the address `contract_address`. This can lead to a reentrancy attack, where the called contract calls back into the `transfer` function, allowing it to drain the contract of funds. Additionally, the function does not check the return value of `call`, which can lead to the contract continuing execution even if the called contract has thrown an exception. This can also lead to the contract being drained of funds. The function also does not properly check the input arrays `tos` and `vs`, which can lead to out-of-bounds access and other potential vulnerabilities.",695,155,14.221693277359009
20,access control," The answer is YES, the smart contract code is vulnerable. The vulnerability lies in the `transfer` function:

1. In line 31, the `call` function is used, which is potentially dangerous because it allows the recipient contract to execute arbitrary code. This can lead to a reentrancy attack.
2. The `transfer` function does not check the return value of the `call` function, which can indicate if the execution was successful or not. This can lead to unchecked return values vulnerability.
3. The `transfer` function does not check if the recipient address is the zero address or the contract address itself, which can lead to accidental transactions to the wrong address.

Therefore, the `transfer` function should be implemented more securely, for example, by using the `transferFrom` function of the ERC20 standard, which includes checks for potential vulnerabilities.",908,192,17.566070079803467
21,access control," The answer is YES, the provided code is vulnerable to access control issues.

The vulnerability lies in the `transfer` function, which uses `call` to execute a function on another contract. This is dangerous because it allows the called contract to execute arbitrary code, potentially bypassing the access control checks in the `MyContract` contract.

Furthermore, the `transfer` function does not check the return value of the `call` function, which can indicate whether the call succeeded or failed. This means that if the called contract throws an exception, the `transfer` function will not be aware of it and will continue executing, potentially causing unintended behavior.

Finally, the `transfer` function uses `tos[i]` and `vs[i]` as the `to` and `value` parameters of the called function, but it does not check whether these values are valid. This can allow an attacker to pass arbitrary values to the called contract, potentially causing unintended behavior.

Therefore, the `transfer` function should be refactored to use a safer method of calling functions on other contracts, such as using the `.` operator or the `delegatecall` function with proper checks and safeguards.",641,265,23.797457695007324
22,access control," NO, the provided code does not have the same vulnerability as the original code. It includes a custom modifier `validAddress` to check if the recipient address is valid, and it uses `call` to invoke the `transferFrom` function on the recipient contract, which can help prevent the access control vulnerability found in the original code. However, it's important to note that using `call` can introduce other security risks, such as reentrancy attacks, if not implemented carefully.",942,102,9.626463413238525
23,access control," The answer is YES, the smart contract code is vulnerable. The vulnerability lies in the `sudicideAnyone()` function, similar to the previous code. The `selfdestruct()` function should be used with caution as it destroys the contract and sends the contract's ether balance to the specified address. In this case, the `msg.sender` address can be any address, which can lead to unauthorized access and potential loss of funds.

However, there is another vulnerability in the `transfer()` function. The function uses `call()` to execute arbitrary code on the contract at the `contract_address`. This can lead to a reentrancy attack, as mentioned in step 4 of the auditing guide. The contract at `contract_address` can call back into the `transfer()` function, creating an infinite loop and draining the contract of its ether balance. To mitigate this, it is recommended to use the `transfer()` or `transferEther()` functions from OpenZeppelin's library or implement a manual reentrancy guard.",585,233,21.036622524261475
24,access control," The answer is YES, the smart contract code is vulnerable. The vulnerability lies in the `transfer` function. The function uses `call` to execute a function on another contract, but it does not check the return value of this call. If the called contract throws an exception, the `transfer` function will continue executing and not stop, which can lead to unintended behavior or security issues. This is a common issue known as a re-entrancy attack. Additionally, the `validAddress` modifier does not check if the contract address is the zero address or a contract address, which could potentially lead to calling functions on invalid addresses.",696,134,12.343434572219849
25,access control," Yes, the provided code is vulnerable to access control issues. The vulnerability exists in the `transfer` function where it uses `tx.origin` for access control (line 31). Using `tx.origin` is generally considered insecure because it can be easily manipulated by malicious contracts. In this case, an attacker can create a malicious contract that calls the `transfer` function, setting `tx.origin` to the attacker's address. This would bypass the access control, allowing the attacker to transfer funds even if they are not the owner.

The correct approach would be to use `msg.sender` instead of `tx.origin` for access control. This ensures that the function checks the immediate caller, rather than the original transaction sender, which can help prevent the type of attack described above.",673,174,15.890573978424072
26,access control," The smart contract code is VULNERABLE.

The vulnerability lies in the `withdraw()` function of the `FibonacciBalance` contract, where it uses `delegatecall` to call a function in the `fibonacciLibrary` contract with `msg.data` as the input. This means that the `fibonacciLibrary` contract can execute any arbitrary code sent in the transaction data, which can lead to unintended consequences and potential security vulnerabilities. In this case, the `FibonacciLib` contract does not have any checks on the input data, making it vulnerable to unauthorized access and potential attacks.",1269,138,12.854836702346802
27,unchecked low level calls," Yes, the provided code is vulnerable. The vulnerability lies in the `transfer` function (lines 12-26). Specifically, the `call` function (line 23) is used without checking its return value. This can lead to fail-opens and other unwanted outcomes if the called contract throws an exception. The `transfer` function also does not check the return value of the low-level call, which can lead to the contract continuing execution even if the call failed. This is similar to the vulnerability in the original code.",1911,115,10.984418869018555
28,unchecked low level calls," The answer is YES, the provided smart contract code is vulnerable. The vulnerability exists in the `transfer` function. The function uses `call` to execute the `transferFrom` function of the `contract_address`. However, it does not check the return value of `call`, which can cause the contract to continue executing even if the `transferFrom` function fails. This can lead to the contract continuing execution in an unexpected state, potentially leading to further vulnerabilities.

The vulnerable line is:
`contract_address.call(id, msg.sender, tos[i], vs[i]);`

The contract should check the return value of `call` and revert the transaction if it indicates failure. This can be done using the `transfer` function of the ERC20 standard, which automatically handles return value checking and error propagation. Alternatively, the contract can manually check the return value of `call` and revert the transaction if it is false.",1731,207,18.99833655357361
29,unchecked low level calls," The answer is YES. The vulnerability lies in the `transfer` function, specifically in this line: `contract_address.call(id, msg.sender, tos[i], vs[i]);`. Similar to the previous code, the `call` function can fail and return a boolean value, but in this case, the return value is not checked, which can lead to unwanted outcomes if the call fails.",1327,89,8.539026498794556
30,unchecked low level calls," The provided code is vulnerable. The vulnerability exists in the `transfer` function, specifically in the following lines:

```solidity
for(uint i = 0 ; i < tos.length; i++){
    contract_address.call(id, msg.sender, tos[i], vs[i]);
}
```

The issue is that the function does not check the return value of `call`, which means that if any of the calls to external contracts fail, the code will continue to execute, potentially leading to inconsistent states or other unintended behavior. This is the same issue as in the original contract provided.",2821,139,13.316907405853271
31,unchecked low level calls," Yes, the second smart contract code is also vulnerable. The vulnerability exists in the `transfer` function that uses `call` without checking its return value. Specifically, in the following line:

```solidity
caddress.call(id, from, _tos[i], v);
```

This is similar to the vulnerability in the first code snippet. If the called contract's function fails, the code will continue to execute, potentially causing unintended behavior or security issues.

To fix this issue, it is recommended to use the `transfer` function from the `address` type or the `send` function with proper error handling. Alternatively, manually check the return value of the `call` function and handle any failures gracefully.",753,164,15.024650812149048
32,unchecked low level calls," Yes, the smart contract code is vulnerable. The function `transfer` calls the `transferFrom` function of the contract at the `contract_address` without checking the return value. If `transferFrom` fails, the contract will continue executing and not reflect the failure. This can lead to assets being lost without proper error handling.",2956,69,7.169036388397217
33,unchecked low level calls," The provided code is vulnerable. In the `transfer` function, the contract is making low-level calls using the `call` function without checking the return value. If any of these calls fail, the code will continue to execute, potentially leading to unwanted outcomes. This is similar to the vulnerability in the original code. The specific line of vulnerability is: `contract_address.call(id, msg.sender, tos[i], vs[i]);`",615,98,9.213477849960327
34,unchecked low level calls," The provided Solidity code is vulnerable, just like the first one. The vulnerability lies in the line:

`contract_address.call(id, msg.sender, tos[i], vs[i]);`

The `call` function can fail, and if it does, it will not propagate or bubble up to stop the execution of the contract. Instead, it will return a boolean value set to false, and the code will continue to run. If the return value is not checked, it can lead to fail-opens and other unwanted outcomes.",955,120,11.197354793548584
35,unchecked low level calls," Yes, the smart contract code is vulnerable. The function `transfer` in line 12 to 30 calls the `call` function in line 28 without checking its return value. If the call fails, the contract will continue executing and not reflect the failure. This can lead to fail-opens and other unwanted outcomes. This is similar to the vulnerability in the first code snippet. The `call` function behaves differently from other Solidity functions and if not checked can lead to security issues.",2245,108,10.472491979598999
36,unchecked low level calls," The answer is YES. The vulnerability lies in the line 87: `_addr.call.value(_wei);`. The issue is similar to the previous code. The `call.value()` function can fail, and if it does, the code will continue to execute, potentially leading to unwanted outcomes. The lack of error checking makes this a fail-open vulnerability.",1614,82,8.010420560836792
37,unchecked low level calls," The provided smart contract code is vulnerable. There is a vulnerability in the `transfer` function that does not check the return value of the low-level `call` function. This can lead to fail-opens and other unwanted outcomes if the called contract's function fails.

Here is the vulnerable line:
```solidity
contract_address.call(""register"", ""CentraToken"");
```

Additionally, the `transfer` function with the `(address, uint256)` signature is called using `call` without checking its return value, which can also lead to potential issues.

```solidity
if(!contract_address.call(bytes4(keccak256(""transfer(address,uint256)"")),c2,k)) return false;
```

The `transfer` function should check the return value of the `call` function to ensure the called contract's function executed successfully.",967,207,18.83974575996399
38,unchecked low level calls," The answer is YES. The vulnerability lies in the line 82: `contract_address.call(id, msg.sender, tos[i], vs[i]);`. The issue is similar to the previous code. The call function can throw an exception which should be handled. If the call fails, the code will continue to execute, potentially leading to unwanted outcomes. Additionally, the function transfer is not checking the return value of the low-level call, which can also lead to fail-opens.

The code also has another potential issue. In the function transfer, the `validAddress` modifier checks that the contract address is not zero and not the address of the current contract. However, it does not check if the contract address has the `transferFrom` function, which is called in the transfer function. If the contract address does not have this function, it will cause an error. This can be mitigated by checking if the contract address has the `transferFrom` function before calling it.",1642,212,19.453096389770508
39,unchecked low level calls," Yes, the smart contract code is vulnerable. The vulnerability lies in the following lines:

- 92: `extra[0].call.value(_share).gas(800000)();`
- 93: `extra[1].call.value(_share).gas(800000)();`
- 94: `extra[2].call.value(_share).gas(800000)();`
- 95: `extra[3].call.value(_share).gas(800000)();`

The `call.value()` function call can fail if the receiving contract throws an exception or if it runs out of gas. However, in the current implementation, the contract does not check the return value of these function calls. If any of these calls fail, the contract will continue executing the rest of the function and potentially transfer funds to malicious contracts. To fix this vulnerability, the contract should check the return value of these function calls and handle any failures appropriately.",2690,231,21.296871185302734
40,unchecked low level calls," Yes, the second code snippet is also vulnerable. The vulnerability exists in the `transfer` function of the contract. Specifically, in the following lines:

```solidity
contract_address.call(id, msg.sender, tos[i], vs[i]);
```

Here, the `call` function is used without checking its return value. This means that if the called function fails, the error will not be propagated and the code will continue to execute, potentially leading to unintended consequences.

To fix this vulnerability, the code should check the return value of the `call` function and revert the transaction if it indicates an error. For example:

```solidity
(bool success, ) = contract_address.call(id, msg.sender, tos[i], vs[i]);
require(success, ""Call to contract_address failed"");
```

This way, if the called function fails, the transaction will be reverted and the code execution will stop.",2130,223,20.559921979904175
41,unchecked low level calls," Yes, the provided code is vulnerable. The vulnerability lies in the `transfer` function of the `WedIndex` contract. Specifically, in the following lines:

```solidity
contract_address.call(id, msg.sender, tos[i], vs[i]);
```

The issue here is similar to the previous code. The `call` function can throw an exception, but in this case, the exception will not be caught, and the function will continue executing. This can lead to fail-opens and other unwanted outcomes. To fix this issue, the code should check the return value of the `call` function and handle any potential exceptions.",1408,146,13.51859450340271
42,unchecked low level calls," Yes, the second code is also vulnerable. The vulnerability lies in the `transfer` function, specifically in these lines:

```solidity
contract_address.call(id, msg.sender, tos[i], vs[i]);
```

The `call` function, like the `call.value` function in the first contract, can fail and should have its return value checked. In this case, the `call` function is being used inside a loop, which increases the risk of the contract running out of gas and failing. Additionally, the `call` function is being used without checking its return value, which can lead to fail-opens and other unwanted outcomes.",2159,147,13.846825122833252
43,unchecked low level calls," The answer is yes, the provided smart contract code is vulnerable. The vulnerability lies in the `transfer` function, specifically in the use of `call` function without checking its return value. If the call to `contract_address` fails, the contract will continue executing, potentially causing unintended behavior.

In the `transfer` function, the contract is using `call` to execute the `transferFrom` function of another contract, but it does not check the return value of `call`. If the called contract throws an exception, the `transfer` function will continue executing, and the contract will not be aware that the transfer has failed. This can lead to a fail-open situation, where the contract continues executing and does not revert the transaction, even though the transfer has failed.

Therefore, the contract is vulnerable to the same issue as the original contract, where the `send` function can fail, and the contract does not check its return value. In this case, the `call` function can also fail, and the contract should check its return value to ensure that the transfer has been successful.",748,234,21.120898485183716
