case_id,vuln_type,audit_report,input_token_num,output_token_num,inference_time
125,reentrancy," Yes, the first smart contract code is vulnerable to a reentrancy attack. The vulnerability lies in the `Collect` function, specifically in the line `if(msg.sender.call.value(_am)())`. This line allows for a call to an untrusted contract before the initial execution is complete, potentially changing the contract state in the middle of execution.

The second smart contract code is not provided for evaluation. However, I can tell you that the code you provided for the `EthealHelper` contract does not contain any immediately obvious vulnerabilities related to reentrancy. It is important to note that a full audit would involve a more thorough analysis of all functions and interactions between contracts.",1692,147,15.355883598327637
126,reentrancy," Answer:

Yes, the given smart contract code is vulnerable to a reentrancy attack. The vulnerability exists in the `iWhitelist` contract in the `withdrawBalance` function. The function uses `msg.sender.call.value(amountToWithdraw)("""")` to send funds to the caller, which can be an external contract. This allows the caller to call the `withdrawBalance` function again before the initial execution is complete, leading to a reentrancy attack.

The `iWhitelist` contract should be modified to use the Checks-Effects-Interactions pattern, where all checks are performed at the beginning of the function, all state changes are made in the middle, and external calls are made at the end. This can help prevent reentrancy attacks by ensuring that the contract state is not changed until all checks have been performed. Additionally, using the `transfer` function instead of `call` can also help prevent reentrancy attacks, as it automatically handles any failures and reverts any changes made to the contract state.",944,224,22.012508392333984
127,time manipulation," Yes, the provided code is vulnerable to timestamp manipulation. The `isSaleFinished` function in the `TimedCrowdsale` contract uses `block.timestamp` to check if the sale has ended, which can be manipulated by the miner. The `EthealHelper` contract also uses this function to determine if a transaction should be considered forwardable, so it is also affected by this vulnerability.",836,89,9.066524028778076
128,time manipulation," NO.

The provided code includes several contracts (lottopollo, iWhitelist, iDeposit, and EthealHelper), but the vulnerability you described only applies to the lottopollo contract. The additional contracts are not relevant to the time manipulation vulnerability in this case. Therefore, the combined contract code is not more vulnerable than the original lottopollo contract.",1111,85,9.03755497932434
129,time manipulation," Answer:

NO.

The provided code for the `Governmental` contract does not have the same vulnerability as the first contract you presented. While it does use `block.timestamp` in a similar way, the `Attacker` contract is not present in this code, so there is no way for the timestamp to be manipulated in a way that would cause a problem. However, it is still not a best practice to rely on `block.timestamp` for critical contract functionality due to the potential for miner manipulation.",1389,113,11.41754150390625
130,time manipulation," The answer is YES, the contract code is vulnerable to timestamp manipulation. The vulnerability lies in the same line as the previous contract: line 18 `require(now!= pastBlockTime);`. The `now` variable, an alias for `block.timestamp`, can be manipulated by the miner, making it unreliable for security-critical operations. In this case, an attacker can manipulate the timestamp to repeatedly execute the body of the fallback function, draining the contract of its funds.",963,109,10.961788654327393
131,time manipulation," Yes, the provided code is vulnerable to time manipulation. The vulnerability exists in both EtherLotto and EthealHelper contracts as they both use block.timestamp in their logic without properly checking for potential manipulation. This can lead to consensus issues and security vulnerabilities as miners can manipulate the timestamp within a certain range.",1173,70,7.3263983726501465
132,short addresses," Answer:

Yes, the smart contract code is vulnerable. The vulnerability lies in the `MyToken` contract, specifically in the `sendCoin` function. The function uses `msg.sender` to check for the balance of the sender, but this can be manipulated by the attacker using the'short address' attack. The attacker can create a specially-crafted address that is one byte shorter than the usual 20 bytes, and the EVM will automatically pad the address with extra zeros. This means that `msg.sender` will point to the attacker's address instead of the actual sender's address, allowing the attacker to bypass the balance check and manipulate the balances.

The `iWhitelist`, `iDeposit`, and `EthealHelper` contracts do not appear to have any obvious vulnerabilities in the provided code. However, it is important to note that the `EthealHelper` contract uses `iDeposit` and `MyToken` contracts, so any vulnerabilities in those contracts could potentially affect the `EthealHelper` contract as well.",1183,241,23.897462129592896
133,denial of service," Answer:

Yes, the smart contract code is vulnerable to a denial-of-service (DoS) attack. The vulnerability lies in the `emptyCreditors` function of the `DosGas` contract. If this function is called when the `creditorAddresses` array has more than 1500 elements, it will be reset to an empty array, and `win` will be set to true. This can be exploited to repeatedly add and then remove creditor addresses, causing the contract to run out of gas and fail, effectively denying service.

The `forwardable` function in the `EthealHelper` contract also calls the `getTx` function in the `iDeposit` contract, which in turn calls the `transactions` function in the `iDeposit` contract. If the `iDeposit` contract also has a similar vulnerability as the `DosGas` contract, it can also be exploited to cause a denial-of-service attack.

Therefore, it is important to ensure that all functions that modify the state of the contract are properly secured and do not allow for gas-draining attacks.",1142,254,25.009570598602295
134,denial of service," Answer:

NO.

The provided code for the `EthealHelper` contract does not appear to have any obvious vulnerabilities related to denial-of-service attacks based on the given code. However, it is important to note that the `iDeposit` and `iWhitelist` contracts are not included in the provided code, so there could be potential vulnerabilities in those contracts that could indirectly affect the `EthealHelper` contract. Nonetheless, based on the provided code, the `EthealHelper` contract itself does not appear to be vulnerable to denial-of-service attacks.",1273,133,13.285178661346436
135,denial of service," Yes, the smart contract code is vulnerable to denial of service attacks. The vulnerability lies in lines 68-69 where `creditorAddresses` and `creditorAmounts` are set to new arrays with zero elements. This will remove all creditor addresses and amounts, effectively deleting the contract's record of who is owed money. This could be exploited by an attacker to prevent legitimate creditors from receiving their payments. Additionally, the contract does not check if the `creditorAddresses` and `creditorAmounts` arrays have enough elements when trying to access or modify them, which could result in out-of-bounds errors and further security vulnerabilities.",2661,145,15.020257949829102
136,denial of service," The smart contract code is vulnerable. The vulnerability lies in the `Refunder` contract, which is similar to the previous code. In the `refundAll` function, a `require` statement is used to check if the funds are successfully sent to each address in the `refundAddresses` array. If sending to any address fails, the whole transaction will be reverted, and no funds will be refunded. This can lead to a denial-of-service attack, where an attacker can intentionally make one of the addresses invalid, preventing all refunds from being processed.

To fix this vulnerability, it is recommended to use a multi-send library or loop through the addresses and send funds individually, handling any errors without affecting the entire transaction.",1157,160,16.070210695266724
137,denial of service," Yes, the smart contract code is vulnerable to a denial of service attack. The vulnerability lies in the `iDeposit` contract, specifically in the `forwardable` function of the `EthealHelper` contract. The function iterates over all transactions in the `iDeposit` contract and checks if the beneficiary of each transaction is whitelisted. If the beneficiary is whitelisted, the function stores the index of the transaction in an array. However, if the number of transactions is very large, this process can consume a significant amount of gas and cause a denial of service. The `getTx` function, which is called inside the `forwardable` function, also has a potential denial of service vulnerability because it does not check the input `i` and will return the details of any transaction if it exists. An attacker could potentially cause the contract to consume all its gas by repeatedly calling this function with increasing values of `i`.",989,205,20.184330701828003
138,denial of service," Yes, the smart contract code is vulnerable to a denial-of-service attack. The vulnerability is present in the DosAuction contract, specifically in the bid() function. If currentFrontrunner is not null, the contract will send the current bid amount to the currentFrontrunner address. If the currentFrontrunner address is malicious, it could repeatedly call the bid() function, causing the contract to send repeated payments and potentially exhausting the funds of the msg.sender. This would result in a denial-of-service attack, as legitimate users would be unable to bid on the auction.

The iWhitelist, iDeposit, and EthealHelper contracts do not appear to have any obvious vulnerabilities based on the provided code. However, it is important to note that a comprehensive security audit would involve a more in-depth analysis of all contract components, including their interactions and potential edge cases.",975,201,19.629321336746216
