case_id,vuln_type,audit_report,input_token_num,output_token_num,inference_time
86,arithmetic," Answer:

For the second contract code you provided, my answer is 'NO'. This contract does not have the same arithmetic overflow and underflow vulnerabilities as the first contract. The functions in this contract do not modify the state variable 'count', so there is no risk of integer overflows or underflows in this contract. However, this does not mean that the contract is completely free of vulnerabilities, and it should still be thoroughly audited using the steps provided in the original guide.",1193,105,10.612598419189453
87,arithmetic," Answer:

For the provided code, the answer is YES, it is vulnerable. The vulnerability lies in the EthealHelper contract, in the function getTx(). The function returns the internal state of the iDeposit contract, including the balance and the beneficiary address. This can lead to information disclosure and privacy issues. The function should be modified to only return the necessary information, such as the transaction ID and time, and not the balance or beneficiary address.",1036,103,10.437290668487549
88,arithmetic," Yes, the provided code is vulnerable to integer overflows. The vulnerability exists in the `iDeposit` contract in the `function run(uint256 input) public` where the `count` variable can overflow if an input is greater than the current `count` value. This can be exploited to manipulate the contract's state and introduce incorrect data. The `EthealHelper` contract does not directly introduce a new vulnerability, but it calls the `iDeposit` contract's functions, which are already vulnerable.",762,117,11.705260992050171
89,arithmetic," Answer:

Yes, the smart contract code is vulnerable. The vulnerability exists in the EthealHelper contract, in the getTx function. The function returns the internal transactions of the iDeposit contract, which includes the sellerBalance of the Overflow contract. If the sellerBalance overflows, it will not affect the functionality of the EthealHelper contract, but it can still lead to security issues in the overall system. This is because the overflowed value can be used in further calculations, leading to incorrect results or security vulnerabilities.",786,115,11.550837516784668
90,arithmetic," Yes, the second smart contract code is also vulnerable due to the lack of checks for arithmetic overflows and underflows. Specifically, the'results' variable in the 'forwardable' function of the 'EthealHelper' contract could potentially overflow if the number of transactions is very large, leading to unexpected behavior. The same vulnerability exists in the 'transfer' function of the 'IntegerOverflowAdd' contract as mentioned earlier.",853,93,9.45370626449585
91,bad randomness," Answer:

YES, the provided code is vulnerable due to the same reason as the previous code. The vulnerability lies in the line:
`bytes32 answer = blockhash(guesses[msg.sender].block);`
in the `settle()` function of the `PredictTheBlockHashChallenge` contract. The `blockhash` function, when used with a block number, returns the hash of that block. However, this is predictable and can be manipulated by miners, making it unsuitable for generating randomness.",1206,121,12.456095933914185
92,bad randomness," Yes, the smart contract code is vulnerable due to the same reasons mentioned in the initial explanation. The `blockNumber` variable is used to generate randomness, which is predictable and can be manipulated by miners. This vulnerability exists in lines 7, 99, 101, 103, 114, 158. Additionally, `block.coinbase` and `msg.sender` should not be used for generating randomness as they are predictable.",3309,107,11.402552843093872
93,bad randomness," Yes, the smart contract code is vulnerable due to the use of block.blockhash in the rand function. Blockhash is only available for the 256 most recent blocks, and it requires significant gas to compute. If the contract tries to access the blockhash of a block outside this range or if the gas limit is too low, it will fail. Additionally, as mentioned in the initial review, randomness in Ethereum is hard to get right and should be avoided if possible.",3560,101,10.86843466758728
94,bad randomness," Answer:

Yes, the first smart contract code is vulnerable due to the use of block.number as a source of randomness. The block number is predictable and can be manipulated by malicious users, making it an unreliable source of randomness. This vulnerability is the same as the one in the provided 'bad' randomness.sol contract.

The second smart contract code is not vulnerable based on the provided code. However, it is important to note that the code only shows a part of the entire smart contract system. If the iWhitelist or iDeposit contracts have vulnerabilities, then the entire system may be vulnerable. Therefore, it is essential to audit all contracts in the system to ensure their security.",1359,155,15.388493299484253
95,bad randomness," Yes, the smart contract code is vulnerable due to the same issue as the previous code. The `answer` variable in the `GuessTheRandomNumberChallenge` contract is being set with a value derived from `block.blockhash(block.number - 1)`, which is predictable and can be manipulated by a malicious user. Therefore, the randomness is not truly random and can be exploited.",1030,89,9.389518737792969
96,bad randomness," Yes, the smart contract code is vulnerable. The vulnerability lies in the following lines:

- `uint256 private salt = block.timestamp;` in the `RandomNumberGenerator` contract.
- `function getTx(address _deposit, uint256 i) view public returns (uint256 amount, address beneficiary, uint64 time, bool cleared)` in the `EthealHelper` contract.

The `getTx` function in the `EthealHelper` contract calls an external contract's function (`iDeposit`'s `transactions` function) without checking its return value, which can lead to vulnerabilities if the external function's return value indicates success or failure.

Additionally, the `salt` variable in the `RandomNumberGenerator` contract is still using `block.timestamp` as its source, which is predictable and can lead to vulnerabilities in the random number generation process.",1103,209,21.178651809692383
97,reentrancy," Yes, the first smart contract code is vulnerable to a reentrancy attack. The vulnerability lies in the `Collect` function, specifically at `if(msg.sender.call.value(_am)())`. This line allows for a call to an untrusted contract before the initial execution is complete, potentially changing the contract state in the middle of execution.

The second smart contract code is not provided in the format requested, so I will not evaluate it. However, I can say that the first contract's vulnerability is due to the use of the low-level `.call` function, which is often the culprit in reentrancy attacks. The second contract does not contain this function, but without evaluating it in full, I cannot say for certain whether it is vulnerable or not.",1620,167,16.563340187072754
98,reentrancy," Answer:

Yes, the first smart contract code is vulnerable to a reentrancy attack. The vulnerability lies in the `withdrawFunds` function, specifically in the line `require(msg.sender.call.value(_weiToWithdraw)());`. This line allows for a call to an untrusted contract before the initial execution is complete, potentially changing the contract state in the middle of execution.

The second smart contract code is not provided for review. I cannot determine if it is vulnerable or not based on the information given.",1155,116,11.846601247787476
99,reentrancy," Yes, the first contract (DEP\_BANK) is vulnerable to reentrancy attacks. The vulnerability lies in the `Collect` function, specifically in the line `if(msg.sender.call.value(_am)())`. This line allows for a call to an untrusted contract before the initial execution is complete, which is a condition for a reentrancy attack.

The second contract (iDeposit) does not contain the same vulnerability, as it does not allow for arbitrary calls to untrusted contracts. However, it is also important to note that the `Deposit` function in the first contract (DEP\_BANK) calls the `Deposit` function of the second contract (iDeposit) indirectly through the fallback function, so the second contract's state should also be considered when auditing the smart contract.",1692,185,18.529276132583618
100,reentrancy," Answer:

Yes, the second smart contract code is also vulnerable to a reentrancy attack. The EthealHelper contract has a function forwardable() that calls an external contract's function getTx() without checking its return value. An attacker can exploit this by creating a malicious contract that calls back into the forwardable() function, allowing them to drain funds.

The vulnerability lies in the following lines:
```go
for (i = 0; i < txs; i++) {
    (_a, _b, _t, _c) = getTx(_deposit, i);
    if (!_c && deposit.whitelist().isWhitelisted(_b)) {
        _ids[results] = i;
        results++;
    }
}
```
Here, the getTx() function is called without checking its return value, allowing an attacker to manipulate its output and potentially call back into the forwardable() function, leading to a reentrancy attack.",1047,222,22.181262969970703
101,reentrancy," Answer:

Yes, the given code is vulnerable to a reentrancy attack. The vulnerability exists in the `withdraw` function of the `SimpleDAO` contract. Just like in the previous code, the contract is using `msg.sender.call.value(amount)()` which allows for a reentrancy attack. This means that an attacker can recursively call the `withdraw` function while the first call is still being processed, draining the contract of its funds. The `credit[msg.sender] -= amount;` line is placed after the `call` which means the contract's state is updated after the external call, allowing for the reentrancy attack. To fix this, the contract should update its state before making the external call.",983,164,16.09138298034668
102,reentrancy," Yes, the provided smart contract code is vulnerable to a reentrancy attack. The vulnerability lies in the `Collect` function, specifically at `if(msg.sender.call.value(_am)())`. This line allows for a call to an untrusted contract before the initial execution is complete, potentially changing the contract state in the middle of execution. This is the same line that was identified as vulnerable in the initial contract, demonstrating a failure to address the known issue.",1616,100,10.85974669456482
103,reentrancy," Yes, the first code is vulnerable to a reentrancy attack. The `Collect` function calls `msg.sender.call.value(_am)()` which can allow an attacker to call the `Collect` function again before the initial execution is complete, changing the contract state in the middle of execution.

The second code is not vulnerable to a reentrancy attack, as it does not call an external contract before the initial execution is complete. However, it is still important to ensure that the `Deposit` and `Whitelist` contracts do not have any vulnerabilities, as they are being used in this contract.",1826,133,13.43375039100647
104,reentrancy," Yes, the smart contract is vulnerable to a reentrancy attack. The vulnerability lies in the `getFirstWithdrawalBonus` function of the `Reentrancy_bonus` contract. After the `withdrawReward` function is called in line 12, the state of the contract can be changed by the recipient address before the initial execution is complete, allowing for the reentrancy attack. This is the same vulnerability that was pointed out in the original code.

Additionally, the `forwardable` function in the `EthealHelper` contract calls an external contract's function (`getTx`) without checking its return value, which could potentially lead to another reentrancy attack if the external contract is malicious. It is recommended to add a check for the success of the external function call to ensure the state of the contract is not changed before the initial execution is complete.",1138,190,19.036271333694458
105,reentrancy," Yes, the first code is vulnerable to a reentrancy attack. The `Collect` function calls `msg.sender.call.value(_am)()` which can allow an attacker to call the `Collect` function again before the initial execution is complete, changing the contract state in the middle of execution.

The second code is not vulnerable as it does not allow for external contract calls that can make new calls to the contract before the initial execution is complete. It only has a view function that returns information about transactions and another function that filters forwardable transactions based on a whitelist.",1822,123,12.466269731521606
106,reentrancy," Yes, the first code is vulnerable to a reentrancy attack. The `Collect` function calls `msg.sender.call.value(_am)()` which can allow the msg.sender (the calling contract) to call back into the `Collect` function before the state has been updated, allowing for the attack.

The second code does not have the same vulnerability, as it does not call back to the contract whose function is being called. It is simply reading data from the blockchain and returning it, so there is no risk of reentrancy.",1802,118,11.995753765106201
107,reentrancy," Yes, the smart contract code is vulnerable to a reentrancy attack. The vulnerability lies in the `Collect` function where `msg.sender.call.value(_am)()` is called before updating the `balance` of the sender. This allows for the possibility of reentering the `Collect` function before the balance is updated, potentially allowing for the unlimited withdrawal of funds. To fix this, first update the balance and then call `msg.sender.transfer(_am)`.",1620,103,10.561646938323975
108,reentrancy," Answer:

For the first contract code, YES, it is vulnerable. The vulnerability lies in the `WithdrawToHolder` function in the `TokenBank` contract, specifically in this line: `if(_addr.call.value(_wei)())`. This line is vulnerable to a reentrancy attack because it allows the called contract (_addr) to call back into the `TokenBank` contract before the state changes made in the current call are finalized.

For the second contract code, there is not enough information provided to determine if it is vulnerable or not. The code provided only includes the `EthealHelper` contract, but there is no information about how it is used or interacted with. To fully assess the vulnerabilities, the entire contract and its usage should be analyzed. However, I can say that the `forwardable` function in the `EthealHelper` contract does not contain any obvious vulnerabilities based on the provided code.",1746,202,19.888173580169678
109,reentrancy," The smart contract code is vulnerable. The vulnerability lies in the `attack` contract's `supportsToken` function, which calls the `airDrop` function of the `ModifierEntrancy` contract. This creates a reentrancy vulnerability because the `airDrop` function changes the state of the `ModifierEntrancy` contract, and the `attack` contract's `supportsToken` function calls an external contract before resolving any effects. This allows an attacker to repeatedly call the function and drain the contract of funds.",1335,116,11.700768232345581
110,reentrancy," Yes, the first smart contract code is vulnerable to a reentrancy attack. The vulnerability lies in the `CashOut` function, specifically in the line `if(msg.sender.call.value(_am)())`. This line allows for a call to an untrusted contract before the initial execution is complete, potentially changing the contract state in the middle of its execution.

The second smart contract code is not provided for evaluation. The `iWhitelist`, `iDeposit`, and `EthealHelper` contracts are not used in the provided code, and the `ETH_FUND` contract is the same as the first one, with the same vulnerability.",1582,145,14.624643087387085
111,reentrancy," Yes, the first contract (PERSONAL\_BANK) is vulnerable to reentrancy attacks. The vulnerability lies in the `Collect` function, specifically in this line: `if(msg.sender.call.value(_am)())`. This allows for a call to an external contract before the initial execution is complete, which is a reentrancy attack.

The second contract (iWhitelist, iDeposit, EthealHelper) is not provided in the original question, so I cannot evaluate its vulnerabilities.",1794,114,11.615553140640259
112,reentrancy," Answer:

Yes, the first contract (ReentrancyDAO) is vulnerable to a reentrancy attack. The vulnerability lies in the `withdrawAll` function, specifically in this line: `bool callResult = msg.sender.call.value(oCredit)();`. This allows for a reentrancy attack because it allows the caller (`msg.sender`) to call the `withdrawAll` function again before the initial execution is complete, potentially draining the contract of its funds.

The second contract (EthealHelper) is not directly vulnerable to a reentrancy attack in the provided code. However, it does call functions from the `iDeposit` and `iWhitelist` contracts, which may be vulnerable if they contain similar issues as the `ReentrancyDAO` contract. Therefore, when calling external contracts, it's essential to ensure they are secure and do not contain any vulnerabilities.",1018,201,20.0726318359375
113,reentrancy," NO, this contract is not vulnerable to the reentrancy attack based on the provided code. The reason is that the `withdrawBalance` function uses the `call.value` function to send ether, but it does not contain any external contract calls after this function that could be manipulated to call back into the `withdrawBalance` function before the state has been updated. However, it is still recommended to use the withdrawal pattern known as the ""checks-effects-interactions"" pattern, where all external calls are made after updating the contract's state.",1019,119,12.091493129730225
114,reentrancy," Yes, the first smart contract code is vulnerable to a reentrancy attack. The vulnerability lies in the `CashOut` function, specifically in the line `if(msg.sender.call.value(_am)())`. This line allows for a call to an external contract before the initial execution is complete, which can lead to a reentrancy attack.

The second smart contract code is not provided in a format that can be evaluated for vulnerabilities. It is a collection of multiple contracts with no specified function or line of code to review. In order to evaluate the code for vulnerabilities, a specific function or line of code would need to be provided.",1534,138,14.076634168624878
115,reentrancy," Yes, the first smart contract code is vulnerable to a reentrancy attack. The vulnerability lies in the `CashOut` function, specifically in the line `if(msg.sender.call.value(_am)())`. This line allows for a call to an external contract before the initial execution is complete, which is a potential security risk.

The second smart contract code is not provided in a format that can be evaluated for vulnerabilities. It is a collection of several contracts, and it is not clear how they are intended to interact with each other. In order to evaluate the code for vulnerabilities, it would be necessary to see how the contracts are being used together.",1532,141,14.148236274719238
116,reentrancy," Yes, the first smart contract code is vulnerable to a reentrancy attack. The vulnerability lies in the `Collect` function, specifically at `if(msg.sender.call.value(_am)())`. This line allows for a call to an untrusted contract before the initial execution is complete, potentially changing the contract state in the middle of execution.

The second smart contract code is not provided in a format that can be evaluated for vulnerabilities. It is a combination of multiple contract definitions, and there is no specific code to analyze. However, if the `iDeposit` contract has a function similar to the `Collect` function in the first contract, it could also be vulnerable to a reentrancy attack.",1612,152,15.352987289428711
117,reentrancy," Answer:

Yes, the smart contract code is vulnerable to a reentrancy attack. The vulnerability exists in the `iDeposit` contract in the `withdrawBalance` function. The contract uses `msg.sender.call.value(amountToWithdraw)("""")` which allows the recipient to call arbitrary code, including calling the `withdrawBalance` function again before the initial execution is complete. This can lead to a reentrancy attack. The `EthealHelper` contract does not have any direct vulnerabilities, but it calls functions of the `iDeposit` contract, which has the vulnerability.",1065,134,13.792038202285767
118,reentrancy," Answer:

Yes, the smart contract code is vulnerable to a reentrancy attack. The vulnerability exists in the `withdrawBalance()` function of the `Reentrance` contract, similar to the previous code. The `msg.sender.call.value(userBalance[msg.sender])()` line is allowing external contract calls before the initial execution is complete, which can lead to a reentrancy attack.

In the provided `EthealHelper` contract, it calls functions from other contracts (`iDeposit` and `iWhitelist`), and if any of these contracts have a function vulnerable to reentrancy, the `EthealHelper` contract could be at risk as well.",997,154,15.756185531616211
119,reentrancy," Yes, the first code is vulnerable to a reentrancy attack. The `CashOut` function uses `msg.sender.call.value(_am)()` which calls the sender's contract and allows it to execute code before the `CashOut` function is finished. This can allow the sender to change the contract state in the middle of the `CashOut` function, enabling a reentrancy attack.

The second code does not use `msg.sender.call.value(_am)()` or any low level functions with external addresses in a way that would allow external contract calls to make new calls to the contract before the initial execution is complete. Therefore, it is not vulnerable to a reentrancy attack.",1650,154,15.341204404830933
120,reentrancy," Yes, the first smart contract code is vulnerable to a reentrancy attack. The vulnerability lies in the `CashOut` function, specifically in the line `if(msg.sender.call.value(_am)())`. This line allows for a call to an untrusted contract before the initial execution is complete, potentially changing the contract state in the middle of execution.

The second smart contract code is not vulnerable to a reentrancy attack, as it does not allow for external contract calls before the initial execution is complete. However, it is important to note that the `iDeposit` and `iWhitelist` contracts have not been provided, so it is impossible to fully evaluate the security of the `EthealHelper` contract.",1500,159,15.74549150466919
121,reentrancy," Yes, the first smart contract code is vulnerable to a reentrancy attack. The vulnerability lies in the `Collect` function, specifically in the line `if(msg.sender.call.value(_am)())`. This line allows for a call to an untrusted contract before the initial execution is complete, potentially changing the contract state in the middle of execution.

The second smart contract code is not directly vulnerable to a reentrancy attack based on the provided code. However, it is important to note that the `iDeposit` contract has a dependency on the `iWhitelist` contract, and if the `iWhitelist` contract were to be vulnerable to a reentrancy attack, then the `iDeposit` contract could potentially be compromised as well. It is always important to ensure that all contracts in a system are secure and do not have any vulnerabilities.",1690,189,18.805235624313354
122,reentrancy," Yes, the first smart contract code is vulnerable to a reentrancy attack. The vulnerability lies in the `CashOut` function, specifically in the line `if(msg.sender.call.value(_am)())`. This line allows for a call to an external contract before the initial execution is complete, which can lead to a reentrancy attack.

The second smart contract code is not provided for evaluation. The `iWhitelist`, `iDeposit`, and `EthealHelper` contracts do not contain any functions that call external contracts before the initial execution is complete, so they are not vulnerable to a reentrancy attack based on the provided code.",1516,143,14.326181888580322
123,reentrancy," Yes, the provided smart contract code is vulnerable to a reentrancy attack. The vulnerability lies in the `Collect` function where it calls the `msg.sender` directly using the `call.value()` function, which can allow an attacker to call the `Collect` function recursively before the initial execution is complete, leading to a reentrancy attack.

To mitigate this vulnerability, it is recommended to use the `transfer()` function instead of `call.value()`, as `transfer()` automatically checks for sufficient balance and throws an exception if the balance is insufficient. Alternatively, implementing a reentrancy guard pattern can also prevent this type of attack.",1616,144,14.373465538024902
124,reentrancy," Yes, the first smart contract code is vulnerable to a reentrancy attack. The vulnerability lies in the `CashOut` function, specifically in the line `if(msg.sender.call.value(_am)())`. This line allows for a call to an untrusted contract before the initial execution is complete, potentially changing the contract state in the middle of execution.

The second smart contract code is not directly vulnerable to a reentrancy attack based on the provided code. However, it is important to note that the `iDeposit` contract has a dependency on the `iWhitelist` contract, and if the `iWhitelist` contract were to contain a vulnerability, it could potentially impact the `iDeposit` contract. It is always important to thoroughly review all dependencies when auditing a smart contract.",1500,177,17.496811389923096
