case_id,vuln_type,audit_report,input_token_num,output_token_num,inference_time
11,access control," The provided code includes a contract named `MultiOwnable` with access control vulnerabilities, and another contract `TestContract` that inherits from `MultiOwnable`. The `TestContract` contract has a `withdrawAll()` function that is protected by the `onlyOwner` modifier, which is defined in the `MultiOwnable` contract.

The `onlyOwner` modifier checks if the msg.sender's address exists in the `owners` mapping and is not equal to zero. However, the `newOwner(address _owner)` function in the `MultiOwnable` contract allows any address to be set as the new owner, without checking if the address has the required permissions. This creates an access control vulnerability, as any address can become the owner and then call the `withdrawAll()` function in the `TestContract` contract.

Therefore, the `TestContract` contract is also vulnerable due to the inheritance of the `MultiOwnable` contract's vulnerability.

Answer: YES, the `TestContract` contract is vulnerable due to the inherited access control vulnerability from the `MultiOwnable` contract.",1236,247,24.42834711074829
12,access control," Yes, the first contract (Missing) is vulnerable due to access control issues. The `missing` function in the contract sets the `owner` variable without any access restriction, allowing any address to become the owner. This is a security risk as it allows an attacker to call the `withdraw` function and steal all the contract's funds.

The second contract (EthealHelper) does not have the same vulnerability as the first contract. The `forwardable` function checks if the beneficiary address is whitelisted before including it in the results array. However, the contract assumes that the `iDeposit` contract at `_deposit` address has a `whitelist` function, which might not be the case. This could result in a revert error in the `forwardable` function. It's always a good practice to check if the contract has the required function before calling it.

To fix the first contract, the `missing` function should be modified to only allow the owner to set the `owner` variable. Here's an example of how to do this:

```solidity
function setOwner(address _newOwner) public onlyowner {
    owner = _newOwner;
}
```

And the `missing` function should be removed or restricted to only be called once.

```solidity
function missing() public onlyowner {
",917,301,29.182380437850952
13,access control," The provided contract iWhitelist, iDeposit, and EthealHelper are not vulnerable to the access control issue mentioned in the prompt. The iWhitelist contract has a public mapping that keeps track of whitelisted addresses, and the iDeposit contract uses the iWhitelist contract to check if an address is whitelisted before performing certain actions. The EthealHelper contract does not have any functionality that modifies the contract state, so it is not vulnerable to access control issues. However, it is important to note that the contracts that use the EthealHelper contract should properly check the access control before calling any of its functions.",3500,138,14.75260066986084
14,access control," NO, the second code snippet is not vulnerable to the 'access control' vulnerability type mentioned. The code snippet does not contain any function that can be bypassed or manipulated by an attacker. However, it is always important to thoroughly test and review all code to ensure there are no vulnerabilities.",1113,66,6.97831916809082
15,access control," The first smart contract code is vulnerable, and the vulnerability is in the `IamMissing` function in line 20. The function is supposed to set the `owner` variable, but it does not have the `onlyowner` modifier, so it can be called by anyone, not just the owner. This is an access control vulnerability.

The second smart contract code is not vulnerable based on the provided code. However, it is important to note that the `iWhitelist` and `iDeposit` contracts are not implemented, so there could be vulnerabilities in those contracts. The `EthealHelper` contract only has view functions, so it cannot be directly vulnerable to external calls. However, if the `iWhitelist` or `iDeposit` contracts have vulnerabilities, then the `EthealHelper` contract could potentially be at risk.",931,187,18.73283815383911
16,access control," No, the second smart contract code is not vulnerable to the 'access control' vulnerability type. The `withdraw` function in the `Map` contract is already secured by a require statement that checks if the msg.sender is the owner. However, the `set` function in the `Map` contract does not have any access control and can be called by anyone, which could lead to a different type of vulnerability. The `iWhitelist`, `iDeposit`, and `EthealHelper` contracts also do not contain the 'access control' vulnerability type in the provided code.",1021,126,12.835939645767212
17,access control," Answer:

YES, the contract code is vulnerable.

The vulnerability lies in the `EthealHelper` contract, which calls the `forwardable` function of the `iDeposit` contract using `delegatecall` in the `Proxy` contract. This can lead to an access control vulnerability, as any address can call the `forwardable` function through the `Proxy` contract. The `iWhitelist` contract and the `isWhitelisted` function do not seem to be used for controlling access to the `forwardable` function, so any address can call it and potentially access sensitive functionality.",873,133,13.408606767654419
18,access control," NO.

The provided code for the `Wallet` contract contains a potential vulnerability in the `PopBonusCode` function, where the `require` statement checks if the array index is within the bounds of the array, but the array index is not explicitly set in the function. However, the `iWhitelist`, `iDeposit`, and `EthealHelper` contracts do not contain any immediately obvious vulnerabilities based on the provided code.

That being said, it is important to note that a thorough security audit should include a variety of testing techniques, such as fuzzing, static analysis, and manual code review, to ensure that potential vulnerabilities are not overlooked. Additionally, the `EthealHelper` contract uses `iDeposit` and `iWhitelist` contracts, so the vulnerabilities in those contracts could potentially affect the `EthealHelper` contract. Therefore, it is important to ensure that all contracts in the system are secure and well-tested.",1136,212,20.852101802825928
19,access control," Answer:

Yes, the first contract (Missing) is vulnerable due to access control issues. The constructor function should be named with a starting capital letter, `Constructor()` should be `constructor()`. As it is, the function is a regular public function that can be called after the contract is deployed, which allows any address to change the owner variable. The correct way to set the owner variable is in the constructor function, and it should be protected with `onlyowner` modifier.

The second contract (iWhitelist, iDeposit, EthealHelper) does not have any obvious vulnerabilities in the provided code. However, without the full context and implementation of the contracts, it's impossible to say for certain that there are no vulnerabilities. The code snippet only shows a part of the contracts, so there might be vulnerabilities in other parts of the contracts or in how they interact with each other.",920,194,19.533829927444458
20,access control," The provided code is vulnerable. The vulnerability lies in the `initWallet()` function of the `Wallet` contract, which is similar to the vulnerable code you provided. The `initWallet()` function sets the `creator` variable to the message sender without any access control checks, which could potentially allow any caller to become the owner of the wallet. This is a type of access control vulnerability.",1133,84,8.844806909561157
21,access control," Yes, the smart contract code is vulnerable to access control issues. The vulnerability exists in the EthealHelper contract in the `forwardable` function. The function uses the `isWhitelisted` function from the `whitelist` contract to check if the beneficiary address is whitelisted. However, it does not check if the caller of the `forwardable` function has the right to call this function. An attacker can call this function and get a list of forwardable transactions even if they are not whitelisted. The issue is that the `whitelist` contract is not properly checked in the `forwardable` function, making it an access control vulnerability.",866,144,14.477495670318604
22,access control," NO.

The `EthealHelper` contract does not have any vulnerabilities based on the provided code. It only has view functions, so it cannot modify the state of the contract or perform any sensitive operations. However, it is dependent on the `iWhitelist` and `iDeposit` contracts, so those contracts would also need to be audited to ensure the overall system's security.",1167,87,8.927270650863647
23,access control," Yes, the provided code is vulnerable to access control issues. The `sudicideAnyone()` function in the `SimpleSuicide` contract allows any caller to destroy the contract without any checks or restrictions. This is a potential security risk and should be avoided. The function should be modified to include checks to ensure that only authorized users can perform this action.",810,74,7.626656770706177
24,access control," Yes, the first smart contract code is vulnerable. The 'changeOwner' function in the 'Unprotected' contract should be modified with the 'onlyowner' modifier to make it only accessible by the owner. Currently, any address can call this function and change the owner, which is an access control vulnerability.

For the second smart contract code, the provided code snippet does not show any vulnerabilities related to the 'access control' issue. However, it is important to note that the 'iWhitelist' and 'iDeposit' contracts are not implemented in the snippet, so potential vulnerabilities in those contracts cannot be evaluated.",921,136,13.720287322998047
25,access control," Yes, the smart contract code is vulnerable. The vulnerability lies in the `EthealHelper` contract, in the `forwardable` function. The function uses `deposit.whitelist().isWhitelisted(_b)` to check if the beneficiary address is whitelisted, but it does not check if the caller of the function has the right to check the whitelist. This means that any address can check if a beneficiary address is whitelisted, which could lead to information disclosure. The issue is similar to the access control vulnerability in the first code snippet, where `tx.origin` was used instead of `msg.sender`.",898,144,14.362497091293335
26,access control," Yes, the smart contract code is vulnerable due to access control issues. The vulnerability lies in the use of `delegatecall` in lines 22 and 29. This allows the called contract (`fibonacciLibrary`) to modify the state and functions of the calling contract (`FibonacciBalance`), which can lead to unauthorized access and modification of the contract's state. This is a form of access control vulnerability because it allows functions that should not have access to modify the contract's state.",1494,111,11.573435544967651
27,unchecked low level calls," Yes, the provided code is vulnerable. The vulnerability lies in the `Command` function of the `Pie` contract, which calls an external contract using the low-level `call.value` function without checking its return value. This can lead to fail-opens and other unwanted outcomes if the external contract throws an exception or consumes all the gas. The code should include a check of the returned boolean value to ensure the call succeeded before proceeding.",2136,95,9.957961320877075
28,unchecked low level calls," Yes, the smart contract code is vulnerable. The vulnerability lies in the `withdraw` function in the `iDeposit` contract. The `owner.send(balance)` statement (line 54 in the first contract) does not check the return value of `send`, which can result in the contract continuing execution even if the send fails. This can lead to the contract failing to withdraw the correct amount or failing to withdraw at all. The same vulnerability exists in the `Delta` contract, making it vulnerable as well.",1956,112,11.745416402816772
29,unchecked low level calls," Yes, the provided smart contract code is vulnerable. The vulnerability lies in the `Command` function of the `Freebie` contract, which calls another contract using the low-level `call.value` function without checking its return value. This can lead to fail-opens and other unwanted outcomes if the called contract function fails.

Here is the vulnerable line:
`adr.call.value(msg.value)(data);`

The `call.value` function can fail, and if it does, the execution will continue, potentially causing unintended behavior or security issues. To fix this vulnerability, the developer should check the return value of the `call.value` function and handle any failures appropriately.",1552,152,15.312281847000122
30,unchecked low level calls," Yes, the smart contract code is vulnerable. The vulnerability lies in the following lines:

1. Line 85: msg.sender.transfer(valuePaid - compensation);
2. Line 89: msg.sender.transfer(excessPaid);
3. Line 101: currentMonarch.etherAddress.transfer(compensation);
4. Line 142: wizardAddress.transfer(amount);

The reason for the vulnerability is that the code uses the low-level function transfer(), which can throw an exception and stop the execution of the contract, but this exception is not handled properly. If the transfer fails, the contract will continue executing the next lines of code, which can lead to inconsistent states or other unintended behaviors. It is recommended to use the higher-level function send() instead, which returns a boolean indicating success or failure, and handle the failure case properly.",3046,200,20.495692014694214
31,unchecked low level calls," Yes, the given code is vulnerable. The vulnerability lies in the `EthealHelper` contract in the `getTx` function. The function calls `iDeposit(_deposit).transactions(i)` which is a low-level call and does not check the return value. If the call to `transactions(i)` fails, it will not be caught and can lead to unwanted outcomes.

The `forwardable` function also has a similar issue in the line `deposit.whitelist().isWhitelisted(_b)`. If `isWhitelisted` function call fails, it will not be caught and can lead to issues.",978,145,14.541294813156128
32,unchecked low level calls," The provided smart contract code contains the same vulnerability as the previous one. The reason is that it uses the `send` function in lines 109 and 141 without checking its return value. If the call to `send` fails, the code will continue to execute, potentially leading to unwanted outcomes. So, the answer is: YES, it is vulnerable.",3181,80,8.76261568069458
33,unchecked low level calls," Answer:

Yes, the following smart contract code is vulnerable. The vulnerability lies in the `EthealHelper` contract, in the `forwardable` function. Specifically, in the `getTx` function call, there is no check for the returned boolean value from `callee.call()`. If the call to `getTx` function fails, the contract will continue executing the rest of the code, potentially leading to unwanted outcomes. The code should include a check for the returned boolean value to ensure the call was successful before proceeding with the rest of the function.",840,123,12.499389171600342
34,unchecked low level calls," Yes, the provided code is vulnerable. The vulnerability exists in the `EthealHelper` contract in the `forwardable` function. The function calls the `getTx` function using the `_deposit` address, which is an input parameter and can be controlled by an attacker. The `getTx` function calls `iDeposit(_deposit).transactions(i)`, which may include unchecked calls to external contracts. If the external contracts are not properly checked for errors, it could lead to fail-opens and other unwanted outcomes.

The vulnerability is not directly in the `AirDropContract` code provided earlier, but the same vulnerability exists in the `transfer` function, where it calls an external contract without properly checking for errors.",1180,164,16.150602340698242
35,unchecked low level calls," Answer:

NO, the provided code is not vulnerable to the same type of vulnerability as the first code. The code uses the `.transfer()` function to send Ether, which will automatically revert and stop execution if it fails. However, there are other potential issues in the code, such as the `Command` function that uses `.call.value()` without checking the return value, which could potentially lead to an issue similar to the first code if called on a malicious contract. Additionally, the `Get` function sends all contract funds to the sender if the sent value is greater than 1 ether, which could potentially lead to a loss of funds if called maliciously.",2470,146,14.89422869682312
36,unchecked low level calls," Yes, the provided code is vulnerable due to the unchecked low-level calls. Specifically, in the `WithdrawToken` function of the `Token` contract, the `token.call` function is used without checking its return value. This can lead to fail-opens and other unwanted outcomes if the call to the `transfer` function fails. The same vulnerability exists in the `TokenBank` contract's `WithdrawToHolder` function with `_addr.call.value(_wei)`.

Additionally, the `forwardable` function in the `EthealHelper` contract has potential vulnerabilities. It creates an array `_ids` with the length of `txs` but then reassigns it with a new array of length `results`. If `results` is less than `txs`, this could lead to out-of-bounds access. Also, the function does not check the return value of the `getTx` function, which uses low-level calls.",1839,210,20.680518627166748
37,unchecked low level calls," Yes, the provided code is vulnerable to the same issue as the previous code. The vulnerability lies in the line:

`contract_address.call(""register"", ""CentraToken"");`

The `call` function used here can fail and if it does, the code will continue to execute without returning a false value to indicate the failure. This can lead to unwanted outcomes if not handled properly.",1192,86,8.850417375564575
38,unchecked low level calls," Yes, the provided code is vulnerable due to the unchecked low-level calls. Specifically, in the `WithdrawToken` function of the `Token` contract, the `token.call` function is used without checking its return value. This can lead to fail-opens and other unwanted outcomes if the call to the `transfer` function in the `token` contract fails. The same vulnerability exists in the `WithdrawToHolder` function of the `TokenBank` contract with the use of `_addr.call.value(_wei)`.",1867,116,12.025702953338623
39,unchecked low level calls," Yes, the smart contract code is vulnerable. The vulnerability lies in the following lines:

- 69, 71, 73, 75: `extra[x].call.value(_share).gas(800000)();`
",2915,61,6.911927700042725
40,unchecked low level calls," Yes, the contract is vulnerable. The vulnerability is in the `EthealHelper` contract in the `forwardable` function. In this function, the `getTx` function is called which is an external function in the `iDeposit` contract. This function can throw exceptions and if it does, it will not be handled properly and the execution will continue, potentially leading to unwanted outcomes.",2355,85,9.03201961517334
41,unchecked low level calls," Yes, the second code snippet is also vulnerable. The vulnerability exists in the `EthealHelper` contract in the `getTx` function. The function calls `iDeposit(_deposit).transactions(i)` which is equivalent to using `.call` since `transactions` is a public getter function. If `_deposit` is a malicious contract, it can re-enter the `getTx` function and cause various attacks such as stealing funds or altering the contract state.

The reason why this vulnerability exists is that the developer did not check the return value of the low-level call `iDeposit(_deposit).transactions(i)`. If the called contract throws an exception, the call will return `false`, but the code will continue to execute, leading to potential fail-opens and other unwanted outcomes.",1633,189,18.843773365020752
42,unchecked low level calls," Yes, the provided code is vulnerable. The vulnerability lies in the `Command` function of the `WhaleGiveaway1` contract, which calls an external contract using the low-level `call.value` function without checking its return value. This can lead to fail-opens and other unwanted outcomes if the external contract throws an exception or consumes all the gas.

The `forwardable` function in the `EthealHelper` contract is not vulnerable because it does not call any external contracts using low-level functions like `call.value`. It only calls internal functions and reads data from the blockchain.",2384,131,13.873750925064087
43,unchecked low level calls," Answer:

Yes, the smart contract code is vulnerable. The vulnerability lies in the `send` function calls in the `Lotto` contract, specifically in the `sendToWinner()` and `withdrawLeftOver()` functions. The `send` function can fail if the recipient address has no code or if the recipient address's fallback function throws an error. If the `send` function fails, the contract will continue executing, potentially leading to inconsistent contract state. This is the same vulnerability as in the first code snippet provided. To fix this, use the `transfer` function instead, which throws an exception if it fails, or check the return value of `send` and handle any failures appropriately.",973,155,15.544322490692139
44,unchecked low level calls," Yes, the smart contract code is vulnerable. The vulnerability lies in the `Command` function of the `FreeEth` contract, which calls an external contract using the low-level `call.value` function without checking its return value. If the external contract throws an exception, the `call.value` function will return false, but the code will continue to execute, potentially leading to unwanted outcomes. This is the same vulnerability as in the original code provided.",1554,98,10.291705131530762
45,unchecked low level calls," Yes, the contract is vulnerable due to the unchecked return value of the low-level call function. In the `execute` function of the `Owned` contract, the result of `_dst.call.value(_value)(_data)` is not checked for success or failure. If the call to `_dst` fails, the contract will continue executing, potentially leading to unwanted outcomes.

Here is the vulnerable line:
```solidity
_dst.call.value(_value)(_data);
```

To fix this vulnerability, you should check the return value of the low-level call and handle failures appropriately. For example:
```solidity
(bool success, ) = _dst.call.value(_value)(_data);
require(success, ""Call to _dst failed"");
```
This way, if the call to `_dst` fails, the contract will stop executing and throw an error message.",2307,208,20.576630353927612
46,unchecked low level calls," Yes, the provided code is vulnerable to the same issue as the previous code. The vulnerability exists in the `iDeposit` contract in the `send` function call in the `withdrawBalance` function, specifically in the `withdraw` function of the `iDeposit` contract. The code should check the return value of `msg.sender.send(amountToWithdraw)` to ensure that the funds have been successfully transferred. If the transfer fails, the contract should not proceed with zeroing out the sender's balance. The same vulnerability exists in the `whitelist().isWhitelisted(_b)` function call in the `EthealHelper` contract, where the contract should check the return value to ensure that the address is indeed whitelisted.",882,166,16.425727367401123
47,unchecked low level calls," Yes, the provided code is vulnerable. The vulnerability is in the `WithdrawToken` function of the `Token` contract, which is inherited by the `TokenBank` contract. Specifically, the line:

`token.call(bytes4(sha3(""transfer(address,uint256)"")),to,amount);`

This line uses the low-level `call` function to transfer tokens from one address to another. However, it does not check the return value of the `call` function. This means that if the transfer fails for any reason (e.g., due to insufficient balance), the code will continue to execute, potentially leading to unwanted outcomes.

Therefore, the code is vulnerable to fail-opens and other unwanted outcomes if the `transfer` function fails. The contract should check the return value of the `call` function and revert the transaction if it indicates failure.",1773,196,19.3211829662323
48,unchecked low level calls," Yes, the given code is vulnerable. The vulnerability lies in the `EthealHelper` contract in the `forwardable` function. Specifically, in the following lines:

```solidity
(_a, _b, _t, _c) = getTx(_deposit, i);
if (!_c && deposit.whitelist().isWhitelisted(_b)) {
    _ids[results] = i;
    results++;
}
```

The issue here is that the `getTx` function uses `send` to retrieve the transaction data, which can fail and return false, but this is not checked in the `forwardable` function. If `getTx` fails, it will return (0, 0, 0, false), and the `isWhitelisted` function will be called on an address with a value of 0, which is likely not the intended behavior. This could potentially lead to security vulnerabilities or incorrect contract behavior.

To fix this issue, you should check the return value of `getTx` and only proceed with the rest of the function if it was successful. You can do this by adding a require statement, like so:

```solidity
(_a, _b, _t, _c) = getTx(_deposit, i);
require(_c, ""getTx failed"");
if (!_",978,301,29.149362087249756
