case_id,vuln_type,audit_report,input_token_num,output_token_num,inference_time
83,arithmetic," Yes, the second smart contract code is also vulnerable. The vulnerability lies in the CustomToken contract's constructor function. The total supply of the token is set to a very large number (10^18) and is assigned to the contract creator's address (0x5ebc4B61A0E0187d9a72Da21bfb8b45F519cb530). This could potentially lead to an integer overflow if the number is too large to be represented by a uint256 variable. However, the 'run' function from the first contract is not directly vulnerable in this code, but if it is used in conjunction with this contract, it could lead to an underflow and result in a security issue.",707,166,15.12259030342102
84,arithmetic," Yes, the second smart contract code is also vulnerable. The vulnerability exists in the CustomToken contract's constructor. The total supply is set to a very large number (10^18). If the 'input' variable in the 'run' function of the IntegerOverflowBenign1 contract (which is the base contract of CustomToken) is a very large number, an arithmetic overflow can occur in the'res = count - input' line, leading to unexpected behavior. Although this specific calculation is not in the critical path of modifying the token's balance, it still highlights the potential for integer overflow issues in the contract.

To fix this vulnerability, consider adding checks to prevent overflows and underflows in arithmetic operations, especially when dealing with user input or critical state variables like token supply. Using SafeMath library or Solidity 0.8.0 and above, which has built-in overflow and underflow protection, is recommended.",610,203,18.450260639190674
85,arithmetic," Yes, the second smart contract code is also vulnerable due to the same reason as the first one. The vulnerability lies in the `run` function of the `IntegerOverflowMultiTxOneFuncFeasible` contract, specifically in this line: `count -= input;`. If `input` is an extremely large number, it could cause an arithmetic overflow or underflow, leading to potential security issues.",687,85,8.073359489440918
86,arithmetic," Yes, the smart contract code is vulnerable. The vulnerability lies in the `overflowaddtostate`, `overflowmultostate`, and `underflowtostate` functions in the `IntegerOverflowSingleTransaction` contract. The `count` variable can overflow or underflow, leading to security issues. The `overflowlocalonly`, `overflowmulocalonly`, and `underflowlocalonly` functions also have the same issue but it is limited to the local variable `res` so it does not affect the contract's state variable `count`.

The `CustomToken` contract does not have any arithmetic operations on its state variables, so it is not vulnerable to the same type of issue. However, it is important to note that the `CustomToken` constructor assigns the total supply to the address `0x5ebc4B61A0E0187d9a72Da21bfb8b45F519cb530` and this could potentially lead to security issues if this address is not properly secured.",1028,225,20.396165132522583
87,arithmetic," Yes, the second smart contract code is also vulnerable due to the same issue as the first one. The vulnerability lies in the `transfer` function of the `CustomToken` contract, which is inherited from the `BaseToken` contract. The `require` statement in this function checks if the sender's balance after subtracting the transfer amount is greater than or equal to zero. However, if the transfer amount is equal to the sender's balance, it will result in an arithmetic underflow, causing the balance to wrap around and become a very large number. This can lead to security vulnerabilities and incorrect contract behavior.

The vulnerable line is:
`require(balanceOf[from] - _value >= 0);`

To fix this issue, the `require` statement should be updated to check if the sender's balance is greater than or equal to the transfer amount, like this:
`require(balanceOf[from] >= _value);`

Additionally, the `_value` variable should be checked for overflow and underflow before performing the subtraction operation.",871,232,21.05214285850525
88,arithmetic," Yes, the first contract (IntegerOverflowAdd) is vulnerable to integer overflow. The vulnerability lies in the line `count += input;` of the `run` function. There is no check to prevent an input that could cause an overflow, which can lead to unpredictable contract behavior or security issues.

The second contract (CustomToken) does not have the same vulnerability in the provided code. The `CustomToken` contract inherits from `BaseToken` and initializes the token supply and related variables in the constructor. However, it does not contain any arithmetic operations that could lead to an overflow or underflow vulnerability based on the provided code.",597,139,12.78187108039856
89,arithmetic," Yes, the second smart contract code is also vulnerable. The vulnerability exists in the CustomToken contract, in the constructor function. The total supply of the token is set to a very large number (10^20), and all of this supply is assigned to the address 0x5ebc4B61A0E0187d9a72Da21bfb8b45F519cb530. If the number representing the token balance is greater than 2^256-1, it will result in an overflow, leading to an incorrect and potentially very large balance for the specified address. This could lead to various security issues, including the potential for theft or denial of service.

The vulnerable line in the CustomToken contract is:

balanceOf[0x5ebc4B61A0E0187d9a72Da21bfb8b45F519cb530] = totalSupply;

To fix this issue, it is recommended to use a safeMath library to perform arithmetic operations, ensuring that overflows and underflows are avoided. Additionally, it is a good practice to limit the token supply to a reasonable amount to prevent potential issues related to large token balances.",621,279,25.094887018203735
90,arithmetic," Yes, the second smart contract code is also vulnerable to integer overflows or underflows. The vulnerability exists in the CustomToken contract, specifically in the constructor function where the total supply is being set. The line of code `totalSupply = 10000000000000000000;` exceeds the maximum value that can be stored in a `uint256` type, which is `2^256 - 1`. This can result in an integer overflow, leading to unpredictable behavior.

The same issue can be found in the `balanceOf` mapping in the constructor function where a large value is assigned to the address `0x5ebc4B61A0E0187d9a72Da21bfb8b45F519cb530`. This can lead to integer overflow in the `balanceOf` mapping as well.",688,206,18.79658031463623
91,bad randomness," Yes, the smart contract code is vulnerable due to the same reason as mentioned before. The 'blockhash' function used in the'settle' function of the PredictTheBlockHashChallenge contract is predictable and can be manipulated by miners. Therefore, it should not be used for generating randomness in this context.

Moreover, the CustomToken contract is not related to the PredictTheBlockHashChallenge contract and does not seem to have any vulnerabilities in itself, but it is always a good practice to separate unrelated contracts and follow best practices for each contract.",1041,125,11.635034084320068
92,bad randomness," Yes, the smart contract code is vulnerable due to the following reasons:

1. The `blockNumber` variable is declared as public state variable, allowing it to be read by any user. This can lead to potential vulnerabilities as an attacker can monitor the block number and potentially manipulate the contract based on its value.
2. The `seed1` and `seed2` variables are generated using the `block.coinbase` and `msg.sender` respectively, and then used to generate the random number. However, the `block.coinbase` is the address of the miner who mined the block and is therefore predictable. Similarly, `msg.sender` is the address of the user who initiated the transaction and is also predictable.
3. The `seed3` variable is generated using `block.difficulty`, which is a value that can be influenced by the miner. Therefore, it is not truly random and can be manipulated by the miner.
4. The `randHash` variable is generated using the `keccak256` function, which takes in the `seed1`, `seed2`, and `seed3` as inputs. Since these inputs are predictable and/or manipulable, the `randHash` value is also predictable and/or manipulable.
5. The `winningNumber` variable is generated by taking the `uint` value of the `randHash",3144,301,27.428429126739502
93,bad randomness," Yes, the smart contract code is vulnerable due to the use of block.blockhash(lastBlockNumber) in the rand() function. The blockhash function only returns the hash of the most recent 256 blocks, so if the contract call is made at block number greater than 256, block.blockhash(lastBlockNumber) will always return 0 for any lastBlockNumber greater than 256. This can lead to a predictable random number generation and potential attacks.",3395,104,10.333139181137085
94,bad randomness," Yes, the smart contract code is vulnerable. The vulnerability lies in the same line as the previous contract: `bool won = (block.number % 2) == 0;`. This line of code is generating a ""random"" value based on the block number, which is predictable and not truly random, making the system susceptible to manipulation.",1194,75,7.305466413497925
95,bad randomness," Yes, the smart contract code is vulnerable. The vulnerability lies in the line:

`answer = uint8(keccak256(block.blockhash(block.number - 1), now));`

The use of `block.blockhash(block.number - 1)` as a source of randomness is vulnerable because it is predictable by miners. Miners can manipulate the blockhash value by mining a specific block hash, which can compromise the integrity of the `answer` variable. This can lead to security vulnerabilities in the `guess` function, as the value of `answer` may not be truly random.

Furthermore, the `CustomToken` contract is not directly related to the `GuessTheRandomNumberChallenge` contract, so it does not introduce any additional vulnerabilities to the smart contract. However, it is generally not a good practice to combine unrelated contracts in a single file.",865,204,18.549362659454346
96,bad randomness," Yes, the smart contract code is vulnerable. The vulnerability lies in the following lines:

- `uint256 private salt = block.timestamp;` in the `RandomNumberGenerator` contract,
- `uint256 x = salt * 100 / max;` in the `random` function,
- `uint256 y = salt * block.number / (salt % 5);` in the `random` function,
- `uint256 seed = block.number / 3 + (salt % 300) + y;` in the `random` function,
- `uint256 h = uint256(blockhash(seed));` in the `random` function.

The reason for this vulnerability is that the `salt` variable is generated using `block.timestamp`, which is a value that can be manipulated by miners in certain situations. This can lead to predictable `salt` values and thus predictable random numbers. Additionally, the use of `block.number` and `blockhash` in the `random` function can also lead to predictable values, as they are based on the current block number and hash, which can be influenced by miners.",938,270,24.396477937698364
97,reentrancy," Yes, the smart contract is vulnerable to a reentrancy attack. The vulnerability lies in the `Collect` function where `msg.sender.call.value(_am)()` is called before the state of the contract is updated. This allows for the possibility of the calling contract to call back into the `Collect` function, changing the state of the contract before the original call is completed. This can lead to a situation where the contract continues to send funds to the attacker, draining the contract of its ether balance.",1455,110,10.411919116973877
98,reentrancy," Yes, the smart contract code is vulnerable to a reentrancy attack. The vulnerability lies in the `withdrawFunds` function of the `EtherStore` contract, specifically in the line `require(msg.sender.call.value(_weiToWithdraw)());`. This line allows the recipient of the funds to execute arbitrary code before the balance of the sender is updated, which can lead to a reentrancy attack.

In the `CustomToken` contract, there is no direct interaction with the `EtherStore` contract, so it is not vulnerable to a reentrancy attack based on the provided code. However, if the `CustomToken` contract were to inherit from the `EtherStore` contract or interact with it in a way that allows for untrusted calls, it could potentially become vulnerable to a reentrancy attack.",990,180,16.459108591079712
99,reentrancy," Yes, the provided code is vulnerable to a reentrancy attack. The vulnerability lies in the `Collect` function where it calls `msg.sender.call.value(_am)()`. This allows for the possibility of the msg.sender contract making another call to the `Collect` function before the current call is finished, allowing for the potential of unlimited ether to be drained from the contract.",1527,85,8.22376275062561
100,reentrancy," Yes, the second smart contract code is also vulnerable to a reentrancy attack. The vulnerable function is the same `withdraw()` function in the `Reentrance` contract, which is used in the `CustomToken` contract without any modifications. The `call.value(_amount)()` line of code is the source of the vulnerability, as it allows for a reentrancy attack to occur.",882,86,8.176740646362305
101,reentrancy," Answer:

Yes, the first smart contract code is vulnerable to a reentrancy attack. The reason is that the `withdraw` function uses `msg.sender.call.value(amount)()` which calls an untrusted contract before the initial execution is complete, allowing the contract state to change in the middle of its execution. This can lead to an attacker repeatedly calling the function and draining the contract of funds.

The second smart contract code is not directly vulnerable to a reentrancy attack, as it does not use `call` to an external contract within a function that modifies the contract state. However, it is still important to note that the `CustomToken` contract inherits from `BaseToken`, and if `BaseToken` or any other contract it inherits from in the future contains a function that is vulnerable to a reentrancy attack, then it could still be at risk. It is always important to ensure that all functions that modify the contract state are secure and cannot be exploited through reentrancy or any other type of attack.",818,223,20.285865783691406
102,reentrancy," Yes, the smart contract is vulnerable to a reentrancy attack. The vulnerability lies in the `Collect` function where the contract allows the `msg.sender` to call an untrusted contract before the initial execution is complete, specifically in this line: `if(msg.sender.call.value(_am)())`. This can allow an attacker to repeatedly call the function and drain the contract of funds.",1451,87,8.38685417175293
103,reentrancy," Yes, the first contract code is vulnerable to reentrancy attacks. The `Collect` function calls `msg.sender.call.value(_am)()` without checking its return value, which means it doesn't verify if the called contract's execution was successful or not. An attacker can exploit this by creating a malicious contract that will call the `Collect` function recursively, draining the contract of its funds.

The second contract code is not provided for review. I will only review the provided contract code.",1661,112,10.633480310440063
104,reentrancy," Yes, the provided smart contract code is vulnerable to a reentrancy attack. The vulnerability exists in the `getFirstWithdrawalBonus` function of the `Reentrancy_bonus` contract. After the `withdrawReward` function is called in line 12, the state of the contract changes and the `claimedBonus` mapping is updated in line 13. However, if the recipient is an untrusted contract, it can call the `getFirstWithdrawalBonus` function again before the initial execution is complete, allowing it to repeatedly drain the contract of funds. This is the same vulnerability that was present in the original code.

To fix this vulnerability, the `withdrawReward` function should be called after the state of the contract has been updated and the function has completed execution. This can be achieved by using the `Checks-Effects-Interactions` pattern, where all state changes are made before interacting with other contracts. In this case, the `withdrawReward` function should be called after the `claimedBonus` mapping is updated in line 12. This will ensure that the state of the contract has been updated before the recipient contract has a chance to call the `getFirstWithdrawalBonus` function again.",973,273,24.602680921554565
105,reentrancy," Answer:

Yes, the first contract code is vulnerable to a reentrancy attack. The vulnerability exists in the `Collect` function where it calls `msg.sender.call.value(_am)()`. This allows a malicious contract to call the `Collect` function again before the initial execution is complete, changing the contract state in the middle of the execution and potentially draining the contract of its funds.

The second contract code, however, does not contain the same vulnerability. The `CustomToken` contract does not have any functions that allow for external contract calls, and the `MONEY_BOX` contract is not interacting with the `CustomToken` contract in a way that would allow for a reentrancy attack.",1657,156,14.52778148651123
106,reentrancy," Yes, the smart contract code is vulnerable to a reentrancy attack. The vulnerability lies in the `Collect` function, specifically in the line `if(msg.sender.call.value(_am)())`. This line allows for a call to an untrusted contract before the initial execution is complete, potentially changing the contract state in the middle of execution.",1637,76,7.497460603713989
107,reentrancy," Yes, the smart contract is vulnerable to a reentrancy attack. The vulnerability lies in the `Collect` function, specifically at `if(msg.sender.call.value(_am)())`. This line allows for a call to an untrusted contract before the initial execution is complete, potentially changing the contract state in the middle of execution.",1455,73,7.191112995147705
108,reentrancy," Answer:

For the first contract (TokenBank), YES, it is vulnerable due to the use of the low-level `.call` function without proper checks, specifically at line 94 in the `WithdrawToHolder` function. This can lead to a reentrancy attack.

For the second contract (CustomToken), No, it does not appear to be vulnerable based on the provided code. It is a simple ERC20 token implementation with no functions that could be susceptible to reentrancy attacks.",1581,112,10.605841636657715
109,reentrancy," The smart contract code is vulnerable. The vulnerability lies in the `attack` contract's `supportsToken` function, which calls the `airDrop` function of the `ModifierEntrancy` contract. This creates a reentrancy vulnerability because the `airDrop` function modifies the `tokenBalance` mapping, which can change the contract state in the middle of its execution. This vulnerability allows for an attacker to repeatedly call the `airDrop` function and drain the contract of funds. This is the same vulnerability type as the one mentioned in the initial review, ['reentrancy.sol'].",1170,130,12.084147930145264
110,reentrancy," Yes, the smart contract code is vulnerable to a reentrancy attack. The vulnerability lies in the `CashOut` function, specifically in the line `if(msg.sender.call.value(_am)())`. This line allows for a call to an external contract before the initial execution is complete, which is a condition for a reentrancy attack.",1417,76,7.424230337142944
111,reentrancy," Yes, the smart contract code is vulnerable to a reentrancy attack. The vulnerability lies in the `Collect` function, specifically in the line `if(msg.sender.call.value(_am)())`. This line allows for a call to an untrusted contract before the initial execution is complete, potentially changing the contract state in the middle of its execution.",1629,77,7.566579580307007
112,reentrancy," Yes, the second smart contract code is also vulnerable to a reentrancy attack. The vulnerability lies in the `withdrawAll()` function of the `ReentrancyDAO` contract, which is similar to the first code. The `call.value(oCredit)()` allows external contract calls before the initial execution is complete, allowing the contract state to change in the middle of its execution. This can lead to a reentrancy attack.",853,96,9.114288091659546
113,reentrancy," Answer:

Yes, the first contract (EtherBank) is vulnerable to a reentrancy attack. The vulnerability lies in the `withdrawBalance` function, specifically in the line `if (!(msg.sender.call.value(amountToWithdraw)())) { throw; }`. This line allows for a reentrancy attack because it allows the caller (`msg.sender`) to execute code before the `withdrawBalance` function has completed execution.

The second contract (CustomToken) is not vulnerable to a reentrancy attack, as there is no function that allows for the transfer of ether or tokens that could be exploited in such a way. However, it is generally recommended to follow best practices for secure coding, even if no vulnerabilities are immediately apparent.",854,165,15.084395170211792
114,reentrancy," Yes, the smart contract code is vulnerable to a reentrancy attack. The vulnerability lies in the `CashOut` function, specifically in the line `if(msg.sender.call.value(_am)())`. This line allows for a call to an untrusted contract before the initial execution is complete, potentially changing the contract state in the middle of its execution. This is exactly the definition of a reentrancy attack.",1369,91,8.717975378036499
115,reentrancy," Yes, the smart contract code is vulnerable to a reentrancy attack. The vulnerability lies in the `CashOut` function, specifically in the line `if(msg.sender.call.value(_am)())`. This line allows for a call to an untrusted contract before the initial execution is complete, potentially changing the contract state in the middle of its execution. This is exactly the definition of a reentrancy attack.",1367,91,8.7550528049469
116,reentrancy," Yes, the provided smart contract code is vulnerable to a reentrancy attack. The vulnerability lies in the `Collect` function, specifically at the line `if(msg.sender.call.value(_am)())`. This line allows the recipient of the funds to call an arbitrary function, which can lead to a reentrancy attack. The recipient can call back into the `Collect` function before the balance of the sender has been updated, allowing them to drain more funds than they should be able to.",1447,105,9.986717700958252
117,reentrancy," Yes, the second smart contract code is also vulnerable to a reentrancy attack. The vulnerability lies in the `withdrawBalance()` function of the `Reentrancy_cross_function` contract, which is similar to the first contract. The `call.value()` function allows the recipient to execute arbitrary code, which can include calling the `withdrawBalance()` function again before the initial execution is complete, leading to a reentrancy attack.

The potential vulnerability exists in the following lines:

```solidity
(bool success, ) = msg.sender.call.value(amountToWithdraw)("""");
require(success);
userBalances[msg.sender] = 0;
```

To mitigate this vulnerability, consider using the `transfer()` function from the ERC20 standard or implement a reentrancy guard pattern to prevent the contract from being manipulated during the execution of external calls.",900,203,18.50230312347412
118,reentrancy," Yes, the provided smart contract code is vulnerable to a reentrancy attack. The vulnerability exists in the `withdrawBalance()` function of the `Reentrance` contract, specifically in the use of `msg.sender.call.value(userBalance[msg.sender])()`. This allows for the possibility of reentrant calls, enabling an attacker to repeatedly call the `withdrawBalance()` function before the initial execution is complete, potentially draining the contract of funds.

The `CustomToken` and `BaseToken` contracts do not directly contribute to the vulnerability, but they are also susceptible to reentrancy attacks if they inherit the `Reentrance` contract or use similar unprotected `call` functions.",832,156,14.290235042572021
119,reentrancy," Yes, the smart contract code is vulnerable to a reentrancy attack. The vulnerability lies in the `CashOut` function where it calls the sender's contract using `msg.sender.call.value(_am)()` before updating the balances. This allows the recipient to call the `CashOut` function again before the balance is updated, allowing for a reentrancy attack.

The same vulnerability exists in the given code as the previous one. The line `if(msg.sender.call.value(_am)())` in the `CashOut` function is susceptible to a reentrancy attack.",1485,135,12.592821836471558
120,reentrancy," Yes, the provided Smart Contract code is vulnerable to Reentrancy Attack. The vulnerability lies in the `CashOut` function where it uses `msg.sender.call.value(_am)()` which allows external contract calls to make new calls to the calling contract before the initial execution is complete.

In the `CashOut` function, the balance of the sender is updated after the `call.value(_am)()` which allows for a reentrancy attack. An attacker can repeatedly call the `CashOut` function before the balance is updated, draining the contract of funds.

To fix this vulnerability, the balance of the sender should be updated before the `call.value(_am)()` is executed. This way, even if the attacker tries to call the `CashOut` function again, the balance of the sender has already been updated and the attacker cannot drain the contract of funds.",1335,199,18.185045957565308
