case_id,vuln_type,audit_report,input_token_num,output_token_num,inference_time
11,access control," The smart contract code is vulnerable. The vulnerability lies in the `CustomToken` contract, specifically in the constructor function. The contract sets the balance of the address `0x5ebc4B61A0E0187d9a72Da21bfb8b45F519cb530` to the total supply, effectively pre-mining tokens for this address. This is a potential centralization risk and could be considered an access control issue, as it gives a specific address a large amount of tokens without any checks or restrictions.

Additionally, the constructor function does not follow the `constructor` keyword syntax introduced in Solidity 0.5.0. Although the code specifies the compiler version as `^0.4.23`, it is still a good practice to follow the latest conventions and syntax for better code readability and maintainability.",1071,191,17.496836185455322
12,access control," Answer:

Yes, the first contract code is vulnerable to access control issues. The function missing() in the contract Missing should be marked as 'internal' or 'private' instead of 'public' to prevent unauthorized access. As it is, any address can call this function and change the owner variable, which should only be set once when the contract is deployed.

The second contract code does not contain the same vulnerability in the provided code, so the answer is No. The contract CustomToken does not inherit the Missing contract, so there is no direct access control issue. However, it is important to note that the BaseToken contract has no access control modifiers on the balanceOf mapping, which could potentially lead to vulnerabilities if used improperly in a larger system.",752,163,14.933058738708496
13,access control," The smart contract code is vulnerable. The vulnerability lies in the `changeOwner` function, which can be called by the contract creator (which may not necessarily be the owner of the contract). This can lead to an access control issue as the contract creator can transfer ownership to themselves, bypassing any access controls that are in place. This is a violation of the principle of least privilege, as the contract creator should not have more privileges than necessary.",3335,93,9.408616304397583
14,access control," NO, the second code snippet is not vulnerable to the 'access control' vulnerability. The `withdraw` function checks if the amount the user wants to withdraw is less than or equal to their balance, and if it is, it transfers that amount to the user. However, it does not have any access control issues. The `migrateTo` function, which could be an access control issue, is not publicly callable from the `CustomToken` contract, so it is not an issue in this context.",948,108,10.11910629272461
15,access control," The answer is YES, the smart contract code is vulnerable. The vulnerability lies in the `IamMissing` function of the `Missing` contract. This function is supposed to initialize the `owner` variable to the address of the contract creator, but it does not use the `onlyowner` modifier. Therefore, any address can call this function and set the `owner` variable to their own address, allowing them to call the `withdraw` function and steal all the funds in the contract.

The `CustomToken` contract does not appear to be directly vulnerable based on the provided code, but it is important to note that it uses the `balanceOf` mapping to store the token balances of each address. If the `onlyowner` modifier is not used correctly in other functions that modify this mapping, it could lead to access control vulnerabilities. It is always important to thoroughly test and audit all functions in a smart contract to ensure their security.",766,199,18.035525798797607
16,access control," No, the second smart contract code is not vulnerable to the 'access control' vulnerability type. The `withdraw` function in the `Map` contract correctly checks if the msg.sender is the owner before performing the transfer operation. However, it is recommended to add a function to change the owner address in case of a need to transfer ownership. The `CustomToken` contract does not have any apparent vulnerabilities in the provided code.",856,90,8.550140857696533
17,access control," Yes, the provided code is vulnerable to access control attacks. The vulnerability exists in the `Proxy` contract, which uses `delegatecall` to allow the calling of functions from the `callee` contract. This can be exploited if the `callee` contract is malicious, as it can potentially modify the state of the `Proxy` contract. The `CustomToken` contract, which inherits from `BaseToken`, does not have any explicit modifier restricting who can call its constructor, making it possible for an attacker to create a new token with arbitrary balances.

In addition, the `Proxy` contract does not check the `_data` parameter passed to the `forward` function, making it possible for an attacker to pass arbitrary data to the `delegatecall`, potentially leading to unintended behavior.

Therefore, both the `Proxy` and `CustomToken` contracts have access control vulnerabilities that need to be addressed to ensure the security of the smart contract.",708,208,18.92026448249817
18,access control," NO, the provided code for the `Wallet` contract does not have the same vulnerability on lines 21-23 as the original code. The `require` statement in the `PopBonusCode()` function checks if the array index is within the bounds of the array, which is a good practice. However, the code does not include any functionality for removing elements from the `bonusCodes` array, so the `PopBonusCode()` function could potentially cause an out-of-bounds error if it is called multiple times.

The `CustomToken` contract appears to be a separate contract that inherits from the `BaseToken` contract and defines its own constructor. It does not interact with the `Wallet` contract directly, so it is not relevant to the vulnerability in the `Wallet` contract.

There are still other potential vulnerabilities in the `Wallet` contract, such as the lack of modifier for the `Destroy()` function, which could allow any address to destroy the contract if they can obtain the owner's address. It is always important to thoroughly test and audit smart contracts to ensure their security and reliability.",971,241,21.772308349609375
19,access control," Answer:

Yes, the first contract code is vulnerable due to the reason you mentioned. The vulnerability lies in line 17: function Constructor(). The constructor of a contract should have the same name as the contract name, and in this case, it should be ""Missing()"". By naming it ""Constructor()"", it is treated as a normal function and not a constructor, and it will not be executed when the contract is deployed. As a result, the ""owner"" variable will not be initialized, and the ""onlyowner"" modifier will not work as intended, making the contract vulnerable to access control issues.

The second contract code is a different story. I will answer ""NO"" because I do not see any obvious vulnerabilities in the code. However, I would like to point out that the first contract ""Missing"" is inherited by the second contract ""CustomToken"" without any modification. Therefore, if the ""Missing"" contract has any vulnerabilities, the ""CustomToken"" contract will inherit them as well. In this case, since the ""Missing"" contract has an issue with the constructor function, the ""CustomToken"" contract will also inherit this issue. But since we have already identified and explained this vulnerability, I will not count it as a separate vulnerability in the ""CustomToken"" contract.

In summary, the first contract code is vulnerable due to the constructor function issue, while the second contract code does not have any",755,301,26.873592138290405
20,access control," Yes, the smart contract code is vulnerable due to access control issues. The vulnerability lies in the `initWallet` function where the `creator` variable is set to `msg.sender`. This creates a potential for an access control vulnerability as any address can initialize the wallet and become the `creator`. This could potentially allow the `creator` to migrate the contract to a different address and steal the funds. To fix this vulnerability, the `initWallet` function should be modified to only allow the contract deployer or a specific address to initialize the wallet.",968,119,11.137105941772461
21,access control," Yes, the second smart contract code is also vulnerable. The vulnerability exists in the `CustomToken` contract in its constructor function. The contract sets the balance of the `0x5ebc4B61A0E0187d9a72Da21bfb8b45F519cb530` address to the total supply, and then calls the `Transfer` event with this address as the recipient. This means that the `0x5ebc4B61A0E0187d9a72Da21bfb8b45F519cb530` address has control over all the tokens in the contract. If this address is not intended to be the owner of all the tokens, then this is a security vulnerability.

Furthermore, the `MyContract` contract in the second code example has the same vulnerability as the first one, with the use of `tx.origin` instead of `msg.sender` in the `sendTo` function. This can allow an attacker to call a function in an intermediate contract, which then calls the `sendTo` function, bypassing the access control check.",701,259,23.3043315410614
22,access control," Answer:

NO, the second code snippet is not vulnerable to the 'access control' vulnerability. The 'access control' vulnerability in the first code snippet is due to the use of `msg.sender` in the `refund` function without checking if the caller has the necessary permissions to refund themselves. The second code snippet does not contain any function that allows arbitrary users to transfer tokens from the contract, so it is not vulnerable to this type of access control vulnerability.

However, I would like to point out that the `CustomToken` contract in the second code snippet initializes the `totalSupply` variable to a very large number and assigns all of it to the address `0x5ebc4B61A0E0187d9a72Da21bfb8b45F519cb530`. This could potentially be a security issue if the address is not intended to hold that much of the token. It is generally a good practice to initialize the `totalSupply` variable to a value that is appropriate for the specific use case of the contract.",1002,240,21.66572070121765
23,access control," Yes, the second smart contract code is also vulnerable due to access control issues. The `SimpleSuicide` contract's `suicideAnyone()` function allows any caller to destroy the contract by calling this function. This is a security risk as it allows any user to potentially destroy the contract and its data. In this specific code, the `CustomToken` contract does not have any direct vulnerabilities related to access control. However, the `SimpleSuicide` contract, which is inherited by `CustomToken`, has an access control vulnerability.

To fix this issue, you can consider implementing a modifier to restrict the `suicideAnyone()` function to be called only by the contract owner or an authorized address. Here's an example of how to implement a simple modifier to restrict function access:

```solidity
address public owner;

modifier onlyOwner() {
    require(msg.sender == owner, ""Only the contract owner can call this function."");
    _;
}

constructor() public {
    owner = msg.sender;
}

function sudicideAnyone() public onlyOwner {
    selfdestruct(msg.sender);
}
```

This implementation restricts the `suicideAnyone()` function to be called only by the contract owner, which enhances the security of the contract.",645,290,26.068022966384888
24,access control," The answer is YES, the smart contract code is vulnerable. The vulnerability lies in the `Unprotected` contract, specifically in the `changeOwner` function. This function should be using the `onlyowner` modifier to ensure that only the owner of the contract can change the owner address. However, it is currently public, meaning any address can call this function and change the owner. This is a classic example of an access control vulnerability.",756,93,8.783275365829468
25,access control," Yes, the second smart contract code is also vulnerable. The vulnerability exists in the `Phishable` contract included in the first contract. If a contract inherits from the vulnerable contract, it also inherits the vulnerability. In this case, the `CustomToken` contract inherits the vulnerable `Phishable` contract. The vulnerability is in the `withdrawAll` function where `tx.origin` is used to check for the contract owner. This is an access control vulnerability because `tx.origin` checks the original address that initiated the transaction, not the direct caller of the contract function. Therefore, if a user contract calls a function in `CustomToken`, the `tx.origin` check will fail because the original address is the user, not the user contract. To fix this, it's recommended to use `msg.sender` instead of `tx.origin` to check for the direct caller of the contract function.",733,196,17.80933952331543
26,access control," Yes, the smart contract code is vulnerable due to access control issues. The vulnerability lies in lines 22 and 29 where `delegatecall` is used. This allows the called contract to modify the state of the calling contract, which can lead to unintended behavior and potential security vulnerabilities if the called contract is not trusted or malicious. This is a common issue when using low-level functions without proper checks. In this case, the `FibonacciLib` contract is being called directly, bypassing any access control checks that may be present in its functions. This could allow any address to call these functions and potentially manipulate the contract's state.",1329,141,13.08570909500122
27,unchecked low level calls," Yes, the provided code is vulnerable due to the same reason as the previous one. The vulnerability lies in the line 35 of the `CustomToken` contract:

`adr.call.value(msg.value)(data);`

The low level function `call.value()` can fail and if the return value is not checked, it can lead to fail-opens and other unwanted outcomes.",1971,88,8.646476030349731
28,unchecked low level calls," Yes, the smart contract code is vulnerable. The vulnerability lies in the `withdraw` function in the `Delta` contract. The `owner.send(balance)` statement (line 65 in the first code block) does not check the return value of `send`, which can result in the contract continuing execution even if the `send` call fails. This can lead to the contract failing to withdraw the intended amount of funds. Additionally, the `Delta` contract uses `send` instead of `transfer`, which provides less error reporting and makes it harder to detect failures.",1791,120,11.358622074127197
29,unchecked low level calls," Yes, the provided smart contract code is vulnerable due to the unchecked low-level call in line 39 of the `Freebie` contract. The `call.value()` function can fail, but there is no check for the return value, which could lead to fail-opens and other unwanted outcomes. This is the same vulnerability as in the first code snippet.

The vulnerability lies in line 39 of the `Freebie` contract: `adr.call.value(msg.value)(data);`

The rest of the code, including the `CustomToken` contract, is not directly vulnerable based on the provided information, but it is important to note that the vulnerable `Freebie` contract can interact with it, potentially causing issues.",1387,162,14.946717500686646
30,unchecked low level calls," Yes, the smart contract code is vulnerable. The vulnerability lies in the following lines:

- Line 110: msg.sender.send(valuePaid);
- Line 118: msg.sender.send(excessPaid);
- Line 132: currentMonarch.etherAddress.send(compensation);
- Line 174: wizardAddress.send(amount);

The vulnerability is due to the fact that the contract does not check the return value of the send function, which can cause the transaction to fail without propagating the error. This can lead to a fail-open situation and unwanted outcomes.",2881,145,13.902133703231812
31,unchecked low level calls," Yes, the second smart contract code is also vulnerable. The vulnerability is in the `airPort` contract, which is identical to the previous code. The `transfer` function in `airPort` contract uses the `call` function with unchecked return value, which can lead to fail-opens and other unwanted outcomes if the call to `transferFrom` function fails. This is the same vulnerability as pointed out in the first code. The `CustomToken` and `BaseToken` contracts do not have this specific vulnerability, but they have their own potential issues and should be thoroughly audited as well.",813,127,11.772455930709839
32,unchecked low level calls," Yes, the smart contract code is vulnerable. The vulnerability lies in the following lines:

1. winner.send(subpot);
2. msg.sender.send(msg.value-value);

The vulnerability is that the code does not check the return value of send() function. If send() function fails, the contract will continue executing, and the state will be changed, leading to fail-opens and other unwanted outcomes. This is the same vulnerability as in the first code.",3016,108,10.587609052658081
33,unchecked low level calls," Answer:

Yes, the following smart contract code is vulnerable. The vulnerability lies in the 'ReturnValue' contract in the 'callnotchecked' function:

function callnotchecked(address callee) public {
callee.call();
}

Just like in the first code snippet, the low level function 'call()' is used without checking its return value. This can lead to fail-opens and other unwanted outcomes if the call to 'callee' fails.",675,105,9.808168411254883
34,unchecked low level calls," Yes, the provided smart contract code is vulnerable. The vulnerability lies in the `transfer` function of the `AirDropContract` contract, specifically in this line: `contract_address.call(id, msg.sender, tos[i], vs[i]);`.

Just like in the first code, the low-level `call` function is used without checking its return value. If the `contract_address` contract's `transferFrom` function (which is the function being called) fails, the execution will continue, potentially causing unwanted outcomes. This is the same 'unchecked-low-level-call' vulnerability as described in the initial question.",1015,142,13.142724752426147
35,unchecked low level calls," Yes, the provided code is vulnerable. The vulnerability lies in the `Command` function of the `Pie` contract, which calls an external contract using the low-level `call.value` function without checking its return value. If the called contract throws an exception, the execution will continue, potentially causing unwanted outcomes.

Here is the vulnerable line:
`adr.call.value(msg.value)(data);`

The rest of the contracts do not seem to have this specific issue, but they might have other vulnerabilities. It's essential to thoroughly test and audit smart contracts before deploying them to the mainnet.",2305,135,12.796888828277588
36,unchecked low level calls," Yes, the provided smart contract code is vulnerable due to the unchecked low-level calls. Specifically, in the `TokenBank` contract, the `WithdrawToken` function in line 19 and the `WithdrawToHolder` function in line 39 both use the `call` function without checking its return value. This can lead to fail-opens and other unwanted outcomes if the called function fails.

In the `CustomToken` contract, there is no such low-level call, so it is not vulnerable to this specific issue. However, it is still important to check for other potential vulnerabilities.",1674,131,12.286746978759766
37,unchecked low level calls," Yes, the provided code is vulnerable to the same issue as the previous code. The line `contract_address.call(""register"", ""CentraToken"");` is an unchecked low-level call, which can cause fail-opens and other unwanted outcomes if the return value is not checked. In this case, the contract's behavior in case of a failed call is not defined, which can lead to security vulnerabilities.

Additionally, the code is missing the `new` keyword when creating a new instance of the `BaseToken` contract. It should be `contract_address = new BaseToken();` instead of `contract_address = 0x96a65609a7b84e8842732deb08f56c3e21ac6f8a;`. Without the `new` keyword, the `contract_address` variable will just contain the address of the `BaseToken` contract, and the `call` function will not have any effect.",1027,218,19.747278690338135
38,unchecked low level calls," Yes, the provided code is vulnerable due to the unchecked low-level calls. Specifically, in the `WithdrawToken` function of the `Token` contract, the `token.call` function is used without checking its return value. This can lead to fail-opens and other unwanted outcomes if the call to the `transfer` function in the `token` contract fails.

The same vulnerability is present in the `TokenBank` contract's `WithdrawToHolder` function, where the `_addr.call.value(_wei)` function call is used without checking its return value.

Therefore, both the `Token` and `TokenBank` contracts are vulnerable to unchecked low-level calls.",1702,154,14.418779134750366
39,unchecked low level calls," Yes, the smart contract code is vulnerable. The vulnerability lies in the following lines:

- 69: `extra[0].call.value(_share).gas(800000)();`
- 71: `extra[1].call.value(_share).gas(800000)();`
- 73: `extra[2].call.value(_share).gas(800000)();`
- 75: `extra[3].call.value(_share).gas(800000)();`

The `call.value()` function call can fail, and if it does, the contract will continue executing without reverting the state changes made before the failed call. This can lead to inconsistencies and potential security issues. To fix this, the contract should check the return value of the `call.value()` function and handle any failures appropriately.",2750,208,19.311981439590454
40,unchecked low level calls," Yes, the contract is vulnerable. The vulnerability is in the `execute` function in the `Owned` contract, which is inherited by the `Marriage` contract. The line `_dst.call.value(_value)(_data);` does not check the return value of the `call` function, which can lead to fail-opens and other unwanted outcomes if the call to `_dst` fails.

The `CustomToken` contract does not use the `execute` function, so it is not directly vulnerable. However, if any contract that inherits from `Owned` and uses the `execute` function interacts with the `CustomToken` contract, it could be vulnerable to the same issue.",2190,151,14.188114643096924
41,unchecked low level calls," Yes, the provided code is vulnerable. The vulnerability lies in the `execute` function of the `Owned` contract, which is inherited by the `WedIndex` contract. Specifically, the line `_dst.call.value(_value)(_data);` is a potential security risk. If `_value` is not properly checked, an integer overflow or underflow could occur, leading to potential security issues. Additionally, as mentioned in the given text, the use of `call` without checking its return value can lead to fail-opens and other unwanted outcomes.

The `CustomToken` contract does not inherit from `Owned` and does not contain any calls to external contracts, so it is not directly vulnerable based on the provided code. However, if it is used in conjunction with a vulnerable `Owned` contract, it could still be at risk.",1468,184,16.93927526473999
42,unchecked low level calls," Answer:

NO, the following smart contract code is not vulnerable in the given function:

`function Command(address adr,bytes data) payable public { require(msg.sender == Owner); adr.call.value(msg.value)(data); }`

The reason is that in this part of the code, the function `Command` requires the sender to be the owner, so only the owner can call this function. Therefore, even if the `adr.call.value(msg.value)(data)` line contains a vulnerability, it can only be exploited by the owner, which limits the potential damage. However, it is still good practice to include error checking after low-level calls to ensure that they are executed successfully.",2219,161,15.088558435440063
43,unchecked low level calls," Yes, the smart contract code is vulnerable. The vulnerability lies in the `sendToWinner()` function in the `Lotto` contract, specifically in the line `winner.send(winAmount);`. If the `winner` is a contract that throws an error upon receiving ether, the `send()` function will return false and the execution will continue, potentially leaving the winner without their prize money. The same vulnerability exists in the `withdrawLeftOver()` function as well. Additionally, the `CustomToken` contract has an anomaly where it directly assigns the total supply to the contract creator's address (0x5ebc4B61A0E0187d9a72Da21bfb8b45F519cb530) in the constructor, which may not be a vulnerability but is worth noting.",808,189,17.198604345321655
44,unchecked low level calls," Yes, the provided code is vulnerable. The vulnerability lies in the `Command` function of the `FreeEth` contract, which calls an external contract using the low-level `call.value` function without checking its return value. If the external contract throws an exception, the `call.value` function will return false, but the code will continue to execute, potentially leading to unwanted outcomes. This is the same vulnerability type as in the given code ('unchecked low level calls').",1389,103,9.766447067260742
