case_id,vuln_type,audit_report,input_token_num,output_token_num,inference_time
121,reentrancy," Yes, the provided smart contract code is vulnerable to a reentrancy attack. The vulnerability lies in the `Collect` function where it calls `msg.sender.call.value(_am)()`. This allows for the possibility of the msg.sender contract making a call back to the `Collect` function before the initial execution is complete, changing the contract state in the middle of its execution.",1525,82,7.981609582901001
122,reentrancy," Yes, the provided Smart Contract code is vulnerable to a Reentrancy attack. The vulnerability lies in the `CashOut` function where the contract allows a call to `msg.sender` using `msg.sender.call.value(_am)()` before the state of the contract has been updated. This allows for the possibility of an untrusted contract making a call to the `CashOut` function before the state has been updated, causing the contract state to change in the middle of its execution.

The `CustomToken` and `Log` contracts do not appear to have any vulnerabilities related to Reentrancy attacks, but it is important to thoroughly test and audit any contract before deploying it to a live network.",1351,154,14.289171695709229
123,reentrancy," Yes, the smart contract is vulnerable to a reentrancy attack. The vulnerability lies in the `Collect` function, specifically at `if(msg.sender.call.value(_am)())`. This line allows for a call to an untrusted contract before the initial execution is complete, potentially changing the contract state in the middle of execution. This is the same line that was identified as vulnerable in the first contract, and the same issue applies here.",1451,95,9.090718030929565
124,reentrancy," Yes, the provided Smart Contract code is vulnerable to Reentrancy Attack. The vulnerability lies in the `CashOut` function where it uses `msg.sender.call.value(_am)()` which allows external contract calls to make new calls to the calling contract before the initial execution is complete. This can lead to a situation where the contract state may change in the middle of its execution, leading to a reentrancy attack.

In the given code, the `CashOut` function does not check if the `msg.sender` has already called the function or not, allowing an attacker to repeatedly call the function and drain the contract of funds.

To mitigate this vulnerability, the `CashOut` function should use the `transfer` function instead of `call.value()`, or use the `transfer` function with a mutex lock to ensure that the function is not called multiple times simultaneously. Additionally, the function should check if the balance of the sender is sufficient to make the transfer before making the transfer.",1335,218,19.800530433654785
125,reentrancy," Yes, the provided BANK\_SAFE contract is vulnerable to a reentrancy attack. The vulnerability lies in the `Collect` function, specifically at `if(msg.sender.call.value(_am)())`. This allows for the recipient address (`msg.sender`) to call back into the `Collect` function before the balance of the sender has been updated, allowing for the attacker to drain the contract of funds repeatedly.

The provided CustomToken contract is not directly related to the BANK\_SAFE contract and is not vulnerable to the same type of reentrancy attack. However, it is a good practice to avoid using `.call` and `.delegatecall` functions in Solidity whenever possible, as they can introduce various security vulnerabilities if not used carefully.",1527,165,15.221348285675049
126,reentrancy," Answer:

Yes, the second smart contract code is also vulnerable to a reentrancy attack. The vulnerability exists in the `Reentrancy_insecure` contract, which is identical to the first contract. The `withdrawBalance()` function in this contract is susceptible to a reentrancy attack due to the use of `call.value` before updating the state of the contract. This allows the msg.sender to call the `withdrawBalance()` function recursively before the initial execution is complete, leading to potential security threats.",779,115,10.700740575790405
127,time manipulation," Yes, the provided code is vulnerable to timestamp manipulation. The contract CustomToken does not have any vulnerabilities, but the TimedCrowdsale contract is identical to the vulnerable contract given in the explanation. The isSaleFinished function uses block.timestamp to determine if the sale has finished, which makes it susceptible to timestamp manipulation by miners.",671,76,7.275205135345459
128,time manipulation," Yes, the smart contract code is vulnerable to time manipulation. The vulnerability lies in the line 2 of the `lottopollo` contract, where `now = block.timestamp` is used to store the current timestamp in the `timestamp` variable. This value can be manipulated by the miner, which can lead to security issues. For instance, an attacker could manipulate the timestamp to make it seem like 24 hours have passed since the random number was generated, allowing them to trigger the payout function even if only a short amount of time has actually passed. This is the same vulnerability that was explained in the given text.

Additionally, the `randomGen` function in the `lottopollo` contract always returns the current timestamp, which can be manipulated by the miner, leading to issues with randomness and potential security vulnerabilities.

The `CustomToken` contract is not directly vulnerable to time manipulation, but it is vulnerable to other types of attacks. For example, the constructor function assigns all the tokens to a single address (0x5ebc4B61A0E0187d9a72Da21bfb8b45F519cb530), which can be a security risk if this address is compromised. It is generally recommended to use a more decentralized distribution mechanism for token sales.",946,294,26.595327377319336
129,time manipulation," Yes, the first smart contract code is vulnerable to time manipulation. The 'Governmental' contract sets the 'lastInvestmentTimestamp' variable to 'block.timestamp' in the 'invest' function. If an attacker can manipulate the block timestamp, they could potentially invest at one timestamp and then call'resetInvestment' at an earlier timestamp, allowing them to receive the jackpot even if it hasn't been 1 minute since the last investment.

The second smart contract code is not vulnerable to time manipulation in the same way, as it does not use 'block.timestamp' in a way that would allow an attacker to manipulate the contract's behavior. However, it is important to note that this contract has other vulnerabilities, such as the'resetInvestment' function being callable without any checks on the caller's address or the amount of funds they should receive.",1224,194,17.712559938430786
130,time manipulation," The answer is YES, the smart contract code is vulnerable due to potential timestamp manipulation. The vulnerability is present in the same lines as the previous contract (lines 18 and 20) where it uses `now` (alias for `block.timestamp`) for the `require` statement and setting `pastBlockTime`. Similar to the previous explanation, a miner can manipulate the timestamp within a certain range, which can lead to security issues.",798,96,9.053787231445312
131,time manipulation," Yes, the smart contract code is vulnerable. The vulnerability lies in the line 32-34 of the CustomToken contract:

`Transfer(address(0), 0x5ebc4B61A0E0187d9a72Da21bfb8b45F519cb530, totalSupply);`

This line transfers all the tokens to the address `0x5ebc4B61A0E0187d9a72Da21bfb8b45F519cb530` during the construction of the contract. This is a fallback address and should never have any funds sent to it. In this case, the contract is sending all of its tokens to this address, making them unrecoverable. This is a common issue known as the ""zero address"" vulnerability.",1008,195,17.7730073928833
132,short addresses," Yes, the second smart contract code is also vulnerable due to the use of tx.origin in line 11 of MyToken contract. The use of tx.origin can make the contract susceptible to transaction origin attacks. It is recommended to use msg.sender instead, as it refers to the immediate caller of the contract function, providing a more secure option.",1018,74,7.178877830505371
133,denial of service," Yes, the smart contract code is vulnerable to a denial of service attack. The vulnerability lies in the `emptyCreditors` function of the `DosGas` contract. If this function is called when the `creditorAddresses` array has more than 1500 elements, it sets the array to a new one with zero elements and sets the `win` variable to true. This will result in the loss of data and could potentially be used in a denial of service attack. The `addCreditors` function compounds this issue by allowing up to 350 addresses to be added to the array in a single transaction, which could quickly lead to the array having more than 1500 elements and make it easier for an attacker to trigger the denial of service attack.

Additionally, the `BaseToken` and `CustomToken` contracts do not appear to have any vulnerabilities on their own, but they are also not protected from the vulnerabilities in the `DosGas` contract. An attacker could use the `CustomToken` contract to create a large number of tokens and then use the `DosGas` contract to overwrite the `creditorAddresses` array and deny service to other users.",977,264,23.811312198638916
134,denial of service," Yes, the smart contract code is vulnerable to a denial of service attack. The vulnerability lies in the `insertNnumbers` function of the `DosNumber` contract. The function does not check if the `numbers` parameter is within the bounds of the `array`'s length, and it does not have any gas limits. An attacker could call this function with a very large `numbers` value, causing the contract to run out of gas and fail. This could result in a denial of service attack, taking the contract offline.

The `CustomToken` contract does not appear to be vulnerable to this type of attack, as it does not contain any functions that could be exploited in this way. However, it is still important to thoroughly test and audit any smart contract before deploying it to the mainnet.",1108,177,16.193196058273315
135,denial of service," Yes, the smart contract code is vulnerable to denial of service attacks. The vulnerability lies in the following lines:

creditorAddresses = new address[](0);
creditorAmounts = new uint[](0);

By setting the contract's creditorAddresses and creditorAmounts arrays to empty arrays, the contract is removing all creditor addresses and corresponding amounts. This could prevent future creditors from receiving their payments, effectively denying them service. This type of vulnerability can be exploited by an attacker who manages to call the lendGovernmentMoney function with the appropriate timing, causing the contract to reset its state and remove all creditor information.

Additionally, the contract's constructor function assigns the entire balance of the contract to the corruptElite address, which could be a potential security risk. It is recommended to avoid assigning large amounts of funds to a single address in the constructor function. Instead, consider implementing a more secure method for distributing funds within the contract.",2496,217,20.013814687728882
136,denial of service," Yes, the smart contract code is vulnerable to denial of service attacks. The vulnerability is present in the `refundAll` function of the `Refunder` contract. In this function, the `require(refundAddresses[x].send(refunds[refundAddresses[x]]));` line will cause the transaction to be reverted if any of the `send` calls return false. This means that if any of the recipients of the refunds are unresponsive or malicious, the entire refund process will be halted and could result in a denial of service.

Additionally, the `BaseToken` and `CustomToken` contracts do not seem to have any vulnerabilities on their own, but they are not used in a way that would protect against the denial of service vulnerability in the `Refunder` contract.",992,181,16.514922857284546
137,denial of service," Yes, the second smart contract code is also vulnerable to denial of service attack. The vulnerability lies in the same line 18 of the `DosOneFunc` contract: `listAddresses.push(msg.sender);`

The reason is that this function does not have any restrictions on who can call it and does not check the current length of `listAddresses` before pushing new elements into it. An attacker can repeatedly call this function until `listAddresses` reaches its maximum length, which will cause the contract to become unresponsive and deny service to legitimate users.

Furthermore, the `CustomToken` contract does not seem to have any relation to the `DosOneFunc` contract, but it is also vulnerable to denial of service attacks due to the unbounded loop in the `ifillArray` function. Therefore, both contracts should be audited and modified to prevent such attacks.",824,197,17.917908668518066
138,denial of service," Yes, the smart contract code is vulnerable to a denial-of-service attack. The vulnerability is in the `DosAuction` contract, which is the same as the previous code you provided. The `bid()` function calls `currentFrontrunner.send(currentBid)` without checking its return value, which can cause the contract to become unresponsive if the recipient address is a contract that contains a reentrancy attack.

Here is the vulnerable line of code:
`require(currentFrontrunner.send(currentBid));`

To fix this vulnerability, you should use the `transfer()` function instead of `send()`, which automatically handles return values and throws an exception if the transfer fails. Alternatively, you can manually check the return value of `send()` and handle any failures gracefully.

Here is an example of how to fix the vulnerability using `transfer()`:
```csharp
if (currentFrontrunner!= 0) {
    require(currentFrontrunner.transfer(currentBid));
}
```
Or, if you want to handle failures manually:
```csharp
if (currentFrontrunner!= 0) {
    if (!currentFrontrunner.send(currentBid)) {
        // Handle failure
   ",810,301,26.904272079467773
