case_id,vuln_type,audit_report,gt,eval_score,eval_input_token_num,eval_output_token_num,eval_inference_time
177781,DoS Exec Code Overflow,"  NO, the given code is not vulnerable to a DoS Exec Code Overflow.

The code is a function that takes three parameters: `in`, `out`, and `length`. It appears to be a part of a graphics library, and it is responsible for converting a grayscale image to a different color space. The function uses a switch statement to determine the color space, and it has a default case that handles the conversion.

The code does not appear to have any obvious vulnerabilities, and it does not contain any code that could be used to execute arbitrary code. The only potential vulnerability I can see is if the `length` parameter is not properly validated, which could lead to a buffer overflow or other type of error. However, this is not a DoS Exec Code Overflow vulnerability, as it does not involve executing arbitrary code.

Therefore, I would say that the code is not vulnerable to a DoS Exec Code Overflow.","The code contains a DoS_Exec_Code_Overflow vulnerability. 
The CVE-ID is CVE-2009-3605. The CWE-ID is CWE-189.
Vulnerability summary:
Multiple integer overflows in Poppler 0.10.5 and earlier allow remote attackers to cause a denial of service (application crash) or possibly execute arbitrary code via a crafted PDF file, related to (1) glib/poppler-page.cc; (2) ArthurOutputDev.cc, (3) CairoOutputDev.cc, (4) GfxState.cc, (5) JBIG2Stream.cc, (6) PSOutputDev.cc, and (7) SplashOutputDev.cc in poppler/; and (8) SplashBitmap.cc, (9) Splash.cc, and (10) SplashFTFont.cc in splash/.  NOTE: this may overlap CVE-2009-0791.
",1.0,889.0,6.0,2.782243490219116
177783,DoS Exec Code Overflow,"  NO, the given code is not vulnerable to a DoS Exec Code Overflow.

The code is a function that takes in a pointer to an array of bytes, a pointer to an array of unsigned integers, and an integer representing the length of the arrays. It then performs some operations on the arrays and returns a value.

The code does not contain any obvious vulnerabilities related to buffer overflows, use after free, memory leaks, integer overflow/underflow, null pointer dereferences, improper input validation, race conditions, insecure function usage, insecure resource management, improper error handling, cryptographic issues, or sensitive data exposure.

However, it is possible that the code could be vulnerable to other types of security vulnerabilities, such as SQL injection or cross-site scripting (XSS), depending on how the function is used and the context in which it is executed.","The code contains a DoS_Exec_Code_Overflow vulnerability. 
The CVE-ID is CVE-2009-3605. The CWE-ID is CWE-189.
Vulnerability summary:
Multiple integer overflows in Poppler 0.10.5 and earlier allow remote attackers to cause a denial of service (application crash) or possibly execute arbitrary code via a crafted PDF file, related to (1) glib/poppler-page.cc; (2) ArthurOutputDev.cc, (3) CairoOutputDev.cc, (4) GfxState.cc, (5) JBIG2Stream.cc, (6) PSOutputDev.cc, and (7) SplashOutputDev.cc in poppler/; and (8) SplashBitmap.cc, (9) Splash.cc, and (10) SplashFTFont.cc in splash/.  NOTE: this may overlap CVE-2009-0791.
",1.0,874.0,6.0,2.0658111572265625
177786,DoS Exec Code Overflow,"  YES, the given code is vulnerable to a DoS_Exec_Code_Overflow vulnerability. The CVE-ID is CVE-2009-3605. The CWE-ID is CWE-189.

The vulnerability arises from the use of the `ImageStream` class, which is used to read image data from a stream. The `ImageStream` class has a `getLine` method that reads a line of image data from the stream and returns it as a `SplashColorPtr`. The `SplashColorPtr` is a pointer to an array of `SplashColor` objects, which are used to represent the color of each pixel in the image.

The vulnerability occurs when the `ImageStream` class is used to read an image with a large number of pixels. If the image has a large number of pixels, the `getLine` method may return a `SplashColorPtr` that points to an array of `SplashColor` objects that is too large to fit in the available memory. This can cause a buffer overflow, which can lead to an exploitable crash or arbitrary code execution.

To exploit this vulnerability, an attacker would need to craft a specially crafted PDF file that contains an image with a large number of pixels. The attacker would then need to send the specially crafted PDF file","The code contains a DoS_Exec_Code_Overflow vulnerability. 
The CVE-ID is CVE-2009-3605. The CWE-ID is CWE-189.
Vulnerability summary:
Multiple integer overflows in Poppler 0.10.5 and earlier allow remote attackers to cause a denial of service (application crash) or possibly execute arbitrary code via a crafted PDF file, related to (1) glib/poppler-page.cc; (2) ArthurOutputDev.cc, (3) CairoOutputDev.cc, (4) GfxState.cc, (5) JBIG2Stream.cc, (6) PSOutputDev.cc, and (7) SplashOutputDev.cc in poppler/; and (8) SplashBitmap.cc, (9) Splash.cc, and (10) SplashFTFont.cc in splash/.  NOTE: this may overlap CVE-2009-0791.
",3.0,964.0,6.0,3.1659796237945557
177787,DoS Exec Code Overflow,"  YES, the given code is vulnerable to a DoS_Exec_Code_Overflow vulnerability. The CVE-ID is CVE-2009-3605. The CWE-ID is CWE-189.

The vulnerability arises from the use of the `ImageStream` class, which is used to read image data from a stream. The `ImageStream` class has a buffer size of 4096 bytes, which can be overflowed by a crafted PDF file. If the image data exceeds this buffer size, it can cause a buffer overflow and potentially execute arbitrary code.

The vulnerability is caused by the `drawMaskedImage` function, which takes a `Stream` object as an argument and uses it to read image data. The `drawMaskedImage` function does not perform any bounds checking on the `Stream` object, which can lead to a buffer overflow if the image data exceeds the buffer size.

To exploit this vulnerability, an attacker can craft a PDF file with a large image data stream, which can overflow the buffer and execute arbitrary code. This can lead to a denial-of-service (DoS) vulnerability, as the application may crash or behave unexpectedly.

To fix this vulnerability, the `ImageStream` class should be modified to perform bounds checking on the `Stream` object, or the","The code contains a DoS_Exec_Code_Overflow vulnerability. 
The CVE-ID is CVE-2009-3605. The CWE-ID is CWE-189.
Vulnerability summary:
Multiple integer overflows in Poppler 0.10.5 and earlier allow remote attackers to cause a denial of service (application crash) or possibly execute arbitrary code via a crafted PDF file, related to (1) glib/poppler-page.cc; (2) ArthurOutputDev.cc, (3) CairoOutputDev.cc, (4) GfxState.cc, (5) JBIG2Stream.cc, (6) PSOutputDev.cc, and (7) SplashOutputDev.cc in poppler/; and (8) SplashBitmap.cc, (9) Splash.cc, and (10) SplashFTFont.cc in splash/.  NOTE: this may overlap CVE-2009-0791.
",3.0,964.0,6.0,2.7341549396514893
177788,DoS Exec Code Overflow,"  YES, the given code is vulnerable to a DoS_Exec_Code_Overflow vulnerability. The CVE-ID is CVE-2009-3605. The CWE-ID is CWE-189.

The vulnerability arises from the use of the `ImageStream` class, which is used to read image data from a stream. The `ImageStream` class has a buffer overflow vulnerability, which can be exploited to cause a denial of service (application crash) or possibly execute arbitrary code.

The vulnerability is caused by the `ImageStream::getNextLine()` function, which reads the next line of image data from the stream. The function has a buffer overflow vulnerability because it does not properly check the size of the buffer before writing data to it. This can cause the buffer to overflow, leading to a crash or arbitrary code execution.

The vulnerability can be exploited by sending a crafted PDF file with a large image, which can cause the buffer to overflow and lead to a denial of service or arbitrary code execution.","The code contains a DoS_Exec_Code_Overflow vulnerability. 
The CVE-ID is CVE-2009-3605. The CWE-ID is CWE-189.
Vulnerability summary:
Multiple integer overflows in Poppler 0.10.5 and earlier allow remote attackers to cause a denial of service (application crash) or possibly execute arbitrary code via a crafted PDF file, related to (1) glib/poppler-page.cc; (2) ArthurOutputDev.cc, (3) CairoOutputDev.cc, (4) GfxState.cc, (5) JBIG2Stream.cc, (6) PSOutputDev.cc, and (7) SplashOutputDev.cc in poppler/; and (8) SplashBitmap.cc, (9) Splash.cc, and (10) SplashFTFont.cc in splash/.  NOTE: this may overlap CVE-2009-0791.
",4.0,905.0,6.0,2.3849055767059326
177789,DoS Exec Code Overflow,"  NO, the given code is not vulnerable to a DoS_Exec_Code_Overflow vulnerability.

The code does not contain any integer overflows that could lead to a denial of service or arbitrary code execution. The integer variables are used in a controlled manner, and the code does not contain any unvalidated user inputs or unchecked calculations that could cause integers to wrap around.

However, the code does contain a potential buffer overflow vulnerability in the `cairo_image_surface_create_for_data` function. The `cairo_rowstride` variable is calculated based on the `cairo_width` variable, which is calculated based on the `width` variable, which is a user-supplied value. If the user-supplied value is too large, it could cause a buffer overflow. However, the code does not contain any checks to prevent this.

Additionally, the code does not contain any memory leaks or use-after-free errors. The `cairo_data` variable is allocated using `gmalloc`, which is a memory allocation function that returns a pointer to a block of memory. The memory is not freed until the `cairo_data` variable goes out of scope.

Overall, while the code does contain some potential vulnerabilities, it does not contain any DoS_Exec_Code_Overflow vulnerabilities.","The code contains a DoS_Exec_Code_Overflow vulnerability. 
The CVE-ID is CVE-2009-3605. The CWE-ID is CWE-189.
Vulnerability summary:
Multiple integer overflows in Poppler 0.10.5 and earlier allow remote attackers to cause a denial of service (application crash) or possibly execute arbitrary code via a crafted PDF file, related to (1) glib/poppler-page.cc; (2) ArthurOutputDev.cc, (3) CairoOutputDev.cc, (4) GfxState.cc, (5) JBIG2Stream.cc, (6) PSOutputDev.cc, and (7) SplashOutputDev.cc in poppler/; and (8) SplashBitmap.cc, (9) Splash.cc, and (10) SplashFTFont.cc in splash/.  NOTE: this may overlap CVE-2009-0791.
",2.0,961.0,6.0,2.090332508087158
177792,DoS Exec Code Overflow,  NO,"The code contains a DoS_Exec_Code_Overflow vulnerability. 
The CVE-ID is CVE-2009-3605. The CWE-ID is CWE-189.
Vulnerability summary:
Multiple integer overflows in Poppler 0.10.5 and earlier allow remote attackers to cause a denial of service (application crash) or possibly execute arbitrary code via a crafted PDF file, related to (1) glib/poppler-page.cc; (2) ArthurOutputDev.cc, (3) CairoOutputDev.cc, (4) GfxState.cc, (5) JBIG2Stream.cc, (6) PSOutputDev.cc, and (7) SplashOutputDev.cc in poppler/; and (8) SplashBitmap.cc, (9) Splash.cc, and (10) SplashFTFont.cc in splash/.  NOTE: this may overlap CVE-2009-0791.
",1.0,706.0,6.0,4.203668594360352
177793,DoS Exec Code Overflow,"  YES, the given code is vulnerable to a DoS_Exec_Code_Overflow vulnerability. The CVE-ID is CVE-2009-3605. The CWE-ID is CWE-189.

The vulnerability arises from the use of the FT_Load_Glyph function, which can cause a buffer overflow if the input glyph index is too large. The function takes an FT_UInt as input, which is an unsigned integer type. However, the function does not perform any bounds checking on the input value, which means that an attacker can potentially overflow the buffer by providing a large value for the glyph index.

To exploit this vulnerability, an attacker would need to provide a crafted PDF file that contains a large glyph index value. The attacker could then use this value to overflow the buffer and execute arbitrary code.

This vulnerability is similar to CVE-2009-0791, which is also a DoS_Exec_Code_Overflow vulnerability in Poppler. However, this vulnerability is specific to the SplashFTFont::makeGlyph function, while CVE-2009-0791 is a more general vulnerability that affects multiple functions in Poppler.","The code contains a DoS_Exec_Code_Overflow vulnerability. 
The CVE-ID is CVE-2009-3605. The CWE-ID is CWE-189.
Vulnerability summary:
Multiple integer overflows in Poppler 0.10.5 and earlier allow remote attackers to cause a denial of service (application crash) or possibly execute arbitrary code via a crafted PDF file, related to (1) glib/poppler-page.cc; (2) ArthurOutputDev.cc, (3) CairoOutputDev.cc, (4) GfxState.cc, (5) JBIG2Stream.cc, (6) PSOutputDev.cc, and (7) SplashOutputDev.cc in poppler/; and (8) SplashBitmap.cc, (9) Splash.cc, and (10) SplashFTFont.cc in splash/.  NOTE: this may overlap CVE-2009-0791.
",4.0,932.0,6.0,3.6461181640625
177794,,"  NO, the given code is not vulnerable to a nan vulnerability. The code is a C++ function that initializes a class with a constructor. It does not contain any arithmetic operations that could lead to a nan vulnerability.","The code contains a nan vulnerability. 
The CVE-ID is CVE-2017-16853. The CWE-ID is CWE-347.
Vulnerability summary:
The DynamicMetadataProvider class in saml/saml2/metadata/impl/DynamicMetadataProvider.cpp in OpenSAML-C in OpenSAML before 2.6.1 fails to properly configure itself with the MetadataFilter plugins and does not perform critical security checks such as signature verification, enforcement of validity periods, and other checks specific to deployments, aka CPPOST-105.
",1.0,672.0,6.0,3.652658462524414
177795,,"  YES, the code is vulnerable to a buffer overflow vulnerability. The function takes a `DOMElement*` as an argument, and then uses `XMLHelper::getAttrBool` to get the value of the `verifyHost` attribute. However, the `XMLHelper::getAttrBool` function does not perform any bounds checking on the input string, which means that it can read past the end of the input buffer if the input string is too long. This can lead to a buffer overflow and potentially execute arbitrary code.","The code contains a nan vulnerability. 
The CVE-ID is CVE-2017-16852. The CWE-ID is CWE-347.
Vulnerability summary:
shibsp/metadata/DynamicMetadataProvider.cpp in the Dynamic MetadataProvider plugin in Shibboleth Service Provider before 2.6.1 fails to properly configure itself with the MetadataFilter plugins and does not perform critical security checks such as signature verification, enforcement of validity periods, and other checks specific to deployments, aka SSPCPP-763.
",2.0,728.0,6.0,1.8266527652740479
177796,Overflow,"  NO, the given code is not vulnerable to a buffer overflow. The code is using a fixed-size buffer to store the data, and the buffer is not being modified or accessed outside of its bounds. Therefore, there is no possibility of a buffer overflow.","The code contains a Overflow vulnerability. 
The CVE-ID is CVE-2019-15938. The CWE-ID is CWE-119.
Vulnerability summary:
Pengutronix barebox through 2019.08.1 has a remote buffer overflow in nfs_readlink_req in fs/nfs.c because a length field is directly used for a memcpy.
",1.0,644.0,6.0,3.2566678524017334
177799,Overflow,"  NO, the given code is not vulnerable to any security vulnerabilities.

The code is a function that reads an image from a file and returns an XcursorImage structure. It does not appear to have any buffer overflow vulnerabilities, as it does not involve any user-supplied data or unchecked input.

The code also does not appear to have any other security vulnerabilities, such as use-after-free, memory leaks, or integer overflow/underflow.

However, it is possible that the code could be vulnerable to other types of security issues, such as null pointer dereferences or improper error handling. But based on the code provided, it does not appear to be vulnerable to any of these issues.","The code contains a Overflow vulnerability. 
The CVE-ID is CVE-2017-16612. The CWE-ID is CWE-190.
Vulnerability summary:
libXcursor before 1.1.15 has various integer overflows that could lead to heap buffer overflows when processing malicious cursors, e.g., with programs like GIMP. It is also possible that an attack vector exists against the related code in cursor/xcursor.c in Wayland through 1.14.0.
",1.0,758.0,6.0,4.0619542598724365
177807,Bypass,"  NO, the given code is not vulnerable to a Bypass vulnerability. The code is a function that takes a dictionary as input and returns the number of color components in the ICC profile. It does not have any direct access to the input dictionary or any potential bypass vulnerabilities. The function only uses the input dictionary to extract the number of color components and then returns that value. Therefore, there is no potential for a bypass vulnerability in this code.","The code contains a Bypass vulnerability. 
The CVE-ID is CVE-2018-19476. The CWE-ID is CWE-704.
Vulnerability summary:
psi/zicc.c in Artifex Ghostscript before 9.26 allows remote attackers to bypass intended access restrictions because of a setcolorspace type confusion.
",1.0,674.0,6.0,3.5249011516571045
177809,Bypass,"  NO, the code is not vulnerable to a bypass vulnerability. The code checks whether the device remains the same before calling the `get_page_device` procedure, and it also checks whether the page device dictionaries are the same before returning. Therefore, the code does not allow bypassing the intended access restrictions.","The code contains a Bypass vulnerability. 
The CVE-ID is CVE-2018-19475. The CWE-ID is nan.
Vulnerability summary:
psi/zdevice2.c in Artifex Ghostscript before 9.26 allows remote attackers to bypass intended access restrictions because available stack space is not checked when the device remains the same.
",1.0,650.0,6.0,3.239044189453125
177811,DoS,"  NO, the given code is not vulnerable to a DoS attack.

The code checks the size of the AS_PATH segment and writes it to the stream if it fits within the available space. It also checks if the next segment can be 'packed' together with the current segment, and if so, it updates the length of the segment header accordingly.

There is no way for an attacker to exploit this code to cause a DoS attack, as the code always checks the size of the AS_PATH segment before writing it to the stream. Additionally, the code does not allow the attacker to write more than the available space in the stream, so there is no way for the attacker to cause a buffer overflow.

Therefore, the code is not vulnerable to a DoS attack.","The code contains a DoS vulnerability. 
The CVE-ID is CVE-2017-16227. The CWE-ID is CWE-20.
Vulnerability summary:
The aspath_put function in bgpd/bgp_aspath.c in Quagga before 1.2.2 allows remote attackers to cause a denial of service (session drop) via BGP UPDATE messages, because AS_PATH size calculation for long paths counts certain bytes twice and consequently constructs an invalid message.
",1.0,769.0,6.0,2.718698263168335
177812,Bypass,  NO,"The code contains a Bypass vulnerability. 
The CVE-ID is CVE-2017-15994. The CWE-ID is CWE-354.
Vulnerability summary:
rsync 3.1.3-development before 2017-10-24 mishandles archaic checksums, which makes it easier for remote attackers to bypass intended access restrictions. NOTE: the rsync development branch has significant use beyond the rsync developers, e.g., the code has been copied for use in various GitHub projects.
",1.0,626.0,6.0,3.10150146484375
177815,Bypass,"  NO. The code is not vulnerable to a bypass vulnerability. The function is using a switch statement to determine the checksum type, and it is properly handling the different types of checksums. The code is also properly closing the file descriptor and unmapping the file buffer.","The code contains a Bypass vulnerability. 
The CVE-ID is CVE-2017-15994. The CWE-ID is CWE-354.
Vulnerability summary:
rsync 3.1.3-development before 2017-10-24 mishandles archaic checksums, which makes it easier for remote attackers to bypass intended access restrictions. NOTE: the rsync development branch has significant use beyond the rsync developers, e.g., the code has been copied for use in various GitHub projects.
",1.0,677.0,6.0,2.9388937950134277
177816,Bypass,"  NO. The code is not vulnerable to a bypass vulnerability. The function is using the `md_context` structure to store the checksum, which is not affected by the `checksum_seed` variable. The `md_context` structure is not used to store the checksum seed, and the `checksum_seed` variable is only used to modify the checksum value. Therefore, the code is not vulnerable to a bypass vulnerability.","The code contains a Bypass vulnerability. 
The CVE-ID is CVE-2017-15994. The CWE-ID is CWE-354.
Vulnerability summary:
rsync 3.1.3-development before 2017-10-24 mishandles archaic checksums, which makes it easier for remote attackers to bypass intended access restrictions. NOTE: the rsync development branch has significant use beyond the rsync developers, e.g., the code has been copied for use in various GitHub projects.
",1.0,706.0,6.0,3.1401443481445312
177821,DoS,  NO. The code is not vulnerable to a DoS attack. The function `maxDistance` takes a vector of vectors of integers as an argument and returns the maximum distance from the starting point to any other point in the grid. The function does not have any vulnerabilities that could be exploited by an attacker to cause a denial of service.,"The code contains a DoS vulnerability. 
The CVE-ID is CVE-2017-15923. The CWE-ID is nan.
Vulnerability summary:
Konversation 1.4.x, 1.5.x, 1.6.x, and 1.7.x before 1.7.3 allow remote attackers to cause a denial of service (crash) via vectors related to parsing of IRC color formatting codes.
",1.0,676.0,6.0,2.626007080078125
177823,Exec Code Overflow,"  NO, the given code is not vulnerable to Exec Code Overflow.

The code is a function that reads compressed data from a file and decompresses it. It uses a LZW (Lempel-Ziv-Welch) algorithm to decompress the data. The function does not have any obvious vulnerabilities related to Exec Code Overflow.

However, it is possible that the function could be vulnerable to other types of vulnerabilities, such as buffer overflows or use-after-free errors, if the input data is not properly validated or if the function is not properly bounds-checked.","The code contains a Exec_Code_Overflow vulnerability. 
The CVE-ID is CVE-2011-2895. The CWE-ID is CWE-119.
Vulnerability summary:
The LZW decompressor in (1) the BufCompressedFill function in fontfile/decompress.c in X.Org libXfont before 1.4.4 and (2) compress/compress.c in 4.3BSD, as used in zopen.c in OpenBSD before 3.8, FreeBSD, NetBSD 4.0.x and 5.0.x before 5.0.3 and 5.1.x before 5.1.1, FreeType 2.1.9, and other products, does not properly handle code words that are absent from the decompression table when encountered, which allows context-dependent attackers to trigger an infinite loop or a heap-based buffer overflow, and possibly execute arbitrary code, via a crafted compressed stream, a related issue to CVE-2006-1168 and CVE-2011-2896.
",1.0,848.0,6.0,3.415573835372925
177825,DoS,"  NO, the given code is not vulnerable to a DoS attack. The code checks the input parameters and returns an error message if the input is invalid. It also uses a queue to traverse the grid, which is a data structure that is designed to prevent DoS attacks. Therefore, the code is not vulnerable to a DoS attack.","The code contains a DoS vulnerability. 
The CVE-ID is CVE-2013-4474. The CWE-ID is CWE-20.
Vulnerability summary:
Format string vulnerability in the extractPages function in utils/pdfseparate.cc in poppler before 0.24.3 allows remote attackers to cause a denial of service (crash) via format string specifiers in a destination filename.
",1.0,669.0,6.0,3.121083974838257
177826,DoS Exec Code Overflow,  NO. The code is not vulnerable to a DoS_Exec_Code_Overflow vulnerability. The function does not have any buffer overflow vulnerabilities.,"The code contains a DoS_Exec_Code_Overflow vulnerability. 
The CVE-ID is CVE-2013-4473. The CWE-ID is CWE-119.
Vulnerability summary:
Stack-based buffer overflow in the extractPages function in utils/pdfseparate.cc in poppler before 0.24.2 allows remote attackers to cause a denial of service (crash) and possibly execute arbitrary code via a source filename.
",1.0,635.0,6.0,3.3132498264312744
