case_id,vuln_type,audit_report,gt,eval_score,eval_input_token_num,eval_output_token_num,eval_inference_time
177736,Bypass,  NO. The code is not vulnerable to a bypass vulnerability. The function is checking the user account control bits and comparing them to a list of required rights. It is not allowing any user to bypass the access restrictions by leveraging the existence of a domain with both a Samba DC and a Windows DC.,"The code contains a Bypass vulnerability. 
The CVE-ID is CVE-2015-8467. The CWE-ID is CWE-264.
Vulnerability summary:
The samldb_check_user_account_control_acl function in dsdb/samdb/ldb_modules/samldb.c in Samba 4.x before 4.1.22, 4.2.x before 4.2.7, and 4.3.x before 4.3.3 does not properly check for administrative privileges during creation of machine accounts, which allows remote authenticated users to bypass intended access restrictions by leveraging the existence of a domain with both a Samba DC and a Windows DC, a similar issue to CVE-2015-2535.
",1.0,727.0,6.0,3.663480520248413
177740,DoS Exec Code Overflow Mem. Corr.,"  NO, the given code is not vulnerable to any of the security vulnerabilities you mentioned.

The code is a function that takes an ASN1_UTCTIME struct as input and returns a time_t value. It appears to be parsing the time string correctly and returning the correct time value.

The code does not contain any buffer overflow vulnerabilities, use after free vulnerabilities, memory leaks, integer overflow/underflow vulnerabilities, null pointer dereferences, improper input validation, race conditions, insecure function usage, insecure resource management, or improper error handling.

Therefore, I would say that the code is not vulnerable to any of the security vulnerabilities you mentioned.","The code contains a DoS_Exec_Code_Overflow_Mem._Corr. vulnerability. 
The CVE-ID is CVE-2013-6420. The CWE-ID is CWE-119.
Vulnerability summary:
The asn1_time_to_time_t function in ext/openssl/openssl.c in PHP before 5.3.28, 5.4.x before 5.4.23, and 5.5.x before 5.5.7 does not properly parse (1) notBefore and (2) notAfter timestamps in X.509 certificates, which allows remote attackers to execute arbitrary code or cause a denial of service (memory corruption) via a crafted certificate that is not properly handled by the openssl_x509_parse function.
",1.0,801.0,6.0,3.1773569583892822
177741,DoS Overflow,"  NO, the given code is not vulnerable to a DoS Overflow.

The code is a function that takes a `gnutls_session_t` object and a `void *session_data` pointer as input, and it returns a `size_t` value indicating the size of the session data. The function appears to be responsible for serializing the session data and copying it into the `session_data` buffer.

However, the function does not appear to have any buffer overflow vulnerabilities. The `psession` variable is declared as a `gnutls_datum_t` struct, which is a simple struct that contains a `data` pointer and a `size` field. The function checks the size of the `psession` struct before copying it into the `session_data` buffer, and it also checks the size of the `session_data` buffer before copying the `psession` struct into it. This ensures that the function does not attempt to copy data into the `session_data` buffer that exceeds the size of the buffer.

Therefore, the function does not appear to have any buffer overflow vulnerabilities.","The code contains a DoS_Overflow vulnerability. 
The CVE-ID is CVE-2011-4128. The CWE-ID is CWE-119.
Vulnerability summary:
Buffer overflow in the gnutls_session_get_data function in lib/gnutls_session.c in GnuTLS 2.12.x before 2.12.14 and 3.x before 3.0.7, when used on a client that performs nonstandard session resumption, allows remote TLS servers to cause a denial of service (application crash) via a large SessionTicket.
",1.0,858.0,6.0,2.346417188644409
177742,DoS Overflow,"  NO, the given code is not vulnerable to a DoS Overflow.

The code is a function that takes a `gnutls_session_t` object and a `void *session_data` pointer as input, and it returns a `gnutls_datum_t` object. The function appears to be responsible for serializing the session data into a buffer, and it does so by calling the `_gnutls_session_pack` function.

However, the code does not appear to be vulnerable to a DoS Overflow. The function checks the size of the buffer provided by the caller, and it returns an error if the buffer is too small. This means that the function is not vulnerable to a buffer overflow attack, as the attacker cannot provide a buffer that is large enough to cause an overflow.

Furthermore, the function does not appear to be vulnerable to a use-after-free attack, as it does not use any pointers that have been freed.

Therefore, I conclude that the code is not vulnerable to a DoS Overflow.","The code contains a DoS_Overflow vulnerability. 
The CVE-ID is CVE-2011-4128. The CWE-ID is CWE-119.
Vulnerability summary:
Buffer overflow in the gnutls_session_get_data function in lib/gnutls_session.c in GnuTLS 2.12.x before 2.12.14 and 3.x before 3.0.7, when used on a client that performs nonstandard session resumption, allows remote TLS servers to cause a denial of service (application crash) via a large SessionTicket.
",1.0,840.0,6.0,3.1834559440612793
177743,DoS,"  NO, the given code is not vulnerable to any security vulnerabilities.

The code is a C++ function that takes two arguments: `dir` and `manifest`. It appears to be a part of a phar (PHP Archive) implementation. The function is responsible for creating a directory stream for a phar file.

The code checks if the directory name is a subdirectory of the phar file, and if it is, it creates a new directory stream for it. It also checks if the directory name is a magic directory (e.g., "".phar""), and if it is, it does not add any magic entries to the directory stream.

The code does not appear to have any vulnerabilities related to buffer overflow, use after free, memory leaks, integer overflow/underflow, null pointer dereference, improper input validation, race conditions, insecure function usage, insecure resource management, or improper error handling.

Therefore, the code is not vulnerable to any security vulnerabilities.","The code contains a DoS vulnerability. 
The CVE-ID is CVE-2015-7804. The CWE-ID is CWE-189.
Vulnerability summary:
Off-by-one error in the phar_parse_zipfile function in ext/phar/zip.c in PHP before 5.5.30 and 5.6.x before 5.6.14 allows remote attackers to cause a denial of service (uninitialized pointer dereference and application crash) by including the / filename in a .zip PHAR archive.
",1.0,821.0,6.0,2.7448770999908447
177747,DoS,"  NO, the given code is not vulnerable to a DoS attack.

The code is a function that parses BGP attributes and stores them in a data structure. It does not have any obvious vulnerabilities related to buffer overflows, use after free, memory leaks, integer overflow/underflow, null pointer dereferences, improper input validation, race conditions, insecure function usage, insecure resource management, or improper error handling.

However, the code does have a potential vulnerability related to the handling of optional attributes. If a path with recognized transitive optional attribute is accepted and passed along to other BGP peers and the Partial bit in the Attribute Flags octet is set to 1 by some previous AS, it is not set back to 0 by the current AS. This could lead to a denial of service (DoS) vulnerability if the Partial bit is not properly handled.

Therefore, the code is vulnerable to a DoS attack, but the vulnerability is not directly related to buffer overflows, use after free, memory leaks, integer overflow/underflow, null pointer dereferences, improper input validation, race conditions, insecure function usage, insecure resource management, or improper error handling.","The code contains a DoS vulnerability. 
The CVE-ID is CVE-2013-6051. The CWE-ID is nan.
Vulnerability summary:
The bgp_attr_unknown function in bgp_attr.c in Quagga 0.99.21 does not properly initialize the total variable, which allows remote attackers to cause a denial of service (bgpd crash) via a crafted BGP update.
",2.0,838.0,6.0,3.9624876976013184
177750,DoS Exec Code,"  NO, the given code is not vulnerable to a DoS_Exec_Code vulnerability.

The code does not contain any obvious vulnerabilities, and it appears to be a correct implementation of the `begin_softmask` function. However, it is important to note that the code is not thoroughly reviewed, and there may be other vulnerabilities that have not been identified.

The `maxDistance` function, on the other hand, is vulnerable to a buffer overflow vulnerability. The function takes a vector of vectors as an argument, and it uses the `directions` vector to iterate over the elements of the vector. However, the `directions` vector is not properly bounded, and it can lead to a buffer overflow if the vector is too large.

To fix this vulnerability, the `directions` vector should be properly bounded, or the function should be modified to use a different approach to iterate over the elements of the vector.","The code contains a DoS_Exec_Code vulnerability. 
The CVE-ID is CVE-2018-1000039. The CWE-ID is CWE-416.
Vulnerability summary:
In MuPDF 1.12.0 and earlier, multiple heap use after free bugs in the PDF parser could allow an attacker to execute arbitrary code, read memory, or cause a denial of service via a crafted file.
",2.0,786.0,6.0,3.526603937149048
177766,DoS,"  NO, the given code is not vulnerable to any security vulnerabilities. It appears to be a function that takes in a struct asn1_data and a struct ldb_parse_tree, and performs some ASN.1 encoding operations on the data. It does not contain any code that could potentially lead to a security vulnerability.","The code contains a DoS vulnerability. 
The CVE-ID is CVE-2015-7540. The CWE-ID is CWE-399.
Vulnerability summary:
The LDAP server in the AD domain controller in Samba 4.x before 4.1.22 does not check return values to ensure successful ASN.1 memory allocation, which allows remote attackers to cause a denial of service (memory consumption and daemon crash) via crafted packets.
",1.0,672.0,6.0,3.100639820098877
177767,DoS,"  NO, the given code is not vulnerable to a DoS attack. The code is using talloc to allocate memory for the control structure, and it is checking the return value of talloc to ensure that the allocation was successful. Additionally, the code is using asn1_start_tag and asn1_end_tag to ensure that the ASN.1 data is properly formatted.

The code is also using asn1_read_OctetString_talloc to read the source_attribute and dereferenced_dn fields, which ensures that the data is properly formatted and validated.

Therefore, the code is not vulnerable to a DoS attack.","The code contains a DoS vulnerability. 
The CVE-ID is CVE-2015-7540. The CWE-ID is CWE-399.
Vulnerability summary:
The LDAP server in the AD domain controller in Samba 4.x before 4.1.22 does not check return values to ensure successful ASN.1 memory allocation, which allows remote attackers to cause a denial of service (memory consumption and daemon crash) via crafted packets.
",1.0,734.0,6.0,3.673287868499756
177768,DoS,"  NO, the given code is not vulnerable to a DoS vulnerability. The code is a function that takes a pointer to a struct tar_sparse_file and a size_t as input, and it appears to be responsible for dumping a sparse file to a tar archive. However, it does not appear to have any vulnerabilities related to DoS.","The code contains a DoS vulnerability. 
The CVE-ID is CVE-2018-20482. The CWE-ID is CWE-835.
Vulnerability summary:
GNU Tar through 1.30, when --sparse is used, mishandles file shrinkage during read access, which allows local users to cause a denial of service (infinite read loop in sparse_dump_region in sparse.c) by modifying a file that is supposed to be archived by a different user's process (e.g., a system backup running as root).
",1.0,695.0,6.0,2.306319236755371
177770,Bypass,"  NO. The code is not vulnerable to a bypass vulnerability. The code checks for the presence of the ""xname follows"" string and exits with an error message if it is not present. It does not allow the attacker to bypass the intended access restrictions.","The code contains a Bypass vulnerability. 
The CVE-ID is CVE-2017-17434. The CWE-ID is nan.
Vulnerability summary:
The daemon in rsync 3.1.2, and 3.1.3-development before 2017-12-03, does not check for fnamecmp filenames in the daemon_filter_list data structure (in the recv_files function in receiver.c) and also does not apply the sanitize_paths protection mechanism to pathnames found in ""xname follows"" strings (in the read_ndx_and_attrs function in rsync.c), which allows remote attackers to bypass intended access restrictions.
",1.0,701.0,6.0,3.1946935653686523
177771,,  NO,"The code contains a nan vulnerability. 
The CVE-ID is CVE-2018-20103. The CWE-ID is CWE-835.
Vulnerability summary:
An issue was discovered in dns.c in HAProxy through 1.8.14. In the case of a compressed pointer, a crafted packet can trigger infinite recursion by making the pointer point to itself, or create a long chain of valid pointers resulting in stack exhaustion.
",1.0,609.0,6.0,3.167377233505249
177773,DoS Exec Code Overflow Mem. Corr.,"  NO. The code is not vulnerable to any of the security vulnerabilities you mentioned.

The code is using the `cairo_image_surface_create_for_data` function to create a new surface from the given data, and it is properly checking the return value of the function to ensure that it returns a valid surface. The code is also properly checking the `width` and `height` parameters to ensure that they are non-negative and less than the size of the `data` array.

The code is not using any user-supplied data, and it is not using any unvalidated user input. Therefore, it is not vulnerable to any of the security vulnerabilities you mentioned.","The code contains a DoS_Exec_Code_Overflow_Mem._Corr. vulnerability. 
The CVE-ID is CVE-2009-3607. The CWE-ID is CWE-189.
Vulnerability summary:
Integer overflow in the create_surface_from_thumbnail_data function in glib/poppler-page.cc in Poppler 0.x allows remote attackers to cause a denial of service (memory corruption) or possibly execute arbitrary code via a crafted PDF document that triggers a heap-based buffer overflow.  NOTE: some of these details are obtained from third party information.
",1.0,765.0,6.0,3.2919445037841797
177774,DoS Exec Code Overflow,"  YES, the given code is vulnerable to a DoS_Exec_Code_Overflow vulnerability. The CVE-ID is CVE-2009-3605. The CWE-ID is CWE-189.

The vulnerability arises from the use of the `ImageStream` class, which is used to read image data from a stream. The `ImageStream` class has a `getLine` method that reads a line of image data from the stream and returns it as a `SplashColorPtr`. The `SplashColorPtr` is a pointer to an array of `SplashColor` objects, which are used to represent the color of each pixel in the image.

The vulnerability occurs when the `ImageStream` class is used to read an image with a large number of pixels. If the image has a large number of pixels, the `getLine` method may return a `SplashColorPtr` that points to an array of `SplashColor` objects that is too large to fit in the available memory. This can cause a buffer overflow, which can lead to an exploitable crash or arbitrary code execution.

To exploit this vulnerability, an attacker would need to craft a specially crafted PDF file that contains an image with a large number of pixels. The attacker would then need to send the specially crafted PDF file","The code contains a DoS_Exec_Code_Overflow vulnerability. 
The CVE-ID is CVE-2009-3605. The CWE-ID is CWE-189.
Vulnerability summary:
Multiple integer overflows in Poppler 0.10.5 and earlier allow remote attackers to cause a denial of service (application crash) or possibly execute arbitrary code via a crafted PDF file, related to (1) glib/poppler-page.cc; (2) ArthurOutputDev.cc, (3) CairoOutputDev.cc, (4) GfxState.cc, (5) JBIG2Stream.cc, (6) PSOutputDev.cc, and (7) SplashOutputDev.cc in poppler/; and (8) SplashBitmap.cc, (9) Splash.cc, and (10) SplashFTFont.cc in splash/.  NOTE: this may overlap CVE-2009-0791.
",3.0,964.0,6.0,2.7767174243927
177775,DoS Exec Code Overflow,"  YES, the given code is vulnerable to a DoS_Exec_Code_Overflow vulnerability. The CVE-ID is CVE-2009-3605. The CWE-ID is CWE-189.

The vulnerability arises from the use of the `getLine` function in the `ImageStream` class, which can cause a buffer overflow if the input stream contains more data than the buffer can hold. This can lead to an exploitable crash or arbitrary code execution.

The code also uses the `getRGBLine` function, which can also cause a buffer overflow if the input stream contains more data than the buffer can hold.

Furthermore, the code uses the `setMatrix` function to set the transformation matrix, which can also cause a buffer overflow if the input stream contains more data than the buffer can hold.

The code also uses the `drawImage` function to draw the image, which can also cause a buffer overflow if the input stream contains more data than the buffer can hold.

Overall, the code is vulnerable to a buffer overflow vulnerability, which can lead to an exploitable crash or arbitrary code execution.","The code contains a DoS_Exec_Code_Overflow vulnerability. 
The CVE-ID is CVE-2009-3605. The CWE-ID is CWE-189.
Vulnerability summary:
Multiple integer overflows in Poppler 0.10.5 and earlier allow remote attackers to cause a denial of service (application crash) or possibly execute arbitrary code via a crafted PDF file, related to (1) glib/poppler-page.cc; (2) ArthurOutputDev.cc, (3) CairoOutputDev.cc, (4) GfxState.cc, (5) JBIG2Stream.cc, (6) PSOutputDev.cc, and (7) SplashOutputDev.cc in poppler/; and (8) SplashBitmap.cc, (9) Splash.cc, and (10) SplashFTFont.cc in splash/.  NOTE: this may overlap CVE-2009-0791.
",4.0,926.0,6.0,2.5632593631744385
177777,DoS Exec Code Overflow,"  YES, the given code is vulnerable to a DoS_Exec_Code_Overflow vulnerability. The CVE-ID is CVE-2009-3605. The CWE-ID is CWE-189.

The vulnerability arises from the use of the `cairo_matrix_init_translate` function, which takes a `height` parameter that is not properly validated. If the `height` parameter is negative, it can cause a buffer overflow when the `cairo_matrix_scale` function is called. This can lead to an exploitable crash or arbitrary code execution.

The code also uses the `cairo_pattern_set_matrix` function to set the matrix for the pattern, which can also lead to a buffer overflow if the matrix is not properly validated.

Additionally, the code uses the `cairo_pattern_set_filter` function to set the filter for the pattern, which can also lead to a buffer overflow if the filter is not properly validated.

Overall, the code is vulnerable to a buffer overflow due to the use of the `cairo_matrix_init_translate` function, the `cairo_pattern_set_matrix` function, and the `cairo_pattern_set_filter` function.","The code contains a DoS_Exec_Code_Overflow vulnerability. 
The CVE-ID is CVE-2009-3605. The CWE-ID is CWE-189.
Vulnerability summary:
Multiple integer overflows in Poppler 0.10.5 and earlier allow remote attackers to cause a denial of service (application crash) or possibly execute arbitrary code via a crafted PDF file, related to (1) glib/poppler-page.cc; (2) ArthurOutputDev.cc, (3) CairoOutputDev.cc, (4) GfxState.cc, (5) JBIG2Stream.cc, (6) PSOutputDev.cc, and (7) SplashOutputDev.cc in poppler/; and (8) SplashBitmap.cc, (9) Splash.cc, and (10) SplashFTFont.cc in splash/.  NOTE: this may overlap CVE-2009-0791.
",4.0,935.0,6.0,4.5499467849731445
177778,DoS Exec Code Overflow,"  YES, the given code is vulnerable to a DoS_Exec_Code_Overflow vulnerability. The CVE-ID is CVE-2009-3605. The CWE-ID is CWE-189.

The vulnerability arises from the use of the `cairo_mask` function, which takes a `cairo_pattern_t` as an argument. The `cairo_pattern_t` is created from a `cairo_surface_t` using the `cairo_pattern_create_for_surface` function. The `cairo_surface_t` is created from a `buffer` using the `cairo_image_surface_create_for_data` function.

The `cairo_image_surface_create_for_data` function takes a `buffer` as an argument, which is a pointer to a block of memory that contains the image data. The `buffer` is created using the `gmalloc` function, which allocates memory using the `malloc` function.

The `malloc` function allocates memory from the heap, which is a shared resource that can be accessed by multiple threads. If the `malloc` function is used in a way that causes a buffer overflow, it can lead to a DoS_Exec_Code_Overflow vulnerability.

For example, if the `","The code contains a DoS_Exec_Code_Overflow vulnerability. 
The CVE-ID is CVE-2009-3605. The CWE-ID is CWE-189.
Vulnerability summary:
Multiple integer overflows in Poppler 0.10.5 and earlier allow remote attackers to cause a denial of service (application crash) or possibly execute arbitrary code via a crafted PDF file, related to (1) glib/poppler-page.cc; (2) ArthurOutputDev.cc, (3) CairoOutputDev.cc, (4) GfxState.cc, (5) JBIG2Stream.cc, (6) PSOutputDev.cc, and (7) SplashOutputDev.cc in poppler/; and (8) SplashBitmap.cc, (9) Splash.cc, and (10) SplashFTFont.cc in splash/.  NOTE: this may overlap CVE-2009-0791.
",3.0,951.0,6.0,2.7208619117736816
177779,DoS Exec Code Overflow,"  YES, the given code is vulnerable to a DoS_Exec_Code_Overflow vulnerability. The CVE-ID is CVE-2009-3605. The CWE-ID is CWE-189.

The vulnerability arises from the use of the `cairo_mask` function, which takes a pattern as an argument. The pattern is created from the `maskImage` surface, which is created from the `maskBuffer` buffer. The `maskBuffer` buffer is created by copying the `maskImgStr` stream into it, which can potentially lead to a buffer overflow if the stream is too large.

The vulnerability can be exploited by sending a crafted PDF file with a large mask image, which can cause the application to allocate a large amount of memory and eventually crash. This can be done by sending a malicious PDF file with a large mask image, which can cause the application to allocate a large amount of memory and eventually crash.

To mitigate this vulnerability, the code should ensure that the `maskBuffer` buffer is allocated with a sufficient size to hold the data from the `maskImgStr` stream, and that the `maskImage` surface is created with a sufficient size to hold the data from the `maskBuffer` buffer. Additionally, the code should ensure that the `maskImgStr` stream is properly closed after it is used to create","The code contains a DoS_Exec_Code_Overflow vulnerability. 
The CVE-ID is CVE-2009-3605. The CWE-ID is CWE-189.
Vulnerability summary:
Multiple integer overflows in Poppler 0.10.5 and earlier allow remote attackers to cause a denial of service (application crash) or possibly execute arbitrary code via a crafted PDF file, related to (1) glib/poppler-page.cc; (2) ArthurOutputDev.cc, (3) CairoOutputDev.cc, (4) GfxState.cc, (5) JBIG2Stream.cc, (6) PSOutputDev.cc, and (7) SplashOutputDev.cc in poppler/; and (8) SplashBitmap.cc, (9) Splash.cc, and (10) SplashFTFont.cc in splash/.  NOTE: this may overlap CVE-2009-0791.
",3.0,975.0,6.0,3.599464178085327
177780,DoS Exec Code Overflow,"  YES, the given code is vulnerable to a DoS_Exec_Code_Overflow vulnerability. The CVE-ID is CVE-2009-3605. The CWE-ID is CWE-189.

The vulnerability arises from the use of integer overflows in the code. The function `GfxImageColorMap::GfxImageColorMap` takes an integer `bitsA` as input, which is used to determine the maximum value of the pixel values. If the value of `bitsA` is too large, it can cause an integer overflow, leading to an incorrect calculation of the maximum pixel value. This can result in a buffer overflow, which can be exploited to execute arbitrary code.

The vulnerability is caused by the following line of code:
```
maxPixel = (1 << bits) - 1;
```
If `bits` is a large value, the left shift operation will cause an integer overflow, resulting in a negative value for `maxPixel`. This can lead to a buffer overflow when the `lookup` array is allocated, as the size of the array is determined by `maxPixel`.

To exploit this vulnerability, an attacker can craft a specially crafted PDF file that contains a large value for `bitsA`. This can be done by using a specially crafted PDF file that contains a large value for `bits","The code contains a DoS_Exec_Code_Overflow vulnerability. 
The CVE-ID is CVE-2009-3605. The CWE-ID is CWE-189.
Vulnerability summary:
Multiple integer overflows in Poppler 0.10.5 and earlier allow remote attackers to cause a denial of service (application crash) or possibly execute arbitrary code via a crafted PDF file, related to (1) glib/poppler-page.cc; (2) ArthurOutputDev.cc, (3) CairoOutputDev.cc, (4) GfxState.cc, (5) JBIG2Stream.cc, (6) PSOutputDev.cc, and (7) SplashOutputDev.cc in poppler/; and (8) SplashBitmap.cc, (9) Splash.cc, and (10) SplashFTFont.cc in splash/.  NOTE: this may overlap CVE-2009-0791.
",3.0,972.0,6.0,2.6603291034698486
