case_id,vuln_type,audit_report,gt,eval_score,eval_input_token_num,eval_output_token_num,eval_inference_time
177875,Exec Code Overflow,"  NO, the given code is not vulnerable to Exec Code Overflow.

The code does not contain any buffer overflow vulnerabilities, as it does not involve any string or memory functions that could potentially cause buffer overflows. Additionally, the code does not contain any use-after-free errors, as it does not involve any pointers that are used after the memory they point to has been deallocated.

The code does contain some potential vulnerabilities related to memory leaks, as it uses the `gs_alloc_bytes_immovable` function to allocate memory for the `aes_context` structure, but it does not properly free this memory. This could lead to memory leaks if the `aes_context` structure is not properly deallocated.

The code also contains some potential vulnerabilities related to integer overflows and underflows, as it uses the `aes_setkey_dec` function to set the key for the AES decryption operation. However, this function does not appear to be vulnerable to integer overflows or underflows.

Overall, the code does not appear to contain any obvious vulnerabilities related to security.","The code contains a Exec_Code_Overflow vulnerability. 
The CVE-ID is CVE-2018-15911. The CWE-ID is CWE-119.
Vulnerability summary:
In Artifex Ghostscript 9.23 before 2018-08-24, attackers able to supply crafted PostScript could use uninitialized memory access in the aesdecode operator to crash the interpreter or potentially execute code.
",2.0,813.0,6.0,2.768705368041992
177879,DoS Exec Code Overflow,"  NO, the given code is not vulnerable to a DoS_Exec_Code_Overflow vulnerability.

The code does not contain any buffer overflow vulnerabilities, as it does not involve any user-supplied data or unchecked array access. Additionally, the code does not contain any use-after-free errors, as it properly checks for null pointers before dereferencing them.

The code does contain some potential security vulnerabilities, such as integer overflows, null pointer dereferences, and improper input validation. However, these vulnerabilities are not related to the DoS_Exec_Code_Overflow vulnerability.

Therefore, the answer to your question is NO, the given code is not vulnerable to a DoS_Exec_Code_Overflow vulnerability.","The code contains a DoS_Exec_Code_Overflow vulnerability. 
The CVE-ID is CVE-2015-3456. The CWE-ID is CWE-119.
Vulnerability summary:
The Floppy Disk Controller (FDC) in QEMU, as used in Xen 4.5.x and earlier and KVM, allows local guest users to cause a denial of service (out-of-bounds write and guest crash) or possibly execute arbitrary code via the (1) FD_CMD_READ_ID, (2) FD_CMD_DRIVE_SPECIFICATION_COMMAND, or other unspecified commands, aka VENOM.
",2.0,782.0,6.0,3.9529542922973633
177880,Bypass,"  NO, the given code is not vulnerable to a Bypass vulnerability. The code is a function that checks if a file name is allowed to be accessed based on a set of permissions. It does not allow arbitrary file system accesses, only Postscript device accesses. The function also checks if the file name starts with a parent reference, and if the permission element starts with the same number of parent references. It also checks if the permission starts with ""./"", absolute paths are not permitted, and if the permission starts with ""./"", relative paths with no ""./"" are allowed as well as with ""./"". The function returns an error if the file name is not allowed to be accessed.

The code does not contain any vulnerabilities related to bypassing security restrictions.","The code contains a Bypass vulnerability. 
The CVE-ID is CVE-2018-15908. The CWE-ID is nan.
Vulnerability summary:
In Artifex Ghostscript 9.23 before 2018-08-23, attackers are able to supply malicious PostScript files to bypass .tempfile restrictions and write files.
",1.0,738.0,6.0,2.645010471343994
177881,DoS,"  NO. The code is not vulnerable to a DoS attack. The function `drm_load_edid_firmware` is not exposed to the user, and it is not possible to trigger a DoS attack by calling this function. The function is only used internally by the kernel, and it is not possible to exploit this vulnerability by calling it from user space.","The code contains a DoS vulnerability. 
The CVE-ID is CVE-2019-12382. The CWE-ID is CWE-476.
Vulnerability summary:
An issue was discovered in drm_load_edid_firmware in drivers/gpu/drm/drm_edid_load.c in the Linux kernel through 5.1.5. There is an unchecked kstrdup of fwstr, which might allow an attacker to cause a denial of service (NULL pointer dereference and system crash).
",1.0,693.0,6.0,6.201579809188843
177883,,"  NO, the given code is not vulnerable to any security vulnerabilities.

The code is a function that takes in a vector of vectors of integers and returns the maximum distance between any two non-zero integers in the grid. It uses a BFS algorithm to find the maximum distance.

The code does not contain any buffer overflows, use after free errors, memory leaks, integer overflows, null pointer dereferences, improper input validation, race conditions, insecure function usage, insecure resource management, improper error handling, cryptographic issues, or sensitive data exposure.

Therefore, the code is not vulnerable to any security vulnerabilities.","The code contains a nan vulnerability. 
The CVE-ID is CVE-2011-1428. The CWE-ID is CWE-20.
Vulnerability summary:
Wee Enhanced Environment for Chat (aka WeeChat) 0.3.4 and earlier does not properly verify that the server hostname matches the domain name of the subject of an X.509 certificate, which allows man-in-the-middle attackers to spoof an SSL chat server via an arbitrary certificate, related to incorrect use of the GnuTLS API.
",1.0,743.0,6.0,2.8808183670043945
177887,DoS Overflow,"  NO, the given code is not vulnerable to a DoS_Overflow vulnerability. The code is a function that allocates memory for a given size and returns a pointer to the allocated memory. It does not have any integer overflows or underflows, and it does not have any other known vulnerabilities.","The code contains a DoS_Overflow vulnerability. 
The CVE-ID is CVE-2015-3228. The CWE-ID is CWE-189.
Vulnerability summary:
Integer overflow in the gs_heap_alloc_bytes function in base/gsmalloc.c in Ghostscript 9.15 and earlier allows remote attackers to cause a denial of service (crash) via a crafted Postscript (ps) file, as demonstrated by using the ps2pdf command, which triggers an out-of-bounds read or write.
",1.0,684.0,6.0,3.9359548091888428
177891,DoS,"  NO. The code is not vulnerable to a DoS attack. The function is designed to decode an RSA PSS ASN.1 signature, and it checks the input parameters carefully to ensure that the signature is valid. The function does not allow the attacker to cause a denial of service by providing a malformed signature.","The code contains a DoS vulnerability. 
The CVE-ID is CVE-2015-3194. The CWE-ID is nan.
Vulnerability summary:
crypto/rsa/rsa_ameth.c in OpenSSL 1.0.1 before 1.0.1q and 1.0.2 before 1.0.2e allows remote attackers to cause a denial of service (NULL pointer dereference and application crash) via an RSA PSS ASN.1 signature that lacks a mask generation function parameter.
",1.0,689.0,6.0,3.583946466445923
177893,+Info,  NO,"The code contains a +Info vulnerability. 
The CVE-ID is CVE-2015-3193. The CWE-ID is CWE-200.
Vulnerability summary:
The Montgomery squaring implementation in crypto/bn/asm/x86_64-mont5.pl in OpenSSL 1.0.2 before 1.0.2e on the x86_64 platform, as used by the BN_mod_exp function, mishandles carry propagation and produces incorrect output, which makes it easier for remote attackers to obtain sensitive private-key information via an attack against use of a (1) Diffie-Hellman (DH) or (2) Diffie-Hellman Ephemeral (DHE) ciphersuite.
",1.0,669.0,6.0,3.1203274726867676
177896,,  NO. The code is not vulnerable to a nan vulnerability.,"The code contains a nan vulnerability. 
The CVE-ID is CVE-2013-2007. The CWE-ID is CWE-264.
Vulnerability summary:
The qemu guest agent in Qemu 1.4.1 and earlier, as used by Xen, when started in daemon mode, uses weak permissions for certain files, which allows local users to read and write to these files.
",1.0,612.0,6.0,3.3054418563842773
177897,+Info,"  NO, the given code is not vulnerable to any security vulnerabilities.

The code is a C++ function that parses an XML file using the libxml2 library. It does not contain any obvious security vulnerabilities, such as buffer overflows, use-after-free errors, memory leaks, integer overflow/underflow, null pointer dereferences, improper input validation, race conditions, insecure function usage, insecure resource management, improper error handling, cryptographic issues, or sensitive data exposure.

The code appears to be well-written and follows best practices for C++ programming. It uses the libxml2 library to parse the XML file, which is a widely used and well-tested library for parsing XML files. The code also appears to be well-structured and easy to understand.

Therefore, I cannot find any security vulnerabilities in the given code.","The code contains a +Info vulnerability. 
The CVE-ID is CVE-2013-1824. The CWE-ID is CWE-200.
Vulnerability summary:
The SOAP parser in PHP before 5.3.22 and 5.4.x before 5.4.12 allows remote attackers to read arbitrary files via a SOAP WSDL file containing an XML external entity declaration in conjunction with an entity reference, related to an XML External Entity (XXE) issue in the soap_xmlParseFile and soap_xmlParseMemory functions.
",1.0,793.0,6.0,3.909306526184082
177898,+Info,"  NO, the given code is not vulnerable to any security vulnerabilities.

The code is a C++ function that parses an XML document using the libxml2 library. It creates a new parser context and sets the options to disable DTD loading and enable the huge feature. It then parses the document and returns the resulting document.

The code does not contain any vulnerabilities related to buffer overflow, use after free, memory leaks, integer overflow/underflow, null pointer dereference, improper input validation, race conditions, insecure function usage, insecure resource management, improper error handling, cryptographic issues, or sensitive data exposure.

Therefore, the code is not vulnerable to any security vulnerabilities.","The code contains a +Info vulnerability. 
The CVE-ID is CVE-2013-1824. The CWE-ID is CWE-200.
Vulnerability summary:
The SOAP parser in PHP before 5.3.22 and 5.4.x before 5.4.12 allows remote attackers to read arbitrary files via a SOAP WSDL file containing an XML external entity declaration in conjunction with an entity reference, related to an XML External Entity (XXE) issue in the soap_xmlParseFile and soap_xmlParseMemory functions.
",1.0,763.0,6.0,2.7098875045776367
177899,+Info,"  NO, the given code is not vulnerable to any security vulnerabilities.

The code is a C++ function that parses an XML file using the libxml2 library. It does not contain any obvious security vulnerabilities, such as buffer overflows, use-after-free errors, or memory leaks.

The function uses the xmlCreateFileParserCtxt function to create a parser context, and then uses the xmlParseDocument function to parse the XML file. It also sets the keepBlanks and ignorableWhitespace properties of the parser context to 0 and the comment property to soap_Comment, respectively.

The function then frees the parser context and returns the parsed XML document.

Therefore, the given code does not contain any security vulnerabilities.","The code contains a +Info vulnerability. 
The CVE-ID is CVE-2013-1824. The CWE-ID is CWE-200.
Vulnerability summary:
The SOAP parser in PHP before 5.3.22 and 5.4.x before 5.4.12 allows remote attackers to read arbitrary files via a SOAP WSDL file containing an XML external entity declaration in conjunction with an entity reference, related to an XML External Entity (XXE) issue in the soap_xmlParseFile and soap_xmlParseMemory functions.
",1.0,772.0,6.0,4.230654954910278
177900,+Info,"  NO, the given code is not vulnerable to any security vulnerabilities. It is a function that parses an XML document from a memory buffer and returns a pointer to the resulting document. It does not contain any obvious security vulnerabilities, and it does not appear to be vulnerable to any of the vulnerabilities you mentioned.","The code contains a +Info vulnerability. 
The CVE-ID is CVE-2013-1824. The CWE-ID is CWE-200.
Vulnerability summary:
The SOAP parser in PHP before 5.3.22 and 5.4.x before 5.4.12 allows remote attackers to read arbitrary files via a SOAP WSDL file containing an XML external entity declaration in conjunction with an entity reference, related to an XML External Entity (XXE) issue in the soap_xmlParseFile and soap_xmlParseMemory functions.
",1.0,689.0,6.0,3.2554759979248047
177901,Overflow,"  NO. The code is not vulnerable to buffer overflow. The function takes two parameters, `v` and `str`, and the buffer size is determined by the size of the `str` parameter. The function does not attempt to write more than `str` can hold, and it does not attempt to read or write outside the bounds of `str`. Therefore, there is no buffer overflow vulnerability.","The code contains a Overflow vulnerability. 
The CVE-ID is CVE-2015-2806. The CWE-ID is CWE-119.
Vulnerability summary:
Stack-based buffer overflow in asn1_der_decoding in libtasn1 before 4.4 allows remote attackers to have unspecified impact via unknown vectors.
",1.0,665.0,6.0,2.843339204788208
177904,DoS,"  NO, the given code is not vulnerable to a DoS attack. The code is a function that takes a pointer to a SplashBitmap object, an integer xDest, an integer yDest, and a SplashClipResult clipRes as input, and it performs some operations on the bitmap and updates some variables. It does not appear to have any vulnerabilities related to DoS.","The code contains a DoS vulnerability. 
The CVE-ID is CVE-2013-1789. The CWE-ID is nan.
Vulnerability summary:
splash/Splash.cc in poppler before 0.22.1 allows context-dependent attackers to cause a denial of service (NULL pointer dereference and crash) via vectors related to the (1) Splash::arbitraryTransformMask, (2) Splash::blitMask, and (3) Splash::scaleMaskYuXu functions.
",1.0,696.0,6.0,2.655196189880371
177905,DoS,"  YES, the given code is vulnerable to a denial of service (DoS) attack. The vulnerability is caused by the use of the `imgCoordMungeLowerC` and `imgCoordMungeUpperC` functions, which can cause a buffer overflow if the input values are not properly validated. An attacker can exploit this vulnerability by providing a specially crafted input that causes the buffer to overflow, leading to a crash or other unintended behavior.

The vulnerability is related to the CWE-120 (Buffer Overflow) and CWE-121 (Stack-based Buffer Overflow) security vulnerabilities.","The code contains a DoS vulnerability. 
The CVE-ID is CVE-2013-1789. The CWE-ID is nan.
Vulnerability summary:
splash/Splash.cc in poppler before 0.22.1 allows context-dependent attackers to cause a denial of service (NULL pointer dereference and crash) via vectors related to the (1) Splash::arbitraryTransformMask, (2) Splash::blitMask, and (3) Splash::scaleMaskYuXu functions.
",2.0,736.0,6.0,3.843283176422119
177906,DoS Exec Code Overflow,"  YES, the given code is vulnerable to a DoS_Exec_Code_Overflow vulnerability. The CVE-ID is CVE-2013-1788. The CWE-ID is CWE-119.

The vulnerability arises from the fact that the code uses a naive algorithm to compute the maximum distance in a grid of integers. The algorithm has a time complexity of O(n^2), where n is the number of rows in the grid. This means that the algorithm can be slow for large grids, and can be exploited by an attacker to cause a denial-of-service (DoS) attack.

The attacker can cause the algorithm to run for a long time by providing a grid with a large number of rows and a small number of columns. The algorithm will spend most of its time iterating over the rows, and will not make progress on the columns. This can cause the algorithm to run for a long time, and can lead to a denial-of-service attack.

To mitigate this vulnerability, the code should use a more efficient algorithm to compute the maximum distance in the grid. One possible solution is to use a breadth-first search (BFS) algorithm, which has a time complexity of O(n+m), where n is the number of rows in the grid and m is the number of columns. This","The code contains a DoS_Exec_Code_Overflow vulnerability. 
The CVE-ID is CVE-2013-1788. The CWE-ID is CWE-119.
Vulnerability summary:
poppler before 0.22.1 allows context-dependent attackers to cause a denial of service (crash) and possibly execute arbitrary code via vectors that trigger an ""invalid memory access"" in (1) splash/Splash.cc, (2) poppler/Function.cc, and (3) poppler/Stream.cc.
",4.0,885.0,6.0,3.8956809043884277
177907,DoS Exec Code Overflow,"  NO, the given code is not vulnerable to a DoS_Exec_Code_Overflow vulnerability.

The code does not contain any buffer overflow vulnerabilities, as it does not involve any string or memory functions that could lead to buffer overflows. Additionally, the code does not contain any use-after-free errors, as it does not involve any pointers that are used after the memory they point to has been deallocated.

The code also does not contain any memory leaks, as it properly calls delete or free after allocating memory using new or malloc.

The code does not contain any integer overflow or underflow vulnerabilities, as it properly checks for overflow or underflow conditions and does not use unvalidated user inputs or unchecked calculations that could lead to incorrect results or buffer miscalculations.

The code does not contain any null pointer dereference vulnerabilities, as it properly checks for null pointers before being dereferenced.

The code does not contain any improper input validation vulnerabilities, as it properly validates user inputs and sanitizes them.

The code does not contain any race condition vulnerabilities, as it properly uses synchronization mechanisms like mutexes, locks, or atomic operations to prevent concurrent access to shared resources.

The code does not contain any insecure function usage vulnerabilities, as it properly uses secure functions like strncpy, fgets, and sscanf.","The code contains a DoS_Exec_Code_Overflow vulnerability. 
The CVE-ID is CVE-2013-1788. The CWE-ID is CWE-119.
Vulnerability summary:
poppler before 0.22.1 allows context-dependent attackers to cause a denial of service (crash) and possibly execute arbitrary code via vectors that trigger an ""invalid memory access"" in (1) splash/Splash.cc, (2) poppler/Function.cc, and (3) poppler/Stream.cc.
",1.0,881.0,6.0,3.440598964691162
177909,DoS Exec Code Overflow,"  NO, the given code is not vulnerable to a DoS_Exec_Code_Overflow vulnerability.

The code does not contain any buffer overflow vulnerabilities, as it does not involve any string or memory functions that could lead to buffer overflows. Additionally, the code does not contain any use-after-free errors, as it does not involve any pointers that are used after the memory they point to has been deallocated.

The code also does not contain any memory leaks, as it properly calls delete or free after allocating memory using new or malloc.

The code does not contain any integer overflow or underflow vulnerabilities, as it properly checks for overflow or underflow conditions and does not use unvalidated user inputs or unchecked calculations that could lead to incorrect results or buffer miscalculations.

The code does not contain any null pointer dereference vulnerabilities, as it properly checks for null pointers before being dereferenced.

The code does not contain any improper input validation vulnerabilities, as it properly validates user input and sanitizes it.

The code does not contain any race condition vulnerabilities, as it properly uses synchronization mechanisms like mutexes, locks, or atomic operations to prevent concurrent access to shared resources.

The code does not contain any insecure function usage vulnerabilities, as it properly uses secure functions like strncpy, fgets, and sscanf.","The code contains a DoS_Exec_Code_Overflow vulnerability. 
The CVE-ID is CVE-2013-1788. The CWE-ID is CWE-119.
Vulnerability summary:
poppler before 0.22.1 allows context-dependent attackers to cause a denial of service (crash) and possibly execute arbitrary code via vectors that trigger an ""invalid memory access"" in (1) splash/Splash.cc, (2) poppler/Function.cc, and (3) poppler/Stream.cc.
",1.0,881.0,6.0,3.189321517944336
177910,DoS,"  NO, the given code is not vulnerable to a DoS attack. The code is a function that takes in a pointer to a scanner state structure and a boolean value, and it performs some operations on the scanner state structure. It does not appear to have any vulnerabilities related to denial of service.","The code contains a DoS vulnerability. 
The CVE-ID is CVE-2017-11714. The CWE-ID is CWE-125.
Vulnerability summary:
psi/ztoken.c in Artifex Ghostscript 9.21 mishandles references to the scanner state structure, which allows remote attackers to cause a denial of service (application crash) or possibly have unspecified other impact via a crafted PostScript document, related to an out-of-bounds read in the igc_reloc_struct_ptr function in psi/igc.c.
",1.0,689.0,6.0,2.581735849380493
177911,Exec Code Overflow,"  NO, the given code is not vulnerable to Exec Code Overflow.

The code checks the length of the input buffer and ensures that it is not too short. It also checks the glyph indices and ensures that they are within the valid range. The code does not appear to have any potential buffer overflow vulnerabilities.","The code contains a Exec_Code_Overflow vulnerability. 
The CVE-ID is CVE-2009-0946. The CWE-ID is CWE-189.
Vulnerability summary:
Multiple integer overflows in FreeType 2.3.9 and earlier allow remote attackers to execute arbitrary code via vectors related to large values in certain inputs in (1) smooth/ftsmooth.c, (2) sfnt/ttcmap.c, and (3) cff/cffload.c.
",1.0,679.0,6.0,3.5642430782318115
177912,Exec Code Overflow,"  NO. The code is not vulnerable to Exec Code Overflow. The function `tt_cmap12_validate` is not responsible for executing any code, it only validates the input data. The vulnerability you mentioned is related to the `smooth/ftsmooth.c`, `sfnt/ttcmap.c`, and `cff/cffload.c` files, which are responsible for executing code.","The code contains a Exec_Code_Overflow vulnerability. 
The CVE-ID is CVE-2009-0946. The CWE-ID is CWE-189.
Vulnerability summary:
Multiple integer overflows in FreeType 2.3.9 and earlier allow remote attackers to execute arbitrary code via vectors related to large values in certain inputs in (1) smooth/ftsmooth.c, (2) sfnt/ttcmap.c, and (3) cff/cffload.c.
",1.0,696.0,6.0,2.585007667541504
177913,Exec Code Overflow,"  NO. The code is not vulnerable to Exec Code Overflow. The function is not using any user-supplied data, and it is not using any external data that could be used to execute arbitrary code. The only potential vulnerability is a buffer overflow if the input data is too large, but this is not a security vulnerability.","The code contains a Exec_Code_Overflow vulnerability. 
The CVE-ID is CVE-2009-0946. The CWE-ID is CWE-189.
Vulnerability summary:
Multiple integer overflows in FreeType 2.3.9 and earlier allow remote attackers to execute arbitrary code via vectors related to large values in certain inputs in (1) smooth/ftsmooth.c, (2) sfnt/ttcmap.c, and (3) cff/cffload.c.
",1.0,684.0,6.0,3.474038600921631
177915,Exec Code Overflow,"  NO, the code is not vulnerable to Exec Code Overflow. The function `maxDistance` is not related to the vulnerable code, and it is not a potential vulnerability.","The code contains a Exec_Code_Overflow vulnerability. 
The CVE-ID is CVE-2009-0946. The CWE-ID is CWE-189.
Vulnerability summary:
Multiple integer overflows in FreeType 2.3.9 and earlier allow remote attackers to execute arbitrary code via vectors related to large values in certain inputs in (1) smooth/ftsmooth.c, (2) sfnt/ttcmap.c, and (3) cff/cffload.c.
",1.0,653.0,6.0,2.8562331199645996
177917,Exec Code,"  NO, the given code is not vulnerable to Exec_Code.

The code does not contain any direct or indirect use of the `system` function, which is a common method for exploiting Exec_Code vulnerabilities. Additionally, the code does not contain any other known vulnerabilities, such as buffer overflows or use-after-free errors.

However, it is important to note that the code is using the `Xmalloc` function to allocate memory, which could potentially lead to memory leaks if the memory is not properly freed. It is also using the `Xfree` function to free memory, which could potentially lead to use-after-free errors if the memory is not properly freed.

Overall, while the code does not contain any direct Exec_Code vulnerabilities, it does contain some potential memory-related vulnerabilities that should be addressed.","The code contains a Exec_Code vulnerability. 
The CVE-ID is CVE-2018-14600. The CWE-ID is CWE-787.
Vulnerability summary:
An issue was discovered in libX11 through 1.6.5. The function XListExtensions in ListExt.c interprets a variable as signed instead of unsigned, resulting in an out-of-bounds write (of up to 128 bytes), leading to DoS or remote code execution.
",2.0,772.0,6.0,2.692300796508789
