case_id,vuln_type,audit_report,gt,eval_score,eval_input_token_num,eval_output_token_num,eval_inference_time
177786,DoS Exec Code Overflow,"  YES, the given code is vulnerable to a DoS_Exec_Code_Overflow vulnerability. The CVE-ID is CVE-2009-3605. The CWE-ID is CWE-189.

The vulnerability arises from the use of the `ImageStream` class, which is used to read image data from a stream. The `ImageStream` class has a `getLine` method that reads a line of image data from the stream, but it does not perform any bounds checking on the line length. This means that if the image data is corrupted or malicious, it can cause the `getLine` method to read beyond the end of the line, leading to a buffer overflow and potentially executing arbitrary code.

The vulnerability can be exploited by sending a specially crafted PDF file that contains a malicious image with a large line length. The malicious image can be used to cause a buffer overflow and execute arbitrary code, potentially leading to a denial of service or other security vulnerabilities.

To fix the vulnerability, the `ImageStream` class should be modified to perform bounds checking on the line length, or a separate bounds checking function should be added to the `ImageStream` class. Additionally, the `drawImage` function should be modified to properly handle the case where the image data is corrupted or malicious, and to prevent the buffer overflow","The code contains a DoS_Exec_Code_Overflow vulnerability. 
The CVE-ID is CVE-2009-3605. The CWE-ID is CWE-189.
Vulnerability summary:
Multiple integer overflows in Poppler 0.10.5 and earlier allow remote attackers to cause a denial of service (application crash) or possibly execute arbitrary code via a crafted PDF file, related to (1) glib/poppler-page.cc; (2) ArthurOutputDev.cc, (3) CairoOutputDev.cc, (4) GfxState.cc, (5) JBIG2Stream.cc, (6) PSOutputDev.cc, and (7) SplashOutputDev.cc in poppler/; and (8) SplashBitmap.cc, (9) Splash.cc, and (10) SplashFTFont.cc in splash/.  NOTE: this may overlap CVE-2009-0791.
",4.0,970.0,6.0,3.7245430946350098
177787,DoS Exec Code Overflow,"  YES, the given code is vulnerable to a DoS_Exec_Code_Overflow vulnerability. The CVE-ID is CVE-2009-3605. The CWE-ID is CWE-189.

The vulnerability arises from the use of the `ImageStream` class, which is used to read image data from a stream. The `ImageStream` class has a buffer size of 4096 bytes, which can be overflowed by a crafted PDF file. If the image data exceeds this buffer size, it can cause a buffer overflow and potentially execute arbitrary code.

The vulnerability is caused by the `imgData.imgStr->reset()` function, which resets the `ImageStream` object to its initial state. However, this function does not check the buffer size before resetting it, which can cause a buffer overflow if the image data exceeds the buffer size.

To exploit this vulnerability, an attacker can craft a PDF file with a large image data stream, which can overflow the buffer and execute arbitrary code. This can lead to a denial-of-service (DoS) vulnerability, as well as an execution of arbitrary code.

Therefore, it is recommended to update the `ImageStream` class to check the buffer size before resetting it, to prevent buffer overflows and ensure the security of the application.","The code contains a DoS_Exec_Code_Overflow vulnerability. 
The CVE-ID is CVE-2009-3605. The CWE-ID is CWE-189.
Vulnerability summary:
Multiple integer overflows in Poppler 0.10.5 and earlier allow remote attackers to cause a denial of service (application crash) or possibly execute arbitrary code via a crafted PDF file, related to (1) glib/poppler-page.cc; (2) ArthurOutputDev.cc, (3) CairoOutputDev.cc, (4) GfxState.cc, (5) JBIG2Stream.cc, (6) PSOutputDev.cc, and (7) SplashOutputDev.cc in poppler/; and (8) SplashBitmap.cc, (9) Splash.cc, and (10) SplashFTFont.cc in splash/.  NOTE: this may overlap CVE-2009-0791.
",4.0,962.0,6.0,4.176417827606201
177788,DoS Exec Code Overflow,"  YES, the given code is vulnerable to a DoS_Exec_Code_Overflow vulnerability. The CVE-ID is CVE-2009-3605. The CWE-ID is CWE-189.

The vulnerability arises from the use of the `ImageStream` class, which is used to read image data from a stream. The `ImageStream` class has a buffer overflow vulnerability, which can be exploited to execute arbitrary code. The vulnerability is caused by the `ImageStream::getNext` method, which reads data from the stream into a buffer, but does not check the buffer size before writing to it. This can lead to a buffer overflow, which can cause the application to crash or execute arbitrary code.

The vulnerability can be exploited by sending a crafted PDF file with a large image, which will cause the `ImageStream` class to read data from the stream into a buffer that is too small, leading to a buffer overflow. The attacker can then use the buffer overflow to execute arbitrary code, potentially leading to a denial of service or other security vulnerabilities.

To fix the vulnerability, the `ImageStream` class should be modified to check the buffer size before writing to it, or a separate buffer should be used to store the image data. Additionally, the `ImageStream` class should be updated to use a secure allocation function to","The code contains a DoS_Exec_Code_Overflow vulnerability. 
The CVE-ID is CVE-2009-3605. The CWE-ID is CWE-189.
Vulnerability summary:
Multiple integer overflows in Poppler 0.10.5 and earlier allow remote attackers to cause a denial of service (application crash) or possibly execute arbitrary code via a crafted PDF file, related to (1) glib/poppler-page.cc; (2) ArthurOutputDev.cc, (3) CairoOutputDev.cc, (4) GfxState.cc, (5) JBIG2Stream.cc, (6) PSOutputDev.cc, and (7) SplashOutputDev.cc in poppler/; and (8) SplashBitmap.cc, (9) Splash.cc, and (10) SplashFTFont.cc in splash/.  NOTE: this may overlap CVE-2009-0791.
",4.0,973.0,6.0,3.6917872428894043
177789,DoS Exec Code Overflow,"  NO. The code is not vulnerable to a DoS_Exec_Code_Overflow vulnerability. The reason is that the code does not contain any integer overflows that can cause a denial of service or arbitrary code execution. The code checks the bounds of the input parameters and performs proper error handling, which mitigates the risk of integer overflows.","The code contains a DoS_Exec_Code_Overflow vulnerability. 
The CVE-ID is CVE-2009-3605. The CWE-ID is CWE-189.
Vulnerability summary:
Multiple integer overflows in Poppler 0.10.5 and earlier allow remote attackers to cause a denial of service (application crash) or possibly execute arbitrary code via a crafted PDF file, related to (1) glib/poppler-page.cc; (2) ArthurOutputDev.cc, (3) CairoOutputDev.cc, (4) GfxState.cc, (5) JBIG2Stream.cc, (6) PSOutputDev.cc, and (7) SplashOutputDev.cc in poppler/; and (8) SplashBitmap.cc, (9) Splash.cc, and (10) SplashFTFont.cc in splash/.  NOTE: this may overlap CVE-2009-0791.
",1.0,772.0,6.0,3.9598660469055176
177792,DoS Exec Code Overflow,"  NO, the given code is not vulnerable to a DoS Exec Code Overflow.

The code does not contain any integer overflows that could lead to a denial of service or arbitrary code execution. The `rowSize` variable is calculated correctly based on the `width` and `rowPad` parameters, and the `data` array is allocated with the correct size. The `alpha` array is also allocated correctly based on the `width` and `height` parameters.

Therefore, the code does not contain any vulnerabilities related to integer overflows or other security issues.","The code contains a DoS_Exec_Code_Overflow vulnerability. 
The CVE-ID is CVE-2009-3605. The CWE-ID is CWE-189.
Vulnerability summary:
Multiple integer overflows in Poppler 0.10.5 and earlier allow remote attackers to cause a denial of service (application crash) or possibly execute arbitrary code via a crafted PDF file, related to (1) glib/poppler-page.cc; (2) ArthurOutputDev.cc, (3) CairoOutputDev.cc, (4) GfxState.cc, (5) JBIG2Stream.cc, (6) PSOutputDev.cc, and (7) SplashOutputDev.cc in poppler/; and (8) SplashBitmap.cc, (9) Splash.cc, and (10) SplashFTFont.cc in splash/.  NOTE: this may overlap CVE-2009-0791.
",1.0,817.0,6.0,2.9299111366271973
177793,DoS Exec Code Overflow,"  YES, the given code is vulnerable to a DoS_Exec_Code_Overflow vulnerability. The CVE-ID is CVE-2009-3605. The CWE-ID is CWE-189.

The vulnerability arises from the use of the `FT_Load_Glyph` function, which can cause a buffer overflow if the input glyph index is too large. The function takes an `FT_UInt` parameter, which is an unsigned integer type, and the input glyph index is converted to this type before being passed to the function. However, if the input glyph index is too large, it will be converted to a value that is outside the range of the `FT_UInt` type, causing a buffer overflow.

The vulnerability can be exploited by sending a crafted PDF file with a large glyph index, which can cause the application to crash or execute arbitrary code. This can lead to a denial-of-service (DoS) vulnerability, as the application may become unavailable to users.

To fix the vulnerability, the `FT_Load_Glyph` function should be modified to check the input glyph index for overflow before passing it to the function. Alternatively, the `FT_UInt` type should be replaced with a larger integer type, such as `FT_Long`, to prevent buffer overflows.","The code contains a DoS_Exec_Code_Overflow vulnerability. 
The CVE-ID is CVE-2009-3605. The CWE-ID is CWE-189.
Vulnerability summary:
Multiple integer overflows in Poppler 0.10.5 and earlier allow remote attackers to cause a denial of service (application crash) or possibly execute arbitrary code via a crafted PDF file, related to (1) glib/poppler-page.cc; (2) ArthurOutputDev.cc, (3) CairoOutputDev.cc, (4) GfxState.cc, (5) JBIG2Stream.cc, (6) PSOutputDev.cc, and (7) SplashOutputDev.cc in poppler/; and (8) SplashBitmap.cc, (9) Splash.cc, and (10) SplashFTFont.cc in splash/.  NOTE: this may overlap CVE-2009-0791.
",4.0,960.0,6.0,4.270356178283691
177794,,"  NO, the given code is not vulnerable to a nan vulnerability. The code does not contain any floating-point arithmetic operations, and it does not use the `nan` value in any way. Therefore, it is not vulnerable to a nan vulnerability.","The code contains a nan vulnerability. 
The CVE-ID is CVE-2017-16853. The CWE-ID is CWE-347.
Vulnerability summary:
The DynamicMetadataProvider class in saml/saml2/metadata/impl/DynamicMetadataProvider.cpp in OpenSAML-C in OpenSAML before 2.6.1 fails to properly configure itself with the MetadataFilter plugins and does not perform critical security checks such as signature verification, enforcement of validity periods, and other checks specific to deployments, aka CPPOST-105.
",1.0,678.0,6.0,3.3852391242980957
177795,,  NO,"The code contains a nan vulnerability. 
The CVE-ID is CVE-2017-16852. The CWE-ID is CWE-347.
Vulnerability summary:
shibsp/metadata/DynamicMetadataProvider.cpp in the Dynamic MetadataProvider plugin in Shibboleth Service Provider before 2.6.1 fails to properly configure itself with the MetadataFilter plugins and does not perform critical security checks such as signature verification, enforcement of validity periods, and other checks specific to deployments, aka SSPCPP-763.
",1.0,625.0,6.0,2.9620158672332764
177796,Overflow,"  NO, the given code is not vulnerable to buffer overflow.

The code uses the `ntoh32` function to read the length of the new path, which is a 32-bit integer. The `ntoh32` function ensures that the value is read correctly, and the code does not contain any other vulnerabilities related to buffer overflow.","The code contains a Overflow vulnerability. 
The CVE-ID is CVE-2019-15938. The CWE-ID is CWE-119.
Vulnerability summary:
Pengutronix barebox through 2019.08.1 has a remote buffer overflow in nfs_readlink_req in fs/nfs.c because a length field is directly used for a memcpy.
",1.0,661.0,6.0,5.10634708404541
177799,Overflow,"  NO, the given code is not vulnerable to any security vulnerabilities.

The code is a function that reads an image file and returns an image object. It does not appear to have any security vulnerabilities, as it only reads data from the file and does not perform any operations that could potentially cause harm.

However, it is important to note that the code is not secure because it does not properly validate user input. The function assumes that the input file is valid and does not check for errors. This could lead to security vulnerabilities if the input file is not valid or if the function is used with untrusted input.","The code contains a Overflow vulnerability. 
The CVE-ID is CVE-2017-16612. The CWE-ID is CWE-190.
Vulnerability summary:
libXcursor before 1.1.15 has various integer overflows that could lead to heap buffer overflows when processing malicious cursors, e.g., with programs like GIMP. It is also possible that an attack vector exists against the related code in cursor/xcursor.c in Wayland through 1.14.0.
",1.0,742.0,6.0,3.7101967334747314
177807,Bypass,"  NO, the given code is not vulnerable to a bypass vulnerability. The code checks the type of the input data and returns an error if the type is not as expected. It does not attempt to bypass the type check and does not allow the user to access data that is not of the expected type. Therefore, there is no bypass vulnerability in the code.","The code contains a Bypass vulnerability. 
The CVE-ID is CVE-2018-19476. The CWE-ID is CWE-704.
Vulnerability summary:
psi/zicc.c in Artifex Ghostscript before 9.26 allows remote attackers to bypass intended access restrictions because of a setcolorspace type confusion.
",1.0,657.0,6.0,2.942824125289917
177809,Bypass,"  NO, the given code is not vulnerable to a bypass vulnerability. The code checks whether the page device dictionaries are the same before returning 0, which means it is not vulnerable to the bypass vulnerability.","The code contains a Bypass vulnerability. 
The CVE-ID is CVE-2018-19475. The CWE-ID is nan.
Vulnerability summary:
psi/zdevice2.c in Artifex Ghostscript before 9.26 allows remote attackers to bypass intended access restrictions because available stack space is not checked when the device remains the same.
",1.0,630.0,6.0,3.924616575241089
177811,DoS,"  NO, the given code is not vulnerable to a DoS attack.

The code checks the size of the AS_PATH attribute before writing it to the stream, and it also checks the size of the segment header before writing it to the stream. This ensures that the AS_PATH attribute is not written partially, which would cause a DoS vulnerability.

Furthermore, the code also checks if the next segment can fit in the current segment, and if it can, it updates the length of the segment header accordingly. This ensures that the AS_PATH attribute is not written partially, which would cause a DoS vulnerability.

Therefore, the code is not vulnerable to a DoS attack.","The code contains a DoS vulnerability. 
The CVE-ID is CVE-2017-16227. The CWE-ID is CWE-20.
Vulnerability summary:
The aspath_put function in bgpd/bgp_aspath.c in Quagga before 1.2.2 allows remote attackers to cause a denial of service (session drop) via BGP UPDATE messages, because AS_PATH size calculation for long paths counts certain bytes twice and consequently constructs an invalid message.
",1.0,748.0,6.0,3.510146379470825
177812,Bypass,  NO,"The code contains a Bypass vulnerability. 
The CVE-ID is CVE-2017-15994. The CWE-ID is CWE-354.
Vulnerability summary:
rsync 3.1.3-development before 2017-10-24 mishandles archaic checksums, which makes it easier for remote attackers to bypass intended access restrictions. NOTE: the rsync development branch has significant use beyond the rsync developers, e.g., the code has been copied for use in various GitHub projects.
",1.0,626.0,6.0,6.081236124038696
177815,Bypass,"  NO. The code is not vulnerable to a bypass vulnerability. The function is using a switch statement to determine the checksum type, and it is checking the value of the checksum_type variable before calling the appropriate checksum function. Additionally, the code is using a map_ptr function to access the memory mapped file, which is a safe way to access memory.","The code contains a Bypass vulnerability. 
The CVE-ID is CVE-2017-15994. The CWE-ID is CWE-354.
Vulnerability summary:
rsync 3.1.3-development before 2017-10-24 mishandles archaic checksums, which makes it easier for remote attackers to bypass intended access restrictions. NOTE: the rsync development branch has significant use beyond the rsync developers, e.g., the code has been copied for use in various GitHub projects.
",1.0,693.0,6.0,3.1641242504119873
177816,Bypass,"  NO. The code is not vulnerable to a bypass vulnerability. The function is using the `md_context` structure to store the intermediate results of the checksum calculation, and it is not using any unsafe or deprecated functions. The code also properly checks the input parameters and ensures that the input buffer is not modified. Therefore, there is no bypass vulnerability in the code.","The code contains a Bypass vulnerability. 
The CVE-ID is CVE-2017-15994. The CWE-ID is CWE-354.
Vulnerability summary:
rsync 3.1.3-development before 2017-10-24 mishandles archaic checksums, which makes it easier for remote attackers to bypass intended access restrictions. NOTE: the rsync development branch has significant use beyond the rsync developers, e.g., the code has been copied for use in various GitHub projects.
",1.0,696.0,6.0,7.188750267028809
177821,DoS,"  NO. The code is not vulnerable to a DoS attack. The function `gridIllumination` takes two vectors as input, `lamps` and `queries`, and returns a vector of integers. The function does not have any buffer overflow vulnerabilities, and it does not have any other known vulnerabilities.","The code contains a DoS vulnerability. 
The CVE-ID is CVE-2017-15923. The CWE-ID is nan.
Vulnerability summary:
Konversation 1.4.x, 1.5.x, 1.6.x, and 1.7.x before 1.7.3 allow remote attackers to cause a denial of service (crash) via vectors related to parsing of IRC color formatting codes.
",1.0,671.0,6.0,3.3530519008636475
177823,Exec Code Overflow,"  NO, the given code is not vulnerable to Exec Code Overflow.

The code does not contain any buffer overflow vulnerabilities, as it does not involve any user-input data or string manipulation functions. The only potential vulnerability is the use of the `getcode` function, which could potentially return an incorrect value if the input stream is corrupted or malicious. However, this vulnerability is not exploitable in the given code snippet, as it only checks for the return value of `getcode` and does not use it for any further operations.

Therefore, the given code is not vulnerable to Exec Code Overflow.","The code contains a Exec_Code_Overflow vulnerability. 
The CVE-ID is CVE-2011-2895. The CWE-ID is CWE-119.
Vulnerability summary:
The LZW decompressor in (1) the BufCompressedFill function in fontfile/decompress.c in X.Org libXfont before 1.4.4 and (2) compress/compress.c in 4.3BSD, as used in zopen.c in OpenBSD before 3.8, FreeBSD, NetBSD 4.0.x and 5.0.x before 5.0.3 and 5.1.x before 5.1.1, FreeType 2.1.9, and other products, does not properly handle code words that are absent from the decompression table when encountered, which allows context-dependent attackers to trigger an infinite loop or a heap-based buffer overflow, and possibly execute arbitrary code, via a crafted compressed stream, a related issue to CVE-2006-1168 and CVE-2011-2896.
",1.0,855.0,6.0,2.875415802001953
177825,DoS,"  NO, the given code is not vulnerable to a DoS attack.

The code does not contain any vulnerabilities related to format string specifiers in a destination filename. The function extractPages takes two string arguments, srcFileName and destFileName, and uses snprintf to construct a pathName string. The snprintf function is used correctly, with the correct number of arguments and the correct format specifiers.

Therefore, the code is not vulnerable to a DoS attack.","The code contains a DoS vulnerability. 
The CVE-ID is CVE-2013-4474. The CWE-ID is CWE-20.
Vulnerability summary:
Format string vulnerability in the extractPages function in utils/pdfseparate.cc in poppler before 0.24.3 allows remote attackers to cause a denial of service (crash) via format string specifiers in a destination filename.
",1.0,693.0,6.0,3.089921712875366
177826,DoS Exec Code Overflow,"  NO. The code is not vulnerable to a DoS_Exec_Code_Overflow vulnerability. The vulnerability is caused by the use of the `sprintf` function, which can be exploited to write to the stack and execute arbitrary code. However, the code does not use `sprintf` in a way that can lead to a stack-based buffer overflow.","The code contains a DoS_Exec_Code_Overflow vulnerability. 
The CVE-ID is CVE-2013-4473. The CWE-ID is CWE-119.
Vulnerability summary:
Stack-based buffer overflow in the extractPages function in utils/pdfseparate.cc in poppler before 0.24.2 allows remote attackers to cause a denial of service (crash) and possibly execute arbitrary code via a source filename.
",1.0,676.0,6.0,2.9706814289093018
177827,,"  NO, the given code is not vulnerable to a nan vulnerability. The code is a function that retrieves the POSIX ACL for a given inode, and it does not contain any arithmetic operations that could lead to a nan vulnerability.","The code contains a nan vulnerability. 
The CVE-ID is CVE-2007-4849. The CWE-ID is CWE-264.
Vulnerability summary:
JFFS2, as used on One Laptop Per Child (OLPC) build 542 and possibly other Linux systems, when POSIX ACL support is enabled, does not properly store permissions during (1) inode creation or (2) ACL setting, which might allow local users to access restricted files or directories after a remount of a filesystem, related to ""legacy modes"" and an inconsistency between dentry permissions and inode permissions.
",1.0,686.0,6.0,3.4325146675109863
177831,,  NO. The code is not vulnerable to a nan vulnerability.,"The code contains a nan vulnerability. 
The CVE-ID is CVE-2019-14975. The CWE-ID is CWE-125.
Vulnerability summary:
Artifex MuPDF before 1.16.0 has a heap-based buffer over-read in fz_chartorune in fitz/string.c because pdf/pdf-op-filter.c does not check for a missing string.
",1.0,609.0,6.0,4.194547653198242
177832,,  NO,"The code contains a nan vulnerability. 
The CVE-ID is CVE-2019-14975. The CWE-ID is CWE-125.
Vulnerability summary:
Artifex MuPDF before 1.16.0 has a heap-based buffer over-read in fz_chartorune in fitz/string.c because pdf/pdf-op-filter.c does not check for a missing string.
",1.0,599.0,6.0,5.43107271194458
177833,DoS Overflow,"  NO. The code is not vulnerable to a DoS_Overflow vulnerability. The function reds_handle_ticket is not vulnerable to a buffer overflow attack because it uses the RSA_private_decrypt function to decrypt the password, which ensures that the password is not longer than the buffer size.","The code contains a DoS_Overflow vulnerability. 
The CVE-ID is CVE-2013-4282. The CWE-ID is CWE-119.
Vulnerability summary:
Stack-based buffer overflow in the reds_handle_ticket function in server/reds.c in SPICE 0.12.0 allows remote attackers to cause a denial of service (crash) via a long password in a SPICE ticket.
",1.0,658.0,6.0,2.409212350845337
177839,+Info,"  NO, the given code is not vulnerable to any security vulnerabilities.

The code is a function that takes in a string and a charset, and returns the next codepoint in the string. It uses the smb_iconv function to convert the string to UTF16 format, and then reads the first two bytes of the converted string to determine the codepoint.

The code does not appear to have any buffer overflow vulnerabilities, as it only reads the first two bytes of the converted string. It also does not appear to have any use-after-free vulnerabilities, as it does not use any pointers after they have been deallocated.

However, the code does have a potential memory leak vulnerability. The function calls the get_conv_handle function, which allocates memory for a smb_iconv_handle structure. If the function does not properly free this memory, it could lead to a memory leak.

Additionally, the code does not appear to have any integer overflow or underflow vulnerabilities, as it only reads the first two bytes of the converted string and does not perform any arithmetic operations on the codepoint.

Overall, the code appears to be secure, but it does have a potential memory leak vulnerability that needs to be addressed.","The code contains a +Info vulnerability. 
The CVE-ID is CVE-2015-5330. The CWE-ID is CWE-200.
Vulnerability summary:
ldb before 1.1.24, as used in the AD LDAP server in Samba 4.x before 4.1.22, 4.2.x before 4.2.7, and 4.3.x before 4.3.3, mishandles string lengths, which allows remote attackers to obtain sensitive information from daemon heap memory by sending crafted packets and then reading (1) an error message or (2) a database value.
",2.0,887.0,6.0,2.9974820613861084
177840,+Info,  NO. The code is not vulnerable to any of the security vulnerabilities listed. It is a correct implementation of the ldb_dn_escape_internal function.,"The code contains a +Info vulnerability. 
The CVE-ID is CVE-2015-5330. The CWE-ID is CWE-200.
Vulnerability summary:
ldb before 1.1.24, as used in the AD LDAP server in Samba 4.x before 4.1.22, 4.2.x before 4.2.7, and 4.3.x before 4.3.3, mishandles string lengths, which allows remote attackers to obtain sensitive information from daemon heap memory by sending crafted packets and then reading (1) an error message or (2) a database value.
",1.0,678.0,6.0,3.4224085807800293
