case_id,vuln_type,audit_report,gt,eval_score,eval_input_token_num,eval_output_token_num,eval_inference_time
177893,+Info,  NO,"The code contains a +Info vulnerability. 
The CVE-ID is CVE-2015-3193. The CWE-ID is CWE-200.
Vulnerability summary:
The Montgomery squaring implementation in crypto/bn/asm/x86_64-mont5.pl in OpenSSL 1.0.2 before 1.0.2e on the x86_64 platform, as used by the BN_mod_exp function, mishandles carry propagation and produces incorrect output, which makes it easier for remote attackers to obtain sensitive private-key information via an attack against use of a (1) Diffie-Hellman (DH) or (2) Diffie-Hellman Ephemeral (DHE) ciphersuite.
",1.0,669.0,6.0,3.578657388687134
177896,,  NO. The code is not vulnerable to a nan vulnerability.,"The code contains a nan vulnerability. 
The CVE-ID is CVE-2013-2007. The CWE-ID is CWE-264.
Vulnerability summary:
The qemu guest agent in Qemu 1.4.1 and earlier, as used by Xen, when started in daemon mode, uses weak permissions for certain files, which allows local users to read and write to these files.
",1.0,612.0,6.0,2.5132298469543457
177897,+Info,"  NO, the given code is not vulnerable to any security vulnerabilities.

The code is a C++ function that parses an XML file using the libxml2 library. It does not contain any obvious security vulnerabilities, such as buffer overflows or use-after-free errors.

However, it is important to note that the code is using the `xmlCreateFileParserCtxt` function, which can be vulnerable to XXE attacks if the XML file being parsed contains an XML external entity declaration. This is because the `xmlCreateFileParserCtxt` function does not perform any validation on the XML file, and it can be exploited by an attacker to read arbitrary files on the server.

To mitigate this vulnerability, the code should use the `xmlCreateFileParserCtxtWithData` function instead, which takes an additional `data` parameter that can be used to specify a custom entity loader. This can be used to load the XML file in a secure manner, without allowing the possibility of an XXE attack.","The code contains a +Info vulnerability. 
The CVE-ID is CVE-2013-1824. The CWE-ID is CWE-200.
Vulnerability summary:
The SOAP parser in PHP before 5.3.22 and 5.4.x before 5.4.12 allows remote attackers to read arbitrary files via a SOAP WSDL file containing an XML external entity declaration in conjunction with an entity reference, related to an XML External Entity (XXE) issue in the soap_xmlParseFile and soap_xmlParseMemory functions.
",3.0,830.0,6.0,3.5304794311523438
177898,+Info,"  NO, the given code is not vulnerable to any security vulnerabilities.

The code is a C++ function that takes two arguments, `buf` and `buf_size`, and returns a `xmlDocPtr` object. It creates a new `xmlParserCtxtPtr` object and initializes it with the `buf` and `buf_size` arguments. It then sets the `options` member of the `xmlParserCtxtPtr` object to `XML_PARSE_HUGE` and calls the `xmlParseDocument` function.

The `xmlParseDocument` function parses the XML document and returns a `xmlDocPtr` object. The `xmlDocPtr` object is then returned by the `soap_xmlParseMemory` function.

There is no evidence of any security vulnerabilities in the code. The code does not appear to be vulnerable to any security issues, such as buffer overflows, use-after-free errors, memory leaks, integer overflow/underflow, null pointer dereferences, improper input validation, race conditions, insecure function usage, insecure resource management, improper error handling, cryptographic issues, or sensitive data exposure.

Therefore, I would say that the code is not vulnerable to any security vulnerabilities.","The code contains a +Info vulnerability. 
The CVE-ID is CVE-2013-1824. The CWE-ID is CWE-200.
Vulnerability summary:
The SOAP parser in PHP before 5.3.22 and 5.4.x before 5.4.12 allows remote attackers to read arbitrary files via a SOAP WSDL file containing an XML external entity declaration in conjunction with an entity reference, related to an XML External Entity (XXE) issue in the soap_xmlParseFile and soap_xmlParseMemory functions.
",1.0,869.0,6.0,4.115658521652222
177899,+Info,"  NO, the given code is not vulnerable to any security vulnerabilities.

The code is a C++ function that parses an XML file using the libxml2 library. It does not contain any obvious security vulnerabilities, such as buffer overflows, use-after-free errors, or memory leaks.

However, it is possible that the code could be vulnerable to other types of security issues, such as XML injection attacks or XXE vulnerabilities. But without further information about the code or the context in which it is used, it is difficult to determine whether these vulnerabilities exist.","The code contains a +Info vulnerability. 
The CVE-ID is CVE-2013-1824. The CWE-ID is CWE-200.
Vulnerability summary:
The SOAP parser in PHP before 5.3.22 and 5.4.x before 5.4.12 allows remote attackers to read arbitrary files via a SOAP WSDL file containing an XML external entity declaration in conjunction with an entity reference, related to an XML External Entity (XXE) issue in the soap_xmlParseFile and soap_xmlParseMemory functions.
",1.0,739.0,6.0,3.920238494873047
177900,+Info,  NO. The code is not vulnerable to any of the security vulnerabilities listed. It is a well-written and secure C++ code that does not contain any known security vulnerabilities.,"The code contains a +Info vulnerability. 
The CVE-ID is CVE-2013-1824. The CWE-ID is CWE-200.
Vulnerability summary:
The SOAP parser in PHP before 5.3.22 and 5.4.x before 5.4.12 allows remote attackers to read arbitrary files via a SOAP WSDL file containing an XML external entity declaration in conjunction with an entity reference, related to an XML External Entity (XXE) issue in the soap_xmlParseFile and soap_xmlParseMemory functions.
",1.0,663.0,6.0,2.4912424087524414
177901,Overflow,  NO,"The code contains a Overflow vulnerability. 
The CVE-ID is CVE-2015-2806. The CWE-ID is CWE-119.
Vulnerability summary:
Stack-based buffer overflow in asn1_der_decoding in libtasn1 before 4.4 allows remote attackers to have unspecified impact via unknown vectors.
",1.0,587.0,6.0,3.2305855751037598
177904,DoS,"  NO, the given code is not vulnerable to a DoS attack.

The code checks the `clipRes` parameter before calling `pipeInit`, which ensures that the function is only called when the `clipRes` parameter is valid. The `clipRes` parameter is an enum value that is used to determine the clipping result, and it is not possible to pass an invalid value to this function. Therefore, the code is not vulnerable to a DoS attack.","The code contains a DoS vulnerability. 
The CVE-ID is CVE-2013-1789. The CWE-ID is nan.
Vulnerability summary:
splash/Splash.cc in poppler before 0.22.1 allows context-dependent attackers to cause a denial of service (NULL pointer dereference and crash) via vectors related to the (1) Splash::arbitraryTransformMask, (2) Splash::blitMask, and (3) Splash::scaleMaskYuXu functions.
",1.0,714.0,6.0,3.4251632690429688
177905,DoS,  NO. The code is not vulnerable to a DoS attack.,"The code contains a DoS vulnerability. 
The CVE-ID is CVE-2013-1789. The CWE-ID is nan.
Vulnerability summary:
splash/Splash.cc in poppler before 0.22.1 allows context-dependent attackers to cause a denial of service (NULL pointer dereference and crash) via vectors related to the (1) Splash::arbitraryTransformMask, (2) Splash::blitMask, and (3) Splash::scaleMaskYuXu functions.
",1.0,634.0,6.0,3.9167661666870117
177906,DoS Exec Code Overflow,"  YES, the given code is vulnerable to a DoS_Exec_Code_Overflow vulnerability. The CVE-ID is CVE-2013-1788. The CWE-ID is CWE-119.

The vulnerability arises from the use of the `splashFloor` function, which is used to calculate the index of the line dash pattern. The function takes a floating-point number as input and returns the largest integer less than or equal to that number. However, the function does not check for overflows, which can occur if the input number is too large.

If the input number is too large, the function will return a value that is not within the valid range of the `int` type, leading to a buffer overflow. This can cause the application to crash or execute arbitrary code.

To exploit this vulnerability, an attacker can send a specially crafted input that causes the `splashFloor` function to return a value that is outside the valid range of the `int` type. This can be done by sending a large floating-point number as input, which will cause the function to return a value that is too large to fit in the `int` type.

The vulnerability can be mitigated by checking for overflows in the `splashFloor` function, or by using a safer function that does not have","The code contains a DoS_Exec_Code_Overflow vulnerability. 
The CVE-ID is CVE-2013-1788. The CWE-ID is CWE-119.
Vulnerability summary:
poppler before 0.22.1 allows context-dependent attackers to cause a denial of service (crash) and possibly execute arbitrary code via vectors that trigger an ""invalid memory access"" in (1) splash/Splash.cc, (2) poppler/Function.cc, and (3) poppler/Stream.cc.
",3.0,889.0,6.0,2.9913253784179688
177907,DoS Exec Code Overflow,"  NO, the given code is not vulnerable to a DoS_Exec_Code_Overflow vulnerability.

The code does not contain any obvious buffer overflow vulnerabilities, and the input validation is not weak. However, the code does contain some potential security vulnerabilities, such as integer overflows, use after free, and memory leaks.

Integer overflows can occur if the input values are too large, leading to incorrect calculations and buffer miscalculations. Use after free vulnerabilities can occur if the memory is deallocated but still being used, leading to crashes or arbitrary code execution. Memory leaks can occur if the memory is not properly freed, leading to performance degradation or DoS vulnerabilities.

However, the code does not contain any obvious vulnerabilities related to these issues. The input validation is not weak, and the code does not contain any obvious buffer overflow vulnerabilities.

Therefore, I would say that the code is not vulnerable to a DoS_Exec_Code_Overflow vulnerability.","The code contains a DoS_Exec_Code_Overflow vulnerability. 
The CVE-ID is CVE-2013-1788. The CWE-ID is CWE-119.
Vulnerability summary:
poppler before 0.22.1 allows context-dependent attackers to cause a denial of service (crash) and possibly execute arbitrary code via vectors that trigger an ""invalid memory access"" in (1) splash/Splash.cc, (2) poppler/Function.cc, and (3) poppler/Stream.cc.
",2.0,813.0,6.0,3.502490997314453
177909,DoS Exec Code Overflow,"  NO, the given code is not vulnerable to a DoS_Exec_Code_Overflow vulnerability.

The code does not contain any buffer overflow vulnerabilities, as it does not involve any user-supplied data or unvalidated user input. The code also does not contain any use-after-free errors, as the memory is properly deallocated and the pointers are not used after the memory has been deallocated.

The code does contain some potential memory leaks, as it does not properly check for missing or improper calls to delete or free after allocating memory using new or malloc. However, the code does not contain any memory leaks that could lead to a DoS_Exec_Code_Overflow vulnerability.

The code does contain some potential integer overflow/underflow vulnerabilities, as it does not properly check for overflow or underflow conditions. However, the code does not contain any integer overflow/underflow vulnerabilities that could lead to a DoS_Exec_Code_Overflow vulnerability.

The code does contain some potential null pointer dereference vulnerabilities, as it does not properly check for null pointers before being dereferenced. However, the code does not contain any null pointer dereference vulnerabilities that could lead to a DoS_Exec_Code_Overflow vulnerability.

The code does contain some potential improper input validation vulnerabilities, as it does not properly validate user input. However, the","The code contains a DoS_Exec_Code_Overflow vulnerability. 
The CVE-ID is CVE-2013-1788. The CWE-ID is CWE-119.
Vulnerability summary:
poppler before 0.22.1 allows context-dependent attackers to cause a denial of service (crash) and possibly execute arbitrary code via vectors that trigger an ""invalid memory access"" in (1) splash/Splash.cc, (2) poppler/Function.cc, and (3) poppler/Stream.cc.
",2.0,891.0,6.0,2.524183750152588
177910,DoS,  NO. The code is not vulnerable to a DoS attack.,"The code contains a DoS vulnerability. 
The CVE-ID is CVE-2017-11714. The CWE-ID is CWE-125.
Vulnerability summary:
psi/ztoken.c in Artifex Ghostscript 9.21 mishandles references to the scanner state structure, which allows remote attackers to cause a denial of service (application crash) or possibly have unspecified other impact via a crafted PostScript document, related to an out-of-bounds read in the igc_reloc_struct_ptr function in psi/igc.c.
",1.0,643.0,6.0,2.8562192916870117
177911,Exec Code Overflow,"  NO, the given code is not vulnerable to Exec Code Overflow.

The code is a function that takes two vectors as input, `lamps` and `queries`, and performs some operations on them. It does not appear to have any vulnerabilities related to Exec Code Overflow.

However, the code does have some potential issues related to buffer overflows, use after free, and other security vulnerabilities. For example, the code uses `unordered_set` and `unordered_map` to store data, which can lead to buffer overflows if the data is not properly validated. Additionally, the code uses `tie` to extract values from a pair, which can lead to use after free if the pair is not properly initialized.

Therefore, it is recommended to thoroughly review the code to ensure that it is free from security vulnerabilities.","The code contains a Exec_Code_Overflow vulnerability. 
The CVE-ID is CVE-2009-0946. The CWE-ID is CWE-189.
Vulnerability summary:
Multiple integer overflows in FreeType 2.3.9 and earlier allow remote attackers to execute arbitrary code via vectors related to large values in certain inputs in (1) smooth/ftsmooth.c, (2) sfnt/ttcmap.c, and (3) cff/cffload.c.
",2.0,781.0,6.0,2.2437002658843994
177912,Exec Code Overflow,"  NO. The code is not vulnerable to Exec Code Overflow.

The function `gridIllumination` does not contain any code that could potentially lead to an overflow. The function takes in two vectors of integers, `N`, `lamps`, and `queries`, and returns a vector of integers. The function does not perform any arithmetic operations that could lead to an overflow.

Furthermore, the function does not use any external data or input that could potentially lead to an overflow. The function only uses the data that is passed in as arguments, and it does not perform any operations that could lead to an overflow.

Therefore, the code is not vulnerable to Exec Code Overflow.","The code contains a Exec_Code_Overflow vulnerability. 
The CVE-ID is CVE-2009-0946. The CWE-ID is CWE-189.
Vulnerability summary:
Multiple integer overflows in FreeType 2.3.9 and earlier allow remote attackers to execute arbitrary code via vectors related to large values in certain inputs in (1) smooth/ftsmooth.c, (2) sfnt/ttcmap.c, and (3) cff/cffload.c.
",1.0,753.0,6.0,3.5050196647644043
177913,Exec Code Overflow,"  NO, the given code is not vulnerable to Exec Code Overflow.

The code checks the input values for validity and returns an error if the input is invalid. It does not execute any code based on the input values. Therefore, it is not vulnerable to Exec Code Overflow.","The code contains a Exec_Code_Overflow vulnerability. 
The CVE-ID is CVE-2009-0946. The CWE-ID is CWE-189.
Vulnerability summary:
Multiple integer overflows in FreeType 2.3.9 and earlier allow remote attackers to execute arbitrary code via vectors related to large values in certain inputs in (1) smooth/ftsmooth.c, (2) sfnt/ttcmap.c, and (3) cff/cffload.c.
",1.0,673.0,6.0,3.089909315109253
177915,Exec Code Overflow,"  NO, the given code is not vulnerable to Exec_Code_Overflow.

The code does not contain any integer overflows that can lead to arbitrary code execution. The integer overflows that are present in the code are related to the parsing of the CFF table, and they are not related to the execution of any code.

The code checks the format of the CFF table and allocates memory for the sids array. It then reads the first glyph sid of the range and the number of glyphs in the range. Finally, it fills in the range of sids.

There is no code execution involved in this process, and there is no potential for an integer overflow to lead to arbitrary code execution. Therefore, the code is not vulnerable to Exec_Code_Overflow.","The code contains a Exec_Code_Overflow vulnerability. 
The CVE-ID is CVE-2009-0946. The CWE-ID is CWE-189.
Vulnerability summary:
Multiple integer overflows in FreeType 2.3.9 and earlier allow remote attackers to execute arbitrary code via vectors related to large values in certain inputs in (1) smooth/ftsmooth.c, (2) sfnt/ttcmap.c, and (3) cff/cffload.c.
",1.0,773.0,6.0,4.644705772399902
177917,Exec Code,  NO. The code is not vulnerable to Exec_Code.,"The code contains a Exec_Code vulnerability. 
The CVE-ID is CVE-2018-14600. The CWE-ID is CWE-787.
Vulnerability summary:
An issue was discovered in libX11 through 1.6.5. The function XListExtensions in ListExt.c interprets a variable as signed instead of unsigned, resulting in an out-of-bounds write (of up to 128 bytes), leading to DoS or remote code execution.
",1.0,625.0,6.0,3.1328012943267822
177918,Exec Code,  NO. The code is not vulnerable to Exec_Code.,"The code contains a Exec_Code vulnerability. 
The CVE-ID is CVE-2018-14600. The CWE-ID is CWE-787.
Vulnerability summary:
An issue was discovered in libX11 through 1.6.5. The function XListExtensions in ListExt.c interprets a variable as signed instead of unsigned, resulting in an out-of-bounds write (of up to 128 bytes), leading to DoS or remote code execution.
",1.0,625.0,6.0,3.592703342437744
177919,,  NO,"The code contains a nan vulnerability. 
The CVE-ID is CVE-2018-14599. The CWE-ID is CWE-682.
Vulnerability summary:
An issue was discovered in libX11 through 1.6.5. The function XListExtensions in ListExt.c is vulnerable to an off-by-one error caused by malicious server responses, leading to DoS or possibly unspecified other impact.
",1.0,604.0,6.0,4.902270317077637
177920,,  NO. The code is not vulnerable to a nan vulnerability.,"The code contains a nan vulnerability. 
The CVE-ID is CVE-2018-14599. The CWE-ID is CWE-682.
Vulnerability summary:
An issue was discovered in libX11 through 1.6.5. The function XListExtensions in ListExt.c is vulnerable to an off-by-one error caused by malicious server responses, leading to DoS or possibly unspecified other impact.
",1.0,614.0,6.0,2.8241653442382812
177921,,  NO. The code is not vulnerable to a nan vulnerability.,"The code contains a nan vulnerability. 
The CVE-ID is CVE-2018-14599. The CWE-ID is CWE-682.
Vulnerability summary:
An issue was discovered in libX11 through 1.6.5. The function XListExtensions in ListExt.c is vulnerable to an off-by-one error caused by malicious server responses, leading to DoS or possibly unspecified other impact.
",1.0,614.0,6.0,4.476050138473511
177922,Exec Code Overflow,"  NO. The code is not vulnerable to Exec Code Overflow. The function add_param_to_argv is not responsible for executing any code, it only parses the input string and adds it to the argv array. The vulnerability you mentioned is related to the iptables-restore command, which is a separate program that uses the add_param_to_argv function.","The code contains a Exec_Code_Overflow vulnerability. 
The CVE-ID is CVE-2019-11360. The CWE-ID is CWE-119.
Vulnerability summary:
A buffer overflow in iptables-restore in netfilter iptables 1.8.2 allows an attacker to (at least) crash the program or potentially gain code execution via a specially crafted iptables-save file. This is related to add_param_to_argv in xshared.c.
",1.0,684.0,6.0,2.544769525527954
177923,Bypass,"  NO, the given code is not vulnerable to a bypass vulnerability. The code checks the existence of the file in the `SG(rfc1867_uploaded_files)` hash table before moving it to the new location. It also checks the open_basedir before renaming the file.

However, the code does not check the existence of the new file before overwriting it. This could lead to a vulnerability if an attacker can control the new file name. For example, if the new file name is ""../secret_file"", the attacker could overwrite the secret file with their own content.

Therefore, the code is vulnerable to a bypass vulnerability. The CVE-ID for this vulnerability is CVE-2015-2348. The CWE-ID for this vulnerability is CWE-264.","The code contains a Bypass vulnerability. 
The CVE-ID is CVE-2015-2348. The CWE-ID is CWE-264.
Vulnerability summary:
The move_uploaded_file implementation in ext/standard/basic_functions.c in PHP before 5.4.39, 5.5.x before 5.5.23, and 5.6.x before 5.6.7 truncates a pathname upon encountering a \x00 character, which allows remote attackers to bypass intended extension restrictions and create files with unexpected names via a crafted second argument.  NOTE: this vulnerability exists because of an incomplete fix for CVE-2006-7243.
",4.0,809.0,6.0,6.269551753997803
177926,Exec Code Overflow,"  NO, the given code is not vulnerable to Exec Code Overflow.

The code is a function that takes in a base64-encoded image and converts it into a GstBuffer. It uses the g_base64_decode_step function to decode the base64-encoded image, and then uses the gst_tag_image_data_to_image_buffer function to convert the decoded data into a GstBuffer.

The g_base64_decode_step function is a safe function that takes in a base64-encoded string and decodes it into a buffer. It does not execute any code, and does not allow any code to be executed. Therefore, there is no vulnerability to Exec Code Overflow in this code.

Similarly, the gst_tag_image_data_to_image_buffer function is also a safe function that takes in a buffer and converts it into a GstBuffer. It does not execute any code, and does not allow any code to be executed. Therefore, there is no vulnerability to Exec Code Overflow in this code.

Overall, the code is not vulnerable to Exec Code Overflow.","The code contains a Exec_Code_Overflow vulnerability. 
The CVE-ID is CVE-2009-0586. The CWE-ID is CWE-189.
Vulnerability summary:
Integer overflow in the gst_vorbis_tag_add_coverart function (gst-libs/gst/tag/gstvorbistag.c) in vorbistag in gst-plugins-base (aka gstreamer-plugins-base) before 0.10.23 in GStreamer allows context-dependent attackers to execute arbitrary code via a crafted COVERART tag that is converted from a base64 representation, which triggers a heap-based buffer overflow.
",1.0,850.0,6.0,2.540872573852539
177927,,"  NO, the code is not vulnerable to a nan vulnerability. The code is a C++ function that implements the OpenSSL sealing algorithm for PEM encryption. It does not contain any nan vulnerabilities.","The code contains a nan vulnerability. 
The CVE-ID is CVE-2017-11144. The CWE-ID is CWE-754.
Vulnerability summary:
In PHP before 5.6.31, 7.x before 7.0.21, and 7.1.x before 7.1.7, the openssl extension PEM sealing code did not check the return value of the OpenSSL sealing function, which could lead to a crash of the PHP interpreter, related to an interpretation conflict for a negative number in ext/openssl/openssl.c, and an OpenSSL documentation omission.
",1.0,681.0,6.0,3.446993112564087
