case_id,vuln_type,audit_report,gt,eval_score,eval_input_token_num,eval_output_token_num,eval_inference_time
177736,Bypass,  NO. The code is not vulnerable to a bypass vulnerability. The function is checking the user account control bits and comparing them to a list of required rights. It is not possible to bypass this check by modifying the user account control bits.,"The code contains a Bypass vulnerability. 
The CVE-ID is CVE-2015-8467. The CWE-ID is CWE-264.
Vulnerability summary:
The samldb_check_user_account_control_acl function in dsdb/samdb/ldb_modules/samldb.c in Samba 4.x before 4.1.22, 4.2.x before 4.2.7, and 4.3.x before 4.3.3 does not properly check for administrative privileges during creation of machine accounts, which allows remote authenticated users to bypass intended access restrictions by leveraging the existence of a domain with both a Samba DC and a Windows DC, a similar issue to CVE-2015-2535.
",1.0,715.0,6.0,2.98659348487854
177740,DoS Exec Code Overflow Mem. Corr.,"  NO, the given code is not vulnerable to any of the security vulnerabilities you mentioned.

The code is using the `estrdup` function to allocate memory for the `strbuf` variable, which is a buffer that is used to store the time string. The `estrdup` function is a safe version of the `strdup` function, which ensures that the memory is properly allocated and initialized.

The code is also using the `mktime` function to convert the time string to a `time_t` value, which is a standard way of representing time in C. The `mktime` function is a safe function that ensures that the time value is properly converted and that the resulting time value is valid.

Therefore, the code is not vulnerable to any of the security vulnerabilities you mentioned.","The code contains a DoS_Exec_Code_Overflow_Mem._Corr. vulnerability. 
The CVE-ID is CVE-2013-6420. The CWE-ID is CWE-119.
Vulnerability summary:
The asn1_time_to_time_t function in ext/openssl/openssl.c in PHP before 5.3.28, 5.4.x before 5.4.23, and 5.5.x before 5.5.7 does not properly parse (1) notBefore and (2) notAfter timestamps in X.509 certificates, which allows remote attackers to execute arbitrary code or cause a denial of service (memory corruption) via a crafted certificate that is not properly handled by the openssl_x509_parse function.
",1.0,833.0,6.0,3.2609329223632812
177741,DoS Overflow,"  NO, the given code is not vulnerable to a DoS Overflow.

The code is a function that takes in a session object and returns a pointer to a buffer that contains the serialized session data. The function checks if the session is resumable, and if it is, it packs the session data into the buffer. The function also checks if the buffer is large enough to hold the session data, and if it is not, it returns an error.

There is no buffer overflow vulnerability in the code because the function checks the size of the buffer before copying the session data into it. The function also checks if the session data is larger than the buffer size, and if it is, it returns an error.

Therefore, the code is not vulnerable to a DoS Overflow.","The code contains a DoS_Overflow vulnerability. 
The CVE-ID is CVE-2011-4128. The CWE-ID is CWE-119.
Vulnerability summary:
Buffer overflow in the gnutls_session_get_data function in lib/gnutls_session.c in GnuTLS 2.12.x before 2.12.14 and 3.x before 3.0.7, when used on a client that performs nonstandard session resumption, allows remote TLS servers to cause a denial of service (application crash) via a large SessionTicket.
",1.0,790.0,6.0,2.5186498165130615
177742,DoS Overflow,"  NO, the given code is not vulnerable to a DoS Overflow.

The code is a function that takes in a session object and a buffer to store the session data. It checks if the buffer is large enough to hold the session data, and if not, it returns an error. It also checks if the session is resumable, and if not, it returns an error.

There is no buffer overflow vulnerability in the code because it checks the size of the buffer before copying the session data into it. It also checks if the session is resumable before attempting to pack the session data.

Therefore, the code is not vulnerable to a DoS Overflow.","The code contains a DoS_Overflow vulnerability. 
The CVE-ID is CVE-2011-4128. The CWE-ID is CWE-119.
Vulnerability summary:
Buffer overflow in the gnutls_session_get_data function in lib/gnutls_session.c in GnuTLS 2.12.x before 2.12.14 and 3.x before 3.0.7, when used on a client that performs nonstandard session resumption, allows remote TLS servers to cause a denial of service (application crash) via a large SessionTicket.
",1.0,767.0,6.0,4.914034605026245
177743,DoS,"  NO, the code is not vulnerable to any of the security vulnerabilities listed.

The code is using the `zend_hash_init` function to initialize a hash table, which is a secure way to allocate and initialize a hash table. The `zend_hash_init` function takes a number of elements as an argument, which is used to determine the initial size of the hash table. The code is not using any user-supplied input to determine the number of elements, so it is not vulnerable to a buffer overflow or other security vulnerability.

Furthermore, the code is not using any user-supplied input to access the hash table, so it is not vulnerable to a use-after-free error or other security vulnerability.

The code is also not using any user-supplied input to access the hash table, so it is not vulnerable to a memory leak or other security vulnerability.

The code is also not using any user-supplied input to access the hash table, so it is not vulnerable to an integer overflow or underflow or other security vulnerability.

The code is also not using any user-supplied input to access the hash table, so it is not vulnerable to a null pointer dereference or other security vulnerability.

The code is also not using any user-supplied input to access the hash table, so it is not","The code contains a DoS vulnerability. 
The CVE-ID is CVE-2015-7804. The CWE-ID is CWE-189.
Vulnerability summary:
Off-by-one error in the phar_parse_zipfile function in ext/phar/zip.c in PHP before 5.5.30 and 5.6.x before 5.6.14 allows remote attackers to cause a denial of service (uninitialized pointer dereference and application crash) by including the / filename in a .zip PHAR archive.
",1.0,892.0,6.0,3.515150308609009
177747,DoS,"  NO, the given code is not vulnerable to a DoS attack.

The code checks if the received attribute is a well-known attribute or not, and if it is not, it returns immediately. It does not process the attribute further, and it does not forward the read pointer of the input stream. Therefore, it is not possible to cause a DoS attack by sending a crafted BGP update with a large number of unrecognized attributes.

In fact, the code is designed to handle unrecognized attributes gracefully, and it does not crash or behave unexpectedly. Therefore, it is not vulnerable to a DoS attack.","The code contains a DoS vulnerability. 
The CVE-ID is CVE-2013-6051. The CWE-ID is nan.
Vulnerability summary:
The bgp_attr_unknown function in bgp_attr.c in Quagga 0.99.21 does not properly initialize the total variable, which allows remote attackers to cause a denial of service (bgpd crash) via a crafted BGP update.
",1.0,725.0,6.0,2.8575265407562256
177750,DoS Exec Code,"  NO, the given code is not vulnerable to a DoS_Exec_Code vulnerability.

The code does not contain any obvious vulnerabilities related to memory management, buffer overflows, or other security issues. However, it does contain a potential race condition in the `pdf_tos_save` and `pdf_tos_restore` functions, which could lead to inconsistent program states or data corruption if not properly synchronized.

Additionally, the code uses the `fz_try` and `fz_catch` macros to handle errors, but it does not properly handle the `FZ_ERROR_TRYLATER` error code, which could lead to a potential DoS vulnerability if not properly handled.

Overall, while the code does not contain any obvious security vulnerabilities, it does contain potential race conditions and error handling issues that should be addressed to ensure the program is secure.","The code contains a DoS_Exec_Code vulnerability. 
The CVE-ID is CVE-2018-1000039. The CWE-ID is CWE-416.
Vulnerability summary:
In MuPDF 1.12.0 and earlier, multiple heap use after free bugs in the PDF parser could allow an attacker to execute arbitrary code, read memory, or cause a denial of service via a crafted file.
",2.0,770.0,6.0,2.7315430641174316
177766,DoS,"  NO, the given code is not vulnerable to a DoS attack.

The code checks the return values of the ASN.1 memory allocation functions to ensure successful allocation. It also checks the return values of the ASN.1 write functions to ensure that the data is written correctly.

Therefore, the code does not have a DoS vulnerability.","The code contains a DoS vulnerability. 
The CVE-ID is CVE-2015-7540. The CWE-ID is CWE-399.
Vulnerability summary:
The LDAP server in the AD domain controller in Samba 4.x before 4.1.22 does not check return values to ensure successful ASN.1 memory allocation, which allows remote attackers to cause a denial of service (memory consumption and daemon crash) via crafted packets.
",1.0,676.0,6.0,2.343297004699707
177767,DoS,"  NO, the given code is not vulnerable to a DoS attack.

The code is using the `talloc` function to allocate memory for the `control` structure, and it is checking the return value of the `asn1_start_tag` function to ensure that the tag was successfully read. This means that the code is properly checking for errors and handling them appropriately.

Therefore, the code is not vulnerable to a DoS attack.","The code contains a DoS vulnerability. 
The CVE-ID is CVE-2015-7540. The CWE-ID is CWE-399.
Vulnerability summary:
The LDAP server in the AD domain controller in Samba 4.x before 4.1.22 does not check return values to ensure successful ASN.1 memory allocation, which allows remote attackers to cause a denial of service (memory consumption and daemon crash) via crafted packets.
",1.0,696.0,6.0,2.8181309700012207
177768,DoS,"  NO. The code is not vulnerable to a DoS attack. The function `sparse_dump_region` is designed to read a specific region of a file and write it to another file. It does not have any input validation, and it does not have any logic to handle a DoS attack. Therefore, it is not vulnerable to a DoS attack.","The code contains a DoS vulnerability. 
The CVE-ID is CVE-2018-20482. The CWE-ID is CWE-835.
Vulnerability summary:
GNU Tar through 1.30, when --sparse is used, mishandles file shrinkage during read access, which allows local users to cause a denial of service (infinite read loop in sparse_dump_region in sparse.c) by modifying a file that is supposed to be archived by a different user's process (e.g., a system backup running as root).
",1.0,700.0,6.0,3.918379783630371
177770,Bypass,"  NO. The code is not vulnerable to a bypass vulnerability. The vulnerability you mentioned is related to the rsync daemon, but the code you provided is not related to the rsync daemon. It appears to be a function that reads data from a file and returns the index of the file. It does not contain any code that could potentially be exploited to bypass access restrictions.","The code contains a Bypass vulnerability. 
The CVE-ID is CVE-2017-17434. The CWE-ID is nan.
Vulnerability summary:
The daemon in rsync 3.1.2, and 3.1.3-development before 2017-12-03, does not check for fnamecmp filenames in the daemon_filter_list data structure (in the recv_files function in receiver.c) and also does not apply the sanitize_paths protection mechanism to pathnames found in ""xname follows"" strings (in the read_ndx_and_attrs function in rsync.c), which allows remote attackers to bypass intended access restrictions.
",1.0,724.0,6.0,2.738753318786621
177771,,  NO,"The code contains a nan vulnerability. 
The CVE-ID is CVE-2018-20103. The CWE-ID is CWE-835.
Vulnerability summary:
An issue was discovered in dns.c in HAProxy through 1.8.14. In the case of a compressed pointer, a crafted packet can trigger infinite recursion by making the pointer point to itself, or create a long chain of valid pointers resulting in stack exhaustion.
",1.0,609.0,6.0,3.440739154815674
177773,DoS Exec Code Overflow Mem. Corr.,  NO. The code is not vulnerable to the DoS_Exec_Code_Overflow_Mem._Corr. vulnerability.,"The code contains a DoS_Exec_Code_Overflow_Mem._Corr. vulnerability. 
The CVE-ID is CVE-2009-3607. The CWE-ID is CWE-189.
Vulnerability summary:
Integer overflow in the create_surface_from_thumbnail_data function in glib/poppler-page.cc in Poppler 0.x allows remote attackers to cause a denial of service (memory corruption) or possibly execute arbitrary code via a crafted PDF document that triggers a heap-based buffer overflow.  NOTE: some of these details are obtained from third party information.
",1.0,655.0,6.0,3.7241334915161133
177774,DoS Exec Code Overflow,"  YES, the given code is vulnerable to a DoS_Exec_Code_Overflow vulnerability. The CVE-ID is CVE-2009-3605. The CWE-ID is CWE-189.

The vulnerability arises from the use of the `ImageStream` class, which is used to read image data from a stream. The `ImageStream` class has a `getLine` method that reads a line of image data from the stream, but it does not perform any bounds checking on the line length. This means that if the image data is corrupted or malicious, it can cause the `getLine` method to read beyond the end of the line, leading to a buffer overflow and potentially executing arbitrary code.

The vulnerability can be exploited by sending a crafted PDF file with a malicious image that has a very large line length, causing the `getLine` method to read beyond the end of the line and execute arbitrary code. This can be done by sending a specially crafted PDF file that contains a malicious image with a very large line length, or by using a specially crafted image file that is used in the PDF file.

To fix the vulnerability, the `ImageStream` class should perform bounds checking on the line length before reading the line from the stream. This can be done by checking the line length against a maximum allowed length","The code contains a DoS_Exec_Code_Overflow vulnerability. 
The CVE-ID is CVE-2009-3605. The CWE-ID is CWE-189.
Vulnerability summary:
Multiple integer overflows in Poppler 0.10.5 and earlier allow remote attackers to cause a denial of service (application crash) or possibly execute arbitrary code via a crafted PDF file, related to (1) glib/poppler-page.cc; (2) ArthurOutputDev.cc, (3) CairoOutputDev.cc, (4) GfxState.cc, (5) JBIG2Stream.cc, (6) PSOutputDev.cc, and (7) SplashOutputDev.cc in poppler/; and (8) SplashBitmap.cc, (9) Splash.cc, and (10) SplashFTFont.cc in splash/.  NOTE: this may overlap CVE-2009-0791.
",4.0,971.0,6.0,4.129263162612915
177775,DoS Exec Code Overflow,"  NO, the given code is not vulnerable to a DoS_Exec_Code_Overflow vulnerability.

The code does not contain any integer overflows that could lead to a denial of service or arbitrary code execution. The integer overflows that were mentioned in the CVE-2009-3605 vulnerability report are related to the handling of PDF files, not the code snippet provided.

The code snippet provided is a function that draws an image and applies a transformation matrix to it. It does not contain any integer overflows that could lead to a denial of service or arbitrary code execution.

Therefore, the code is not vulnerable to a DoS_Exec_Code_Overflow vulnerability.","The code contains a DoS_Exec_Code_Overflow vulnerability. 
The CVE-ID is CVE-2009-3605. The CWE-ID is CWE-189.
Vulnerability summary:
Multiple integer overflows in Poppler 0.10.5 and earlier allow remote attackers to cause a denial of service (application crash) or possibly execute arbitrary code via a crafted PDF file, related to (1) glib/poppler-page.cc; (2) ArthurOutputDev.cc, (3) CairoOutputDev.cc, (4) GfxState.cc, (5) JBIG2Stream.cc, (6) PSOutputDev.cc, and (7) SplashOutputDev.cc in poppler/; and (8) SplashBitmap.cc, (9) Splash.cc, and (10) SplashFTFont.cc in splash/.  NOTE: this may overlap CVE-2009-0791.
",1.0,837.0,6.0,4.53050422668457
177777,DoS Exec Code Overflow,"  YES, the given code is vulnerable to a DoS_Exec_Code_Overflow vulnerability. The CVE-ID is CVE-2009-3605. The CWE-ID is CWE-189.

The vulnerability arises from the use of the `cairo_matrix_init_translate` function, which takes a `double` argument for the translation value. However, the value is not properly validated, and an attacker can provide a specially crafted value that causes a buffer overflow. This can lead to the execution of arbitrary code, including code that can cause a denial of service or other security vulnerabilities.

The vulnerability is caused by the fact that the `cairo_matrix_init_translate` function does not properly validate the `tx` and `ty` arguments, which are used to set the translation values. An attacker can provide a specially crafted value for these arguments that causes the `cairo_matrix_init_translate` function to write beyond the end of the allocated buffer, leading to a buffer overflow. This can be exploited to execute arbitrary code, including code that can cause a denial of service or other security vulnerabilities.

To fix this vulnerability, the `cairo_matrix_init_translate` function should properly validate the `tx` and `ty` arguments, and ensure that they are within the","The code contains a DoS_Exec_Code_Overflow vulnerability. 
The CVE-ID is CVE-2009-3605. The CWE-ID is CWE-189.
Vulnerability summary:
Multiple integer overflows in Poppler 0.10.5 and earlier allow remote attackers to cause a denial of service (application crash) or possibly execute arbitrary code via a crafted PDF file, related to (1) glib/poppler-page.cc; (2) ArthurOutputDev.cc, (3) CairoOutputDev.cc, (4) GfxState.cc, (5) JBIG2Stream.cc, (6) PSOutputDev.cc, and (7) SplashOutputDev.cc in poppler/; and (8) SplashBitmap.cc, (9) Splash.cc, and (10) SplashFTFont.cc in splash/.  NOTE: this may overlap CVE-2009-0791.
",4.0,957.0,6.0,6.494184732437134
177778,DoS Exec Code Overflow,"  YES, the given code is vulnerable to a DoS_Exec_Code_Overflow vulnerability. The CVE-ID is CVE-2009-3605. The CWE-ID is CWE-189.

The vulnerability arises from the use of the `cairo_mask` function, which takes a `cairo_pattern_t` as an argument. The `cairo_pattern_t` is created from a `cairo_surface_t` using the `cairo_pattern_create_for_surface` function. The `cairo_surface_t` is created from a `buffer` using the `cairo_image_surface_create_for_data` function.

The `cairo_image_surface_create_for_data` function takes a `buffer` as an argument, which is a pointer to a block of memory that contains the image data. The `buffer` is created using the `gmalloc` function, which allocates memory using the `malloc` function.

The `malloc` function allocates memory from the heap, which is a shared resource that can be accessed by multiple threads. If the `malloc` function is used in a way that causes a buffer overflow, it can lead to a DoS_Exec_Code_Overflow vulnerability.

For example, if the `","The code contains a DoS_Exec_Code_Overflow vulnerability. 
The CVE-ID is CVE-2009-3605. The CWE-ID is CWE-189.
Vulnerability summary:
Multiple integer overflows in Poppler 0.10.5 and earlier allow remote attackers to cause a denial of service (application crash) or possibly execute arbitrary code via a crafted PDF file, related to (1) glib/poppler-page.cc; (2) ArthurOutputDev.cc, (3) CairoOutputDev.cc, (4) GfxState.cc, (5) JBIG2Stream.cc, (6) PSOutputDev.cc, and (7) SplashOutputDev.cc in poppler/; and (8) SplashBitmap.cc, (9) Splash.cc, and (10) SplashFTFont.cc in splash/.  NOTE: this may overlap CVE-2009-0791.
",3.0,951.0,6.0,3.503054141998291
177779,DoS Exec Code Overflow,"  YES, the given code is vulnerable to a DoS_Exec_Code_Overflow vulnerability. The CVE-ID is CVE-2009-3605. The CWE-ID is CWE-189.

The vulnerability arises from the use of the `cairo_mask` function, which takes a pattern as an argument. The pattern is created from the `maskImage` surface, which is created from the `maskBuffer` buffer. The `maskBuffer` buffer is created by copying the `maskImgStr` stream into it, which can potentially lead to a buffer overflow if the stream is too large.

The vulnerability can be exploited by sending a crafted PDF file with a large mask image, which can cause the application to allocate a large amount of memory and eventually crash. This can be done by sending a PDF file with a large number of pages, each with a large mask image. The attacker can also use a specially crafted PDF file to cause a buffer overflow by sending a large amount of data to the `maskImgStr` stream.

To mitigate this vulnerability, the application should limit the size of the `maskBuffer` buffer and ensure that it is properly bounded. Additionally, the application should validate the input data to prevent buffer overflows.","The code contains a DoS_Exec_Code_Overflow vulnerability. 
The CVE-ID is CVE-2009-3605. The CWE-ID is CWE-189.
Vulnerability summary:
Multiple integer overflows in Poppler 0.10.5 and earlier allow remote attackers to cause a denial of service (application crash) or possibly execute arbitrary code via a crafted PDF file, related to (1) glib/poppler-page.cc; (2) ArthurOutputDev.cc, (3) CairoOutputDev.cc, (4) GfxState.cc, (5) JBIG2Stream.cc, (6) PSOutputDev.cc, and (7) SplashOutputDev.cc in poppler/; and (8) SplashBitmap.cc, (9) Splash.cc, and (10) SplashFTFont.cc in splash/.  NOTE: this may overlap CVE-2009-0791.
",4.0,953.0,6.0,2.965057373046875
177780,DoS Exec Code Overflow,"  YES, the given code is vulnerable to a DoS_Exec_Code_Overflow vulnerability. The CVE-ID is CVE-2009-3605. The CWE-ID is CWE-189.

The vulnerability arises from the use of integer overflows in the code. The function takes an integer input 'bitsA' and uses it to calculate the maximum value of a pixel (maxPixel) and the number of components in the color space (nComps). If the value of 'bitsA' is too large, it can cause an integer overflow, leading to a buffer overflow and potentially arbitrary code execution.

The vulnerability can be exploited by sending a crafted PDF file with a large value for 'bitsA', causing the function to overflow and execute arbitrary code. This can lead to a denial-of-service (DoS) vulnerability, as the application may crash or behave unexpectedly.

To fix the vulnerability, the code should ensure that the value of 'bitsA' is properly validated and sanitized before being used in the calculation of maxPixel and nComps. Additionally, the code should use safe and secure practices when handling user input, such as proper validation and sanitation of inputs, especially in functions like gets, scanf, or file and network input handling.","The code contains a DoS_Exec_Code_Overflow vulnerability. 
The CVE-ID is CVE-2009-3605. The CWE-ID is CWE-189.
Vulnerability summary:
Multiple integer overflows in Poppler 0.10.5 and earlier allow remote attackers to cause a denial of service (application crash) or possibly execute arbitrary code via a crafted PDF file, related to (1) glib/poppler-page.cc; (2) ArthurOutputDev.cc, (3) CairoOutputDev.cc, (4) GfxState.cc, (5) JBIG2Stream.cc, (6) PSOutputDev.cc, and (7) SplashOutputDev.cc in poppler/; and (8) SplashBitmap.cc, (9) Splash.cc, and (10) SplashFTFont.cc in splash/.  NOTE: this may overlap CVE-2009-0791.
",3.0,955.0,6.0,3.4760680198669434
177781,DoS Exec Code Overflow,"  NO, the given code is not vulnerable to a DoS Exec Code Overflow.

The code is using a switch statement to handle different cases, and each case is handling a specific type of input. The code is also using a temporary buffer to store the results of the calculations, which helps to prevent buffer overflows.

Therefore, the code is not vulnerable to a DoS Exec Code Overflow.","The code contains a DoS_Exec_Code_Overflow vulnerability. 
The CVE-ID is CVE-2009-3605. The CWE-ID is CWE-189.
Vulnerability summary:
Multiple integer overflows in Poppler 0.10.5 and earlier allow remote attackers to cause a denial of service (application crash) or possibly execute arbitrary code via a crafted PDF file, related to (1) glib/poppler-page.cc; (2) ArthurOutputDev.cc, (3) CairoOutputDev.cc, (4) GfxState.cc, (5) JBIG2Stream.cc, (6) PSOutputDev.cc, and (7) SplashOutputDev.cc in poppler/; and (8) SplashBitmap.cc, (9) Splash.cc, and (10) SplashFTFont.cc in splash/.  NOTE: this may overlap CVE-2009-0791.
",1.0,782.0,6.0,3.1767284870147705
177783,DoS Exec Code Overflow,"  NO, the given code is not vulnerable to a DoS Exec Code Overflow.

The code is using a switch statement to handle different cases, and each case is handling a specific type of input. The code is also using a temporary buffer to store the results of the calculations, which helps to prevent buffer overflows.

Therefore, the code is not vulnerable to a DoS Exec Code Overflow.","The code contains a DoS_Exec_Code_Overflow vulnerability. 
The CVE-ID is CVE-2009-3605. The CWE-ID is CWE-189.
Vulnerability summary:
Multiple integer overflows in Poppler 0.10.5 and earlier allow remote attackers to cause a denial of service (application crash) or possibly execute arbitrary code via a crafted PDF file, related to (1) glib/poppler-page.cc; (2) ArthurOutputDev.cc, (3) CairoOutputDev.cc, (4) GfxState.cc, (5) JBIG2Stream.cc, (6) PSOutputDev.cc, and (7) SplashOutputDev.cc in poppler/; and (8) SplashBitmap.cc, (9) Splash.cc, and (10) SplashFTFont.cc in splash/.  NOTE: this may overlap CVE-2009-0791.
",1.0,782.0,6.0,2.5037267208099365
