case_id,vuln_type,audit_report,gt,eval_score,eval_input_token_num,eval_output_token_num,eval_inference_time
177823,Exec Code Overflow,"  NO, the given code is not vulnerable to Exec Code Overflow.

The code is a function that reads data from a buffer and decompresses it using the LZW algorithm. It does not contain any code that could potentially lead to an overflow.

The function uses a loop to read data from the buffer and decompress it. It also uses a stack to store the decompressed data. The stack is used to store the decompressed data in reverse order, and the function uses a variable to keep track of the current position in the stack.

The function also uses a variable to keep track of the previous code, and it uses a loop to generate the output characters in reverse order. The function also uses a variable to keep track of the current code, and it uses a loop to generate the new entry.

The function does not contain any code that could potentially lead to an overflow. The only potential issue with the code is that it does not properly handle the case where the decompressed data is longer than the buffer size. However, this is not a vulnerability, but rather a potential issue that could cause the function to fail.","The code contains a Exec_Code_Overflow vulnerability. 
The CVE-ID is CVE-2011-2895. The CWE-ID is CWE-119.
Vulnerability summary:
The LZW decompressor in (1) the BufCompressedFill function in fontfile/decompress.c in X.Org libXfont before 1.4.4 and (2) compress/compress.c in 4.3BSD, as used in zopen.c in OpenBSD before 3.8, FreeBSD, NetBSD 4.0.x and 5.0.x before 5.0.3 and 5.1.x before 5.1.1, FreeType 2.1.9, and other products, does not properly handle code words that are absent from the decompression table when encountered, which allows context-dependent attackers to trigger an infinite loop or a heap-based buffer overflow, and possibly execute arbitrary code, via a crafted compressed stream, a related issue to CVE-2006-1168 and CVE-2011-2896.
",1.0,960.0,6.0,4.954378604888916
177825,DoS,"  NO, the given code is not vulnerable to a DoS vulnerability.

The code does not contain any format string vulnerabilities, as it does not use any format strings in the `snprintf` function. The `snprintf` function is used to create a new string based on a format string and a set of arguments, but the format string is not user-supplied and is hardcoded in the code. Therefore, there is no risk of a format string vulnerability.

Furthermore, the code does not contain any other vulnerabilities that could be exploited by a malicious user. The code is well-structured and follows best practices for C++ programming.

Therefore, the code is not vulnerable to a DoS vulnerability.","The code contains a DoS vulnerability. 
The CVE-ID is CVE-2013-4474. The CWE-ID is CWE-20.
Vulnerability summary:
Format string vulnerability in the extractPages function in utils/pdfseparate.cc in poppler before 0.24.3 allows remote attackers to cause a denial of service (crash) via format string specifiers in a destination filename.
",1.0,742.0,6.0,3.3428406715393066
177826,DoS Exec Code Overflow,"  NO. The code is not vulnerable to a DoS_Exec_Code_Overflow vulnerability. The vulnerability is caused by the use of the `sprintf` function, which can be exploited to write to the stack and execute arbitrary code. However, the code does not use `sprintf` in a way that would lead to a stack-based buffer overflow.","The code contains a DoS_Exec_Code_Overflow vulnerability. 
The CVE-ID is CVE-2013-4473. The CWE-ID is CWE-119.
Vulnerability summary:
Stack-based buffer overflow in the extractPages function in utils/pdfseparate.cc in poppler before 0.24.2 allows remote attackers to cause a denial of service (crash) and possibly execute arbitrary code via a source filename.
",2.0,676.0,6.0,3.2028255462646484
177827,,"  NO, the given code is not vulnerable to a nan vulnerability. The code is a function that retrieves the access control list (ACL) for a file or directory, and it does not contain any operations that could lead to a nan vulnerability. The function uses the `jffs2_iget_acl` function to retrieve the ACL from the inode, and it also uses the `jffs2_acl_from_medium` function to convert the ACL from a medium format to a POSIX ACL. The function does not contain any operations that could lead to a nan vulnerability.","The code contains a nan vulnerability. 
The CVE-ID is CVE-2007-4849. The CWE-ID is CWE-264.
Vulnerability summary:
JFFS2, as used on One Laptop Per Child (OLPC) build 542 and possibly other Linux systems, when POSIX ACL support is enabled, does not properly store permissions during (1) inode creation or (2) ACL setting, which might allow local users to access restricted files or directories after a remount of a filesystem, related to ""legacy modes"" and an inconsistency between dentry permissions and inode permissions.
",1.0,753.0,6.0,3.856276035308838
177831,,"  NO, the given code is not vulnerable to a nan vulnerability. The code is a function that takes in a context, a filter processor, a tag record, and a unicode character, and performs some operations on the tag record. It does not appear to have any direct interaction with the outside world, and does not seem to be vulnerable to a nan vulnerability.","The code contains a nan vulnerability. 
The CVE-ID is CVE-2019-14975. The CWE-ID is CWE-125.
Vulnerability summary:
Artifex MuPDF before 1.16.0 has a heap-based buffer over-read in fz_chartorune in fitz/string.c because pdf/pdf-op-filter.c does not check for a missing string.
",1.0,669.0,6.0,3.8512871265411377
177832,,  NO. The code is not vulnerable to a nan vulnerability.,"The code contains a nan vulnerability. 
The CVE-ID is CVE-2019-14975. The CWE-ID is CWE-125.
Vulnerability summary:
Artifex MuPDF before 1.16.0 has a heap-based buffer over-read in fz_chartorune in fitz/string.c because pdf/pdf-op-filter.c does not check for a missing string.
",1.0,609.0,6.0,3.429799795150757
177833,DoS Overflow,  NO. The code is not vulnerable to a DoS_Overflow vulnerability. The function reds_handle_ticket is not vulnerable to a buffer overflow attack because it does not use any buffer overflow vulnerabilities.,"The code contains a DoS_Overflow vulnerability. 
The CVE-ID is CVE-2013-4282. The CWE-ID is CWE-119.
Vulnerability summary:
Stack-based buffer overflow in the reds_handle_ticket function in server/reds.c in SPICE 0.12.0 allows remote attackers to cause a denial of service (crash) via a long password in a SPICE ticket.
",1.0,641.0,6.0,3.689114570617676
177839,+Info,"  NO, the given code is not vulnerable to any security vulnerabilities.

The code is a function that takes in a string and a charset, and returns the next codepoint in the string. It uses the smb_iconv_handle to convert the string to UTF16 format, and then reads the first 4 bytes of the converted string to determine the codepoint.

The code does not appear to have any vulnerabilities related to buffer overflow, use after free, memory leaks, integer overflow/underflow, null pointer dereference, improper input validation, race conditions, insecure function usage, insecure resource management, or improper error handling.

However, the code does have a potential vulnerability related to cryptographic issues. The code uses the smb_iconv_handle to convert the string to UTF16 format, which could potentially be vulnerable to cryptographic issues if the conversion is not done correctly.

Additionally, the code does not appear to have any vulnerabilities related to sensitive data exposure, as it does not appear to be handling any sensitive data.

Overall, the code does not appear to have any security vulnerabilities.","The code contains a +Info vulnerability. 
The CVE-ID is CVE-2015-5330. The CWE-ID is CWE-200.
Vulnerability summary:
ldb before 1.1.24, as used in the AD LDAP server in Samba 4.x before 4.1.22, 4.2.x before 4.2.7, and 4.3.x before 4.3.3, mishandles string lengths, which allows remote attackers to obtain sensitive information from daemon heap memory by sending crafted packets and then reading (1) an error message or (2) a database value.
",1.0,863.0,6.0,2.7996418476104736
177840,+Info,"  NO, the given code is not vulnerable to any security vulnerabilities.

The code is a simple function that takes a string as input and escapes certain characters. It does not perform any sensitive operations or handle user input in a way that could lead to vulnerabilities. The only potential issue I can see is that the function does not check for buffer overflows, but this is not a security vulnerability.

Therefore, I would say that the code is not vulnerable to any security vulnerabilities.","The code contains a +Info vulnerability. 
The CVE-ID is CVE-2015-5330. The CWE-ID is CWE-200.
Vulnerability summary:
ldb before 1.1.24, as used in the AD LDAP server in Samba 4.x before 4.1.22, 4.2.x before 4.2.7, and 4.3.x before 4.3.3, mishandles string lengths, which allows remote attackers to obtain sensitive information from daemon heap memory by sending crafted packets and then reading (1) an error message or (2) a database value.
",1.0,742.0,6.0,4.15466833114624
177841,+Info,"  NO. The code is not vulnerable to any of the vulnerabilities you mentioned.

The code is using the `talloc_array` function to allocate memory for the destination string, and it is properly checking the return value of `talloc_array` to ensure that the allocation was successful. It is also properly initializing the `size` variable to 0 before starting the loop, and it is properly updating the `size` variable with the length of the destination string after the loop.

The code is also properly checking the return value of `talloc_realloc` to ensure that the reallocation was successful.

Therefore, the code is not vulnerable to any of the vulnerabilities you mentioned.","The code contains a +Info vulnerability. 
The CVE-ID is CVE-2015-5330. The CWE-ID is CWE-200.
Vulnerability summary:
ldb before 1.1.24, as used in the AD LDAP server in Samba 4.x before 4.1.22, 4.2.x before 4.2.7, and 4.3.x before 4.3.3, mishandles string lengths, which allows remote attackers to obtain sensitive information from daemon heap memory by sending crafted packets and then reading (1) an error message or (2) a database value.
",1.0,784.0,6.0,4.103569746017456
177842,+Info,"  NO, the given code is not vulnerable to any security vulnerabilities.

The code is a function that takes in a string and a charset, and returns the next codepoint in the string. It uses a series of if statements to determine the next codepoint, and it does not appear to have any vulnerabilities.

The function does not use any user input, and it does not perform any operations that could lead to a buffer overflow or other security vulnerability. It simply takes in a string and a charset, and returns the next codepoint in the string.

Therefore, I would say that the code is not vulnerable to any security vulnerabilities.","The code contains a +Info vulnerability. 
The CVE-ID is CVE-2015-5330. The CWE-ID is CWE-200.
Vulnerability summary:
ldb before 1.1.24, as used in the AD LDAP server in Samba 4.x before 4.1.22, 4.2.x before 4.2.7, and 4.3.x before 4.3.3, mishandles string lengths, which allows remote attackers to obtain sensitive information from daemon heap memory by sending crafted packets and then reading (1) an error message or (2) a database value.
",1.0,774.0,6.0,3.780590772628784
177843,+Info,"  NO, the given code is not vulnerable to any security vulnerabilities.

The code is a function that takes in a string and returns its length. It uses a series of if statements to check if the string is null, and if it is not null, it checks if the first character is a null byte. If it is not a null byte, it increments the count and moves on to the next character.

There is no buffer overflow, use after free, memory leak, integer overflow/underflow, null pointer dereference, improper input validation, race condition, insecure function usage, insecure resource management, or improper error handling in the code.

Therefore, the code is not vulnerable to any security vulnerabilities.","The code contains a +Info vulnerability. 
The CVE-ID is CVE-2015-5330. The CWE-ID is CWE-200.
Vulnerability summary:
ldb before 1.1.24, as used in the AD LDAP server in Samba 4.x before 4.1.22, 4.2.x before 4.2.7, and 4.3.x before 4.3.3, mishandles string lengths, which allows remote attackers to obtain sensitive information from daemon heap memory by sending crafted packets and then reading (1) an error message or (2) a database value.
",1.0,789.0,6.0,3.263873815536499
177844,+Info,"  NO, the given code is not vulnerable to any security vulnerabilities.

The code is using the `talloc_array` function to allocate memory for the destination string, and it is properly checking the return value of `talloc_array` to ensure that the allocation was successful. It is also properly initializing the `size` variable to 0 before starting the loop, and it is properly updating the `size` variable with the length of the destination string after the loop.

Therefore, the code does not contain any buffer overflow vulnerabilities, use after free vulnerabilities, memory leaks, integer overflow/underflow vulnerabilities, null pointer dereferences, improper input validation, race conditions, insecure function usage, insecure resource management, improper error handling, cryptographic issues, or sensitive data exposure.","The code contains a +Info vulnerability. 
The CVE-ID is CVE-2015-5330. The CWE-ID is CWE-200.
Vulnerability summary:
ldb before 1.1.24, as used in the AD LDAP server in Samba 4.x before 4.1.22, 4.2.x before 4.2.7, and 4.3.x before 4.3.3, mishandles string lengths, which allows remote attackers to obtain sensitive information from daemon heap memory by sending crafted packets and then reading (1) an error message or (2) a database value.
",1.0,802.0,6.0,4.433329343795776
177848,,"  NO, the given code is not vulnerable to a nan vulnerability. The code is not using any floating-point operations, and it does not appear to be related to the nan vulnerability.","The code contains a nan vulnerability. 
The CVE-ID is CVE-2015-5296. The CWE-ID is CWE-20.
Vulnerability summary:
Samba 3.x and 4.x before 4.1.22, 4.2.x before 4.2.7, and 4.3.x before 4.3.3 supports connections that are encrypted but unsigned, which allows man-in-the-middle attackers to conduct encrypted-to-unencrypted downgrade attacks by modifying the client-server data stream, related to clidfs.c, libsmb_server.c, and smbXcli_base.c.
",1.0,682.0,6.0,4.10904335975647
177850,DoS Overflow,"  YES, the given code is vulnerable to a DoS_Overflow vulnerability. The CVE-ID is CVE-2015-5289. The CWE-ID is CWE-119.

The vulnerability arises from the fact that the code does not properly handle the case where the input array has more than 4 elements. In such cases, the code will attempt to access elements beyond the end of the array, leading to a buffer overflow. This can cause the server to crash or behave unexpectedly, leading to a denial of service.

The vulnerability can be exploited by sending an array with more than 4 elements as input to the function. The attacker can craft the input array to cause the code to access memory beyond the end of the array, leading to a buffer overflow.

To fix the vulnerability, the code should be modified to properly handle the case where the input array has more than 4 elements. This can be done by adding a check to ensure that the input array has at most 4 elements, and by modifying the code to access only the first 4 elements of the array.","The code contains a DoS_Overflow vulnerability. 
The CVE-ID is CVE-2015-5289. The CWE-ID is CWE-119.
Vulnerability summary:
Multiple stack-based buffer overflows in json parsing in PostgreSQL before 9.3.x before 9.3.10 and 9.4.x before 9.4.5 allow attackers to cause a denial of service (server crash) via unspecified vectors, which are not properly handled in (1) json or (2) jsonb values.
",3.0,845.0,6.0,3.614048719406128
177851,DoS Overflow,"  NO, the given code is not vulnerable to a DoS_Overflow vulnerability.

The code does not contain any buffer overflow vulnerabilities, as it does not involve any user-supplied input or unchecked arithmetic operations. The only potential vulnerability is a potential integer overflow in the `guessMajority` function, which could lead to incorrect results if the input array is very large. However, this is not a DoS_Overflow vulnerability, as it does not involve any unchecked input or unchecked arithmetic operations.","The code contains a DoS_Overflow vulnerability. 
The CVE-ID is CVE-2015-5289. The CWE-ID is CWE-119.
Vulnerability summary:
Multiple stack-based buffer overflows in json parsing in PostgreSQL before 9.3.x before 9.3.10 and 9.4.x before 9.4.5 allow attackers to cause a denial of service (server crash) via unspecified vectors, which are not properly handled in (1) json or (2) jsonb values.
",1.0,727.0,6.0,2.676658868789673
177852,DoS Overflow,"  NO, the given code is not vulnerable to a DoS_Overflow vulnerability.

The code does not contain any buffer overflow vulnerabilities, as it does not involve any string or memory functions that could lead to buffer overflows. Additionally, the code does not contain any use-after-free errors, as it does not involve any pointers that are used after they have been deallocated.

The code also does not contain any memory leaks, as it does not involve any dynamic memory management that could lead to memory leaks.

The code does not contain any integer overflow or underflow vulnerabilities, as it does not involve any arithmetic operations that could lead to integer overflows or underflows.

The code does not contain any null pointer dereference vulnerabilities, as it does not involve any null pointer dereferences.

The code does not contain any improper input validation vulnerabilities, as it does not involve any user input that could lead to buffer overflows or other vulnerabilities.

The code does not contain any race conditions, as it does not involve any multi-threaded code that could lead to race conditions.

The code does not contain any insecure function usage vulnerabilities, as it does not involve any insecure or deprecated functions.

The code does not contain any improper error handling vulnerabilities, as it does not involve any errors that could lead to unpredictable behavior or crashes.

","The code contains a DoS_Overflow vulnerability. 
The CVE-ID is CVE-2015-5289. The CWE-ID is CWE-119.
Vulnerability summary:
Multiple stack-based buffer overflows in json parsing in PostgreSQL before 9.3.x before 9.3.10 and 9.4.x before 9.4.5 allow attackers to cause a denial of service (server crash) via unspecified vectors, which are not properly handled in (1) json or (2) jsonb values.
",1.0,888.0,6.0,3.9306328296661377
177853,DoS Overflow,"  NO, the given code is not vulnerable to a DoS_Overflow vulnerability.

The code does not contain any buffer overflow vulnerabilities, as it does not involve any user-supplied input or unchecked arithmetic operations. The only potential vulnerability is the use of the `elog` function, which could potentially lead to a denial-of-service (DoS) attack if the error message is not properly sanitized. However, this is not a buffer overflow vulnerability.","The code contains a DoS_Overflow vulnerability. 
The CVE-ID is CVE-2015-5289. The CWE-ID is CWE-119.
Vulnerability summary:
Multiple stack-based buffer overflows in json parsing in PostgreSQL before 9.3.x before 9.3.10 and 9.4.x before 9.4.5 allow attackers to cause a denial of service (server crash) via unspecified vectors, which are not properly handled in (1) json or (2) jsonb values.
",2.0,717.0,6.0,2.746135711669922
177855,Bypass,"  YES, the given code is vulnerable to a Bypass vulnerability. The CVE-ID is CVE-2015-5252. The CWE-ID is CWE-264.

Vulnerability summary:
vfs.c in smbd in Samba 3.x and 4.x before 4.1.22, 4.2.x before 4.2.7, and 4.3.x before 4.3.3, when share names with certain substring relationships exist, allows remote attackers to bypass intended file-access restrictions via a symlink that points outside of a share.

The vulnerability is caused by the code's reliance on the `SMB_VFS_REALPATH` function, which can return a path that is not within the share. The code then checks the `st` field of the `smb_fname_cwd` structure, which is not properly initialized. This allows an attacker to create a symlink that points outside of the share, bypassing the intended file-access restrictions.","The code contains a Bypass vulnerability. 
The CVE-ID is CVE-2015-5252. The CWE-ID is CWE-264.
Vulnerability summary:
vfs.c in smbd in Samba 3.x and 4.x before 4.1.22, 4.2.x before 4.2.7, and 4.3.x before 4.3.3, when share names with certain substring relationships exist, allows remote attackers to bypass intended file-access restrictions via a symlink that points outside of a share.
",4.0,834.0,6.0,3.4466981887817383
177856,,"  YES, the code is vulnerable to a buffer overflow attack. The function `guessMajority` has a buffer overflow vulnerability because it uses the `ArrayReader` class to read values from an array, but it does not perform any bounds checking on the array indices. This means that if the array indices are out of bounds, the function will write to memory outside of the array, potentially causing a buffer overflow.","The code contains a nan vulnerability. 
The CVE-ID is CVE-2019-13638. The CWE-ID is CWE-78.
Vulnerability summary:
GNU patch through 2.7.6 is vulnerable to OS shell command injection that can be exploited by opening a crafted patch file that contains an ed style diff payload with shell metacharacters. The ed editor does not need to be present on the vulnerable system. This is different from CVE-2018-1000156.
",2.0,702.0,6.0,3.5316720008850098
177857,,  NO. The code is not vulnerable to a nan vulnerability.,"The code contains a nan vulnerability. 
The CVE-ID is CVE-2019-13636. The CWE-ID is CWE-59.
Vulnerability summary:
In GNU patch through 2.7.6, the following of symlinks is mishandled in certain cases other than input files. This affects inp.c and util.c.
",1.0,602.0,6.0,3.2363009452819824
177859,Exec Code Bypass,"  NO, the given code is not vulnerable to Exec Code Bypass.

The code is a function that takes a pointer to a gs_gstate object as an argument and returns an integer. It appears to be a part of the ghostscript library, which is used for rendering PostScript documents.

The function first checks if the device pointer is null or not, and if it is not null, it copies the null device to a new device pointer and then sets the new device pointer as the current device. It then sets the device's profile to the default profile and increments the reference count of the profile.

The function then calls the gs_setdevice_no_erase function, which sets the current device to the new device pointer. If the call to gs_setdevice_no_erase fails, it frees the new device pointer and returns an error code.

The function then returns the error code or 0, depending on the outcome of the call to gs_setdevice_no_erase.

There is no evidence of any vulnerability in the code, as it appears to be a legitimate function that sets the current device to the null device and sets the device's profile to the default profile.","The code contains a Exec_Code_Bypass vulnerability. 
The CVE-ID is CVE-2018-16863. The CWE-ID is CWE-78.
Vulnerability summary:
It was found that RHSA-2018:2918 did not fully fix CVE-2018-16509. An attacker could possibly exploit another variant of the flaw and bypass the -dSAFER protection to, for example, execute arbitrary shell commands via a specially crafted PostScript document. This only affects ghostscript 9.07 as shipped with Red Hat Enterprise Linux 7.
",1.0,868.0,6.0,3.385723352432251
177860,Exec Code Bypass,"  NO, the given code is not vulnerable to Exec Code Bypass.

The code checks the contents of the stacks and ensures that the new save level is zero. It also resets l_new in all stack entries if the new save level is zero.

There is no evidence of an Exec Code Bypass vulnerability in the code.","The code contains a Exec_Code_Bypass vulnerability. 
The CVE-ID is CVE-2018-16863. The CWE-ID is CWE-78.
Vulnerability summary:
It was found that RHSA-2018:2918 did not fully fix CVE-2018-16509. An attacker could possibly exploit another variant of the flaw and bypass the -dSAFER protection to, for example, execute arbitrary shell commands via a specially crafted PostScript document. This only affects ghostscript 9.07 as shipped with Red Hat Enterprise Linux 7.
",1.0,699.0,6.0,3.8222177028656006
177862,Exec Code,"  NO, the given code is not vulnerable to Exec Code.

The code is a function that takes two gs_gstate pointers as input and returns a boolean value indicating whether the two gs_gstate objects are using the same page device. The function uses the obj_eq function to compare the pagedevice dictionaries of the two gs_gstate objects.

The obj_eq function is a safe function that checks whether two objects are equal by comparing their contents. It does not execute any code, and it does not have any known vulnerabilities.

Therefore, the given code is not vulnerable to Exec Code.","The code contains a Exec_Code vulnerability. 
The CVE-ID is CVE-2018-16802. The CWE-ID is nan.
Vulnerability summary:
An issue was discovered in Artifex Ghostscript before 9.25. Incorrect ""restoration of privilege"" checking when running out of stack during exception handling could be used by attackers able to supply crafted PostScript to execute code using the ""pipe"" instruction. This is due to an incomplete fix for CVE-2018-16509.
",1.0,738.0,6.0,3.212864637374878
