case_id,vuln_type,audit_report,gt,eval_score,eval_input_token_num,eval_output_token_num,eval_inference_time
177736,Bypass,"  NO, the code is not vulnerable. The function is not directly related to the vulnerability.","The code contains a Bypass vulnerability. 
The CVE-ID is CVE-2015-8467. The CWE-ID is CWE-264.
Vulnerability summary:
The samldb_check_user_account_control_acl function in dsdb/samdb/ldb_modules/samldb.c in Samba 4.x before 4.1.22, 4.2.x before 4.2.7, and 4.3.x before 4.3.3 does not properly check for administrative privileges during creation of machine accounts, which allows remote authenticated users to bypass intended access restrictions by leveraging the existence of a domain with both a Samba DC and a Windows DC, a similar issue to CVE-2015-2535.
",1.0,686.0,6.0,7.620229959487915
177740,DoS Exec Code Overflow Mem. Corr.,"  NO, the given code is not vulnerable to any security vulnerabilities.

The code is a function that takes an ASN1_UTCTIME pointer as an argument and returns a time_t value. It appears to be parsing the time string in the ASN1_UTCTIME object and converting it to a time_t value.

The code does not appear to have any obvious security vulnerabilities, such as buffer overflows, use-after-free errors, memory leaks, integer overflow/underflow, null pointer dereferences, improper input validation, race conditions, insecure function usage, insecure resource management, or improper error handling.

However, it is possible that the code could be vulnerable to other types of security vulnerabilities, such as cryptographic issues or sensitive data exposure, if the code is not properly validated or sanitized.","The code contains a DoS_Exec_Code_Overflow_Mem._Corr. vulnerability. 
The CVE-ID is CVE-2013-6420. The CWE-ID is CWE-119.
Vulnerability summary:
The asn1_time_to_time_t function in ext/openssl/openssl.c in PHP before 5.3.28, 5.4.x before 5.4.23, and 5.5.x before 5.5.7 does not properly parse (1) notBefore and (2) notAfter timestamps in X.509 certificates, which allows remote attackers to execute arbitrary code or cause a denial of service (memory corruption) via a crafted certificate that is not properly handled by the openssl_x509_parse function.
",1.0,833.0,6.0,4.21555495262146
177741,DoS Overflow,"  NO, the given code is not vulnerable to a DoS Overflow.

The code checks the size of the buffer before copying the data into it, and it also checks if the buffer is large enough to hold the data. Additionally, it uses the `memcpy` function to copy the data, which ensures that the data is copied correctly and safely.

Therefore, the code does not contain any vulnerabilities related to buffer overflows or other security issues.","The code contains a DoS_Overflow vulnerability. 
The CVE-ID is CVE-2011-4128. The CWE-ID is CWE-119.
Vulnerability summary:
Buffer overflow in the gnutls_session_get_data function in lib/gnutls_session.c in GnuTLS 2.12.x before 2.12.14 and 3.x before 3.0.7, when used on a client that performs nonstandard session resumption, allows remote TLS servers to cause a denial of service (application crash) via a large SessionTicket.
",1.0,725.0,6.0,4.820912599563599
177742,DoS Overflow,"  NO, the given code is not vulnerable to a DoS Overflow.

The code checks the size of the buffer before copying the data into it, and it also checks if the buffer is large enough to hold the data. Additionally, it uses the `memcpy` function to copy the data, which ensures that the data is copied correctly and safely.

Therefore, the code does not contain any vulnerabilities related to buffer overflows or other security issues.","The code contains a DoS_Overflow vulnerability. 
The CVE-ID is CVE-2011-4128. The CWE-ID is CWE-119.
Vulnerability summary:
Buffer overflow in the gnutls_session_get_data function in lib/gnutls_session.c in GnuTLS 2.12.x before 2.12.14 and 3.x before 3.0.7, when used on a client that performs nonstandard session resumption, allows remote TLS servers to cause a denial of service (application crash) via a large SessionTicket.
",1.0,725.0,6.0,3.202133893966675
177743,DoS,"  NO, the code is not vulnerable to a DoS attack.

The code checks if the length of the string is less than or equal to the length of the directory, and if the first characters of the string match the directory, it continues to the next character. If the string is longer than the directory, it checks if the next character in the string matches the directory, and if it does, it continues to the next character. If the string is shorter than the directory, it checks if the next character in the string matches the directory, and if it does, it continues to the next character.

The code does not have any off-by-one errors, and it does not have any other vulnerabilities that could cause a DoS attack.","The code contains a DoS vulnerability. 
The CVE-ID is CVE-2015-7804. The CWE-ID is CWE-189.
Vulnerability summary:
Off-by-one error in the phar_parse_zipfile function in ext/phar/zip.c in PHP before 5.5.30 and 5.6.x before 5.6.14 allows remote attackers to cause a denial of service (uninitialized pointer dereference and application crash) by including the / filename in a .zip PHAR archive.
",1.0,775.0,6.0,5.240687608718872
177747,DoS,"  NO, the given code is not vulnerable to a DoS attack.

The code checks if the received attribute is a well-known attribute or not, and if it is not, it returns BGP_ATTR_PARSE_PROCEED. This means that the code does not process the attribute further, and it does not affect the behavior of the program.

Therefore, the code does not contain a DoS vulnerability.","The code contains a DoS vulnerability. 
The CVE-ID is CVE-2013-6051. The CWE-ID is nan.
Vulnerability summary:
The bgp_attr_unknown function in bgp_attr.c in Quagga 0.99.21 does not properly initialize the total variable, which allows remote attackers to cause a denial of service (bgpd crash) via a crafted BGP update.
",1.0,682.0,6.0,4.25268292427063
177750,DoS Exec Code,"  YES, the given code is vulnerable to a DoS_Exec_Code vulnerability. The CVE-ID is CVE-2018-1000039. The CWE-ID is CWE-416.

The vulnerability arises from the use of the `pdf_xobject_bbox` function, which can cause a buffer overflow if the input `pdf_xobject` is maliciously crafted. The `pdf_xobject_bbox` function is used to retrieve the bounding box of a PDF object, and it uses the `pdf_xobject_matrix` function to retrieve the matrix of the object. The `pdf_xobject_matrix` function can also cause a buffer overflow if the input `pdf_xobject` is maliciously crafted.

The vulnerability can be exploited by sending a maliciously crafted PDF file to the `begin_softmask` function, which can cause the function to read and execute arbitrary code, leading to a denial of service.

To fix the vulnerability, the `pdf_xobject_bbox` and `pdf_xobject_matrix` functions should be updated to properly validate the input `pdf_xobject` before using it to retrieve the bounding box or matrix. Additionally, the `pdf_xobject` should be properly sanitized before being used in any","The code contains a DoS_Exec_Code vulnerability. 
The CVE-ID is CVE-2018-1000039. The CWE-ID is CWE-416.
Vulnerability summary:
In MuPDF 1.12.0 and earlier, multiple heap use after free bugs in the PDF parser could allow an attacker to execute arbitrary code, read memory, or cause a denial of service via a crafted file.
",4.0,846.0,6.0,7.130257844924927
177766,DoS,"  NO, the given code is not vulnerable to a DoS attack.

The code checks the return values of the ASN.1 memory allocation functions to ensure successful allocation. It also checks the return values of the ASN.1 write functions to ensure that the data is written correctly.

Therefore, the code does not have a DoS vulnerability.","The code contains a DoS vulnerability. 
The CVE-ID is CVE-2015-7540. The CWE-ID is CWE-399.
Vulnerability summary:
The LDAP server in the AD domain controller in Samba 4.x before 4.1.22 does not check return values to ensure successful ASN.1 memory allocation, which allows remote attackers to cause a denial of service (memory consumption and daemon crash) via crafted packets.
",1.0,676.0,6.0,2.796628952026367
177767,DoS,"  NO, the given code is not vulnerable to a DoS attack.

The code is using the `talloc` library to allocate memory for the `control` and `r` variables. The `talloc` library is designed to handle memory allocation and deallocation safely, and it is not vulnerable to a DoS attack.

Furthermore, the code is using the `asn1_load` function to load the ASN.1 data into the `data` variable. The `asn1_load` function is designed to handle ASN.1 data safely, and it is not vulnerable to a DoS attack.

Therefore, the code is not vulnerable to a DoS attack.","The code contains a DoS vulnerability. 
The CVE-ID is CVE-2015-7540. The CWE-ID is CWE-399.
Vulnerability summary:
The LDAP server in the AD domain controller in Samba 4.x before 4.1.22 does not check return values to ensure successful ASN.1 memory allocation, which allows remote attackers to cause a denial of service (memory consumption and daemon crash) via crafted packets.
",1.0,743.0,6.0,3.87544584274292
177768,DoS,"  NO, the code is not vulnerable to a DoS attack.

The code is using the `lseek_or_error` function to seek to the offset specified in the `sparse_map` array, and then reading the data from the file. The `lseek_or_error` function is used to handle errors that may occur during the seek operation, but it does not handle errors that may occur during the read operation.

Therefore, if the `lseek_or_error` function fails, the code will continue to read from the file, potentially causing a buffer overflow or other security vulnerability.

To fix this vulnerability, the code should use the `lseek_or_error` function to seek to the offset specified in the `sparse_map` array, and then use the `safe_read` function to read the data from the file. The `safe_read` function should be used to handle errors that may occur during the read operation.","The code contains a DoS vulnerability. 
The CVE-ID is CVE-2018-20482. The CWE-ID is CWE-835.
Vulnerability summary:
GNU Tar through 1.30, when --sparse is used, mishandles file shrinkage during read access, which allows local users to cause a denial of service (infinite read loop in sparse_dump_region in sparse.c) by modifying a file that is supposed to be archived by a different user's process (e.g., a system backup running as root).
",2.0,814.0,6.0,5.180783033370972
177770,Bypass,"  NO, the given code is not vulnerable to a bypass vulnerability.

The code checks for the presence of the ""xname follows"" string and reads the corresponding file name if it is present. It then checks if the file name is a regular file or not. If it is not a regular file, it exits with an error message.

Therefore, the code does not allow the attacker to bypass intended access restrictions by sending a malicious file name. The vulnerability you mentioned is related to a different issue, which is related to the use of the ""xname follows"" string in the protocol.","The code contains a Bypass vulnerability. 
The CVE-ID is CVE-2017-17434. The CWE-ID is nan.
Vulnerability summary:
The daemon in rsync 3.1.2, and 3.1.3-development before 2017-12-03, does not check for fnamecmp filenames in the daemon_filter_list data structure (in the recv_files function in receiver.c) and also does not apply the sanitize_paths protection mechanism to pathnames found in ""xname follows"" strings (in the read_ndx_and_attrs function in rsync.c), which allows remote attackers to bypass intended access restrictions.
",1.0,767.0,6.0,5.620647430419922
177771,,"  NO, the given code is not vulnerable to a nan vulnerability. The code is a function that reads a DNS name from a buffer and returns the number of bytes read. It does not contain any operations that could lead to a nan vulnerability.","The code contains a nan vulnerability. 
The CVE-ID is CVE-2018-20103. The CWE-ID is CWE-835.
Vulnerability summary:
An issue was discovered in dns.c in HAProxy through 1.8.14. In the case of a compressed pointer, a crafted packet can trigger infinite recursion by making the pointer point to itself, or create a long chain of valid pointers resulting in stack exhaustion.
",1.0,655.0,6.0,3.944852352142334
177773,DoS Exec Code Overflow Mem. Corr.,"  NO, the given code is not vulnerable to the DoS_Exec_Code_Overflow_Mem._Corr. vulnerability.

The code does not contain any integer overflows or underflows, and it does not use any unsafe functions or libraries. The only potential vulnerability I can see is a potential buffer overflow if the input data is too large, but this can be mitigated by using a secure function like `strncpy` or `memcpy` to copy the data into the buffer.

Therefore, I would say that the code is not vulnerable to the DoS_Exec_Code_Overflow_Mem._Corr. vulnerability.","The code contains a DoS_Exec_Code_Overflow_Mem._Corr. vulnerability. 
The CVE-ID is CVE-2009-3607. The CWE-ID is CWE-189.
Vulnerability summary:
Integer overflow in the create_surface_from_thumbnail_data function in glib/poppler-page.cc in Poppler 0.x allows remote attackers to cause a denial of service (memory corruption) or possibly execute arbitrary code via a crafted PDF document that triggers a heap-based buffer overflow.  NOTE: some of these details are obtained from third party information.
",1.0,756.0,6.0,5.65776515007019
177774,DoS Exec Code Overflow,"  YES, the given code is vulnerable to a DoS_Exec_Code_Overflow vulnerability. The CVE-ID is CVE-2009-3605. The CWE-ID is CWE-189.

The vulnerability arises from the use of the `guessMajority` function, which takes an `ArrayReader` object as an argument. The function iterates over the last 4 elements of the array and checks if they are equal to the first 3 elements. If they are, it increments a counter. If the counter reaches a certain threshold, it returns the index of the first 3 elements.

The vulnerability is caused by the fact that the `ArrayReader` object is not properly validated. An attacker can craft a malicious input that causes the `guessMajority` function to iterate over the entire array, leading to a denial of service.

To exploit this vulnerability, an attacker can send a malicious input that causes the `guessMajority` function to iterate over the entire array, leading to a denial of service. This can be done by sending a large input that causes the `ArrayReader` object to iterate over the entire array, leading to a denial of service.

To fix this vulnerability, the `ArrayReader` object should be properly validated to ensure","The code contains a DoS_Exec_Code_Overflow vulnerability. 
The CVE-ID is CVE-2009-3605. The CWE-ID is CWE-189.
Vulnerability summary:
Multiple integer overflows in Poppler 0.10.5 and earlier allow remote attackers to cause a denial of service (application crash) or possibly execute arbitrary code via a crafted PDF file, related to (1) glib/poppler-page.cc; (2) ArthurOutputDev.cc, (3) CairoOutputDev.cc, (4) GfxState.cc, (5) JBIG2Stream.cc, (6) PSOutputDev.cc, and (7) SplashOutputDev.cc in poppler/; and (8) SplashBitmap.cc, (9) Splash.cc, and (10) SplashFTFont.cc in splash/.  NOTE: this may overlap CVE-2009-0791.
",3.0,958.0,6.0,3.653313636779785
177775,DoS Exec Code Overflow,"  YES, the given code is vulnerable to a DoS_Exec_Code_Overflow vulnerability. The CVE-ID is CVE-2009-3605. The CWE-ID is CWE-189.

The vulnerability arises from the use of the `guessMajority` function, which takes an `ArrayReader` object as an argument. The function iterates over the last four elements of the array and checks if they are equal to the first three elements. If they are, it increments a counter. If the counter reaches a certain threshold, it returns the index of the first three elements.

The vulnerability is caused by the fact that the `ArrayReader` object is not properly validated. An attacker can craft a malicious input that causes the `guessMajority` function to iterate over the entire array, leading to a buffer overflow and potentially an arbitrary code execution.

To exploit this vulnerability, an attacker would need to provide a malicious input that causes the `guessMajority` function to iterate over the entire array. This can be done by providing a large input that is longer than the size of the array, and the function will iterate over the entire input, potentially leading to a buffer overflow.

The fix for this vulnerability is to properly validate the input and ensure that the `ArrayReader`","The code contains a DoS_Exec_Code_Overflow vulnerability. 
The CVE-ID is CVE-2009-3605. The CWE-ID is CWE-189.
Vulnerability summary:
Multiple integer overflows in Poppler 0.10.5 and earlier allow remote attackers to cause a denial of service (application crash) or possibly execute arbitrary code via a crafted PDF file, related to (1) glib/poppler-page.cc; (2) ArthurOutputDev.cc, (3) CairoOutputDev.cc, (4) GfxState.cc, (5) JBIG2Stream.cc, (6) PSOutputDev.cc, and (7) SplashOutputDev.cc in poppler/; and (8) SplashBitmap.cc, (9) Splash.cc, and (10) SplashFTFont.cc in splash/.  NOTE: this may overlap CVE-2009-0791.
",3.0,962.0,6.0,3.898667812347412
177777,DoS Exec Code Overflow,"  YES, the given code is vulnerable to a DoS_Exec_Code_Overflow vulnerability. The CVE-ID is CVE-2009-3605. The CWE-ID is CWE-189.

The vulnerability arises from the use of the `guessMajority` function, which takes an `ArrayReader` object as input and returns the index of the majority element in the array. The function uses a naive approach to determine the majority element, which can lead to a buffer overflow if the input array is maliciously crafted.

The vulnerability is caused by the use of the `query` method of the `ArrayReader` object, which takes a variable number of arguments and returns the value of the element at the specified index. The `query` method is used in a loop to iterate over the elements of the array, and the loop condition is based on the number of elements in the array. However, the loop condition is not properly checked, which allows an attacker to manipulate the number of elements in the array and cause a buffer overflow.

To exploit this vulnerability, an attacker can craft a malicious input array that contains a large number of elements, and the `query` method will iterate over the entire array, leading to a buffer overflow. The attacker can then use the buffer overflow to execute arbitrary code, leading to a den","The code contains a DoS_Exec_Code_Overflow vulnerability. 
The CVE-ID is CVE-2009-3605. The CWE-ID is CWE-189.
Vulnerability summary:
Multiple integer overflows in Poppler 0.10.5 and earlier allow remote attackers to cause a denial of service (application crash) or possibly execute arbitrary code via a crafted PDF file, related to (1) glib/poppler-page.cc; (2) ArthurOutputDev.cc, (3) CairoOutputDev.cc, (4) GfxState.cc, (5) JBIG2Stream.cc, (6) PSOutputDev.cc, and (7) SplashOutputDev.cc in poppler/; and (8) SplashBitmap.cc, (9) Splash.cc, and (10) SplashFTFont.cc in splash/.  NOTE: this may overlap CVE-2009-0791.
",2.0,970.0,6.0,3.2599263191223145
177778,DoS Exec Code Overflow,"  YES, the given code is vulnerable to a DoS_Exec_Code_Overflow vulnerability. The CVE-ID is CVE-2009-3605. The CWE-ID is CWE-189.

The vulnerability arises from the use of the `cairo_mask` function, which takes a pattern as an argument. The pattern is created from the `maskImage` surface, which is created from the `maskBuffer` buffer. The `maskBuffer` buffer is created by iterating over the `maskImgStr` stream and copying the values into the buffer.

The vulnerability occurs when the `maskImgStr` stream contains a large number of values, causing the `maskBuffer` buffer to overflow. This can be exploited by sending a crafted PDF file with a large number of values in the `maskImgStr` stream, causing the buffer to overflow and leading to a denial of service or potentially arbitrary code execution.

The vulnerability is related to the use of the `cairo_mask` function, which takes a pattern as an argument. The pattern is created from the `maskImage` surface, which is created from the `maskBuffer` buffer. The `maskBuffer` buffer is created by iterating over the `maskImgStr` stream and copying the values into the buffer.

The vulnerability is related to the use of the `","The code contains a DoS_Exec_Code_Overflow vulnerability. 
The CVE-ID is CVE-2009-3605. The CWE-ID is CWE-189.
Vulnerability summary:
Multiple integer overflows in Poppler 0.10.5 and earlier allow remote attackers to cause a denial of service (application crash) or possibly execute arbitrary code via a crafted PDF file, related to (1) glib/poppler-page.cc; (2) ArthurOutputDev.cc, (3) CairoOutputDev.cc, (4) GfxState.cc, (5) JBIG2Stream.cc, (6) PSOutputDev.cc, and (7) SplashOutputDev.cc in poppler/; and (8) SplashBitmap.cc, (9) Splash.cc, and (10) SplashFTFont.cc in splash/.  NOTE: this may overlap CVE-2009-0791.
",3.0,973.0,6.0,3.1382853984832764
177779,DoS Exec Code Overflow,"  YES, the given code is vulnerable to a DoS_Exec_Code_Overflow vulnerability. The CVE-ID is CVE-2009-3605. The CWE-ID is CWE-189.

The vulnerability arises from the use of the `cairo_mask` function, which takes a pattern as an argument. The pattern is created from the `maskImage` surface, which is created from the `maskBuffer` buffer. The `maskBuffer` buffer is created by copying the `maskImgStr` stream into it. The `maskImgStr` stream is created from the `maskStr` stream, which is passed as an argument to the function.

The vulnerability occurs when the `maskStr` stream contains a large number of bytes, which can cause the `maskBuffer` buffer to overflow. This can happen if the `maskStr` stream contains a malicious PDF file with a large number of bytes in the soft mask.

The overflow can cause the `maskBuffer` buffer to overwrite the return address on the stack, leading to a buffer overflow attack. The attacker can then use the overwritten return address to redirect the program control flow to a malicious location, allowing the attacker to execute arbitrary code.

To exploit this vulnerability, an attacker would need to create a malicious PDF file with a large soft mask and pass it","The code contains a DoS_Exec_Code_Overflow vulnerability. 
The CVE-ID is CVE-2009-3605. The CWE-ID is CWE-189.
Vulnerability summary:
Multiple integer overflows in Poppler 0.10.5 and earlier allow remote attackers to cause a denial of service (application crash) or possibly execute arbitrary code via a crafted PDF file, related to (1) glib/poppler-page.cc; (2) ArthurOutputDev.cc, (3) CairoOutputDev.cc, (4) GfxState.cc, (5) JBIG2Stream.cc, (6) PSOutputDev.cc, and (7) SplashOutputDev.cc in poppler/; and (8) SplashBitmap.cc, (9) Splash.cc, and (10) SplashFTFont.cc in splash/.  NOTE: this may overlap CVE-2009-0791.
",4.0,970.0,6.0,3.0244922637939453
177780,DoS Exec Code Overflow,"  YES, the given code is vulnerable to a DoS_Exec_Code_Overflow vulnerability. The CVE-ID is CVE-2009-3605. The CWE-ID is CWE-189.

The vulnerability arises from the use of integer overflows in the code. The function takes an integer input 'bits' and uses it to calculate the maximum value of a pixel. If the value of 'bits' is too large, it can cause an integer overflow, leading to an incorrect calculation of the maximum pixel value. This can result in a buffer overflow when the function tries to access memory outside the allocated bounds.

The vulnerability can be exploited by sending a crafted PDF file with a large value of 'bits' to the function. The attacker can control the value of 'bits' by manipulating the input PDF file, leading to a DoS_Exec_Code_Overflow vulnerability.","The code contains a DoS_Exec_Code_Overflow vulnerability. 
The CVE-ID is CVE-2009-3605. The CWE-ID is CWE-189.
Vulnerability summary:
Multiple integer overflows in Poppler 0.10.5 and earlier allow remote attackers to cause a denial of service (application crash) or possibly execute arbitrary code via a crafted PDF file, related to (1) glib/poppler-page.cc; (2) ArthurOutputDev.cc, (3) CairoOutputDev.cc, (4) GfxState.cc, (5) JBIG2Stream.cc, (6) PSOutputDev.cc, and (7) SplashOutputDev.cc in poppler/; and (8) SplashBitmap.cc, (9) Splash.cc, and (10) SplashFTFont.cc in splash/.  NOTE: this may overlap CVE-2009-0791.
",3.0,879.0,6.0,3.0673632621765137
