case_id,vuln_type,audit_report,gt,eval_score,eval_input_token_num,eval_output_token_num,eval_inference_time
177865,DoS,"  NO, the given code is not vulnerable to a DoS attack.

The code checks the length of the input string and pattern before starting the pattern matching process. It also uses a switch statement to handle the different characters in the pattern. The code does not have any vulnerabilities related to buffer overflow, use after free, memory leaks, integer overflow/underflow, null pointer dereference, improper input validation, race conditions, insecure function usage, insecure resource management, improper error handling, cryptographic issues, or sensitive data exposure.

Therefore, the code is not vulnerable to a DoS attack.","The code contains a DoS vulnerability. 
The CVE-ID is CVE-2017-13720. The CWE-ID is CWE-125.
Vulnerability summary:
In the PatternMatch function in fontfile/fontdir.c in libXfont through 1.5.2 and 2.x before 2.0.2, an attacker with access to an X connection can cause a buffer over-read during pattern matching of fonts, leading to information disclosure or a crash (denial of service). This occurs because '\0' characters are incorrectly skipped in situations involving ? characters.
",1.0,755.0,6.0,3.5862841606140137
177867,,"  NO, the given code is not vulnerable to a nan vulnerability. The code does not contain any potential buffer overflow vulnerabilities, use after free errors, memory leaks, integer overflow/underflow, null pointer dereferences, improper input validation, race conditions, insecure function usage, insecure resource management, improper error handling, cryptographic issues, or sensitive data exposure.","The code contains a nan vulnerability. 
The CVE-ID is CVE-2018-16541. The CWE-ID is CWE-416.
Vulnerability summary:
In Artifex Ghostscript before 9.24, attackers able to supply crafted PostScript files could use incorrect free logic in pagedevice replacement to crash the interpreter.
",1.0,659.0,6.0,3.386373996734619
177869,,"  YES, the code is vulnerable to a buffer overflow attack. The function `guessMajority` takes an `ArrayReader` object as a parameter, which is used to read the contents of an array. The function then iterates over the array and checks if the value at index 3 is equal to the value at index 4. If the value at index 3 is equal to the value at index 4, the function increments the `count_a` variable. If the value at index 3 is not equal to the value at index 4, the function increments the `count_b` variable and sets the `idx_b` variable to the index of the value that is not equal to the value at index 3.

The vulnerability arises from the fact that the `ArrayReader` object is not properly validated. An attacker could potentially pass a malicious `ArrayReader` object that contains a large number of values, causing the function to overflow the buffer. This could potentially lead to a denial-of-service or other security vulnerability.

To fix this vulnerability, the `ArrayReader` object should be properly validated to ensure that it does not contain too many values. Additionally, the function should be modified to check for buffer overflows and to handle them appropriately.","The code contains a nan vulnerability. 
The CVE-ID is CVE-2018-16513. The CWE-ID is CWE-704.
Vulnerability summary:
In Artifex Ghostscript before 9.24, attackers able to supply crafted PostScript files could use a type confusion in the setcolor function to crash the interpreter or possibly have unspecified other impact.
",2.0,847.0,6.0,2.7999863624572754
177870,,"  NO, the given code is not vulnerable to a nan vulnerability. The code is a function that takes an array as input and returns the majority element in the array. It uses a simple algorithm to find the majority element, which is not vulnerable to a nan vulnerability.","The code contains a nan vulnerability. 
The CVE-ID is CVE-2018-16511. The CWE-ID is CWE-704.
Vulnerability summary:
An issue was discovered in Artifex Ghostscript before 9.24. A type confusion in ""ztype"" could be used by remote attackers able to supply crafted PostScript to crash the interpreter or possibly have unspecified other impact.
",1.0,653.0,6.0,3.470862865447998
177874,Exec Code Overflow,"  NO, the given code is not vulnerable to Exec Code Overflow.

The code does not contain any buffer overflow vulnerabilities, as it does not involve any user-supplied input or unchecked memory access. The code also does not contain any other known vulnerabilities, such as use-after-free, memory leaks, integer overflow/underflow, null pointer dereference, improper input validation, race conditions, insecure function usage, insecure resource management, or improper error handling.

Therefore, the code is not vulnerable to Exec Code Overflow.","The code contains a Exec_Code_Overflow vulnerability. 
The CVE-ID is CVE-2018-15911. The CWE-ID is CWE-119.
Vulnerability summary:
In Artifex Ghostscript 9.23 before 2018-08-24, attackers able to supply crafted PostScript could use uninitialized memory access in the aesdecode operator to crash the interpreter or potentially execute code.
",1.0,704.0,6.0,3.7267351150512695
177875,Exec Code Overflow,"  NO, the given code is not vulnerable to Exec Code Overflow.

The code does not contain any buffer overflow vulnerabilities, as it does not involve any string or memory functions that could potentially cause buffer overflows. Additionally, the code does not contain any use-after-free errors, as it does not involve any pointers that are used after the memory they point to has been deallocated.

Furthermore, the code does not contain any memory leaks, as it properly implements dynamic memory management using new and delete operators. The code also does not contain any integer overflow or underflow vulnerabilities, as it properly checks for overflow or underflow conditions and handles them appropriately.

Finally, the code does not contain any null pointer dereference vulnerabilities, as it properly checks for null pointers before dereferencing them.

Overall, the code appears to be secure and does not contain any known vulnerabilities.","The code contains a Exec_Code_Overflow vulnerability. 
The CVE-ID is CVE-2018-15911. The CWE-ID is CWE-119.
Vulnerability summary:
In Artifex Ghostscript 9.23 before 2018-08-24, attackers able to supply crafted PostScript could use uninitialized memory access in the aesdecode operator to crash the interpreter or potentially execute code.
",1.0,772.0,6.0,3.057948589324951
177879,DoS Exec Code Overflow,"  NO, the given code is not vulnerable to a DoS_Exec_Code_Overflow vulnerability.

The code does not contain any buffer overflow vulnerabilities, as it does not involve any user-supplied input or unchecked array access. Additionally, the code does not contain any use-after-free errors, as it properly checks for null pointers before dereferencing them.

The code also does not contain any memory leaks, as it properly calls delete or free after allocating memory using new or malloc.

The code does not contain any integer overflow or underflow vulnerabilities, as it properly checks for overflow or underflow conditions and ensures that integers are validated and sanitized.

The code does not contain any null pointer dereference vulnerabilities, as it properly checks for null pointers before dereferencing them.

The code does not contain any improper input validation vulnerabilities, as it properly validates user input and sanitizes it.

The code does not contain any race condition vulnerabilities, as it properly uses synchronization mechanisms to prevent concurrent access to shared resources.

The code does not contain any insecure function usage vulnerabilities, as it properly uses secure functions like strncpy, fgets, and sscanf.

The code does not contain any insecure resource management vulnerabilities, as it properly manages resources like file descriptors, sockets, and memory.","The code contains a DoS_Exec_Code_Overflow vulnerability. 
The CVE-ID is CVE-2015-3456. The CWE-ID is CWE-119.
Vulnerability summary:
The Floppy Disk Controller (FDC) in QEMU, as used in Xen 4.5.x and earlier and KVM, allows local guest users to cause a denial of service (out-of-bounds write and guest crash) or possibly execute arbitrary code via the (1) FD_CMD_READ_ID, (2) FD_CMD_DRIVE_SPECIFICATION_COMMAND, or other unspecified commands, aka VENOM.
",1.0,889.0,6.0,3.7255642414093018
177880,Bypass,"  NO, the given code is not vulnerable to a Bypass vulnerability. The code is a function that checks if a file name is allowed to be accessed based on a set of permissions. It does not allow arbitrary file system accesses, only Postscript device accesses. The function also checks if the file name starts with a certain number of parent references, and if the permission element starts with the same number of parent references. It also checks if the permission starts with ""./"", absolute paths are not permitted, and if the permission starts with ""./"", relative paths with no ""./"" are allowed as well as with ""./"". The function returns an error if the file name is not allowed to be accessed.

Therefore, the code does not allow any bypass vulnerabilities.","The code contains a Bypass vulnerability. 
The CVE-ID is CVE-2018-15908. The CWE-ID is nan.
Vulnerability summary:
In Artifex Ghostscript 9.23 before 2018-08-23, attackers are able to supply malicious PostScript files to bypass .tempfile restrictions and write files.
",1.0,738.0,6.0,4.143384695053101
177881,DoS,"  NO. The code is not vulnerable to a DoS attack. The function is using the `strsep` function to parse a comma-separated list of strings, and it is properly checking the return value of `strsep` to ensure that it is not NULL before using it. Additionally, the function is using the `kstrdup` function to allocate memory for the `edidstr` variable, and it is properly checking the return value of `kstrdup` to ensure that it is not NULL before using it. Therefore, the code is not vulnerable to a DoS attack.","The code contains a DoS vulnerability. 
The CVE-ID is CVE-2019-12382. The CWE-ID is CWE-476.
Vulnerability summary:
An issue was discovered in drm_load_edid_firmware in drivers/gpu/drm/drm_edid_load.c in the Linux kernel through 5.1.5. There is an unchecked kstrdup of fwstr, which might allow an attacker to cause a denial of service (NULL pointer dereference and system crash).
",1.0,739.0,6.0,2.625190496444702
177883,,"  NO, the given code is not vulnerable to a nan vulnerability. The code is a function that takes in a struct t_weechat_plugin, struct t_gui_buffer, const char *tags, const char *message, int strip_colors, t_hook_callback_print *callback, void *callback_data, and returns a struct t_hook. It does not contain any arithmetic operations or any code that could potentially cause a nan vulnerability.","The code contains a nan vulnerability. 
The CVE-ID is CVE-2011-1428. The CWE-ID is CWE-20.
Vulnerability summary:
Wee Enhanced Environment for Chat (aka WeeChat) 0.3.4 and earlier does not properly verify that the server hostname matches the domain name of the subject of an X.509 certificate, which allows man-in-the-middle attackers to spoof an SSL chat server via an arbitrary certificate, related to incorrect use of the GnuTLS API.
",1.0,708.0,6.0,3.7932016849517822
177887,DoS Overflow,"  NO, the given code is not vulnerable to a DoS_Overflow vulnerability.

The code checks the size of the allocated memory block against the limit and the used memory, and it also checks if the memory block is too large to be allocated. If any of these conditions are met, it sets the message to ""exceeded limit"". However, it does not check if the size of the memory block is too large to be allocated, which could lead to a buffer overflow.

Additionally, the code does not check if the memory block is too large to be allocated, which could lead to a buffer overflow.

Therefore, the code is not vulnerable to a DoS_Overflow vulnerability.","The code contains a DoS_Overflow vulnerability. 
The CVE-ID is CVE-2015-3228. The CWE-ID is CWE-189.
Vulnerability summary:
Integer overflow in the gs_heap_alloc_bytes function in base/gsmalloc.c in Ghostscript 9.15 and earlier allows remote attackers to cause a denial of service (crash) via a crafted Postscript (ps) file, as demonstrated by using the ps2pdf command, which triggers an out-of-bounds read or write.
",2.0,760.0,6.0,5.3396008014678955
177891,DoS,"  NO, the given code is not vulnerable to a DoS attack.

The code is using the `d2i_RSA_PSS_PARAMS` function to decode an ASN.1-encoded RSA PSS parameters structure. The function returns a pointer to a `RSA_PSS_PARAMS` structure, which is then used to determine the mask generation algorithm.

The code is not using the `d2i_X509_ALGOR` function to decode the mask generation algorithm, which is a potential vulnerability. If the `d2i_X509_ALGOR` function is not used, the code may not properly handle the mask generation algorithm, which could lead to a denial of service (DoS) attack.

Therefore, the code is vulnerable to a DoS attack.","The code contains a DoS vulnerability. 
The CVE-ID is CVE-2015-3194. The CWE-ID is nan.
Vulnerability summary:
crypto/rsa/rsa_ameth.c in OpenSSL 1.0.1 before 1.0.1q and 1.0.2 before 1.0.2e allows remote attackers to cause a denial of service (NULL pointer dereference and application crash) via an RSA PSS ASN.1 signature that lacks a mask generation function parameter.
",3.0,778.0,6.0,4.245628118515015
177893,+Info,"  YES, the given code is vulnerable to a buffer overflow vulnerability. The function takes an untrusted input from the user and uses it as a parameter to the BN_bntest_rand function, which can cause a buffer overflow if the input is too large. Additionally, the function also uses the BN_mod_exp function, which can also lead to a buffer overflow if the input is too large.

The vulnerability is due to the use of untrusted user input without proper validation and sanitation. The input is used directly without any bounds checking, which can lead to buffer overflows if the input is too large.

The recommended solution is to properly validate and sanitize the user input before using it in the BN_bntest_rand function. Additionally, the BN_mod_exp function should also be used with proper bounds checking to prevent buffer overflows.","The code contains a +Info vulnerability. 
The CVE-ID is CVE-2015-3193. The CWE-ID is CWE-200.
Vulnerability summary:
The Montgomery squaring implementation in crypto/bn/asm/x86_64-mont5.pl in OpenSSL 1.0.2 before 1.0.2e on the x86_64 platform, as used by the BN_mod_exp function, mishandles carry propagation and produces incorrect output, which makes it easier for remote attackers to obtain sensitive private-key information via an attack against use of a (1) Diffie-Hellman (DH) or (2) Diffie-Hellman Ephemeral (DHE) ciphersuite.
",2.0,832.0,6.0,4.223257780075073
177896,,  NO. The code is not vulnerable to a nan vulnerability.,"The code contains a nan vulnerability. 
The CVE-ID is CVE-2013-2007. The CWE-ID is CWE-264.
Vulnerability summary:
The qemu guest agent in Qemu 1.4.1 and earlier, as used by Xen, when started in daemon mode, uses weak permissions for certain files, which allows local users to read and write to these files.
",1.0,612.0,6.0,3.7178523540496826
177897,+Info,"  NO, the given code is not vulnerable to the specified vulnerability.

The code does not contain any direct or indirect use of the `strcpy`, `sprintf`, `memcpy`, or `array access` functions, which are the primary sources of buffer overflow vulnerabilities. Additionally, the code does not contain any direct or indirect use of the `gets`, `scanf`, or `file and network input handling` functions, which are the primary sources of input validation vulnerabilities.

Furthermore, the code does not contain any direct or indirect use of the `strcpy`, `sprintf`, `memcpy`, or `array access` functions, which are the primary sources of buffer overflow vulnerabilities. Additionally, the code does not contain any direct or indirect use of the `gets`, `scanf`, or `file and network input handling` functions, which are the primary sources of input validation vulnerabilities.

The code also does not contain any direct or indirect use of the `xmlInitParser`, `xmlCleanupParser`, or `xmlParseDocument` functions, which are the primary sources of memory management vulnerabilities.

Finally, the code does not contain any direct or indirect use of the `xmlCreateFileParserCtxt` function, which is the primary source of the vulnerability.

Therefore, the code is not vulnerable to the specified vulnerability.","The code contains a +Info vulnerability. 
The CVE-ID is CVE-2013-1824. The CWE-ID is CWE-200.
Vulnerability summary:
The SOAP parser in PHP before 5.3.22 and 5.4.x before 5.4.12 allows remote attackers to read arbitrary files via a SOAP WSDL file containing an XML external entity declaration in conjunction with an entity reference, related to an XML External Entity (XXE) issue in the soap_xmlParseFile and soap_xmlParseMemory functions.
",1.0,890.0,6.0,5.112237930297852
177898,+Info,"  NO, the given code is not vulnerable to any security vulnerabilities.

The code is a C++ function that parses an XML document using the libxml2 library. It creates a new parser context using the `xmlCreateMemoryParserCtxt` function, and then parses the XML document using the `xmlParseDocument` function. The function returns the parsed XML document.

The code does not contain any vulnerabilities related to buffer overflow, use after free, memory leaks, integer overflow/underflow, null pointer dereference, improper input validation, race conditions, insecure function usage, insecure resource management, improper error handling, cryptographic issues, or sensitive data exposure.

Therefore, the code is not vulnerable to any security vulnerabilities.","The code contains a +Info vulnerability. 
The CVE-ID is CVE-2013-1824. The CWE-ID is CWE-200.
Vulnerability summary:
The SOAP parser in PHP before 5.3.22 and 5.4.x before 5.4.12 allows remote attackers to read arbitrary files via a SOAP WSDL file containing an XML external entity declaration in conjunction with an entity reference, related to an XML External Entity (XXE) issue in the soap_xmlParseFile and soap_xmlParseMemory functions.
",1.0,772.0,6.0,4.79650616645813
177899,+Info,"  NO, the given code is not vulnerable to any security vulnerabilities.

The code is a C++ function that parses an XML file using the libxml2 library. It creates a new parser context, sets the keepBlanks flag to 0, and then parses the XML file. The function then frees the parser context and returns the parsed XML document.

The code does not contain any vulnerabilities related to buffer overflow, use after free, memory leaks, integer overflow/underflow, null pointer dereference, improper input validation, race conditions, insecure function usage, improper resource management, or improper error handling.

Therefore, the code is not vulnerable to any security vulnerabilities.","The code contains a +Info vulnerability. 
The CVE-ID is CVE-2013-1824. The CWE-ID is CWE-200.
Vulnerability summary:
The SOAP parser in PHP before 5.3.22 and 5.4.x before 5.4.12 allows remote attackers to read arbitrary files via a SOAP WSDL file containing an XML external entity declaration in conjunction with an entity reference, related to an XML External Entity (XXE) issue in the soap_xmlParseFile and soap_xmlParseMemory functions.
",1.0,761.0,6.0,3.2965378761291504
177900,+Info,"  NO, the given code is not vulnerable to any security vulnerabilities.

The code is a C++ function that parses an XML document using the libxml2 library. It creates a new parser context using the `xmlCreateMemoryParserCtxt` function, and then parses the XML document using the `xmlParseDocument` function. The function returns the parsed XML document.

The code does not contain any obvious security vulnerabilities, such as buffer overflows, use-after-free errors, memory leaks, integer overflow/underflow, null pointer dereferences, improper input validation, race conditions, insecure function usage, insecure resource management, improper error handling, cryptographic issues, or sensitive data exposure.

However, it is important to note that the code may still contain security vulnerabilities that are not immediately apparent. For example, the code may contain unchecked user input, unvalidated data, or other potential vulnerabilities that could be exploited by attackers. Therefore, it is important to thoroughly review the code and test it thoroughly to ensure that it is secure.","The code contains a +Info vulnerability. 
The CVE-ID is CVE-2013-1824. The CWE-ID is CWE-200.
Vulnerability summary:
The SOAP parser in PHP before 5.3.22 and 5.4.x before 5.4.12 allows remote attackers to read arbitrary files via a SOAP WSDL file containing an XML external entity declaration in conjunction with an entity reference, related to an XML External Entity (XXE) issue in the soap_xmlParseFile and soap_xmlParseMemory functions.
",1.0,833.0,6.0,8.026397943496704
177901,Overflow,"  NO. The code is not vulnerable to buffer overflow. The function takes a long integer and a character array as input, and it copies the string representation of the integer into the character array. The function does not use any unsafe or deprecated functions, and it does not have any obvious vulnerabilities.","The code contains a Overflow vulnerability. 
The CVE-ID is CVE-2015-2806. The CWE-ID is CWE-119.
Vulnerability summary:
Stack-based buffer overflow in asn1_der_decoding in libtasn1 before 4.4 allows remote attackers to have unspecified impact via unknown vectors.
",1.0,643.0,6.0,3.178584337234497
177904,DoS,"  NO, the given code is not vulnerable to a DoS attack.

The code checks the input values of `xDest`, `yDest`, and `clipRes` before using them, and it also checks the return value of `state->clip->test()` before using it. Additionally, the code uses the `pipe` object to perform the blitting operation, which is a secure way to handle memory and resources.

Therefore, the code does not contain any vulnerabilities related to buffer overflow, use after free, memory leaks, integer overflow/underflow, null pointer dereference, improper input validation, race conditions, insecure function usage, insecure resource management, or improper error handling.","The code contains a DoS vulnerability. 
The CVE-ID is CVE-2013-1789. The CWE-ID is nan.
Vulnerability summary:
splash/Splash.cc in poppler before 0.22.1 allows context-dependent attackers to cause a denial of service (NULL pointer dereference and crash) via vectors related to the (1) Splash::arbitraryTransformMask, (2) Splash::blitMask, and (3) Splash::scaleMaskYuXu functions.
",1.0,758.0,6.0,2.1972241401672363
177905,DoS,"  YES, the given code is vulnerable to a DoS attack. The vulnerability is caused by the use of the `imgCoordMungeLowerC` and `imgCoordMungeUpperC` functions, which can cause a buffer overflow if the input values are not properly validated. An attacker can exploit this vulnerability by providing a specially crafted input that causes the buffer to overflow, leading to a crash or denial of service.

The vulnerability is related to the CWE-120 (Buffer Overflow) and CWE-121 (Stack-based Buffer Overflow) vulnerabilities.","The code contains a DoS vulnerability. 
The CVE-ID is CVE-2013-1789. The CWE-ID is nan.
Vulnerability summary:
splash/Splash.cc in poppler before 0.22.1 allows context-dependent attackers to cause a denial of service (NULL pointer dereference and crash) via vectors related to the (1) Splash::arbitraryTransformMask, (2) Splash::blitMask, and (3) Splash::scaleMaskYuXu functions.
",2.0,730.0,6.0,2.5302138328552246
177906,DoS Exec Code Overflow,"  YES, the given code is vulnerable to a DoS_Exec_Code_Overflow vulnerability. The CVE-ID is CVE-2013-1788. The CWE-ID is CWE-119.

The vulnerability arises from the use of the `splashFloor` function, which is used to calculate the index of the line dash pattern. The function takes a floating-point number as input and returns the largest integer less than or equal to that number. However, the function does not check for overflows, which can occur if the input value is too large.

If the input value is too large, the function will return a value that is not the largest integer less than or equal to the input value, but rather a value that is too large to be represented by the integer type. This can cause the loop to run indefinitely, leading to a denial-of-service (DoS) vulnerability.

To exploit this vulnerability, an attacker can send a specially crafted input that causes the `splashFloor` function to return a value that is too large, leading to an infinite loop. This can cause the application to crash or become unresponsive, leading to a denial-of-service (DoS) vulnerability.

Therefore, it is important to fix this vulnerability by adding appropriate checks for overflows","The code contains a DoS_Exec_Code_Overflow vulnerability. 
The CVE-ID is CVE-2013-1788. The CWE-ID is CWE-119.
Vulnerability summary:
poppler before 0.22.1 allows context-dependent attackers to cause a denial of service (crash) and possibly execute arbitrary code via vectors that trigger an ""invalid memory access"" in (1) splash/Splash.cc, (2) poppler/Function.cc, and (3) poppler/Stream.cc.
",3.0,881.0,6.0,3.289498805999756
