case_id,vuln_type,audit_report,gt,eval_score,eval_input_token_num,eval_output_token_num,eval_inference_time
177736,Bypass,"  YES, the code is vulnerable to a Bypass vulnerability. The CVE-ID is CVE-2015-8467. The CWE-ID is CWE-264.

The vulnerability arises from the fact that the function does not properly check for administrative privileges during creation of machine accounts. This allows remote authenticated users to bypass intended access restrictions by leveraging the existence of a domain with both a Samba DC and a Windows DC, a similar issue to CVE-2015-2535.

The vulnerability is caused by the fact that the function does not check for the presence of the required rights on the Domain object, which are required to set the UF_DONT_EXPIRE_PASSWD, UF_ENCRYPTED_TEXT_PASSWORD_ALLOWED, UF_SERVER_TRUST_ACCOUNT, UF_PARTIAL_SECRETS_ACCOUNT, and UF_INTERDOMAIN_TRUST_ACCOUNT bits in the userAccountControl attribute.

The function does not properly check for the presence of these rights, which allows an attacker to bypass intended access restrictions and create machine accounts with the required rights. This can lead to unauthorized access to sensitive data or system resources.","The code contains a Bypass vulnerability. 
The CVE-ID is CVE-2015-8467. The CWE-ID is CWE-264.
Vulnerability summary:
The samldb_check_user_account_control_acl function in dsdb/samdb/ldb_modules/samldb.c in Samba 4.x before 4.1.22, 4.2.x before 4.2.7, and 4.3.x before 4.3.3 does not properly check for administrative privileges during creation of machine accounts, which allows remote authenticated users to bypass intended access restrictions by leveraging the existence of a domain with both a Samba DC and a Windows DC, a similar issue to CVE-2015-2535.
",4.0,884.0,6.0,2.628427028656006
177740,DoS Exec Code Overflow Mem. Corr.,"  NO, the given code is not vulnerable to any security vulnerabilities.

The code is a function that takes in a vector of vectors of integers, a vector of integers, and a vector of integers as input, and returns a vector of vectors of integers. The function appears to be a simple implementation of a BFS algorithm, where the input vector of vectors of integers represents a grid, the input vector of integers represents the starting point of the BFS, and the output vector of vectors of integers represents the result of the BFS.

The function does not appear to have any vulnerabilities related to security, such as buffer overflows, use after free, memory leaks, integer overflow/underflow, null pointer dereference, improper input validation, race conditions, insecure function usage, insecure resource management, improper error handling, cryptographic issues, or sensitive data exposure.

Therefore, I would say that the code is not vulnerable to any security vulnerabilities.","The code contains a DoS_Exec_Code_Overflow_Mem._Corr. vulnerability. 
The CVE-ID is CVE-2013-6420. The CWE-ID is CWE-119.
Vulnerability summary:
The asn1_time_to_time_t function in ext/openssl/openssl.c in PHP before 5.3.28, 5.4.x before 5.4.23, and 5.5.x before 5.5.7 does not properly parse (1) notBefore and (2) notAfter timestamps in X.509 certificates, which allows remote attackers to execute arbitrary code or cause a denial of service (memory corruption) via a crafted certificate that is not properly handled by the openssl_x509_parse function.
",1.0,865.0,6.0,1.5947155952453613
177741,DoS Overflow,  NO,"The code contains a DoS_Overflow vulnerability. 
The CVE-ID is CVE-2011-4128. The CWE-ID is CWE-119.
Vulnerability summary:
Buffer overflow in the gnutls_session_get_data function in lib/gnutls_session.c in GnuTLS 2.12.x before 2.12.14 and 3.x before 3.0.7, when used on a client that performs nonstandard session resumption, allows remote TLS servers to cause a denial of service (application crash) via a large SessionTicket.
",1.0,645.0,6.0,1.2755968570709229
177742,DoS Overflow,"  NO. The code is not vulnerable to a DoS overflow. The function takes a vector of vectors as an argument, and it does not appear to be vulnerable to a buffer overflow.","The code contains a DoS_Overflow vulnerability. 
The CVE-ID is CVE-2011-4128. The CWE-ID is CWE-119.
Vulnerability summary:
Buffer overflow in the gnutls_session_get_data function in lib/gnutls_session.c in GnuTLS 2.12.x before 2.12.14 and 3.x before 3.0.7, when used on a client that performs nonstandard session resumption, allows remote TLS servers to cause a denial of service (application crash) via a large SessionTicket.
",1.0,673.0,6.0,2.7158799171447754
177743,DoS,"  NO, the given code is not vulnerable to a DoS attack.

The code is using the `zend_hash_has_more_elements` function to check if there are more elements in the `manifest` hash table. This function returns `FAILURE` if there are no more elements, and `SUCCESS` if there are more elements. The code is then using a `while` loop to iterate over the elements in the `manifest` hash table, and it breaks out of the loop when `FAILURE` is returned.

Therefore, the code is not vulnerable to a DoS attack because it is not possible to cause the `zend_hash_has_more_elements` function to return `FAILURE` by sending a specially crafted input. The function is designed to return `FAILURE` only when there are no more elements in the hash table, and the code is not vulnerable to a DoS attack because it is not possible to cause the function to return `FAILURE` by sending a specially crafted input.","The code contains a DoS vulnerability. 
The CVE-ID is CVE-2015-7804. The CWE-ID is CWE-189.
Vulnerability summary:
Off-by-one error in the phar_parse_zipfile function in ext/phar/zip.c in PHP before 5.5.30 and 5.6.x before 5.6.14 allows remote attackers to cause a denial of service (uninitialized pointer dereference and application crash) by including the / filename in a .zip PHAR archive.
",1.0,827.0,6.0,2.7806637287139893
177747,DoS,"  NO, the given code is not vulnerable to a DoS attack.

The code is a function that takes in a vector of vectors of integers, a vector of integers, and an integer `k` as input. It returns a vector of vectors of integers that represents the highest ranked `k` items in the input grid, where the ranking is based on the pricing range and the distance from the starting point.

The function uses a BFS algorithm to traverse the grid, and it maintains a lookup table to keep track of the shortest distance from the starting point to each cell in the grid. The function also uses a priority queue to keep track of the cells that need to be visited in the next iteration.

The function does not have any vulnerabilities that can cause a DoS attack. The only potential vulnerability is if the input grid is too large, which can cause the function to run out of memory. However, this is not a DoS vulnerability, but rather a resource exhaustion vulnerability.

Therefore, I would say that the code is not vulnerable to a DoS attack.","The code contains a DoS vulnerability. 
The CVE-ID is CVE-2013-6051. The CWE-ID is nan.
Vulnerability summary:
The bgp_attr_unknown function in bgp_attr.c in Quagga 0.99.21 does not properly initialize the total variable, which allows remote attackers to cause a denial of service (bgpd crash) via a crafted BGP update.
",1.0,815.0,6.0,2.432317018508911
177750,DoS Exec Code,"  YES, the code is vulnerable to a DoS_Exec_Code vulnerability. The CVE-ID is CVE-2018-1000039. The CWE-ID is CWE-416.

The vulnerability arises from the use of the `fz_try` macro, which catches all exceptions and rethrows them as `FZ_ERROR_TRYLATER`. This allows an attacker to cause a denial of service by repeatedly throwing exceptions until the stack is exhausted.

To exploit this vulnerability, an attacker would need to craft a specially crafted PDF file that causes the `pdf_run_xobject` function to repeatedly throw exceptions. This would cause the `fz_begin_mask` function to repeatedly call `fz_drop_colorspace` with a null pointer, leading to a crash.

The vulnerability is fixed in MuPDF 1.13.0 and later versions.","The code contains a DoS_Exec_Code vulnerability. 
The CVE-ID is CVE-2018-1000039. The CWE-ID is CWE-416.
Vulnerability summary:
In MuPDF 1.12.0 and earlier, multiple heap use after free bugs in the PDF parser could allow an attacker to execute arbitrary code, read memory, or cause a denial of service via a crafted file.
",4.0,769.0,6.0,3.046391487121582
177766,DoS,"  NO, the given code is not vulnerable to any security vulnerabilities. It appears to be a function that takes in a struct asn1_data and a struct ldb_parse_tree, and performs some ASN.1 encoding operations on the data. It does not contain any code that could potentially lead to a security vulnerability.","The code contains a DoS vulnerability. 
The CVE-ID is CVE-2015-7540. The CWE-ID is CWE-399.
Vulnerability summary:
The LDAP server in the AD domain controller in Samba 4.x before 4.1.22 does not check return values to ensure successful ASN.1 memory allocation, which allows remote attackers to cause a denial of service (memory consumption and daemon crash) via crafted packets.
",1.0,672.0,6.0,3.891645669937134
177767,DoS,"  NO. The code is not vulnerable to a DoS attack. The function is using talloc to allocate memory for the control structure, and it is checking the return value of talloc to ensure that the allocation was successful. Additionally, the function is using asn1_start_tag and asn1_end_tag to ensure that the ASN.1 data is properly formatted.","The code contains a DoS vulnerability. 
The CVE-ID is CVE-2015-7540. The CWE-ID is CWE-399.
Vulnerability summary:
The LDAP server in the AD domain controller in Samba 4.x before 4.1.22 does not check return values to ensure successful ASN.1 memory allocation, which allows remote attackers to cause a denial of service (memory consumption and daemon crash) via crafted packets.
",1.0,683.0,6.0,2.9484875202178955
177768,DoS,"  NO, the code is not vulnerable to a DoS attack.

The code is using the `lseek_or_error` function to seek to the offset specified in the `sparse_map` structure. This function checks for errors and returns `false` if an error occurs. However, it does not check for the case where the offset is beyond the end of the file, which could lead to a DoS attack.

To exploit this vulnerability, an attacker would need to modify the file to have a large number of sparse regions, each with a large offset. This would cause the `lseek_or_error` function to repeatedly seek to the end of the file, which would eventually cause a read error. The attacker could then use this error to cause the program to enter an infinite loop, which would consume all available resources and lead to a denial-of-service.

However, this vulnerability is not present in the code you provided, as it checks for the case where the offset is beyond the end of the file before calling `lseek_or_error`. Therefore, the code is not vulnerable to this type of attack.","The code contains a DoS vulnerability. 
The CVE-ID is CVE-2018-20482. The CWE-ID is CWE-835.
Vulnerability summary:
GNU Tar through 1.30, when --sparse is used, mishandles file shrinkage during read access, which allows local users to cause a denial of service (infinite read loop in sparse_dump_region in sparse.c) by modifying a file that is supposed to be archived by a different user's process (e.g., a system backup running as root).
",1.0,850.0,6.0,3.1475632190704346
177770,Bypass,"  NO. The code is not vulnerable to a bypass vulnerability. The vulnerability you mentioned is related to the daemon in rsync 3.1.2, and 3.1.3-development before 2017-12-03, and it does not apply to the given code.","The code contains a Bypass vulnerability. 
The CVE-ID is CVE-2017-17434. The CWE-ID is nan.
Vulnerability summary:
The daemon in rsync 3.1.2, and 3.1.3-development before 2017-12-03, does not check for fnamecmp filenames in the daemon_filter_list data structure (in the recv_files function in receiver.c) and also does not apply the sanitize_paths protection mechanism to pathnames found in ""xname follows"" strings (in the read_ndx_and_attrs function in rsync.c), which allows remote attackers to bypass intended access restrictions.
",1.0,715.0,6.0,1.4518208503723145
177771,,  NO,"The code contains a nan vulnerability. 
The CVE-ID is CVE-2018-20103. The CWE-ID is CWE-835.
Vulnerability summary:
An issue was discovered in dns.c in HAProxy through 1.8.14. In the case of a compressed pointer, a crafted packet can trigger infinite recursion by making the pointer point to itself, or create a long chain of valid pointers resulting in stack exhaustion.
",1.0,609.0,6.0,3.575611114501953
177773,DoS Exec Code Overflow Mem. Corr.,"  NO. The code is not vulnerable to any of the security vulnerabilities you mentioned.

The code is using the `cairo_image_surface_create_for_data` function to create a new surface from the given data, and it is properly checking the return value of the function to ensure that the surface was created successfully. It is also properly setting the user data for the surface using the `cairo_surface_set_user_data` function.

The code is also properly checking the input data for buffer overflows by using the `g_malloc` function to allocate memory for the pixels, and it is properly checking the input data for integer overflows by using the `cairo_image_surface_create_for_data` function to create the surface.

Therefore, the code is not vulnerable to any of the security vulnerabilities you mentioned.","The code contains a DoS_Exec_Code_Overflow_Mem._Corr. vulnerability. 
The CVE-ID is CVE-2009-3607. The CWE-ID is CWE-189.
Vulnerability summary:
Integer overflow in the create_surface_from_thumbnail_data function in glib/poppler-page.cc in Poppler 0.x allows remote attackers to cause a denial of service (memory corruption) or possibly execute arbitrary code via a crafted PDF document that triggers a heap-based buffer overflow.  NOTE: some of these details are obtained from third party information.
",1.0,790.0,6.0,2.4955718517303467
177774,DoS Exec Code Overflow,"  YES, the given code is vulnerable to a DoS_Exec_Code_Overflow vulnerability. The CVE-ID is CVE-2009-3605. The CWE-ID is CWE-189.

The vulnerability arises from the use of the `gmallocn` function, which allocates memory for an array of `n` elements of size `m`. In this case, the `n` value is derived from the `colorMap->getNumPixelComps()` function, which can return a large value. The `m` value is derived from the `colorMap->getBits()` function, which can also return a large value.

The `gmallocn` function uses the `gmalloc` function to allocate memory for the array, and the `gmalloc` function uses the `grealloc` function to reallocate memory. The `grealloc` function uses the `gfree` function to free the memory, and the `gfree` function uses the `gmalloc` function to allocate memory again.

This creates a loop where the memory is allocated, reallocated, and freed repeatedly, leading to a stack overflow. The attacker can exploit this vulnerability by sending a crafted PDF file with a large value for `n` and `m`, causing the stack to overflow and leading to a denial of service.","The code contains a DoS_Exec_Code_Overflow vulnerability. 
The CVE-ID is CVE-2009-3605. The CWE-ID is CWE-189.
Vulnerability summary:
Multiple integer overflows in Poppler 0.10.5 and earlier allow remote attackers to cause a denial of service (application crash) or possibly execute arbitrary code via a crafted PDF file, related to (1) glib/poppler-page.cc; (2) ArthurOutputDev.cc, (3) CairoOutputDev.cc, (4) GfxState.cc, (5) JBIG2Stream.cc, (6) PSOutputDev.cc, and (7) SplashOutputDev.cc in poppler/; and (8) SplashBitmap.cc, (9) Splash.cc, and (10) SplashFTFont.cc in splash/.  NOTE: this may overlap CVE-2009-0791.
",4.0,971.0,6.0,2.361783027648926
177775,DoS Exec Code Overflow,"  YES, the given code is vulnerable to a DoS_Exec_Code_Overflow vulnerability. The CVE-ID is CVE-2009-3605. The CWE-ID is CWE-189.

The vulnerability arises from the use of the `gets` function, which can cause a buffer overflow if the input string is too long. The `gets` function does not perform any bounds checking, and it does not provide any mechanism for the user to specify the maximum length of the input string. This means that an attacker can potentially overflow the buffer by providing a long input string, leading to a crash or arbitrary code execution.

To exploit this vulnerability, an attacker would need to provide a specially crafted PDF file that contains a malicious string that is longer than the buffer size. The attacker could then use this string to overflow the buffer and execute arbitrary code.

It is important to note that this vulnerability is not specific to the `gets` function, but rather a general issue with any function that does not perform bounds checking. Therefore, it is important to avoid using the `gets` function in any new code, and to instead use safer alternatives like `fgets` or `getline`.","The code contains a DoS_Exec_Code_Overflow vulnerability. 
The CVE-ID is CVE-2009-3605. The CWE-ID is CWE-189.
Vulnerability summary:
Multiple integer overflows in Poppler 0.10.5 and earlier allow remote attackers to cause a denial of service (application crash) or possibly execute arbitrary code via a crafted PDF file, related to (1) glib/poppler-page.cc; (2) ArthurOutputDev.cc, (3) CairoOutputDev.cc, (4) GfxState.cc, (5) JBIG2Stream.cc, (6) PSOutputDev.cc, and (7) SplashOutputDev.cc in poppler/; and (8) SplashBitmap.cc, (9) Splash.cc, and (10) SplashFTFont.cc in splash/.  NOTE: this may overlap CVE-2009-0791.
",4.0,941.0,6.0,4.922389268875122
177777,DoS Exec Code Overflow,"  YES, the given code is vulnerable to a DoS_Exec_Code_Overflow vulnerability. The CVE-ID is CVE-2009-3605. The CWE-ID is CWE-189.

The vulnerability arises from the use of the `cairo_matrix_init_translate` function, which takes a `double` argument for the translation value. However, the value is not properly validated, and an attacker can potentially provide a large value that causes a buffer overflow. This can lead to the execution of arbitrary code, potentially allowing the attacker to take control of the system.

The vulnerability is not limited to the given code snippet, but rather it is a general issue with the use of `cairo_matrix_init_translate` in Cairo. It is recommended to use a safe version of the function, such as `cairo_matrix_init_translate_with_scale`, which takes a `double` argument for the scale value, and a `double` argument for the translation value. This can help prevent the vulnerability.","The code contains a DoS_Exec_Code_Overflow vulnerability. 
The CVE-ID is CVE-2009-3605. The CWE-ID is CWE-189.
Vulnerability summary:
Multiple integer overflows in Poppler 0.10.5 and earlier allow remote attackers to cause a denial of service (application crash) or possibly execute arbitrary code via a crafted PDF file, related to (1) glib/poppler-page.cc; (2) ArthurOutputDev.cc, (3) CairoOutputDev.cc, (4) GfxState.cc, (5) JBIG2Stream.cc, (6) PSOutputDev.cc, and (7) SplashOutputDev.cc in poppler/; and (8) SplashBitmap.cc, (9) Splash.cc, and (10) SplashFTFont.cc in splash/.  NOTE: this may overlap CVE-2009-0791.
",3.0,910.0,6.0,1.3260371685028076
177778,DoS Exec Code Overflow,"  YES, the given code is vulnerable to a DoS_Exec_Code_Overflow vulnerability. The CVE-ID is CVE-2009-3605. The CWE-ID is CWE-189.

The vulnerability arises from the use of the `cairo_mask` function, which takes a pattern as an argument. The pattern is created from the `maskImage` surface, which is created from the `maskBuffer` buffer. The `maskBuffer` buffer is created by iterating over the `maskImgStr` stream and copying the data into the `maskBuffer` buffer.

The vulnerability occurs when the `maskImgStr` stream contains a large amount of data, causing the `maskBuffer` buffer to overflow. This can be exploited by sending a specially crafted PDF file that contains a large amount of data in the `maskImgStr` stream, causing the buffer to overflow and leading to a denial of service or arbitrary code execution.

To mitigate this vulnerability, the code should ensure that the `maskBuffer` buffer is large enough to hold the data from the `maskImgStr` stream, and that the `maskBuffer` buffer is properly initialized before being used. Additionally, the code should ensure that the `maskImgStr` stream is properly closed after use to prevent any potential resource leaks.","The code contains a DoS_Exec_Code_Overflow vulnerability. 
The CVE-ID is CVE-2009-3605. The CWE-ID is CWE-189.
Vulnerability summary:
Multiple integer overflows in Poppler 0.10.5 and earlier allow remote attackers to cause a denial of service (application crash) or possibly execute arbitrary code via a crafted PDF file, related to (1) glib/poppler-page.cc; (2) ArthurOutputDev.cc, (3) CairoOutputDev.cc, (4) GfxState.cc, (5) JBIG2Stream.cc, (6) PSOutputDev.cc, and (7) SplashOutputDev.cc in poppler/; and (8) SplashBitmap.cc, (9) Splash.cc, and (10) SplashFTFont.cc in splash/.  NOTE: this may overlap CVE-2009-0791.
",3.0,966.0,6.0,3.2021212577819824
177779,DoS Exec Code Overflow,"  YES, the given code is vulnerable to a DoS_Exec_Code_Overflow vulnerability. The CVE-ID is CVE-2009-3605. The CWE-ID is CWE-189.

The vulnerability arises from the use of the `cairo_mask` function, which takes a pattern as an argument. The pattern is created from the `maskImage` surface, which is created from the `maskBuffer` buffer. The `maskBuffer` buffer is created by copying the `maskImgStr` stream into it, which can potentially lead to a buffer overflow if the stream is too large.

The vulnerability can be exploited by sending a crafted PDF file with a large mask image, which can cause the `maskBuffer` buffer to overflow and potentially execute arbitrary code. This can lead to a denial-of-service (DoS) vulnerability, as well as an execution of arbitrary code.

To fix this vulnerability, the code should ensure that the `maskBuffer` buffer is large enough to hold the data from the `maskImgStr` stream, and that the `maskImgStr` stream is properly validated to prevent buffer overflows.","The code contains a DoS_Exec_Code_Overflow vulnerability. 
The CVE-ID is CVE-2009-3605. The CWE-ID is CWE-189.
Vulnerability summary:
Multiple integer overflows in Poppler 0.10.5 and earlier allow remote attackers to cause a denial of service (application crash) or possibly execute arbitrary code via a crafted PDF file, related to (1) glib/poppler-page.cc; (2) ArthurOutputDev.cc, (3) CairoOutputDev.cc, (4) GfxState.cc, (5) JBIG2Stream.cc, (6) PSOutputDev.cc, and (7) SplashOutputDev.cc in poppler/; and (8) SplashBitmap.cc, (9) Splash.cc, and (10) SplashFTFont.cc in splash/.  NOTE: this may overlap CVE-2009-0791.
",4.0,932.0,6.0,2.9207279682159424
177780,DoS Exec Code Overflow,"  YES, the given code is vulnerable to a DoS_Exec_Code_Overflow vulnerability. The CVE-ID is CVE-2009-3605. The CWE-ID is CWE-189.

The vulnerability arises from the use of integer overflows in the code. The function takes an integer input 'bitsA' and uses it to calculate the maximum value of a pixel (maxPixel). If the value of 'bitsA' is too large, it can cause an integer overflow, leading to an incorrect calculation of'maxPixel'. This can result in a buffer overflow when the function tries to access memory outside the allocated bounds.

The vulnerability can be exploited by sending a crafted PDF file with a large value for 'bitsA', causing the function to overflow and access unallocated memory. This can lead to a denial-of-service (DoS) vulnerability, as the application may crash or behave unexpectedly.

To fix the vulnerability, the code should ensure that the value of 'bitsA' is properly validated and that it does not exceed the maximum value of'maxPixel'. Additionally, the code should use appropriate bounds checking to prevent writing or reading outside the allocated memory space.","The code contains a DoS_Exec_Code_Overflow vulnerability. 
The CVE-ID is CVE-2009-3605. The CWE-ID is CWE-189.
Vulnerability summary:
Multiple integer overflows in Poppler 0.10.5 and earlier allow remote attackers to cause a denial of service (application crash) or possibly execute arbitrary code via a crafted PDF file, related to (1) glib/poppler-page.cc; (2) ArthurOutputDev.cc, (3) CairoOutputDev.cc, (4) GfxState.cc, (5) JBIG2Stream.cc, (6) PSOutputDev.cc, and (7) SplashOutputDev.cc in poppler/; and (8) SplashBitmap.cc, (9) Splash.cc, and (10) SplashFTFont.cc in splash/.  NOTE: this may overlap CVE-2009-0791.
",3.0,946.0,6.0,1.3572280406951904
