case_id,vuln_type,audit_report,gt,eval_score,eval_input_token_num,eval_output_token_num,eval_inference_time
177880,Bypass,"  NO. The code is not vulnerable to a bypass vulnerability. The function is designed to check if a file name is allowed to be accessed based on a set of permissions. The function uses a simple string matching algorithm to check if the file name matches any of the permissions. The function also checks if the file name starts with a certain number of parent references, and if the permission starts with ""./"", absolute paths are not permitted. The function also checks if the permission starts with ""./"", relative paths with no ""./"" are allowed as well as with ""./"". The function returns an error if the file name is not allowed to be accessed.","The code contains a Bypass vulnerability. 
The CVE-ID is CVE-2018-15908. The CWE-ID is nan.
Vulnerability summary:
In Artifex Ghostscript 9.23 before 2018-08-23, attackers are able to supply malicious PostScript files to bypass .tempfile restrictions and write files.
",1.0,716.0,6.0,3.3522632122039795
177881,DoS,"  NO. The code is not vulnerable to a DoS attack. The function `drm_load_edid_firmware` is not exposed to the user, and it is not possible to trigger a DoS attack by calling this function. The function is only used internally by the kernel, and it is not possible to exploit this vulnerability by calling it from user space.","The code contains a DoS vulnerability. 
The CVE-ID is CVE-2019-12382. The CWE-ID is CWE-476.
Vulnerability summary:
An issue was discovered in drm_load_edid_firmware in drivers/gpu/drm/drm_edid_load.c in the Linux kernel through 5.1.5. There is an unchecked kstrdup of fwstr, which might allow an attacker to cause a denial of service (NULL pointer dereference and system crash).
",1.0,700.0,6.0,1.3260908126831055
177883,,"  NO, the given code is not vulnerable to any security vulnerabilities. It is a function that takes in a struct t_weechat_plugin, struct t_gui_buffer, const char *tags, const char *message, int strip_colors, t_hook_callback_print *callback, void *callback_data, and returns a new_hook. It is not vulnerable to any security vulnerabilities.","The code contains a nan vulnerability. 
The CVE-ID is CVE-2011-1428. The CWE-ID is CWE-20.
Vulnerability summary:
Wee Enhanced Environment for Chat (aka WeeChat) 0.3.4 and earlier does not properly verify that the server hostname matches the domain name of the subject of an X.509 certificate, which allows man-in-the-middle attackers to spoof an SSL chat server via an arbitrary certificate, related to incorrect use of the GnuTLS API.
",1.0,697.0,6.0,5.3333611488342285
177887,DoS Overflow,"  NO, the given code is not vulnerable to a DoS_Overflow vulnerability. The code is a function that allocates memory for a given size and returns a pointer to the allocated memory. It does not contain any integer overflows or underflows, and it does not have any other known vulnerabilities.","The code contains a DoS_Overflow vulnerability. 
The CVE-ID is CVE-2015-3228. The CWE-ID is CWE-189.
Vulnerability summary:
Integer overflow in the gs_heap_alloc_bytes function in base/gsmalloc.c in Ghostscript 9.15 and earlier allows remote attackers to cause a denial of service (crash) via a crafted Postscript (ps) file, as demonstrated by using the ps2pdf command, which triggers an out-of-bounds read or write.
",1.0,684.0,6.0,3.6429314613342285
177891,DoS,  NO,"The code contains a DoS vulnerability. 
The CVE-ID is CVE-2015-3194. The CWE-ID is nan.
Vulnerability summary:
crypto/rsa/rsa_ameth.c in OpenSSL 1.0.1 before 1.0.1q and 1.0.2 before 1.0.2e allows remote attackers to cause a denial of service (NULL pointer dereference and application crash) via an RSA PSS ASN.1 signature that lacks a mask generation function parameter.
",1.0,629.0,6.0,2.942903757095337
177893,+Info,  NO,"The code contains a +Info vulnerability. 
The CVE-ID is CVE-2015-3193. The CWE-ID is CWE-200.
Vulnerability summary:
The Montgomery squaring implementation in crypto/bn/asm/x86_64-mont5.pl in OpenSSL 1.0.2 before 1.0.2e on the x86_64 platform, as used by the BN_mod_exp function, mishandles carry propagation and produces incorrect output, which makes it easier for remote attackers to obtain sensitive private-key information via an attack against use of a (1) Diffie-Hellman (DH) or (2) Diffie-Hellman Ephemeral (DHE) ciphersuite.
",1.0,676.0,6.0,1.4644317626953125
177896,,  NO,"The code contains a nan vulnerability. 
The CVE-ID is CVE-2013-2007. The CWE-ID is CWE-264.
Vulnerability summary:
The qemu guest agent in Qemu 1.4.1 and earlier, as used by Xen, when started in daemon mode, uses weak permissions for certain files, which allows local users to read and write to these files.
",1.0,609.0,6.0,1.491605520248413
177897,+Info,"  NO, the given code is not vulnerable to any of the security vulnerabilities you mentioned.

The code is a C++ function that takes in a filename as a string and returns an XML document. It uses the libxml2 library to parse the XML file and create an XML document. The function does not appear to have any vulnerabilities related to buffer overflow, use after free, memory leaks, integer overflow/underflow, null pointer dereference, improper input validation, race conditions, insecure function usage, insecure resource management, improper error handling, cryptographic issues, or sensitive data exposure.

However, it is possible that the function could be vulnerable to other types of security vulnerabilities, such as cross-site scripting (XSS) or cross-site request forgery (CSRF), depending on how the function is used and the context in which it is executed.","The code contains a +Info vulnerability. 
The CVE-ID is CVE-2013-1824. The CWE-ID is CWE-200.
Vulnerability summary:
The SOAP parser in PHP before 5.3.22 and 5.4.x before 5.4.12 allows remote attackers to read arbitrary files via a SOAP WSDL file containing an XML external entity declaration in conjunction with an entity reference, related to an XML External Entity (XXE) issue in the soap_xmlParseFile and soap_xmlParseMemory functions.
",1.0,805.0,6.0,1.373647689819336
177898,+Info,"  NO, the given code is not vulnerable to any security vulnerabilities.

The code is a C++ function that takes in a buffer of memory and a size, and returns an XML document. It uses the libxml2 library to parse the XML document. The function does not appear to have any security vulnerabilities, as it does not perform any user input validation or sanitation, and it does not use any insecure functions or libraries.

However, it is important to note that the code is not secure because it does not properly handle errors or exceptions. If an error occurs during the parsing process, the function does not properly handle it and may crash or return an incorrect result. Additionally, the function does not properly close or release any resources, which could lead to memory leaks or other issues.","The code contains a +Info vulnerability. 
The CVE-ID is CVE-2013-1824. The CWE-ID is CWE-200.
Vulnerability summary:
The SOAP parser in PHP before 5.3.22 and 5.4.x before 5.4.12 allows remote attackers to read arbitrary files via a SOAP WSDL file containing an XML external entity declaration in conjunction with an entity reference, related to an XML External Entity (XXE) issue in the soap_xmlParseFile and soap_xmlParseMemory functions.
",1.0,784.0,6.0,2.9799928665161133
177899,+Info,"  NO, the given code is not vulnerable to any security vulnerabilities.

The code is a C++ function that takes in a filename as a string and returns an XML document. It uses the libxml2 library to parse the XML file and create an XML document. The function does not appear to have any security vulnerabilities, as it does not perform any user input validation or sanitation, and it does not use any insecure functions or libraries.

However, it is important to note that the function does not perform any error handling or input validation, which could lead to unexpected behavior or security vulnerabilities if the input is not valid or if there are errors during parsing. Additionally, the function does not properly close or release any resources, which could lead to memory leaks or other issues.","The code contains a +Info vulnerability. 
The CVE-ID is CVE-2013-1824. The CWE-ID is CWE-200.
Vulnerability summary:
The SOAP parser in PHP before 5.3.22 and 5.4.x before 5.4.12 allows remote attackers to read arbitrary files via a SOAP WSDL file containing an XML external entity declaration in conjunction with an entity reference, related to an XML External Entity (XXE) issue in the soap_xmlParseFile and soap_xmlParseMemory functions.
",1.0,788.0,6.0,1.8480212688446045
177900,+Info,"  NO. The code is not vulnerable to any of the security vulnerabilities listed. It is a valid C++ code that uses the libxml2 library to parse an XML document. The code does not contain any buffer overflow, use after free, memory leak, integer overflow/underflow, null pointer dereference, improper input validation, race condition, insecure function usage, insecure resource management, improper error handling, cryptographic issues, or sensitive data exposure vulnerabilities.","The code contains a +Info vulnerability. 
The CVE-ID is CVE-2013-1824. The CWE-ID is CWE-200.
Vulnerability summary:
The SOAP parser in PHP before 5.3.22 and 5.4.x before 5.4.12 allows remote attackers to read arbitrary files via a SOAP WSDL file containing an XML external entity declaration in conjunction with an entity reference, related to an XML External Entity (XXE) issue in the soap_xmlParseFile and soap_xmlParseMemory functions.
",1.0,720.0,6.0,2.5731360912323
177901,Overflow,"  NO. The code is not vulnerable to buffer overflow. The function takes two parameters, v and str, and the buffer size is determined by the size of the str parameter. The function does not attempt to write beyond the bounds of the str parameter, and it does not attempt to read beyond the bounds of the v parameter. Therefore, there is no buffer overflow vulnerability.","The code contains a Overflow vulnerability. 
The CVE-ID is CVE-2015-2806. The CWE-ID is CWE-119.
Vulnerability summary:
Stack-based buffer overflow in asn1_der_decoding in libtasn1 before 4.4 allows remote attackers to have unspecified impact via unknown vectors.
",1.0,666.0,6.0,1.2979207038879395
177904,DoS,"  NO. The code is not vulnerable to a DoS attack. The function is not vulnerable to a DoS attack because it does not have any input validation or sanitation. The function takes in a vector of vectors of integers as an argument, and it does not check if the input is valid or not. Therefore, an attacker can potentially pass in a vector of vectors of integers that is too large, leading to a stack overflow. However, the function does not have any input validation or sanitation, so it is not vulnerable to a DoS attack.","The code contains a DoS vulnerability. 
The CVE-ID is CVE-2013-1789. The CWE-ID is nan.
Vulnerability summary:
splash/Splash.cc in poppler before 0.22.1 allows context-dependent attackers to cause a denial of service (NULL pointer dereference and crash) via vectors related to the (1) Splash::arbitraryTransformMask, (2) Splash::blitMask, and (3) Splash::scaleMaskYuXu functions.
",1.0,738.0,6.0,1.3523905277252197
177905,DoS,"  YES, the code is vulnerable to a denial of service (DoS) attack. The vulnerability is caused by the use of uninitialized memory in the `scaledMask` variable. The `scaleMask` function is called with uninitialized `srcData` and `srcWidth` parameters, which can lead to a buffer overflow and a use-after-free error. This can cause the application to crash or execute arbitrary code, leading to a denial of service.","The code contains a DoS vulnerability. 
The CVE-ID is CVE-2013-1789. The CWE-ID is nan.
Vulnerability summary:
splash/Splash.cc in poppler before 0.22.1 allows context-dependent attackers to cause a denial of service (NULL pointer dereference and crash) via vectors related to the (1) Splash::arbitraryTransformMask, (2) Splash::blitMask, and (3) Splash::scaleMaskYuXu functions.
",4.0,712.0,6.0,3.208580255508423
177906,DoS Exec Code Overflow,"  YES, the given code is vulnerable to a DoS_Exec_Code_Overflow vulnerability. The CVE-ID is CVE-2013-1788. The CWE-ID is CWE-119.

The vulnerability arises from the use of the `splashFloor` function, which is used to calculate the index of the line dash pattern. The function takes a floating-point number as input and returns the largest integer less than or equal to that number. However, the function does not check for overflows, which can occur if the input value is too large.

If the input value is too large, the function will return a value that is not the largest integer less than or equal to the input value, but rather a value that is too large to fit in the integer range. This can cause the `lineDashStartIdx` variable to take on a value that is not within the bounds of the `state->lineDash` array, leading to a buffer overflow.

The buffer overflow can cause the program to write to memory locations that it is not authorized to access, potentially leading to arbitrary code execution. This can be exploited by an attacker to execute malicious code with elevated privileges, leading to a denial-of-service (DoS) vulnerability.

To fix this vulnerability, the `splashFloor` function","The code contains a DoS_Exec_Code_Overflow vulnerability. 
The CVE-ID is CVE-2013-1788. The CWE-ID is CWE-119.
Vulnerability summary:
poppler before 0.22.1 allows context-dependent attackers to cause a denial of service (crash) and possibly execute arbitrary code via vectors that trigger an ""invalid memory access"" in (1) splash/Splash.cc, (2) poppler/Function.cc, and (3) poppler/Stream.cc.
",3.0,893.0,6.0,1.242689847946167
177907,DoS Exec Code Overflow,  NO,"The code contains a DoS_Exec_Code_Overflow vulnerability. 
The CVE-ID is CVE-2013-1788. The CWE-ID is CWE-119.
Vulnerability summary:
poppler before 0.22.1 allows context-dependent attackers to cause a denial of service (crash) and possibly execute arbitrary code via vectors that trigger an ""invalid memory access"" in (1) splash/Splash.cc, (2) poppler/Function.cc, and (3) poppler/Stream.cc.
",1.0,627.0,6.0,3.478710651397705
177909,DoS Exec Code Overflow,  NO,"The code contains a DoS_Exec_Code_Overflow vulnerability. 
The CVE-ID is CVE-2013-1788. The CWE-ID is CWE-119.
Vulnerability summary:
poppler before 0.22.1 allows context-dependent attackers to cause a denial of service (crash) and possibly execute arbitrary code via vectors that trigger an ""invalid memory access"" in (1) splash/Splash.cc, (2) poppler/Function.cc, and (3) poppler/Stream.cc.
",1.0,627.0,6.0,3.6103320121765137
177910,DoS,"  NO. The code is not vulnerable to a DoS attack. The function `highestRankedKItems` takes in a grid, pricing, and start, and returns the highest ranked k items in the grid. The function does not have any vulnerabilities that could cause a DoS attack.","The code contains a DoS vulnerability. 
The CVE-ID is CVE-2017-11714. The CWE-ID is CWE-125.
Vulnerability summary:
psi/ztoken.c in Artifex Ghostscript 9.21 mishandles references to the scanner state structure, which allows remote attackers to cause a denial of service (application crash) or possibly have unspecified other impact via a crafted PostScript document, related to an out-of-bounds read in the igc_reloc_struct_ptr function in psi/igc.c.
",1.0,688.0,6.0,3.798811674118042
177911,Exec Code Overflow,  NO. The code is not vulnerable to Exec Code Overflow.,"The code contains a Exec_Code_Overflow vulnerability. 
The CVE-ID is CVE-2009-0946. The CWE-ID is CWE-189.
Vulnerability summary:
Multiple integer overflows in FreeType 2.3.9 and earlier allow remote attackers to execute arbitrary code via vectors related to large values in certain inputs in (1) smooth/ftsmooth.c, (2) sfnt/ttcmap.c, and (3) cff/cffload.c.
",1.0,631.0,6.0,2.932544231414795
177912,Exec Code Overflow,"  NO. The code is not vulnerable to Exec Code Overflow.

The function `highestRankedKItems` takes in a grid, pricing, and start, and returns the highest ranked k items in the grid. The function uses a BFS to traverse the grid and find the highest ranked k items. The function does not have any buffer overflow vulnerabilities.

The function does have some other issues, such as:

* The function uses a static variable `directions` to store the directions to move in the grid. This can lead to issues if the function is called multiple times in the same program, as the `directions` variable will be reused.
* The function uses a `compare` function to sort the results. This can lead to issues if the `compare` function is not properly defined.
* The function uses a `result` vector to store the results. This can lead to issues if the `result` vector is not properly resized.

However, these issues are not related to buffer overflows.","The code contains a Exec_Code_Overflow vulnerability. 
The CVE-ID is CVE-2009-0946. The CWE-ID is CWE-189.
Vulnerability summary:
Multiple integer overflows in FreeType 2.3.9 and earlier allow remote attackers to execute arbitrary code via vectors related to large values in certain inputs in (1) smooth/ftsmooth.c, (2) sfnt/ttcmap.c, and (3) cff/cffload.c.
",1.0,820.0,6.0,2.657113552093506
177913,Exec Code Overflow,"  YES, the code is vulnerable to an Exec Code Overflow vulnerability. The CVE-ID is CVE-2009-0946. The CWE-ID is CWE-189.

The vulnerability arises from the use of the `TT_NEXT_ULONG` macro, which reads the next 32-bit value from the input buffer without performing any bounds checking. This allows an attacker to overflow the buffer and execute arbitrary code.

To exploit this vulnerability, an attacker would need to provide a specially crafted input that causes the `TT_NEXT_ULONG` macro to read beyond the end of the input buffer. This can be done by providing a large value for the `length` parameter, which is used as the size of the input buffer. If the `length` value is too large, the `TT_NEXT_ULONG` macro will read beyond the end of the buffer, leading to an overflow.

The vulnerability can be mitigated by properly validating the input buffer size and ensuring that the `length` parameter is not too large. Additionally, the `TT_NEXT_ULONG` macro should be replaced with a safer alternative that performs bounds checking.","The code contains a Exec_Code_Overflow vulnerability. 
The CVE-ID is CVE-2009-0946. The CWE-ID is CWE-189.
Vulnerability summary:
Multiple integer overflows in FreeType 2.3.9 and earlier allow remote attackers to execute arbitrary code via vectors related to large values in certain inputs in (1) smooth/ftsmooth.c, (2) sfnt/ttcmap.c, and (3) cff/cffload.c.
",4.0,843.0,6.0,3.4097795486450195
177915,Exec Code Overflow,"  YES, the code is vulnerable to an Exec Code Overflow vulnerability. The CVE-ID is CVE-2009-0946. The CWE-ID is CWE-189.

The vulnerability arises from the use of the `vector<vector<int>> highestRankedKItems` function, which takes a grid, pricing, and start as input and returns the highest ranked k items in the grid. The function uses a BFS algorithm to traverse the grid and find the highest ranked k items. However, the function does not properly check the size of the grid and the number of items in the grid, which can lead to an overflow if the grid is too large or the number of items is too high.

The vulnerability can be exploited by providing a large grid and a large number of items, which can cause the function to overflow and execute arbitrary code. This can lead to a Denial of Service (DoS) attack or a remote code execution vulnerability.

To fix the vulnerability, the function should properly check the size of the grid and the number of items in the grid before traversing the grid. Additionally, the function should use a safer data structure such as a vector of pairs instead of a vector of vectors to store the items.","The code contains a Exec_Code_Overflow vulnerability. 
The CVE-ID is CVE-2009-0946. The CWE-ID is CWE-189.
Vulnerability summary:
Multiple integer overflows in FreeType 2.3.9 and earlier allow remote attackers to execute arbitrary code via vectors related to large values in certain inputs in (1) smooth/ftsmooth.c, (2) sfnt/ttcmap.c, and (3) cff/cffload.c.
",4.0,864.0,6.0,6.46895694732666
177917,Exec Code,  NO. The code is not vulnerable to Exec_Code.,"The code contains a Exec_Code vulnerability. 
The CVE-ID is CVE-2018-14600. The CWE-ID is CWE-787.
Vulnerability summary:
An issue was discovered in libX11 through 1.6.5. The function XListExtensions in ListExt.c interprets a variable as signed instead of unsigned, resulting in an out-of-bounds write (of up to 128 bytes), leading to DoS or remote code execution.
",1.0,625.0,6.0,3.0793378353118896
177918,Exec Code,  NO. The code is not vulnerable to Exec_Code.,"The code contains a Exec_Code vulnerability. 
The CVE-ID is CVE-2018-14600. The CWE-ID is CWE-787.
Vulnerability summary:
An issue was discovered in libX11 through 1.6.5. The function XListExtensions in ListExt.c interprets a variable as signed instead of unsigned, resulting in an out-of-bounds write (of up to 128 bytes), leading to DoS or remote code execution.
",1.0,625.0,6.0,3.3606011867523193
177919,,"  YES, the code is vulnerable to a buffer overflow attack. The function `XListFonts` takes a pattern as input, which can be a null-terminated string. The code then uses the `strlen` function to determine the length of the pattern, and then copies the pattern into a buffer. However, the code does not check the length of the pattern before copying it into the buffer, which means that the buffer may overflow if the pattern is too long. This can lead to a security vulnerability, as it can cause the program to write to memory outside of the buffer, potentially leading to a crash or other security issue.","The code contains a nan vulnerability. 
The CVE-ID is CVE-2018-14599. The CWE-ID is CWE-682.
Vulnerability summary:
An issue was discovered in libX11 through 1.6.5. The function XListExtensions in ListExt.c is vulnerable to an off-by-one error caused by malicious server responses, leading to DoS or possibly unspecified other impact.
",2.0,728.0,6.0,2.076348304748535
177920,,  NO. The code is not vulnerable to a nan vulnerability.,"The code contains a nan vulnerability. 
The CVE-ID is CVE-2018-14599. The CWE-ID is CWE-682.
Vulnerability summary:
An issue was discovered in libX11 through 1.6.5. The function XListExtensions in ListExt.c is vulnerable to an off-by-one error caused by malicious server responses, leading to DoS or possibly unspecified other impact.
",1.0,614.0,6.0,2.4787509441375732
177921,,  NO. This code is not vulnerable to a nan vulnerability.,"The code contains a nan vulnerability. 
The CVE-ID is CVE-2018-14599. The CWE-ID is CWE-682.
Vulnerability summary:
An issue was discovered in libX11 through 1.6.5. The function XListExtensions in ListExt.c is vulnerable to an off-by-one error caused by malicious server responses, leading to DoS or possibly unspecified other impact.
",1.0,621.0,6.0,1.3977766036987305
177922,Exec Code Overflow,"  YES, the code is vulnerable to a buffer overflow attack. The function `add_param_to_argv` has a buffer overflow vulnerability because it does not check the size of the `param_buffer` array before copying data into it. This means that if the input string is longer than the buffer size, it will overwrite the memory beyond the buffer, leading to unpredictable behavior.

The vulnerability is related to CWE-120, which is a type of buffer overflow vulnerability. The function `add_param_to_argv` does not properly check the size of the `param_buffer` array before copying data into it, which can lead to a buffer overflow.

The CVE-ID for this vulnerability is CVE-2019-11360.","The code contains a Exec_Code_Overflow vulnerability. 
The CVE-ID is CVE-2019-11360. The CWE-ID is CWE-119.
Vulnerability summary:
A buffer overflow in iptables-restore in netfilter iptables 1.8.2 allows an attacker to (at least) crash the program or potentially gain code execution via a specially crafted iptables-save file. This is related to add_param_to_argv in xshared.c.
",3.0,759.0,6.0,2.984888792037964
177923,Bypass,"  NO, the given code is not vulnerable to a bypass vulnerability. The code checks the input parameters for null or empty values, and it also checks the length of the input parameters to ensure that they are within the expected range. Additionally, the code uses the `zend_parse_parameters` function to parse the input parameters, which checks for null or empty values and ensures that the input parameters are of the expected type.

Therefore, the code does not contain any vulnerabilities related to bypassing input validation.","The code contains a Bypass vulnerability. 
The CVE-ID is CVE-2015-2348. The CWE-ID is CWE-264.
Vulnerability summary:
The move_uploaded_file implementation in ext/standard/basic_functions.c in PHP before 5.4.39, 5.5.x before 5.5.23, and 5.6.x before 5.6.7 truncates a pathname upon encountering a \x00 character, which allows remote attackers to bypass intended extension restrictions and create files with unexpected names via a crafted second argument.  NOTE: this vulnerability exists because of an incomplete fix for CVE-2006-7243.
",1.0,754.0,6.0,2.5869040489196777
