case_id,vuln_type,audit_report,gt,eval_score,eval_input_token_num,eval_output_token_num,eval_inference_time
177825,DoS,"  NO, the given code is not vulnerable to a DoS attack.

The code does not contain any vulnerabilities related to format string manipulation, as it does not use any format strings or format specifiers. The code also does not contain any vulnerabilities related to memory management, as it does not allocate or deallocate memory dynamically.

The code does contain a vulnerability related to integer overflow, as it uses the `snprintf` function to format a string with a maximum length of 4096 characters. If the destination filename is longer than 4096 characters, the `snprintf` function will write past the end of the buffer, leading to a buffer overflow. However, this vulnerability is not exploitable in this specific code snippet, as the destination filename is not user-supplied and is not longer than 4096 characters.","The code contains a DoS vulnerability. 
The CVE-ID is CVE-2013-4474. The CWE-ID is CWE-20.
Vulnerability summary:
Format string vulnerability in the extractPages function in utils/pdfseparate.cc in poppler before 0.24.3 allows remote attackers to cause a denial of service (crash) via format string specifiers in a destination filename.
",2.0,773.0,6.0,1.276010513305664
177826,DoS Exec Code Overflow,  NO. The code is not vulnerable to a DoS_Exec_Code_Overflow vulnerability. The function does not have any buffer overflow vulnerabilities.,"The code contains a DoS_Exec_Code_Overflow vulnerability. 
The CVE-ID is CVE-2013-4473. The CWE-ID is CWE-119.
Vulnerability summary:
Stack-based buffer overflow in the extractPages function in utils/pdfseparate.cc in poppler before 0.24.2 allows remote attackers to cause a denial of service (crash) and possibly execute arbitrary code via a source filename.
",1.0,642.0,6.0,1.3764822483062744
177827,,  NO. The code is not vulnerable to a nan vulnerability.,"The code contains a nan vulnerability. 
The CVE-ID is CVE-2007-4849. The CWE-ID is CWE-264.
Vulnerability summary:
JFFS2, as used on One Laptop Per Child (OLPC) build 542 and possibly other Linux systems, when POSIX ACL support is enabled, does not properly store permissions during (1) inode creation or (2) ACL setting, which might allow local users to access restricted files or directories after a remount of a filesystem, related to ""legacy modes"" and an inconsistency between dentry permissions and inode permissions.
",1.0,653.0,6.0,3.615588665008545
177831,,  NO. The code is not vulnerable to a nan vulnerability.,"The code contains a nan vulnerability. 
The CVE-ID is CVE-2019-14975. The CWE-ID is CWE-125.
Vulnerability summary:
Artifex MuPDF before 1.16.0 has a heap-based buffer over-read in fz_chartorune in fitz/string.c because pdf/pdf-op-filter.c does not check for a missing string.
",1.0,616.0,6.0,1.3939085006713867
177832,,  NO. The code is not vulnerable to a nan vulnerability.,"The code contains a nan vulnerability. 
The CVE-ID is CVE-2019-14975. The CWE-ID is CWE-125.
Vulnerability summary:
Artifex MuPDF before 1.16.0 has a heap-based buffer over-read in fz_chartorune in fitz/string.c because pdf/pdf-op-filter.c does not check for a missing string.
",1.0,616.0,6.0,1.3997433185577393
177833,DoS Overflow,  NO. The code is not vulnerable to a DoS overflow. The function reds_handle_ticket is not vulnerable to a DoS overflow because it does not use any stack-based buffer overflow vulnerabilities.,"The code contains a DoS_Overflow vulnerability. 
The CVE-ID is CVE-2013-4282. The CWE-ID is CWE-119.
Vulnerability summary:
Stack-based buffer overflow in the reds_handle_ticket function in server/reds.c in SPICE 0.12.0 allows remote attackers to cause a denial of service (crash) via a long password in a SPICE ticket.
",1.0,641.0,6.0,4.601908445358276
177839,+Info,"  NO, the code is not vulnerable to any of the security vulnerabilities you mentioned.

The code is using the `smb_iconv` function to convert a string from one character set to another. The function takes a descriptor as its first argument, which is a handle to the conversion descriptor. The code is using the `get_conv_handle` function to get the descriptor, which is a static function that returns a handle to the conversion descriptor.

The code is also using the `smb_iconv` function to convert the string to UTF-16 format. The function takes a descriptor as its first argument, which is the conversion descriptor obtained from the `get_conv_handle` function. The function also takes a pointer to the input string as its second argument, a pointer to the output buffer as its third argument, and a pointer to the number of bytes written as its fourth argument.

The code is checking the length of the input string and the number of bytes written by the `smb_iconv` function to determine if the conversion was successful. If the number of bytes written is less than the length of the input string, the conversion was successful. If the number of bytes written is greater than the length of the input string, the conversion was not successful.

The code is also checking the length of the output string to determine if it is a valid UTF-16 character","The code contains a +Info vulnerability. 
The CVE-ID is CVE-2015-5330. The CWE-ID is CWE-200.
Vulnerability summary:
ldb before 1.1.24, as used in the AD LDAP server in Samba 4.x before 4.1.22, 4.2.x before 4.2.7, and 4.3.x before 4.3.3, mishandles string lengths, which allows remote attackers to obtain sensitive information from daemon heap memory by sending crafted packets and then reading (1) an error message or (2) a database value.
",1.0,931.0,6.0,1.2154321670532227
177840,+Info,"  NO. The code is not vulnerable to any of the security vulnerabilities listed. It is a correct implementation of the `ldb_dn_escape_internal` function, and it does not contain any of the vulnerabilities listed.","The code contains a +Info vulnerability. 
The CVE-ID is CVE-2015-5330. The CWE-ID is CWE-200.
Vulnerability summary:
ldb before 1.1.24, as used in the AD LDAP server in Samba 4.x before 4.1.22, 4.2.x before 4.2.7, and 4.3.x before 4.3.3, mishandles string lengths, which allows remote attackers to obtain sensitive information from daemon heap memory by sending crafted packets and then reading (1) an error message or (2) a database value.
",1.0,690.0,6.0,2.3125736713409424
177841,+Info,"  NO. The code is not vulnerable to any of the security vulnerabilities you mentioned. It is a function that takes a string and converts it to uppercase using the `toupper_m` function. It does not involve any user input or external data, and it does not have any known vulnerabilities.","The code contains a +Info vulnerability. 
The CVE-ID is CVE-2015-5330. The CWE-ID is CWE-200.
Vulnerability summary:
ldb before 1.1.24, as used in the AD LDAP server in Samba 4.x before 4.1.22, 4.2.x before 4.2.7, and 4.3.x before 4.3.3, mishandles string lengths, which allows remote attackers to obtain sensitive information from daemon heap memory by sending crafted packets and then reading (1) an error message or (2) a database value.
",1.0,706.0,6.0,3.2028286457061768
177842,+Info,"  NO. The code is not vulnerable to any of the security vulnerabilities you mentioned. It is a function that takes in a string, a source charset, and a pointer to a size_t variable, and returns the next codepoint in the string. It does not appear to have any security vulnerabilities.","The code contains a +Info vulnerability. 
The CVE-ID is CVE-2015-5330. The CWE-ID is CWE-200.
Vulnerability summary:
ldb before 1.1.24, as used in the AD LDAP server in Samba 4.x before 4.1.22, 4.2.x before 4.2.7, and 4.3.x before 4.3.3, mishandles string lengths, which allows remote attackers to obtain sensitive information from daemon heap memory by sending crafted packets and then reading (1) an error message or (2) a database value.
",1.0,708.0,6.0,3.3094093799591064
177843,+Info,  NO. The code is not vulnerable to any of the security vulnerabilities listed. It is a correct implementation of the strlen_m_ext_handle function.,"The code contains a +Info vulnerability. 
The CVE-ID is CVE-2015-5330. The CWE-ID is CWE-200.
Vulnerability summary:
ldb before 1.1.24, as used in the AD LDAP server in Samba 4.x before 4.1.22, 4.2.x before 4.2.7, and 4.3.x before 4.3.3, mishandles string lengths, which allows remote attackers to obtain sensitive information from daemon heap memory by sending crafted packets and then reading (1) an error message or (2) a database value.
",1.0,684.0,6.0,1.1787443161010742
177844,+Info,"  NO. The code is not vulnerable to any of the security vulnerabilities listed in the previous question. It is a correct implementation of the `strupper_talloc_n_handle` function, which is used to convert a string to uppercase using the `talloc` library. The function takes a `struct smb_iconv_handle` as an argument, which is used to handle the conversion. The function also takes a `TALLOC_CTX` as an argument, which is used to allocate memory for the converted string. The function returns a pointer to the converted string.

The code does not contain any vulnerabilities related to buffer overflow, use after free, memory leaks, integer overflow/underflow, null pointer dereference, improper input validation, race conditions, insecure function usage, insecure resource management, improper error handling, cryptographic issues, or sensitive data exposure.

Therefore, the code is not vulnerable to any of the security vulnerabilities listed in the previous question.","The code contains a +Info vulnerability. 
The CVE-ID is CVE-2015-5330. The CWE-ID is CWE-200.
Vulnerability summary:
ldb before 1.1.24, as used in the AD LDAP server in Samba 4.x before 4.1.22, 4.2.x before 4.2.7, and 4.3.x before 4.3.3, mishandles string lengths, which allows remote attackers to obtain sensitive information from daemon heap memory by sending crafted packets and then reading (1) an error message or (2) a database value.
",1.0,837.0,6.0,3.1376953125
177848,,  NO. The code is not vulnerable to a nan vulnerability.,"The code contains a nan vulnerability. 
The CVE-ID is CVE-2015-5296. The CWE-ID is CWE-20.
Vulnerability summary:
Samba 3.x and 4.x before 4.1.22, 4.2.x before 4.2.7, and 4.3.x before 4.3.3 supports connections that are encrypted but unsigned, which allows man-in-the-middle attackers to conduct encrypted-to-unencrypted downgrade attacks by modifying the client-server data stream, related to clidfs.c, libsmb_server.c, and smbXcli_base.c.
",1.0,665.0,6.0,1.280625343322754
177850,DoS Overflow,"  NO, the given code is not vulnerable to a DoS_Overflow vulnerability. The code does not contain any buffer overflow vulnerabilities.","The code contains a DoS_Overflow vulnerability. 
The CVE-ID is CVE-2015-5289. The CWE-ID is CWE-119.
Vulnerability summary:
Multiple stack-based buffer overflows in json parsing in PostgreSQL before 9.3.x before 9.3.10 and 9.4.x before 9.4.5 allow attackers to cause a denial of service (server crash) via unspecified vectors, which are not properly handled in (1) json or (2) jsonb values.
",1.0,661.0,6.0,1.4295809268951416
177851,DoS Overflow,"  NO, the given code is not vulnerable to a DoS_Overflow vulnerability.

The code does not contain any buffer overflow vulnerabilities, as it does not involve any user-supplied input or unchecked arithmetic operations. The only potential vulnerability is a potential use-after-free error, where the memory allocated for the array is not properly freed, leading to a memory leak. However, this vulnerability can be mitigated by using smart pointers or other memory management techniques.","The code contains a DoS_Overflow vulnerability. 
The CVE-ID is CVE-2015-5289. The CWE-ID is CWE-119.
Vulnerability summary:
Multiple stack-based buffer overflows in json parsing in PostgreSQL before 9.3.x before 9.3.10 and 9.4.x before 9.4.5 allow attackers to cause a denial of service (server crash) via unspecified vectors, which are not properly handled in (1) json or (2) jsonb values.
",2.0,718.0,6.0,3.686126947402954
177852,DoS Overflow,"  NO, the given code is not vulnerable to a DoS_Overflow vulnerability.

The code does not contain any buffer overflow vulnerabilities, as it does not involve any user-supplied input or unchecked arithmetic operations. The only potential vulnerability is a potential use-after-free error, which can occur if the memory allocated by the `new` operator is not properly freed. However, this vulnerability can be mitigated by using smart pointers or other memory management techniques.

Therefore, the code is not vulnerable to a DoS_Overflow vulnerability.","The code contains a DoS_Overflow vulnerability. 
The CVE-ID is CVE-2015-5289. The CWE-ID is CWE-119.
Vulnerability summary:
Multiple stack-based buffer overflows in json parsing in PostgreSQL before 9.3.x before 9.3.10 and 9.4.x before 9.4.5 allow attackers to cause a denial of service (server crash) via unspecified vectors, which are not properly handled in (1) json or (2) jsonb values.
",2.0,733.0,6.0,2.5290486812591553
177853,DoS Overflow,"  NO, the given code is not vulnerable to a DoS_Overflow vulnerability.

The code does not contain any buffer overflow vulnerabilities, as it does not involve any user-supplied input or unchecked arithmetic operations. The only potential vulnerability is the use of the `elog` function, which could potentially lead to a denial-of-service (DoS) attack if the error message is not properly handled. However, this is not a buffer overflow vulnerability.","The code contains a DoS_Overflow vulnerability. 
The CVE-ID is CVE-2015-5289. The CWE-ID is CWE-119.
Vulnerability summary:
Multiple stack-based buffer overflows in json parsing in PostgreSQL before 9.3.x before 9.3.10 and 9.4.x before 9.4.5 allow attackers to cause a denial of service (server crash) via unspecified vectors, which are not properly handled in (1) json or (2) jsonb values.
",2.0,724.0,6.0,1.4257283210754395
177855,Bypass,"  YES, the code is vulnerable to a Bypass vulnerability. The CVE-ID is CVE-2015-5252. The CWE-ID is CWE-264.

The vulnerability arises from the fact that the code allows a symlink to point outside of a share, which can bypass intended file-access restrictions. This can be exploited by creating a symlink that points to a file outside of the share, and then accessing the symlink. This can allow an attacker to access files outside of the share, potentially leading to sensitive data disclosure or other security issues.","The code contains a Bypass vulnerability. 
The CVE-ID is CVE-2015-5252. The CWE-ID is CWE-264.
Vulnerability summary:
vfs.c in smbd in Samba 3.x and 4.x before 4.1.22, 4.2.x before 4.2.7, and 4.3.x before 4.3.3, when share names with certain substring relationships exist, allows remote attackers to bypass intended file-access restrictions via a symlink that points outside of a share.
",3.0,745.0,6.0,3.0553507804870605
177856,,"  YES, the code is vulnerable to a buffer overflow attack. The function `highestRankedKItems` has a buffer overflow vulnerability because it uses a fixed-size array to store the results of the BFS search, which can lead to a buffer overflow if the number of results exceeds the size of the array. Additionally, the function does not check the validity of the input parameters, which can lead to a crash or other security vulnerabilities.","The code contains a nan vulnerability. 
The CVE-ID is CVE-2019-13638. The CWE-ID is CWE-78.
Vulnerability summary:
GNU patch through 2.7.6 is vulnerable to OS shell command injection that can be exploited by opening a crafted patch file that contains an ed style diff payload with shell metacharacters. The ed editor does not need to be present on the vulnerable system. This is different from CVE-2018-1000156.
",2.0,713.0,6.0,1.4382026195526123
177857,,  NO. The code is not vulnerable to a nan vulnerability.,"The code contains a nan vulnerability. 
The CVE-ID is CVE-2019-13636. The CWE-ID is CWE-59.
Vulnerability summary:
In GNU patch through 2.7.6, the following of symlinks is mishandled in certain cases other than input files. This affects inp.c and util.c.
",1.0,602.0,6.0,3.4346182346343994
177859,Exec Code Bypass,  NO. The code is not vulnerable to Exec Code Bypass.,"The code contains a Exec_Code_Bypass vulnerability. 
The CVE-ID is CVE-2018-16863. The CWE-ID is CWE-78.
Vulnerability summary:
It was found that RHSA-2018:2918 did not fully fix CVE-2018-16509. An attacker could possibly exploit another variant of the flaw and bypass the -dSAFER protection to, for example, execute arbitrary shell commands via a specially crafted PostScript document. This only affects ghostscript 9.07 as shipped with Red Hat Enterprise Linux 7.
",1.0,648.0,6.0,2.143817186355591
177860,Exec Code Bypass,"  NO, the given code is not vulnerable to Exec Code Bypass.

The code does not contain any user-input-based vulnerabilities, such as buffer overflows or use-after-free errors. It also does not contain any memory leaks or other resource management issues.

The code does contain some potential security vulnerabilities, such as integer overflows or underflows, but these are not directly related to the Exec Code Bypass vulnerability.

Therefore, I would rate this code as ""Not Vulnerable"" to Exec Code Bypass.","The code contains a Exec_Code_Bypass vulnerability. 
The CVE-ID is CVE-2018-16863. The CWE-ID is CWE-78.
Vulnerability summary:
It was found that RHSA-2018:2918 did not fully fix CVE-2018-16509. An attacker could possibly exploit another variant of the flaw and bypass the -dSAFER protection to, for example, execute arbitrary shell commands via a specially crafted PostScript document. This only affects ghostscript 9.07 as shipped with Red Hat Enterprise Linux 7.
",2.0,736.0,6.0,2.834506034851074
177862,Exec Code,"  NO, the given code is not vulnerable to Exec Code.

The code does not contain any user-supplied data, and it does not use any unsafe functions or libraries. It also does not contain any buffer overflows or other common vulnerabilities.

However, the code does contain a potential race condition in the `restore_page_device` function. If two threads call this function simultaneously, they may both try to access the same device object, which could lead to a race condition if the device object is not properly synchronized. To mitigate this, the code could use a mutex or other synchronization mechanism to ensure that only one thread can access the device object at a time.","The code contains a Exec_Code vulnerability. 
The CVE-ID is CVE-2018-16802. The CWE-ID is nan.
Vulnerability summary:
An issue was discovered in Artifex Ghostscript before 9.25. Incorrect ""restoration of privilege"" checking when running out of stack during exception handling could be used by attackers able to supply crafted PostScript to execute code using the ""pipe"" instruction. This is due to an incomplete fix for CVE-2018-16509.
",2.0,754.0,6.0,3.6667819023132324
177865,DoS,  NO,"The code contains a DoS vulnerability. 
The CVE-ID is CVE-2017-13720. The CWE-ID is CWE-125.
Vulnerability summary:
In the PatternMatch function in fontfile/fontdir.c in libXfont through 1.5.2 and 2.x before 2.0.2, an attacker with access to an X connection can cause a buffer over-read during pattern matching of fonts, leading to information disclosure or a crash (denial of service). This occurs because '\0' characters are incorrectly skipped in situations involving ? characters.
",1.0,639.0,6.0,4.778246164321899
177867,,"  NO, the given code is not vulnerable to a nan vulnerability. The code does not contain any potential buffer overflow vulnerabilities, use after free errors, memory leaks, integer overflow/underflow, null pointer dereferences, improper input validation, race conditions, insecure function usage, insecure resource management, improper error handling, cryptographic issues, or sensitive data exposure.","The code contains a nan vulnerability. 
The CVE-ID is CVE-2018-16541. The CWE-ID is CWE-416.
Vulnerability summary:
In Artifex Ghostscript before 9.24, attackers able to supply crafted PostScript files could use incorrect free logic in pagedevice replacement to crash the interpreter.
",1.0,659.0,6.0,3.625208854675293
177869,,"  NO, the given code is not vulnerable to any security vulnerabilities.

The code is a C++ function that takes in a vector of vectors of integers and a vector of integers as input, and returns a vector of vectors of integers. The function appears to be a simple implementation of a BFS algorithm, where the input vector of vectors of integers represents a grid, and the output vector of vectors of integers represents the shortest path from the starting point to the goal point in the grid.

The function does not appear to have any security vulnerabilities, as it does not involve any user input or external data. It does not appear to have any buffer overflows, use after free errors, memory leaks, integer overflows, null pointer dereferences, improper input validation, race conditions, insecure function usage, insecure resource management, improper error handling, cryptographic issues, or sensitive data exposure.

Therefore, I would say that the code is not vulnerable to any security vulnerabilities.","The code contains a nan vulnerability. 
The CVE-ID is CVE-2018-16513. The CWE-ID is CWE-704.
Vulnerability summary:
In Artifex Ghostscript before 9.24, attackers able to supply crafted PostScript files could use a type confusion in the setcolor function to crash the interpreter or possibly have unspecified other impact.
",1.0,784.0,6.0,2.2744178771972656
177870,,  NO. The code is not vulnerable to a nan vulnerability.,"The code contains a nan vulnerability. 
The CVE-ID is CVE-2018-16511. The CWE-ID is CWE-704.
Vulnerability summary:
An issue was discovered in Artifex Ghostscript before 9.24. A type confusion in ""ztype"" could be used by remote attackers able to supply crafted PostScript to crash the interpreter or possibly have unspecified other impact.
",1.0,612.0,6.0,3.1323142051696777
177874,Exec Code Overflow,"  YES, the given code is vulnerable to Exec_Code_Overflow. The CVE-ID is CVE-2018-15911. The CWE-ID is CWE-119.

The vulnerability arises from the use of uninitialized memory in the aesdecode operator. An attacker can supply crafted PostScript to exploit this vulnerability and potentially execute code.","The code contains a Exec_Code_Overflow vulnerability. 
The CVE-ID is CVE-2018-15911. The CWE-ID is CWE-119.
Vulnerability summary:
In Artifex Ghostscript 9.23 before 2018-08-24, attackers able to supply crafted PostScript could use uninitialized memory access in the aesdecode operator to crash the interpreter or potentially execute code.
",3.0,669.0,6.0,3.2451224327087402
177875,Exec Code Overflow,"  NO, the given code is not vulnerable to Exec_Code_Overflow.

The code does not contain any buffer overflow vulnerabilities, as it does not involve any string or memory functions that could potentially cause buffer overflows. Additionally, the code does not contain any use-after-free errors, as it does not involve any pointers that are used after the memory they point to has been deallocated.

Furthermore, the code does not contain any memory leaks, as it properly calls delete or free after allocating memory using new or malloc. The code also does not contain any integer overflow or underflow vulnerabilities, as it properly checks for overflow or underflow conditions and ensures that integers are validated and sanitized.

The code also does not contain any null pointer dereference vulnerabilities, as it properly checks for null pointers before dereferencing them. The code also does not contain any improper input validation vulnerabilities, as it properly validates user input and sanitizes it.

The code also does not contain any race condition vulnerabilities, as it properly uses synchronization mechanisms like mutexes, locks, or atomic operations to prevent concurrent access to shared resources. The code also does not contain any insecure function usage vulnerabilities, as it properly uses secure functions like strncpy, fgets, or sscanf.

The code also does not contain any insecure resource management vulnerabilities","The code contains a Exec_Code_Overflow vulnerability. 
The CVE-ID is CVE-2018-15911. The CWE-ID is CWE-119.
Vulnerability summary:
In Artifex Ghostscript 9.23 before 2018-08-24, attackers able to supply crafted PostScript could use uninitialized memory access in the aesdecode operator to crash the interpreter or potentially execute code.
",1.0,857.0,6.0,3.731975793838501
177879,DoS Exec Code Overflow,"  NO, the given code is not vulnerable to a DoS_Exec_Code_Overflow vulnerability.

The code does not contain any buffer overflow vulnerabilities, as it does not involve any user-supplied input or unvalidated user input. The code also does not contain any use-after-free errors, as it properly checks for null pointers before dereferencing them.

The code does contain some potential memory leaks, as it does not properly free memory allocated using new or malloc. However, this does not pose a significant security risk, as the memory leaks are not exploitable in the context of the given code.

The code also does not contain any integer overflow or underflow vulnerabilities, as it properly checks for overflow or underflow conditions.

Overall, the code is not vulnerable to a DoS_Exec_Code_Overflow vulnerability.","The code contains a DoS_Exec_Code_Overflow vulnerability. 
The CVE-ID is CVE-2015-3456. The CWE-ID is CWE-119.
Vulnerability summary:
The Floppy Disk Controller (FDC) in QEMU, as used in Xen 4.5.x and earlier and KVM, allows local guest users to cause a denial of service (out-of-bounds write and guest crash) or possibly execute arbitrary code via the (1) FD_CMD_READ_ID, (2) FD_CMD_DRIVE_SPECIFICATION_COMMAND, or other unspecified commands, aka VENOM.
",2.0,804.0,6.0,3.0700602531433105
