case_id,vuln_type,audit_report,input_token_num,output_token_num,inference_time
177860,Exec Code Bypass," The given code snippet for the function `zrestore` does not directly contain any apparent vulnerabilities related to the provided list. However, it does call other functions like `restore_check_stack` and `restore_fix_stack` which could potentially contain vulnerabilities. It is essential to review those functions as well.

The code snippet provided for the function `canDistribute` is not related to the vulnerability assessment of the `zrestore` function. It is an entirely different function, and it appears to be safe based on the given code.

Therefore, the answer is:

For `zrestore`: 'Maybe'
The reason is that it calls other functions which could potentially contain vulnerabilities. It is necessary to review those functions as well.

For `canDistribute`: 'No'
The given code for this function does not contain any apparent vulnerabilities.",1731,190,10.28597617149353
177862,Exec Code," The given code for `restore_page_device` function is not directly related to the provided vulnerability description. Therefore, I cannot determine if it is vulnerable based on the information provided.

However, I will evaluate the given code for potential vulnerabilities as per the steps mentioned in the question:

1. Buffer Overflow: No, there are no string functions like strcpy, sprintf, or array access that could lead to buffer overflow vulnerabilities.
2. Use After Free: No, there are no pointers that are dereferenced after they have been freed.
3. Memory Leaks: No, there are no dynamic memory allocations that are not properly deallocated.
4. Integer Overflow/Underflow: No, there are no arithmetic operations that could lead to integer overflow or underflow.
5. Null Pointer Dereference: No, there are no pointers that are dereferenced without being checked for null.
6. Improper Input Validation: The code does not involve user input, so input validation is not applicable.
7. Race Conditions: No, there are no concurrent accesses to shared resources that could lead to race conditions.
8. Insecure Function Usage: The code does not use any insecure or deprecated functions.
9. Improper Resource Management: No, there are no resources like file descriptors, sockets, or memory that are not properly handled",1753,301,16.155868530273438
177865,DoS," The given code for PatternMatch function is not the same as the vulnerable code mentioned in the vulnerability summary. The provided code does not contain any buffer overflow vulnerabilities.

Therefore, the answer is 'NO'.",1844,46,2.7347750663757324
177867,nan," Based on the provided code snippet, it appears to be a separate function unrelated to the initial `gs_main_finit` function. This function, named `canDistribute`, is not directly related to the vulnerability described in the initial code. Therefore, I cannot definitively say whether this function is vulnerable or not without additional context.

However, I can provide some general observations about the code:

1. The function `canDistribute` is written in C++ and appears to be implementing a solution for the Subset Sum problem. It uses dynamic programming to find if a given set of integers can be distributed among a given number of agents, each having a limited capacity.
2. The function does not directly interact with any external resources or memory, and it does not appear to contain any buffer overflow, use-after-free, memory leak, or other vulnerabilities that were mentioned in the initial vulnerability description.
3. The function does not seem to have any input validation or error handling mechanisms, but it does not process user input or external data, so this is not a significant concern in this case.

Based on the given code, I would classify the `canDistribute` function as not vulnerable. However, it's always a good practice to validate user input and handle errors properly when writing production code.",4840,280,15.406498432159424
177869,nan," Based on the provided code snippet, it does not appear to be directly vulnerable to the nan vulnerability described in the initial code example. The given code does not involve handling PostScript files or the setcolor function, which were the sources of the vulnerability in the initial code. However, it is always important to keep in mind that other vulnerabilities may exist in the code, and it is essential to follow secure coding practices to minimize risks.",3049,91,5.244588375091553
177870,nan," The given code for the function `ztype` does not directly involve user input or memory management functions that are commonly associated with buffer overflow vulnerabilities. However, it does contain a conditional branch based on the value of `op[-1].value.pstruct`. If this value is not zero, it calls a function `gs_struct_type_name_string` with a pointer to a string obtained from the memory `imemory`.

This function call could potentially lead to a buffer overflow if the string is not properly checked for length or if the memory `imemory` is not properly managed. The vulnerability type in this case could be a use-after-free or a buffer overflow, depending on the specifics of the `imemory` management and the `gs_struct_type_name_string` implementation.

Therefore, the answer is 'YES', and the vulnerability is related to the potential for a buffer overflow or use-after-free error due to the lack of proper bounds checking and memory management in the `gs_struct_type_name_string` function call.",1549,234,12.599167346954346
177874,Exec Code Overflow," Based on the given code, it does not appear to be vulnerable to the Exec_Code_Overflow vulnerability described earlier. The code is performing AES encryption and decryption using precomputed round keys, and there is no evidence of user input being processed in an unsafe manner. However, it is still important to follow best practices for secure coding, such as proper bounds checking and input validation, to prevent other types of vulnerabilities.",3826,90,5.2771077156066895
177875,Exec Code Overflow," Based on the given code, the `s_aes_process` function does not appear to be directly vulnerable to the vulnerabilities listed in the provided steps. However, it does call other functions that could potentially contain vulnerabilities, such as `gs_alloc_bytes_immovable` and `aes_setkey_dec`. It is important to thoroughly review these functions and the surrounding code to ensure that they are handling memory and cryptographic operations securely.

Therefore, the answer is: 'Maybe'. The `s_aes_process` function itself may not be vulnerable, but it depends on the implementation of the functions it calls.

To perform a thorough vulnerability audit, you would need to review the entire codebase, including all functions and libraries used, to ensure that all security vulnerabilities are identified and addressed. The steps provided in the question are a good starting point, but there are many other vulnerabilities that could potentially exist in C++ code.

It is also important to note that the code snippet provided may not be complete, and there may be additional context or dependencies that could impact the security of the code. Therefore, a thorough analysis would require a more comprehensive understanding of the entire system.",2896,256,13.878447532653809
177879,DoS Exec Code Overflow," The given `fdctrl_read_data` function does not appear to be directly vulnerable to the mentioned vulnerabilities (DoS, Exec, Code, Overflow) based on the provided code snippet. However, it is always important to ensure proper bounds checking and input validation in all functions, even if they do not seem vulnerable at first glance.

The second code snippet, `canDistribute`, is a separate function and does not seem to be related to the vulnerability assessment of the `fdctrl_read_data` function. It is not vulnerable to the mentioned vulnerabilities based on the provided code snippet.

Therefore, the answer is 'NO' for both functions.",2121,146,8.04349684715271
177880,Bypass," Based on the given code, the `check_file_permissions_reduced` function does not directly involve any memory management or string manipulation functions that are commonly associated with buffer overflow vulnerabilities. It appears to be checking file permissions based on a list of permitted strings. However, there are still potential vulnerabilities that could be present, such as improper input validation or race conditions if the function is called concurrently. To thoroughly evaluate the vulnerability of this function, a more in-depth analysis would be required, including an examination of the context in which it is used and the potential impact of any vulnerabilities that may be present.

Therefore, based on the given code alone, it is not possible to definitively determine if the code is vulnerable or not. However, it is always a good practice to validate user inputs and ensure proper synchronization mechanisms are in place when dealing with file system accesses or other resources that could be accessed concurrently.

So, my answer is 'UNDETERMINED'.",2527,213,11.722529172897339
177881,DoS," The given code for the function `drm_load_edid_firmware` is vulnerable. The vulnerability is due to the unchecked use of `kstrdup` function. If the input string `edid_firmware` is maliciously crafted, it could lead to a NULL pointer dereference and cause a denial of service (DoS) attack.",1555,82,4.572785377502441
177883,nan," Based on the provided code, there are no obvious buffer overflow, use-after-free, memory leak, integer overflow/underflow, null pointer dereference, or improper input validation vulnerabilities. However, there are some potential issues:

1. The code does not check the return value of malloc() and malloc() calls, which could lead to memory leaks if the calls fail.
2. The code does not check the return value of HOOK_CONNECT() call, which could hide potential errors or vulnerabilities.
3. The code does not validate or sanitize the input tags, which could lead to potential injection attacks or buffer overflows if the input is not properly checked.
4. The code does not handle errors or exceptions properly, which could lead to unintended behavior or vulnerabilities if an error occurs.
5. The code uses the string_split() function, which is not shown in the code snippet, and its behavior and security implications are unknown.

Overall, while there are some potential issues, none of them appear to be directly related to the classic security vulnerabilities listed in the original question. However, it is still important to address the issues mentioned above to ensure the code is robust and secure.",1783,261,14.014418363571167
177887,DoS Overflow," The given C++ code for `gs_heap_alloc_bytes` function does not directly involve the code for the `canDistribute` function provided at the end. Therefore, I cannot determine the vulnerability of the `canDistribute` function based on the given code.

However, I can evaluate the `gs_heap_alloc_bytes` function based on the provided information. The code appears to be checking the size of the allocation request against the available memory limit. If the size exceeds the limit, it sets an error message and returns. This check seems to be in place to prevent buffer overflow attacks.

Additionally, the code uses `Memento_label` to allocate memory, which is not defined in the provided code snippet. It is essential to understand the behavior of this function to determine if it is vulnerable to any memory-related attacks.

Based on the given code, it is challenging to determine if the `gs_heap_alloc_bytes` function is vulnerable to a DoS attack or any other type of vulnerability. Further analysis would be required to make an accurate assessment.

Therefore, my answer is: 'UNDECIDED'.",2445,248,13.840641021728516
177891,DoS," The given code for the function `rsa_pss_decode` is not directly related to the code snippet you provided earlier, which was identified as having a DoS vulnerability. Therefore, I cannot definitively say whether the new code is vulnerable or not without analyzing it specifically for vulnerabilities.

However, I can provide some general advice on the code:

1. The code appears to be parsing ASN.1 structures, which can be complex and error-prone. Make sure to validate input and handle errors properly.
2. The code uses `d2i_RSA_PSS_PARAMS` and `d2i_X509_ALGOR` functions, which are likely to be part of a larger library (OpenSSL, in this case). Be sure to understand the behavior of these functions and how they interact with the rest of the code.
3. The code does not appear to check the return values of the `d2i_RSA_PSS_PARAMS` and `d2i_X509_ALGOR` functions, which could lead to undefined behavior if the functions fail.

Based on this analysis, it is difficult to determine if the code is vulnerable without a more thorough examination. However, there are potential areas for error and potential security vulnerabilities, so it is recommended to carefully review the code and ensure proper error handling and input validation",1554,301,16.005619525909424
177893,+Info," Based on the given code, it does not appear to be directly vulnerable to the vulnerabilities listed in the initial instructions. However, it does use the OpenSSL library, which has had vulnerabilities related to the Montgomery multiplication and exponentiation functions in the past. Therefore, it is important to ensure that the OpenSSL library is kept up-to-date with the latest security patches to mitigate any potential risks.

The code itself does not contain any obvious vulnerabilities, such as buffer overflows, use-after-free errors, memory leaks, or integer overflows/underflows. It also properly checks for zero moduli and even moduli, which are known vulnerabilities in Montgomery multiplication and exponentiation.

However, it is important to note that the code's security ultimately depends on the security of the OpenSSL library and how it is being used in the context of the larger application. Therefore, it is still recommended to keep the OpenSSL library updated and to follow best practices for securely using cryptographic functions.

Answer: NO.",3153,226,12.413006067276001
177896,nan," The given code for the `become_daemon` function does not appear to be directly related to the vulnerability described in the provided context. The code seems to be implementing a daemon process, which is not inherently vulnerable based on the provided information.

Therefore, the answer is 'NO'. The code does not exhibit any vulnerabilities as described in the given steps.",1452,80,4.474361419677734
177897,+Info," The provided code for the function `soap_xmlParseFile` is not the same as the code mentioned in the vulnerability summary. However, based on the given vulnerability summary, the code is vulnerable to XML External Entity (XXE) attacks. The vulnerability arises from the parser's inability to properly handle XML external entity references, allowing an attacker to read arbitrary files.

The code snippet you provided does not contain any XML parsing logic or functions that could be exploited for XXE attacks. Therefore, the code is not vulnerable to the described issue.

However, it is essential to keep in mind that the vulnerability might exist in other parts of the codebase, especially if it involves XML parsing or handling. Always ensure that XML parsing is done securely, and external entities are disabled or properly validated to prevent potential attacks.",1785,182,9.863397121429443
177898,+Info," The given code snippet `xmlDocPtr soap_xmlParseMemory(const void *buf, size_t buf_size)` is not directly related to the vulnerability described in the CVE-2013-1824. The vulnerability mentioned in the CVE is related to the SOAP parser in PHP, not in the given C++ code. Therefore, the answer is 'NO'.",1703,87,4.878533601760864
177899,+Info," The provided code for the function `soap_xmlParseFile` is not directly related to the given C++ code. However, based on the vulnerability description provided, the PHP SOAP parser function is vulnerable to XML External Entity (XXE) attacks.

The given C++ code does not contain any XML parsing functionality or any indication of handling user input, so it is not vulnerable to the described XXE attack.

Therefore, the answer is 'NO'.",1729,100,5.610484600067139
177900,+Info," The given C++ code for the function `soap_xmlParseMemory` does not directly involve user input or any other potentially vulnerable operations like memory management or arithmetic operations. Therefore, based on the provided code snippet, it appears to be relatively secure.

However, it is essential to note that the code snippet provided is incomplete and does not include the `soap_ignorableWhitespace` and `soap_Comment` functions. These functions could potentially introduce vulnerabilities if they are not implemented securely. Additionally, the comment at the beginning of the code suggests that the `xmlInitParser()` function is called, which could have security implications if not handled properly.

To ensure the security of the code, it is recommended to review the entire codebase, including all related functions and libraries, and perform a thorough vulnerability assessment as described in the steps provided in the question.",1619,186,10.077852249145508
177901,Overflow," The second code snippet provided, `canDistribute(vector<int>& nums, vector<int>& quantity)`, does not appear to contain any obvious buffer overflow vulnerabilities. It is written in a modern C++ style and uses standard library functions and data structures. The code seems to be implementing a solution to the subset sum problem, and it does not involve any string or memory manipulation functions that could potentially lead to buffer overflows. Therefore, the answer is 'NO'.",1305,101,5.5608038902282715
177904,DoS," The given `Splash::blitMask` function does not appear to be vulnerable based on the provided code alone. However, it is always a good practice to ensure proper bounds checking and input validation in the code to prevent potential vulnerabilities.

The second code snippet provided is not related to the `Splash::blitMask` function, and it is not a C++ code. It is a C++11 implementation of the knapsack problem using dynamic programming. This code does not contain any apparent vulnerabilities.",2175,112,6.23710036277771
177905,DoS, NO. The given code does not contain any obvious null pointer dereference vulnerabilities. The code is calculating bounds and performing checks to ensure that pointers are within valid memory ranges.,3713,38,2.5684399604797363
177906,DoS Exec Code Overflow," Based on the provided code snippet, it does not appear to be directly vulnerable to the DoS, Exec, Code, Overflow vulnerability described in the initial code example. However, the code does contain complex logic and potential edge cases that could potentially hide other vulnerabilities. It is always recommended to thoroughly review and test all code for security vulnerabilities, especially when dealing with user input or complex logic.

The given code snippet, `SplashPath *Splash::makeDashedPath(SplashPath *path)`, is a function that generates a dashed path from a given path. It does not involve any user input or external data, and it does not appear to allocate memory in an unsafe manner or perform any arithmetic operations that could lead to integer overflows or underflows.

However, it is important to note that the code snippet provided does not represent the entire program, and it is possible that other parts of the code could contain vulnerabilities. It is always recommended to perform a thorough vulnerability assessment on the entire codebase to ensure that all potential vulnerabilities are identified and addressed.",3204,236,12.941420555114746
177907,DoS Exec Code Overflow," The given `Splash::scaleMaskYuXd` function does not appear to be directly vulnerable to the mentioned vulnerabilities in the provided list. However, it does contain some potential issues:

1. Memory management: The function allocates memory for `lineBuf` and then forgets to check for allocation errors. This could potentially lead to memory leaks or other issues if memory allocation fails.
2. Function recursion: The inner loop `for (y = 0; y < srcHeight; ++y)` is nested inside another loop `for (y = 0; y < srcHeight; ++y)`. This could potentially lead to stack overflow if the input size is large.
3. Integer arithmetic: The function performs integer arithmetic without bounds checking or input validation, which could potentially lead to integer overflows or underflows.

However, these issues do not directly result in the mentioned vulnerabilities (DoS, Exec, Code, Overflow). To determine if the function is vulnerable to these specific vulnerabilities, a more thorough analysis would be required.

Therefore, the answer is 'NO', but with the caveat that the function may contain other potential issues that could lead to vulnerabilities if not addressed properly.",1990,267,14.401297092437744
177909,DoS Exec Code Overflow," The given `Splash::scaleMaskYdXu` function is not directly related to the vulnerability described in the provided CVE-ID and CWE-ID. The vulnerability in the code snippet you provided is not present in the given code.

Therefore, the answer is 'NO'.",1976,67,3.8575522899627686
177910,DoS," The given code for `token_continue` function does not appear to contain any obvious vulnerabilities related to the provided list. However, it does call external functions `gs_scanner_error_object` and `gs_scan_handle_refill` which could potentially have vulnerabilities. It is important to review those functions as well.

The second code snippet provided is an unrelated function called `canDistribute`. This function does not contain any apparent vulnerabilities. It is a time-complexity intensive function, but it does not involve any memory management or input handling that could lead to vulnerabilities.",1565,129,7.073852777481079
177911,Exec Code Overflow," The given `tt_cmap10_validate` function does not directly involve user input or dynamic memory management, so it is not vulnerable to the types of vulnerabilities listed in the provided steps. However, it does contain integer operations, so it is important to ensure that there are no integer overflows or underflows.

In the given code, there are two integer variables `length` and `count` that are calculated from user input. However, there are checks in place to ensure that these values do not exceed certain bounds. Specifically, the code checks that `table + length` and `table + length + count * 2` do not exceed `valid->limit`. If these checks pass, it is unlikely that there is an integer overflow vulnerability.

Therefore, the answer is 'NO'. However, it is always important to ensure that all integer operations are validated and checked for overflow or underflow conditions to prevent potential vulnerabilities.",1430,201,11.367461919784546
177912,Exec Code Overflow," Based on the provided code, the `tt_cmap12_validate` function is not directly related to the `canDistribute` function. The `tt_cmap12_validate` function appears to be validating a table of data, while the `canDistribute` function is implementing a solution to the ""distribute n items to m bins"" problem.

Therefore, the `canDistribute` function itself does not contain any apparent vulnerabilities. However, it's always a good practice to ensure that the input to the function is valid and within acceptable bounds.

So, the answer is 'NO'.",1668,135,7.423902988433838
177913,Exec Code Overflow," Based on the provided code snippet, the `tt_cmap8_validate` function does not appear to be directly vulnerable to integer overflows or any other type of code injection vulnerabilities. However, it does contain some complex logic for validating the input data, which could potentially hide other vulnerabilities. It is always recommended to thoroughly review the entire codebase and ensure that all functions and libraries used within it are up-to-date and free of known vulnerabilities.

Therefore, the answer is 'NO', but with the caveat that a thorough analysis of the entire codebase is necessary to ensure its security.",2670,131,7.2837231159210205
177915,Exec Code Overflow," Based on the provided code snippet, it does not appear to be directly vulnerable to the Exec, Code, Overflow vulnerability described in the CVE-2009-0946. The code is primarily involved in loading and parsing a charset table, and does not contain any obvious integer overflows or other conditions that could lead to arbitrary code execution.

However, it is important to note that the code may still contain other vulnerabilities or issues, such as buffer overflows, use-after-free errors, memory leaks, or race conditions, which were not addressed in the given vulnerability description. Therefore, it is still recommended to perform a thorough vulnerability assessment on the entire codebase to ensure its security.

Answer: NO.",2250,164,8.99826979637146
