case_id,vuln_type,audit_report,input_token_num,output_token_num,inference_time
177799,Overflow," The given code for _XcursorReadImage function is not directly vulnerable to integer overflow as the code snippet provided does not involve any arithmetic operations on user inputs or unchecked calculations. However, the code does contain a sanity check for width and height values, which if not properly implemented, could potentially lead to buffer overflows if the input data is malicious. Therefore, it is essential to ensure that the _XcursorFileReadUInt function correctly checks the file size and position before reading the width and height values to prevent potential buffer overflows.

In summary, the given code is not vulnerable to integer overflow as defined in the provided list, but it is essential to ensure proper bounds checking when reading the width and height values from the file to prevent potential buffer overflows.",1957,164,8.976298570632935
177807,Bypass," Based on the given code, the `znumicc_components` function does not appear to be directly vulnerable to the Bypass vulnerability described in the previous example. However, it does involve handling user input (the dictionary) and creating a profile based on that input, so it's essential to ensure proper input validation and error handling are implemented to prevent other vulnerabilities, such as buffer overflows or injection attacks.

Therefore, the answer is:

NO (but with a caveat: ensure proper input validation and error handling are implemented)",2107,117,6.496628522872925
177809,Bypass," Based on the given code, the `restore_page_device` function does not appear to be directly vulnerable to the vulnerabilities listed in the provided steps. However, it does call other functions that could potentially have vulnerabilities, such as `dev_proc(dev_old, get_page_device)` and `putdeviceparams`. Therefore, it is important to thoroughly audit those functions as well.

The `canDistribute` function is not related to the `restore_page_device` function and does not appear to have any security vulnerabilities based on the provided code.

However, it's important to note that the absence of vulnerabilities in the given code does not guarantee that the code is completely secure. It's always a good practice to follow secure coding guidelines and regularly perform security audits to ensure the code remains secure.",2468,177,9.68162989616394
177811,DoS," Based on the provided code, the `aspath_put` function does not appear to be directly vulnerable to the vulnerabilities listed in the initial instructions. However, it does contain some assumptions and potential edge cases that could potentially lead to issues if not handled properly in the larger context of the application.

For example, the comment ""The general assumption here is that many things tested will never happen. And, in real life, up to now, they have not."" suggests that there may be some unchecked assumptions being made about the input data. Additionally, the code for handling overlength segments (`while ( (seg->length - written) > AS_SEGMENT_MAX)`) could potentially lead to issues if the input data is not properly validated or if the segment lengths are not accurately represented.

However, without more context about the larger application and the data being processed, it is difficult to definitively say whether or not this code is vulnerable. It is always important to validate and sanitize user input, and to handle edge cases and potential errors appropriately to mitigate risks.

Regarding the second code snippet, it is not related to the vulnerability assessment task and appears to be an unrelated function for calculating whether a set of numbers can be distributed among a given set of quantities. It does not contain any apparent vulnerabilities based on the provided code.",2427,285,15.451533079147339
177812,Bypass," The sum_update function provided does not directly involve user input or input validation, so it is not vulnerable to the types of vulnerabilities listed in the initial steps. However, it does contain some complex logic for handling checksums, which could potentially hide other vulnerabilities. It is important to ensure that the md5_update, mdfour_update, and memcpy functions are implemented securely and that the sumresidue variable is properly managed to prevent buffer overflows or other issues. Additionally, the case statements in the switch statement should be exhaustively covered to handle all possible cursum_type values.

The canDistribute function, on the other hand, does not appear to contain any obvious vulnerabilities. It uses standard C++ libraries (vector, unordered_map, and nth_element) and follows good programming practices, such as using constant expressions for array sizes and using iterators instead of array indices. The function's time complexity is also stated explicitly, which is helpful for understanding its performance characteristics. Overall, the canDistribute function seems secure.",1632,222,11.964090824127197
177815,Bypass," The given code for `file_checksum` function does not appear to be vulnerable to the Bypass vulnerability described in the provided context. The code seems to be handling the file reading and checksum calculation correctly, with proper checks for the end of the file.

However, it's important to note that the code snippet provided does not represent the entire program, and there could be other vulnerabilities or issues in the surrounding code. Always perform a thorough vulnerability assessment on the entire codebase to ensure the security of your application.",2262,113,6.278039932250977
177816,Bypass," The given code for `get_checksum2()` function is not directly vulnerable to the mentioned vulnerabilities in the provided list. However, it does contain some potential issues:

1. Memory management: The code allocates memory for `buf1` and `len1` inside the function, and if the length of the input data `len` is larger than the previously allocated length `len1`, it reallocates the memory. This could potentially lead to memory leaks if the memory allocation fails.

2. Buffer handling: The code uses `memcpy()` to copy the input data `buf` to `buf1`. If the length of the input data `len` is larger than the size of the allocated buffer `buf1`, it could result in a buffer overflow.

3. Insecure function usage: The code uses the `mdfour_update()` function without checking its return value. If this function call fails, the program may continue executing, potentially leading to unexpected behavior or crashes.

4. Improper error handling: The code does not handle errors properly, especially when allocating memory for `buf1`. If memory allocation fails, the program may continue executing, potentially leading to memory leaks or crashes.

5. Cryptographic issues: The code uses the `mdfour_update()` function for MD4 checksum calculation, which is considered outdated and insecure. It is",2322,301,16.170686721801758
177821,DoS," The second code snippet provided does not appear to be directly related to the first vulnerability discussed. It is a separate function called `canDistribute` that does not involve the IRCView or the openTags function. Therefore, it is not vulnerable to the Denial of Service vulnerability described in the first code snippet.

However, it is important to note that the `canDistribute` function has a time complexity of O(3^m), which can be quite inefficient for large inputs. This could potentially lead to performance issues, but it does not introduce any security vulnerabilities.",1370,124,6.784667015075684
177823,Exec Code Overflow," Based on the given code, it does not appear to be directly vulnerable to the Exec, Code, Overflow vulnerability described in the provided vulnerability summary. The code is not handling code words that are absent from the decompression table, and it is not using a LZW decompressor. However, it is always important to keep in mind that there may be other vulnerabilities present in the code that are not immediately apparent from the provided snippet. It is recommended to perform a thorough vulnerability assessment using the steps outlined in the provided guide.",2493,114,6.607291221618652
177825,DoS," The given code for the `extractPages` function does not appear to contain any obvious buffer overflow, use-after-free, memory leak, or format string vulnerabilities. However, it does contain other potential issues, such as:

1. Improper Input Validation (CWE-20): The code does not check if `destFileName` contains the required '%d' format specifier when extracting more than one page. This could potentially lead to a format string vulnerability if an attacker provides a malicious filename.
2. Race Conditions (CWE-362): The code uses the `goto` statement to exit the function prematurely when an error occurs. This could potentially lead to race conditions if multiple threads are accessing the same resources.
3. Insecure Function Usage (CWE-676): The code uses the `snprintf` function without proper bounds checking, which could potentially lead to a buffer overflow if the destination string is not large enough. It is recommended to use a safer alternative like `snprintf_s` or `sprintf_s` with bounds checking.

However, based on the given code snippet, it is not immediately clear if these issues are exploitable vulnerabilities or not. A more thorough analysis would be required to determine the exact risk level.

Therefore, my answer is:

Answer: YES - The code contains potential vulnerabilities, including",1789,301,16.07463049888611
177826,DoS Exec Code Overflow," The second code snippet provided does not contain any obvious buffer overflow vulnerabilities. It appears to be a function for distributing items with given quantities, and it uses standard C++ libraries (vector, unordered\_map, etc.) without any apparent memory management issues. Therefore, the answer is 'NO'.",1664,63,3.5907065868377686
177827,nan," The given C++ code does not appear to be directly vulnerable based on the provided code snippet. However, it does contain a complex algorithm for distributing items with given quantities, which may introduce potential vulnerabilities if the input is not properly validated or if the algorithm is not implemented correctly. It is essential to ensure that user inputs are validated and sanitized, and that the algorithm is implemented correctly to prevent any potential vulnerabilities.

Therefore, the answer is 'NO', but with the caveat that the code should be thoroughly reviewed for proper input validation and algorithm implementation to ensure security.",2098,124,6.858547210693359
177831,nan," The given code snippet `mcid_char_imp` does not directly contain any obvious buffer overflow vulnerabilities, use-after-free errors, memory leaks, or null pointer dereferences. However, it does call the `walk_string` function, which is not shown in the code snippet. If `walk_string` contains any of the mentioned vulnerabilities, then the overall function `mcid_char_imp` could be vulnerable as well.

Therefore, it is essential to review the implementation of the `walk_string` function to ensure its safety. If `walk_string` is vulnerable, then the `mcid_char_imp` function is also vulnerable.

In summary, the `mcid_char_imp` function itself is not vulnerable based on the provided code snippet. However, it is crucial to examine the implementation of the `walk_string` function to ensure its security.",1840,195,10.661347150802612
177832,nan," The given code for `walk_string` function does not appear to be vulnerable to the mentioned vulnerabilities in the provided list. It is checking for the correct rune value and handling whitespace characters appropriately. However, it does contain a potential memory safety issue when using `memmove` function. The length of the string being moved should be checked against the remaining size of the destination buffer to prevent buffer overflows.

The second code snippet for `canDistribute` function is not a C++ code, but rather a C++11 code. It does not involve any memory management or string manipulation functions, so it is not vulnerable to the mentioned vulnerabilities.

Therefore, the answer is 'NO' for both code snippets.",1686,159,8.705658435821533
177833,DoS Overflow," The given code for the function `reds_handle_ticket` is not vulnerable to buffer overflow as there is no function call or array access that can lead to a buffer overflow condition. The code only performs RSA decryption and checks the password, which does not involve any memory manipulation that could result in a buffer overflow.

However, the second code snippet you provided, which is a separate function called `canDistribute`, is not related to the `reds_handle_ticket` function and does not involve any C++ code from the original `reds_handle_ticket` function. Therefore, it is not relevant to the vulnerability assessment of the `reds_handle_ticket` function.

So, the answer is 'NO' for the `reds_handle_ticket` function, and no further information is needed for this question.",1705,186,10.152888059616089
177839,+Info," Based on the given code, the `next_codepoint_handle_ext` function does not appear to be directly vulnerable to the vulnerabilities listed in the provided steps. However, it does contain some complex logic and potential edge cases that could potentially hide other vulnerabilities. It is always a good practice to thoroughly test and validate user inputs and ensure proper error handling to mitigate risks.

The second code snippet, `canDistribute` function, is not a C++ code snippet, but rather a C++11 code snippet. It appears to be implementing a solution to the ""Partition to K Subsets"" problem, which is a well-known combinatorial problem. The code itself does not seem to contain any obvious vulnerabilities, as it is using standard C++ libraries and following good programming practices. However, it is always important to validate user inputs and ensure proper error handling to mitigate risks.

Therefore, the answer is 'NO' for both code snippets.",2360,208,11.300251722335815
177840,+Info," The given code for the function `ldb_dn_escape_internal` is not directly related to the vulnerability described in the provided CVE-ID and summary. The vulnerability described in the CVE-ID is related to the AD LDAP server in Samba, which is not present in the given code.

Therefore, the answer is 'NO'. The given code does not have the vulnerability described in the provided CVE-ID.",2028,96,5.37668251991272
177841,+Info," The given code for `strupper_talloc_n_handle` function is not directly related to the vulnerability described in the provided CVE-ID and CWE-ID. The vulnerability in the code snippet is not apparent.

However, it's essential to note that the code snippet provided does not follow the best practices for handling strings and memory allocation. It uses a hardcoded buffer size and does not check for buffer overflow conditions. This could potentially lead to buffer overflow vulnerabilities if the input string is larger than expected.

The code for the `canDistribute` function is unrelated to the vulnerability assessment and does not contain any apparent vulnerabilities. It is a separate function that calculates whether a given set of numbers can be distributed among a given set of quantities.",1658,169,9.172131776809692
177842,+Info," The given code for the function `next_codepoint_handle_ext` is not directly related to the provided vulnerability description. Therefore, I cannot determine if it is vulnerable based on the information provided.

However, I can evaluate the second code snippet you've shared, which is a separate function called `canDistribute`. This function appears to be unrelated to the initial vulnerability discussion and does not involve any string handling or memory management, so it is unlikely to have the same vulnerabilities as the initial code.

Therefore, my answer is 'NO'. The code for the `canDistribute` function does not appear to have any obvious vulnerabilities based on the provided information.",1572,146,7.936227798461914
177843,+Info," Based on the given code, the `strlen_m_ext_handle` function is not directly vulnerable to the vulnerabilities listed in the provided steps. However, it does process user input (the `s` parameter) and calls an external function `next_codepoint_handle_ext` that could potentially have vulnerabilities. Therefore, it's essential to ensure proper input validation and check the implementation of the `next_codepoint_handle_ext` function for any related vulnerabilities.

However, the second piece of code you provided, `canDistribute`, is not related to the vulnerability assessment of the `strlen_m_ext_handle` function. It is a separate function, and its implementation appears to be unrelated to string handling or memory management, so it is not vulnerable to the vulnerabilities listed in the provided steps.",2376,176,9.614516258239746
177844,+Info," The given code for `strupper_talloc_n_handle` function is not directly related to the vulnerability described in the provided CVE-ID and CWE-ID. The vulnerability in the code snippet is not apparent.

However, it's always a good practice to follow secure coding guidelines when handling strings and memory allocation. In this case, the code does allocate memory for the destination string based on the source string length, but it doesn't check if the source string is null or if the length is within the bounds of the allocated memory. This could potentially lead to a buffer overflow if the source string is larger than expected. To mitigate this risk, you should check the source string length and ensure that it is within the bounds of the allocated memory before processing it.

Regarding the second code snippet, it doesn't seem to have any apparent vulnerabilities related to the given vulnerability types. It appears to be a different problem domain and doesn't involve any string or memory handling that could lead to the vulnerabilities mentioned in the provided list.",1678,226,12.195959568023682
177848,nan," The given code snippet for `do_connect` function is not directly related to the vulnerability described in the CVE-2015-5296. The vulnerability is related to Samba's handling of encrypted connections, which is not present in the provided code. Therefore, the answer is 'NO'.",1595,70,3.966421604156494
177850,DoS Overflow," Based on the given code, the function `datum_to_json` is not vulnerable to a DoS overflow vulnerability as described in the CVE-2015-5289. The code does not contain any unchecked string copies or memory allocations that could lead to a buffer overflow. However, there are other potential vulnerabilities, such as use-after-free errors or integer overflows, that should be addressed.",4301,94,5.54394006729126
177851,DoS Overflow," The given `parse_array` function does not directly involve any memory handling or user input processing, so it is not vulnerable to the mentioned C++ vulnerabilities such as buffer overflow, use-after-free, memory leak, integer overflow/underflow, null pointer dereference, improper input validation, race conditions, insecure function usage, insecure resource management, or improper error handling.

However, the code snippet you provided for the `parse_array` function is not the same as the vulnerable code you mentioned at the beginning. The vulnerable code is from PostgreSQL, and the given code is a different function.

The given code is a separate function called `canDistribute` that calculates whether it is possible to distribute a given set of numbers to a given set of quantities. It does not involve any of the mentioned vulnerabilities.",1551,179,9.65813684463501
177852,DoS Overflow," The given code for `parse_object` function does not appear to be directly vulnerable to the mentioned vulnerabilities in the list. However, it does call other functions `parse_object_field` and `report_parse_error` which could potentially contain vulnerabilities. It is essential to review those functions as well.

The code itself does not contain any buffer overflow, use-after-free, memory leak, integer overflow/underflow, null pointer dereference, or sensitive data exposure vulnerabilities. It also seems to have proper input validation and error handling mechanisms.

However, the code does contain a time complexity of O(2^m) in the `canDistribute` function due to submask enumeration. This is not a security vulnerability but rather an inefficiency. It is essential to consider this when dealing with large inputs.",1753,177,9.764161825180054
177853,DoS Overflow," The given code snippet `setPath(JsonbIterator **it, Datum *path_elems, bool *path_nulls, int path_len, JsonbParseState **st, int level, Jsonb *newval, bool create)` itself does not contain any apparent vulnerabilities. However, it does call other functions like `setPathArray` and `setPathObject` which are not shown in the code snippet. These functions could potentially contain vulnerabilities, so it's essential to review them as well.

The code snippet appears to be handling JSON parsing and does not contain any obvious buffer overflow, use-after-free, memory leak, or other vulnerabilities. However, it does not follow best practices for input validation, which could potentially lead to vulnerabilities if user input is not properly validated in the called functions.

Therefore, the answer is:

NO, but with a caveat: The given code snippet does not contain any apparent vulnerabilities, but it calls other functions that could potentially contain vulnerabilities, particularly in the areas of input validation. It is crucial to review those functions for potential vulnerabilities.",1867,245,13.209614992141724
177855,Bypass," Based on the provided code snippet, it does not appear to be directly vulnerable to the Bypass vulnerability described in the given context. The code seems to be handling file paths and checking directory access, but it does not involve symlinks or substring relationships that could be exploited for bypassing intended access restrictions.

However, it's important to note that this code snippet might not represent the entire vulnerability in the given context. The CVE-2015-5252 vulnerability is a complex issue that likely involves multiple components and interactions, so it's essential to consider the entire context and system configuration when evaluating the vulnerability.

Therefore, based on the given code snippet alone, the answer is 'NO'.",3327,161,8.943323850631714
177856,nan," Based on the provided code, there doesn't seem to be any obvious vulnerability related to the steps mentioned in the question. The code appears to be handling user input through the `get_ed_command_letter` function, which is not shown in the code snippet. It's also using `get_line` to read input, which is a standard C library function that doesn't have any known vulnerabilities if used correctly.

However, there are other potential vulnerabilities in the code that are not related to the steps mentioned in the question, such as the use of `sprintf` without proper bounds checking, the lack of error handling in some places, and the potential for integer overflows or underflows in arithmetic operations. These issues should be addressed separately.

Therefore, the answer is 'NO', but it's important to note that the code should still be thoroughly reviewed for other potential vulnerabilities.",3158,196,10.865514278411865
177857,nan," The given code for `plan_a` function is not directly related to the provided C++ code for the `canDistribute` function. Therefore, I cannot determine if the `plan_a` function is vulnerable based on the given information.

However, I can evaluate the `canDistribute` function for potential vulnerabilities. After analyzing the code, I found no obvious security vulnerabilities, such as buffer overflow, use-after-free, memory leaks, or integer overflow/underflow. The code appears to be handling inputs correctly and validating them before performing calculations.

The function uses dynamic memory allocation with `vector` and `unordered_map`, but it properly initializes and cleans up these resources. The function also uses recursive subroutines, but it handles the recursion depth effectively by using dynamic programming to store intermediate results and avoid redundant calculations.

Therefore, my answer is 'NO', the `canDistribute` function does not have any apparent security vulnerabilities based on the provided code.",1705,219,11.797505617141724
177859,Exec Code Bypass," The given gs_nulldevice function does not directly contain any obvious vulnerabilities based on the provided code snippet. However, it does call other functions like dev_proc, gs_copydevice, rc_init, gs_setdevice_no_erase, and get_profile, which could potentially have vulnerabilities. It is essential to review these functions' implementations to ensure they are secure.

The second code snippet, canDistribute, is not related to the vulnerability assessment of the gs_nulldevice function. It is a separate function that calculates whether a given set of integers can be distributed among a given set of quantities. This function does not contain any apparent vulnerabilities based on the provided code.

Therefore, the answer is:

1. gs_nulldevice function: It is not clear whether it is vulnerable or not without reviewing the implementation of the called functions.
2. canDistribute function: It is not vulnerable.",1697,216,11.674074172973633
