case_id,vuln_type,audit_report,input_token_num,output_token_num,inference_time
177736,Bypass," The given code snippet `samldb_check_user_account_control_acl` is not directly related to the vulnerability described in the text provided. The vulnerability described in the text is related to a different function and module in Samba. Therefore, based on the given code snippet, it is not vulnerable.",2728,69,4.057250738143921
177740,DoS Exec Code Overflow Mem. Corr.," The given code for the function `asn1_time_to_time_t` is not directly related to the code snippet you provided earlier, which was vulnerable to a DoS, Exec, Code, Overflow, Mem., Corr. vulnerability. The new code snippet appears to be a separate function for converting an ASN.1 UTC time string to a Unix timestamp.

Based on the provided code, it does not contain any obvious vulnerabilities. However, it does have some potential issues:

1. The code does not check the return value of `mktime()`, which could potentially lead to undefined behavior if the function call fails.
2. The code does not check the return value of `estrdup()`, which could potentially lead to memory leaks or undefined behavior if the function call fails.
3. The code does not check the return value of `php_error_docref()`, which could potentially lead to undefined behavior if the function call fails.

However, these issues do not directly result in security vulnerabilities. They are more related to general programming best practices and error handling.

Therefore, my answer is 'NO', the code is not vulnerable to any of the vulnerabilities mentioned in the original list. However, it is always a good idea to follow best practices and handle errors properly in your code.",2222,286,15.480794668197632
177741,DoS Overflow," The given gnutls_session_get_data function is vulnerable to a DoS attack via buffer overflow. The vulnerability arises from the lack of proper bounds checking when copying data from psession.data to session_data. If psession.size is larger than session_data_size, it can cause a buffer overflow, leading to a denial of service (application crash).

The second code snippet provided is not related to the vulnerability audit and is not a C++ code snippet. It is a function written in C++ that calculates whether a given set of numbers can be distributed among a given set of quantities. This code does not contain any security vulnerabilities.",1474,145,7.9344398975372314
177742,DoS Overflow," The given gnutls_session_get_data function is vulnerable to a DoS attack through a buffer overflow. The vulnerability arises from the lack of proper bounds checking on the size of the session_data buffer when copying the data from psession.data. An attacker can exploit this by sending a large SessionTicket to the client, causing the session_data buffer to be overwritten and resulting in a denial of service (application crash).

The second code snippet provided is not related to the vulnerability audit and is not a C++ code snippet. It is a function written in C++ that calculates whether a given set of numbers can be distributed among a given set of quantities. This code does not contain any security vulnerabilities.",1444,160,8.717712640762329
177743,DoS," The given C++ code for the function `phar_make_dirstream` does not appear to be vulnerable to the specific vulnerabilities listed in the provided steps. However, it is always important to keep in mind that this code analysis is not exhaustive, and other vulnerabilities may exist.

The code seems to be handling directory and file entries correctly, checking for path separators and subdirectories, and properly managing memory. It does not contain any obvious buffer overflow, use-after-free, memory leak, or integer overflow/underflow vulnerabilities.

However, it is essential to note that the code snippet provided is incomplete, and it is not possible to determine if there are any other vulnerabilities in the surrounding code or libraries being used. Therefore, a thorough vulnerability assessment should be conducted on the entire system, considering all the components and their interactions.",4063,183,10.244579553604126
177747,DoS," The given bgp_attr_unknown function does not directly relate to the provided canDistribute function. The bgp_attr_unknown function is vulnerable to a denial-of-service attack due to a lack of proper initialization of the 'total' variable, as explained in the previous response. The canDistribute function, on the other hand, appears to be a separate function for determining whether a given set of numbers can be distributed among a given set of quantities. It does not contain any apparent vulnerabilities based on the provided code snippet.",2299,113,6.333778381347656
177750,DoS Exec Code," Based on the provided code, it does not appear to be directly vulnerable to the vulnerabilities listed in the initial prompt. However, there are some potential issues that could be worth investigating further:

1. The code does not check the return value of `pdf_xobject_bbox` and `pdf_xobject_matrix`, which could potentially hide errors or unexpected behavior.
2. The code uses `fz_rethrow_if` in the error handling section, but it is not clear what this function does or how it is implemented. If it does not properly propagate exceptions, it could lead to unintended consequences.
3. The code uses a `FIXME` comment, which suggests that there may be unintended behavior or incomplete functionality in the code.

However, none of these issues directly relate to the vulnerabilities listed in the initial prompt, such as buffer overflows, use-after-free errors, memory leaks, etc. Therefore, based on the provided code, it does not appear to be vulnerable to those specific vulnerabilities.

That being said, it is always important to thoroughly understand the codebase and any dependencies it may have, as well as keep up-to-date with any security advisories or vulnerabilities related to the libraries or tools being used.",2319,275,14.794142484664917
177766,DoS," Based on the given code, the `ldap_push_filter` function does not appear to be directly vulnerable to a Denial of Service (DoS) attack as described in the vulnerability summary provided. The function is primarily concerned with encoding and pushing various LDAP filter types to an ASN.1 data structure. It does not involve any memory allocation or resource management that could be exploited for a DoS attack.

However, it is important to note that the code snippet provided is only a part of the larger system, and other parts of the codebase could still contain vulnerabilities. It is always recommended to perform a thorough vulnerability assessment on the entire codebase to ensure its security.

Therefore, the answer is 'NO'.",4677,157,8.953993082046509
177767,DoS," The given code for the function `decode_openldap_dereference` is not directly vulnerable to the DoS vulnerability described in the provided context. The vulnerability in the code you initially provided was related to memory allocation in the context of ASN.1 parsing, which is not present in the given code.

However, the code you provided as a second example, `canDistribute`, is not related to the vulnerability assessment you initially requested. It is a different function that appears to be implementing a combinatorial problem solution. This code does not contain any apparent security vulnerabilities.

Therefore, the answer is 'NO' for the given code.",2321,142,8.230332374572754
177768,DoS," Based on the provided code snippet, the function `sparse_dump_region` does not appear to be directly vulnerable to the DoS vulnerability described in the given CVE. However, it is important to note that the vulnerability may exist in other parts of the codebase, and the provided function could potentially be affected indirectly. Therefore, it is crucial to thoroughly review the entire codebase to ensure that all vulnerabilities are identified and addressed.

Answer: NO.",2773,101,5.741832494735718
177770,Bypass," Based on the given code, the `read_ndx_and_attrs` function does not appear to be directly vulnerable to the Bypass vulnerability described in the provided vulnerability summary. The function primarily deals with reading and processing file indices and related attributes, and does not seem to involve handling or validating user-supplied filenames or paths.

However, it is important to note that the vulnerability summary mentions that the issue is present in the `recv_files` function in `receiver.c` and the `read_ndx_and_attrs` function in `rsync.c`. The code snippet provided only shows the `read_ndx_and_attrs` function, so it is possible that the vulnerability exists in other parts of the codebase that were not included in the provided code snippet.

Therefore, based on the given code alone, the answer is 'NO'. However, it is crucial to consider the larger context of the codebase and the vulnerability summary to fully understand the security implications.",3587,222,12.222736358642578
177771,nan," The second code snippet provided is not related to the DNS parsing vulnerability discussed earlier. It is a separate function called `canDistribute` that appears to be implementing a solution for a combinatorial problem. This code does not contain any apparent security vulnerabilities.

Therefore, the answer is 'NO'.",2012,68,3.9093406200408936
177773,DoS Exec Code Overflow Mem. Corr.," The given code for `create_surface_from_thumbnail_data` function is not directly vulnerable to the mentioned vulnerabilities in the list. However, it does contain a potential integer overflow issue in the `for` loop condition `j = height; j; j--`. If `height` is not properly validated or checked, an attacker could potentially pass a large value, causing the loop to iterate an excessive number of times, leading to a denial-of-service (DoS) condition.

However, the second code snippet provided is not related to the C++ code you initially asked about, and it doesn't seem to have any apparent vulnerabilities. It's a separate function that calculates whether a given set of numbers can be distributed among a given set of quantities.",1777,168,9.133664608001709
177774,DoS Exec Code Overflow," Based on the given code, there are no obvious buffer overflow, use-after-free, memory leak, or integer overflow vulnerabilities. However, there are some potential issues:

1. The code does not check the return value of `gmalloc` and `gmallocn`, which could lead to memory leaks if the allocation fails.
2. The code does not check the return value of `new ImageStream(str, width, colorMap->getNumPixelComps(), colorMap->getBits())`, which could lead to a failure to allocate memory and an unhandled exception.
3. The code does not check the return value of `str->close()`, which could lead to a failure to close the stream and a potential resource leak.
4. The code does not validate user input, such as the width and height parameters, which could lead to invalid values and potential vulnerabilities.
5. The code does not check the return value of `splash->drawImage(src, &imgData, srcMode, maskColors? gTrue : gFalse, width, height, mat)`, which could lead to a failure to draw the image and an unhandled exception.

Overall, while there are some potential issues, none of them appear to be directly related to security vulnerabilities like buffer overflows, use-after-free errors, or memory leaks. However, it is always important to validate user",3452,301,16.247909784317017
177775,DoS Exec Code Overflow," Based on the given code, the ArthurOutputDev::drawImage function does not appear to be directly vulnerable to the integer overflow vulnerability described in the CVE-2009-3605. However, it does call other functions that may be vulnerable, such as ImageStream::getLine() and colorMap->getRGBLine(). These functions could potentially contain integer overflows, leading to the vulnerability if they are called with unvalidated user input. Therefore, it is important to ensure that these functions are properly validated and sanitized to prevent such vulnerabilities.

In summary, the ArthurOutputDev::drawImage function itself is not vulnerable to the described integer overflow vulnerability, but it may call vulnerable functions, so proper input validation and sanitization are necessary.",2690,165,9.11502718925476
177777,DoS Exec Code Overflow," Yes, the given C++ code is vulnerable to integer overflows. The vulnerability lies in the for loop where the mask is generated by multiplying maskColors[2*i] and maskColors[2*i+1] with 255. If the values of maskColors[2*i] and maskColors[2*i+1] are not properly checked or validated, an integer overflow can occur, leading to unintended behavior or even code execution.

The specific vulnerability referenced in the code snippet is CVE-2009-3605, with a CWE-ID of CWE-189. This vulnerability can result in a denial of service (DoS) or potentially arbitrary code execution via a crafted PDF file.",3220,169,9.391999959945679
177778,DoS Exec Code Overflow," Based on the given code, there are no obvious buffer overflow, use-after-free, memory leak, or integer overflow vulnerabilities. However, there are some potential issues:

1. The code does not validate the input parameters, such as width, height, maskWidth, and maskHeight. If these values are not properly checked, it could lead to out-of-bounds access or other issues.
2. The code uses the gmalloc function to allocate memory, but there is no check for memory allocation failure. This could lead to undefined behavior if the memory cannot be allocated.
3. The code uses the cairo_matrix_init_translate and cairo_matrix_scale functions without checking their return values. If these functions fail, it could lead to unexpected behavior.
4. The code uses the cairo_pattern_create_for_surface function to create patterns from images, but it does not check the return value for failure. If the function fails, it could lead to undefined behavior.
5. The code uses the cairo_set_source function to set the source pattern, but it does not check the return value for failure. If the function fails, it could lead to undefined behavior.

Overall, while there are some potential issues in the code, none of them appear to be directly related to the vulnerabilities you listed in your initial question. However, it is always important to validate input parameters, check memory allocation",3504,301,16.271734714508057
177779,DoS Exec Code Overflow," Based on the given code, there are no obvious buffer overflow or integer overflow vulnerabilities. However, there are some potential memory leaks and resource management issues. For instance, the code does not properly close or free the maskImage and maskPattern after use, and it does not check if the image and pattern creations were successful before continuing. These issues could potentially lead to memory leaks or other resource-related vulnerabilities.

However, the code does not appear to contain any DoS, Exec, Code, or Overflow vulnerabilities as described in the original vulnerability summary.

Therefore, the answer is 'NO'.

Regarding the second code snippet, it is a separate function that calculates whether a given set of numbers can be distributed among a given set of quantities. It does not involve any C++ code related to the original vulnerability, so it is not relevant to the vulnerability assessment.",3564,192,10.572429418563843
177780,DoS Exec Code Overflow," Based on the given code, the `GfxImageColorMap` constructor does not appear to contain any obvious integer overflow vulnerabilities. The code checks the value of `maxPixel` and limits it to 255 if it exceeds that value. Additionally, the code uses the `gmalloc` function to allocate memory, which should handle integer overflows by returning a null pointer if the requested memory size is too large.

Therefore, the answer is 'NO'.",3786,100,5.801060914993286
177781,DoS Exec Code Overflow," The given code for `GfxImageColorMap::getGrayLine` function does not appear to contain any obvious buffer overflow, use-after-free, memory leak, or null pointer dereference vulnerabilities. However, it does contain integer arithmetic operations, so it is important to ensure that inputs are validated and that integer overflows do not occur.

The `canDistribute` function is not related to the `GfxImageColorMap::getGrayLine` function, so it is not directly relevant to the vulnerability assessment of the given code.

Therefore, the answer is 'NO'. However, it is important to note that the absence of vulnerabilities in the given code does not guarantee that the code is completely secure, and further analysis may be required to ensure that all potential vulnerabilities have been addressed.",1604,176,10.11571717262268
177783,DoS Exec Code Overflow," The given code for `GfxImageColorMap::getRGBLine` function is not directly related to the vulnerability described in the CVE-ID CVE-2009-3605. The vulnerability mentioned in the CVE-ID is related to integer overflows in Poppler, which is not present in the given code.

Therefore, the answer is 'NO'. The given code is not vulnerable to the DoS, Exec, Code, Overflow vulnerability mentioned in the CVE-ID.",1598,114,6.290703535079956
177786,DoS Exec Code Overflow," Based on the given code, there are no obvious buffer overflow, use-after-free, memory leak, or null pointer dereference vulnerabilities. However, there are some potential integer overflow vulnerabilities. For instance, in the following line:

`n = 1 << colorMap->getBits();`

If `colorMap->getBits()` is not properly validated, it could potentially result in an integer overflow. Similarly, in the following switch statement:

`switch (colorMode) {... }`

If `colorMode` is not properly validated, it could potentially result in an integer overflow as well. To mitigate these risks, it is recommended to validate user inputs and ensure that calculations do not exceed the maximum representable value for the integer type used.

Additionally, there are some other potential vulnerabilities in the code, such as race conditions, insecure function usage, and improper error handling. However, these vulnerabilities are not directly related to the given code snippet and would require further analysis to determine if they exist.

Therefore, the answer is:

YES, there are potential integer overflow vulnerabilities in the code.",3448,249,13.569916725158691
177787,DoS Exec Code Overflow," Based on the given code, it is not immediately clear if there is a vulnerability related to integer overflows or any other type of vulnerability. However, there are several potential issues that should be investigated further:

1. The code does not check the return value of `new` when allocating memory for `maskColorMap`, `maskBitmap`, and `imgData.lookup`. If memory allocation fails, the code continues execution, which could lead to undefined behavior or memory leaks.
2. The code does not check the return value of `gmalloc` when allocating memory for `imgData.lookup`. If memory allocation fails, the code continues execution, which could lead to undefined behavior or memory leaks.
3. The code does not check the return value of `new ImageStream(maskStr, maskWidth, 1, 1)` and `new ImageStream(str, width, colorMap->getNumPixelComps(), colorMap->getBits())`. If memory allocation fails, the code continues execution, which could lead to undefined behavior or memory leaks.
4. The code does not check the return value of `new SplashBitmap(width, height, 1, splashModeMono1, gFalse)` and `new Splash(maskBitmap, gFalse)`. If memory allocation fails, the code continues execution, which could lead to undefined behavior or memory leaks.
",4554,301,16.442914247512817
177788,DoS Exec Code Overflow," Based on the given code, there are no obvious buffer overflow, use-after-free, memory leak, integer overflow/underflow, null pointer dereference, or improper input validation vulnerabilities. However, there are some potential race conditions and insecure function usage issues.

The code does not appear to have any buffer overflow vulnerabilities as it does not use functions like strcpy, sprintf, or any other string manipulation functions without proper bounds checking.

There are no use-after-free errors as all pointers are properly deallocated before being used again.

Memory leaks are not present as all dynamically allocated memory is properly deallocated.

There are no integer overflow/underflow vulnerabilities as all integer operations are performed with proper bounds checking.

There are no null pointer dereferences as all pointers are checked for null before being dereferenced.

The code does not have any obvious improper input validation vulnerabilities as it does not process user input directly.

However, there are potential race conditions in the following lines:

maskSplash->clear(maskColor);
maskSplash->drawImage(&imageSrc, &imgMaskData, splashModeMono8, gFalse, maskWidth, maskHeight, mat);

These lines could potentially allow concurrent access to the maskSplash object, leading to inconsistent program states or data corruption. To mit",4260,301,16.31959056854248
177789,DoS Exec Code Overflow," Based on the given code, the `poppler_page_prepare_output_dev` function does not contain any obvious buffer overflow or memory management vulnerabilities. However, it does perform integer calculations with unchecked user input (`width` and `height` from `page->page->getCropWidth()` and `page->page->getCropHeight()`). This could potentially lead to integer overflows or underflows if the input values are maliciously crafted.

To mitigate this risk, it's recommended to validate and sanitize the input values before performing any arithmetic operations. This can be done by checking if the values fall within expected ranges or by using safe functions like `std::min` and `std::max` to limit the values.

Therefore, the answer is:

YES, the code is vulnerable to Integer Overflow/Underflow (CWE-190, CWE-191) due to unchecked user input in the calculation of `width` and `height`.",2026,221,11.923528909683228
177792,DoS Exec Code Overflow," The given SplashBitmap constructor code does not directly contain any obvious buffer overflow, use-after-free, memory leak, or integer overflow vulnerabilities. However, it does call gmalloc() to allocate memory, which could potentially lead to memory-related vulnerabilities if not used properly.

The code snippet provided for canDistribute() function is not related to the SplashBitmap constructor and does not contain any apparent vulnerabilities. It is a separate function that uses dynamic programming to solve a combinatorial problem.

Therefore, the answer is 'NO' for both the SplashBitmap constructor and the canDistribute() function.",1694,136,7.431338548660278
177793,DoS Exec Code Overflow," Based on the given code, the SplashFTFont::makeGlyph function does not appear to be directly vulnerable to integer overflows. However, it does call other functions that may be vulnerable, such as FT_Load_Glyph and FT_Render_Glyph. These functions could potentially contain integer overflows, leading to the DoS, Exec, Code, Overflow vulnerability described in the CVE-2009-3605. Therefore, it is recommended to thoroughly review these functions and ensure that proper bounds checking and input validation are implemented to prevent integer overflows.

However, the provided code snippet itself does not contain any integer overflow vulnerabilities. The code appears to be handling integer values correctly, with proper bounds checking and input validation.

Therefore, the answer is 'NO', the SplashFTFont::makeGlyph function is not vulnerable to integer overflows based on the given code.",2830,201,11.077721357345581
177794,nan," The given code snippet `DynamicMetadataProvider::DynamicMetadataProvider(const DOMElement* e)` is not directly related to the nan vulnerability described in the provided context. It is a constructor for a C++ class, and it does not involve any network communication or metadata processing that could be susceptible to the nan vulnerability. Therefore, the answer is 'NO'.",1938,78,4.425349473953247
177795,nan," The given code snippet `DynamicMetadataProvider::DynamicMetadataProvider(const DOMElement* e)` is not directly related to the nan vulnerability described in the provided context. This code appears to be a constructor for a DynamicMetadataProvider class, which is parsing XML configuration data and initializing class members accordingly. Based on the given code, there are no obvious security vulnerabilities.

However, it's essential to keep in mind that the code might still have other vulnerabilities, such as buffer overflows, use-after-free errors, memory leaks, or other issues. The provided code snippet does not exhibit any of these vulnerabilities.

Therefore, the answer is 'NO'.",2086,150,8.226505517959595
177796,Overflow," The given code for `nfs_readlink_req` function is not directly related to the provided C++ code for the `canDistribute` function. Therefore, I cannot evaluate the vulnerability of the `canDistribute` function based on the given information.

However, I can tell you that the `nfs_readlink_req` function is vulnerable to a buffer overflow. The vulnerability arises from the fact that the length of the new path is read into a `len` variable and then used to allocate memory for the `target` variable without proper bounds checking. An attacker could potentially provide a larger path length than intended, causing a buffer overflow and leading to arbitrary code execution or a denial-of-service condition.",1826,156,8.523690938949585
