case_id,vuln_type,audit_report,input_token_num,output_token_num,inference_time
177917,Exec Code," Based on the provided code, the XGetFontPath function does not appear to be directly vulnerable to the Exec_Code vulnerability described in the given CVE. The function is primarily concerned with handling and parsing data received from an X11 server, and does not involve executing arbitrary code or data.

However, it is important to note that the code should still be reviewed for other potential vulnerabilities, such as buffer overflows, use-after-free errors, memory leaks, and other issues mentioned in the original list. The code snippet provided does not contain any obvious signs of these vulnerabilities, but a thorough analysis would be required to confirm this.

Therefore, the answer is 'NO', but with the caveat that the code should still be carefully reviewed for other potential vulnerabilities.",1992,171,9.322072267532349
177918,Exec Code," The given code for the function `XListExtensions` is not directly related to the `canDistribute` function. Therefore, I cannot evaluate the vulnerability of the `canDistribute` function based on the provided code.

Regarding the `XListExtensions` function, the code appears to be handling the memory allocation and unpacking of the received data correctly. However, there are some potential issues that should be considered:

1. The code does not check the return value of `_XReply` and `GetEmptyReq`. If these functions fail, the code continues execution, which could lead to undefined behavior.
2. The code does not check the value of `rep.nExtensions` before allocating memory for the `list` array. If `rep.nExtensions` is 0, the code will still attempt to allocate memory, which could lead to a memory leak or other issues.
3. The code does not check the return value of `Xmalloc` when allocating memory for `list` and `ch`. If `Xmalloc` fails, the code will continue execution, which could lead to a memory leak or other issues.
4. The code does not check the value of `rep.length` before allocating memory for `ch`. If `rep.length` is 0 or negative, the code will attempt to allocate memory with a size of 0 or a negative number, which could lead to undefined",2042,301,16.100083827972412
177919,nan," Based on the provided code, the XListFonts function itself does not appear to be vulnerable to the nan vulnerability described in the initial code snippet. However, the code does contain other potential vulnerabilities, such as memory leaks and buffer overflows, which should be addressed. The canDistribute function is not related to the XListFonts function and does not appear to contain any vulnerabilities based on the given code.",2586,90,5.159607410430908
177920,nan," The given XGetFontPath function is not directly related to the vulnerability described in the CVE-2018-14599. The vulnerability in the CVE is related to an off-by-one error in the XListExtensions function in libX11, which is not present in the provided XGetFontPath function.

Therefore, the answer is 'NO'. The XGetFontPath function does not contain the vulnerability described in the CVE-2018-14599.",1976,115,6.434555768966675
177921,nan," The second code snippet provided is not related to the vulnerability discussed earlier. It is a separate function called `canDistribute` written in C++. This function appears to be implementing a solution for the ""Partition to K Subsets"" problem.

Based on the given code, it does not contain any apparent security vulnerabilities. It is focused on solving a combinatorial problem and does not involve any memory management, input validation, or other security-sensitive operations. Therefore, the answer is 'NO'.",2060,107,5.965143918991089
177922,Exec Code Overflow," The given code for the function `add_param_to_argv` is not directly vulnerable to a buffer overflow as it checks the length of the `param_buffer` before appending a character and before setting the null terminator. However, the code does not follow secure coding practices and is prone to other vulnerabilities such as:

1. Improper Input Validation (CWE-20)
2. Insecure Function Usage (CWE-676)
3. Race Conditions (CWE-362)

These vulnerabilities can lead to various issues, including buffer overflows, code injection, and denial-of-service attacks. To mitigate these risks, consider the following recommendations:

1. Validate and sanitize user inputs before processing them.
2. Use safer alternatives to functions like `strtok` and `sprintf`.
3. Implement proper synchronization mechanisms for multi-threaded code.

However, the second code snippet provided does not seem to be related to the `add_param_to_argv` function and does not appear to contain any buffer overflow vulnerabilities. It is a separate function implementing a different algorithm.",2427,252,13.716994047164917
177923,Bypass," The given PHP code snippet is not C++ code, so it cannot be directly evaluated for vulnerabilities using the steps provided for C++ code. The provided code is written in the PHP scripting language.

To answer your question, the given code is not C++ code, so it is not vulnerable to the C++ vulnerabilities mentioned in the steps.",2029,75,4.372248888015747
177926,Exec Code Overflow," The given code for `gst_vorbis_tag_add_coverart` function is not directly related to the code snippet you provided for the `canDistribute` function. Therefore, I cannot determine if the `canDistribute` function is vulnerable based on the provided code alone.

However, I can tell you that the `gst_vorbis_tag_add_coverart` function is vulnerable to a heap-based buffer overflow due to an integer overflow in the calculation of the memory allocation for `img_data`. This is a known vulnerability with a CVE-ID of CVE-2009-0586 and a CWE-ID of CWE-189. The vulnerability allows attackers to execute arbitrary code by providing a specially crafted COVERART tag with a base64-encoded image that is larger than expected.",2033,188,10.27133584022522
177927,nan," Based on the given code, the `openssl_seal()` function is not directly vulnerable to the nan vulnerability described in the provided vulnerability summary. The nan vulnerability is related to the OpenSSL sealing function not checking its return value, which is not the case in the provided code as it checks the return value of `EVP_SealInit()`, `EVP_SealUpdate()`, and `EVP_SealFinal()`.

Therefore, the answer is 'NO'.",4134,108,6.218978404998779
