case_id,vuln_type,audit_report,input_token_num,output_token_num,inference_time
177862,Exec Code," The given `restore_page_device` function does not directly involve user input or string manipulation functions, so it is less likely to have buffer overflow or use-after-free vulnerabilities. However, it does contain some potential issues:

1. The code uses `gs_currentdevice(pgs_old)` and `gs_currentdevice(pgs_new)` twice in the same if condition, which might be an unintended duplicate. This could potentially lead to unexpected behavior or race conditions if the device state changes between the two calls.

2. The code does not check the return value of `(*dev_proc(dev_old, get_page_device)) (dev_old)` and `(*dev_proc(dev_new, get_page_device)) (dev_new)`. If these functions return an error, the code might continue with uninitialized or incorrect device pointers, leading to undefined behavior.

3. The code does not check for null pointers before dereferencing them in the if condition `if (dev_old!= dev_new)`. If `dev_old` or `dev_new` is null, the code will attempt to dereference a null pointer, causing a crash or undefined behavior.

4. The code does not implement proper error handling for the case when `dev_t1` or `dev_t2` are not equal.",1415,301,16.246833086013794
177865,DoS," The given code for the `PatternMatch` function is not directly related to the `visiblePoints` function. Therefore, I cannot determine if the `visiblePoints` function is vulnerable based on the provided code alone.

However, I can evaluate the `PatternMatch` function for potential vulnerabilities. Based on the given code, the `PatternMatch` function does not appear to be vulnerable to the specific DoS vulnerability described in the CVE-2017-13720. The code does not contain the incorrect handling of '\0' characters that leads to the buffer over-read condition.

However, the `PatternMatch` function does contain recursive calls, which could potentially lead to stack overflow attacks if the input patterns are crafted carefully. It is essential to ensure proper bounds checking and input validation to prevent such attacks.

In summary, the `PatternMatch` function may not be vulnerable to the specific DoS vulnerability described in CVE-2017-13720, but it could be vulnerable to stack overflow attacks. The `visiblePoints` function, on the other hand, does not appear to be related to the vulnerability in the `PatternMatch` function and is not vulnerable based on the provided code.",1506,263,14.573940515518188
177867,nan," Based on the provided code snippet, the `gs_main_finit` function does not appear to be directly vulnerable to the use-after-free (CWE-416) vulnerability described in the given context. However, it does call other functions that could potentially contain such vulnerabilities. For instance, `interp_reclaim` and `alloc_restore_all` could free memory that is later used by `gs_main_finit`. Therefore, it is essential to ensure that these functions are implemented correctly to avoid use-after-free vulnerabilities.

However, the `visiblePoints` function provided at the end of the code snippet is not related to the `gs_main_finit` function and does not seem to have any security vulnerabilities based on the given code.

So, the answer is:

For `gs_main_finit`: 'Maybe'
Reason: It calls other functions that could potentially contain use-after-free vulnerabilities.

For `visiblePoints`: 'No'",4502,223,12.656415462493896
177869,nan," Based on the provided code, the `zsetcolor` function does not appear to be directly vulnerable to the nan vulnerability described in the given CVE. However, it does call other functions that could potentially be vulnerable, such as `get_space_object` and `validate_spaces`. These functions should be examined in more detail to determine if they contain any nan vulnerabilities.

Therefore, the answer is: 'Partially'. The `zsetcolor` function itself may not be vulnerable, but it calls other functions that could potentially be vulnerable.

However, it's important to note that the `visiblePoints` function provided at the end of the code snippet is not related to the `zsetcolor` function and should not be considered when evaluating its vulnerability.",2711,166,9.2454514503479
177870,nan," The second code snippet provided is not related to the first vulnerability discussed. It is a separate function called ""visiblePoints"" that takes a vector of vectors of integers, an angle, and a vector of integers as arguments and returns the number of visible points.

This function does not appear to contain any obvious security vulnerabilities. It performs the following tasks:

1. It initializes a static constant ""PI"" as the value of atan2(0, -1).
2. It initializes an empty vector ""arr"" to store the angles between each point and the given location.
3. It iterates through the points vector and calculates the angle between each point and the given location. If the point is the same as the given location, it increments a counter ""extra"".
4. It sorts the arr vector in ascending order.
5. It makes the vector circular by adding the angles that are greater than 2 to the beginning of the vector.
6. It calculates the angle ""d"" based on the given angle and the number of degrees in a circle (360).
7. It initializes a variable ""result"" to 0 and two pointers ""left"" and ""right"" to the beginning and end of the arr vector, respectively.
8. It iterates through the arr vector and finds the number of points that are visible based on the given angle ""d"".",1211,301,16.49119234085083
177874,Exec Code Overflow," Based on the provided code, the `aes_crypt_ecb` function does not appear to be vulnerable to the Exec_Code_Overflow vulnerability described in the previous example. The code does not involve user input or unchecked array indices, and it properly handles the memory accesses related to the AES encryption and decryption functions. Therefore, the answer is 'NO'.",3488,81,4.7993223667144775
177875,Exec Code Overflow," Based on the provided code, the `s_aes_process` function does not appear to be directly vulnerable to the Exec_Code_Overflow vulnerability described in the example. The function is handling AES decryption and does not contain any code that would allow an attacker to execute arbitrary code.

However, it is essential to note that the code snippet provided is incomplete, and it is impossible to determine if there are any other vulnerabilities in the surrounding code. It is always recommended to perform a thorough vulnerability assessment on the entire codebase to ensure its security.",2558,122,6.829673528671265
177879,DoS Exec Code Overflow," The second code snippet provided, `visiblePoints` function, does not appear to contain any buffer overflow, use-after-free, memory leak, integer overflow/underflow, null pointer dereference, or improper input validation vulnerabilities based on the given code. However, it does contain some potential issues:

1. Race conditions: The function does not use any synchronization mechanisms to ensure that the `points` vector is not modified during its execution. This could potentially lead to inconsistent program states or data corruption if multiple threads access the vector concurrently.

2. Insecure resource management: The function does not check if the `points` vector is a valid pointer before accessing it. This could potentially lead to a null pointer dereference if the pointer is null.

3. Improper error handling: The function does not handle any potential exceptions or errors that may occur during its execution. This could potentially lead to vulnerabilities if the application doesnt properly address error conditions.

4. Cryptographic issues: The function does not use any cryptographic functions, so there are no cryptographic issues to address.

5. Sensitive data exposure: The function does not log or transmit any sensitive information, so there are no sensitive data exposure vulnerabilities to address.

Overall, while there are some potential issues in the code, none of them directly relate to the security vulnerabilities you listed in the first code snippet",1783,301,16.982802152633667
177880,Bypass," The given `check_file_permissions_reduced` function is not directly related to the `visiblePoints` function provided. Therefore, I cannot determine if the `visiblePoints` function is vulnerable based on the provided code alone.

However, I can evaluate the `check_file_permissions_reduced` function for potential vulnerabilities as per the steps you've outlined:

1. Buffer Overflow: The function does not involve any string or memory functions like `strcpy`, `sprintf`, `memcpy`, or array access that could lead to buffer overflow vulnerabilities.
2. Use After Free: The function does not dynamically allocate memory and then free it, so there are no pointers that could be used after they have been freed.
3. Memory Leaks: The function does not dynamically allocate memory using `new` or `malloc` and does not forget to free it, so there are no memory leaks.
4. Integer Overflow/Underflow: The function does not involve any arithmetic operations on integer types that could lead to overflow or underflow conditions.
5. Null Pointer Dereference: The function checks pointers for null before dereferencing them.
6. Improper Input Validation: The function does not involve user input processing, so there is no need for input validation.
7. Race Conditions: The function is not multi-threaded, so there are no race",2189,301,16.221379280090332
177881,DoS," The given C++ code for the function `drm_load_edid_firmware` is vulnerable. The vulnerability is due to the unchecked use of `kstrdup` function, which can result in a NULL pointer dereference if the input string is empty. This can lead to a denial-of-service (DoS) vulnerability as the function may crash when the pointer is dereferenced.

The second function `visiblePoints` is not vulnerable as it does not involve any memory allocation or pointer dereferencing that could lead to a NULL pointer dereference or buffer overflow vulnerability.",1217,129,7.611891269683838
177883,nan," Based on the provided code, it does not appear to contain any of the vulnerabilities listed in the initial instructions. The code is primarily focused on memory allocation and adding a new hook to a list, with no apparent interaction with user input, network connections, or cryptographic functions. Therefore, the answer is 'NO'.",1445,65,3.8730838298797607
177887,DoS Overflow," The second code snippet provided, `visiblePoints` function, does not appear to contain any obvious buffer overflow, use-after-free, memory leak, or integer overflow vulnerabilities. It does involve the use of `atan2` and `sort` functions, but these functions are not inherently vulnerable on their own. The code also involves some calculations with angles and doubles, but these operations do not seem to involve any unchecked user input or arithmetic operations that could lead to integer overflow.

Therefore, my answer is 'NO'.",2107,115,6.4011712074279785
177891,DoS," The given code for the function `rsa_pss_decode` is not directly related to the `visiblePoints` function. Therefore, I cannot determine if the `visiblePoints` function is vulnerable based on the provided code.

However, I can evaluate the `rsa_pss_decode` function for vulnerabilities as requested.

The `rsa_pss_decode` function appears to be parsing an ASN.1 sequence and decoding an RSA-PSS parameter structure. It checks if the sequence contains a mask generation function parameter and, if so, extracts it.

The vulnerability in this code is related to the NULL pointer dereference that can occur when the mask generation function parameter is missing. When the `if (pss->maskGenAlgorithm)` condition is not met, the `pmaskHash` pointer is not initialized. Later in the code, when the `*pmaskHash` pointer is dereferenced, it can result in a NULL pointer dereference and application crash.

This vulnerability can be exploited to cause a denial of service (DoS) by sending malicious RSA-PSS signatures without the mask generation function parameter to the vulnerable application.

Therefore, the answer is:

YES, the `rsa_pss_decode` function is vulnerable to a NULL pointer dereference and denial of service (DoS)",1216,301,16.14585018157959
177893,+Info," Based on the given code, the `test_mod_exp` function is not directly vulnerable to the vulnerabilities listed in the steps provided. However, it does call the `BN_mod_exp` and `BN_mod_exp_mont_consttime` functions, which were found to be vulnerable in the OpenSSL library. Therefore, the code using this function may still be vulnerable if the OpenSSL library being used is affected by the CVE-2015-3193 vulnerability.

To mitigate this risk, it is recommended to update the OpenSSL library to a version that is not affected by this vulnerability. Alternatively, consider using a different library or algorithm for modular exponentiation to avoid this risk entirely.

So, the answer is: 'YES', but only if the OpenSSL library being used is affected by the CVE-2015-3193 vulnerability.",2815,197,10.940727472305298
177896,nan," The given code for the `become_daemon` function is not directly related to the vulnerability described in the provided context. The code appears to be implementing a daemon process, which is not vulnerable to the nan vulnerability mentioned in the CVE-ID and CWE-ID.

Therefore, the answer is 'NO'.",1114,72,4.090095520019531
177897,+Info," The given C++ code for the `visiblePoints` function does not appear to contain any obvious security vulnerabilities related to the provided list of vulnerabilities. It mainly deals with vector manipulation and angle calculations. However, it's essential to note that this conclusion is based on the provided code snippet alone. If there are other parts of the codebase that interact with user input or external data, those areas should be thoroughly audited for potential vulnerabilities.",1447,94,5.2539801597595215
177898,+Info," The given code for the function `visiblePoints` is not directly related to the XML parsing code provided earlier and does not appear to contain any obvious security vulnerabilities. It is just a function that calculates the number of visible points from a given angle and location. Therefore, the answer is 'NO'.",1365,63,3.592289686203003
177899,+Info," The given code for the function `visiblePoints` is not directly related to the vulnerability described in the provided context. It appears to be an unrelated function that calculates the number of visible points based on a given angle and location. Therefore, it is not vulnerable to the XML External Entity (XXE) issue mentioned in the vulnerability summary.

However, it's important to note that the code snippet provided for the `soap_xmlParseFile` function is vulnerable to the XXE issue as described in the vulnerability summary.",1391,114,6.296982526779175
177900,+Info," The given C++ code for the function `soap_xmlParseMemory` is not directly related to the vulnerability described in the provided CVE-ID (CVE-2013-1824) and its corresponding CWE-ID (CWE-200). The vulnerability is related to the SOAP parser in PHP, not in the given C++ code. Therefore, the answer is 'NO'.",1281,90,5.039053440093994
177901,Overflow," The second code snippet, `visiblePoints()` function, does not appear to contain any buffer overflow vulnerabilities. The function is processing arrays and doubles, and there are no string manipulation functions or memory allocation calls that could lead to buffer overflow issues. Therefore, the answer is 'NO'.",967,62,3.5213539600372314
177904,DoS," Based on the given code, the `Splash::blitMask` function does not appear to be vulnerable to the specific vulnerabilities listed in the provided steps (Buffer Overflow, Use After Free, Memory Leaks, Integer Overflow/Underflow, Null Pointer Dereference, Improper Input Validation, Race Conditions, Insecure Function Usage, Insecure Resource Management, Improper Error Handling, Cryptographic Issues, or Sensitive Data Exposure).

However, it is important to note that the code should still be reviewed for other potential vulnerabilities or coding best practices. The code snippet provided does not contain any obvious vulnerabilities related to the steps mentioned.

Therefore, the answer is 'NO'.",1837,156,8.62248158454895
177905,DoS," Based on the provided code, the Splash::arbitraryTransformMask function does not appear to be vulnerable to the specific vulnerabilities listed in the steps you provided. However, there are still other potential vulnerabilities that could exist, such as buffer overflows, use-after-free errors, or integer overflows, that were not covered in the steps. It's important to note that the absence of vulnerabilities in the given code does not guarantee that the code is completely secure.

Regarding the additional code you provided, it does not seem related to the Splash::arbitraryTransformMask function, so it does not affect the vulnerability assessment of that function. However, it does contain a potential vulnerability in the use of the 'arr' vector. The 'arr' vector is populated with the atan2 values of the differences between each point and the 'location' vector. However, there is no bounds checking on the 'arr' vector, so if the number of points is large enough, it could potentially cause a buffer overflow. Additionally, the 'arr' vector is sorted and made circular, but there is no check to ensure that the circular comparison does not go beyond the bounds of the vector. This could also potentially lead to a buffer overflow. It's important to ensure that the 'arr' vector is properly sized and that bounds checking is implemented to prevent buffer overflows.",3375,295,16.68245816230774
177906,DoS Exec Code Overflow," Based on the given code, the `Splash::makeDashedPath` function does not appear to be directly vulnerable to the mentioned vulnerabilities (DoS, Exec, Code, Overflow) as it does not involve any memory manipulation or user input handling that could lead to these types of vulnerabilities. However, it is always important to keep in mind that other parts of the codebase could still contain vulnerabilities. It is recommended to perform a thorough vulnerability assessment on the entire codebase to ensure its security.",2866,109,6.476794719696045
177907,DoS Exec Code Overflow," Based on the given code, the `Splash::scaleMaskYuXd` function does not appear to be directly vulnerable to the mentioned vulnerabilities (DoS, Exec, Code, Overflow) as it does not involve user input, dynamic memory allocation without proper bounds checking, or insecure function usage. However, it does contain some potential issues, such as potential integer overflows or underflows in the calculations, and potential race conditions in the multi-threaded code. It is essential to ensure proper bounds checking and synchronization mechanisms are in place to prevent these issues.

The second function, `visiblePoints`, is not related to the C++ code provided in the initial question, so it is not directly relevant to the vulnerability assessment.

Therefore, the answer is:

For the `Splash::scaleMaskYuXd` function: NO (it does not appear to be vulnerable to the mentioned vulnerabilities, but it does contain potential issues that should be addressed).

For the `visiblePoints` function: N/A (it is not related to the given C++ code).",1652,237,12.802456140518188
177909,DoS Exec Code Overflow," Based on the given code, the `Splash::scaleMaskYdXu` function does not appear to be directly vulnerable to the mentioned vulnerabilities (DoS, Exec, Code, Overflow) as it does not involve user input, memory allocation beyond the bounds of allocated memory, or the use of insecure functions. However, it does contain some potential issues such as memory leaks and improper error handling. It is always recommended to validate user inputs, check for buffer overflows, and use secure functions to prevent potential vulnerabilities.

The second function, `visiblePoints`, is not related to the C++ code provided in the initial question, so it is not directly relevant to the vulnerability assessment.

Therefore, the answer is 'NO' for the given code.",1638,167,9.292375564575195
177910,DoS," The given code for the function `token_continue` does not appear to contain any obvious vulnerabilities related to the provided list. However, it does call the function `gs_scan_handle_refill` which is not shown in the code snippet. If this function contains any vulnerabilities, they could potentially be exploited in the context of the `token_continue` function.

The second function `visiblePoints` is not related to the `token_continue` function and does not contain any apparent vulnerabilities.

Therefore, the answer is 'NO'.",1227,120,6.6658782958984375
177911,Exec Code Overflow," The given `tt_cmap10_validate` function is not directly related to the `visiblePoints` function provided. Therefore, I cannot determine if the `visiblePoints` function is vulnerable based on the provided code alone.

However, I can evaluate the `tt_cmap10_validate` function for potential vulnerabilities as per the steps mentioned in the task:

1. Buffer Overflow: The function does not involve any string or memory functions like strcpy, sprintf, memcpy, or array access. It only deals with length and pointer calculations. Therefore, it does not seem to have buffer overflow vulnerabilities.

2. Use After Free: The function does not dynamically allocate memory or free it. It only deals with local pointers. Therefore, it does not have use-after-free vulnerabilities.

3. Memory Leaks: The function does not dynamically allocate memory and does not forget to free it. Therefore, it does not have memory leak vulnerabilities.

4. Integer Overflow/Underflow: The function checks the length and pointer calculations against the valid limit. It also checks the glyph indices against the valid glyph count. These checks should prevent integer overflow/underflow vulnerabilities.

5. Null Pointer Dereference: The function checks the pointers for null before dereferencing them. Therefore, it does not have null pointer dereference vulnerabilities.

6. Impro",1092,301,16.03445267677307
177912,Exec Code Overflow," The given code for `tt_cmap12_validate` function is not directly related to the `visiblePoints` function. Therefore, the vulnerability analysis for `tt_cmap12_validate` does not affect the `visiblePoints` function.

The `visiblePoints` function appears to be a separate function that calculates the number of visible points within a certain angle range. It does not involve any memory management or integer arithmetic operations that could lead to buffer overflows or integer overflows.

Thus, the `visiblePoints` function is not vulnerable to the Exec_Code_Overflow vulnerability or any other vulnerabilities related to the `tt_cmap12_validate` function.

Therefore, the answer is 'NO'.",1330,165,9.006053924560547
177913,Exec Code Overflow," Based on the provided code snippet, the `tt_cmap8_validate` function does not appear to be directly vulnerable to integer overflows or Exec_Code_Overflow vulnerabilities as described in the CVE-2009-0946 vulnerability. The code snippet provided does not contain any obvious signs of buffer overflows or use-after-free errors either.

However, it is essential to note that the code snippet provided is an incomplete function, and it is impossible to determine if there are any vulnerabilities in other parts of the code. Additionally, the code snippet does not include any input validation, which could potentially introduce vulnerabilities if user input is not properly sanitized.

Therefore, the answer is 'NO', but it is crucial to keep in mind that the code snippet provided is an incomplete function, and other parts of the code could potentially contain vulnerabilities.",2332,197,10.848465919494629
177915,Exec Code Overflow," Based on the provided code snippet, the `cff_charset_load` function does not directly involve the `visiblePoints` function. Therefore, the `visiblePoints` function itself is not vulnerable to the Exec, Code, Overflow vulnerability mentioned in the given context.

However, it's essential to keep in mind that the overall application or system might still be vulnerable to other types of vulnerabilities, such as those mentioned in the steps you've outlined. The `visiblePoints` function should be reviewed for any potential vulnerabilities related to those steps.

In summary, the `visiblePoints` function is not vulnerable to the Exec, Code, Overflow vulnerability mentioned in the context of the `cff_charset_load` function.",1912,162,9.595048666000366
177917,Exec Code," The given XGetFontPath function does not appear to be directly vulnerable to the Exec_Code vulnerability described in the provided context. The function is primarily concerned with handling and returning a list of font paths, and does not involve executing external code or data.

However, it is always important to ensure proper bounds checking and memory management when dealing with user input or external data. In this case, the function does check the size of the received data and properly allocates memory for the list of font paths. It also checks for null pointers before dereferencing them.

Therefore, based on the given code, the XGetFontPath function does not appear to be vulnerable to the Exec_Code vulnerability.

Regarding the visiblePoints function, it is not related to the XGetFontPath function and does not involve any external data or user input. It appears to be a standalone function for calculating the number of visible points within a given angle range. The function does not involve any memory management or bounds checking that could lead to vulnerabilities.

Therefore, both the XGetFontPath and visiblePoints functions appear to be safe based on the given code.",1654,247,13.34118103981018
