case_id,vuln_type,audit_report,input_token_num,output_token_num,inference_time
177796,Overflow," The given C++ code for the `nfs_readlink_req` function is not directly related to the `visiblePoints` function. Therefore, I cannot evaluate the vulnerability of the `visiblePoints` function based on the provided code.

Regarding the `nfs_readlink_req` function, it appears to be vulnerable to a buffer overflow issue. The code does not check the size of the `data` array or the length of the response before copying the data into the target buffer using `xzalloc`. An attacker could potentially send a maliciously crafted request with a larger response size than expected, causing a buffer overflow and leading to arbitrary code execution or a denial-of-service condition.

Therefore, the answer is 'YES' and the vulnerability is due to a lack of proper bounds checking when copying data into the target buffer.",1488,187,10.232253313064575
177799,Overflow," The given C++ code for the function `_XcursorReadImage` does not appear to be vulnerable to integer overflows based on the provided code snippet. The code checks the width and height values read from the file against hardcoded limits (0x10000), which should prevent integer overflows from occurring.

However, it's important to note that the code snippet provided may not represent the entire function or the context in which it's used. It's always recommended to perform a thorough analysis of the entire codebase to ensure that all potential vulnerabilities are identified and addressed.

Therefore, the answer is 'NO', and the given code is not vulnerable to integer overflows based on the provided code snippet.",1619,161,9.001493692398071
177807,Bypass," The given code for `znumicc_components` function is not directly related to the `visiblePoints` function provided. Therefore, I cannot determine if the `visiblePoints` function is vulnerable based on the provided code.

However, I can evaluate the `znumicc_components` function for vulnerabilities as per the given steps:

1. Buffer Overflow: The code does not contain any obvious buffer overflow vulnerabilities as it uses `gsicc_get_profile_handle_buffer` and `gs_gstate_memory` functions to allocate memory, which should handle bounds checking.

2. Use After Free: The code does not contain any use-after-free vulnerabilities as it properly decrements the reference count of `picc_profile` before returning.

3. Memory Leaks: The code does not contain any memory leaks as it properly deallocates the memory allocated for `picc_profile->buffer` and `picc_profile->memory`.

4. Integer Overflow/Underflow: The code does not contain any integer overflow or underflow vulnerabilities as it uses the `intval` member of the `value` struct, which should handle integer conversions properly.

5. Null Pointer Dereference: The code does not contain any null pointer dereferences as it checks for null pointers before dereferencing them.

6. Improper Input Validation: The code",1769,301,16.649688243865967
177809,Bypass," The given `restore_page_device` function is not directly related to the `visiblePoints` function provided. However, I'll evaluate the `restore_page_device` function based on the vulnerability description and CVE-ID you've provided.

YES, the `restore_page_device` function is vulnerable to a stack overflow attack due to insufficient checks on the available stack space when the device remains the same. This vulnerability can be exploited to bypass intended access restrictions.",2130,107,6.0276038646698
177811,DoS," The given `aspath_put` function is not directly related to the `visiblePoints` function. Therefore, I cannot determine if the `visiblePoints` function is vulnerable based on the provided code.

However, I can evaluate the `aspath_put` function based on the information provided in the vulnerability summary. Based on the summary, the `aspath_put` function is vulnerable to a denial of service (DoS) attack due to an invalid message construction issue.

Therefore, my answer is:

YES, the `aspath_put` function is vulnerable to a denial of service (DoS) attack. The vulnerability is caused by an incorrect calculation of the message size, which can result in an invalid message being constructed and causing a session drop.",2089,167,9.165135622024536
177812,Bypass," The sum_update function does not directly involve user input or input validation, so it is not vulnerable to the vulnerabilities listed in the initial instructions, such as buffer overflow, use-after-free, memory leaks, integer overflow/underflow, null pointer dereference, improper input validation, race conditions, insecure function usage, insecure resource management, or improper error handling.

However, the code does contain a potential vulnerability related to the CVE-2017-15994 Bypass vulnerability in rsync. The vulnerability arises when the code does not properly handle the sumresidue variable, which can lead to data being processed out of order. This could potentially allow an attacker to bypass intended access restrictions.

In the given code, the sum_update function checks if the length of the input data plus the current sumresidue is less than the CSUM_CHUNK size. If this condition is true, the function copies the input data into the sumresidue buffer and updates the sumresidue variable. However, if the condition is false, the function processes the input data in chunks of CSUM_CHUNK size.

An attacker could potentially manipulate the input data to cause the sumresidue variable to exceed the CSUM_CHUNK size, causing the function to process the input data in smaller chunks. By carefully crafting the input data",1294,301,16.223817110061646
177815,Bypass," The given `file_checksum` function is not directly related to the `visiblePoints` function. Therefore, I cannot determine if the `visiblePoints` function is vulnerable based on the provided code.

However, I can evaluate the `file_checksum` function based on the information provided in the vulnerability summary. The vulnerability summary mentions a Bypass vulnerability in rsync, and the code snippet provided is part of the rsync code. Therefore, I can conclude that the `file_checksum` function is vulnerable.

The vulnerability allows an attacker to bypass intended access restrictions by manipulating archaic checksums. The specific issue is that the code does not properly handle the last block of data when computing the checksum for certain checksum types. This can lead to incorrect checksums being computed, allowing an attacker to bypass access restrictions.

Therefore, the answer is:

YES, the `file_checksum` function is vulnerable to a Bypass vulnerability.",1924,220,12.501816511154175
177816,Bypass," The given `get_checksum2` function is not directly related to the `visiblePoints` function. However, I'll evaluate the `get_checksum2` function based on the provided code.

YES, the `get_checksum2` function is vulnerable to a Bypass vulnerability. The issue lies in the MD4 checksum calculation where the `mdfour_update` function is not called when `len - i <= 0` or `xfersum_type == CSUM_MD4_BUSTED`. This can lead to incorrect checksum calculations and potential security vulnerabilities.",1984,131,7.311938285827637
177821,DoS," The given IRCView::openTags function does not appear to be directly vulnerable to the mentioned vulnerabilities in the provided list. However, the visiblePoints function is not directly related to the IRCView::openTags function, so it should be evaluated separately.

To evaluate the visiblePoints function, you would need to follow the steps mentioned in the provided list, focusing on potential vulnerabilities related to buffer overflow, use-after-free, memory leaks, integer overflow/underflow, null pointer dereference, improper input validation, race conditions, insecure function usage, insecure resource management, improper error handling, cryptographic issues, and sensitive data exposure.

Based on the given code snippet, the visiblePoints function does not seem to have any obvious vulnerabilities. However, it is always a good practice to thoroughly review the code and ensure that all inputs are properly validated and that any dynamic memory allocation is handled correctly. Additionally, the use of third-party libraries, such as the C++ standard library, should be verified for any potential vulnerabilities.

Therefore, the answer is 'NO' for the IRCView::openTags function, and no further information is provided regarding the visiblePoints function as it requires a separate evaluation.",1032,261,14.353534936904907
177823,Exec Code Overflow," Based on the given code, the `BufCompressedFill` function does not directly involve user input or string manipulation functions, so it does not appear to contain any of the vulnerabilities listed in the initial instructions. However, it is always important to keep in mind that vulnerabilities can exist in other parts of the codebase, and it's crucial to maintain a secure coding practice throughout the entire project.

The `visiblePoints` function, on the other hand, does not involve any C++ memory management or string manipulation functions, and it does not appear to contain any obvious vulnerabilities. It is written in a modern C++ style, using `vector` and `emplace_back` to manage dynamic arrays, and it does not involve any pointer arithmetic or other low-level memory manipulation.

Therefore, the answer is 'NO' for both functions.",2155,184,10.638678789138794
177825,DoS," The given code for the `extractPages` function does not appear to contain any obvious format string vulnerabilities. The `snprintf` function is used to format the destination file name, but it is properly checking the size of the `pathName` buffer before using it. Therefore, I would answer 'NO' for this code snippet.",1451,70,3.990513801574707
177826,DoS Exec Code Overflow," The second code snippet provided, named `visiblePoints`, does not contain any obvious buffer overflow vulnerabilities or other security issues related to the given steps in the initial question. The code appears to be calculating the number of visible points within a certain angle range. It uses standard C++ library functions and does not involve any string manipulation or memory management that could lead to buffer overflow vulnerabilities. Therefore, the answer is 'NO'.",1326,89,4.981905221939087
177827,nan," The given C++ code for the `visiblePoints` function does not appear to contain any obvious security vulnerabilities based on the provided code snippet. It is focused on calculating the number of visible points from a given location and angle. The code does not involve any string or memory manipulation functions, dynamic memory allocation, or user input handling, which are common sources of security vulnerabilities. Therefore, the answer is 'NO'.",1760,88,5.318758249282837
177831,nan," The given code snippet `mcid_char_imp` does not directly involve string manipulation functions like `strcpy`, `sprintf`, or array access, which are common causes of buffer overflow vulnerabilities. However, it does call `pdf_dict_del` and `pdf_drop_obj` functions, which could potentially manipulate PDF objects in memory.

To determine if this code is vulnerable, we need to understand how these functions are implemented and how they interact with the `tr` structure. If these functions do not properly check bounds or perform input validation, they could potentially lead to buffer overflow or other vulnerabilities.

However, the code snippet provided does not show the implementation of these functions, so it is impossible to determine if they are vulnerable based on this code alone. Therefore, I cannot definitively say whether this code is vulnerable or not.

To perform a thorough vulnerability audit, you would need to examine the implementation of these functions and the surrounding code to ensure that they are handling memory and input validation properly. Additionally, you would need to check for other vulnerabilities such as use-after-free, memory leaks, and integer overflows as mentioned in the original prompt.",1502,251,13.611713886260986
177832,nan," The second code snippet provided, `visiblePoints(vector<vector<int>>& points, int angle, vector<int>& location)` function, does not appear to contain any obvious buffer overflow or memory management vulnerabilities. It is written in C++ and involves vector manipulation, trigonometric calculations, and sorting. However, it does not involve any string manipulation or memory allocation functions that are commonly associated with buffer overflow vulnerabilities. Therefore, it is likely not vulnerable based on the given code alone.",1348,108,6.01263952255249
177833,DoS Overflow," The second code snippet provided does not contain any apparent buffer overflow vulnerabilities. The function `visiblePoints` is not handling any strings or memory allocations that could lead to buffer overflows. Therefore, the answer is 'NO'.",1367,49,2.8648343086242676
177839,+Info," The given code snippet `next_codepoint_handle_ext` is not directly related to the vulnerability described in the provided CVE-ID (CVE-2015-5330). The vulnerability in the CVE-ID is related to the LDAP server in Samba, which is not present in the given code. Therefore, the answer is 'NO'.",2022,83,4.737880229949951
177840,+Info," The given `ldb_dn_escape_internal` function is not directly related to the `visiblePoints` function. However, based on the provided code snippet, the `ldb_dn_escape_internal` function does not appear to be vulnerable to the specific vulnerability described in the CVE-2015-5330. This function seems to be handling string escaping correctly, with proper checks for the beginning or end of the string and proper handling of special characters.

Therefore, the answer is 'NO'. The `visiblePoints` function itself does not contain any apparent vulnerabilities based on the provided code.",1690,135,7.718196392059326
177841,+Info," The given C++ code for the function `strupper_talloc_n_handle` does not appear to be directly vulnerable to the vulnerabilities listed in the provided steps. However, it does call the function `next_codepoint_handle_ext` which could potentially have vulnerabilities if not implemented correctly. It is important to review the implementation of `next_codepoint_handle_ext` to ensure it properly handles string lengths and validates user inputs to prevent buffer overflows, integer overflows, and other vulnerabilities.

The second function `visiblePoints` does not seem to have any apparent vulnerabilities based on the provided code. It is a standalone function that calculates the number of visible points based on a given angle and location. It does not involve any string manipulation or memory management functions that could potentially lead to vulnerabilities.",1320,179,9.752585887908936
177842,+Info," The given code for the function `next_codepoint_handle_ext` is not directly related to the provided vulnerability description. Therefore, I cannot definitively say whether it is vulnerable or not based on the information provided.

However, I can tell you that the code does not appear to contain any obvious buffer overflow, use-after-free, memory leak, or integer overflow/underflow vulnerabilities based on the given code snippet. It does involve string handling with `strnlen`, but it seems to be used correctly with a limit of 5 characters.

The second code snippet provided is for a different function called `int visiblePoints` and is not related to the vulnerability described in the initial question. It appears to be a separate function that calculates the visible points around a given location based on an angle. This code does not contain any apparent vulnerabilities based on the given code snippet.",1234,191,11.029786825180054
177843,+Info," The given code for the function `strlen_m_ext_handle` does not directly involve user input or string manipulation functions like `strcpy`, `sprintf`, or `memcpy`, which are common sources of buffer overflow vulnerabilities. However, it does process input in the form of `src_charset` and `dst_charset`, which could potentially be malicious if not properly validated.

To determine if this code is vulnerable, we need to examine how these input parameters are handled. Based on the provided code snippet, there is no apparent input validation or sanitization for `src_charset` and `dst_charset`. This could potentially allow an attacker to manipulate these inputs and cause the function to behave unexpectedly or even crash, potentially leading to security vulnerabilities.

Therefore, the answer is: 'YES'. The code is vulnerable due to the lack of proper input validation for `src_charset` and `dst_charset`. This could potentially allow an attacker to manipulate these inputs and cause the function to behave unexpectedly or even crash, potentially leading to security vulnerabilities.

It is important to note that this analysis is based on the provided code snippet alone. In a real-world scenario, it is essential to consider the context in which this function is used, as well as any additional checks or validations that may be performed outside of this function.",2038,297,16.0906343460083
177844,+Info," The given C++ code for the function `strupper_talloc_n_handle` does not appear to be directly vulnerable to the vulnerabilities listed in the provided steps. However, it does use the `talloc_array` function to allocate memory, and if that function is not implemented securely, it could potentially lead to memory-related vulnerabilities such as buffer overflows or memory leaks. It is important to ensure that the memory allocation function is used correctly and securely, with proper bounds checking and error handling.

The second code snippet provided, `visiblePoints`, does not contain any apparent vulnerabilities based on the given code alone. However, as always, it is important to ensure that all inputs are properly validated and sanitized, and that any external libraries or functions used are also secure.",1340,172,9.46402645111084
177848,nan," The given code snippet for the function `do_connect` does not appear to contain any obvious vulnerabilities related to the provided list. However, it does contain a separate function `visiblePoints` which is not directly related to the `do_connect` function. The `visiblePoints` function seems to be calculating the visible angle of points in a 2D plane, and does not contain any apparent security vulnerabilities.

Therefore, the answer is 'NO'. The `do_connect` function is not vulnerable based on the provided code snippet.",1257,117,6.746275424957275
177850,DoS Overflow," Based on the given code, the `datum_to_json` function does not appear to be directly vulnerable to buffer overflows, as it does not involve the use of functions like `strcpy`, `sprintf`, or array access without proper bounds checking. However, it does call other functions (such as `array_to_json_internal` and `composite_to_json`) that may have their own buffer handling vulnerabilities. Therefore, it is still important to ensure that these called functions are implemented securely to prevent potential buffer overflows or other vulnerabilities.

Additionally, the `visiblePoints` function provided in the code snippet is not related to the `datum_to_json` function and does not involve any C++ standard library functions or memory management that could lead to buffer overflows or other security vulnerabilities. Therefore, it is not vulnerable based on the given code.

So, the answer is 'NO' for the `datum_to_json` function, and nothing more for the `visiblePoints` function.",3963,224,12.487693548202515
177851,DoS Overflow," The given `parse_array` function does not appear to be directly vulnerable to the mentioned vulnerabilities in the provided list. However, it does call other functions like `parse_array_element` which could potentially contain vulnerabilities. It's essential to review those functions as well.

The `visiblePoints` function does not seem to contain any obvious vulnerabilities based on the provided code. It performs some calculations and returns a result. There are no memory management functions, no user input handling, and no external function calls that could potentially introduce vulnerabilities.

However, it's important to note that the absence of vulnerabilities in the given code does not guarantee that the entire program is free of vulnerabilities. It's crucial to review the entire codebase to ensure its security.",1213,163,8.8854501247406
177852,DoS Overflow," The given `parse_object` function does not appear to be directly vulnerable to the mentioned vulnerabilities in the provided code snippet. However, it does call other functions like `parse_object_field` which could potentially contain vulnerabilities. It's essential to review those functions as well.

The `visiblePoints` function does not seem to have any apparent vulnerabilities based on the provided code. It performs calculations and manipulates vectors, but it does not involve any user input or memory management that could lead to vulnerabilities.",1415,110,6.068323135375977
177853,DoS Overflow," The given `setPath` function does not appear to be directly vulnerable to the mentioned vulnerabilities in the provided code snippet. However, it does call other functions like `setPathArray` and `setPathObject` which could potentially contain vulnerabilities. It is essential to review those functions as well.

The `visiblePoints` function does not contain any apparent vulnerabilities in the provided code snippet. It is a separate function from the `setPath` function and does not involve any memory management or input handling that could lead to vulnerabilities.",1529,114,6.335820436477661
177855,Bypass," Based on the provided code, it does not appear to be directly vulnerable to the Bypass vulnerability described in the given context. The code seems to be handling file paths and checking directory access, but it does not involve symlinks or substring relationships that could be exploited for bypassing intended access restrictions.

However, it is essential to note that this conclusion is based on the given code snippet alone. Other parts of the codebase or context could potentially introduce vulnerabilities. Always perform a thorough vulnerability assessment on the entire codebase to ensure comprehensive security.",2989,118,6.744307518005371
177856,nan," The given C++ code does not contain the `do_ed_script` function from the vulnerable code snippet provided earlier. Therefore, it cannot be evaluated for the nan vulnerability based on the information provided.

Answer: NO.",2820,51,3.1353399753570557
177857,nan," The given code for the function 'plan_a' does not directly involve the 'visiblePoints' function provided. Therefore, the vulnerability analysis for 'plan_a' should be based on the code provided for 'plan_a' only.

Based on the provided code for 'plan_a', it appears to be vulnerable to a buffer overflow issue. The vulnerability arises from the'safe_open' function call, which does not check the return value of 'open' function properly. If the 'open' function fails, the 'ifd' variable will remain uninitialized, and when the code later attempts to close the file descriptor, it will result in undefined behavior. This can potentially lead to a buffer overflow or other security vulnerabilities.

Therefore, the answer is:

YES - The code is vulnerable to a buffer overflow issue due to the unchecked return value of the'safe_open' function call.",1367,196,10.752964973449707
177859,Exec Code Bypass," The gs_nulldevice function provided in the code snippet is not directly related to the visiblePoints function. Therefore, the vulnerability analysis should be focused on the gs_nulldevice function.

Based on the given information, it is not possible to definitively determine if the gs_nulldevice function is vulnerable without a more thorough analysis. However, some potential vulnerabilities that could be present in the code include:

1. Buffer Overflow: The gs_copydevice function is used to copy a device structure, and it does not have any bounds checking. If the size of the memory allocated for the new device structure is not sufficient, it could result in a buffer overflow.
2. Use-after-Free: The gs_free_object function is used to free the memory allocated for the new device structure if the gs_setdevice_no_erase function fails. If the gs_setdevice_no_erase function is called multiple times with the same device structure, the memory could be freed multiple times, leading to a use-after-free vulnerability.
3. Integer Overflow: The code does not check for integer overflow when calculating the size of the arr vector in the visiblePoints function. If the number of elements in the points vector is large enough, it could result in an integer overflow, leading to unexpected behavior.

To perform a thorough vulner",1359,301,16.395426034927368
177860,Exec Code Bypass," The given code for the function `zrestore` does not directly contain any apparent vulnerabilities related to the provided list. However, it does call other functions like `restore_check_stack` and `restore_fix_stack` which could potentially contain vulnerabilities. It is essential to review those functions' implementations as well.

The `visiblePoints` function, on the other hand, does not seem to contain any apparent vulnerabilities based on the provided code. It is a standalone function that calculates the number of visible points from a given angle and location. It does not involve any memory management, input validation, or other potential vulnerability sources.

Therefore, the answer is:

For zrestore: 'Maybe'
For visiblePoints: 'No'",1393,162,8.879176378250122
