case_id,vuln_type,audit_report,input_token_num,output_token_num,inference_time
177918,Exec Code," The given `XListExtensions` function is not directly related to the `visiblePoints` function. Therefore, I cannot determine if the `visiblePoints` function is vulnerable based on the provided code.

However, I can evaluate the `XListExtensions` function based on the information you've provided. The function appears to be vulnerable to a buffer overflow issue. The vulnerability is due to the fact that the `length` variable is assumed to be signed, but it should be treated as an unsigned value. This can lead to an out-of-bounds write condition, potentially resulting in a denial-of-service or remote code execution attack.

Therefore, the answer is:

YES (Buffer Overflow)",1704,153,8.401207447052002
177919,nan," The given code is not directly related to the vulnerability described in the provided context. The code snippet is a separate function named `visiblePoints` which does not involve any network communication or memory handling that could lead to the nan vulnerability. Therefore, the answer is 'NO'.",2248,58,3.4280190467834473
177920,nan," The given XGetFontPath function does not appear to be directly vulnerable to the mentioned nan vulnerability (CVE-2018-14599, CWE-682). The function is responsible for retrieving a list of font paths from the X server and returning them as a null-terminated array. It does not involve any network communication or untrusted input handling, which are common factors in nan vulnerabilities.

However, it is essential to note that the code snippet provided is only a part of the XGetFontPath function. It is possible that other parts of the code or related functions may be vulnerable. It is always recommended to thoroughly review the entire codebase and follow secure coding practices to minimize potential vulnerabilities.

In summary, the given code snippet is not vulnerable to the nan vulnerability mentioned in the question.",1638,181,9.87490177154541
177921,nan," The second code snippet provided is not related to the first vulnerability discussed. It appears to be a separate function called `visiblePoints` written in C++. Based on the given code, this function does not exhibit any obvious security vulnerabilities. It performs some calculations on a vector of vectors and returns the number of visible points based on a given angle and location. The code does not involve any memory management, string manipulation, or input validation that could lead to common security vulnerabilities. Therefore, the answer is 'NO'.",1722,108,6.041923999786377
177922,Exec Code Overflow," The given code for the function `add_param_to_argv` is vulnerable. The reason is that it does not properly check the length of the input string being parsed and copied into the `param_buffer` array. If the input string is longer than the size of the buffer, it can result in a buffer overflow, leading to arbitrary code execution or a crash.

The vulnerability is similar to the one described in the provided CVE-ID (CVE-2019-11360) and CWE-ID (CWE-119). The code does not have any bounds checking on the input string, and it does not limit the size of the `param_buffer` array, making it susceptible to a buffer overflow attack.",2089,162,8.941801071166992
177923,Bypass," The given PHP code for the function `move_uploaded_file` is not directly related to the C++ code you provided. Therefore, I cannot determine if the C++ code is vulnerable based on the information given.

However, I can tell you that the PHP code is vulnerable to a file name manipulation attack, as described in the CVE-2015-2348 vulnerability. This vulnerability allows an attacker to bypass intended extension restrictions and create files with unexpected names.

As for the C++ code, it does not appear to involve file handling or user input validation, so it is unlikely to be vulnerable to the same issue. However, it is always important to follow secure coding practices when handling user input or file I/O in C++ as well.",1691,167,9.152796745300293
177926,Exec Code Overflow," The given C++ code for the `gst_vorbis_tag_add_coverart` function is not directly related to the `visiblePoints` function you provided. Therefore, I cannot determine if the `visiblePoints` function is vulnerable based on the provided code.

However, I can evaluate the `gst_vorbis_tag_add_coverart` function based on the information you've given. Based on the description and the CVE-ID you've provided, it appears that the `gst_vorbis_tag_add_coverart` function is vulnerable to an integer overflow. This vulnerability can lead to a heap-based buffer overflow, which can be exploited by attackers to execute arbitrary code.

Therefore, the answer is:

YES, the `gst_vorbis_tag_add_coverart` function is vulnerable to an Exec_Code_Overflow vulnerability due to an integer overflow.",1695,204,11.145298957824707
177927,nan," The given PHP code does not contain any C++ code, so it cannot be evaluated for C++ vulnerabilities directly. The code snippet provided is written in PHP, and it appears to be handling OpenSSL encryption and decryption. To evaluate its security, you would need to look for vulnerabilities specific to PHP, such as improper input validation, lack of error handling, or insecure function usage.

However, if you want to check for C++ vulnerabilities in the given code, you would first need to extract the C++ code from it. The code snippet provided does not contain any C++ code.

Therefore, my answer is: NO.",3796,139,8.279347896575928
