case_id,vuln_type,audit_report,input_token_num,output_token_num,inference_time
177736,Bypass," Based on the provided code, the samldb_check_user_account_control_acl function does not directly contain any apparent vulnerabilities related to the given list. However, it does call external functions and uses external data structures, so it's essential to consider the security context of those components.

The vulnerability described in the text provided, CVE-2015-8467, is not directly related to the code snippet given. The code snippet provided is a separate function that appears to be handling security descriptors and user account control flags.

Therefore, the answer is 'NO'. However, it's crucial to remember that the security of the entire system depends on the proper implementation and interaction of all its components. The absence of vulnerabilities in one function does not guarantee the absence of vulnerabilities in the entire system.",2390,180,9.875038862228394
177740,DoS Exec Code Overflow Mem. Corr.," The given `asn1_time_to_time_t` function is vulnerable. The vulnerability is due to the lack of proper bounds checking when parsing the time string. An attacker can provide a maliciously crafted time string that is longer than expected, leading to a buffer overflow. This can result in arbitrary code execution or a denial of service (DoS) attack.

The `visiblePoints` function, on the other hand, does not appear to be vulnerable based on the provided code. It does not involve any string or memory manipulation functions that could lead to buffer overflows or other vulnerabilities.",1884,133,7.431881427764893
177741,DoS Overflow," The given `gnutls_session_get_data` function is vulnerable. The vulnerability is due to the lack of proper bounds checking when copying data from `psession.data` to `session_data`. If the size of `psession.data` exceeds the size of `session_data`, it can result in a buffer overflow, leading to a denial-of-service attack.

The second code snippet, `visiblePoints` function, is not vulnerable to the mentioned vulnerabilities in the given code. It doesn't involve any memory handling or string manipulation that could lead to buffer overflow or other security vulnerabilities.",1136,137,7.807790517807007
177742,DoS Overflow," The given `gnutls_session_get_data` function is vulnerable. The vulnerability is due to the lack of proper bounds checking on the size of the `session_data` buffer. If the size of the `psession.data` is larger than the allocated size of `session_data`, it can result in a buffer overflow, leading to a denial-of-service attack or arbitrary code execution.",1106,88,5.166300058364868
177743,DoS, The given C++ code for the `visiblePoints` function does not contain any apparent security vulnerabilities. It is focused on calculating the number of visible points from a given location and angle.,3725,40,2.6439368724823
177747,DoS," The given `bgp_attr_unknown` function is vulnerable. The reason is that it does not properly initialize the `total` variable, which can be exploited by remote attackers to cause a denial of service (bgpd crash) via a crafted BGP update.",1961,60,3.5431911945343018
177750,DoS Exec Code," The given `begin_softmask` function does not directly contain any obvious vulnerabilities based on the provided code snippet. However, it does manipulate pointers to `pdf_gstate` and `pdf_xobject` structures, which could potentially be vulnerable to use-after-free attacks if those pointers are not properly managed.

To determine if this code is vulnerable, a more thorough analysis would be required, including checking the context in which this function is called, the lifetimes of the pointers, and the handling of memory allocation and deallocation.

The `visiblePoints` function does not contain any apparent vulnerabilities based on the provided code snippet. It is a pure function that calculates the number of visible points based on a given angle and a list of points. It does not involve any memory management or pointer manipulation, so it is unlikely to be vulnerable to the types of issues mentioned in the provided vulnerability audit steps.",1981,200,10.934691429138184
177766,DoS," The given code for the function `ldap_push_filter` does not appear to contain any obvious buffer overflow or memory management vulnerabilities. However, it does call other functions (e.g., `asn1_push_tag`, `asn1_write_OctetString`, etc.) that could potentially have vulnerabilities. It is important to ensure that these called functions are also secure and properly handle memory allocation.

Additionally, the code for the function `visiblePoints` does not involve any memory management or string manipulation functions, so it is unlikely to contain any buffer overflow or memory management vulnerabilities.

However, it is essential to note that the absence of vulnerabilities in the given code does not guarantee that the entire program is free of vulnerabilities. It is crucial to perform a thorough analysis of the entire codebase to ensure its security.",4339,180,10.121318340301514
177767,DoS," The given code for the function `decode_openldap_dereference` is not directly vulnerable to the DoS vulnerability described in the provided context. The vulnerability in the code you initially provided was due to the lack of checking the return values of ASN.1 memory allocation functions, which could lead to memory exhaustion and a denial of service.

The code you provided for `decode_openldap_dereference` does not exhibit this behavior, as it checks the return values of the `talloc` and `asn1_load` functions and returns false if they fail. Therefore, the answer is 'NO'.",1983,136,7.552753686904907
177768,DoS," Based on the provided code, the `sparse_dump_region` function does not appear to be directly vulnerable to the DoS vulnerability described in the given vulnerability summary. The function is responsible for reading and writing data from a file, but it does not involve handling user input or file access from other users. However, it is still important to ensure proper bounds checking and memory management in this function to prevent other types of vulnerabilities.

The `visiblePoints` function, on the other hand, is not related to the given C++ code and does not appear to have any vulnerabilities based on the provided code alone.

Therefore, the answer is:

For `sparse_dump_region`: NO
For `visiblePoints`: NO.",2435,161,8.899765729904175
177770,Bypass," The given code for the function `read_ndx_and_attrs` does not appear to contain any obvious vulnerabilities based on the provided code snippet. However, it is important to note that the entire codebase should be thoroughly audited to ensure security. The function seems to be handling file indices and receiving file lists, but it does not contain any obvious buffer overflows, use-after-free errors, memory leaks, or other common vulnerabilities.

However, it is essential to remember that this analysis is based on the provided code snippet alone. The entire codebase should be thoroughly audited to ensure security.

Therefore, the answer is 'NO'.",3249,143,8.071733713150024
177771,nan," The second code snippet provided, `visiblePoints(vector<vector<int>>& points, int angle, vector<int>& location)` function, does not appear to contain any obvious buffer overflow, use-after-free, memory leak, integer overflow/underflow, null pointer dereference, or improper input validation vulnerabilities based on the given code. However, it does perform some calculations with doubles and uses the `atan2` function, which could potentially lead to floating-point issues or inaccuracies. Additionally, the function uses the `sort` and `size` functions, which could potentially hide memory management vulnerabilities if those functions are not used correctly with the provided `arr` vector. It is recommended to review the implementation of these functions and ensure they are used correctly to mitigate any potential risks. Overall, the code appears to be relatively safe based on the provided information.",1674,185,10.14722490310669
177773,DoS Exec Code Overflow Mem. Corr.," The given `create_surface_from_thumbnail_data` function does not appear to be vulnerable to the listed types of vulnerabilities based on the provided code. However, it's essential to note that the function's behavior could change if the input parameters (width, height, rowstride, and data) are not properly validated or if there are other unchecked conditions. Therefore, it's crucial to ensure proper input validation and error handling in the calling code.

The second function, `visiblePoints`, is not directly related to the C++ code vulnerabilities discussed in the initial prompt. It appears to be a separate function that calculates the number of visible points based on a given angle and location. This function does not contain any apparent vulnerabilities based on the provided code.",1439,164,9.277629375457764
177774,DoS Exec Code Overflow," Based on the given code, the `SplashOutputDev::drawImage` function does not appear to be directly vulnerable to the integer overflow vulnerability described in the CVE-2009-3605. However, it does allocate memory for `imgData.lookup` based on the number of colors in the color map, which could potentially lead to a memory leak or a buffer overflow if the color map contains a large number of colors. It is important to ensure that the memory allocation for `imgData.lookup` is properly checked and managed to prevent such issues.

Additionally, the `visiblePoints` function is not shown in the code snippet provided, so it cannot be evaluated for vulnerabilities in this context.

Therefore, the answer is:

NO (for the `SplashOutputDev::drawImage` function)

However, it is important to note that the code snippet provided may not be the complete or accurate representation of the actual codebase, and other vulnerabilities or issues may exist elsewhere in the code. A thorough vulnerability assessment should be conducted on the entire codebase to ensure its security.",3114,241,13.30396032333374
177775,DoS Exec Code Overflow," Based on the given code, the ArthurOutputDev::drawImage function does not appear to contain any obvious buffer overflow, use-after-free, memory leak, or null pointer dereference vulnerabilities. However, it does contain integer overflows when checking the pixel values against maskColors. This could potentially lead to incorrect image processing or even a crash. It is also important to note that the code does not validate user input, so there is a risk of injection attacks if the input is not properly sanitized before use. Additionally, the code does not handle errors properly, which could lead to unintended behavior or vulnerabilities if an error occurs. Overall, while there are potential vulnerabilities in the code, the ArthurOutputDev::drawImage function itself does not appear to be critically vulnerable based on the provided code snippet.",2352,171,9.86811876296997
177777,DoS Exec Code Overflow," Based on the given code, the `CairoOutputDev::drawImage` function does not appear to be directly vulnerable to the mentioned vulnerability (DoS, Exec, Code, Overflow) as described in the provided vulnerability summary. However, it's essential to note that the code might still have other vulnerabilities or issues. The code snippet provided does not involve any integer overflow conditions, and there are no apparent unchecked arithmetic operations or user inputs that could lead to such vulnerabilities.

However, it's crucial to remember that the entire codebase should be thoroughly audited to ensure the absence of any vulnerabilities. The given code snippet might be a part of a larger system, and other parts of the codebase could still be vulnerable.

Therefore, the answer is 'NO', but it's essential to perform a comprehensive vulnerability assessment on the entire codebase to ensure its security.",2882,194,11.287340641021729
177778,DoS Exec Code Overflow," Based on the given code, the `CairoOutputDev::drawMaskedImage` function does not appear to be directly vulnerable to integer overflows, buffer overflows, use-after-free errors, or other vulnerabilities mentioned in the provided list. However, it does allocate and manipulate memory dynamically, so it's essential to ensure proper bounds checking and memory management when handling user input or external data.

The code snippet provided is not sufficient to determine if there are any vulnerabilities related to input validation, race conditions, or insecure function usage. It's crucial to review the entire context of the codebase and the data sources to ensure the security of the application.

Therefore, the answer is 'NO', but with the caveat that a thorough analysis of the entire codebase and data sources is necessary to ensure the absence of vulnerabilities.",3166,183,10.816883087158203
177779,DoS Exec Code Overflow," Based on the given code, the function `CairoOutputDev::drawSoftMaskedImage` does not appear to be directly vulnerable to integer overflows. However, it does allocate memory dynamically and manipulate pointers, so there could be potential vulnerabilities related to buffer overflows or use-after-free errors. It is important to carefully examine the code that initializes and manipulates these pointers to ensure proper bounds checking and memory management.

However, the function `visiblePoints` in the provided code snippet is not part of the `CairoOutputDev::drawSoftMaskedImage` function, so it is not directly related to the vulnerability assessment of the given code.

Therefore, the answer is:

NO (for the CairoOutputDev::drawSoftMaskedImage function)

However, it is always recommended to perform a thorough vulnerability assessment on all the functions and libraries used in a project to ensure the overall security of the application.",3226,207,12.018491268157959
177780,DoS Exec Code Overflow," Based on the given code, the `GfxImageColorMap::GfxImageColorMap` function does not appear to be directly vulnerable to integer overflows, DoS, Exec, Code, or buffer overflow vulnerabilities. However, it does allocate memory dynamically and there are no checks on the size of the input data, so there is a potential for memory leaks or out-of-bounds memory access if the input data is malicious. Additionally, there are no checks on the input pointers, so null pointer dereferences could occur if the input pointers are null.

The `visiblePoints` function is not shown in the code snippet provided, so it cannot be evaluated for vulnerabilities.

Therefore, the answer is:

Part 1: 'NO' (for the `GfxImageColorMap::GfxImageColorMap` function)
Part 2: 'Cannot evaluate' (for the `visiblePoints` function)",3448,203,11.26073670387268
177781,DoS Exec Code Overflow," Based on the provided code snippet, the `GfxImageColorMap::getGrayLine` function does not appear to be directly vulnerable to the mentioned vulnerability (DoS, Exec, Code, Overflow). However, it does call other functions (`colorSpace2->getGrayLine`) that may be vulnerable, depending on their implementation. It is essential to review those functions for potential integer overflows or other vulnerabilities.

The second code snippet, `int visiblePoints(vector<vector<int>>& points, int angle, vector<int>& location)`, does not contain any apparent vulnerabilities related to the mentioned vulnerability (DoS, Exec, Code, Overflow). It is a separate function that calculates the number of visible points based on a given angle and location.",1266,171,9.368973016738892
177783,DoS Exec Code Overflow," Based on the provided code snippet, the `GfxImageColorMap::getRGBLine` function does not appear to be directly vulnerable to the mentioned vulnerabilities (DoS, Exec, Code, Overflow) as it does not involve user input, dynamic memory allocation, or arithmetic operations without proper bounds checking. However, it does call other functions (`colorSpace2->getRGBLine` and `colorSpace->getRGBLine`) that could potentially have vulnerabilities. Therefore, it is essential to review those functions as well.

The second function, `int visiblePoints(vector<vector<int>>& points, int angle, vector<int>& location)`, does not seem to have any apparent vulnerabilities related to the mentioned vulnerabilities. It involves sorting a vector and calculating angles, but there are no memory allocations, user inputs, or arithmetic operations without proper bounds checking.

In summary, the first function might be vulnerable if the called functions (`colorSpace2->getRGBLine` and `colorSpace->getRGBLine`) have vulnerabilities. The second function appears to be safe.",1260,237,12.894871234893799
177786,DoS Exec Code Overflow," Based on the given code, the `SplashOutputDev::drawImage` function does not appear to be directly vulnerable to the integer overflow vulnerability described in the CVE-2009-3605. However, it does allocate memory for `imgData.lookup` based on the number of colors in the color map, which could potentially be large. If the color map contains a large number of colors, this could lead to a memory allocation that is too large, resulting in a memory exhaustion denial-of-service attack. Additionally, the code does not check the return value of `gmalloc` or `new`, which could result in use-after-free vulnerabilities if the memory is not properly freed.

Therefore, while the `SplashOutputDev::drawImage` function itself may not be directly vulnerable to the integer overflow vulnerability described in CVE-2009-3605, it does contain other potential vulnerabilities that should be addressed.

Here are some recommendations to improve the security of the code:

1. Check the return value of `gmalloc` and `new` to ensure that memory is allocated successfully before using it.
2. Free the memory allocated for `imgData.lookup` and `imgData.imgStr` when they are no longer needed to prevent use-after-free vulnerabilities.
3. Consider using a safer alternative to `g",3110,301,17.35704755783081
177787,DoS Exec Code Overflow," Based on the given code, the `SplashOutputDev::drawMaskedImage` function does not appear to contain any obvious buffer overflow or integer overflow vulnerabilities. However, it does allocate memory dynamically and there are no checks on the size of the input data, so there could be potential for memory leaks or out-of-bounds memory access if the input data is maliciously crafted. It is also using various functions and libraries, some of which may have their own vulnerabilities, so it is important to ensure that these components are up-to-date and secure.

Therefore, the answer is: 'NO', but with the caveat that the code should be thoroughly tested and all dependencies should be kept up-to-date to ensure security.",4216,161,9.664743423461914
177788,DoS Exec Code Overflow," Based on the given code, there are no obvious buffer overflow, use-after-free, memory leak, or integer overflow vulnerabilities. However, there are some potential issues:

1. The code does not check the return value of `gmalloc()` and `new` calls, which could lead to memory leaks if the allocation fails.
2. The code does not validate user input, such as the width, height, and maskWidth, maskHeight parameters. This could potentially lead to out-of-bounds access or other vulnerabilities if these values are not properly checked.
3. The code uses `gfree()` to free memory allocated with `gmalloc()`, but it is not clear where this memory was originally allocated. This could potentially lead to use-after-free vulnerabilities if the memory is not properly managed.
4. The code uses `splash->drawImage()` function without checking its return value, which could potentially hide errors or vulnerabilities in the function implementation.
5. The code uses `splashModeMono1`, `splashModeMono8`, `splashModeRGB8`, `splashModeBGR8`, `splashModeXBGR8`, and `splashModeCMYK8` constants without defining them, which could potentially lead to confusion or errors when reading or maintaining the code.

Overall, while there are some potential issues in the code, there",3922,301,17.277715921401978
177789,DoS Exec Code Overflow," Based on the given code, the `poppler_page_prepare_output_dev` function does not appear to be directly vulnerable to integer overflows or any other security vulnerabilities mentioned in the provided list. However, it does allocate memory using `gmalloc` and create a `cairo_surface_t` object, which could potentially lead to memory leaks or other issues if not managed properly. It is always a good practice to ensure that memory is properly allocated, used, and released in a timely and secure manner.

The second code snippet provided, `visiblePoints` function, is not directly related to the `poppler_page_prepare_output_dev` function and does not contain any apparent security vulnerabilities. It is a standalone function that calculates the number of visible points within a given angle and location.

Therefore, the answer is 'NO' for both pieces of code. However, it is essential to ensure that memory is managed correctly in the `poppler_page_prepare_output_dev` function to avoid potential memory leaks or other issues.",1688,230,13.225199699401855
177792,DoS Exec Code Overflow," The given SplashBitmap constructor code does not directly contain any obvious buffer overflow, use-after-free, memory leak, or integer overflow vulnerabilities. However, it does call gmalloc, which is a C library function for dynamic memory allocation. If the memory allocation fails, the program may terminate abnormally, leading to a denial-of-service condition. Additionally, the code does not check the return value of gmalloc, which could potentially allow a DoS attack if the attacker can cause the allocation to fail.

However, the second code snippet provided, int visiblePoints(vector<vector<int>>& points, int angle, vector<int>& location), does not appear to have any direct security vulnerabilities. It is a separate function that calculates the number of visible points based on a given angle and location. It does not involve any memory management or string manipulation functions that could lead to common security vulnerabilities.

Therefore, the answer is:

For the SplashBitmap constructor code: 'YES', it has a potential DoS vulnerability due to the lack of checking the return value of gmalloc.

For the int visiblePoints(vector<vector<int>>& points, int angle, vector<int>& location) function: 'NO', it does not have any obvious security vulnerabilities.",1356,283,15.943153858184814
177793,DoS Exec Code Overflow," Based on the given code, the `SplashFTFont::makeGlyph` function does not appear to be directly vulnerable to the DoS, Exec, Code, Overflow vulnerability described in the CVE-2009-3605. The function does involve memory allocation and manipulation, but it does not involve user input or unchecked arithmetic operations that could lead to integer overflows or other vulnerabilities.

However, it is important to note that the vulnerability in the code you provided earlier is a separate issue and should be addressed independently. The `SplashFTFont::makeGlyph` function may still have other vulnerabilities or issues that could be present, and it is always a good idea to thoroughly review all code for potential security vulnerabilities.

Regarding the second code snippet you provided, it is not related to the `SplashFTFont::makeGlyph` function and does not appear to contain any vulnerabilities based on the given code alone. It is a separate function that calculates the number of visible points within a given angle range.",2492,232,12.731906175613403
177794,nan," The given code snippet `DynamicMetadataProvider::DynamicMetadataProvider(const DOMElement* e)` is not directly related to the vulnerability described in the provided CVE-ID (CVE-2017-16853) and CWE-ID (CWE-347). The vulnerability in the CVE pertains to the OpenSAML-C library's failure to properly configure itself with MetadataFilter plugins and perform critical security checks.

Therefore, the code snippet itself is not vulnerable based on the information provided.",1600,122,6.749314308166504
177795,nan," The given code for `DynamicMetadataProvider` constructor does not directly contain any apparent vulnerabilities based on the provided code snippet. However, it does involve external libraries and configurations, which could potentially introduce vulnerabilities. For instance, the `XMLHelper::getFirstChildElement()` and `XMLToolingConfig::getConfig().TrustEngineManager.newPlugin()` functions could have vulnerabilities if not properly implemented or if they have vulnerabilities in their own codebase. Additionally, the use of `auto_ptr_char` and `string` classes could potentially hide memory management issues.

However, the code snippet itself does not contain any obvious buffer overflow, use-after-free, memory leak, integer overflow/underflow, null pointer dereference, or sensitive data exposure vulnerabilities.

It is essential to consider the entire context of the codebase, including the libraries and configurations used, to perform a thorough vulnerability assessment.",1748,196,10.647269010543823
