case_id,vuln_type,audit_report,gt,eval_score,eval_input_token_num,eval_output_token_num,eval_inference_time
177794,," Based on the provided code snippet, the DynamicMetadataProvider constructor does not appear to contain any obvious buffer overflow, use-after-free, memory leak, integer overflow/underflow, null pointer dereference, or sensitive data exposure vulnerabilities. However, it does contain other potential issues, such as:

1. Improper Input Validation: The code does not validate the input 'e' for null before calling e->getAttributeNS(nullptr, refreshDelayFactor). This could potentially lead to a null pointer dereference if 'e' is null.

2. Insecure Resource Management: The code creates and starts a new thread (m_cleanup_thread) without checking if it was successfully created. If the thread creation fails, the cleanup_fn function will still be called, potentially leading to undefined behavior.

3. Insecure Function Usage: The code uses the deprecated 'auto_ptr_char' type instead of the recommended'std::string' or'std::string_view' for handling strings.

4. Race Conditions: The code creates and starts a new thread (m_cleanup_thread) without any synchronization mechanism to prevent concurrent access to shared resources.

5. Cryptographic Issues: The code does not appear to contain any cryptographic functions, but it is still important to ensure that any cryptographic functions used elsewhere in the code are used correctly.

6. Other vulner",nan,2.0,726.0,6.0,0.9778773784637451
177795,," The given C++ code for `DynamicMetadataProvider::DynamicMetadataProvider` function does not appear to contain any obvious buffer overflow, use-after-free, memory leak, integer overflow/underflow, null pointer dereference, or sensitive data exposure vulnerabilities based on the provided code snippet. However, it does not cover all possible vulnerabilities, such as race conditions, insecure function usage, improper resource management, or improper error handling.

The code snippet provided mainly deals with XML parsing and configuration, so the primary focus should be on input validation and error handling. Make sure that user inputs, such as the XML elements and attributes, are properly validated and sanitized to prevent buffer overflows, injection attacks, and other vulnerabilities. Additionally, ensure that exceptions and errors are handled appropriately to prevent potential exploitation.

The second code snippet provided, `int sumOfFlooredPairs(vector<int>& nums)`, is not related to the vulnerability assessment of the first code snippet. It appears to be an unrelated function that calculates the sum of pairs of numbers in a vector while taking the floor of each number. This function does not contain any apparent vulnerabilities based on the provided code snippet.",nan,0.0,687.0,6.0,0.9062254428863525
177796,Overflow," The given C++ code for `nfs_readlink_req` function is vulnerable. The reason is that the `len` variable is calculated as the difference between the current pointer position and the beginning of the `data` array. If the `nfs_add_fh3` or `rpc_add_credentials` functions write more data than expected, the `len` calculation will be incorrect, leading to a buffer overflow when the `xzalloc` function is called. This can result in arbitrary code execution or a denial-of-service attack.",Overflow,3.0,565.0,6.0,0.9600999355316162
177799,Overflow," The given C++ code for _XcursorReadImage function does not appear to be vulnerable to integer overflow directly. However, it does read data from a file, and if the data is malicious, it could potentially lead to buffer overflows or other vulnerabilities. The code snippet provided does not show the implementation of _XcursorFileReadChunkHeader and _XcursorReadUInt functions, which could be the source of the vulnerability. Therefore, it is essential to review those functions' implementations to ensure proper bounds checking and input validation are in place.

Based on the given code snippet, the answer is: NO (not vulnerable to integer overflow). However, it is crucial to review the implementation of _XcursorFileReadChunkHeader and _XcursorReadUInt functions to ensure they are handling input correctly and checking bounds.",Overflow,2.0,621.0,6.0,0.9124925136566162
177807,Bypass," The given C++ code for `znumicc_components` function does not directly contain any apparent vulnerabilities based on the provided code snippet. However, it does call other functions like `check_type`, `check_dict_read`, `dict_find_string`, and `gsicc_get_profile_handle_buffer` which could potentially have vulnerabilities. It is essential to review these functions' implementations to ensure their security.

The sumOfFlooredPairs function provided in the code snippet is not related to the znumicc_components function and does not contain any apparent vulnerabilities.

Therefore, the answer is 'NO' for both the znumicc_components and sumOfFlooredPairs functions.",Bypass,1.0,590.0,6.0,0.8493328094482422
177809,Bypass," The given code for `restore_page_device` function is not directly related to the provided vulnerability description. However, I will still evaluate the code for potential vulnerabilities based on the general steps you've provided.

1. Buffer Overflow: The code does not involve string or memory functions like strcpy, sprintf, or array access, so there is no apparent buffer overflow vulnerability.
2. Use After Free: The code does not involve freeing memory or pointers, so there is no use-after-free vulnerability.
3. Memory Leaks: The code does not involve dynamic memory allocation, so there are no memory leaks.
4. Integer Overflow/Underflow: The code does not involve arithmetic operations on integer types, so there is no integer overflow/underflow vulnerability.
5. Null Pointer Dereference: The code checks for null pointers before dereferencing, so there is no null pointer dereference vulnerability.
6. Improper Input Validation: The code does not involve user input, so there is no improper input validation vulnerability.
7. Race Conditions: The code does not involve multi-threading, so there are no race conditions.
8. Insecure Function Usage: The code does not use any insecure or deprecated functions, so there is no insecure function usage vulnerability.
9. Insecure Resource Management: The code does",Bypass,1.0,717.0,6.0,1.455847978591919
177811,DoS," The provided C++ code for the function `aspath_put` is vulnerable. The vulnerability is due to the lack of proper input validation and the potential for writing more data than the available space in the stream, leading to a denial-of-service condition. The code assumes that certain conditions will never occur, but in reality, they can and do, resulting in invalid BGP UPDATE messages and session drops.

The vulnerability is described in CVE-2017-16227 with a CWE-ID of CWE-20.",DoS,3.0,561.0,6.0,0.9227147102355957
177812,Bypass," The sum_update function is not directly vulnerable based on the given code. However, it does handle different checksum types, and if any of those types contain a vulnerability, it could potentially be exploited. It's important to ensure that all checksum types are implemented securely to prevent any potential vulnerabilities.

The sumOfFlooredPairs function is not vulnerable based on the given code. It's a separate function that calculates the sum of pairs in a vector using a prefix sum algorithm and modular arithmetic. It doesn't involve any memory handling or checksum calculations, so there's no vulnerability present in this function.",Bypass,1.0,572.0,6.0,0.8294601440429688
177815,Bypass," The given C++ code for `file_checksum` function is not directly vulnerable to the mentioned vulnerabilities in the provided list. However, it does contain an issue related to the MD4 checksum computation, which is a known issue (CVE-2017-15994). This issue is related to the lack of handling the last block of data when the file size is a multiple of 64 bytes. This can lead to an incorrect MD4 checksum calculation.

However, the code snippet you provided for `sumOfFlooredPairs` function is not related to the vulnerability assessment and does not contain any apparent security vulnerabilities. It is just a function to calculate the sum of floored pairs in a vector.",Bypass,2.0,599.0,6.0,0.9139070510864258
177816,Bypass, The given C++ code for `get_checksum2()` function is vulnerable. The vulnerability is due to the incorrect handling of checksum seed in MD4 algorithm. The code fails to call `mdfour_update()` function with the checksum seed when the length of data is a multiple of 64. This allows an attacker to bypass intended access restrictions by providing specially crafted data.,Bypass,3.0,532.0,6.0,0.9291517734527588
177821,DoS," The given IRCView::openTags function does not appear to be directly vulnerable to the mentioned vulnerabilities in the provided list. However, it does call other functions (fontColorOpenTag and spanColorOpenTag) that could potentially have vulnerabilities. It is essential to review those functions as well to ensure the overall codebase is secure.

The sumOfFlooredPairs function is not directly related to the C++ code provided in the vulnerability audit task. It is a separate function that calculates the sum of pairs of numbers with flooring. This function does not contain any apparent vulnerabilities based on the provided code snippet.",DoS,1.0,579.0,6.0,0.8148479461669922
177823,Exec Code Overflow," Based on the given code, the BufCompressedFill function does not directly involve string or memory functions like strcpy, sprintf, memcpy, or array access, and it does not appear to involve dynamic memory management or user input validation. However, the code does involve the use of a compressed file format, which can potentially be vulnerable to compression algorithm vulnerabilities such as Exec_Code_Overflow.

The provided code snippet does not show the implementation of the getcode function, which is called within the BufCompressedFill function and could potentially contain the vulnerable LZW decompression logic. Therefore, it is difficult to definitively determine if the given code is vulnerable without further context.

However, based on the vulnerability summary provided earlier, it is recommended to assume that the getcode function contains the vulnerable LZW decompression logic and that the BufCompressedFill function is vulnerable to Exec_Code_Overflow.

Therefore, the answer is:

YES, the BufCompressedFill function is potentially vulnerable to Exec_Code_Overflow due to the use of the getcode function, which may contain the vulnerable LZW decompression logic.",Exec Code Overflow,3.0,675.0,6.0,0.8345150947570801
177825,DoS," The given code for the function `extractPages` does not appear to contain any obvious buffer overflow or format string vulnerabilities. However, there is a potential issue with the use of `snprintf` in the loop where the `pathName` array is filled with the formatted string. If the length of `destFileName` plus the length of the format string `""%d""` is greater than the size of `pathName`, then a buffer overflow could occur. To mitigate this, the size of `pathName` should be checked against the length of the formatted string before using `snprintf`.

Therefore, the answer is: 'YES', the code is vulnerable to a potential buffer overflow if the input strings are not properly checked and validated.",DoS,2.0,608.0,6.0,0.8614645004272461
177826,DoS Exec Code Overflow," The given code for the `extractPages` function does not appear to contain any obvious buffer overflow vulnerabilities, as it uses `sprintf` within a loop but with the correct format string and valid input. However, it does have other potential vulnerabilities, such as improper input validation and potential memory leaks. It's essential to validate the input `srcFileName` and `destFileName` and ensure they are properly formed, and to properly manage memory allocated within the function.

However, the code snippet provided for `sumOfFlooredPairs` function is not related to the vulnerability audit and does not contain any apparent buffer overflow vulnerabilities. It is a separate function that calculates the sum of pairs of numbers in a vector while taking modulo with a constant value.",DoS Exec Code Overflow,2.0,611.0,6.0,0.8795127868652344
177827,," The given C++ code for `sumOfFlooredPairs` function does not appear to contain any direct security vulnerabilities based on the provided code snippet. It mainly deals with calculating the sum of pairs in a vector using prefix sum technique and modular arithmetic. However, it's essential to remember that security vulnerabilities can't always be determined solely by analyzing the code snippet, as the context, libraries, and external dependencies might introduce vulnerabilities.",nan,0.0,541.0,6.0,0.8479204177856445
177831,," The given C++ code for `mcid_char_imp` function does not directly involve any buffer handling or memory management operations that could lead to buffer overflow, use-after-free, or memory leak vulnerabilities. However, it does call `pdf_dict_del` and `pdf_drop_obj` functions, which could potentially manipulate PDF objects in an insecure manner. Therefore, it is recommended to review the implementation of these functions and the surrounding context to ensure proper bounds checking and input validation are in place.

The sumOfFlooredPairs function is not vulnerable to the mentioned vulnerabilities as it does not involve any buffer handling, memory management, or PDF object manipulation. It is a standalone function that calculates the sum of pairs in a vector using prefix sums and modular arithmetic.",nan,0.0,607.0,6.0,1.3123717308044434
177832,," The given `walk_string` function does not appear to be directly vulnerable to the mentioned vulnerabilities in the provided list. However, it does call the `fz_chartorune` function, which is not shown in the code snippet. If `fz_chartorune` contains a buffer overflow vulnerability, then the `walk_string` function could be vulnerable as well, depending on how the buffer overflow is exploited. Without seeing the implementation of `fz_chartorune`, it is impossible to determine if it is vulnerable or not.",nan,0.0,562.0,6.0,0.9369993209838867
177833,DoS Overflow," The given `reds_handle_ticket` function is not directly vulnerable to the mentioned vulnerabilities in the provided list. However, it does call the `RSA_private_decrypt` function, which could potentially be vulnerable to buffer overflows depending on the implementation of the RSA library being used. It is essential to ensure that the RSA library being used is secure and properly handles input validation and bounds checking to prevent any potential buffer overflow vulnerabilities.

The `sumOfFlooredPairs` function is not vulnerable to the mentioned vulnerabilities as it does not involve string manipulation, memory management, or user input validation. It is a simple function that calculates the sum of pairs in a vector using prefix sums and modular arithmetic.",DoS Overflow,2.0,597.0,6.0,0.9953000545501709
177839,+Info," The given C++ code for the function `next_codepoint_handle_ext` is not directly vulnerable to the vulnerabilities listed in the provided steps. However, it does contain some potentially risky behavior, such as the repeated use of `smb_iconv` with the same input and buffer, which could potentially lead to buffer overflows if the input is not properly checked or validated. It is essential to ensure that the input is properly checked and validated before passing it to the `smb_iconv` function to prevent potential vulnerabilities.

Therefore, the answer is:

'NO (but with a caveat)'

The caveat is that the code may be vulnerable if the input is not properly checked and validated before passing it to the `smb_iconv` function.",+Info,0.0,612.0,6.0,0.8625168800354004
177840,+Info," The given 'ldb_dn_escape_internal' function is vulnerable. The vulnerability is due to the lack of proper bounds checking when copying strings using'memcpy'. This can lead to buffer overflows if the input string length is not properly validated. In the given code, the 'len' parameter is used as the limit for the'memcpy' function, but it is not checked against the actual length of the source string. This can result in copying more bytes than intended, leading to a buffer overflow.

The vulnerability is similar to the one described in CVE-2015-5330, where an attacker can send crafted packets to obtain sensitive information from the daemon heap memory by exploiting this buffer overflow vulnerability.",+Info,0.0,601.0,6.0,0.9473748207092285
177841,+Info," The given C++ code for the function `strupper_talloc_n_handle` does not appear to be vulnerable to the specific vulnerabilities listed in the provided steps (Buffer Overflow, Use After Free, Memory Leaks, Integer Overflow/Underflow, Null Pointer Dereference, Improper Input Validation, Race Conditions, Insecure Function Usage, Insecure Resource Management, Improper Error Handling, Cryptographic Issues, and Sensitive Data Exposure).

However, it is essential to note that the code might still have other vulnerabilities or issues not covered in the provided steps. For instance, the code does not check the return value of `next_codepoint_handle_ext` and `talloc_realloc`, which could potentially lead to memory leaks or other issues if the functions fail. Additionally, the code does not validate the input `src` or `n`, which could potentially lead to other vulnerabilities if the input is malicious.

The second code snippet provided is not related to the vulnerability audit and does not appear to have any apparent vulnerabilities based on the given code alone. However, as always, it is essential to validate user inputs and check for potential edge cases to ensure the code's security.",+Info,2.0,692.0,6.0,0.9207348823547363
177842,+Info," The given code for `next_codepoint_handle_ext` function is not directly related to the vulnerability described in the provided CVE-ID (CVE-2015-5330). The vulnerability in the code snippet is not apparent.

However, the code does contain some assumptions and potential limitations that could potentially lead to issues if not handled properly. For instance, the assumption that no multi-byte character can take more than 5 bytes and the limitation of 5 bytes for the input string in the `strnlen` function call could potentially cause issues if the input is not properly validated.

To ensure the security of the code, it is essential to validate user inputs and ensure that they do not exceed the assumed limits. Proper error handling and bounds checking should be implemented to prevent potential buffer overflows or other vulnerabilities.

In summary, while the given code does not appear to be vulnerable based on the provided information, it is essential to validate user inputs and ensure proper error handling and bounds checking to prevent potential vulnerabilities.

Therefore, the answer is: NO, but with a recommendation to validate user inputs and ensure proper error handling and bounds checking.",+Info,1.0,685.0,6.0,1.0765337944030762
177843,+Info," The given C++ code for the function `strlen_m_ext_handle` does not appear to be directly vulnerable to the vulnerabilities listed in the provided steps. However, it does contain some checks and conditions that could potentially hide other vulnerabilities in the `next_codepoint_handle_ext` function or other parts of the codebase. It is essential to thoroughly review the entire codebase and all related functions to ensure the absence of any security vulnerabilities.

Therefore, the answer is 'NO', but with the caveat that a thorough analysis of the entire codebase is necessary to ensure complete security.",+Info,1.0,574.0,6.0,1.3300535678863525
177844,+Info," The given C++ code for the function `strupper_talloc_n_handle` does not appear to be vulnerable to the specific vulnerabilities listed in the provided steps (Buffer Overflow, Use After Free, Memory Leaks, Integer Overflow/Underflow, Null Pointer Dereference, Improper Input Validation, Race Conditions, Insecure Function Usage, Insecure Resource Management, Improper Error Handling, Cryptographic Issues, and Sensitive Data Exposure).

However, it is essential to note that the code might still have other vulnerabilities or issues not covered in the provided steps. For instance, the code might not handle edge cases properly, or it might not be efficient in terms of memory usage or performance. Additionally, the code's security depends on the correctness and security of the functions `next_codepoint_handle` and `push_codepoint_handle`.

Therefore, the answer is 'NO', but it is essential to keep in mind that a thorough security analysis requires a more comprehensive approach.",+Info,1.0,650.0,6.0,0.8676941394805908
177848,," The given code snippet for `do_connect` function does not contain any apparent vulnerabilities related to the provided vulnerability list. It mainly deals with memory management and string manipulation. However, it is essential to note that the code snippet provided is incomplete, and it is impossible to make a definitive statement without analyzing the entire codebase.",nan,0.0,522.0,6.0,0.8842182159423828
177850,DoS Overflow," Based on the given code, the `datum_to_json` function does not appear to be directly vulnerable to buffer overflows. The function processes various data types and formats them into a JSON string, but it does not directly handle user input or unchecked calculations that could lead to integer overflows or buffer miscalculations.

However, it is important to note that the function calls other functions (such as `array_to_json_internal`, `composite_to_json`, and `OidOutputFunctionCall`) that may have their own vulnerabilities. Therefore, it is crucial to thoroughly review those functions as well to ensure the overall codebase is secure.

In summary, the `datum_to_json` function itself does not appear to be vulnerable to buffer overflows based on the provided code. However, it is essential to review the called functions for potential vulnerabilities.",DoS Overflow,2.0,627.0,6.0,1.0361318588256836
177851,DoS Overflow," The given `parse_array` function does not appear to be directly vulnerable to the mentioned vulnerabilities in the provided list. However, it does call other functions (`parse_array_element`) that could potentially contain vulnerabilities. It's essential to review those functions as well.

The `sumOfFlooredPairs` function does not seem to contain any obvious vulnerabilities based on the provided code. It uses standard library functions and follows good practices, such as using a vector of ints and an unordered_map for counting occurrences.

However, it's important to note that the provided code snippet might not be the complete or accurate representation of the actual codebase. It's always recommended to perform a thorough analysis of the entire codebase to ensure its security.",DoS Overflow,1.0,601.0,6.0,0.896934986114502
177852,DoS Overflow," The given `parse_object` function does not appear to be directly vulnerable to the mentioned vulnerabilities in the provided list. However, it does call other functions like `parse_object_field` which could potentially contain vulnerabilities. It's essential to review those functions as well.

The `sumOfFlooredPairs` function does not seem to have any apparent vulnerabilities based on the provided code. It uses standard C++ libraries and follows good practices, such as using a constant for the modulus and initializing the prefix vector with the maximum element's size.",DoS Overflow,1.0,565.0,6.0,0.8476002216339111
177853,DoS Overflow," The given code for `setPath` function does not appear to be directly vulnerable to buffer overflows, use-after-free errors, or memory leaks based on the provided context. However, it does call other functions like `setPathArray` and `setPathObject` which could potentially contain vulnerabilities. It is essential to review those functions as well.

The second code snippet provided is not related to the C++ code in the initial question and does not involve any security vulnerabilities. It is a function to calculate the sum of pairs in a vector using prefix sum and a hash map.",DoS Overflow,1.0,576.0,6.0,0.8451921939849854
177855,Bypass," Based on the provided code, it does not appear to be directly vulnerable to the Bypass vulnerability described in the initial code snippet. The code seems to be handling file paths and checking directory access, but it does not involve symlinks or external file access in the same way as the vulnerable code.

However, it is essential to note that this analysis is based on the given code snippet alone. Other parts of the codebase or context could potentially introduce vulnerabilities. Always consider the entire system and its environment when evaluating security.",Bypass,1.0,563.0,6.0,0.8215618133544922
177856,, The given C++ code does not contain the nan vulnerability as it is unrelated to the code snippet provided. The nan vulnerability is specific to the GNU patch and the ed script handling.,nan,1.0,494.0,6.0,0.8335871696472168
177857,," The given code for `plan_a` function is not directly related to the provided nan vulnerability description. The nan vulnerability is related to the mishandling of symlinks in certain cases in the GNU patch library. The provided code does not involve symlinks or any file handling logic related to the nan vulnerability. Therefore, the answer is 'NO'.",nan,3.0,530.0,6.0,0.9628396034240723
