case_id,vuln_type,audit_report,gt,eval_score,eval_input_token_num,eval_output_token_num,eval_inference_time
177859,Exec Code Bypass," The given gs_nulldevice function does not appear to contain any obvious buffer overflow, use-after-free, memory leak, or integer overflow vulnerabilities based on the provided code snippet. However, it does contain some complex logic and interactions between different functions, so it's essential to consider the following potential vulnerabilities:

1. Improper Input Validation: The function does not seem to validate the input pgs pointer, which could potentially lead to a null pointer dereference if pgs is null.
2. Race Conditions: The function contains multiple calls to gs_setdevice_no_erase, which could potentially lead to race conditions if these calls are not properly synchronized.
3. Insecure Function Usage: The function uses gs_copydevice, which may have vulnerabilities if not used correctly.
4. Insecure Resource Management: The function allocates memory for ndev and sets its device type, but it does not check if the memory allocation was successful. If the memory allocation fails, the function will continue executing, potentially leading to memory leaks or other issues.
5. Cryptographic Issues: The function does not appear to use any cryptographic functions, so this vulnerability is not applicable.
6. Sensitive Data Exposure: The function does not seem to handle or expose any sensitive data, so this vulnerability is not applicable.

Based on the given code sn",Exec Code Bypass,2.0,725.0,6.0,1.0002434253692627
177860,Exec Code Bypass," The given zrestore function does not directly contain any obvious vulnerabilities related to the provided list. However, it does call other functions (restore_check_stack, ivalidate_clean_spaces, and restore_fix_stack) that could potentially contain vulnerabilities. It is essential to review those functions as well to ensure the overall codebase is secure.

The sumOfFlooredPairs function, on the other hand, does not appear to contain any vulnerabilities based on the provided code. It uses standard C++ libraries (vector, unordered_map, accumulate) and follows good programming practices (prefix sum, modular arithmetic).

However, it is always a good practice to validate user inputs and ensure proper error handling, even if not explicitly shown in the provided code.",Exec Code Bypass,1.0,607.0,6.0,0.8478569984436035
177862,Exec Code," Based on the provided code snippet, the `restore_page_device` function does not appear to contain any obvious buffer overflow, use-after-free, memory leak, or integer overflow vulnerabilities. However, it does contain some potential issues:

1. The code contains multiple instances of assigning the same variable to itself, which is redundant and unnecessary:

```cpp
dev_new = gs_currentdevice(pgs_new);
dev_new = gs_currentdevice(pgs_new);
```

2. The code does not check the return value of `(*dev_proc(dev_old, get_page_device)) (dev_old)` and `(*dev_proc(dev_new, get_page_device)) (dev_new)` before assigning the result to `dev_t1` and `dev_t2`, respectively. If these functions return null pointers, the program may continue executing with uninitialized pointers, leading to undefined behavior.

3. The code does not check the return value of `obj_eq(dev_old->memory, &gs_int_gstate(pgs_old)->pagedevice, &gs_int_gstate(pgs_new)->pagedevice)` and `samepagedevice` before returning from the function. If these conditions are",Exec Code,2.0,695.0,6.0,1.445098638534546
177865,DoS," Based on the given code, the PatternMatch function is not directly related to the sumOfFlooredPairs function. The PatternMatch function appears to be a recursive pattern matching algorithm, and it does not contain any apparent vulnerabilities related to buffer overflow, use-after-free, memory leaks, or other security vulnerabilities. Therefore, the sumOfFlooredPairs function is not vulnerable based on the provided code.",DoS,1.0,538.0,6.0,0.852008581161499
177867,," The given `gs_main_finit` function is not directly related to the `sumOfFlooredPairs` function you provided. Therefore, I cannot evaluate the vulnerability of the `gs_main_finit` function based on the code snippet you have given.

However, I can tell you that the `sumOfFlooredPairs` function itself does not appear to have any obvious security vulnerabilities. It is a simple function that calculates the sum of pairs of numbers in a vector, taking into account the modulo operation. The function uses standard C++ libraries and does not involve any user input or external data, so it is unlikely to be vulnerable to common attacks such as buffer overflows, integer overflows, or SQL injection.

Therefore, my answer is 'NO', the `sumOfFlooredPairs` function is not vulnerable based on the given code.",nan,1.0,628.0,6.0,0.8505630493164062
177869,," Based on the provided code snippet, the `zsetcolor` function does not appear to be directly vulnerable to the nan vulnerability described in the given context. The code does not involve any floating-point arithmetic operations or user input that could be exploited for type confusion attacks.

However, it is essential to note that the code might still have other vulnerabilities or issues that are not related to the nan vulnerability. The code should be thoroughly reviewed for other potential security concerns, such as buffer overflows, use-after-free errors, memory leaks, and other vulnerabilities mentioned in the initial list.

Therefore, the answer is 'NO' in this specific case, but it is crucial to continue evaluating the code for other potential vulnerabilities.",nan,1.0,599.0,6.0,0.8104865550994873
177870,," The given C++ code for `ztype` function is not directly related to the provided sumOfFlooredPairs function. Therefore, I cannot determine if the sumOfFlooredPairs function is vulnerable based on the given code.

Regarding the ztype function, it appears to be handling structures and their types. Based on the provided code snippet, there are no obvious buffer overflow, use-after-free, memory leak, integer overflow/underflow, null pointer dereference, or improper input validation vulnerabilities. However, it does call other functions like `array_get`, `name_ref`, and `gs_struct_type_name_string` which could potentially have vulnerabilities. Without further context or the implementation of these functions, it's impossible to determine if the ztype function is vulnerable.

In summary, I cannot definitively say whether the sumOfFlooredPairs function is vulnerable based on the given code. As for the ztype function, it's not vulnerable based on the provided code snippet, but it could be vulnerable if the called functions have vulnerabilities.",nan,0.0,663.0,6.0,0.8124101161956787
177874,Exec Code Overflow," Based on the provided code, it does not appear to be vulnerable to Exec, Code, Overflow (CWE-119) as there is no evidence of writing data outside the allocated memory space or executing arbitrary code. The code is performing AES encryption and decryption operations, and the variables are being properly updated within their allocated memory.",Exec Code Overflow,1.0,526.0,6.0,0.8606812953948975
177875,Exec Code Overflow," Based on the provided code, the function `s_aes_process` does not appear to be directly vulnerable to the Exec, Code, Overflow vulnerability described in the initial code snippet. The function is handling memory allocation and decryption in a way that does not involve writing data beyond the allocated bounds or executing arbitrary code.

However, it is important to note that the code snippet you provided is only a part of the larger Ghostscript implementation, and other parts of the codebase may still contain vulnerabilities. It is always recommended to perform a thorough vulnerability assessment on the entire codebase to ensure the security of the application.

Therefore, the answer is 'NO', the provided code snippet is not vulnerable to the Exec, Code, Overflow vulnerability.",Exec Code Overflow,1.0,606.0,6.0,0.8208024501800537
177879,DoS Exec Code Overflow," The given fdctrl\_read\_data function does not appear to contain any obvious buffer overflow vulnerabilities, use-after-free errors, or memory leaks. However, it does contain some other potential vulnerabilities, such as:

1. Improper Input Validation: The code does not validate the input 'fdctrl' before using it, which could potentially lead to unexpected behavior if an invalid or malicious input is passed to the function.
2. Insecure Resource Management: The code does not check the return values of some functions, such as 'get_cur_drv' and 'blk_read', which could potentially lead to resource leaks or other issues if these functions fail.
3. Insecure Function Usage: The code uses some functions, such as'memset', without proper bounds checking, which could potentially lead to buffer overflows or other issues if the input size is not carefully managed.

However, based on the given code snippet alone, it is not clear that there is a DoS, Exec, Code, Overflow vulnerability present. The vulnerability summary and CVE-ID/CWE-ID provided in the text do not appear to directly relate to the given code.

Therefore, my answer is: NO, the given code does not appear to contain a DoS, Exec, Code, Overflow vulnerability based on the provided code snippet alone. However, there are other potential",DoS Exec Code Overflow,2.0,732.0,6.0,1.4386169910430908
177880,Bypass," The given C++ code for `check_file_permissions_reduced` function is not directly related to the vulnerability described in the provided vulnerability summary. Therefore, I cannot definitively say whether it is vulnerable or not based on the given code alone.

However, I can provide some general observations about the code:

1. The code checks if the given file name matches any of the permitted file names in a list. It uses a recursive descent parser to perform the string matching.
2. The code uses a `string_match` function to perform the string matching. The function takes a regular expression as a parameter and uses it to match the given file name against the permitted file name.
3. The code uses a `gp_file_name_parents` function to get the number of parent directories in a file name.
4. The code uses a `gp_file_name_is_absolute` function to check if a file name is absolute.
5. The code uses a `dict_find_string` function to find a string in a dictionary.

Based on the given code, it does not appear to have any obvious buffer overflow, use-after-free, memory leak, or null pointer dereference vulnerabilities. However, it is still possible that there are other vulnerabilities or issues in the code that are not immediately apparent.

Therefore, my answer is 'NO', but with",Bypass,1.0,726.0,6.0,0.9009811878204346
177881,DoS," The given C++ code for the function `drm_load_edid_firmware` is vulnerable. The vulnerability is due to the unchecked use of `kstrdup` function, which can result in a NULL pointer dereference if the input string is empty or an error occurs during memory allocation. This can lead to a denial-of-service (DoS) vulnerability as the function may crash or cause a system crash.

The code for the function `int sumOfFlooredPairs(vector<int>& nums)` does not appear to be vulnerable based on the provided code snippet. It is a separate function that does not involve any string manipulation or memory allocation using functions like `kstrdup` or `strsep`.",DoS,3.0,601.0,6.0,0.8549578189849854
177883,," Based on the provided code, it does not appear to be vulnerable to the nan vulnerability described in the initial code snippet and the associated CVE/CWE information. The code in question is not related to SSL/TLS certificate handling or the GnuTLS API. Instead, it is a function for adding a new hook to a list, which involves dynamic memory allocation and some string manipulation.

Therefore, the answer is 'NO'.",nan,1.0,544.0,6.0,0.8895719051361084
177887,DoS Overflow," The provided code for the function `gs_heap_alloc_bytes` is not directly related to the `sumOfFlooredPairs` function. Therefore, I cannot determine if the `sumOfFlooredPairs` function is vulnerable based on the given code.

However, I can evaluate the `gs_heap_alloc_bytes` function for potential vulnerabilities as per the steps you've outlined:

1. Buffer Overflow: The code checks if the size to be allocated exceeds the limit. It also checks if the memory allocation fails. These checks should prevent buffer overflow.
2. Use After Free: The code does not appear to free memory explicitly, but it does not seem to dereference pointers after they have been allocated and assigned to `ptr`. Therefore, it does not appear to have use-after-free vulnerabilities.
3. Memory Leaks: The code checks if the memory allocation fails and sets an error message if it does. If the allocation is successful, it adds the allocated memory to the `mmem->allocated` list and updates the `mmem->used` variable. This suggests that the code does not have memory leaks.
4. Integer Overflow/Underflow: The code does not involve arithmetic operations on integer types that could result in overflow or underflow.
5. Null Pointer Dereference: The code checks if `mmem->monitor` is not",DoS Overflow,2.0,728.0,6.0,0.8732812404632568
177891,DoS," The given code for the function `rsa_pss_decode` is not directly related to the code snippet you provided earlier, which was vulnerable to a DoS attack due to a null pointer dereference. The `rsa_pss_decode` function appears to be parsing RSA PSS parameters from an ASN.1 structure. Based on the code snippet provided, it does not contain any obvious vulnerabilities. However, it is always important to ensure proper bounds checking and memory management when dealing with dynamic memory or user input. In this case, the code does not involve dynamic memory allocation or user input, so it should be relatively safe.

Regarding the second code snippet, which is not provided, the function `sumOfFlooredPairs` appears to be calculating a sum based on the numbers in a vector, using prefix sums and a modulus. Without seeing the actual implementation of this function, it is difficult to determine if it contains any vulnerabilities. However, based on the code snippet provided, it does not appear to contain any obvious vulnerabilities related to the ones mentioned in the original question.

Therefore, the answer is 'NO' for both code snippets.",DoS,1.0,685.0,6.0,1.510012149810791
177893,+Info," Based on the given code, the function `test_mod_exp` is not directly vulnerable to the vulnerabilities listed in the steps provided. However, it does call the function `BN_mod_exp` and `BN_mod_exp_mont_consttime` which are known to be vulnerable to certain attacks. Therefore, the calling code or the context in which these functions are used could potentially be vulnerable. It is important to ensure that the OpenSSL library being used is up-to-date and that the Montgomery multiplication and exponentiation functions are being used correctly and securely.

However, the second piece of code you provided, `sumOfFlooredPairs`, does not appear to have any direct security vulnerabilities based on the given code. It is a simple function that calculates the sum of pairs in a vector, modulo a given number. It does not involve any memory management, input validation, or other security-sensitive operations. Therefore, it is likely not vulnerable to the types of vulnerabilities listed in the steps provided.",+Info,0.0,655.0,6.0,0.9168667793273926
177896,," The given 'become\_daemon' function is not directly related to the'sumOfFlooredPairs' function. The 'become\_daemon' function appears to be a function for daemonizing a process, and it does not contain any apparent vulnerabilities based on the provided code. Therefore, the answer is 'NO'.",nan,0.0,526.0,6.0,0.8660662174224854
177897,+Info," The provided C++ code for the function `sumOfFlooredPairs` does not appear to contain any obvious security vulnerabilities, such as buffer overflows, use-after-free errors, memory leaks, or integer overflows. It mainly deals with calculating the sum of pairs in a vector and using prefix sums and a hash map to optimize the calculation.

Therefore, the answer is 'NO'.",+Info,0.0,537.0,6.0,0.8918473720550537
177898,+Info," The given C++ code for the function `soap_xmlParseMemory` is not directly related to the vulnerability described in the CVE-2013-1824. The vulnerability is related to the SOAP parser in PHP, not the C++ code. Therefore, the given C++ code is not vulnerable based on the information provided.",+Info,1.0,525.0,6.0,0.886981725692749
177899,+Info," The given C++ code for the function `soap_xmlParseFile` is not directly related to the `sumOfFlooredPairs` function. However, based on the provided information, the `soap_xmlParseFile` function is vulnerable to XML External Entity (XXE) attacks as described in the vulnerability summary.

The vulnerability arises from the `xmlCreateFileParserCtxt` function call, which does not properly validate or sanitize the input filename. This can allow an attacker to provide a specially crafted XML file containing an XML external entity declaration and an entity reference, which can be used to read arbitrary files on the server.

Therefore, the answer is:

YES (soap_xmlParseFile function is vulnerable to XML External Entity (XXE) attacks)",+Info,0.0,609.0,6.0,0.9138484001159668
177900,+Info," The given C++ code for the function `soap_xmlParseMemory` does not directly contain any obvious vulnerabilities based on the provided code snippet. However, it does call external functions like `xmlInitParser`, `xmlCreateMemoryParserCtxt`, `xmlParseDocument`, and `xmlFreeParserCtxt` which could potentially have vulnerabilities if not used correctly. It is essential to ensure that these functions are being used with proper input validation and error handling to prevent any potential security issues.

The second code snippet provided is for a different function called `sumOfFlooredPairs`, which appears to be unrelated to the XML parsing function. This code does not contain any apparent vulnerabilities based on the provided code snippet.

Therefore, the answer is 'NO' for both code snippets.",+Info,0.0,613.0,6.0,0.8605482578277588
177901,Overflow," The second code snippet provided, `sumOfFlooredPairs(vector<int>& nums)`, does not appear to be vulnerable to the types of vulnerabilities listed in the initial instructions. It is a separate function that does not involve string or memory manipulation, and there is no evidence of buffer overflow, use-after-free, memory leaks, or other vulnerabilities in the code.",Overflow,1.0,530.0,6.0,0.9297547340393066
177904,DoS," Based on the given code, the Splash::blitMask function does not appear to be vulnerable to the specific vulnerabilities listed in the provided steps. However, it is always important to ensure proper bounds checking and input validation in C++ code to prevent potential vulnerabilities. In this case, the code seems to be checking the bounds of the array and using the clipRes variable to control the loop, which should help prevent buffer overflows and other related vulnerabilities. However, it is still essential to review the rest of the codebase to ensure that all potential vulnerabilities are addressed.

Regarding the second code snippet, it is not related to the vulnerability audit task, so I cannot evaluate its vulnerability. The code appears to be calculating the sum of pairs of numbers in a vector, modulo a constant value. It does not contain any apparent vulnerabilities based on the provided code alone. However, as always, proper input validation and bounds checking should be implemented to ensure the security of the code.",DoS,1.0,652.0,6.0,0.8835780620574951
177905,DoS," Based on the given code, the Splash::arbitraryTransformMask function does not appear to be directly vulnerable to the vulnerabilities listed in the provided steps. However, there are some potential issues that could lead to vulnerabilities if not handled properly:

1. The code uses the imgCoordMungeLowerC and imgCoordMungeUpperC functions, which are not defined in the provided code. These functions could potentially be vulnerable if they are not implemented correctly, such as not checking bounds or not validating inputs.
2. The code uses the testRect function of the state->clip pointer, but it is not clear how this function is implemented or what its input is. If this function is not implemented correctly, it could potentially lead to vulnerabilities.
3. The code scales the mask using the scaleMask function, but it is not clear how this function is implemented or what its input is. If this function is not implemented correctly, it could potentially lead to vulnerabilities.

Therefore, it is recommended to review the implementation of the imgCoordMungeLowerC, imgCoordMungeUpperC, testRect, and scaleMask functions to ensure they are implemented correctly and do not contain any vulnerabilities. Additionally, it is important to ensure that any inputs to these functions are properly validated and sanitized to prevent potential attacks.",DoS,2.0,718.0,6.0,0.8808863162994385
177906,DoS Exec Code Overflow," Based on the provided code snippet, the `Splash::makeDashedPath` function does not appear to be directly vulnerable to the mentioned vulnerabilities (DoS, Exec, Code, Overflow) as it does not involve any memory manipulation or user input handling that could lead to these types of vulnerabilities. However, it is always important to keep in mind that vulnerabilities can exist in other parts of the codebase, and the `makeDashedPath` function could potentially be affected by them.

Therefore, the answer is 'NO', but it is crucial to maintain a secure coding practice throughout the entire codebase.",DoS Exec Code Overflow,1.0,583.0,6.0,1.4664227962493896
177907,DoS Exec Code Overflow," Based on the given code, the `Splash::scaleMaskYuXd` function does not appear to be directly vulnerable to the mentioned vulnerabilities (DoS, Exec, Code, Overflow) as it does not involve any user input, dynamic memory allocation with incorrect bounds, or pointer dereferencing without proper checks. However, it does contain some potential issues, such as potential integer overflows in the division operations and potential memory leaks if the `lineBuf` allocation fails. It is essential to ensure proper bounds checking and error handling in the function to mitigate these risks.

Regarding the second code snippet, it is a separate function called `sumOfFlooredPairs` that does not seem to be related to the original `Splash::scaleMaskYuXd` function. This function appears to be implementing a prefix sum algorithm and does not contain any apparent vulnerabilities related to the mentioned vulnerabilities (DoS, Exec, Code, Overflow).

Therefore, the answer is 'NO' for both the `Splash::scaleMaskYuXd` function and the `sumOfFlooredPairs` function.",DoS Exec Code Overflow,1.0,676.0,6.0,1.1170713901519775
177909,DoS Exec Code Overflow," Based on the given code, the `Splash::scaleMaskYdXu` function does not appear to be directly vulnerable to the mentioned vulnerabilities (DoS, Exec, Code, Overflow) in the provided context. However, there are potential memory management issues, such as memory leaks or uninitialized pointers, which should be addressed.

The code snippet provided for `sumOfFlooredPairs` is a separate function and does not seem to be related to the `Splash::scaleMaskYdXu` function. It appears to be implementing a prefix sum algorithm and does not contain any apparent vulnerabilities.

Therefore, the answer is 'NO' for the `Splash::scaleMaskYdXu` function. However, it is essential to ensure proper memory management practices in the code, such as releasing allocated memory and checking for null pointers before dereferencing them.",DoS Exec Code Overflow,1.0,632.0,6.0,0.8313779830932617
177910,DoS," The given code for `token_continue` function is not directly related to the `int sumOfFlooredPairs` function. Therefore, the vulnerability assessment for the `token_continue` function does not affect the `int sumOfFlooredPairs` function.

The `token_continue` function appears to be handling scanner states and managing a stack, but it does not involve any user input or memory management that could lead to the vulnerabilities mentioned in the provided list.

Thus, the answer is 'NO'. The `int sumOfFlooredPairs` function is not vulnerable based on the given code.",DoS,1.0,577.0,6.0,0.9709694385528564
177911,Exec Code Overflow," The given `tt_cmap10_validate` function does not appear to be directly vulnerable to integer overflows based on the provided code snippet. However, it does involve parsing and checking the length and count values, which could potentially be manipulated to cause issues elsewhere in the code. It's essential to ensure that these values are properly validated and checked throughout the application to prevent potential integer overflows or other vulnerabilities.

The `sumOfFlooredPairs` function is not directly related to the given C++ code and does not seem to contain any apparent vulnerabilities. It appears to be a function that calculates the sum of pairs of numbers, taking into account the modulus value. The function uses prefix sums and an unordered map to store the count of each number in the input vector. The implementation seems correct and does not contain any apparent vulnerabilities.",Exec Code Overflow,2.0,624.0,6.0,1.5646400451660156
