case_id,vuln_type,audit_report,gt,eval_score,eval_input_token_num,eval_output_token_num,eval_inference_time
177736,Bypass," Based on the provided code, the samldb_check_user_account_control_acl function does not directly contain any obvious vulnerabilities related to the given list. However, it does involve interactions with LDAP data and security descriptors, so it's essential to ensure proper input validation, access control, and error handling are implemented in the surrounding code.

The code snippet provided is just a function definition, and it doesn't contain any execution flow or user input handling. Therefore, it's challenging to determine vulnerabilities based on this code alone.

However, it's crucial to remember that the vulnerability in the given code example (CVE-2015-8467) is not related to the samldb_check_user_account_control_acl function itself but rather to the way it is used in the larger context of the Samba software.

So, the answer is 'NO', but it's essential to ensure that the surrounding code and the Samba software are securely implemented.",Bypass,1.0,637.0,6.0,1.9257845878601074
177740,DoS Exec Code Overflow Mem. Corr.," The given C++ code for the function `asn1_time_to_time_t` is vulnerable. The vulnerability is due to the lack of proper bounds checking when parsing the time string. This can lead to buffer overflows or memory corruption, potentially allowing an attacker to execute arbitrary code or cause a denial of service.

The vulnerability is similar to the one described in CVE-2013-6420, where the `openssl.c` library in PHP before certain versions did not properly parse X.509 certificates, leading to memory corruption. In the given code, the `thestr` pointer is not checked for bounds when it is modified, allowing an attacker to potentially write outside the allocated memory.

Therefore, the answer is 'YES' and the vulnerability is of type 'DoS', 'Exec', 'Code', 'Overflow', 'Mem'.",DoS Exec Code Overflow Mem. Corr.,3.0,634.0,6.0,0.818272590637207
177741,DoS Overflow," The given gnutls_session_get_data function is vulnerable. The vulnerability is due to the lack of proper bounds checking when copying data from psession to session_data. If the size of psession.data exceeds the size of session_data, it can result in a buffer overflow, leading to a denial of service (DoS) attack.

The sumOfFlooredPairs function, on the other hand, does not appear to be vulnerable to the mentioned vulnerabilities in the given code. It is a different function that calculates the sum of pairs in a vector using prefix sums and modular arithmetic.",DoS Overflow,3.0,576.0,6.0,0.8237631320953369
177742,DoS Overflow," The given gnutls_session_get_data function is vulnerable. The issue is that the function does not properly check the size of the session_data buffer against the size of the data being copied (psession.size). If the session_data buffer is too small, a buffer overflow can occur, leading to a denial-of-service condition. The vulnerability is described in CVE-2011-4128 and has a CWE-ID of CWE-119.

The sumOfFlooredPairs function, on the other hand, does not contain any apparent buffer overflow vulnerabilities or other security issues. It is safe to use.",DoS Overflow,3.0,580.0,6.0,1.4400553703308105
177743,DoS," The given C++ code for the function `phar_make_dirstream` does not directly contain any obvious vulnerabilities based on the provided code snippet. However, it does process user input (the `dir` argument) and manipulates file paths, so it's essential to ensure proper input validation and error handling to prevent potential vulnerabilities.

The code snippet itself does not show any signs of buffer overflows, use-after-free errors, memory leaks, or other common vulnerabilities. However, it does perform string comparisons and searches for path separators, so it's crucial to ensure that user input is properly validated and sanitized to prevent potential attacks.

Therefore, the answer is 'NO', but it's important to remember that the code's vulnerability depends on the context in which it is used and the input it receives. Proper input validation and error handling should always be implemented to mitigate potential risks.",DoS,1.0,631.0,6.0,1.4542787075042725
177747,DoS," The given C++ code for the function `bgp_attr_unknown` is vulnerable. The vulnerability is related to a Denial of Service (DoS) attack as described in CVE-2013-6051. The issue is that the `total` variable is not initialized before use, allowing an attacker to cause a buffer overflow and crash the application by sending a crafted BGP update with a large length value.",DoS,3.0,543.0,6.0,1.5146279335021973
177750,DoS Exec Code," The given code for `begin_softmask` function does not appear to contain any obvious use-after-free vulnerabilities. The code sets the `gstate->softmask` and related pointers to `NULL` before using them, ensuring that they are no longer valid. Therefore, the code is not vulnerable to use-after-free attacks.

However, it is essential to note that the code snippet provided is incomplete, and it is impossible to determine if there are other parts of the code that may introduce vulnerabilities. Additionally, the code snippet does not include the context in which it is used, which could impact its security.

The second code snippet provided is unrelated to the vulnerability audit and is not related to the C++ code being analyzed. It is a separate function written in C++ that calculates the sum of pairs in a vector using prefix sums and a hash table. This code does not contain any apparent vulnerabilities.",DoS Exec Code,1.0,640.0,6.0,0.9629559516906738
177766,DoS," The given C++ code for the function `ldap_push_filter` does not appear to contain any obvious buffer overflow or memory management vulnerabilities. The code mainly deals with parsing and pushing LDAP filter operations, and it uses ASN.1 encoding and decoding functions. These functions are expected to handle memory allocation and deallocation internally, and the given code does not show any signs of misusing them.

However, it is essential to note that the code's security is not solely dependent on this function. Other parts of the codebase, such as input validation, error handling, and resource management, should also be considered for potential vulnerabilities.

Therefore, based on the provided code snippet, it seems that the code is not vulnerable to the mentioned vulnerabilities. However, a thorough security analysis should be performed on the entire codebase to ensure its overall security.",DoS,1.0,625.0,6.0,1.0380852222442627
177767,DoS," The given code for `decode_openldap_dereference` function is not directly vulnerable to the DoS vulnerability described in the provided context. However, it does involve dynamic memory allocation and parsing of potentially untrusted data, which could potentially introduce other vulnerabilities such as buffer overflows or use-after-free errors if not handled properly. It is essential to ensure proper bounds checking, input validation, and error handling in this function to mitigate these risks.

The second code snippet provided, `sumOfFlooredPairs`, is not related to the vulnerability audit's scope as it does not involve any security-related functionality. It is a simple function to calculate the sum of pairs in a vector, and it does not contain any apparent vulnerabilities.",DoS,2.0,603.0,6.0,0.8627760410308838
177768,DoS," The given C++ code for `sparse_dump_region` function does not directly contain any obvious vulnerabilities related to the provided list. However, it does call other functions like `lseek_or_error`, `safe_read`, `find_next_block`, `blocking_write`, and `tar_sparse_dump_region` which could potentially have vulnerabilities. It is essential to review those functions as well to ensure the overall codebase is secure.

Therefore, the answer is 'NO' for the given `sparse_dump_region` function alone, but it is crucial to evaluate the other functions called within it as well.",DoS,2.0,578.0,6.0,0.8416314125061035
177770,Bypass," The given code for `read_ndx_and_attrs` function does not contain any apparent buffer overflow, use-after-free, memory leak, integer overflow/underflow, null pointer dereference, or insecure function usage vulnerabilities based on the provided code snippet. However, it does contain some potential issues related to input validation and error handling, which should be further investigated.

The code does not validate user input in the `iflags` variable, and it does not check the `len` value when reading a string using `read_vstring`. This could potentially lead to buffer overflows or other vulnerabilities if the input is not properly sanitized. Additionally, the code does not handle errors properly when reading strings using `read_vstring`. If the read fails, the code exits with an error message but does not properly clean up or return an error code.

Therefore, while the code does not contain any obvious buffer overflow, use-after-free, memory leak, integer overflow/underflow, null pointer dereference, or insecure function usage vulnerabilities, it does contain potential issues related to input validation and error handling that should be addressed.",Bypass,2.0,681.0,6.0,1.5453510284423828
177771,," The given C++ code for `dns_read_name` function is vulnerable. The vulnerability is due to the recursive call to `dns_read_name` function without proper bounds checking, which can lead to stack exhaustion or infinite recursion. This is a classic case of a nan (name anomaly) vulnerability.",nan,0.0,517.0,6.0,0.8499476909637451
177773,DoS Exec Code Overflow Mem. Corr.," The given C++ code for `create_surface_from_thumbnail_data` function does not appear to contain any obvious buffer overflow vulnerabilities, as it does not involve any string or memory functions that could potentially lead to buffer overflows. However, it does involve integer arithmetic operations, so it is important to check for integer overflow conditions.

Upon closer inspection, the code does not involve any unchecked integer arithmetic operations or user inputs, and the loop indices are properly checked against the loop conditions. Therefore, it is unlikely that this code is vulnerable to integer overflow or other types of security vulnerabilities.

However, it is important to note that this analysis is based on the given code alone, and other parts of the program or external inputs could potentially introduce vulnerabilities. It is always recommended to perform a thorough vulnerability assessment on the entire system to ensure its security.

So, the answer is 'NO'.",DoS Exec Code Overflow Mem. Corr.,1.0,639.0,6.0,0.8947973251342773
177774,DoS Exec Code Overflow," Based on the given code, there are no obvious buffer overflow, use-after-free, memory leak, or integer overflow vulnerabilities. However, there are some potential issues:

1. The code does not check the return value of `gmalloc` and `gmallocn`, which could lead to memory leaks if the allocation fails.
2. The code does not check the return value of `new ImageStream(str, width, colorMap->getNumPixelComps(), colorMap->getBits())`, which could lead to a null pointer dereference if the allocation fails.
3. The code does not check the return value of `str->close()`, which could lead to a memory leak if the close fails.
4. The code does not validate the input parameters, such as `width` and `height`, which could lead to unexpected behavior or crashes if they are negative or larger than expected.
5. The code does not check the return value of `splash->drawImage(src, &imgData, srcMode, maskColors? gTrue : gFalse, width, height, mat)`, which could lead to a null pointer dereference if the drawImage function fails.

However, none of these issues directly lead to a DoS, Exec, Code, Overflow vulnerability.

Therefore, the answer is 'NO'.",DoS Exec Code Overflow,2.0,729.0,6.0,0.9013175964355469
177775,DoS Exec Code Overflow," Based on the given code, the ArthurOutputDev::drawImage function does not appear to contain any obvious buffer overflow, use-after-free, memory leak, or integer overflow vulnerabilities. However, it does allocate memory with gmalloc and new, and then later free that memory. If the memory allocation fails, the code does not check the return value, which could lead to a memory leak or other issues. Additionally, the code does not validate user input, so it may be vulnerable to injection attacks or other issues if user input is not properly sanitized before use.

The code for sumOfFlooredPairs function is not related to the vulnerability assessment of the ArthurOutputDev::drawImage function, so it does not need to be evaluated for vulnerabilities in this context.

Therefore, the answer is:

ArthurOutputDev::drawImage function: 'MAYBE'
Reason: The code does not check the return value of memory allocation functions, which could lead to memory leaks or other issues if memory allocation fails. Additionally, the code does not validate user input, which could make it vulnerable to injection attacks or other issues if user input is not properly sanitized before use.

sumOfFlooredPairs function: 'NO'
Reason: The sumOfFlooredPairs function does not contain any obvious buffer overflow, use-after-free, memory leak, or integer overflow vulnerabilities",DoS Exec Code Overflow,2.0,732.0,6.0,0.817420244216919
177777,DoS Exec Code Overflow," Yes, the code is vulnerable to integer overflow. The vulnerability lies in the for loop where the index 'i' is used to access the pixel values in the 'pix' array and the maskColors array. If the pixel values or maskColors values are not properly checked or validated, an integer overflow can occur, leading to unintended behavior or even code execution. The overflow can occur when the pixel or maskColors value is greater than 255 and is multiplied by 255 in the if condition. This can result in a value larger than the maximum representable integer value, causing the integer to wrap around and produce unexpected results.",DoS Exec Code Overflow,2.0,587.0,6.0,1.3954100608825684
177778,DoS Exec Code Overflow," Based on the given code, the function `CairoOutputDev::drawMaskedImage` is not vulnerable to the mentioned vulnerabilities (DoS, Exec, Code, Overflow) as it does not involve any user input or memory manipulation operations that could lead to these types of vulnerabilities. However, it does perform integer calculations, so it's essential to ensure proper bounds checking and input validation for any integer values passed to the function.

The code snippet provided for `sumOfFlooredPairs` is not related to the `CairoOutputDev::drawMaskedImage` function, so it doesn't affect the vulnerability assessment of the given code.",DoS Exec Code Overflow,1.0,587.0,6.0,1.445960283279419
177779,DoS Exec Code Overflow," Based on the given code, the function `CairoOutputDev::drawSoftMaskedImage` is not vulnerable to integer overflow as there are no integer variables that are being incremented or assigned values based on user input without proper validation. However, there are other potential vulnerabilities such as use-after-free, memory leaks, and race conditions that should be addressed.",DoS Exec Code Overflow,2.0,533.0,6.0,0.9530949592590332
177780,DoS Exec Code Overflow," Based on the given code, it does not appear to be directly vulnerable to integer overflows or any other vulnerabilities mentioned in the provided list. However, there are some potential issues that should be addressed:

1. Memory management: The code allocates memory using `gmalloc` and `gmallocn` functions, but it does not check for allocation failures. This could lead to memory leaks or other issues if the allocation fails.
2. Error handling: The code uses `goto` statements to handle errors, which can make error handling more difficult to manage and understand. It is generally recommended to use RAII (Resource Acquisition Is Initialization) or other more structured error handling mechanisms.
3. Input validation: The code does not validate user input or check the bounds of array indices. This could potentially lead to out-of-bounds access or other vulnerabilities if the input is not properly sanitized.

Overall, while the code may not be directly vulnerable to the specific vulnerabilities mentioned in the provided list, there are still potential issues that should be addressed to improve the security and reliability of the code.",DoS Exec Code Overflow,2.0,678.0,6.0,1.5064692497253418
177781,DoS Exec Code Overflow," Based on the given code, the `GfxImageColorMap::getGrayLine` function does not appear to be directly vulnerable to the mentioned DoS, Exec, Code, Overflow vulnerability (CVE-2009-3605, CWE-189). However, it's essential to note that the code snippet provided is an incomplete function, and it's impossible to determine if other parts of the codebase are vulnerable.

The `GfxImageColorMap::getGrayLine` function performs integer calculations, but it doesn't involve user input or unchecked arithmetic operations. It also doesn't use any insecure functions or memory management techniques that could lead to the mentioned vulnerability.

However, it's crucial to remember that the presence of this vulnerability in other parts of the codebase could still impact the overall security of the application. Therefore, it's essential to perform a thorough vulnerability assessment on the entire codebase to ensure that all potential vulnerabilities are identified and addressed.",DoS Exec Code Overflow,1.0,647.0,6.0,0.8426752090454102
177783,DoS Exec Code Overflow," Based on the given code, the `GfxImageColorMap::getRGBLine` function does not appear to be directly vulnerable to the mentioned vulnerabilities (DoS, Exec, Code, Overflow) as it does not involve user input, dynamic memory allocation without proper bounds checking, or arithmetic operations without proper checks. However, it does call other functions (`colorSpace2->getRGBLine` and `colorSpace->getRGBLine`) that could potentially have vulnerabilities. Therefore, it is essential to review those functions as well.

The second code snippet provided is not related to the initial vulnerability discussion and appears to be a separate function called `sumOfFlooredPairs`. This function does not contain any apparent vulnerabilities related to the mentioned vulnerability types. It uses standard C++ libraries and follows good practices, such as using a constant for the modulus and initializing the prefix vector with the maximum element's size.",DoS Exec Code Overflow,1.0,642.0,6.0,1.4116582870483398
177786,DoS Exec Code Overflow," Based on the given code, it appears that the `SplashOutputDev::drawImage` function is not directly vulnerable to integer overflows as there are no arithmetic operations involving user inputs or unchecked calculations that could cause integers to wrap around. However, the code does allocate memory dynamically and there are no bounds checks on the size of the input streams or image data. This could potentially lead to memory leaks or denial-of-service attacks if large inputs are intentionally provided. Additionally, there are several other potential vulnerabilities in the code, such as use-after-free errors, unvalidated user inputs, and race conditions, which should be addressed as well.

Therefore, while the code may not be directly vulnerable to integer overflows, it is still important to ensure proper bounds checking and resource management to prevent other types of vulnerabilities.

So, the answer is: 'Partially'. The code may not be directly vulnerable to integer overflows, but it contains other potential vulnerabilities that need to be addressed.",DoS Exec Code Overflow,2.0,656.0,6.0,0.872661828994751
177787,DoS Exec Code Overflow," Based on the given code, it appears that the `SplashOutputDev::drawMaskedImage` function is not directly vulnerable to integer overflows as there are no integer variables that are being assigned values based on user input or unchecked calculations. However, there are several integer variables that are being used in calculations and comparisons, so it's important to ensure that proper bounds checking and input validation are implemented in other parts of the code to prevent potential vulnerabilities.

Therefore, the answer is 'NO', but with the caveat that the code should be reviewed in its entirety to ensure that all potential vulnerabilities are addressed.",DoS Exec Code Overflow,1.0,581.0,6.0,1.0818543434143066
177788,DoS Exec Code Overflow," Based on the provided code, there are several integer operations that could potentially lead to integer overflows. For instance, the calculation of 'n' in the 'imgMaskData' and 'imgData' sections, as well as the 'i' variable in the for loops where the pixel values are read from the color maps. These overflows could potentially lead to denial of service (DoS) or arbitrary code execution.

Therefore, the answer is 'YES'. The code is vulnerable to integer overflows, which could result in a DoS or code execution vulnerability.

The specific vulnerability referenced in the code snippet provided is CVE-2009-3605, which is a DoS vulnerability in Poppler 0.10.5 and earlier due to integer overflows in several components. The CWE-ID for this vulnerability is CWE-189.",DoS Exec Code Overflow,3.0,632.0,6.0,0.8477468490600586
177789,DoS Exec Code Overflow," Based on the provided code, it does not appear to be vulnerable to the specific vulnerabilities listed in the steps you provided. However, there are still other potential vulnerabilities that could exist, such as integer overflows or buffer overflows, that were not explicitly mentioned in the steps. It's important to note that the code should still be thoroughly reviewed for any potential vulnerabilities, even if the specific steps you provided do not directly apply to this code.

The code you provided is a function called `poppler_page_prepare_output_dev` that appears to be responsible for preparing output data for a Poppler library. It does not contain any obvious vulnerabilities, such as buffer overflows or use-after-free errors, that could be exploited to execute arbitrary code or cause a denial of service. The code does allocate memory using `gmalloc` and performs some arithmetic operations, but these operations are properly bounded and do not appear to be vulnerable to integer overflows.

However, it's important to note that the code you provided is only a small part of the larger Poppler library, and other parts of the library may contain vulnerabilities. Therefore, it's still important to thoroughly review the entire codebase for any potential vulnerabilities. Additionally, the code you provided does not involve user input or network communication, so it is not vulnerable to injection attacks or other vulnerabilities related to user input or network communication",DoS Exec Code Overflow,1.0,732.0,6.0,0.8565812110900879
177792,DoS Exec Code Overflow," The given C++ code for `SplashBitmap` constructor does not appear to contain any obvious buffer overflow or integer overflow vulnerabilities based on the provided code snippet. However, it does allocate memory dynamically using `gmalloc()` and there is a potential for memory leaks if the allocated memory is not properly released. It is always a good practice to ensure that memory is properly deallocated when it is no longer needed to avoid memory leaks.

The second code snippet for `int sumOfFlooredPairs(vector<int>& nums)` function does not contain any apparent vulnerabilities related to buffer overflow, integer overflow, or use-after-free errors. It does involve some complex calculations and memory management using vectors and unordered maps, but it does not involve any dynamic memory allocation or pointer manipulation that could lead to vulnerabilities.

Therefore, the answer is 'NO' for both code snippets.",DoS Exec Code Overflow,1.0,631.0,6.0,0.8415067195892334
177793,DoS Exec Code Overflow," Based on the provided code snippet, the SplashFTFont::makeGlyph function does not appear to contain any obvious buffer overflow or integer overflow vulnerabilities. However, it does call other functions that could potentially contain such vulnerabilities, such as FT_Load_Glyph and FT_Render_Glyph. Therefore, it is essential to review those functions' implementations as well.

The code snippet provided does not contain any use-after-free, memory leak, null pointer dereference, improper input validation, race conditions, insecure function usage, or insecure resource management vulnerabilities.

However, it is essential to note that the code snippet provided is incomplete and may not represent the entire system. Therefore, it is crucial to perform a thorough vulnerability assessment on the entire application, including all related functions and libraries, to ensure the security of the system.",DoS Exec Code Overflow,2.0,621.0,6.0,0.8193607330322266
