case_id,vuln_type,audit_report,gt,eval_score,eval_input_token_num,eval_output_token_num,eval_inference_time
177912,Exec Code Overflow," Based on the provided code snippet, the `tt_cmap12_validate` function does not appear to be directly vulnerable to integer overflows or any other vulnerabilities mentioned in the steps you've outlined. However, it does contain some potential issues, such as unchecked array bounds and unvalidated user input. These issues, if present elsewhere in the codebase, could potentially lead to vulnerabilities.

The second code snippet you've included, `sumOfFlooredPairs`, is a separate function and does not appear to be related to the `tt_cmap12_validate` function. It is written in C++11 and uses standard library functions, so it does not contain any apparent vulnerabilities based on the given code alone.

Therefore, the answer is 'NO' for both parts of the question. However, it's important to remember that the absence of vulnerabilities in a single function or code snippet does not guarantee the entire codebase is free of vulnerabilities. Thoroughly reviewing the entire codebase and following secure coding practices is essential to ensure the application's security.",Exec Code Overflow,2.0,664.0,6.0,1.1049690246582031
177913,Exec Code Overflow," Based on the provided code snippet, the `tt_cmap8_validate` function does not appear to be directly vulnerable to integer overflows or buffer overflows. However, it does perform some bounds checking on input data, so if that data is not properly validated before being passed to this function, it could potentially lead to vulnerabilities.

Therefore, the answer is: 'Maybe'. The vulnerability depends on the input validation that occurs before calling this function. If the input is not properly validated, then it could potentially lead to integer overflows or other vulnerabilities. If the input is properly validated, then this function should be relatively safe.",Exec Code Overflow,1.0,585.0,6.0,0.8575267791748047
177915,Exec Code Overflow," Based on the provided code snippet, it does not appear to be directly vulnerable to the Exec, Code, Overflow vulnerability described in the CVE-2009-0946. The code is primarily involved in loading and parsing CFF charset tables, and does not contain any obvious integer overflows or other conditions that could lead to arbitrary code execution.

However, it is essential to note that the code might still have other vulnerabilities, such as buffer overflows, use-after-free errors, or memory leaks, which are not addressed in the steps provided. A thorough vulnerability assessment would require a more comprehensive analysis of the entire codebase and its interactions with external inputs.

Therefore, the answer is 'NO', but it is crucial to remember that this code snippet might still have other vulnerabilities.",Exec Code Overflow,2.0,615.0,6.0,0.8419113159179688
177917,Exec Code," Based on the provided code, the XGetFontPath function does not appear to be directly vulnerable to the Exec_Code vulnerability described in the given CVE-ID. The function is primarily concerned with allocating and unpacking memory received over a network, but it does not involve executing arbitrary code or data.

However, it is essential to note that the code snippet provided does not represent the entire program or library. It is always crucial to consider the context in which the function is used and the potential interactions with other parts of the codebase.

Therefore, the answer is 'NO', but it is essential to keep in mind that the code might still have other vulnerabilities or issues that could affect its security.",Exec Code,1.0,597.0,6.0,0.938542366027832
177918,Exec Code," The given C++ code for the function `XListExtensions` is not directly related to the vulnerability described in the provided vulnerability summary. The vulnerability described in the summary is related to an out-of-bounds write issue in the `_XReadPad` function call, which is not present in the given code.

Therefore, the answer is 'NO'. The given code is not vulnerable to the Exec_Code vulnerability described in the provided vulnerability summary.",Exec Code,1.0,547.0,6.0,0.8430092334747314
177919,," Based on the provided code, the function XListFonts() is not directly vulnerable to the nan vulnerability mentioned in the initial code snippet. The nan vulnerability is related to the XListExtensions function in the libX11 library, which is not being used in the provided code.

However, the provided code does have other potential vulnerabilities, such as memory leaks, buffer overflows, and use-after-free errors, which should be addressed.

For example, the code does not check the return value of Xmalloc() and Xfree(), and if Xmalloc() fails, it does not handle the error properly. This can lead to memory leaks. Additionally, the code does not check the length of the strings read from the network, which can result in buffer overflows if the strings are longer than expected. Lastly, the code does not check if the memory allocated for flist and ch is freed properly before returning, which can result in use-after-free errors.

Therefore, while the code is not vulnerable to the specific nan vulnerability mentioned, it does have other potential vulnerabilities that should be addressed.",nan,0.0,674.0,6.0,0.8991420269012451
177920,," Based on the provided code, the `XGetFontPath` function does not appear to be directly vulnerable to the nan vulnerability described in the given vulnerability summary. The code does not involve any floating-point arithmetic or network communication that could be exploited for a nan attack.

Therefore, the answer is 'NO'.",nan,3.0,520.0,6.0,0.9541232585906982
177921,," The second code snippet provided is not related to the first vulnerability discussed. It is a different function written in C++ that calculates the sum of pairs in a vector using prefix sum and modular arithmetic. This code does not contain any apparent security vulnerabilities.

Therefore, the answer is: NO.",nan,1.0,515.0,6.0,0.9395077228546143
177922,Exec Code Overflow," Yes, the given code is vulnerable. The vulnerability is due to a buffer overflow in the `param_buffer` array. The code does not check the length of the input string before copying it into the buffer, which can result in writing past the end of the buffer if the input string is long enough. This can lead to arbitrary code execution or a denial-of-service attack.",Exec Code Overflow,3.0,535.0,6.0,1.430798053741455
177923,Bypass," The given C++ code for the function `sumOfFlooredPairs` does not appear to contain any obvious security vulnerabilities based on the provided code snippet. It is focused on calculating a sum using a prefix sum technique and does not involve any user input, file I/O, or memory management that could lead to common security vulnerabilities.",Bypass,1.0,525.0,6.0,0.9807033538818359
177926,Exec Code Overflow," The given C++ code for `gst_vorbis_tag_add_coverart` function is not directly shown in the code snippet provided. However, based on the CVE-ID and CWE-ID mentioned, it appears that the function is vulnerable to an integer overflow.

The code snippet provided does not contain any integer overflow conditions. However, it does involve the decoding of base64 data and handling of image data, which could potentially lead to integer overflows if the input data is not properly validated or checked for bounds.

To determine if this specific code snippet is vulnerable, we would need to analyze the `g_base64_decode_step` function and the `gst_tag_image_data_to_image_buffer` function to see if they contain any integer overflow conditions. Without this information, it is not possible to definitively say whether this code snippet is vulnerable or not.

Therefore, the answer is:

NO (but with a caveat that the given code snippet may not be representative of the entire function and that further analysis is required to determine if the function is vulnerable)",Exec Code Overflow,3.0,669.0,6.0,1.4849610328674316
177927,, The given PHP code is not directly related to C++ and cannot be evaluated for C++ vulnerabilities as stated in the task. The code is written in PHP and should be evaluated using PHP vulnerability detection techniques.,nan,0.0,499.0,6.0,0.872473955154419
