case_id,vuln_type,audit_report,input_token_num,output_token_num,inference_time
1,CWE-918,"  YES, the code is vulnerable to Server Side Request Forgery (SSRF) attack.

The vulnerability is caused by the `requests_session.request()` method, which allows an attacker to send a request to any URL they want, potentially bypassing access controls such as firewalls that prevent the attackers from accessing the URLs directly.

The vulnerability is triggered when an attacker provides a URL that is not a valid URL, but rather a URL that is not accessible from the outside world, such as a private IP address. The `is_private_address()` function is used to check if the URL is a private address, and if it is, the code raises an exception. However, this does not prevent the attacker from sending a request to the private address, which could potentially bypass the access control.

To mitigate this vulnerability, the code should ensure that the URL is a valid URL and that it is accessible from the outside world before sending the request. Additionally, the code should not allow the attacker to provide a URL that is not a valid URL, but rather should raise an exception if the URL is not a valid URL.",1929,250,9.781355381011963
2,CWE-918,"  NO. The code is not vulnerable to CWE-918. The function `is_private_address` is not used in the `outerTrees` function, and it is not used to make any requests to external URLs. The `outerTrees` function is only used to compute the convex hull of a set of points, and it does not involve any external requests. Therefore, the code is not vulnerable to CWE-918.",1299,99,3.807021141052246
3,CWE-601,"  NO. The code is not vulnerable to the CWE-601 issue. The issue is related to the way the code handles user-controlled input, specifically the `extra_config` parameter, which is used to modify the configuration of the worker HS. However, the code does not use the `extra_config` parameter to modify the `instance_map` configuration, which is the part of the configuration that is vulnerable to the CWE-601 issue.

The code does use the `instance_map` configuration to determine the IP address of the worker HS, but it does not use the `extra_config` parameter to modify this configuration. Therefore, the code is not vulnerable to the CWE-601 issue.",2864,162,6.169673204421997
4,CWE-601,"  NO. The code is not vulnerable to the CWE-601 issue. The function `outerTrees` is not using any user-controlled input, and it is not using the `redirect` function to redirect the user to a malicious site. Instead, it is using the `cross` function to calculate the 2D cross product of two vectors, which is not related to the CWE-601 issue.",1702,93,3.887662649154663
5,CWE-918,"  NO. The code is not vulnerable to CWE-918. The vulnerability is in the `outerTrees` function, which is not present in the code you provided.",1388,41,1.6324234008789062
6,CWE-918,"  NO. The code is not vulnerable to CWE-918. The vulnerability is in the `outerTrees` function, which is not present in the provided code.",1388,40,1.6264736652374268
7,CWE-918,"  YES, the given code is vulnerable to CWE-918.

The vulnerability is due to the fact that the code uses the `filter` method to filter the results based on the format of the data, but it does not properly validate the input data. An attacker could potentially exploit this vulnerability by providing malicious input data, such as a format that is not a valid format for the data, or a format that is not intended to be used in the filter. This could potentially allow an attacker to bypass the intended filter and retrieve data that they are not authorized to access.",1052,129,5.190917491912842
8,CWE-918,"  YES, the given code is vulnerable to CWE-918. The vulnerability is due to the use of the `filter` method in the `adv_search_extension` function, which allows an attacker to manipulate the query by providing a malicious value for the `include_extension_inputs` or `exclude_extension_inputs` parameters. This can lead to a server-side request forgery (SSRF) attack, where the attacker can make the server send a request to an unexpected host or port, potentially bypassing access controls such as firewalls that prevent the attackers from accessing the URLs directly.",1052,138,5.313433647155762
9,CWE-918,"  YES, the code is vulnerable to CWE-918.

The vulnerability is caused by the use of the `filter` method in the `adv_search_serie` function. The `filter` method takes a predicate function as an argument, which is applied to each element in the iterable. In this case, the predicate function is `db.Books.series.any(db.Series.id == serie)`.

The vulnerability arises because the `any` method is used to check if any element in the `db.Books.series` collection satisfies the condition `db.Series.id == serie`. However, this method does not ensure that the condition is applied to the correct collection. In other words, it is possible for an attacker to manipulate the `db.Series.id` field to bypass the intended filter and access unauthorized data.

To fix this vulnerability, the `any` method should be replaced with a more secure method that ensures the condition is applied to the correct collection. One possible solution is to use the `all` method, which checks if all elements in the collection satisfy the condition. Another solution is to use a more secure method such as `filter_by` or `filter_by_id` that ensures the condition is applied to the correct collection.",1052,283,10.692821502685547
10,CWE-918,"  YES, the code is vulnerable to CWE-918.

The vulnerability is caused by the use of the `filter` method in the `adv_search_serie` function. The `filter` method takes a predicate function as an argument, which is applied to each element in the iterable. In this case, the predicate function is `db.Books.series.any(db.Series.id == serie)`.

The vulnerability arises because the `any` method is used to check if any element in the `db.Books.series` collection satisfies the condition `db.Series.id == serie`. However, this method does not ensure that the condition is applied to the correct collection. In other words, it is possible for an attacker to manipulate the `db.Series.id` field to bypass the intended filter and access unauthorized data.

To fix this vulnerability, the `any` method should be replaced with a more secure method that ensures the condition is applied to the correct collection. One such method is the `all` method, which checks if all elements in the collection satisfy the condition.

Therefore, the fixed code should be:
```
def adv_search_serie(q, include_series_inputs, exclude_series_inputs):
    for serie in include_series_inputs:
        q = q.filter",1052,301,11.264894247055054
11,CWE-918,"  NO. The code is not vulnerable to CWE-918. The vulnerability is in the `outerTrees` function, which is not used in the `adv_search_shelf` function. The `outerTrees` function is used to calculate the convex hull of a set of points, but it does not involve any user input or external data, so it is not vulnerable to CWE-918.",1134,94,3.853327751159668
12,CWE-918,"  NO. The given code is not vulnerable to CWE-918. The code is using the `outerjoin` method to join two tables based on a common column, and then filtering the results based on the values in the `include_shelf_inputs` and `exclude_shelf_inputs` lists. The code is not using the `outerTrees` method, which is vulnerable to CWE-918.",1134,97,3.7189698219299316
13,CWE-918,"  YES, the code is vulnerable to Server-Side Request Forgery (SSRF) attack.

The vulnerability is caused by the `outerTrees` function, which takes a list of points as input and returns a list of points that form the convex hull of the input points. The function uses the 2D cross product of two vectors to determine the orientation of the points. However, the function does not properly handle the case where the points are collinear, which can lead to a potential SSRF vulnerability.

In particular, the function assumes that the cross product of two vectors is positive if the vectors make a counter-clockwise turn, and negative if the vectors make a clockwise turn. However, if the points are collinear, the cross product will be zero, and the function will not be able to determine the orientation of the points. This can lead to a potential SSRF vulnerability if an attacker can provide a set of points that are collinear and form a loop, which can cause the function to loop indefinitely and potentially lead to a denial-of-service or other types of attacks.

To fix the vulnerability, the function should properly handle the case where the points are collinear by using a different method to determine the orientation of the points, such as checking if the points are on the same line or not.",1744,289,11.05844759941101
14,CWE-918,"  YES, the code is vulnerable to Server-Side Request Forgery (SSRF) attack.

The vulnerability is caused by the `outerTrees` function, which takes a list of points as input and returns a list of points that form the convex hull of the input points. The function uses the 2D cross product of two vectors to determine the orientation of the points. However, the function does not properly handle the case where the points are collinear, which can lead to a potential SSRF vulnerability.

In particular, the function assumes that the cross product of two vectors is positive if the vectors make a counter-clockwise turn, and negative if the vectors make a clockwise turn. However, if the points are collinear, the cross product will be zero, and the function will not be able to determine the orientation of the points. This can lead to a potential SSRF vulnerability if an attacker can provide a set of points that are collinear and form a loop, which can cause the function to loop indefinitely and potentially lead to a denial-of-service or other types of attacks.

To fix the vulnerability, the function should properly handle the case where the points are collinear by using a different method to determine the orientation of the points, such as checking if the points are on the same line or not.",1744,289,11.635064840316772
15,CWE-918,"  NO. The code is not vulnerable to the CWE-918 vulnerability. The vulnerability is related to the use of the `render_title_template` function, which is not used in the code snippet provided. Additionally, the code does not appear to be vulnerable to the CVE-2022-0939 vulnerability, as it does not appear to be using the `outerTrees` function.",1570,94,3.9185516834259033
16,CWE-918,"  YES, the code is vulnerable to Server-Side Request Forgery (SSRF) attack.

The vulnerability is caused by the `outerTrees` function, which takes a list of points as input and returns the convex hull of the points. The function uses the 2D cross product of the vectors OA and OB to determine the orientation of the points. However, the function does not properly handle the case where the points are collinear, which can lead to a false positive result.

An attacker can exploit this vulnerability by providing a list of points that are all on the same line, but not necessarily on the same plane. The `outerTrees` function will return a convex hull that includes all the points in the list, which can lead to a bypass of the access controls.

For example, an attacker can provide a list of points that are all on the same line, but not necessarily on the same plane, and the `outerTrees` function will return a convex hull that includes all the points in the list, which can lead to a bypass of the access controls.

To fix this vulnerability, the `outerTrees` function should properly handle the case where the points are collinear, and return a convex hull that includes only the points that are not on the same line.",1570,287,11.380922317504883
17,CWE-918,"  NO. The code is not vulnerable to CWE-918. The vulnerability is related to the use of the `generate_password_hash` function, which is used to hash the user's password. The code does not use the `generate_password_hash` function to hash the user's email or kindle_mail. Therefore, the code is not vulnerable to CWE-918.",2724,91,3.763122320175171
18,CWE-918,"  NO, the code is not vulnerable to CWE-918.

The code is using the `sorted` function to sort the points lexicographically, and then using the `set` function to remove duplicates. This ensures that the points are unique and in a consistent order.

The code is also using the `cross` function to calculate the 2D cross product of the vectors OA and OB, which is used to determine the orientation of the points. The `cross` function is correctly implemented and does not have any vulnerabilities.

Therefore, the code is not vulnerable to CWE-918.",2724,139,5.352254629135132
19,CWE-918,"  NO. The code is not vulnerable to CWE-918. The vulnerability is in the `outerTrees` function, which is not used in the provided code.",1532,40,1.6981933116912842
20,CWE-918,"  NO. The code is not vulnerable to CWE-918. The vulnerability is in the `outerTrees` function, which is not used in the provided code.",1532,40,1.745722770690918
21,CWE-918,"  NO. The code is not vulnerable to CWE-918. The vulnerability is related to the use of the `format_date` function, which is not used in the provided code. Additionally, the code does not use the `datetime` module to manipulate dates, which would also make it vulnerable to CWE-918.",2370,75,3.2235989570617676
22,CWE-918,"  NO. The code is not vulnerable to CWE-918. The vulnerability is related to the use of the `format_date` function, which is not used in the provided code. The `format_date` function is used in the `calibre-web` project, but it is not used in the provided code. Therefore, the code is not vulnerable to CWE-918.",2370,90,3.7280712127685547
23,CWE-918,"  YES, the code is vulnerable to CWE-918. The vulnerability is in the `outerTrees` function, which uses the `cross` function to determine the orientation of the points in the convex hull. The `cross` function is vulnerable to a type of attack called ""Server-Side Request Forgery"" (SSRF), which can be used to bypass access controls and retrieve sensitive information from internal networks.

The `cross` function takes three points as input and returns the 2D cross product of the vectors OA and OB. The function is vulnerable to SSRF because it uses the `requests` library to retrieve the contents of the URL specified in the `points` list. If an attacker can control the contents of the `points` list, they can use the `cross` function to retrieve sensitive information from internal networks.

To exploit this vulnerability, an attacker would need to have a valid URL that can be used to access the internal network. Once the attacker has control over the `points` list, they can use the `cross` function to retrieve sensitive information from the internal network.

To fix this vulnerability, the `cross` function should be modified to use a different method to determine the orientation of the points in the convex hull. This could include using a different algorithm or using a different library that does not have the same vulnerability.",1296,301,11.320019245147705
24,CWE-918,"  YES, the code is vulnerable to CWE-918. The vulnerability is in the `outerTrees` function, which uses the `cross` function to determine the orientation of the points in the convex hull. The `cross` function is vulnerable to a type of attack called ""Server-Side Request Forgery"" (SSRF), which can be used to bypass access controls and retrieve sensitive information from internal networks.

The `cross` function takes three points as input and returns the 2D cross product of the vectors OA and OB. The function is vulnerable to SSRF because it uses the `requests` library to retrieve the contents of the URL specified in the `points` list. If an attacker can control the contents of the `points` list, they can potentially use the `cross` function to retrieve sensitive information from internal networks.

To exploit this vulnerability, an attacker would need to have a valid URL that can be used to access the internal network. Once the URL is controlled, the attacker can use the `cross` function to retrieve sensitive information from the internal network.

To fix this vulnerability, the `cross` function should be modified to use a different method to determine the orientation of the points in the convex hull. This could include using a different algorithm or using a different library that does not have the same vulnerability.",1296,297,11.96343994140625
25,CWE-918,"  YES, the given code is vulnerable to Server-Side Request Forgery (SSRF) attack.

The vulnerability is caused by the fact that the code retrieves the contents of a URL provided by the user, without verifying that the URL is valid and that it is being sent to the expected destination. This allows an attacker to make the server send a request to a URL that is not intended, potentially bypassing access controls such as firewalls that prevent the attacker from accessing the URL directly.

The vulnerability is caused by the `calibre_db.search_query` function, which takes a `search` parameter that is not properly validated. The function then uses this parameter to construct a SQL query that retrieves the contents of the URL provided by the user.

To exploit this vulnerability, an attacker would need to provide a URL that is not intended to be retrieved by the server, but that is still valid and that the server would send a request to. For example, an attacker could provide a URL that is on the same network as the server, but that is not intended to be accessed by the server. The server would then send a request to this URL, potentially bypassing access controls and retrieving sensitive information.

To fix this vulnerability, the code should properly validate the `search` parameter and ensure that it is being sent to the expected destination. This",4098,301,11.28078007698059
26,CWE-918,"  YES, the given code is vulnerable to Server-Side Request Forgery (SSRF) attack.

The vulnerability is caused by the fact that the code retrieves the contents of a URL provided by the user, without verifying that the URL is valid and that it is being sent to the expected destination. This allows an attacker to make the server send a request to a URL that is not intended, potentially bypassing access controls such as firewalls that prevent the attacker from accessing the URL directly.

The vulnerability is caused by the `calibre_db.search_query` function, which takes a `search` parameter that is not properly validated. The function then uses this parameter to construct a SQL query that retrieves the contents of the URL provided by the user.

To exploit this vulnerability, an attacker would need to provide a URL that is not intended to be retrieved by the server, but that is still valid and that the server would send a request to. For example, an attacker could provide a URL that is on the same network as the server, but that is not intended to be accessed by the server. The server would then send a request to this URL, potentially bypassing access controls and retrieving sensitive information.

To fix this vulnerability, the code should properly validate the `search` parameter and ensure that it is being sent to the expected destination. This",4098,301,11.983633279800415
27,CWE-918,"  NO. The code is not vulnerable to CWE-918. The vulnerability is in the `outerTrees` function, which is not used in the provided code.",3208,40,1.8249671459197998
28,CWE-918,"  NO. The code is not vulnerable to CWE-918. The vulnerability is in the `outerTrees` function, which is not used in the provided code.",3208,40,1.8304738998413086
29,CWE-918,"  NO. The code is not vulnerable to CWE-918. The vulnerability is in the `outerTrees` function, which is not present in the code snippet provided.",1094,41,1.6648807525634766
30,CWE-918,"  NO. The code is not vulnerable to CWE-918. The vulnerability is in the `outerTrees` function, which is not present in the code snippet provided.",1094,41,1.6611006259918213
31,CWE-918,"  NO. The code is not vulnerable to CWE-918. The vulnerability is related to the use of the `render_title_template` function, which is not present in the code snippet provided.",1430,47,1.9708290100097656
32,CWE-918,"  NO. The code is not vulnerable to CWE-918. The vulnerability is related to the use of the `render_title_template` function, which is not present in the code snippet provided.",1430,47,2.0058374404907227
33,CWE-918,"  YES, the code is vulnerable to Server-Side Request Forgery (SSRF) attack.

The vulnerability is caused by the use of the `calibre_db.common_filters()` function, which allows an attacker to specify a URL or similar request from an upstream component and retrieve the contents of this URL. This can be used to bypass access controls such as firewalls that prevent the attacker from accessing the URL directly.

The attacker can use this vulnerability to make it appear as if the server is sending the request, possibly bypassing access controls such as firewalls that prevent the attacker from accessing the URLs directly. The server can be used as a proxy to conduct port scanning of hosts in internal networks, use other URLs such as that can access documents on the system (using file://), or use other protocols such as gopher:// or tftp://, which may provide greater control over the contents of requests.

The vulnerability is also related to the use of the `outerTrees` function, which is used to calculate the convex hull of a set of points. The function uses the 2D cross product of OA and OB vectors, i.e. z-component of their 3D cross product. This can be used to detect the case we have just one unique point.

To exploit this vulnerability, an attacker can",1610,301,11.794612646102905
34,CWE-918,"  YES, the code is vulnerable to Server-Side Request Forgery (SSRF) attack.

The vulnerability is caused by the use of the `calibre_db.common_filters()` function, which allows an attacker to specify a URL or similar request from an upstream component and retrieve the contents of this URL. This can be used to bypass access controls such as firewalls that prevent the attacker from accessing the URL directly.

The attacker can use this vulnerability to make it appear as if the server is sending the request, possibly bypassing access controls such as firewalls that prevent the attacker from accessing the URLs directly. The server can be used as a proxy to conduct port scanning of hosts in internal networks, use other URLs such as that can access documents on the system (using file://), or use other protocols such as gopher:// or tftp://, which may provide greater control over the contents of requests.

The vulnerability is in the `outerTrees` function, which is used to calculate the convex hull of a set of points. The function uses the `cross` function to calculate the 2D cross product of OA and OB vectors, and returns a positive value if OAB makes a counter-clockwise turn, negative for clockwise turn, and zero if the points are collinear. However, the function does not properly check the return",1610,301,11.572365522384644
35,CWE-918,"  NO. The code is not vulnerable to CWE-918. The vulnerability is in the `outerTrees` function, which is not used in the `ratings_list` function.",1428,45,1.8779480457305908
36,CWE-918,"  NO. The code is not vulnerable to CWE-918. The vulnerability is in the `outerTrees` function, which is not used in the `ratings_list` function.",1428,45,1.819286823272705
37,CWE-918,"  NO. The code is not vulnerable to CWE-918. The vulnerability is related to the use of the `render_title_template` function, which is not used in the provided code. Additionally, the code does not use any external libraries or frameworks, so it is not vulnerable to any known vulnerabilities.",2570,71,2.786806344985962
38,CWE-918,"  NO. The code is not vulnerable to CWE-918. The vulnerability is related to the use of the `render_title_template` function, which is not used in the provided code. Additionally, the code does not use any external libraries or frameworks, so it is not vulnerable to any known vulnerabilities.",2570,71,3.297071695327759
39,CWE-918,"  NO. The code is not vulnerable to the CWE-918 vulnerability. The vulnerability is related to the use of the `create_function` method to create a custom function in the database, which allows an attacker to execute arbitrary SQL code. However, the code does not use this method to create a custom function, and instead uses the `outerjoin` method to join the `db.Books` table with the `ub.ReadBook` table. This method is used to perform a left outer join, which is not vulnerable to the CWE-918 vulnerability. Therefore, the code is not vulnerable to this specific vulnerability.",4852,142,5.957499742507935
40,CWE-918,"  NO. The code is not vulnerable to the CWE-918 vulnerability. The vulnerability is related to the use of the `create_function` method to create a custom function in the database, which allows an attacker to execute arbitrary SQL code. However, the code does not use this method to create a custom function, and instead uses the `outerjoin` method to join the `db.Books` table with the `ub.ReadBook` table. This method is used to perform a left outer join, which is not vulnerable to the CWE-918 vulnerability. Therefore, the code is not vulnerable to this specific vulnerability.",4852,142,6.366182088851929
