case_id,vuln_type,audit_report,input_token_num,output_token_num,inference_time
76,CWE-284,"  YES, the given code is vulnerable to CWE-284.

The vulnerability is in the `outerTrees` function, which is used to compute the convex hull of a set of points. The function uses the 2D cross product of vectors to determine the orientation of the points. However, the function does not properly handle the case where the points are collinear, which can lead to a vulnerability.

In particular, the function assumes that the cross product of two vectors is positive if the vectors make a counter-clockwise turn, and negative if they make a clockwise turn. However, if the vectors are collinear, the cross product is zero, but the function does not properly handle this case. This can lead to a vulnerability if an attacker can control the points in the set, and can manipulate the cross product to cause the function to return an incorrect result.

For example, an attacker could craft a set of points that are collinear, but have a different orientation than the original points. The function would then return an incorrect result, potentially allowing the attacker to bypass security checks or perform other malicious actions.

Therefore, it is important to properly handle the case where the points are collinear in the `outerTrees` function, and to ensure that the function returns the correct result in all cases.",2329,287,11.901199102401733
77,CWE-918,"  YES, the code is vulnerable to Server Side Request Forgery (SSRF) attack. The vulnerability is in the `get_file` function, where the `requests.get` method is used to retrieve the contents of a URL. The URL is constructed by replacing the `www.dropbox.com` part of the original URL with `dl.dropboxusercontent.com`. This can allow an attacker to access sensitive information by sending a request to a URL that is not intended to be accessed by the server.

To exploit this vulnerability, an attacker would need to send a request to the server with a URL that is not intended to be accessed by the server. For example, the attacker could send a request to `http://localhost:8080/dl.dropboxusercontent.com/file.txt`, which would allow the attacker to access the file `file.txt` on the server's file system.

The vulnerability is related to CWE-918, which is a type of SSRF vulnerability. The vulnerability is caused by the fact that the server is not properly validating the URL that is being requested, and is instead blindly forwarding the request to the URL that is provided. This allows an attacker to send a request to a URL that is not intended to be accessed by the server, which can lead to sensitive information being dis",1058,301,10.935330390930176
78,CWE-116,"  YES, the given code is vulnerable to a CWE-116 issue.

The vulnerability is caused by the improper escaping of the shell command, while calling the `ansible_runner.interface.run_command` function. This can lead to parameters getting executed as host's shell commands, which can be used to execute arbitrary commands on the host.

The code is vulnerable because it does not properly escape the `plugin_names` parameter, which is a user-supplied input. This allows an attacker to inject malicious commands into the `plugin_names` parameter, which will be executed as shell commands on the host.

To fix this vulnerability, the code should properly escape the `plugin_names` parameter using the `shlex.quote` function. This will ensure that the input is properly escaped and cannot be used to execute arbitrary commands on the host.",1769,192,7.889461517333984
79,CWE-918,"  NO. The code is not vulnerable to CWE-918. The function `_check_login_status` is not vulnerable to SSRF because it only retrieves the contents of the URL provided in the `X-Direct-Url` header, and it does not allow the addition of arbitrary URLs for proxying. Additionally, the function `outerTrees` is not vulnerable to SSRF because it only retrieves the contents of the URLs provided in the `points` list, and it does not allow the addition of arbitrary URLs for proxying.",1278,120,4.5648393630981445
80,CWE-601,"  YES, the code is vulnerable to CWE-601.

The vulnerability is caused by the use of the `redirect` function in the `return` statement, which takes the `next` parameter from the `request.POST` dictionary. This means that an attacker can potentially redirect the user to a malicious website by modifying the `next` parameter in the request.

For example, an attacker could send a request with a modified `next` parameter that contains a malicious URL, such as `http://www.maliciouswebsite.com`. When the `redirect` function is called with this modified `next` parameter, the user will be redirected to the malicious website, potentially leading to a phishing attack.

To fix this vulnerability, the `redirect` function should be used with caution and should only be used with trusted input. Additionally, the `next` parameter should be validated to ensure that it is a valid URL before it is used in the `redirect` function.",1335,217,8.366611957550049
81,CWE-264,"  YES, the given code is vulnerable to CWE-264.

The vulnerability is due to the fact that the code does not properly implement token expiration. This means that an attacker can bypass intended authorization restrictions by creating new tokens through token chaining, leveraging possession of a token for a disabled user account, or leveraging possession of a token for an account with a changed password.

The code does not properly check for token expiration, which allows an attacker to create a new token that is valid for a longer period of time than the original token. This can be used to bypass intended authorization restrictions and gain unauthorized access to resources.

To fix this vulnerability, the code should properly implement token expiration by checking for token expiration and refreshing the token if it has expired. This can be done by using the `token_api.get_token` method to retrieve the token and checking its `expires` field. If the token has expired, the code should refresh the token by using the `token_api.create_token` method.",3667,235,9.125096559524536
82,CWE-78,"  YES, the given code is vulnerable to CWE-78: Injection.

The vulnerability arises from the use of the `exec` function to execute code from an untrusted source. This allows an attacker to inject arbitrary code into the program, potentially leading to a security breach.

The code is vulnerable because it does not properly sanitize or validate the input before executing it. An attacker could potentially inject malicious code that could be executed by the `exec` function, potentially leading to a security breach.

To fix this vulnerability, the code should properly sanitize and validate the input before executing it. This could involve using a whitelist of allowed functions and variables, or using a sandboxing mechanism to limit the execution of the code.",1334,170,6.834110975265503
83,CWE-22,"  YES, the given code is vulnerable to CWE-22. The vulnerability is caused by the use of the `exec` function, which allows an attacker to execute arbitrary code in the context of the program. This can be exploited by injecting malicious code into the `code` variable, which will then be executed when the `exec` function is called.

The vulnerability is caused by the fact that the `exec` function does not properly sanitize the input it receives. An attacker can inject malicious code into the `code` variable by providing a specially crafted input that is not properly sanitized. Once the malicious code is executed, it can potentially cause unintended behavior, including the disclosure of sensitive information or the execution of arbitrary code.

To fix the vulnerability, the `exec` function should be used with caution and proper input validation should be implemented to ensure that only trusted input is executed. Additionally, the `config.retrieveBoilerplateFile` function should be reviewed to ensure that it properly sanitizes its input and does not allow for the injection of malicious code.",981,245,9.227672338485718
84,CWE-352,"  YES, the given code is vulnerable to a CWE-352 vulnerability. The vulnerability is caused by the fact that the code does not properly verify whether a well-formed, valid, consistent request was intentionally provided by the user who submitted the request. This can be exploited by an attacker to trick a client into making an unintentional request to the web server, which will be treated as an authentic request.",1638,92,3.7541239261627197
85,CWE-290,"  YES, the code is vulnerable to a CWE-290 attack. The vulnerability is caused by the use of the `json.loads()` function to parse the `allowlist` parameter, which can result in a JSON deserialization vulnerability if the input is not properly validated. An attacker can potentially exploit this vulnerability by sending a malicious input to the `allowlist` parameter, which can lead to a denial of service or information disclosure.

To fix this vulnerability, the code should validate the input to `json.loads()` to ensure that it is a valid JSON string. Additionally, the code should also validate the `exclude` parameter to ensure that it is a valid regular expression.",1012,155,6.376710414886475
86,CWE-835,"  NO. The code is not vulnerable to CWE-835. The vulnerability is in the `outerTrees` function, which is not present in the code snippet provided.",1208,41,1.731870174407959
87,CWE-444,"  YES, the given code is vulnerable to CWE-444.

The vulnerability arises from the use of the `smuggle_url` function, which allows an attacker to add arbitrary HTTP headers to a request made by the `yt-dlp` tool. This can allow the attacker to MITM the request and exfiltrate cookies or other sensitive information.

The `smuggle_url` function is used to add a `Referer` header to the request, which is set to `https://storyfire.com/`. This header is used to bypass the same-origin policy and allow the request to be made to a different domain. However, this header can be modified by an attacker to point to a different domain, allowing the attacker to MITM the request and exfiltrate cookies or other sensitive information.

To fix this vulnerability, the `smuggle_url` function should be updated to only allow the addition of trusted headers, such as the `Referer` header, and not allow arbitrary headers to be added. Additionally, the `yt-dlp` tool should be updated to only allow trusted domains to be accessed, and not allow access to arbitrary domains.",2005,268,10.85185170173645
88,CWE-79,"  YES, the given code is vulnerable to CWE-79. The reason is that the code does not properly escape user-supplied data before including it in output that is used as a web page that is served to other users. This allows an attacker to inject malicious script that is executed by the web browser, potentially leading to a reflected XSS vulnerability.",2272,79,3.2440686225891113
89,CWE-22,"  YES, the given code is vulnerable to CWE-22. The vulnerability is due to the use of the `os.path.join` function to construct the path to the file being sent. This function does not properly validate the user-controlled filename variable, which can lead to an arbitrary file read on the system. This is fixed in version 1.3.1.",1032,83,3.203279495239258
90,CWE-22,"  YES, the code is vulnerable to CWE-22. The `outerTrees` function uses the `cross` function to determine the orientation of the points in the convex hull. However, the `cross` function does not properly neutralize special elements in the pathname, which can cause the pathname to resolve to a location outside of the restricted directory. This can lead to an arbitrary file read on the system.",1024,90,3.437978982925415
91,CWE-918,"  YES, the code is vulnerable to CWE-918. The vulnerability is caused by the fact that the `outerTrees` function does not properly validate the `points` parameter, which can be controlled by the user. An attacker can potentially provide a malicious value for the `points` parameter, which can lead to a blind server-side request forgery (SSRF) vulnerability.

The `outerTrees` function uses the `cross` function to compute the 2D cross product of two vectors, which is used to determine the orientation of the points. However, the `cross` function does not properly validate the `points` parameter, which can lead to a vulnerability if an attacker can control the `points` parameter.

For example, an attacker can potentially provide a malicious value for the `points` parameter, which can cause the `outerTrees` function to make a request to an unexpected host or port, potentially bypassing access controls such as firewalls that prevent the attackers from accessing the URLs directly.

Therefore, it is important to properly validate the `points` parameter to prevent such vulnerabilities.",1019,249,9.673646211624146
92,CWE-22,"  YES, the code is vulnerable to CWE-22. The function `outerTrees` takes a list of points as input and returns a list of points that form the outermost convex hull of the input points. The function uses the `cross` function to compute the 2D cross product of two vectors, which is used to determine the orientation of the points in the convex hull. However, the `cross` function does not properly validate the input points, which allows an attacker to manipulate the output of the function by providing malicious input points. Specifically, an attacker can provide a point that is very close to the original point, but in the opposite direction, which can cause the function to return an incorrect result. This vulnerability can be exploited to bypass security measures that rely on the correctness of the convex hull computation.",1072,179,6.876639366149902
93,CWE-22,"  YES, the code is vulnerable to CWE-22. The `outerTrees` function uses the `cross` function to determine the orientation of the points in the convex hull. However, the `cross` function does not properly neutralize special elements within the pathname that can cause the pathname to resolve to a location that is outside of the restricted directory. This allows an attacker to access files or directories that are elsewhere on the system.",1064,96,3.8846137523651123
94,CWE-918,"  NO. The code is not vulnerable to CWE-918. The function `outerTrees` is not using any user-controlled input, and it is not using any external libraries that could be vulnerable to this type of attack. Additionally, the function is not using any external resources, and it is not making any requests to external servers. Therefore, it is not vulnerable to CWE-918.",1059,91,3.596383571624756
95,CWE-79,"  YES, the given code is vulnerable to a cross-site scripting (XSS) attack. The reason is that the `mark_safe()` function is used to render the custom field values, which allows an attacker to inject malicious script into the page. This can be exploited by a malicious user to execute arbitrary code on the victim's browser.

To fix this vulnerability, the `mark_safe()` function should be replaced with the appropriate use of `format_html()` instead. This will ensure that the custom field values are properly escaped and cannot be used to inject malicious script into the page.",2656,132,5.654084205627441
96,CWE-918,"  YES, the code is vulnerable to Server-Side Request Forgery (SSRF) attack.

The vulnerability is caused by the fact that the code retrieves the contents of a URL provided by the user, without verifying that the URL is valid or that it is being sent to the expected destination. This allows an attacker to send a request to a URL that is not intended to be accessed by the server, potentially bypassing access controls such as firewalls that prevent the attacker from accessing the URL directly.

The vulnerability is caused by the following line of code:
```
db_element = db_session.query(db_object).filter(db_filter == add_element).first()
```
The `db_filter` variable is set to `db_object.lang_code` if `db_type` is `'languages'`, `db_object.value` if `db_type` is `'custom'`, and `db_object.name` otherwise. The `add_element` variable is a user-provided value that is used to filter the results of the query.

An attacker could potentially exploit this vulnerability by providing a URL that is not intended to be accessed by the server, but is instead a URL that can be accessed by the attacker. For example, the attacker could provide a URL that is on a different host or",1668,301,12.34985637664795
97,CWE-918,"  YES, the code is vulnerable to Server-Side Request Forgery (SSRF) attack.

The vulnerability is caused by the fact that the code retrieves the contents of a URL provided by the user, without verifying that the URL is valid or that it is being sent to the expected destination. This allows an attacker to send a request to a URL that is not intended to be accessed by the server, potentially bypassing access controls such as firewalls that prevent the attacker from accessing the URL directly.

The vulnerability is caused by the following line of code:
```
db_element = db_session.query(db_object).filter(db_filter == add_element).first()
```
The `db_filter` variable is set to `db_object.lang_code` if `db_type` is `'languages'`, `db_object.value` if `db_type` is `'custom'`, and `db_object.name` otherwise. The `add_element` variable is a user-provided value that is used to filter the results of the query.

An attacker could potentially exploit this vulnerability by providing a URL that is not intended to be accessed by the server, but is instead a URL that can be accessed by the attacker. For example, the attacker could provide a URL that is on a different host or",1668,301,11.95911455154419
98,CWE-918,"  YES, the code is vulnerable to Server-Side Request Forgery (SSRF) attack.

The vulnerability is caused by the `outerTrees` function, which takes a list of points as input and returns a list of points that form the convex hull of the input points. The function uses the 2D cross product of two vectors to determine the orientation of the points. However, the function does not properly validate the input points, which allows an attacker to send a malicious request that can cause the server to send a request to an unexpected host or port.

For example, an attacker can send a request with a list of points that contains a point with a malicious URL, such as `http://example.com/`. The server will then send a request to `http://example.com/` to retrieve the contents of the URL, which can potentially lead to a server-side request forgery attack.

To fix the vulnerability, the `outerTrees` function should properly validate the input points to ensure that they are valid and do not contain any malicious data. This can be done by checking the format of the points and ensuring that they are within the expected range of values. Additionally, the function should not send any requests to unexpected hosts or ports, and should instead return an error message to the user if it detects any malicious data in the input points.",1534,296,11.6071035861969
99,CWE-918,"  YES, the code is vulnerable to Server-Side Request Forgery (SSRF) attack.

The vulnerability is caused by the `outerTrees` function, which takes a list of points as input and returns a list of points that form the convex hull of the input points. The function uses the 2D cross product of two vectors to determine the orientation of the points. However, the function does not properly validate the input points, which allows an attacker to send a malicious request that can cause the server to send a request to an unexpected host or port.

For example, an attacker can send a request with a list of points that contains a point with a malicious URL, such as `http://example.com/`. The server will then send a request to `http://example.com/` to retrieve the contents of the URL, which can potentially lead to a server-side request forgery attack.

To fix the vulnerability, the `outerTrees` function should properly validate the input points to ensure that they are valid and do not contain any malicious data. This can be done by checking the format of the points and ensuring that they are within the expected range of values. Additionally, the function should not send any requests to unexpected hosts or ports, and should instead return an error message to the user if it detects any malicious data in the input points.",1534,296,11.75141978263855
100,CWE-918,"  NO. The code is not vulnerable to CWE-918. The vulnerability is in the `outerTrees` function, which is not used in the provided code.",2076,40,1.7965960502624512
