case_id,vuln_type,audit_report,gt,eval_score,eval_input_token_num,eval_output_token_num,eval_inference_time
11,access control," The answer is YES, the contract TestContract is vulnerable due to an access control vulnerability similar to the previous code. The function `withdrawAll()` is marked as onlyOwner, but the contract does not implement the Ownable contract, which means the modifier onlyOwner does not have the effect of restricting the function to the owner of the contract. Any user can call the function `withdrawAll()` and withdraw the contract's balance.

In addition, the contract LetsSuicide and SuicideContract are vulnerable to a reentrancy attack. The function NukeContract in SuicideContract calls the constructor of LetsSuicide, which directly calls the suicide function, allowing the recipient contract to execute arbitrary code before the state change is finalized. This can lead to a loss of funds if the recipient contract is malicious.",access control,4.0,592.0,6.0,2.734973192214966
12,access control," Answer:

Yes, the first contract Missing is vulnerable due to an access control vulnerability. The missing() function is public and does not have the onlyowner modifier, so any address can call this function and set themselves as the owner. This could allow an attacker to call the withdraw() function and steal the contract's funds.

The other contracts LetsSuicide and SuicideContract do not have any obvious vulnerabilities in the provided code. However, the SuicideContract contract has a function NukeContract() that allows for self-destructing the contract by calling the LetsSuicide contract. This could potentially be used in a malicious way if the Russian address is not properly checked or authorized.",access control,4.0,568.0,6.0,2.38565993309021
13,access control," The provided code is vulnerable. The vulnerability lies in the `NukeContract` function of the `SuicideContract` contract, which allows any user to suicide the contract by calling this function with the address of the contract to be suicide as an argument. This can lead to loss of funds and unintended behavior. The `LetsSuicide` contract is not needed in this case, as the `selfdestruct` function can be called directly. The `LetsSuicide` contract is also missing an access control mechanism, allowing anyone to suicide any contract by calling its function.",access control,4.0,549.0,6.0,2.6744775772094727
14,access control," NO, the second smart contract code is not vulnerable based on the provided code snippet. The first contract `Wallet` does not show any signs of access control vulnerabilities in the provided functions. The second contract `LetsSuicide` is a constructor function that self-destructs the contract and transfers funds to the specified address. The third contract `SuicideContract` calls the `LetsSuicide` constructor and passes the `Russian` address as an argument. There are no access control issues in this code. However, it's important to note that the `LetsSuicide` constructor function should be marked as `payable` only if it intends to receive funds, and the `SuicideContract` should ensure that the `Russian` address is a valid address before calling the `LetsSuicide` constructor.",access control,1.0,595.0,6.0,1.8704793453216553
15,access control," Answer:

Yes, the first smart contract code is vulnerable due to an access control vulnerability. The function IamMissing() in the Missing contract should be marked as constructor to ensure that it is only called once during contract creation and not accidentally called later, which would result in the owner variable being set to the wrong value. The current code allows any caller to set the owner variable to their address, which is not intended.

The second smart contract code is not vulnerable based on the provided code. However, it is important to note that the NukeContract function in the SuicideContract contract can be used to self-destruct the Russian contract by passing its address to the function. This can be a potential security risk if used improperly.",access control,4.0,579.0,6.0,2.2748727798461914
16,access control," No, the second smart contract code is not vulnerable based on the given code snippet.

The first contract ""Map"" does not have any obvious vulnerabilities in the provided functions. The `withdraw` function uses a require statement to ensure that only the owner can withdraw funds, and the `set` and `get` functions are properly implemented to set and get values in the map array.

The second contract ""LetsSuicide"" is a constructor function that calls the suicide function to destroy the contract. It is not vulnerable based on the given code snippet.

The third contract ""SuicideContract"" calls the constructor function of the ""LetsSuicide"" contract to destroy the contract. It is not vulnerable based on the given code snippet.

However, it is important to note that the use of the word ""Suicide"" and ""Fucking"" in the contract names is not recommended as it goes against best practices for naming conventions in smart contracts.",access control,1.0,621.0,6.0,3.122455596923828
17,access control," Yes, the provided code is vulnerable to access control attacks. The `SuicideContract` contract has a function `NukeContract` that allows for arbitrary contract deletion by calling the `LetsSuicide` contract. This can be exploited by an attacker to delete any contract, not just the intended target. This is a form of access control vulnerability because the `NukeContract` function does not properly restrict who can call it, allowing for unauthorized deletion of contracts.",access control,3.0,527.0,6.0,2.649872064590454
18,access control," Answer:

NO. The provided code for the `Wallet` contract does not have the same vulnerability as the original code in the 'access control' category. The `PopBonusCode` function in the `Wallet` contract checks if the array index is within the bounds of the array before decrementing the array length. However, the provided code for the `SuicideContract` and `LetsSuicide` contracts are separate contracts that can be used to suicide or nuke other contracts. This functionality is different from the access control vulnerability discussed in the original code.",access control,2.0,546.0,6.0,2.142103910446167
19,access control," The contract is vulnerable. The constructor function in the `Missing` contract is called when the contract is mined, and it sets the `owner` variable to the address of the creator. However, the `Missing` contract does not initialize the `owner` variable in the constructor with `msg.sender`, but assigns it in a separate function `Constructor()`. This means that if an attacker calls the `Constructor()` function after the contract has been deployed, they can change the `owner` variable and gain unauthorized access to the `withdraw()` function.

Furthermore, the `LetsSuicide` contract has a constructor that calls the `suicide` function, which is deprecated in Solidity version 0.5.0 and later. Instead, the `selfdestruct` function should be used.

The `SuicideContract` contract has a function `NukeContract` that creates a new instance of the `LetsSuicide` contract and calls its constructor with the `Russian` address as an argument. This can potentially be used by an attacker to delete any contract, including the `Missing` contract, and steal any funds in it.

Therefore, the contract is vulnerable to access control vulnerabilities and potential deletion by the `NukeContract` function.",access control,4.0,683.0,6.0,3.1528074741363525
20,access control," The answer is YES, the contract LetsSuicide is vulnerable. The vulnerability lies in the fact that the constructor of the contract LetsSuicide is public, which means that any address can call it and suicide the contract, bypassing the access control in the SuicideContract contract.",access control,3.0,489.0,6.0,2.578486442565918
21,access control," Yes, the given code is vulnerable to access control issues. The `LetsSuicide` contract is a suicide contract that allows the owner to suicide (self-destruct) the contract and send the funds to a specified address. However, the `SuicideContract` contract does not check if the caller of the `NukeContract` function is the owner before calling the `LetsSuicide` contract. This can allow any caller to nuke the `SuicideContract` contract and send the funds to an arbitrary address. The `LetsSuicide` contract should have an access control mechanism to ensure that only the owner can call the `suicide` function.",access control,3.0,567.0,6.0,2.7096989154815674
22,access control," Answer:

NO.

The provided code for the Wallet contract does not have the same vulnerability as the original code. The refund() function in this contract transfers the balance of msg.sender, which is the same address that called the function, to itself. Therefore, there is no access control vulnerability in this case.

However, it is important to note that the Wallet contract still has other potential vulnerabilities, such as reentrancy attacks and arithmetic overflows/underflows, which should be checked and addressed.

The LetsSuicide and SuicideContract contracts are separate contracts that are not directly related to the Wallet contract. The LetsSuicide contract is a contract that calls the suicide() function of another contract, and the SuicideContract contract is a contract that creates and calls the LetsSuicide contract. These contracts do not have any obvious access control vulnerabilities based on the provided code. However, it is important to thoroughly test and audit any contract before deploying it to a production environment.",access control,2.0,626.0,6.0,2.4484245777130127
23,access control," Yes, the provided code is vulnerable to access control issues. The `LetsSuicide` contract calls the `suicideAnyone` function in the `SimpleSuicide` contract, which destroys the calling contract using `selfdestruct(msg.sender)`. This means that any contract with the ability to create a `LetsSuicide` contract can destroy any other contract. In this case, the `SuicideContract` contract is used to create a `LetsSuicide` contract, so it can destroy any other contract given its address. This is a form of access control vulnerability because it allows unauthorized destruction of contracts.",access control,4.0,557.0,6.0,2.3989274501800537
24,access control," Answer:

Yes, the smart contract code is vulnerable.

The vulnerability lies in the `SuicideContract` contract, specifically in the `NukeContract` function. This function allows any user to call the `suicide` function of the `Unprotected` contract, which should only be callable by the contract owner. This is an access control vulnerability, as any user can delete the contract and steal its funds. The `onlyowner` modifier is defined in the `Unprotected` contract but is not used in the `suicide` function, making it accessible to anyone.",access control,3.0,550.0,6.0,2.0403025150299072
25,access control," Yes, the provided smart contract code is vulnerable to access control issues. The vulnerability lies in the `SuicideContract` contract, specifically in the `NukeContract` function. The function calls the `LetsSuicide` contract with the `suicide` function, which destroys the `Russian` contract by sending all its funds to the `LetsSuicide` contract. This can lead to a loss of funds if the `Russian` contract is not intended to be self-destructed. Additionally, the `LetsSuicide` contract does not check the `msg.sender` or `tx.origin` before self-destructing, which can lead to an access control vulnerability.",access control,4.0,570.0,6.0,2.210101842880249
26,access control," Yes, the smart contract code is vulnerable due to access control issues. The vulnerability lies in the use of `delegatecall` in lines 31 and 38. This function type can execute arbitrary code from the calling contract, which can lead to a lack of access control and potential security breaches. In this case, the `delegatecall` function is being used without proper checks, allowing any caller to execute the `fibonacci` function without any restrictions. This can lead to unauthorized access and manipulation of the contract's state.",access control,3.0,539.0,6.0,1.7316522598266602
27,unchecked low level calls," Yes, the provided code is vulnerable due to the use of the low-level `call.value()` function in the `Command` function of the `Pie` contract without checking its return value. This can lead to fail-opens and other unwanted outcomes if the called contract throws an exception.

The `NukeContract` function in the `SuicideContract` contract is not vulnerable as it does not use any low-level functions that can bypass Solidity's error propagation mechanism. However, it is important to note that the `LetsSuicide` contract is designed to suicide the contract it is called with, which can lead to unintended consequences if not used carefully.",unchecked low level calls,4.0,566.0,6.0,2.5441009998321533
28,unchecked low level calls," Yes, the provided smart contract code is vulnerable. The vulnerability lies in the ""SuicideContract"" contract. When the ""NukeContract"" function is called, it creates a new instance of the ""LetsSuicide"" contract and sends it ether via the ""value"" function. However, there is no check for the return value of the ""send"" function in the ""LetsSuicide"" contract's constructor. If the ""send"" function fails, the contract creation and ether transfer will still go through, potentially leading to a loss of funds.

Here is the vulnerable line:
(new LetsSuicide).value(msg.value)(Russian);

It is recommended to include a check for the return value of the ""send"" function to ensure that the ether transfer was successful before proceeding with the contract creation.",unchecked low level calls,3.0,596.0,6.0,2.674915313720703
29,unchecked low level calls," Yes, the provided smart contract code is vulnerable due to the unchecked return value of the low-level `call` function used in the `Command` function of the `Freebie` contract. If the call to `adr.call.value(msg.value)(data)` fails, it will continue executing the code without handling the error, which could lead to unwanted outcomes.

In the provided code, the `LetsSuicide` and `SuicideContract` contracts do not contain any vulnerabilities based on the given code. However, it is essential to note that the `LetsSuicide` contract will immediately suicide to the given address in its constructor, which could lead to potential issues if not used carefully.",unchecked low level calls,4.0,573.0,6.0,2.473402976989746
30,unchecked low level calls," Yes, the smart contract code is vulnerable due to the same reason as the previous one. The vulnerability lies in the following lines:

- Line 110: `msg.sender.send(valuePaid);`
- Line 118: `msg.sender.send(excessPaid);`
- Line 132: `currentMonarch.etherAddress.send(compensation);`
- Line 174: `wizardAddress.send(amount);`

The `send` function can fail, and if it does, the contract will continue executing without reverting the previous operations. This can lead to fail-opens and other unwanted outcomes.",unchecked low level calls,3.0,554.0,6.0,2.1186981201171875
31,unchecked low level calls," Yes, the provided SuicideContract is also vulnerable. The vulnerability lies in the `NukeContract` function of the `SuicideContract` where it creates a new instance of the `LetsSuicide` contract and calls its `value` function with `msg.value` without checking its return value. If the `LetsSuicide` contract's constructor or the `suicide` function fail, it will not be caught and may result in the failure to suicide the Russian contract. This is similar to the vulnerability in the previous code where the return value of `call` is not checked.",unchecked low level calls,3.0,554.0,6.0,2.237222194671631
32,unchecked low level calls," Yes, the provided smart contract code is vulnerable to the same issue as the previous code. The vulnerability lies in the following lines:

1. Line 109: `winner.send(subpot);`
2. Line 141: `msg.sender.send(msg.value-value);`

The issue is that the contract does not check the return value of the `send()` function, which can result in fail-opens and other unwanted outcomes if the function fails. This is the same vulnerability as described in the 'unchecked-low-level-calls' category.",unchecked low level calls,3.0,543.0,6.0,1.8394880294799805
33,unchecked low level calls," Yes, the given code is vulnerable. The vulnerability lies in the `NukeContract` function of the `SuicideContract` contract. In this function, a new instance of the `LetsSuicide` contract is created and its constructor is called with `Russian` address as an argument. The constructor of the `LetsSuicide` contract calls the `suicide` function with the `LetsFuckingSuicide` address, which will destroy the `SuicideContract` contract and transfer all its funds to the `LetsFuckingSuicide` address. This can lead to loss of funds if the `LetsFuckingSuicide` address is not trusted. Additionally, the `callnotchecked` function in the `ReturnValue` contract is also vulnerable for the same reason as mentioned in the previous question.",unchecked low level calls,4.0,600.0,6.0,3.7726943492889404
34,unchecked low level calls," Yes, the provided code is vulnerable. The vulnerability lies in the `SuicideContract`'s `NukeContract` function. The `LetsSuicide` contract is designed to suicide (self-destruct) and send ether to the provided address. However, there is no check on the `Russian` address passed to the `NukeContract` function, making it possible to pass any address, including the `0x0` address (the null address). This could result in the loss of ether sent to the `NukeContract` function.

Additionally, the `transfer` function in the `AirDropContract` contract uses `call` without checking the return value, which can lead to fail-opens and other unwanted outcomes, as mentioned in the initial explanation.",unchecked low level calls,4.0,592.0,6.0,3.604463815689087
35,unchecked low level calls," NO, this contract is not vulnerable in the same way as the previous one. The low-level call is not used in a way that would lead to an unchecked send. However, there are still other potential vulnerabilities in this contract, such as the lack of checks on the 'data' parameter in the 'Command' function, which could lead to unintended behavior if 'data' contains a malicious code. Additionally, the 'NukeContract' function in the 'SuicideContract' could potentially be used maliciously if the 'Russian' address is not properly checked or authorized.",unchecked low level calls,2.0,551.0,6.0,2.968738079071045
36,unchecked low level calls," Yes, the provided smart contract code is vulnerable due to the same reason as mentioned before. The vulnerability lies in the following lines:

1. In the `Token` contract, line 11: `token.call(bytes4(sha3(""transfer(address,uint256)"")),to,amount);`
2. In the `TokenBank` contract, line 97: `_addr.call.value(_wei);`

The issue is that the `call` function can fail, and if it does, the code will continue to execute, potentially causing unintended consequences. It is essential to check the return value of the `call` function and handle any failures appropriately.",unchecked low level calls,3.0,566.0,6.0,2.0509941577911377
37,unchecked low level calls," Yes, the provided code is vulnerable. The vulnerability lies in the contract's use of the low-level `call` function, which can fail and should have its return value checked to ensure success. In this case, the contract is calling the ""register"" function of another contract (contract\_address) without checking the return value. If the call fails, the contract will continue to execute the next line of code, potentially causing unintended behavior or errors.

In addition, the code includes a contract called ""SuicideContract"" that appears to allow for the self-destruction of a contract by calling its NukeContract function with a specified address. This could potentially be used as an attack vector if not used carefully. It is important to ensure that only authorized parties have the ability to call this function and that proper checks are in place to prevent unintended consequences.",unchecked low level calls,4.0,608.0,6.0,1.9863460063934326
38,unchecked low level calls," Yes, the provided smart contract code is vulnerable due to the same issue as the previous code. The vulnerability lies in the following lines:

1. In the `Token` contract, line 11: `token.call(bytes4(sha3(""transfer(address,uint256)"")),to,amount);`
2. In the `TokenBank` contract, line 97: `_addr.call.value(_wei);`

The issue is that the `call` function can fail, and if it does, the code will continue to execute, potentially causing unintended consequences. It is essential to check the return value of the `call` function and handle any failures appropriately.",unchecked low level calls,3.0,567.0,6.0,2.8786070346832275
39,unchecked low level calls," Yes, the smart contract code is vulnerable due to the unchecked return value of low-level calls. Specifically, in the `fundPuppets()` function of the `Splitter` contract, the `call.value()` function is used to send ether to other contracts without checking its return value. This means that if the called contract throws an exception or fails to execute properly, the `Splitter` contract will not be aware of this and will continue executing, potentially leading to a fail-open situation. The same vulnerability is present in the constructor function of the `Puppet` contract, where `target[0].call.value(msg.value).gas(600000)()` is used without checking the return value.

The `SuicideContract` contract is not directly vulnerable, but it is a potential security risk since it allows deleting any contract without any checks or restrictions. This could lead to unintended consequences if used maliciously.",unchecked low level calls,4.0,617.0,6.0,3.3107869625091553
40,unchecked low level calls," Yes, the smart contract code is vulnerable. The vulnerability lies in the `SuicideContract` contract, specifically in the `NukeContract` function. The function calls the `LetsSuicide` contract's constructor using `new` keyword and passes `Russian` as an argument. This can allow an attacker to set any address as the new contract, including a contract they control. The `LetsSuicide` contract then sends all the ether in the `SuicideContract` to the address passed in, which can result in the ether being sent to an unintended or malicious contract. This is an example of an unchecked call, as the return value of the `LetsSuicide` constructor is not checked. This can lead to fail-opens and other unwanted outcomes.",unchecked low level calls,3.0,590.0,6.0,2.0659432411193848
41,unchecked low level calls," Yes, the provided code is vulnerable. The vulnerability lies in the `NukeContract` function of the `SuicideContract` contract. In line 62, it calls the `LetsSuicide` contract's constructor using `new` keyword and passes `Russian` address as an argument. This can potentially cause the `LetsSuicide` contract to be created with `Russian` as the owner, allowing the owner to execute low-level calls without proper checks.

The `LetsSuicide` contract's constructor calls the `suicide` function, which destroys the current contract and transfers all its funds to the given address. In this case, the `Russian` contract will receive the funds without proper checks, which can lead to fail-opens and other unwanted outcomes.

The root cause of the vulnerability is the unchecked low-level call in the `LetsSuicide` contract's constructor, which is being called in the `NukeContract` function.",unchecked low level calls,4.0,626.0,6.0,2.2301197052001953
42,unchecked low level calls," Yes, the provided code is vulnerable due to the use of the low-level `call.value` function without proper error checking. Specifically, in the `Command` function of the `WhaleGiveaway1` contract, the line `adr.call.value(msg.value)(data);` does not check the return value of the `call` function. This can lead to fail-opens and other unwanted outcomes if the call to `adr` fails.

The `LetsSuicide` and `SuicideContract` contracts do not contain any calls to low-level functions like `call`, `callcode`, `delegatecall`, or `send`, so they are not directly vulnerable to the same issue. However, they do contain a call to the `suicide` function, which should be used with caution as it permanently destroys the contract and transfers its ether balance to the specified address.",unchecked low level calls,4.0,611.0,6.0,2.002213716506958
43,unchecked low level calls," Answer:

Yes, the given smart contract code is vulnerable.

The vulnerability lies in the `SuicideContract` contract, specifically in the `NukeContract` function. The `LetsSuicide` contract is created within the `NukeContract` function and its constructor calls the `suicide` function, which destroys the `SuicideContract` contract and sends all its funds to the address provided as a parameter (`Russian` in this case). This can lead to an unintended destruction of the contract and loss of funds.

Additionally, the `send` function used in the `Lotto` contract can also fail, just like in the previous example. It is recommended to use the `transfer` function instead, which automatically checks for errors and reverses the transaction if an error occurs.",unchecked low level calls,2.0,594.0,6.0,3.0532479286193848
