case_id,vuln_type,audit_report,gt,eval_score,eval_input_token_num,eval_output_token_num,eval_inference_time
112,reentrancy," Yes, the given smart contract code is vulnerable to a reentrancy attack. The vulnerability lies in the `withdrawAll()` function of the `ReentrancyDAO` contract. The function uses `msg.sender.call.value(oCredit)()` to send Ether to the caller, which allows the caller to be any address, including another contract. If the caller is a malicious contract, it can call back into the `withdrawAll()` function before the initial execution is complete, allowing the attacker to drain the contract of its funds. This is the same vulnerability that exists in the initial example provided.

The `SuicideContract` and `LetsSuicide` contracts do not directly contribute to the reentrancy vulnerability, but they do demonstrate other potential vulnerabilities. The `SuicideContract` contract contains a `NukeContract()` function that allows an attacker to destroy any contract by calling the function with the contract's address as an argument. The `LetsSuicide` contract is designed to destroy itself upon creation, which can be dangerous if it is called with the address of a critical contract. These contracts highlight the importance of carefully managing contract interactions and ensuring that destructive operations are used responsibly.",reentrancy,4.0,671.0,6.0,2.6583077907562256
113,reentrancy," Yes, the given smart contract code is vulnerable to a reentrancy attack. The vulnerability exists in the `withdrawBalance` function of the `EtherBank` contract. The function uses `msg.sender.call.value(amountToWithdraw)()` to send ether to the caller, which allows the caller to be an external contract. This opens up the possibility for the caller to be a malicious contract that can call back into the `withdrawBalance` function before the balance of the sender has been set to 0. This can lead to an infinite loop and the draining of the contract's funds.

The `SuicideContract` and `LetsSuicide` contracts do not directly contribute to the reentrancy vulnerability, but they demonstrate another potential issue. The `SuicideContract` contract has a function `NukeContract` that allows it to call the `suicide` function of any contract, passing the `Russian` address as a parameter. This can be used to self-destruct any contract, which may not be desirable behavior. The `LetsSuicide` contract is then used in the `NukeContract` function to perform the self-destruct.",reentrancy,4.0,666.0,6.0,2.397322416305542
114,reentrancy," Yes, the first smart contract code is vulnerable to a reentrancy attack. The vulnerability lies in the `CashOut` function, specifically in the line `if(msg.sender.call.value(_am)())`. This line allows for a call to an external contract before the initial execution is complete, potentially allowing the state of the contract to change in the middle of its execution. This is exactly what happens in a reentrancy attack.

The second smart contract code does not contain the same vulnerability, as it does not include a function that calls an external contract before the initial execution is complete. However, it does contain a potential security risk in the `NukeContract` function of the `SuicideContract`. This function allows for any caller to send ether to the contract and then immediately destroy the contract, potentially making the ether sent to the contract inaccessible. This could be considered a security risk, as it allows for the inappropriate use of the contract.",reentrancy,4.0,625.0,6.0,2.0365383625030518
115,reentrancy," Yes, the first smart contract code is vulnerable to a reentrancy attack. The vulnerability lies in the `CashOut` function, specifically in the line `if(msg.sender.call.value(_am)())`. This line allows for a call to be made from the recipient of the funds (`msg.sender`) back to the contract before the state has been updated, allowing for the attacker to drain the contract of funds.

The second smart contract code is not vulnerable to a reentrancy attack, as it does not allow for calls to be made from the recipient of the funds back to the contract during the `NukeContract` function. However, it is important to note that the `LetsSuicide` contract is designed to suicide and transfer all ether sent to it to the specified address, which can be a security risk if used improperly.",reentrancy,4.0,603.0,6.0,1.671696424484253
116,reentrancy," Yes, the given smart contract code is vulnerable to a reentrancy attack. The vulnerability lies in the `Collect` function, specifically in this line: `if(msg.sender.call.value(_am)())`. This allows for a call to an external contract before the initial execution is complete, potentially allowing the contract state to change in the middle of its execution. This is the same line that was identified as the source of vulnerability in the first code snippet.",reentrancy,3.0,526.0,6.0,3.4949214458465576
117,reentrancy," Answer:

Yes, the provided contract is vulnerable to a reentrancy attack. The vulnerability lies in the `withdrawBalance()` function of the `Reentrancy_cross_function` contract. When a user calls this function, the contract uses the `call.value()` function to send Ether to the user's address. However, if the user's address is an external contract that contains malicious code, it can take advantage of the reentrancy vulnerability to repeatedly call the `withdrawBalance()` function before the initial execution is complete. This can allow the attacker to drain the contract of its Ether.

The `LetsSuicide` and `SuicideContract` contracts do not directly contribute to the reentrancy vulnerability in the `Reentrancy_cross_function` contract. However, they demonstrate a potential vulnerability in the way that contracts can be chained together. If the `SuicideContract` contract is called with the address of the `Reentrancy_cross_function` contract, it will trigger a suicide event that destroys the contract and sends its Ether to the `LetsSuicide` contract. If the `LetsSuicide` contract is an external contract controlled by an attacker, it could potentially be used to steal the Ether sent by the `SuicideContract`.

To mitigate the reentrancy vulnerability in the `Reentrancy",reentrancy,4.0,696.0,6.0,1.7417244911193848
118,reentrancy," Yes, the smart contract is vulnerable to a reentrancy attack. The vulnerability lies in the `withdrawBalance()` function of the `Reentrance` contract, specifically in the use of the low-level `call.value()` function, which allows the msg.sender to call an untrusted contract before the initial execution is complete. This can lead to the contract state changing in the middle of its execution, allowing for a reentrancy attack.

The `SuicideContract` and `LetsSuicide` contracts do not directly contribute to the vulnerability, but they demonstrate a potential way to exploit the reentrancy vulnerability by allowing the contract to ""suicide"" and transfer funds to an untrusted address.",reentrancy,4.0,575.0,6.0,2.3919589519500732
119,reentrancy," Answer:

Yes, the provided smart contract code is vulnerable to a reentrancy attack. The vulnerability lies in the `CashOut` function where it calls the `msg.sender.call.value(_am)()` which can allow an attacker to make external calls before the initial execution is complete, leading to a reentrancy attack. This is the same vulnerability found in the first contract. 

In addition, the contract is also vulnerable to a suicide attack where an attacker can nuke the contract by calling the `NukeContract` function with the malicious contract address. This can lead to the loss of funds or unintended behavior.",reentrancy,4.0,559.0,6.0,2.6076881885528564
120,reentrancy," Yes, the first smart contract code is vulnerable to reentrancy attacks. The vulnerability lies in the `CashOut` function, specifically in the line `if(msg.sender.call.value(_am)())`. This line allows for a call to an untrusted contract before the initial execution is complete, potentially allowing the contract state to change in the middle of its execution. This is exactly what happens in a reentrancy attack.

The second smart contract code does not contain the same vulnerability, as it does not use `call.value` or any other function that would allow for external calls before the initial execution is complete. However, it is important to note that the `SuicideContract` contract can be used to suicide the `LetsSuicide` contract, which could potentially be used in a malicious way. It is always important to carefully consider the potential implications of allowing external calls and the possibility of untrusted contracts interacting with your own contract.",reentrancy,4.0,623.0,6.0,3.0383095741271973
121,reentrancy," Yes, the provided PRIVATE\_ETH\_CELL contract is vulnerable to a reentrancy attack. The vulnerability lies in the `Collect` function, specifically at `msg.sender.call.value(_am)()`. This allows for the message sender to call an untrusted contract before the initial execution is complete, potentially changing the contract state in the middle of execution. This can lead to the contract being drained of funds, as seen in the example of the multimillion dollar heist in Ethereum's history.

The additional code provided contains two other contracts, LetsSuicide and SuicideContract, but they do not directly contribute to the vulnerability in the PRIVATE\_ETH\_CELL contract.",reentrancy,4.0,572.0,6.0,2.801215171813965
122,reentrancy," Yes, the provided Smart Contract code is vulnerable to Reentrancy Attack. The vulnerability lies in the `CashOut` function where it uses `msg.sender.call.value(_am)()` which allows external contract calls before the initial execution is complete, potentially changing the contract state in the middle of its execution. This can lead to a situation where the contract state is modified multiple times before the initial execution is complete, leading to potential security threats.

In the provided code, the `CashOut` function can be exploited using a malicious contract that calls the `CashOut` function recursively before the initial execution is complete, leading to a reentrancy attack.

Therefore, it is recommended to use the `transfer` function instead of `call.value()` or implement a mutex lock to prevent reentrancy attacks.",reentrancy,3.0,595.0,6.0,2.5188395977020264
123,reentrancy," Yes, the smart contract is vulnerable to a reentrancy attack. The vulnerability lies in the line `if(msg.sender.call.value(_am)())` within the `Collect` function. This line allows the caller to execute arbitrary code before the `Collect` function has completed execution, which can lead to a reentrancy attack.",reentrancy,3.0,502.0,6.0,2.6083059310913086
124,reentrancy," Yes, the first smart contract code is vulnerable to a reentrancy attack. The vulnerability lies in the `CashOut` function, specifically in the line `if(msg.sender.call.value(_am)())`. This line allows for a call to an external contract before the initial execution is complete, potentially allowing the state of the contract to change in the middle of its execution. This is exactly what happens in a reentrancy attack.

The second smart contract code does not contain the same vulnerability, as it does not use `call.value` or any other function that would allow for an external contract call before the initial execution is complete. However, it is important to note that the `SuicideContract` contract can be used to suicide another contract, which could potentially be used maliciously.",reentrancy,4.0,593.0,6.0,2.392228841781616
125,reentrancy," Yes, the smart contract code is vulnerable to a reentrancy attack. The vulnerability lies in the `Collect` function, specifically in the line `if(msg.sender.call.value(_am)())`. This line allows for a call to an untrusted contract before the initial execution is complete, potentially allowing the contract state to change in the middle of execution. This is exactly the condition that can lead to a reentrancy attack.",reentrancy,3.0,521.0,6.0,2.724426746368408
126,reentrancy," Answer:

Yes, the smart contract code is vulnerable to a reentrancy attack. The vulnerability lies in the `withdrawBalance` function of the `Reentrancy_insecure` contract. The function uses `msg.sender.call.value(amountToWithdraw)("""")` to send funds to the caller, which allows the caller to execute arbitrary code before the function completes execution. This can lead to a reentrancy attack where the caller calls the `withdrawBalance` function again before the first call has completed, allowing the caller to drain the contract of funds.

The `LetsSuicide` and `SuicideContract` contracts do not directly contribute to the vulnerability in the `withdrawBalance` function. However, they demonstrate a separate issue where the `LetsSuicide` contract is immediately self-destructing upon construction, which could potentially be used in a malicious way. It is generally not recommended to include self-destruct functionality in a contract that can be called by any address.",reentrancy,4.0,629.0,6.0,2.811089038848877
127,time manipulation," Yes, the provided code is vulnerable to timestamp manipulation. The `SuicideContract` contract contains a function `NukeContract` that allows for a specified contract to be suicide bombed and its funds transferred. However, the `TimedCrowdsale` contract, which is one of the potential targets for this attack, still relies on the `block.timestamp` value, which as explained before, can be manipulated by miners. Therefore, the contract's funds can be drained before the intended time by a miner who is also a malicious actor.

In addition, the naming convention used in the contract is not considered a best practice and can be potentially offensive to some users. It is recommended to use professional and neutral language when naming variables, functions, and contracts.",time manipulation,4.0,585.0,6.0,9.084887504577637
128,time manipulation," Yes, the given smart contract code is vulnerable to timestamp manipulation. The vulnerability lies in the `lottopollo` contract, specifically in the `randomGen()` function, which returns `block.timestamp`. This value can be manipulated by miners, leading to potential security issues. The `draw()` function of `lottopollo` contract calls `randomGen()`, which can result in a vulnerable payout in the `payOut()` function due to the potential manipulation of the timestamp.

Additionally, the `SuicideContract` contract contains a call to the `LetsSuicide` contract, which can potentially lead to the loss of funds if called with a malicious address. However, this vulnerability is not related to the timestamp manipulation issue in the `lottopollo` contract.",time manipulation,4.0,590.0,6.0,2.222886085510254
129,time manipulation," Yes, the provided smart contract code is vulnerable to a time manipulation attack. The vulnerability lies in the `Governmental` contract, specifically in the `resetInvestment` function. The function checks if a certain amount of time has passed since the last investment by comparing `block.timestamp` (current block timestamp) with `lastInvestmentTimestamp`. However, as the first review stated, the block timestamp can be manipulated by the miner, which can lead to a potential security issue. In this case, a miner could manipulate the timestamp to be less than `lastInvestmentTimestamp + ONE_MINUTE`, allowing the `resetInvestment` function to be called prematurely.

The `LetsSuicide` and `SuicideContract` contracts do not appear to be related to the vulnerability, as they do not interact with the `Governmental` contract.",time manipulation,3.0,599.0,6.0,2.2800636291503906
130,time manipulation," Answer:

NO.

The provided code for the Roulette contract is the same as before, and it does have a time manipulation vulnerability. However, the additional code for the LetsSuicide and SuicideContract contracts does not introduce any new vulnerabilities into the Roulette contract. The new contracts do not interact with or inherit from the Roulette contract, so the Roulette contract's vulnerability stands on its own.",time manipulation,3.0,510.0,6.0,3.3799192905426025
131,time manipulation," Yes, the smart contract code is vulnerable. The vulnerability lies in the line 18: `var random = uint(sha3(block.timestamp)) % 2;`

This contract is similar to the previous one. It uses the `block.timestamp` to generate a random number, which makes it vulnerable to manipulation by miners. The miner can manipulate the timestamp to control the outcome of the random number generation, which can lead to security issues.",time manipulation,3.0,522.0,6.0,3.1498053073883057
132,short addresses," Yes, the second smart contract code is also vulnerable due to the use of the `tx.origin` property in the `MyToken` contract. The `tx.origin` property returns the original address that started the transaction, which can be manipulated in a malicious way. It is recommended to use `msg.sender` instead, which returns the immediate caller of the contract. The `LetsSuicide` and `SuicideContract` contracts also have a potential security issue - they allow the contract to be self-destructed by any caller, which can lead to a loss of funds or unintended behavior.",short addresses,2.0,553.0,6.0,2.312591075897217
133,denial of service," Answer:

YES, the smart contract is vulnerable.

The vulnerability lies in the `SuicideContract`'s `NukeContract` function. This function allows any user to call it and nuke any contract by passing the contract's address as a parameter. This can result in a denial-of-service attack, as the contract will be destroyed and cannot be recovered. The `LetsSuicide` contract is unnecessary here, as the `selfdestruct` function can be used directly in the `SuicideContract` to achieve the same result. The `LetsSuicide` contract only increases the complexity and potential vulnerabilities of the system.

In addition, the `SuicideContract` contract does not check if the contract being nuked has any associated ether or tokens, which can be lost forever. This can lead to a loss of funds for the contract's users.

To fix this vulnerability, the `NukeContract` function should be restricted to only allow calls from authorized addresses, or the function should check if the contract being nuked has any associated ether or tokens and handle them appropriately before destroying the contract.",denial of service,4.0,657.0,6.0,3.1776883602142334
134,denial of service," Yes, the smart contract code is vulnerable to a denial of service attack. The vulnerability lies in the `insertNnumbers` function of the `DosNumber` contract. The function does not check if the `numbers` parameter is within the bounds of the `array`'s length, which can result in the contract running out of gas if `numbers` is set to a very large value. This can lead to a denial of service as the contract will become unresponsive and unable to process further transactions.

The `LetsSuicide` and `SuicideContract` contracts do not contain any obvious vulnerabilities related to denial of service attacks. However, they do contain a suicide function that can be used to destroy the contract, which can lead to a loss of funds or data. It is important to ensure that such functions are properly secured and only callable by authorized parties.",denial of service,4.0,609.0,6.0,3.3280186653137207
135,denial of service," Yes, the smart contract code is vulnerable to denial of service attacks. The vulnerability lies in lines 78-83 where the `SuicideContract` contract can be used to suicide the `Government` contract, and in lines 46 and 48 where the `creditorAddresses` and `creditorAmounts` arrays are reset to empty arrays, potentially losing all creditor information and amounts. This could be considered a denial of service attack as it would prevent any future creditors from being recorded and paid out.",denial of service,4.0,536.0,6.0,2.644794464111328
136,denial of service," Answer:

Yes, the smart contract is vulnerable to a denial-of-service attack. The vulnerability is present in the same line as the previous contract, which is:
require(refundAddresses[x].send(refunds[refundAddresses[x]]));

The'require' statement here will ensure that the transaction is successful only if the'send' function returns true, indicating that the specified amount of ether has been transferred successfully. If the transfer fails for any reason, the'require' statement will evaluate to false, and the entire transaction will be reverted. This means that if any one of the refundAddresses[x] fails to receive ether, none of the other refundAddresses will receive their ether either. This is a classic example of a denial-of-service attack, where an attacker can deny service to other legitimate users by causing a single failure in the system.",denial of service,3.0,603.0,6.0,2.656071186065674
137,denial of service," Yes, the provided smart contract code is vulnerable to a denial of service attack. The vulnerability lies in the `NukeContract` function of the `SuicideContract`. This function calls the `LetsSuicide` contract with the `suicide` function, which destroys the `SuicideContract` contract and transfers all its funds to the `Russian` address. This can lead to a denial of service as the contract will no longer be accessible and its funds will be transferred to another address. Additionally, the `ifillArray` function in the `DosOneFunc` contract is also vulnerable to a denial of service attack due to the same reason mentioned earlier. The function allows the contract to be flooded with addresses, potentially causing it to run out of gas or exhausting its storage limit.",denial of service,4.0,593.0,6.0,2.968336820602417
138,denial of service," Yes, the smart contract code is vulnerable to a denial of service attack. The vulnerability lies in the `DosAuction` contract, specifically in the `bid()` function. If `currentFrontrunner` is not `0`, the contract will send `currentBid` to `currentFrontrunner` using `currentFrontrunner.send(currentBid)`. If `currentFrontrunner` is a malicious contract, it could re-enter the `bid()` function before the `send()` operation is completed, causing an reentrancy attack and draining the contract of funds, leading to a denial of service.

The `LetsSuicide` and `SuicideContract` contracts do not appear to have any obvious vulnerabilities on their own, but they are designed to facilitate the deletion of a contract, which could be used maliciously in conjunction with the `DosAuction` contract.",denial of service,4.0,614.0,6.0,2.363478183746338
