case_id,vuln_type,audit_report,gt,eval_score,eval_input_token_num,eval_output_token_num,eval_inference_time
77,arithmetic," Yes, the given code is vulnerable due to the unchecked arithmetic operation in line 7 of the `IntegerOverflowMappingSym1` contract. The `map[k] -= v` operation does not check for underflow, meaning if `k` is a large number and `v` is a large positive number, the result could wrap around to a very large positive number, potentially leading to security vulnerabilities.

The `LetsSuicide` and `SuicideContract` contracts do not contain any arithmetic operations, so they are not directly vulnerable based on the provided code. However, they could still be vulnerable to other types of attacks, especially if the input addresses are not properly checked or if they interact with vulnerable contracts.",arithmetic,4.0,576.0,6.0,2.6306183338165283
78,arithmetic," Yes, the provided code is vulnerable to an integer overflow. The vulnerability lies in the line:

`count *= input;`

In the `run` function of the `IntegerOverflowMul` contract, there is no check for integer overflow when multiplying the `count` variable with the `input` parameter. This can lead to an integer overflow if the product of `count` and `input` exceeds the maximum value representable by a `uint` in Solidity, which can result in undetected, incorrect calculations and potential security issues.

However, the provided code does not include the `arithmetic.sol` vulnerability mentioned in the initial review. The `arithmetic.sol` vulnerability usually refers to a more complex scenario involving multiple contracts and the incorrect handling of underflows and overflows. In this case, the vulnerability is limited to the single contract `IntegerOverflowMul`.",arithmetic,3.0,607.0,6.0,2.287942886352539
79,arithmetic," Yes, the given smart contract code is vulnerable to arithmetic overflows and underflows. The vulnerability lies in the `add` function of the `Overflow_Add` contract, in which the `balance` variable can be incremented beyond its maximum value if a large enough `deposit` value is provided, causing an integer overflow. This can lead to security vulnerabilities and incorrect contract behavior. The `LetsSuicide` and `SuicideContract` contracts do not contain arithmetic operations, so they are not directly vulnerable to this type of issue. However, they can still be affected if they interact with the vulnerable `Overflow_Add` contract.",arithmetic,4.0,559.0,6.0,2.214258909225464
80,arithmetic," Yes, the provided code is vulnerable to an arithmetic underflow attack. The vulnerability lies in the `run` function of the `IntegerOverflowMinimal` contract, specifically in this line: `count -= input;`. If `input` is a large enough value, it will cause the `count` variable to underflow, wrapping around to a very large number. This can lead to security vulnerabilities and incorrect contract behavior.

The `LetsSuicide` and `SuicideContract` contracts do not contain any arithmetic operations, so they are not directly vulnerable to the same type of attack. However, they do contain a potential security issue: the `LetsSuicide` constructor calls the `suicide` function, which immediately destroys the contract. This can be dangerous if the contract holds valuable assets or performs important functions. It would be better to add a modifier or a separate function to allow the contract to be destroyed in a controlled manner.",arithmetic,4.0,620.0,6.0,4.395612716674805
81,arithmetic," The answer is YES, the provided code is vulnerable to an arithmetic overflow attack. The vulnerability exists in the `increaseLockTime` function of the `TimeLock` contract. The code `lockTime[msg.sender] += _secondsToIncrease;` does not check for integer overflow, which can occur if the sum of `lockTime[msg.sender]` and `_secondsToIncrease` exceeds the maximum value of `uint`. This can lead to the attacker being able to unlock the contract prematurely.

The `SuicideContract` and `LetsSuicide` contracts do not contain any arithmetic operations, so they are not vulnerable to the same type of attack. However, they introduce a new attack vector through the `suicide` function, which allows the contract to be destroyed by an untrusted third party. This is not directly related to the arithmetic overflow vulnerability, but it is still a serious issue that should be addressed.",arithmetic,4.0,617.0,6.0,1.9243104457855225
82,arithmetic," Answer:

Yes, the first contract (TokenSaleChallenge) is vulnerable due to potential integer overflows and underflows. The issues exist in the following lines:

1. In the `buy` function, line 23: `require(msg.value == numTokens * PRICE_PER_TOKEN);` - If `numTokens` is a large number, it might result in an overflow when calculating `numTokens * PRICE_PER_TOKEN`.

2. In the `buy` function, line 25: `balanceOf[msg.sender] += numTokens;` - If `numTokens` is a large number, it might result in an overflow when adding to `balanceOf[msg.sender]`.

3. In the `sell` function, line 33: `msg.sender.transfer(numTokens * PRICE_PER_TOKEN);` - Similar to point 1, if `numTokens` is a large number, it might result in an overflow when calculating `numTokens * PRICE_PER_TOKEN`.

The second contract (SuicideContract) is not directly vulnerable in the provided code. However, it utilizes another contract (LetsSuicide) which is designed to suicide the main contract, which can be considered a security risk.",arithmetic,4.0,672.0,6.0,2.7588248252868652
83,arithmetic," Answer:

Yes, the second smart contract code is also vulnerable. The vulnerability lies in the ""NukeContract"" function of the ""SuicideContract"" contract. The function creates a new instance of the ""LetsSuicide"" contract and directly calls its constructor with the ""Russian"" address as an argument, passing any value sent with the transaction. This is a potential security risk as it allows the ""LetsSuicide"" contract to have control over the funds sent with the transaction, without proper checks or restrictions. This could potentially lead to loss of funds or unintended behavior.",arithmetic,2.0,548.0,6.0,1.942124843597412
84,arithmetic," Answer:

NO.

The provided code includes three contracts: IntegerOverflowBenign1, LetsSuicide, and SuicideContract. The IntegerOverflowBenign1 contract contains the same vulnerable code as before, but the LetsSuicide and SuicideContract contracts do not have any functions that interact with the vulnerable contract or exhibit any other vulnerabilities based on the provided code. Therefore, there is no need to audit the LetsSuicide and SuicideContract contracts in this case.",arithmetic,2.0,524.0,6.0,2.046403408050537
85,arithmetic," The answer is yes, the second smart contract code is also vulnerable. The vulnerability lies in the `NukeContract` function of the `SuicideContract` contract. This function calls the `LetsSuicide` contract with `msg.value` without checking its value. If `msg.value` is larger than the remaining gas, an out-of-gas exception will be thrown, but the transaction will still be executed, allowing an attacker to drain the contract of funds. Additionally, the `LetsSuicide` contract is not necessary in this case and can be removed, simplifying the code and reducing the attack surface.

However, the given code does not contain the `arithmetic.sol` vulnerability mentioned in the prompt. The `arithmetic.sol` vulnerability typically refers to integer overflows and underflows, which are not present in the given code. The vulnerability in the second contract is related to the lack of input validation and the unnecessary use of the `LetsSuicide` contract.",arithmetic,2.0,629.0,6.0,3.1348838806152344
86,arithmetic," Answer:

Yes, the given smart contract code is vulnerable to integer overflows and underflows. The vulnerabilities exist in the same lines as the previous contract, specifically in the 'overflowaddtostate', 'overflowmultostate', 'underflowtostate' functions where the arithmetic operations are performed without checking for overflows and underflows.

In addition, the 'SuicideContract' contract has an additional vulnerability. The 'NukeContract' function calls the 'LetsSuicide' contract's constructor, which is a potential security risk. Constructors should only be called during contract creation, and calling them later can lead to unexpected behavior or vulnerabilities.",arithmetic,4.0,564.0,6.0,2.4731767177581787
87,arithmetic," Answer:

Yes, the first contract (Token) is vulnerable due to the lack of checks for arithmetic overflows and underflows. In the `transfer` function, the code `balances[msg.sender] -= _value;` is vulnerable to underflow if `_value` is larger than the current balance of `msg.sender`. This can lead to a security vulnerability where an attacker can manipulate the balance to a negative value, effectively creating new tokens out of thin air.

The second and third contracts (LetsSuicide and SuicideContract) do not contain any arithmetic operations, so they are not vulnerable to the same type of attack. However, they contain a call to the `suicide` function, which can be used to self-destruct the contract and send its ether balance to a specified address. This can be a security risk if the contract contains ether and the recipient address is not properly checked or controlled by a trusted party.",arithmetic,4.0,618.0,6.0,2.412205457687378
88,arithmetic," Answer:

Yes, the first contract (IntegerOverflowAdd) is vulnerable to integer overflow. The vulnerability lies in the line `count += input;` in the `run` function. There is no check to prevent an input that could cause an overflow, which can lead to unpredictable contract behavior and security issues.

The other contracts (LetsSuicide and SuicideContract) do not directly interact with the IntegerOverflowAdd contract in the provided code, so they are not vulnerable based on the given code. However, they do introduce a potential security risk by allowing the contract to self-destruct, which could be abused if not used carefully.",arithmetic,4.0,559.0,6.0,2.1230881214141846
89,arithmetic," Answer:

NO.

The provided code for the `Overflow` contract contains the same vulnerability as the initial example, but the additional contracts do not directly introduce any new vulnerabilities into the `Overflow` contract. However, the `SuicideContract` and `LetsSuicide` contracts allow for a user to suicide the contract and send ether to a specified address, which could be a potential security risk depending on the use case.",arithmetic,2.0,517.0,6.0,2.3529348373413086
90,arithmetic," NO.

The provided code for the LetsSuicide and SuicideContract contracts do not have any arithmetic operations that could lead to an integer overflow or underflow vulnerability. The LetsSuicide contract is a simple contract that calls the suicide function of another contract with the given address. The SuicideContract contract is a contract that calls the NukeContract function, which in turn creates a new instance of the LetsSuicide contract and calls its value function with the msg.value and Russian arguments.

Therefore, the code for the LetsSuicide and SuicideContract contracts is not vulnerable to the arithmetic.sol vulnerability.",arithmetic,1.0,550.0,6.0,2.7939350605010986
91,bad randomness," Answer:

YES, the smart contract code is vulnerable due to the same reason as the first contract. The randomness in the 'PredictTheBlockHashChallenge' contract is generated using the block number, which can be predicted and manipulated by miners. This makes it an unreliable source of randomness.

The 'LetsSuicide' and 'SuicideContract' contracts do not seem to have any vulnerabilities in themselves, but they are used to suicide or nuke other contracts, which can be misused if the contracts that are being targeted have any vulnerabilities.",bad randomness,4.0,542.0,6.0,2.359266757965088
92,bad randomness," Yes, the smart contract code is vulnerable due to the following reasons:

1. The `blockNumber` variable is set to `block.number` in line 13, which is the current block number. This value is predictable and can lead to a vulnerability in the randomness of the contract.

2. In line 99, 101, and 158, `block.coinbase`, `msg.sender`, and `block.number` are used to generate the random number. `block.coinbase` is the address of the miner who mined the block and is not truly random. `msg.sender` is predictable as it is the address of the user who initiated the contract call. `block.number` is the current block number, which is also predictable.

Therefore, the randomness in the contract is not truly random and can be manipulated by an attacker. This vulnerability can lead to security issues and should be addressed.",bad randomness,3.0,615.0,6.0,3.1103413105010986
93,bad randomness," Yes, the provided smart contract code is vulnerable due to the usage of block.blockhash which is limited to the 256 most recent blocks. If the contract's init function is called in block 256 or later, block.blockhash(lastBlockNumber) will always return 0, making the random number generation predictable and exploitable.

In the given code, the 'init' function calls 'join' function which uses the 'rand' function to generate random numbers based on the block hash. If the contract's initialization process is delayed and the 'init' function is called in block 256 or later, the random number generation will become predictable and exploitable.

To fix this vulnerability, consider using a different source of entropy that is not limited to the 256 most recent blocks, or implement a different approach to random number generation that does not rely on the blockchain's blockhash.",bad randomness,3.0,610.0,6.0,2.6128838062286377
94,bad randomness," Yes, the smart contract code is vulnerable due to the same reason as the first one. The randomness is generated using `(block.number % 2) == 0`, which is predictable and can be manipulated. This vulnerability exists in both the `makeBet` function of the `Lottery` contract and the constructor of the `LetsSuicide` contract.",bad randomness,4.0,505.0,6.0,3.425992012023926
95,bad randomness," Answer:

YES, the smart contract code is vulnerable.

The vulnerability lies in the `GuessTheRandomNumberChallenge` contract, which is similar to the previous contract provided. The random number generation in the `GuessTheRandomNumberChallenge` contract is predictable and can be manipulated by a miner, making it unreliable for any secure purpose.

In addition, the `SuicideContract` contract contains a reentrancy vulnerability. The `NukeContract` function calls the `LetsSuicide` contract's constructor, which can cause a change in the contract's state before the external call is executed. This can lead to a reentrancy attack, where an attacker can repeatedly call the `NukeContract` function and drain the contract of funds.",bad randomness,4.0,582.0,6.0,2.9608538150787354
96,bad randomness," Yes, the smart contract code is vulnerable. The vulnerability lies in the line:
`uint256 private salt = block.timestamp;`

The `block.timestamp` is a value that can be manipulated by the miner of the block, within certain bounds. Therefore, it should not be used as a source of randomness in a secure smart contract. In this case, the `salt` variable, which is used to generate randomness, is entirely dependent on `block.timestamp`, making it predictable and exploitable.",bad randomness,3.0,533.0,6.0,2.3884148597717285
97,reentrancy," Yes, the smart contract is vulnerable to a reentrancy attack. The vulnerability lies in the line `if(msg.sender.call.value(_am)())` within the `Collect` function. This line allows the caller to execute arbitrary code before the `Collect` function has completed execution, which can lead to a reentrancy attack.",reentrancy,3.0,502.0,6.0,2.399038791656494
98,reentrancy," Answer:

Yes, the first smart contract code is vulnerable to a reentrancy attack. The vulnerability lies in the `withdrawFunds` function at line 27 where it uses `msg.sender.call.value(_weiToWithdraw)()`. This line allows the caller to execute arbitrary code before the `withdrawFunds` function has finished executing, which can lead to a reentrancy attack.

The second smart contract code is not directly vulnerable to a reentrancy attack in the `NukeContract` function. However, it is vulnerable to a suicide attack, where the `SuicideContract` can be used to kill any other contract. This is not directly related to the reentrancy attack, but it is still a vulnerability that should be addressed.",reentrancy,4.0,585.0,6.0,4.271039724349976
99,reentrancy," Yes, the provided code is vulnerable to a reentrancy attack. The vulnerability lies in the `Collect` function where it calls `msg.sender.call.value(_am)()`. This allows for the message sender (i.e., the calling contract) to call back into the `Collect` function before the initial execution is complete, leading to a reentrancy attack.

To mitigate this vulnerability, you can follow the Checks-Effects-Interactions pattern, where you perform checks for user input first, apply the effects of the function next, and interact with other contracts last. In this case, you should first update the balance of the sender and then call the sender's contract. Additionally, you can use the `transfer` function, which has built-in checks for reentrancy.

Here's an example of how you can modify the `Collect` function to avoid the reentrancy attack:

```solidity
function Collect(uint _am)
    public
    payable
{
    if(balances[msg.sender]>=MinSum && balances[msg.sender]>=_am)
    {
        balances[msg.sender]-=_am;
        (bool success, ) = msg.sender.call{value: _am}("""");
        require(success, ""Transfer failed."");
        Log.AddMessage(msg.sender,_",reentrancy,3.0,690.0,6.0,3.257681369781494
100,reentrancy," Yes, the smart contract code is vulnerable to a reentrancy attack. The vulnerability lies in the `withdraw` function of the `Reentrance` contract, specifically in the following lines:

```solidity
if(msg.sender.call.value(_amount)()) {
  _amount;
}
```

Here, the contract is calling an external contract (`msg.sender`) and sending it `_amount` of ether without checking its integrity. This allows for a reentrancy attack, where the external contract can call back into the `withdraw` function before the balance of the sender has been updated, allowing the attacker to drain the contract of its funds.

The `LetsSuicide` and `SuicideContract` contracts do not directly contribute to the vulnerability, but they demonstrate a potential attack vector where an attacker can force the contract to suicide and transfer its ether to a different contract.",reentrancy,4.0,610.0,6.0,2.6513452529907227
101,reentrancy," Yes, the provided SimpleDAO contract is vulnerable to a reentrancy attack. The vulnerability lies in the `withdraw` function at line 12:

```solidity
bool res = msg.sender.call.value(amount)();
```

By using `msg.sender.call.value(amount)()`, the contract allows the recipient to be any arbitrary address, which can be an external contract. If this external contract is malicious, it can call back into the `withdraw` function, creating a reentrancy attack.

In the provided `SuicideContract`, it does not directly interact with the `SimpleDAO` contract, so it does not introduce additional vulnerabilities to the `SimpleDAO` contract. However, the `SuicideContract` itself is vulnerable to a suicide attack, as it allows an external address to nuke the contract.",reentrancy,4.0,599.0,6.0,2.728041172027588
102,reentrancy," Yes, the smart contract is vulnerable to a reentrancy attack. The vulnerability lies in the line `if(msg.sender.call.value(_am)())` within the `Collect` function. This line allows for a call to an untrusted contract before the initial execution is complete, potentially changing the contract state in the middle of its execution. This is exactly the condition that allows for a reentrancy attack.",reentrancy,3.0,517.0,6.0,2.1021316051483154
103,reentrancy," Yes, the smart contract code is vulnerable to a reentrancy attack. The vulnerability lies in the `Collect` function, specifically at `msg.sender.call.value(_am)()`. This allows for a call to an external contract before the initial execution is complete, allowing the contract state to change in the middle of its execution.",reentrancy,3.0,501.0,6.0,2.3411569595336914
104,reentrancy," Yes, the given smart contract code is vulnerable to a reentrancy attack. The vulnerability lies in the `getFirstWithdrawalBonus` function of the `Reentrancy_bonus` contract. After calling the `withdrawReward` function, the state of the contract is changed before the initial execution is complete, allowing the caller to call the `getFirstWithdrawalBonus` function again recursively. This can lead to an infinite loop, draining the contract of funds.

The `LetsSuicide` and `SuicideContract` contracts do not have a direct impact on the vulnerability, but they can be used to perform malicious actions, such as self-destructing the contract or transferring funds to an unintended recipient.",reentrancy,4.0,575.0,6.0,2.2724475860595703
105,reentrancy," Yes, the provided smart contract code is vulnerable to a reentrancy attack. The vulnerability lies in the `Collect` function where it calls the `call.value(_am)()` function of the `msg.sender` without checking its integrity. This allows a malicious contract to call the `Collect` function recursively before the balance of the `msg.sender` is updated, leading to a reentrancy attack.

In the provided code, the `SuicideContract` contract is not directly related to the reentrancy vulnerability. However, it contains a potential security issue where it calls the `LetsSuicide` contract constructor with `payable` and then calls `suicide` function. This can potentially allow an attacker to send ether to the `LetsSuicide` contract during its construction, which can be a security risk.",reentrancy,4.0,600.0,6.0,2.103543758392334
106,reentrancy," Yes, the smart contract code is vulnerable to a reentrancy attack. The vulnerability lies in the line 55 of the `ACCURAL_DEPOSIT` contract:

`if(msg.sender.call.value(_am)())`

By using the low-level `.call` function, it is possible to perform a reentrancy attack as it allows external contract calls to make new calls to the calling contract before the initial execution is complete. This can lead to the state of the contract being changed in the middle of its execution, allowing for potential exploits.",reentrancy,3.0,544.0,6.0,1.7262449264526367
107,reentrancy," Yes, the smart contract is vulnerable to a reentrancy attack. The vulnerability lies in the line `if(msg.sender.call.value(_am)())` in the `Collect` function. This line allows the caller to execute arbitrary code before the `Collect` function has completed execution, which can lead to a reentrancy attack.",reentrancy,3.0,502.0,6.0,4.1106343269348145
108,reentrancy," NO, the provided code does not have the same reentrancy vulnerability in the `WithdrawToHolder` function. The potential vulnerability in the `Token` contract's `WithdrawToken` function is not relevant to the `WithdrawToHolder` function in the `TokenBank` contract.

However, I would like to point out that the `TokenBank` contract has a potential reentrancy vulnerability in the `WitdrawTokenToHolder` function. The function calls the `WithdrawToken` function from the `Token` contract, which could potentially allow an attacker to manipulate the contract state in the middle of its execution. To fix this, you can follow the common reentrancy prevention pattern by using a mutex or a state variable to track the state of the function execution.",reentrancy,4.0,591.0,6.0,2.9304256439208984
109,reentrancy," The answer is YES, the smart contract code is vulnerable. The vulnerability lies in the `ModifierEntrancy` contract, in the `airDrop()` function. The function can be called repeatedly before the state changes are finalized due to the lack of a reentrancy guard pattern. This allows an attacker to manipulate the state and repeatedly call the function, resulting in unintended token balance increases.

In the `attack` contract, the `supportsToken()` function calls `ModifierEntrancy(msg.sender).airDrop()` without checking if the call has been made before, allowing the reentrancy attack to occur.",reentrancy,3.0,555.0,6.0,2.8046233654022217
110,reentrancy," Yes, the smart contract code is vulnerable to a reentrancy attack. The vulnerability lies in the `CashOut` function, specifically in the line `if(msg.sender.call.value(_am)())`. This line allows for a call to an external contract before the initial execution is complete, potentially allowing the external contract to change the contract state in the middle of its execution. This is a classic example of a reentrancy attack.",reentrancy,3.0,522.0,6.0,4.161967754364014
111,reentrancy," Yes, the provided PERSONAL\_BANK contract is vulnerable to a reentrancy attack. The vulnerability lies in the `Collect` function, specifically at the line `if(msg.sender.call.value(_am)())`. This line allows for a call to an untrusted external contract before the initial execution is complete, which is a condition for a reentrancy attack. The `call.value` function does not have any protection against such attacks, making the contract susceptible to unauthorized access and manipulation.",reentrancy,3.0,533.0,6.0,2.561091423034668
