case_id,vuln_type,audit_report,gt,eval_score,eval_input_token_num,eval_output_token_num,eval_inference_time
76,front running," NO, the provided code is not vulnerable to the front-running attack mentioned in the review. The reason is that the smart contract does not contain any functionality that reveals valuable information which can be exploited by miners through front-running. The contract is simply a game where users submit a number and the contract determines a winner based on the sum of the submitted numbers. However, the contract does contain other vulnerabilities, such as the use of the `.send()` function, which can throw an exception and stop the execution of the `andTheWinnerIs()` function. It is recommended to use the `transfer()` function instead, which handles exceptions internally. Additionally, the `delete players;` statement in the `andTheWinnerIs()` function is not necessary and can be removed.",front running,2.0,586.0,6.0,3.7641794681549072
77,arithmetic," Yes, the second smart contract code is also vulnerable due to the same reason as the first one. In the `CustomToken` contract, the `totalSupply` variable is assigned a very large value (line 16) without checking for integer overflow. This can lead to an integer overflow if the value is too large to be represented by a `uint256` type, leading to a security vulnerability. The `init` function in the `IntegerOverflowMappingSym1` contract also has the same issue in line 5, where it decrements a value without checking for underflow.",arithmetic,4.0,551.0,6.0,2.1102652549743652
78,arithmetic," Yes, the second smart contract code is also vulnerable. The vulnerability exists in the CustomToken contract, specifically in the constructor function. The total supply is being set to a very large number (9 digits) which can cause an integer overflow if it is not checked properly. This could potentially lead to security issues or unintended behavior. The BaseToken contract does not seem to have any obvious vulnerabilities based on the provided code.",arithmetic,2.0,516.0,6.0,3.1458740234375
79,arithmetic," Yes, the second smart contract code is also vulnerable. The vulnerability exists in the CustomToken contract, in the constructor function. The total supply is being set to a very large number (line 15), which can cause an integer overflow if the `balanceOf` mapping is updated with this value (line 17). This can lead to the balance of the recipient address being set to a value that is less than the total supply, thereby causing a discrepancy in the total supply and the sum of all balances.

To fix this issue, the total supply value should be set to a number that is within the maximum limit of the `uint256` data type, and the `balanceOf` mapping should be updated accordingly. Additionally, it is recommended to use the `SafeMath` library to prevent arithmetic overflows and underflows in the contract.",arithmetic,4.0,602.0,6.0,3.8508286476135254
80,arithmetic," Yes, the second smart contract code is also vulnerable. The vulnerability exists in the CustomToken contract's constructor. The total supply of the token is set to a very large number (1 quintillion) and assigned to the balance of address 0xbabaf2036d6a6623328e0d3cd41fc5eb30cea25f. If the input parameter 'input' in the run function of the IntegerOverflowMinimal contract is greater than 1, it will cause an arithmetic underflow, leading to a security vulnerability. This is because the 'count' variable will become a very large number, potentially leading to integer overflows in other parts of the contract or causing other unintended consequences.

In summary, the vulnerability exists due to the potential for integer overflows caused by the arithmetic underflow in the IntegerOverflowMinimal contract's run function, which is used in the CustomToken contract's constructor.",arithmetic,4.0,618.0,6.0,2.1273810863494873
81,arithmetic," Yes, the smart contract code is vulnerable to an arithmetic overflow. The vulnerability is in the `increaseLockTime` function of the `TimeLock` contract. The code `lockTime[msg.sender] += _secondsToIncrease;` does not check for an overflow, so if `_secondsToIncrease` is large enough, it will result in an overflow, allowing the lock time to be set to a value that is lower than the current time. This could allow a user to withdraw funds before they are supposed to.

The `CustomToken` contract does not appear to be directly vulnerable in the provided code, but it is an example of how not checking for overflows can lead to vulnerabilities. In this case, the `totalSupply` variable is set to a very large number, which could cause issues if it is used in arithmetic operations without checking for overflows.",arithmetic,4.0,607.0,6.0,2.833528518676758
82,arithmetic," Answer:

Yes, the smart contract code is vulnerable due to the same reason as mentioned before. The integer overflow vulnerability exists in the following lines:

1. In the `buy` function, the `require` statement does not check for integer overflow:
```csharp
require(msg.value == numTokens * PRICE_PER_TOKEN);
```

2. In the `buy` function, the `balanceOf` mapping does not check for integer overflow:
```csharp
balanceOf[msg.sender] += numTokens;
```

3. In the `sell` function, the `transfer` does not check for integer overflow:
```csharp
msg.sender.transfer(numTokens * PRICE_PER_TOKEN);
```

These lines can cause integer overflows, leading to security vulnerabilities.",arithmetic,3.0,586.0,6.0,3.9228408336639404
83,arithmetic," Yes, the second smart contract code is also vulnerable. The vulnerability exists in the CustomToken contract, in the constructor function. The total supply of the token is set to a very large number, which can cause an integer overflow if it is added to or subtracted from. In this case, it is assigned directly to the `totalSupply` variable, but if there were any operations involving `totalSupply` that were not properly checked for overflows, it could lead to a vulnerability.

Additionally, the `balanceOf` mapping is being set directly in the constructor, without checking for overflows. If the balance for an address is set to a value that is larger than the `totalSupply`, it could lead to a vulnerability.

It is important to note that the `IntegerOverflowMultiTxMultiFuncFeasible` contract is the same as in the first example, and it is also vulnerable for the same reason.",arithmetic,4.0,617.0,6.0,2.379307985305786
84,arithmetic," Yes, the second smart contract code is also vulnerable. The vulnerability exists in the CustomToken contract's constructor. The total supply of the token is set to a very large number (800000000000000000000000000) which could result in an integer overflow if not handled correctly in the contract's arithmetic operations.

Furthermore, the balanceOf mapping is being set to the totalSupply for the address 0xbabaf2036d6a6623328e0d3cd41fc5eb30cea25f. If this address is malicious, they could potentially exploit this large balance.

Additionally, the contract does not include any checks to prevent integer overflows or underflows in its arithmetic operations, which could lead to security vulnerabilities.",arithmetic,4.0,583.0,6.0,2.720172166824341
85,arithmetic," Yes, the second smart contract code is also vulnerable due to the lack of overflow and underflow protection in the same line as the first contract: `count -= input;`. The `count` variable could overflow if a large enough `input` value is provided, leading to potential security issues.

Additionally, the `BaseToken` and `CustomToken` contracts do not have any access control vulnerabilities, but they do not implement checks for reentrancy attacks, arithmetic overflows and underflows, unchecked return values, randomness, gas limit and loops, or timestamp dependence. These should be considered when creating a more robust and secure smart contract.",arithmetic,4.0,561.0,6.0,2.868608236312866
86,arithmetic," Yes, the smart contract code is vulnerable. The vulnerability lies in the `overflowaddtostate`, `overflowmultostate`, and `underflowtostate` functions in the `IntegerOverflowSingleTransaction` contract. The `count` variable can overflow or underflow, leading to security issues. The `overflowlocalonly`, `overflowmulocalonly`, and `underflowlocalonly` functions are not affecting the contract's state and are safe in this context, but the same vulnerability exists in the functions that modify the `count` variable.

The `CustomToken` and `BaseToken` contracts are not vulnerable in the provided code, as they do not use the `IntegerOverflowSingleTransaction` contract or manipulate integers in a way that would cause overflows or underflows. However, it is essential to ensure that any arithmetic operations in these contracts are also checked for overflows and underflows.",arithmetic,4.0,616.0,6.0,2.287365674972534
87,arithmetic," Yes, the first contract is vulnerable to integer overflows and underflows. The vulnerability in line 20 is a subtle one. If `balances[msg.sender]` is currently `0` and `_value` is set to `1`, the `require` statement will pass, but the subsequent subtraction will result in a negative number, which is not allowed in Solidity. This can lead to unintended behavior or security vulnerabilities.

The second contract, however, is not vulnerable in the same way. While it does initialize the `totalSupply` variable to a very large number, the `balanceOf` mapping is initialized separately for each address, so there is no risk of an overflow or underflow due to subtraction. However, it is still possible for the contract to be vulnerable to other types of attacks, such as reentrancy attacks or access control vulnerabilities.",arithmetic,4.0,604.0,6.0,3.3187685012817383
88,arithmetic," Yes, the second smart contract code is also vulnerable. The vulnerability exists in the CustomToken contract, specifically in the constructor function. The total supply is set to a very large number (line 15), and then the balance of the deployer address is set to the total supply (line 16). However, there is no check for overflow in this operation. If the deployer address is a contract that has a fallback function that calls a function in the CustomToken contract, an overflow can occur, leading to a security vulnerability.

Here is an example of how an overflow can occur:

1. The deployer deploys the CustomToken contract with address 0x11111111111111111111111111111111.
2. The total supply is set to a very large number, let's say 2^256 - 1.
3. The balance of the deployer address is set to the total supply.
4. The deployer contract's fallback function is called, which calls a function in the CustomToken contract.
5. The function in the CustomToken contract causes an integer overflow, leading to a security vulnerability.

To fix this vulnerability, the CustomToken contract should check for overflow when setting the balance of the deployer address. This can be done using",arithmetic,3.0,689.0,6.0,2.617058277130127
89,arithmetic," Yes, the second smart contract code is also vulnerable. The vulnerability exists in the CustomToken contract, in the constructor function. The total supply is set to a very large number (line 18), and then the balance of the deploying address is set to the total supply (line 19). If the deploying address has a balance greater than the maximum value of a uint256 (2^256-1), it would result in an overflow.

The vulnerability lies in line 19: balanceOf[0xbabaf2036d6a6623328e0d3cd41fc5eb30cea25f] = totalSupply; // possible overflow if totalSupply is greater than the maximum value of a uint256",arithmetic,3.0,580.0,6.0,2.8648712635040283
90,arithmetic," Yes, the second smart contract code is also vulnerable to integer overflows. The vulnerability exists in the CustomToken contract in the line:

balanceOf[0xbabaf2036d6a6623328e0d3cd41fc5eb30cea25f] = totalSupply;

The 'totalSupply' variable is a very large number, and if the 'uint256' type uses 256 bits, then it is possible to have an integer overflow when assigning this value to 'balanceOf', which is also a 'uint256' type. This could lead to unintended behavior or security vulnerabilities.",arithmetic,3.0,556.0,6.0,5.501321077346802
91,bad randomness," Yes, the smart contract code is vulnerable due to the same reason as mentioned before. The randomness in the `settle` function is still generated using `blockhash(guesses[msg.sender].block)`, which is predictable and can be manipulated by miners. Therefore, this contract is also not secure against attacks exploiting this predictability.",bad randomness,3.0,501.0,6.0,2.5878524780273438
92,bad randomness," Yes, the smart contract code is vulnerable due to the following reasons:

1. The `blockNumber` variable is used to generate `seed1` and `seed2` in line 99 and 101 respectively. An attacker can manipulate the block number by creating a block at a specific number.
2. The `block.difficulty` value used as `seed3` in line 103 is influenced by the miner and can be manipulated to an extent.

These vulnerabilities can lead to predictable randomness, allowing an attacker to manipulate the contract's outcome.",bad randomness,3.0,544.0,6.0,5.340185165405273
93,bad randomness," Yes, the smart contract code is vulnerable due to the use of block.blockhash which is limited to the 256 most recent blocks. If the contract's creation block number is more than 256 blocks ago, then block.blockhash(block.number - 1) will always return 0 and the random number generation will not work as intended. This can lead to predictable and manipulable randomness.

In the provided code, the 'rand' function uses block.blockhash(block.number - 1) to generate randomness, making it vulnerable if the contract has been deployed for more than 256 blocks.",bad randomness,3.0,552.0,6.0,2.758284568786621
94,bad randomness," Yes, the smart contract code is vulnerable. The vulnerability lies in the line:

`bool won = (block.number % 2) == 0;`

The randomness of the `won` variable is generated by checking the remainder of the block number divided by two, which will only result in two possible outcomes: 0 or 1. This is not true randomness and can be easily manipulated or predicted. Therefore, the lottery is not fair and can be exploited.

The second part of the code, the `CustomToken` contract, is not directly related to the vulnerability in the `Lottery` contract. However, it is also vulnerable due to the predictable initialization of the `totalSupply` variable and the direct assignment of tokens to the address `0xbabaf2036d6a6623328e0d3cd41fc5eb30cea25f`. This can lead to a lack of fairness and potential exploitation.",bad randomness,4.0,622.0,6.0,3.0552453994750977
95,bad randomness," Yes, the smart contract code is vulnerable. The vulnerability lies in the line:

`answer = uint8(keccak256(block.blockhash(block.number - 1), now));`

The use of `block.blockhash(block.number - 1)` as a source of randomness is vulnerable because it is predictable. A malicious user can potentially manipulate the state of the contract by predicting the blockhash.

Additionally, the contract does not check the input of the `guess` function for correctness, which can lead to vulnerabilities. The input should be checked to ensure it is within the valid range before performing any operations on it.

Furthermore, the contract uses `now` as a source of randomness, which is also predictable and can be manipulated by miners. It is recommended to use a more secure source of randomness, such as a decentralized randomness beacon, to ensure the security and reliability of the contract.",bad randomness,4.0,611.0,6.0,3.1717629432678223
96,bad randomness," Yes, the smart contract code is vulnerable. The vulnerability lies in the following lines:

- `uint256 private salt = block.timestamp;` in the `RandomNumberGenerator` contract,
- `uint256 x = salt * 100 / max;` in the `random` function,
- `uint256 y = salt * block.number / (salt % 5);` in the `random` function,
- `uint256 seed = block.number / 3 + (salt % 300) + y;` in the `random` function,
- `uint256 h = uint256(blockhash(seed));` in the `random` function.

The reason for this vulnerability is that the `salt` variable is generated using `block.timestamp`, which is a value that can be manipulated by miners in certain situations. This can lead to predictable and manipulable values in the `random` function, making it unsuitable for generating random numbers in a secure way.",bad randomness,3.0,627.0,6.0,7.175233602523804
97,reentrancy," Yes, the smart contract is vulnerable to a reentrancy attack. The vulnerability lies in the `Collect` function where it calls the `call.value(_am)()` function. This allows for a call to an external contract before the initial execution is complete, which is a reentrancy attack.",reentrancy,3.0,495.0,6.0,2.336092233657837
98,reentrancy," Answer:

Yes, the first smart contract code is vulnerable to a reentrancy attack. The vulnerability lies in the `withdrawFunds` function at line 27 where it calls `msg.sender.call.value(_weiToWithdraw)()`. This allows for a malicious contract to recursively call the `withdrawFunds` function before the balance of the sender has been updated, draining the contract of its funds.

The second smart contract code is not provided for review.",reentrancy,3.0,525.0,6.0,3.8154561519622803
99,reentrancy," Yes, the provided code is vulnerable to a reentrancy attack. The vulnerability lies in the `Collect` function where it calls `msg.sender.call.value(_am)()`. This allows for the recipient of the funds to call back into the `Collect` function before the balance of the sender has been updated, allowing for the recipient to repeatedly drain the contract of funds. This is the same vulnerability present in the original code provided.",reentrancy,3.0,522.0,6.0,3.980419874191284
100,reentrancy," Yes, the second smart contract code is also vulnerable to a reentrancy attack. The vulnerable function is the same `withdraw()` function in the `Reentrance` contract, which is used in the `CustomToken` contract without any modifications. This function allows for the calling contract to change its state before the initial execution is complete, which is the definition of a reentrancy attack. The specific line of code that allows this vulnerability is `msg.sender.call.value(_amount)()`, which allows the caller to execute arbitrary code before the `withdraw()` function completes.",reentrancy,3.0,550.0,6.0,2.8755850791931152
101,reentrancy," Answer:

Yes, the first smart contract code is vulnerable to a reentrancy attack. The 'withdraw' function uses the low-level call function'msg.sender.call.value(amount)()' without checking the address of'msg.sender', allowing for external contract calls before the initial execution is complete. This can lead to a reentrancy attack where the contract state may change in the middle of its execution, allowing for potential exploitation.

The second smart contract code is not vulnerable to a reentrancy attack in the 'withdraw' function of the 'SimpleDAO' contract, as it is not used in the 'CustomToken' or 'BaseToken' contracts. However, it is still recommended to use the 'transfer' function instead of the low-level call function for safer and more secure code.",reentrancy,4.0,594.0,6.0,4.747841119766235
102,reentrancy," Yes, the smart contract is vulnerable to a reentrancy attack. The vulnerability lies in the `Collect` function, specifically at `if(msg.sender.call.value(_am)())`. This line allows for a call to an untrusted contract before the initial execution is complete, potentially changing the contract state in the middle of execution. This is the same line that was identified as vulnerable in the initial contract, and it has not been corrected in this version.",reentrancy,3.0,526.0,6.0,6.238368511199951
103,reentrancy," Answer:

Yes, the first contract code is vulnerable to a reentrancy attack. The vulnerability exists in the `Collect` function where it calls `msg.sender.call.value(_am)()`. This allows the message sender (i.e., the calling contract) to make new calls to the current contract before the initial execution is complete, leading to a reentrancy attack.

The second contract code does not contain the vulnerable line of code, so it is not vulnerable to a reentrancy attack. However, it is always a good practice to follow the best security practices when writing smart contracts.",reentrancy,4.0,554.0,6.0,3.1537373065948486
104,reentrancy," Yes, the provided smart contract code is vulnerable to a reentrancy attack. The vulnerability exists in the `getFirstWithdrawalBonus` function of the `Reentrancy_bonus` contract. After the `withdrawReward` function is called in line 12, the state of the contract changes and the `claimedBonus` mapping is updated in line 13. However, if the recipient is an untrusted contract, it can call the `getFirstWithdrawalBonus` function again before the initial execution is complete, allowing it to drain the contract of funds. This is the same vulnerability that was present in the initial code provided.",reentrancy,3.0,560.0,6.0,3.0587069988250732
105,reentrancy," Answer:

Yes, the first contract code is vulnerable to a reentrancy attack. The vulnerability lies in the `Collect` function, specifically at `msg.sender.call.value(_am)()`. This allows for an attacker to call an untrusted contract before the initial execution is complete, potentially changing the contract state in the middle of execution.

The second contract code, CustomToken, is not vulnerable to the reentrancy attack as it does not contain any function that calls an external contract before the initial execution is complete.",reentrancy,3.0,539.0,6.0,3.9600424766540527
106,reentrancy," Yes, the smart contract code is vulnerable to a reentrancy attack. The vulnerability lies in the `Collect` function, specifically in the line `if(msg.sender.call.value(_am)())`. This line allows for a call to an untrusted contract before the initial execution is complete, potentially changing the contract state in the middle of execution.",reentrancy,3.0,504.0,6.0,3.60657000541687
107,reentrancy," Yes, the smart contract code is vulnerable to a reentrancy attack. The vulnerability lies in the `Collect` function, specifically at `if(msg.sender.call.value(_am)())`. This line allows for a call to an untrusted contract before the initial execution is complete, potentially changing the contract state in the middle of execution.",reentrancy,3.0,502.0,6.0,2.257638692855835
108,reentrancy," NO, the provided code does not have the same reentrancy vulnerability in the `WithdrawToHolder` function. The potential vulnerability in the `TokenBank` contract's `WithdrawToHolder` function was due to the unprotected `.call.value()()` function. In the provided `CustomToken` contract, there is no function that is vulnerable to a reentrancy attack. However, it is important to note that the `CustomToken` contract has a different vulnerability: it sets the balance of the contract creator to the total supply in the constructor, which can lead to a potential vulnerability if the contract creator's account is compromised.",reentrancy,2.0,562.0,6.0,3.3641812801361084
109,reentrancy," The smart contract code is vulnerable. The vulnerability lies in the `attack` contract's `supportsToken` function, where it calls the `airDrop` function of the `ModifierEntrancy` contract. This creates a reentrancy attack vector, as the `airDrop` function modifies the state of the `ModifierEntrancy` contract, and the `attack` contract does not properly handle the potential for reentrancy. The `attack` contract's `supportsToken` function should not call any external contracts that modify the state of the contract before the initial execution is complete.",reentrancy,3.0,552.0,6.0,4.330679416656494
110,reentrancy," Yes, the smart contract code is vulnerable to a reentrancy attack. The vulnerability lies in the `CashOut` function, specifically in the line `if(msg.sender.call.value(_am)())`. This line allows for a call to an external contract before the initial execution is complete, which is a condition for a reentrancy attack.",reentrancy,3.0,504.0,6.0,3.167405843734741
111,reentrancy," Yes, the smart contract code is vulnerable to a reentrancy attack. The vulnerability lies in the `Collect` function, specifically at `if(msg.sender.call.value(_am)())`. This line allows for a call to an untrusted contract before the initial execution is complete, potentially changing the contract state in the middle of execution.",reentrancy,3.0,502.0,6.0,2.6294445991516113
112,reentrancy," Answer:

Yes, the first contract (ReentrancyDAO) is vulnerable to a reentrancy attack. The vulnerability lies in the `withdrawAll` function, specifically in the line `bool callResult = msg.sender.call.value(oCredit)();`. This allows for a reentrancy attack because it allows the caller (`msg.sender`) to call the `withdrawAll` function again before the initial execution is complete, potentially draining the contract of its funds.

The second contract (CustomToken) is not vulnerable to a reentrancy attack, as it does not contain any functions that call external contracts before the initial execution is complete. However, it is important to note that this contract does not implement any safeguards against reentrancy attacks in its `transfer` function, which could be added to improve security.",reentrancy,4.0,597.0,6.0,2.454827308654785
