case_id,vuln_type,audit_report,gt,eval_score,eval_input_token_num,eval_output_token_num,eval_inference_time
11,access control," The smart contract code is vulnerable. The vulnerability lies in the `CustomToken` contract, specifically in the constructor function. The constructor function is not defined with the `constructor` keyword (which was introduced in Solidity version 0.4.22), but instead it is defined as a regular function with the same name as the contract. This means that the function will behave as a regular function after the contract has been constructed, and not just during the construction phase. As a result, an attacker can call this function after the contract has been deployed, potentially causing unintended behavior. In this case, the attacker could mint new tokens by calling the `CustomToken` function after the contract has been deployed. To fix this vulnerability, the `CustomToken` function should be defined as a constructor using the `constructor` keyword.",access control,2.0,598.0,6.0,2.9842090606689453
12,access control," Answer:

Yes, the first contract code is vulnerable to an access control vulnerability. The `missing` function in the `Missing` contract does not have the `onlyowner` modifier, which means that any address can call this function and set the `owner` variable to their address. This is a security risk as it allows any address to potentially gain control over the contract.

The second contract code does not have the same vulnerability as the `onlyowner` modifier is used correctly in the `withdraw` function of the `Missing` contract. However, I cannot say for sure if the entire code is secure without reviewing the rest of the contract and its intended functionality.",access control,3.0,567.0,6.0,2.8292860984802246
13,access control," The provided smart contract code is vulnerable. The vulnerability lies in the `changeOwner` function, which allows the current owner to transfer ownership to any address without any checks. This can lead to an access control issue, as any existing owner can transfer ownership to an attacker. This is a common security vulnerability in smart contracts, where access control is not properly implemented, allowing unauthorized access to sensitive functions.",access control,3.0,513.0,6.0,2.701892852783203
14,access control," No, the second smart contract code is not vulnerable to the 'access control' vulnerability. The `withdraw` function in the `Wallet` contract correctly checks if the sender's balance is greater than or equal to the requested withdrawal amount, preventing an access control vulnerability. However, it is still recommended to check for other potential vulnerabilities in the code.

The `CustomToken` contract creates a new token with a large supply and assigns it to a specific address. While this may not be an issue in this context, it is important to ensure that token transfers are handled securely and that the token's functionality is thoroughly tested.",access control,2.0,557.0,6.0,3.7248873710632324
15,access control," Answer:

Yes, the first contract is vulnerable to access control issues. In the IamMissing function, the owner's address is set to msg.sender without checking if the contract is in the initial state or not. An attacker can call this function to become the owner of the contract.

The second contract is not vulnerable to access control issues in the provided code. However, it is important to note that the BaseToken contract's constructor function is not marked as payable, which can cause issues if someone tries to send ether to the contract during deployment. Additionally, the total supply of tokens is set to a very high value, which can cause issues with gas limits if not handled properly.",access control,4.0,569.0,6.0,2.7476441860198975
16,access control," No, the second smart contract code is not vulnerable to the 'access control' vulnerability type. The `withdraw` function in the `Map` contract correctly checks if the msg.sender is the owner before performing the transfer operation. However, it is recommended to use the latest version of Solidity and implement the `SafeMath` library to prevent arithmetic overflows and underflows.

The `CustomToken` contract seems to be a simple ERC20 token contract with a fixed supply. There are no apparent vulnerabilities in this contract. However, it is recommended to perform a thorough audit of the contract before deploying it to the mainnet.",access control,2.0,558.0,6.0,5.581833362579346
17,access control," Yes, the provided code is vulnerable to access control attacks. The vulnerability exists in the `Proxy` contract, which uses `delegatecall` to allow the calling of functions in the `callee` contract. This can be exploited if the `callee` contract is malicious, as it can potentially modify the state of the `Proxy` contract. The `CustomToken` contract, which inherits from `BaseToken`, does not interact with the `Proxy` contract, so it is not directly vulnerable. However, if it is used as a `callee` contract in the `Proxy` contract, it could be at risk. To mitigate this vulnerability, the `Proxy` contract should implement proper access controls to ensure that only trusted contracts can be used as `callee`.",access control,4.0,587.0,6.0,2.7856125831604004
18,access control," NO, the provided code for the CustomToken contract does not have the same vulnerability as the previous Wallet contract. The require statement in the PopBonusCode function of the Wallet contract was always true due to the unsigned nature of array lengths, which is not present in the CustomToken contract.

However, it is important to note that the CustomToken contract has its own potential security issues. For instance, the constructor function in the CustomToken contract is assigning the total supply to a specific address (0xbabaf2036d6a6623328e0d3cd41fc5eb30cea25f) without any checks or restrictions. This could potentially lead to access control issues, where only the owner address has access to the large token balance. It is recommended to add checks or restrictions in the constructor function to prevent unauthorized access and ensure that the token supply is distributed fairly and securely.",access control,4.0,613.0,6.0,3.9633774757385254
19,access control," The first contract code is vulnerable, and the vulnerability is in the `Constructor` function. The function is not marked `constructor` (which is the correct way to define a constructor in Solidity version 0.5.0 and above). Instead, it is a normal function with the same name as the contract, which is a naming convention used for constructors in older versions of Solidity (0.4.x and below). However, this naming convention is not enforced, and the function will not be treated as a constructor. As a result, the `owner` variable will not be initialized as the contract's deployer address, and the `onlyowner` modifier will not work as intended.

The second contract code is not vulnerable based on the provided code. However, it is important to note that the `CustomToken` contract inherits from the `BaseToken` contract, and the `BaseToken` contract does not have an `onlyowner` modifier. Therefore, any function in the `BaseToken` contract that is meant to be restricted to the contract owner should be updated to include the `onlyowner` modifier in the `CustomToken` contract.",access control,3.0,665.0,6.0,2.0817291736602783
20,access control," Yes, the smart contract code is vulnerable due to access control issues. The vulnerability lies in the `initWallet()` function where the `creator` variable is set to `msg.sender`. This creates a potential for an access control vulnerability as any address can become the creator of the contract by calling this function. This could potentially allow an attacker to gain control over the contract and perform actions that should only be allowed for the contract creator.",access control,3.0,520.0,6.0,2.6512603759765625
21,access control," Yes, the second smart contract code is also vulnerable. The vulnerability exists in the `CustomToken` contract in its constructor function. The contract sets the balance of the `owner` address to the total supply, but it does not perform any access control checks to ensure that the `owner` address is the deploying address or has the necessary permissions to have such a large balance. This could potentially lead to access control issues.

The line of code that contains the vulnerability is:
`balanceOf[0xbabaf2036d6a6623328e0d3cd41fc5eb30cea25f] = totalSupply;`

This line assigns the total supply to the owner's address without checking if the address is authorized to have that amount.",access control,3.0,585.0,6.0,2.6972763538360596
22,access control," Answer:

Yes, the first smart contract code is vulnerable to access control issues. The vulnerability lies in the refund function where there is no access control in place to restrict who can call this function. An attacker can call this function to withdraw funds even if they have not deposited any funds beforehand.

In the second smart contract code, there is no apparent vulnerability related to access control in the provided code. However, it is important to note that the code provided only includes the constructor function for the CustomToken contract, and it is unclear if there are any other functions that may have access control vulnerabilities. It is always important to thoroughly test and audit any smart contract code before deploying it to the blockchain.",access control,4.0,572.0,6.0,2.1834428310394287
23,access control," Yes, the second smart contract code is also vulnerable due to access control issues. The `SimpleSuicide` contract's `suicideAnyone()` function allows any caller to destroy the contract by calling this function. This is because there is no check to ensure that only the contract owner or authorized users can call this function. This can lead to unauthorized destruction of the contract and loss of associated assets.

In the given code, the `suicideAnyone()` function in the `SimpleSuicide` contract should have restricted access to prevent unauthorized access and destruction of the contract. This can be done by using modifier `onlyOwner` or any other similar access control mechanisms.",access control,3.0,566.0,6.0,3.1409425735473633
24,access control," Answer:

Yes, the first smart contract code is vulnerable due to the access control issue. The `changeOwner` function is public, meaning any address can call this function and change the owner of the contract. This is a security risk as it allows unauthorized addresses to take control of the contract.

The second smart contract code is a different contract called `CustomToken` and is not vulnerable to the same access control issue. However, it has its own set of issues. The `CustomToken` contract sets the initial total supply to a very large number and assigns it all to one address (0xbabaf2036d6a6623328e0d3cd41fc5eb30cea25f). This could be a centralization risk, as one address has a large portion of the total supply. Additionally, the contract does not have any functionality to mint, burn, or transfer tokens, making it inflexible for future changes.",access control,4.0,624.0,6.0,3.2237048149108887
25,access control," Yes, the second smart contract code is also vulnerable. The vulnerability exists in the `Phishable` contract included in the first contract. If an external contract inherits from the `Phishable` contract, it will also inherit the `withdrawAll` function with the insecure access control. In this case, the `CustomToken` contract inherits from `Phishable`, and the `withdrawAll` function is accessible, making it vulnerable.

The vulnerability lies in line 12 of the `Phishable` contract:

```solidity
require(tx.origin == owner);
```

Using `tx.origin` for access control is not recommended, as it can be easily manipulated by malicious users. Instead, use `msg.sender` to check the direct caller of the function.",access control,3.0,585.0,6.0,2.7223308086395264
26,access control," Yes, the smart contract code is vulnerable due to the access control issues. The vulnerability lies in lines 19 and 26 where `delegatecall` is used. This allows the called contract to modify the state and functions of the calling contract, which can lead to unauthorized access and modification of the contract's state. This is a potential 'access control' vulnerability as any contract can be passed to the `delegatecall` function, bypassing the usual access controls. It is recommended to use `call` instead of `delegatecall` and implement specific functions for external contracts to interact with, with proper access controls in place.",access control,3.0,559.0,6.0,2.048570156097412
27,unchecked low level calls," Yes, the provided code is vulnerable due to the same reason as the previous code. In the `Command` function of the `Pie` contract, it uses the low-level `call.value` function (line 58) without checking the return value. If the called contract throws an exception, the execution will continue, potentially causing unwanted effects.

Here's the vulnerable part of the code:

```solidity
adr.call.value(msg.value)(data);
```

To fix this issue, you should use the `transfer` function or check the return value of the `call.value` function to ensure the execution was successful.",unchecked low level calls,3.0,559.0,6.0,2.198868989944458
28,unchecked low level calls," Yes, the smart contract code is vulnerable. The vulnerability lies in the `withdraw` function in the `Delta` contract. The `owner.send(balance)` statement (line 65 in the first code block) does not check the return value of `send`, which can result in the contract continuing execution even if the `send` call fails. This can lead to the contract failing to withdraw the intended amount of funds. Additionally, the `Delta` contract uses `send` instead of `transfer`, which provides less error reporting and makes it harder to detect failures.",unchecked low level calls,4.0,549.0,6.0,3.397648811340332
29,unchecked low level calls," Yes, the provided code is vulnerable. The vulnerability lies in the `Command` function of the `Freebie` contract, which calls an external contract using the low-level `call.value` function without checking its return value. If the called contract throws an exception, the `call.value` will return false, but the execution will continue, potentially causing unwanted outcomes.

In this specific case, the vulnerability is in line 39: `adr.call.value(msg.value)(data);`

Additionally, the `CustomToken` contract creates an initial supply of tokens and assigns them to the address `0xbabaf2036d6a6623328e0d3cd41fc5eb30cea25f`. While this may not directly contribute to the vulnerability, it is important to ensure that the recipient address is valid and authorized to receive the entire token supply.",unchecked low level calls,4.0,609.0,6.0,3.499103546142578
30,unchecked low level calls," Yes, the smart contract code is vulnerable. The vulnerability lies in the following lines:

- Line 110: msg.sender.send(valuePaid);
- Line 118: msg.sender.send(excessPaid);
- Line 132: currentMonarch.etherAddress.send(compensation);
- Line 174: wizardAddress.send(amount);

The vulnerability is due to the fact that the contract uses the low-level function send(), which can fail and does not propagate errors. If the send fails, the contract will continue to execute, potentially leaving the contract in an inconsistent state. The return value of send() should be checked to ensure that the transaction was successful before proceeding with contract execution.",unchecked low level calls,3.0,570.0,6.0,2.7237260341644287
31,unchecked low level calls," Yes, the provided smart contract code is vulnerable. The vulnerability lies in the `airPort` contract, which is almost identical to the vulnerable code provided earlier. The `transfer` function calls an unchecked external function using `call`, which can lead to fail-opens and other unwanted outcomes if the return value is not checked. Specifically, the line `caddress.call(id,from,_tos[i],v);` is the source of the vulnerability.",unchecked low level calls,3.0,526.0,6.0,3.488705635070801
32,unchecked low level calls," Answer:

NO, the provided code is not vulnerable to the same type of vulnerability as the previous code. The code does not use the `send` function in a way that could cause a fail-open if the return value is not checked. However, it is important to note that the `send` function can still fail for other reasons, such as if the recipient's contract throws an error or if the recipient has run out of gas. Therefore, it is still a best practice to check the return value of `send` and handle any errors appropriately.",unchecked low level calls,2.0,547.0,6.0,2.3752546310424805
33,unchecked low level calls," Yes, the second smart contract code is also vulnerable. The vulnerability exists in the ReturnValue contract, which is identical to the one in the first code. The function callnotchecked() in the ReturnValue contract does not check the return value of callee.call(), making it susceptible to the same fail-opens and unwanted outcomes as described in the first code. This vulnerability can be exploited in a similar way as described for the first code.",unchecked low level calls,3.0,524.0,6.0,2.07537579536438
34,unchecked low level calls," Yes, the provided code is vulnerable to the same issue as the previous code. The vulnerability lies in the line:

`contract_address.call(id, msg.sender, tos[i], vs[i]);`

in the `transfer` function of the `AirDropContract` contract. The issue is that the code continues to run without checking the return value of the low-level `call` function. If the call to `contract_address` fails, the code will continue to execute, potentially leading to unwanted outcomes.

In addition, the code is missing the `validAddress` modifier in the `CustomToken` contract when calling the `Transfer` event. While this may not directly contribute to the vulnerability mentioned, it is still a potential issue that should be addressed.",unchecked low level calls,4.0,586.0,6.0,2.8193695545196533
35,unchecked low level calls," Answer:

Yes, the following smart contract code is vulnerable:

contract Pie
{
...
function Command(address adr,bytes data)
payable
public
{
require(msg.sender == Owner);
adr.call.value(msg.value)(data);
}
...
}

The reason it is vulnerable is because, similar to the first code snippet, the low-level function call.value(msg.value)(data) does not have its return value checked. If the call to 'adr' fails, the code will continue to execute, potentially causing unintended behavior or security vulnerabilities.",unchecked low level calls,3.0,542.0,6.0,2.8926873207092285
36,unchecked low level calls," Yes, the given smart contract code is vulnerable due to the unchecked low-level calls. Specifically, in the `WithdrawToken` function of the `Token` contract, the `token.call` function is used without checking its return value. This can lead to fail-opens and other unwanted outcomes if the call fails. The same vulnerability exists in the `TokenBank` contract's `WithdrawToHolder` function with the use of `_addr.call.value(_wei)`.

In the provided `CustomToken` contract, there are no low-level calls without return value checks, so it is not vulnerable based on the given code. However, it is essential to ensure that any contracts interacting with the `CustomToken` contract do not contain similar vulnerabilities.",unchecked low level calls,3.0,584.0,6.0,2.3144283294677734
37,unchecked low level calls," Yes, the given smart contract code is vulnerable to the same issue as the previous code. The vulnerability lies in the line:

`contract_address.call(""register"", ""CentraToken"");`

Just like before, the low-level `call` function is used without checking its return value. If the call to `register` function fails, the contract will continue executing and potentially cause unwanted outcomes.",unchecked low level calls,3.0,514.0,6.0,2.5226447582244873
38,unchecked low level calls," Yes, the provided code is vulnerable due to the unchecked low-level calls. Specifically, in the `WithdrawToken` function of the `Token` contract, the `token.call` function is used without checking its return value. This can lead to fail-opens and other unwanted outcomes if the call fails. The same vulnerability exists in the `_addr.call.value(_wei)` line of the `WithdrawToHolder` function in the `TokenBank` contract.",unchecked low level calls,3.0,527.0,6.0,3.495668649673462
39,unchecked low level calls," Yes, the smart contract code is vulnerable. The vulnerability lies in the following lines:

- 69, 71, 73, 75: `extra[x].call.value(_share).gas(800000)();`

The `call.value()` function can fail, and if it does, the contract will continue executing, leading to potential issues. The contract should check the return value of this function to ensure it has succeeded before proceeding.",unchecked low level calls,3.0,525.0,6.0,2.968299627304077
40,unchecked low level calls," Yes, the contract is vulnerable. The vulnerability is in the `execute` function of the `Owned` contract, which is inherited by the `Marriage` contract. The line `_dst.call.value(_value)(_data);` does not check the return value of the `call` function, which can lead to fail-opens and other unwanted outcomes if the call to `_dst` fails.

Additionally, the `execute` function in the `Owned` contract is called with `onlyOwner` modifier, but it does not restrict the `_dst` address to which the contract can be transferred. This can lead to a security vulnerability where an attacker can transfer the contract to their own address and call the `execute` function to drain the contract of its funds.",unchecked low level calls,4.0,587.0,6.0,2.331221342086792
41,unchecked low level calls," Yes, the provided code is vulnerable. The vulnerability lies in the `execute` function of the `Owned` contract, which is inherited by the `WedIndex` contract. The line `_dst.call.value(_value)(_data);` does not check the return value of the low-level `call` function. If the call to `_dst` fails, the code will continue to execute, potentially leading to unwanted outcomes. This is the same vulnerability type as in the first code snippet (unchecked low level calls).",unchecked low level calls,3.0,538.0,6.0,2.1131296157836914
42,unchecked low level calls," Yes, the contract is vulnerable due to the unchecked return value of the low-level call function. In the `Command` function, the contract calls an external contract using `adr.call.value(msg.value)(data)`, but it does not check the return value of this call. If the call fails for any reason (e.g., out of gas, the called contract throws an exception), the failure will not be handled, and the contract will continue executing, potentially leading to unexpected behavior or security vulnerabilities.

To fix this issue, the contract should check the return value of the low-level call and handle any failures appropriately. For example:

```solidity
bool success = adr.call.value(msg.value)(data);
require(success, ""Call failed"");
```

This way, if the call fails, the contract will stop executing and the `require` statement will trigger, notifying users of the failure.",unchecked low level calls,3.0,614.0,6.0,2.6427743434906006
43,unchecked low level calls," Yes, the smart contract code is vulnerable. The vulnerability lies in the same lines as the previous contract: lines 20 and 27 where `send` function is called without checking its return value. If the call to `send` fails, the contract will continue executing the next line of code, setting `payedOut` to true, which could lead to unwanted outcomes. Additionally, the `BaseToken` and `CustomToken` contracts do not have any visible vulnerabilities, but they do not implement any checks for the `send` function either, potentially inheriting the same vulnerability from the `Lotto` contract if the same `send` function is used.",unchecked low level calls,4.0,570.0,6.0,2.6870737075805664
44,unchecked low level calls," Yes, the provided code is vulnerable. The vulnerability lies in the `Command` function of the `FreeEth` contract, which calls an external contract using the low-level `call.value` function without checking its return value. If the external contract call fails, the code will continue to execute, potentially leading to unwanted outcomes.

Here is the vulnerable line:
`adr.call.value(msg.value)(data);`

The rest of the code, including the `CustomToken` contract, is not directly vulnerable based on the provided information. However, it's important to note that the `CustomToken` contract assigns a large total supply to a specific address (0xbabaf2036d6a6623328e0d3cd41fc5eb30cea25f) in the constructor, which might or might not be the intended behavior.",unchecked low level calls,4.0,604.0,6.0,2.936906337738037
