case_id,vuln_type,audit_report,gt,eval_score,eval_input_token_num,eval_output_token_num,eval_inference_time
113,reentrancy," Answer:

Yes, the first contract EtherBank is vulnerable to a reentrancy attack. The vulnerability lies in the `withdrawBalance` function, specifically in the line:

`if (!(msg.sender.call.value(amountToWithdraw)())) { throw; }`

Here, the contract is allowing a call to an external contract before the initial execution is complete, which can lead to a reentrancy attack. The attacker can repeatedly call the `withdrawBalance` function and drain the contract of funds.

The second contract CustomToken is not directly vulnerable to the reentrancy attack as it does not have any function to withdraw or transfer ether. However, it is always a good practice to follow the principle of least privilege and only give the necessary permissions to the contract. In this case, the contract has assigned the total supply to an external address in the constructor, which can be a potential security risk.",reentrancy,4.0,613.0,6.0,8.525572776794434
114,reentrancy," Yes, the smart contract code is vulnerable to a reentrancy attack. The vulnerability lies in the `CashOut` function, specifically in the line `if(msg.sender.call.value(_am)())`. This line allows for a call to an untrusted contract before the initial execution is complete, potentially changing the contract state in the middle of its execution. This is exactly what happens in a reentrancy attack.",reentrancy,3.0,518.0,6.0,2.718656063079834
115,reentrancy," Yes, the first smart contract code is vulnerable to a reentrancy attack. The vulnerability lies in the `CashOut` function, specifically in the line `if(msg.sender.call.value(_am)())`. This line allows for a call to an untrusted contract before the initial execution is complete, potentially changing the contract state in the middle of execution.

The second smart contract code is not provided in the format requested, so it cannot be evaluated in isolation. However, if it is used in conjunction with the first contract as the `Log` contract, it does not introduce any additional vulnerabilities to the `ETH_VAULT` contract.",reentrancy,3.0,563.0,6.0,3.498594284057617
116,reentrancy," Yes, the provided smart contract code is vulnerable to a reentrancy attack. The vulnerability lies in the `Collect` function, specifically at the line `if(msg.sender.call.value(_am)())`. This line allows for a call to an arbitrary address before the `Collect` function has completed execution, which is a potential point of reentrancy.",reentrancy,3.0,506.0,6.0,4.003968000411987
117,reentrancy," Yes, the second smart contract code is also vulnerable to a reentrancy attack. The vulnerability exists in the `CustomToken` contract in the `withdrawBalance()` function of the `Reentrancy_cross_function` contract. The `withdrawBalance()` function uses `call.value()` which can allow an attacker to call the function recursively and drain the contract of funds. This is the same vulnerability that exists in the first contract.",reentrancy,3.0,520.0,6.0,4.168264150619507
118,reentrancy," Yes, the smart contract is vulnerable. The vulnerability lies in the `withdrawBalance()` function of the `Reentrance` contract, which is almost identical to the vulnerable code provided in the initial explanation. The `call.value()` function call made in this function allows for reentrancy, potentially allowing an attacker to repeatedly call the function and drain the contract of funds.",reentrancy,3.0,509.0,6.0,2.1290524005889893
119,reentrancy," Yes, the smart contract code is vulnerable to a reentrancy attack. The vulnerability lies in the `CashOut` function where it calls the sender's contract using `msg.sender.call.value(_am)()`. This allows the recipient to call back into the `CashOut` function before the balance of the sender has been updated, allowing for a reentrancy attack.

The contract also uses `tx.origin` in the `onlyOwner` modifier, which is generally considered a bad practice as it makes the contract susceptible to a phishing attack. It is recommended to use `msg.sender` instead.",reentrancy,4.0,555.0,6.0,2.4393868446350098
120,reentrancy," Yes, the provided Smart Contract code is vulnerable to Reentrancy Attack. The vulnerability lies in the `CashOut` function where it uses `msg.sender.call.value(_am)()` which allows external contract calls to make new calls to the calling contract before the initial execution is complete.

In the `CashOut` function, the balance of the sender is updated after the `call.value()` function is executed. This allows for a reentrancy attack where the called contract can recursively call the `CashOut` function before the balance of the sender is updated, draining the contract of its funds.

To fix this vulnerability, the balance of the sender should be updated before the `call.value()` function is executed. This can be done by using the `transfer` function instead of `call.value()` or by implementing a reentrancy guard pattern.",reentrancy,3.0,604.0,6.0,2.2290194034576416
121,reentrancy," Yes, the provided PRIVATE\_ETH\_CELL contract is vulnerable to a reentrancy attack. The vulnerability lies in the `Collect` function, specifically at `if(msg.sender.call.value(_am)())`. This allows for the recipient of the ether to call back into the contract before the balance of the sender has been updated, allowing for the attacker to drain the contract of ether in a reentrancy attack.

The provided CustomToken contract is not vulnerable to the same type of attack as the PRIVATE\_ETH\_CELL contract because it does not include any functions that allow for the transfer of ether. It is a token contract that only deals with the transfer of tokens, not ether.",reentrancy,3.0,576.0,6.0,3.427765130996704
122,reentrancy," Yes, the provided Smart Contract code is vulnerable to a Reentrancy attack. The vulnerability lies in the `CashOut` function, specifically in the line:

`if(msg.sender.call.value(_am)())`

By using the low-level `.call.value()` function, the contract allows external contracts to make new calls before the initial execution is complete. This can lead to the state of the contract being changed in the middle of its execution, enabling a Reentrancy attack.",reentrancy,3.0,530.0,6.0,3.2668685913085938
123,reentrancy," Yes, the smart contract is vulnerable to a reentrancy attack. The vulnerability lies in the `Collect` function, specifically at `if(msg.sender.call.value(_am)())`. This line allows for a call to an untrusted contract before the initial execution is complete, potentially changing the contract state in the middle of execution. This is the same line that was identified as vulnerable in the first contract, and the same issue applies here.",reentrancy,3.0,523.0,6.0,3.64033842086792
124,reentrancy," Yes, the provided Smart Contract code is vulnerable to Reentrancy Attack. The vulnerability lies in the `CashOut` function where it uses `msg.sender.call.value(_am)()` which allows external contract calls to make new calls to the calling contract before the initial execution is complete.

This means that the contract state may change in the middle of its execution as a result of a call to an untrusted contract, which can lead to a reentrancy attack. An attacker can repeatedly call the `CashOut` function, draining the contract of funds.",reentrancy,3.0,546.0,6.0,1.9925050735473633
125,reentrancy," Yes, the smart contract code is vulnerable to a reentrancy attack. The vulnerability lies in the `Collect` function where the contract allows the `msg.sender` to call an untrusted contract before the initial execution is complete, specifically in this line: `if(msg.sender.call.value(_am)())`. This can allow an attacker to repeatedly call the function and drain the contract of funds.",reentrancy,3.0,514.0,6.0,2.2727293968200684
126,reentrancy," Answer:

Yes, the second smart contract code is also vulnerable to a reentrancy attack. The vulnerability exists in the `CustomToken` contract, which inherits from the `BaseToken` contract. The `CustomToken` contract has a constructor function that sets the initial total supply and assigns it to the address 0xbabaf2036d6a6623328e0d3cd41fc5eb30cea25f. This address can then call the `withdrawBalance()` function in the `Reentrancy_insecure` contract, which is vulnerable to a reentrancy attack for the same reasons as in the first code example.

The vulnerable code in the `Reentrancy_insecure` contract is the same as before:
```csharp
(bool success, ) = msg.sender.call.value(amountToWithdraw)("""");
require(success);
```
At this point, the caller's code is executed, and if the caller is a malicious contract, it can call the `withdrawBalance()` function again before the initial execution is complete, leading to a reentrancy attack.",reentrancy,3.0,653.0,6.0,2.3994247913360596
127,time manipulation," Yes, the provided code is vulnerable to timestamp manipulation. The contract CustomToken does not have any vulnerabilities by itself, but the TimedCrowdsale contract is identical to the previous example and shares the same issue. The isSaleFinished function uses block.timestamp to determine if the sale has finished, which can be manipulated by the miner.",time manipulation,3.0,501.0,6.0,2.495349168777466
128,time manipulation," Yes, the smart contract code is vulnerable to time manipulation. The vulnerability lies in the following lines:

- Line 9: `if ( rand> 0 && now - rand > 24 hours ) {`
- Line 23: `return block.timestamp;`

The `now` keyword is an alias for `block.timestamp`. The `block.timestamp` value is provided by the miner and can be manipulated within a certain range (typically, a few seconds). In this contract, the `payOut` function's condition for sending funds depends on the `now - rand > 24 hours` condition, which can be manipulated by the miner. This can lead to potential security issues and unfair advantages for attackers.",time manipulation,3.0,577.0,6.0,2.7501866817474365
129,time manipulation," Yes, the provided smart contract code is vulnerable to the 'time manipulation' attack. The vulnerability lies in the `Governmental` contract, specifically in the `resetInvestment()` function. The function checks if a certain amount of time has passed since the last investment (`block.timestamp > lastInvestmentTimestamp + ONE_MINUTE`). However, as the `block.timestamp` value can be manipulated by miners, this check does not provide sufficient protection. A malicious miner could manipulate the timestamp to a value before `lastInvestmentTimestamp + ONE_MINUTE`, allowing the `resetInvestment()` function to be called prematurely.

The `CustomToken` and `Attacker` contracts do not directly contribute to the time manipulation vulnerability in the `Governmental` contract. However, it is important to note that the `Attacker` contract can call the `resetInvestment()` function in the `Governmental` contract, which is part of the vulnerability.",time manipulation,3.0,618.0,6.0,3.423250436782837
130,time manipulation," Answer:

Yes, the first contract (Roulette) is vulnerable to time manipulation. The vulnerability lies in the lines:

```solidity
require(now!= pastBlockTime);",time manipulation,3.0,469.0,6.0,2.3785152435302734
131,time manipulation," Yes, the smart contract code is vulnerable. The vulnerability lies in the `play` function of the `EtherLotto` contract, which uses the `block.timestamp` to generate a random number. As explained in the first part of the question, this can lead to time manipulation vulnerabilities as the block timestamp can be influenced by the miner. In this case, a miner could manipulate the block timestamp to control the outcome of the game, which is not fair and secure.",time manipulation,3.0,528.0,6.0,3.1065263748168945
132,short addresses," Yes, the second smart contract code is also vulnerable due to the use of tx.origin in line 11 of the MyToken contract. The use of tx.origin is not recommended because it is insecure and can be vulnerable to phishing attacks. An attacker can trick a user into sending a transaction to a malicious contract, which then forwards the transaction to the target contract (in this case, the MyToken contract) using tx.origin. This would give the attacker access to the user's balance in the MyToken contract.

The CustomToken contract appears to be a separate and unrelated contract, but since it inherits from the BaseToken contract, it is possible that the BaseToken or CustomToken contracts could be modified to interact with the MyToken contract in a way that would exploit this vulnerability. Therefore, it is important to ensure that all contracts are secure and do not use insecure practices like tx.origin.",short addresses,2.0,610.0,6.0,2.1289632320404053
133,denial of service," Yes, the smart contract code is vulnerable to denial of service attack. The vulnerability lies in the `emptyCreditors` function where the `creditorAddresses` array is reset when its length exceeds 1500. This can be exploited by an attacker to repeatedly call the `addCreditors` function to fill up the array and trigger the denial of service attack.

The second contract `CustomToken` is not directly vulnerable to the denial of service attack, but it shares the same struct and functions as the `BaseToken` contract. Therefore, if the `BaseToken` contract is vulnerable, any contracts that inherit from it may also be at risk. It is important to ensure that all inherited contracts are also secure and do not contain any vulnerabilities.",denial of service,4.0,585.0,6.0,2.8200669288635254
134,denial of service," Yes, the smart contract code is vulnerable to a denial-of-service (DoS) attack. The vulnerability lies in the `insertNnumbers` function of the `DosNumber` contract. The function does not check if the `numbers` parameter is within the bounds of the `array`'s length, which can result in the contract allocating more and more memory each time the function is called, eventually leading to a DoS.

The vulnerable lines of code are:
```scss
for(uint i=0;i<numbers;i++) {
    if(numElements == array.length) {
        array.length += 1;
    }
    array[numElements++] = value;
}
```
In the above code, the `for` loop iterates `numbers` times, regardless of the current length of the `array`. This can result in the contract allocating more and more memory, leading to a potential DoS attack. To fix this vulnerability, the contract should check if `numbers` is within the bounds of the `array`'s length before executing the `for` loop.",denial of service,3.0,652.0,6.0,3.2403934001922607
135,denial of service," Yes, the smart contract code is vulnerable to denial of service attacks. The vulnerability lies in lines 92-93 and 96-97 where the `creditorAddresses` and `creditorAmounts` arrays are reset to new arrays with zero elements. This will cause all previous creditors' information to be erased, effectively preventing them from receiving any more payments. This can be exploited by an attacker by repeatedly calling the `lendGovernmentMoney` function, causing the contract to reset the arrays and lose track of the creditors. This can lead to a denial of service as the contract will no longer be able to make payments to the correct creditors.

In addition, the `lendGovernmentMoney` function is not checking the `buddy` parameter for any restrictions, allowing any address to be passed as an argument. This can lead to unintended behavior and potential vulnerabilities. It is recommended to add access controls and checks to ensure that only authorized addresses can be used as a `buddy`.

Furthermore, the contract is using the `send` function to transfer funds, which can throw exceptions and cause the contract to stop execution. It is recommended to use the `transfer` function instead, which will automatically handle exceptions and prevent the contract from stopping execution.

Overall, the contract should undergo further testing and auditing to ensure its security and",denial of service,4.0,696.0,6.0,3.184194326400757
136,denial of service," Yes, the smart contract code is vulnerable to a denial-of-service attack. The vulnerability is present in the `refundAll` function of the `Refunder` contract. The function iterates over the `refundAddresses` array and sends ether to each address in the array from the contract's storage. If any of the `send` calls fail, the contract will stop execution due to the `require` statement, and no further addresses in the array will be processed. This means that if an attacker can manipulate one of the addresses in the array to cause the `send` call to fail, they can prevent all subsequent addresses from receiving their refunds. This is similar to the vulnerability in the first code snippet you provided.",denial of service,3.0,579.0,6.0,3.2865841388702393
137,denial of service," Yes, the second smart contract code is also vulnerable to denial of service attack. The vulnerability is in the `CustomToken` contract, specifically in the constructor function. The constructor sets the total supply of the token to a very large number and assigns all of it to the address `0xbabaf2036d6a6623328e0d3cd41fc5eb30cea25f`. This creates a single point of failure, as this address now has control over all the tokens in the contract. If this address is compromised or malicious, it can cause a denial of service by refusing to participate in any transactions, effectively rendering the contract useless.

Additionally, the `ifillArray` function in the `DosOneFunc` contract has the same vulnerability as in the first contract, allowing an attacker to fill up the `listAddresses` array and cause a denial of service.",denial of service,4.0,614.0,6.0,2.997344732284546
138,denial of service," Yes, the smart contract code is vulnerable to a denial-of-service attack. The vulnerability is in the `DosAuction` contract, which is the same as the previous code you provided. The `bid()` function calls `currentFrontrunner.send(currentBid)` without checking its return value, which can cause the contract to become unresponsive if the recipient address is a contract that contains a fallback function that uses up all the available gas or throws an exception. This can lead to a denial-of-service attack, making the contract unavailable for further use.

However, the `CustomToken` contract does not seem to have any obvious vulnerabilities related to denial-of-service attacks based on the provided code. It is a simple ERC20 token contract that initializes its state in the constructor.",denial of service,3.0,589.0,6.0,4.270849704742432
