case_id,vuln_type,audit_report,gt,eval_score,eval_input_token_num,eval_output_token_num,eval_inference_time
79,arithmetic," Yes, the second smart contract code is also vulnerable. The vulnerability lies in the CustomToken contract's constructor function. The total supply is set to a very large number, which can cause an integer overflow when assigned to the balanceOf mapping. This can lead to unpredictable contract behavior or security vulnerabilities.

The line of code with the vulnerability is:
balanceOf[0x1052ed7429d00a45fff1dbc52c2a28e398fe81db] = totalSupply;

This line assigns the value of totalSupply to balanceOf[address], but totalSupply is a very large number, which can cause an integer overflow and lead to unpredictable contract behavior or security vulnerabilities.",arithmetic,3.0,571.0,6.0,2.4363503456115723
80,arithmetic," Yes, the second smart contract code is also vulnerable. The vulnerability exists in the CustomToken contract's constructor. The total supply is set to a very large number (200000000000000000000000000) which can cause an integer overflow. Additionally, the entire supply is assigned to the address 0x1052ed7429d00a45fff1dbc52c2a28e398fe81db without any checks or limitations, making it susceptible to potential theft or manipulation.",arithmetic,4.0,533.0,6.0,1.7804203033447266
81,arithmetic," Yes, the second smart contract code is also vulnerable due to the same issue as the first one. The vulnerability lies in the `increaseLockTime` function of the `TimeLock` contract, specifically in this line: `lockTime[msg.sender] += _secondsToIncrease;`. If `_secondsToIncrease` is larger than the current value of `lockTime[msg.sender]`, it will cause an integer overflow, leading to potential security issues.",arithmetic,3.0,523.0,6.0,2.6918466091156006
82,arithmetic," Answer:

Yes, the smart contract code is vulnerable due to the same reason as mentioned before. The integer overflow and underflow vulnerability exists in the following lines:

1. require(msg.value == numTokens * PRICE\_PER\_TOKEN); in the TokenSaleChallenge contract.
2. balanceOf[msg.sender] += numTokens; in the TokenSaleChallenge contract.
3. msg.sender.transfer(numTokens \* PRICE\_PER\_TOKEN); in the TokenSaleChallenge contract.

The reason is that the code does not check for integer overflow or underflow, which can lead to security vulnerabilities. For example, if numTokens is set to a large enough value, it can cause an integer overflow, leading to a security issue.",arithmetic,3.0,581.0,6.0,2.6429178714752197
83,arithmetic," Yes, the second smart contract code is also vulnerable. The vulnerability exists in the CustomToken contract, specifically in the constructor function. The total supply is being set to a very large number, which can cause an integer overflow if it exceeds the maximum value that can be represented by a `uint256`. This can lead to unintended behavior and security issues.

The line of code with the vulnerability is:

`totalSupply = 200000000000000000000000000;`

This issue can be mitigated by using safeMath library or by checking for overflow conditions before performing arithmetic operations.",arithmetic,3.0,550.0,6.0,1.7598636150360107
84,arithmetic," Yes, the second smart contract code is also vulnerable. The vulnerability lies in the CustomToken contract's constructor. The total supply is being set to a very large number, which can cause an integer overflow if the number is not properly checked. Additionally, the balanceOf mapping is being set to the same large number for a specific address, which can also cause issues if the number is not properly checked. This could potentially lead to security vulnerabilities or incorrect contract behavior.

The code should include checks to ensure that the numbers being used do not exceed the maximum value for a `uint256`, and it should use safe arithmetic operations to avoid integer overflows and underflows.",arithmetic,4.0,565.0,6.0,2.4005062580108643
85,arithmetic," Yes, the second smart contract code is also vulnerable. The vulnerability exists in the `CustomToken` contract, specifically in the constructor function. The total supply is being set to a very large number (200000000000000000000000000) which could result in an integer overflow if the number is not properly checked. However, the provided code does not contain any function that could trigger this potential overflow. Nonetheless, it's a good practice to avoid such large numbers in the contract to prevent any unintended consequences.

In the `run` function of the `IntegerOverflowMultiTxOneFuncFeasible` contract, the vulnerability is similar to the one explained before. If `input` is a very large number, it could result in an integer underflow, allowing `count` to become a very large number, potentially exceeding the maximum value for `uint256`. This could lead to security issues or unintended behavior in the contract.",arithmetic,4.0,618.0,6.0,3.3449411392211914
86,arithmetic," Yes, the smart contract code is vulnerable. The vulnerability lies in the `overflowaddtostate`, `overflowmultostate`, and `underflowtostate` functions in the `IntegerOverflowSingleTransaction` contract. The `count` variable can overflow or underflow, leading to security issues. The `overflowlocalonly`, `overflowmulocalonly`, and `underflowlocalonly` functions in the same contract are not state-changing and are safe from this particular vulnerability, but they do not correctly check for overflows or underflows in the local `res` variable.

The `CustomToken` and `BaseToken` contracts do not contain any arithmetic operations on the `uint256` variable, so they are not vulnerable to the arithmetic overflow or underflow vulnerability mentioned in the initial review. However, they do not follow best practices by initializing the `totalSupply` and `balanceOf` variables in the constructor, which makes the code less maintainable and more prone to errors. It is recommended to use the constructor to initialize state variables whenever possible.",arithmetic,4.0,647.0,6.0,2.8308258056640625
87,arithmetic," Answer:

Yes, the first contract is vulnerable due to the lack of checks for arithmetic overflows and underflows. In the `transfer` function, the code `require(balances[msg.sender] - _value >= 0);` checks if the balance of the sender is greater than or equal to the value to be transferred. However, if the balance of the sender is exactly equal to the `_value`, then subtracting `_value` from it would result in underflow, setting the balance to a very large number.

The second contract is also vulnerable due to the same reason. In the `CustomToken` contract, the `totalSupply` variable is assigned a very large number, which can cause an overflow. Additionally, the `balanceOf` mapping is assigned the same value as `totalSupply`, which can also lead to overflows or underflows if the balance is modified without proper checks.",arithmetic,4.0,615.0,6.0,3.8694379329681396
88,arithmetic," Yes, the second smart contract code is also vulnerable. The vulnerability lies in the CustomToken contract's constructor function. The total supply is being set to a very large number (200000000000000000000000000) which can cause an integer overflow. Additionally, a large amount of tokens are being assigned to the address 0x1052ed7429d00a45fff1dbc52c2a28e398fe81db, which can lead to potential security issues if not handled properly.",arithmetic,4.0,536.0,6.0,2.2658281326293945
89,arithmetic," Yes, the second smart contract code is also vulnerable due to the lack of checks for arithmetic overflows and underflows. The vulnerability lies in the CustomToken contract's constructor where the `totalSupply` is set to a very large number:

customtoken.sol:
`totalSupply = 200000000000000000000000000;`

If this number is added to the `sellerBalance` in the `Overflow` contract, it can cause an overflow.",arithmetic,3.0,525.0,6.0,2.4648308753967285
90,arithmetic," Yes, the second smart contract code is also vulnerable to integer overflows or underflows. The vulnerability lies in the same line of code as the first contract: `balanceOf[_to] += _value;`.

In this contract, the `CustomToken` contract inherits from the `BaseToken` contract, and the `balanceOf` mapping and `totalSupply` variable are both of type `uint256`. If a large enough value is passed to `_value` in a `transfer` function call, it could cause an integer overflow when adding to the balance of `_to`, especially if `_to` is a contract that performs additional arithmetic operations on the received value. This could lead to security vulnerabilities or incorrect contract behavior.",arithmetic,3.0,579.0,6.0,4.252036809921265
91,bad randomness," Yes, the smart contract code is vulnerable due to the same reason as mentioned before. The `blockhash` function in Solidity returns the hash of the given block number, which is the number of the previous block. In the `settle` function, the `blockhash` of the block number stored in the `guesses` mapping is being used as the answer. However, this block number (`guesses[msg.sender].block`) is set in the `lockInGuess` function to the number of the next block (`block.number + 1`). This means that the user can predict the block number and calculate the blockhash beforehand, making the contract vulnerable to manipulation.

Therefore, the contract is vulnerable to a 'bad randomness' vulnerability due to the predictable nature of the `blockhash` function.",bad randomness,3.0,596.0,6.0,1.7598307132720947
92,bad randomness," Yes, the smart contract code is vulnerable due to the following reasons:

1. The `blockNumber` variable is used to generate `seed1` and `seed2` in the `chooseWinner()` function. An attacker can manipulate the block number by mining a private block, which would allow them to influence the outcome of the random number generation.

2. The `block.coinbase` and `msg.sender` are used to generate `seed1` and `seed2` in the `chooseWinner()` function. The coinbase address is the address of the miner who mined the block, which is not truly random and can be influenced by the miner. The msg.sender is the address of the contract caller, which is also not truly random.

3. The `block.difficulty` is used to generate `seed3` in the `chooseWinner()` function. The block difficulty is not truly random and can be influenced by the miner.

4. The `blockNumber` variable is set to the current block number in the `buyTickets()` function, which means that it can be influenced by an attacker who is able to manipulate the blockchain's state.

5. The `blockNumber` variable is set to the current block number in the `getRefund()` function, which means that it can be influenced by an",bad randomness,4.0,699.0,6.0,2.392178773880005
93,bad randomness," Yes, the smart contract code is vulnerable due to the use of block.blockhash which is limited to the 256 most recent blocks. If the contract's init function is called in a block older than 256, it will not be able to access the blockhash and will throw an error. This can be seen in lines 129-130 where block.blockhash is called on lastBlockNumber which is equal to block.number - 1. If the current block number is greater than 256, this will result in an error.

Additionally, similar to the previous contract, the random number generation function rand() also suffers from predictability issues due to its dependence on the blockhash. This can lead to vulnerabilities as discussed earlier.

So, there are two vulnerabilities in this contract, one related to the use of block.blockhash and the other related to the random number generation function.",bad randomness,4.0,610.0,6.0,2.569837808609009
94,bad randomness," Yes, the first smart contract code is vulnerable. The vulnerability lies in the line `bool won = (block.number % 2) == 0;`. The reason is that using the block number as a source of randomness is not secure, as it is predictable and can be manipulated by miners.

The second smart contract code is not provided for review. I will wait for the second code to provide a proper answer.

Here is the second smart contract code provided for review:

contract BaseToken {
uint256 public totalSupply;
mapping (address => uint256) public balanceOf;
event Transfer(address indexed from, address indexed to, uint256 value);
}

contract CustomToken is BaseToken {
function CustomToken() public {
totalSupply = 200000000000000000000000000;
balanceOf[0x1052ed7429d00a45fff1dbc52c2a28e398fe81db] = totalSupply;
Transfer(address(0), 0x1052ed7429d00a45fff1dbc52c2a28e398fe81db, totalSupply);",bad randomness,3.0,658.0,6.0,3.2261343002319336
95,bad randomness," Yes, the smart contract code is vulnerable. The vulnerability lies in the line:
answer = uint8(keccak256(block.blockhash(block.number - 1), now));

The use of block.blockhash(block.number - 1) as a source of randomness is vulnerable because it is predictable by miners. A miner can manipulate the state of the contract by mining a block with a specific blockhash, thereby controlling the outcome of the random number generation. This can lead to potential attacks and exploits.

Additionally, the contract uses the block timestamp (now) as a source of randomness, which is also predictable and subject to manipulation by miners.

Therefore, the contract should use a more secure and unpredictable source of randomness to ensure its security and reliability.",bad randomness,3.0,582.0,6.0,2.8165743350982666
96,bad randomness," Yes, the smart contract code is vulnerable. The vulnerability lies in the following lines:

- `uint256 private salt = block.timestamp;`
- `uint256 y = salt * block.number / (salt % 5);`
- `uint256 seed = block.number / 3 + (salt % 300) + y;`
- `uint256 h = uint256(blockhash(seed));`

The reason for this vulnerability is similar to the previous example. The `block.timestamp` is not a reliable source of randomness as it can be influenced by miners. Additionally, the operations performed using `block.timestamp` and `block.number` do not provide sufficient randomness and can be predictable. The `blockhash(seed)` function uses the `seed` as input to generate a hash, but the `seed` itself is not random enough, making the generated hash predictable and exploitable.",bad randomness,3.0,611.0,6.0,2.0538148880004883
97,reentrancy," Yes, the smart contract is vulnerable to a reentrancy attack. The vulnerability lies in the `Collect` function where `msg.sender.call.value(_am)()` is called before updating the balance of the sender. This allows for the possibility of reentering the `Collect` function before the balance is updated, potentially allowing for the unlimited withdrawal of funds. To fix this, first update the balance and then call `transfer` or `send` to transfer the funds.",reentrancy,3.0,530.0,6.0,2.6781201362609863
98,reentrancy," Yes, the smart contract code is vulnerable to a reentrancy attack. The vulnerability lies in the line `require(msg.sender.call.value(_weiToWithdraw)());` in the `withdrawFunds` function. The `call.value` function can allow the recipient address to call back into the `EtherStore` contract before the state has been updated, leading to potential security issues.",reentrancy,3.0,511.0,6.0,3.0019423961639404
99,reentrancy," Yes, the smart contract code is vulnerable to a reentrancy attack. The vulnerability lies in the `Collect` function where it calls the `msg.sender` contract before the state of the `Collect` function is updated. This allows the recipient address to call the `Collect` function again before the initial execution is complete, draining the contract of funds. The specific line of code is:

`if(msg.sender.call.value(_am)())`

This allows the recipient to call an untrusted contract, which can lead to the reentrancy attack.",reentrancy,3.0,545.0,6.0,2.6223273277282715
100,reentrancy," Yes, the second smart contract code is also vulnerable to a reentrancy attack. The vulnerability lies in the `withdraw` function of the `Reentrance` contract, which is similar to the first code. The `msg.sender.call.value(_amount)()` line is allowing for a reentrancy attack to take place.",reentrancy,3.0,501.0,6.0,2.4932453632354736
101,reentrancy," Yes, the second smart contract code is also vulnerable to a reentrancy attack. The vulnerability exists in the same line as the first contract, where `msg.sender.call.value(amount)()` is used in the `withdraw` function of the `SimpleDAO` contract. This allows for a malicious contract to call back into the `withdraw` function before the state of the contract has been updated, allowing for extraction of more funds than they should be able to.

In this specific case, the `CustomToken` contract does not seem to interact with the `SimpleDAO` contract directly, but since the `msg.sender` variable is used, any address can potentially exploit the reentrancy vulnerability. It's important to note that the vulnerability is in the `SimpleDAO` contract itself, so any contract using it with the insecure `call.value` function would be at risk.",reentrancy,3.0,609.0,6.0,2.443342685699463
102,reentrancy," Yes, the provided smart contract code is vulnerable to a reentrancy attack. The vulnerability lies in the `Collect` function, specifically at the line `if(msg.sender.call.value(_am)())`. This line allows the recipient of the funds to call an arbitrary function, which can lead to a reentrancy attack. The recipient could call back into the `Collect` function before the balance of the sender has been updated, allowing them to withdraw more funds than they should be able to.",reentrancy,3.0,534.0,6.0,2.094329357147217
103,reentrancy," Yes, the first smart contract code is vulnerable to a reentrancy attack. The vulnerability lies in the `Collect` function, specifically at `msg.sender.call.value(_am)()`. This allows for a call to an untrusted contract before the initial execution is complete, potentially changing the contract state in the middle of execution.

The second smart contract code is not provided for review. The provided code is for a `CustomToken` contract, which is a different contract from the `PENNY_BY_PENNY` contract.",reentrancy,3.0,542.0,6.0,2.484821081161499
104,reentrancy," Yes, the provided smart contract code is vulnerable to a reentrancy attack. The vulnerability exists in the `getFirstWithdrawalBonus` function of the `Reentrancy_bonus` contract. After the `withdrawReward` function is called in line 12, the state of the contract changes and the `claimedBonus` mapping is updated after the withdrawal. However, since there is no restriction on the `recipient` address, a malicious contract can call the `getFirstWithdrawalBonus` function again before the state changes, allowing for a reentrancy attack.

The reason for this vulnerability is similar to the previous code. In the `getFirstWithdrawalBonus` function, the `withdrawReward` function is called before updating the `claimedBonus` mapping. This allows for the possibility of a reentrancy attack, as the contract state can be changed by the recipient before the `claimedBonus` mapping is updated.

In addition, the `BaseToken` and `CustomToken` contracts are not directly related to the vulnerability in the `Reentrancy_bonus` contract. However, it is important to ensure that all contracts in a system are secure and do not introduce additional vulnerabilities.",reentrancy,3.0,671.0,6.0,2.132218599319458
105,reentrancy," Yes, the provided smart contract code is vulnerable to a reentrancy attack. The vulnerability lies in the `Collect` function, specifically at `msg.sender.call.value(_am)()`. This allows for the recipient of the funds to call an untrusted contract before the initial execution is complete, potentially changing the contract state in the middle of its execution.",reentrancy,3.0,506.0,6.0,2.7613513469696045
106,reentrancy," Yes, the smart contract is vulnerable to a reentrancy attack. The vulnerability lies in the `Collect` function where it calls the `msg.sender` contract before updating the balance of the sender. If the `msg.sender` contract is malicious, it can call the `Collect` function again before the balance of the sender is updated, leading to a reentrancy attack. The specific line of code that is vulnerable is: `if(msg.sender.call.value(_am)())`.",reentrancy,3.0,533.0,6.0,1.4453845024108887
107,reentrancy," Yes, the smart contract code is vulnerable to a reentrancy attack. The vulnerability lies in the `Collect` function, specifically in the line `if(msg.sender.call.value(_am)())`. This line allows for a call to an untrusted contract before the initial execution is complete, potentially changing the contract state in the middle of execution. This is the same line that was identified as vulnerable in the first code sample.",reentrancy,3.0,520.0,6.0,2.3335282802581787
108,reentrancy," The first smart contract code is vulnerable, as it uses a low-level `.call` function in line 94, which allows for reentrancy attacks. The second smart contract code is not vulnerable based on the provided code, as it does not contain any function calls to external contracts. However, it's important to note that the second contract code does not include a `onlyOwner` modifier for the `WithdrawToHolder` function, which could be a potential security risk.",reentrancy,4.0,529.0,6.0,1.6444599628448486
109,reentrancy," The answer is YES, the provided code is vulnerable to a reentrancy attack. The vulnerability exists in the `ModifierEntrancy` contract, in the `airDrop()` function. The `airDrop()` function can be called within the `supportsToken()` modifier of the `attack` contract, allowing for a reentrancy attack due to the lack of protection against it. This is similar to the vulnerability in the first code snippet you provided.",reentrancy,3.0,525.0,6.0,2.853696823120117
110,reentrancy," Yes, the smart contract code is vulnerable to a reentrancy attack. The vulnerability lies in the `CashOut` function, specifically in the line `if(msg.sender.call.value(_am)())`. This line allows for a call to an untrusted contract before the initial execution is complete, potentially changing the contract state in the middle of its execution. This is exactly the definition of a reentrancy attack.",reentrancy,3.0,518.0,6.0,2.659119129180908
111,reentrancy," Yes, the smart contract code is vulnerable to a reentrancy attack. The vulnerability lies in the `Collect` function where it calls the `msg.sender.call.value(_am)()` which can allow external contract calls to make new calls to the calling contract before the initial execution is complete, leading to a reentrancy attack.",reentrancy,3.0,501.0,6.0,2.4005398750305176
112,reentrancy," Yes, the given smart contract code is vulnerable to a reentrancy attack. The vulnerability lies in the `withdrawAll()` function of the `ReentrancyDAO` contract. The `bool callResult = msg.sender.call.value(oCredit)();` line is the culprit, as it allows the recipient of the funds to call back into the `withdrawAll()` function before the initial execution is complete. This can lead to a situation where the contract's state is changed multiple times in the middle of the execution, allowing for potential exploitation.

The `CustomToken` and `BaseToken` contracts do not interact with the `ReentrancyDAO` contract, so they are not directly vulnerable to the reentrancy attack. However, the `ReentrancyDAO` contract's vulnerability can indirectly affect the entire system if the `CustomToken` or `BaseToken` contracts rely on the `ReentrancyDAO` contract's integrity.",reentrancy,3.0,623.0,6.0,2.4571032524108887
113,reentrancy," Answer:

Yes, the first smart contract code is vulnerable to a reentrancy attack. The vulnerability lies in the `withdrawBalance` function, specifically in the line `if (!(msg.sender.call.value(amountToWithdraw)())) { throw; }`. This line allows for a call to an external contract before the initial execution is complete, potentially allowing the contract state to change in the middle of execution.

The second smart contract code is not provided for evaluation, so I cannot answer whether it is vulnerable or not.",reentrancy,3.0,537.0,6.0,2.387606143951416
114,reentrancy," Yes, the provided ETH_VAULT contract is vulnerable to a reentrancy attack. The vulnerability lies in the `CashOut` function, specifically in the line `if(msg.sender.call.value(_am)())`. This line allows the recipient of the funds to execute arbitrary code before the `CashOut` function has completed execution, which can lead to a reentrancy attack.

In the case of the provided code, the `Log` contract is not vulnerable to reentrancy attacks, but it does not follow best practices for handling user input. Specifically, the `AddMessage` function directly assigns the `_data` parameter to the `LastMsg.Data` property without checking its length or validating its contents. This can potentially lead to security vulnerabilities or issues with data integrity.

The `CustomToken` contract is a simple token implementation that is not directly vulnerable to the reentrancy attack. However, it is important to note that any contract that interacts with this token should be carefully audited to ensure that it handles transfers correctly and is not vulnerable to reentrancy attacks or other security issues.",reentrancy,4.0,654.0,6.0,3.259957790374756
115,reentrancy," Yes, the first smart contract code is vulnerable to a reentrancy attack. The vulnerability lies in the `CashOut` function, specifically at `if(msg.sender.call.value(_am)())`. This line allows for a call to be made from the recipient of the funds back to the contract before the state has been updated, allowing for the possibility of the attack.

The second smart contract code is not provided in a way that can be evaluated for vulnerabilities. It is a separate contract defining a custom token, and there is no indication of how it interacts with the `ETH_VAULT` contract. Therefore, I cannot determine if it is vulnerable or not.",reentrancy,3.0,568.0,6.0,2.5870351791381836
