case_id,vuln_type,audit_report,gt,eval_score,eval_input_token_num,eval_output_token_num,eval_inference_time
11,access control," The smart contract code is vulnerable. The vulnerability lies in the `CustomToken` contract, specifically in the `CustomToken` constructor function. The `CustomToken` contract is derived from `BaseToken` which does not have a `new` modifier or any other modifier that restricts who can call the constructor. This means that the `CustomToken` constructor function can be called by anyone, and the contract will be initialized with the specified total supply and assign it to the attacker's address. This is a clear access control vulnerability, as the contract's state is being modified by an unauthorized party. Additionally, the `CustomToken` constructor function is not marked as `payable`, so it cannot receive any ether, but it does not prevent the function from being called, which is an inconsistency in the contract's design.",access control,4.0,600.0,6.0,3.0133440494537354
12,access control," Answer:

Yes, the first contract code is vulnerable due to the'missing' function which does not have the 'onlyowner' modifier. This means that any address can call this function and set the 'owner' variable to their address.

The second contract code does not have the same vulnerability as the 'onlyowner' modifier is used correctly in the 'withdraw' function of the 'BaseToken' contract. However, it is important to note that the'missing' function from the first contract is not present in the second contract.

Therefore, the answer is:

Contract 1: Yes, because of the missing 'onlyowner' modifier in the'missing' function.
Contract 2: No.",access control,3.0,575.0,6.0,2.635716199874878
13,access control," The smart contract code is vulnerable. The vulnerability lies in the `changeOwner` function, which allows the current owner to transfer ownership to any address without any checks. This can lead to an access control issue, as any existing owner can give away ownership to an attacker. A potential fix would be to add a modifier to the `changeOwner` function to check if the caller is the current owner and if the new owner is a designated address.",access control,3.0,523.0,6.0,2.6995670795440674
14,access control," Answer:

NO, the second code snippet is not vulnerable to the 'access control' vulnerability.

The 'access control' vulnerability in the first code snippet exists because the 'withdraw' function does not check if the sender has sufficient balance before allowing them to withdraw funds. This can allow an attacker to withdraw more funds than they have in their balance. However, the second code snippet does not contain a 'withdraw' function, so it cannot have this vulnerability.

However, I would like to point out that the 'CustomToken' contract in the second code snippet has a potential vulnerability. The 'totalSupply' and 'balanceOf' variables should be initialized in the constructor function, not in the contract definition. This is because the contract definition is executed only once when the contract is deployed, while the constructor function is executed every time a new instance of the contract is created. Therefore, in the current implementation, all instances of the 'CustomToken' contract will have the same balance, which may not be the desired behavior.",access control,2.0,638.0,6.0,2.4001705646514893
15,access control," Answer:

NO, the second code snippet is not vulnerable to the 'access control' vulnerability. The first code snippet is vulnerable because the constructor function 'IamMissing()' should be declared with the constructor keyword, which was introduced in Solidity version 0.4.22. In the second code snippet, the 'IamMissing()' function is not a constructor function, but a fallback function, which is not vulnerable to the 'access control' vulnerability. However, the 'IamMissing()' function should still be renamed to 'Missing()' and declared with the constructor keyword to avoid confusion.

The 'CustomToken' contract inherits from the 'BaseToken' contract and initializes the 'totalSupply' and 'balanceOf' variables in the constructor function. The 'owner' variable in the 'Missing' contract is initialized in the 'IamMissing()' function, which is not a constructor function. Therefore, the 'owner' variable is not initialized properly, and the 'onlyowner' modifier may not work as intended.

Moreover, the 'Missing' contract has a fallback function that allows anyone to send ether to the contract. However, there is no functionality to withdraw or use the ether sent to the contract.

Therefore, while the 'Missing' contract is not vulnerable to the 'access control' vulnerability, it still has some issues that need to",access control,2.0,705.0,6.0,3.1740167140960693
16,access control," No, the second smart contract code is not vulnerable to the 'access control' vulnerability type. The `withdraw` function in the `Map` contract correctly checks if the msg.sender is the owner before performing the transfer operation. However, it is always recommended to use the latest version of Solidity and implement more secure patterns for access control, such as using OpenZeppelin's library.

Regarding the `CustomToken` contract, it is a separate contract that does not inherit from the `Map` contract, and it does not have any access control vulnerabilities in the provided code. However, it is a simple implementation of a token contract and should be thoroughly tested and audited before deployment.",access control,3.0,569.0,6.0,2.571530342102051
17,access control," Yes, the provided code is vulnerable to access control issues. The 'forward' function in the Proxy contract uses 'delegatecall' to execute the code of the 'callee' contract. This means that the 'callee' contract can modify the state of the Proxy contract, including its access control settings. If the 'callee' contract is untrusted, this could lead to an access control bypass vulnerability. In this case, the 'CustomToken' contract is not checked for access control, so any function in 'CustomToken' that modifies the contract state could be called by an attacker through the 'forward' function in the 'Proxy' contract.",access control,4.0,563.0,6.0,3.4004287719726562
18,access control," NO, the provided code for the `Wallet` contract does not have the same access control vulnerability as the original code. However, it is important to note that the `Wallet` contract does not have any functionality for granting access to its functions, so any user who interacts with the contract can call its functions without restriction.

The `CustomToken` contract, on the other hand, has its own set of vulnerabilities. Specifically, the contract's constructor function initializes the total supply of tokens and assigns them all to a single address without any checks or restrictions. This could allow a malicious user to gain control of all the tokens in the contract. Additionally, the contract does not have any functionality for transferring tokens or adding new users, so it is limited in its usefulness.",access control,2.0,586.0,6.0,2.96232008934021
19,access control," Answer:

NO, the second contract code you provided is not vulnerable to the 'access control' vulnerability. The first contract code was vulnerable because it used a constructor function without the same name as the contract, which could allow the contract to be initialized with the wrong address as the owner. However, the second contract code initializes the owner variable correctly in the constructor function with the same name as the contract. Therefore, it does not have the 'access control' vulnerability.

However, I would like to point out that the second contract code has other potential issues. The first contract code was missing the `payable` keyword in the constructor function, which could prevent the contract from receiving ether. The second contract code includes a fallback function that can receive ether, but it does not have any logic to handle incoming ether. This could lead to unintended behavior or vulnerabilities. Additionally, the `totalSupply` variable is set to a large value in the `CustomToken` constructor, which could lead to unintended consequences or make the contract a target for attacks. It is generally recommended to initialize variables to reasonable values and to include logic in the fallback function to handle incoming ether.",access control,2.0,665.0,6.0,2.7678287029266357
20,access control," Yes, the first smart contract code is vulnerable due to an access control issue. The `initWallet` function sets the `creator` variable to the message sender without any checks, allowing any caller to become the contract creator.

The second smart contract code does not contain the `initWallet` function, so it is not vulnerable to the same access control issue. However, it does have other potential issues, such as the unchecked creation of tokens in the `CustomToken` constructor.",access control,4.0,530.0,6.0,3.930025577545166
21,access control," Yes, the second smart contract code is also vulnerable. The vulnerability exists in the `sendTo` function of `MyContract` contract, which uses `tx.origin` for access control. This is insecure because `tx.origin` returns the original address that started the transaction, not the immediate caller of the function. In this case, if `MyContract` is called by an intermediate contract, the `sendTo` function will still allow the transaction even if it wasn't initiated by the owner. This can lead to an access control vulnerability.

To fix this vulnerability, it is recommended to use `msg.sender` instead of `tx.origin` to check the immediate caller of the function.",access control,3.0,571.0,6.0,4.626642227172852
22,access control," NO, the second smart contract code is not vulnerable to the 'access control' vulnerability type. The 'transfer' function in the 'Wallet' contract checks the msg.sender's balance before transferring funds, and the'migrateTo' function checks if the msg.sender is the creator of the contract before transferring the balance. However, it is still recommended to perform a full audit to check for other potential vulnerabilities.",access control,1.0,515.0,6.0,2.497006416320801
23,access control," Yes, the second smart contract code is also vulnerable due to access control issues. The `SimpleSuicide` contract's `suicideAnyone()` function allows any caller to destroy the contract using `selfdestruct(msg.sender)`. This is a potential security risk as any user who interacts with the `CustomToken` contract can unintentionally or maliciously trigger the destruction of the `SimpleSuicide` contract. To mitigate this risk, it is recommended to restrict the `suicideAnyone()` function to be callable only by the contract owner or a privileged address.",access control,3.0,546.0,6.0,2.6765265464782715
24,access control," Answer:

NO.

The contract `Unprotected` has an `onlyowner` modifier that is used in the `changeOwner` function, but the modifier is not applied to the constructor function. This means that the owner address is not being set securely. However, this is not the 'access control' vulnerability as described in the question.

The `CustomToken` contract does not inherit from the `Unprotected` contract, so it is not affected by the vulnerability in the `Unprotected` contract.

Therefore, the `CustomToken` contract is not vulnerable to the 'access control' vulnerability.",access control,2.0,554.0,6.0,1.909156084060669
25,access control," Yes, the second smart contract code is also vulnerable. The vulnerability exists in the `Phishable` contract, which is identical to the previous code. The `withdrawAll` function uses `tx.origin` for access control, which is insecure and can be bypassed. This allows an attacker to call the function even if they are not the intended owner. The `CustomToken` contract is unrelated to the vulnerability in the `Phishable` contract.",access control,3.0,524.0,6.0,2.219581365585327
26,access control," Yes, the smart contract code is vulnerable due to access control issues. The vulnerability lies in lines 18 and 25 where `delegatecall` is used. This allows the called contract (in this case `fibonacciLibrary`) to modify the state of the calling contract (`FibonacciBalance`), including calling its functions. Since there is no check on who can call the fallback function of `FibonacciBalance` or what functions of `fibonacciLibrary` can be called, any address can call any function of `fibonacciLibrary` using `FibonacciBalance` as a proxy, potentially leading to unauthorized actions.

To mitigate this issue, you should implement specific functions in `FibonacciBalance` that define what actions can be taken through `fibonacciLibrary`, and restrict the fallback function to only call the appropriate function(s) in `fibonacciLibrary`. Additionally, consider using `call` instead of `delegatecall` if the intent is to only execute functions of `fibonacciLibrary` without affecting the state of `FibonacciBalance`.",access control,4.0,644.0,6.0,2.19372296333313
27,unchecked low level calls," Yes, the provided code is vulnerable due to the same reason as the previous one. The vulnerability lies in the line 32 of the `Command` function in the `Pie` contract, where it uses the low-level `call.value()` function without checking its return value:

```solidity
adr.call.value(msg.value)(data);
```

This can potentially lead to fail-opens and other unwanted outcomes if the external contract call fails. The rest of the code, which is a separate `CustomToken` contract, is not directly related to the vulnerability in the `Pie` contract.",unchecked low level calls,3.0,554.0,6.0,2.775386095046997
28,unchecked low level calls," Yes, the smart contract code is vulnerable. The vulnerability lies in the `withdraw` function:

`function withdraw(uint256 _amount) onlyOwner returns (bool result) {`
`uint256 balance;`
`balance = this.balance;`
`if(_amount > 0) balance = _amount;`
`owner.send(balance);`
`return true;`
`}`

The `owner.send(balance)` call does not check the return value, which can cause the contract to continue executing even if the `send` call fails. This can lead to the contract failing to withdraw the correct amount or failing to withdraw at all.",unchecked low level calls,3.0,563.0,6.0,5.4555134773254395
29,unchecked low level calls," Yes, the provided smart contract code is vulnerable. The vulnerability lies in the `Command` function of the `Freebie` contract, which calls an external contract using the low-level `call.value` function without checking its return value. If the called contract throws an exception, the execution will continue, potentially causing unwanted outcomes. The same vulnerability exists in the original code, making it a deeper issue in the codebase.",unchecked low level calls,3.0,520.0,6.0,1.9348766803741455
30,unchecked low level calls," Yes, the smart contract code is vulnerable. The vulnerability lies in lines 135, 141, and 147 where `send()` is used without checking its return value. If the call to `send()` fails, the contract will continue executing, potentially leaving the contract in an inconsistent state. This is the same vulnerability as in the first contract.",unchecked low level calls,3.0,506.0,6.0,2.5074682235717773
31,unchecked low level calls," Yes, the provided smart contract code is vulnerable to the same issue as the previous code. The vulnerability lies in the following line in the `airPort` contract:

`caddress.call(id, from, _tos[i], v);`

The use of the low-level `call` function without checking its return value can lead to fail-opens and other unwanted outcomes if the call to `caddress` fails. This vulnerability is the same as the one in the previous code, hence the given code is also vulnerable.",unchecked low level calls,3.0,540.0,6.0,3.7774105072021484
32,unchecked low level calls," Yes, the given code is vulnerable to the same issue as the previous code. The vulnerability lies in the lines 109 and 141, where `send` function is used without checking its return value. If the call to `send` fails, the execution will continue, potentially leading to unwanted outcomes.

The reason this is a vulnerability is that if the `send` function fails, it will return false, but the code will not handle this situation and will continue to execute. This can lead to a situation where the contract continues as if the funds were transferred, even though they were not. This can cause issues with the contract's state and can lead to security vulnerabilities.

Therefore, it is important to always check the return value of `send` and handle the situation appropriately if it returns false. This can be done by wrapping the `send` function in a require statement or using an if statement to check its return value.",unchecked low level calls,3.0,622.0,6.0,2.6625068187713623
33,unchecked low level calls," Yes, the second smart contract code is also vulnerable. The vulnerability exists in the `callnotchecked` function of the `ReturnValue` contract, which is similar to the vulnerability in the first code. The `callee.call()` function call is not checked for any errors, so if the call to `callee` fails, the contract will continue to execute, potentially leading to unwanted outcomes.

The `callnotchecked` function should include a check for the success or failure of the `callee.call()` function, for example:
```scss
function callnotchecked(address callee) public {
  (bool success, ) = callee.call("""");
  require(success, ""Call failed"");
}
```
This will ensure that the contract execution stops if the `callee.call()` function fails.",unchecked low level calls,3.0,593.0,6.0,2.5606637001037598
34,unchecked low level calls," Yes, the provided code is vulnerable to the same issue as the previous code. The vulnerability lies in the line:

`contract_address.call(id, msg.sender, tos[i], vs[i]);`

in the `transfer` function of the `AirDropContract` contract. The issue is that the code continues to run without checking the return value of the low-level `call` function. If the call to `contract_address` fails, the code will continue to execute, potentially leading to unwanted outcomes.

In addition, the code is missing a check for the length of the `tos` and `vs` arrays in the `transfer` function. This could lead to an out-of-bounds error if the arrays are not the same length.

It is also worth noting that the `BaseToken` and `CustomToken` contracts do not appear to be directly related to the vulnerability in the `AirDropContract` contract. However, they do have some potential issues. For example, the `CustomToken` constructor sets the total supply to a very large number, which could potentially lead to issues with gas costs or other unintended consequences. It is generally a good practice to initialize variables in the constructor with reasonable values.",unchecked low level calls,4.0,678.0,6.0,3.916447877883911
35,unchecked low level calls," NO, the provided code for the CustomToken contract does not contain the vulnerability related to low-level calls and unchecked return values as in the initial code. The CustomToken contract does not use any low-level functions like call(), callcode(), delegatecall(), or send(). It only uses the high-level function transfer, which automatically propagates errors and bubbles up. Therefore, it does not have the same vulnerability as the initial code.

However, it is essential to note that the Pie contract still contains the vulnerability, as it uses the low-level function call.value() without checking the return value.",unchecked low level calls,4.0,553.0,6.0,2.117893934249878
36,unchecked low level calls," Yes, the provided smart contract code is vulnerable due to the unchecked low-level calls. Specifically, in the `WithdrawToken` function of the `Token` contract, the `token.call` function is used without checking its return value. This can lead to the same issues as described in the initial review. The same vulnerability exists in the `TokenBank` contract's `WithdrawToHolder` function with `_addr.call.value(_wei)`.

The potential vulnerabilities are in lines 19, 44, and 97:

1. `token.call(bytes4(sha3(""transfer(address,uint256)"")),to,amount);` in the `WithdrawToken` function of the `Token` contract.
2. `_addr.call.value(_wei)` in the `WithdrawToHolder` function of the `TokenBank` contract.",unchecked low level calls,3.0,601.0,6.0,2.723539113998413
37,unchecked low level calls," Yes, the provided code is vulnerable to the same issue as the previous one. The line `contract_address.call(""register"", ""CentraToken"");` is an unchecked low-level call that could potentially allow the contract at `contract_address` to execute arbitrary code. If the call to `register` function fails or causes an error, the execution will continue instead of halting or propagating the error. This could lead to unexpected behavior or potential security vulnerabilities.",unchecked low level calls,3.0,528.0,6.0,2.640401840209961
38,unchecked low level calls," Yes, the provided smart contract code is vulnerable due to the unchecked return value of the low-level call function. In the `WithdrawToken` function of the `Token` contract, the `token.call` function is used without checking its return value.

In line 44: `token.call(bytes4(sha3(""transfer(address,uint256)"")),to,amount);`

If the call to the `transfer` function fails, the contract will continue executing, potentially leading to unwanted outcomes. This is the same vulnerability as in the first code snippet.",unchecked low level calls,3.0,546.0,6.0,2.3812544345855713
39,unchecked low level calls," Yes, the smart contract code is vulnerable. The vulnerability lies in the following lines:

- 69, 71, 73, 75: `extra[x].call.value(_share).gas(800000)();`

The `call.value()` function can fail, and if it does, the contract will continue executing, leading to potential issues. The contract should check the return value of this function to ensure it has succeeded before proceeding.",unchecked low level calls,3.0,525.0,6.0,1.5534968376159668
40,unchecked low level calls," Yes, the contract is vulnerable due to the unchecked return value of the low-level call function. In the `execute` function of the `Owned` contract, the result of the `_dst.call.value(_value)(_data)` is not checked for success or failure. If the call fails, the contract will continue executing, potentially leading to unexpected results or security vulnerabilities.

Here is the vulnerable code:

```solidity
function execute(address _dst, uint _value, bytes _data) onlyOwner {
    _dst.call.value(_value)(_data);
}
```

To fix this vulnerability, you should check the return value of the low-level call and handle failures appropriately. For example:

```solidity
function execute(address _dst, uint _value, bytes _data) onlyOwner {
    bool success = _dst.call.value(_value)(_data);
    require(success, ""Low-level call failed"");
}
```

This way, if the low-level call fails, the contract will stop executing and the `require` statement will trigger an exception, making it more secure and predictable.",unchecked low level calls,3.0,653.0,6.0,2.9410266876220703
41,unchecked low level calls," Yes, the provided code is vulnerable based on the 'unchecked low level calls' vulnerability type mentioned in the prompt. The vulnerability lies in the `execute` function of the `Owned` contract, which calls an external contract using the low-level `call.value()` function without checking its return value. If the external contract call fails, the code will continue to execute, potentially leading to unwanted outcomes. The specific lines of code are:

```solidity
function execute(address _dst, uint _value, bytes _data) onlyOwner {
    _dst.call.value(_value)(_data);
}
```

To fix this vulnerability, it is recommended to check the return value of the low-level call and handle any failures appropriately. For example:

```solidity
function execute(address _dst, uint _value, bytes _data) onlyOwner {
    bool success = _dst.call.value(_value)(_data);
    require(success, ""Low-level call failed"");
}
```",unchecked low level calls,3.0,630.0,6.0,2.0926005840301514
42,unchecked low level calls," Yes, the provided code is vulnerable due to the unchecked return value of the `adr.call.value(msg.value)(data)` function call in the `Command` function. If the call to `adr` fails, the code will continue to execute, potentially allowing for fail-open scenarios. The code should include a check of the return value to ensure the call succeeded before continuing.

Here is the relevant section of the code with an added check for the return value:

```solidity
function Command(address adr, bytes data)
    payable
    public
{
    require(msg.sender == Owner);
    bool success = adr.call.value(msg.value)(data);
    require(success, ""Call to address failed"");
}
```

In this revised code, the function call to `adr` returns a boolean value that indicates whether the call succeeded or not. The `require` statement checks this value and, if it is `false`, the transaction is reverted with the message ""Call to address failed"".",unchecked low level calls,3.0,633.0,6.0,3.6117684841156006
