case_id,vuln_type,audit_report,gt,eval_score,eval_input_token_num,eval_output_token_num,eval_inference_time
116,reentrancy," Yes, the provided WALLET contract is vulnerable to a reentrancy attack. The vulnerability lies in the `Collect` function, specifically at `if(msg.sender.call.value(_am)())`. This line allows for a call to an untrusted contract before the initial execution is complete, potentially changing the contract state in the middle of execution. This can lead to the unauthorized transfer of funds, as seen in the infamous Ethereum DAO attack.

To mitigate this vulnerability, consider using the ""checks-effects-interactions"" pattern. In this pattern, you first perform checks (e.g., ensuring the balance is sufficient), then apply the effects (e.g., updating the balance), and finally interact with other contracts. By following this pattern, you can help ensure that the contract state is not altered before the initial execution is complete.

In the provided code, you can replace the `if(msg.sender.call.value(_am)())` line with the following:

```solidity
address(msg.sender).transfer(_am);
```

This line uses the built-in `transfer` function, which automatically checks for sufficient balance and handles exceptions, making it safer against reentrancy attacks. However, note that using `transfer` limits the gas available for the called contract, so if the called contract requires more gas, you may need to use",reentrancy,4.0,699.0,6.0,3.5119619369506836
117,reentrancy," Yes, the second smart contract code is also vulnerable to a reentrancy attack. The vulnerability lies in the `withdrawBalance()` function of the `Reentrancy_cross_function` contract, which is similar to the first contract. The `call.value()` function allows the recipient to execute arbitrary code, which can include calling the `withdrawBalance()` function again before the initial execution is complete, leading to a reentrancy attack. The `CustomToken` contract is not directly related to the vulnerability, but it is an insecure way of creating a token with a large supply and assigning it all to a single address in the constructor function.",reentrancy,4.0,562.0,6.0,2.8117878437042236
118,reentrancy," Yes, the second smart contract code is also vulnerable to a reentrancy attack. The vulnerability lies in the `withdrawBalance()` function of the `Reentrance` contract, which is similar to the previous code. The `call.value()` function call made in this function can allow an attacker to recursively call the `withdrawBalance()` function before the initial execution is complete, leading to a reentrancy attack.

To mitigate this vulnerability, the `withdrawBalance()` function should follow the ""checks-effects-interactions"" pattern, where all state changes are made before any external calls are made. This can prevent an attacker from manipulating the contract state during the execution of the function.",reentrancy,3.0,570.0,6.0,2.4100773334503174
119,reentrancy," Yes, the smart contract code is vulnerable to a reentrancy attack. The vulnerability lies in the `CashOut` function where it uses `msg.sender.call.value(_am)()`. This allows for a call to an external contract before the initial execution is complete, allowing the state of the contract to change in the middle of its execution. This is the same vulnerability present in the first code snippet you provided.",reentrancy,3.0,518.0,6.0,2.18794846534729
120,reentrancy," Yes, the provided Smart Contract code is vulnerable to Reentrancy Attack. The vulnerability lies in the `CashOut` function where it uses `msg.sender.call.value(_am)()` which allows external contract calls to make new calls to the calling contract before the initial execution is complete. This can lead to the state of the contract being changed in the middle of its execution, allowing for a Reentrancy Attack.

In addition, the `CashOut` function does not check the return value of `msg.sender.call.value(_am)()`, which can lead to vulnerabilities if the call fails.

The code should be updated to use the `transfer` function or the Checks-Effects-Interactions pattern to prevent Reentrancy Attacks.",reentrancy,4.0,582.0,6.0,2.1532845497131348
121,reentrancy," Yes, the provided smart contract code is vulnerable to a reentrancy attack. The vulnerability lies in the `Collect` function where it calls the `msg.sender` contract before the state of the current contract has been updated. This allows for the `msg.sender` contract to call back into the `Collect` function, creating a reentrancy attack. This is similar to the line 54 in the first code snippet provided.",reentrancy,3.0,521.0,6.0,2.954357624053955
122,reentrancy," Yes, the provided Smart Contract code is vulnerable to a Reentrancy attack. The vulnerability lies in the `CashOut` function where it uses `msg.sender.call.value(_am)()` which allows for an external contract call before the initial execution is complete. This means that the contract state may change in the middle of its execution as a result of a call to an untrusted contract, which is the definition of a Reentrancy attack.

In addition, the `CashOut` function should have the `payable` keyword before the parentheses, like this: `function CashOut(uint _am) public payable {...}`. This is because the function is receiving ether, and without the `payable` keyword, it will throw an error.

The `Deposit` function also has a potential issue. It increases the balance of the sender before checking if the transaction was successful. If the `TransferLog.AddMessage` function call fails, the balance of the sender will still be increased. It would be better to check if the transaction was successful before updating the balance.

The `Log` contract also has an issue. The `AddMessage` function sets the `LastMsg` struct with the current time and other data, but it does not reset the struct after pushing it to the `History` array. This means that the `LastMsg` struct will contain the data of the",reentrancy,4.0,713.0,6.0,2.112725257873535
123,reentrancy," Yes, the smart contract is vulnerable to a reentrancy attack. The vulnerability lies in the `Collect` function, specifically in the line `if(msg.sender.call.value(_am)())`. This line allows for a call to an untrusted contract before the initial execution is complete, potentially changing the contract state in the middle of execution. This is the same line that was identified as vulnerable in the first code sample, and the same steps can be taken to remediate the vulnerability, such as using the `transfer` function instead of `call` or implementing a reentrancy guard.",reentrancy,3.0,553.0,6.0,2.3414196968078613
124,reentrancy," Yes, the provided Smart Contract code is vulnerable to Reentrancy Attack. The vulnerability lies in the `CashOut` function where it uses `msg.sender.call.value(_am)()` which allows external contract calls to make new calls to the calling contract before the initial execution is complete. This can lead to the state of the contract being changed in the middle of its execution, allowing for a Reentrancy Attack.

In addition, the `CashOut` function does not check the return value of the `call` function, which can lead to additional vulnerabilities. It is recommended to use the `transfer` function or the Checks-Effects-Interactions pattern to prevent such vulnerabilities.",reentrancy,4.0,570.0,6.0,2.6426548957824707
125,reentrancy," Yes, the smart contract code is vulnerable to a reentrancy attack. The vulnerability lies in the `Collect` function where it calls the `msg.sender` contract before the state of the `Collect` function is updated. This allows the called contract to call back into the `Collect` function creating an infinite loop and draining the contract of funds. The `msg.sender.call.value(_am)()` line is the issue.",reentrancy,3.0,520.0,6.0,2.2864749431610107
126,reentrancy," Answer:

Yes, the second smart contract code is also vulnerable to a reentrancy attack. The vulnerability exists in the `Reentrancy_insecure` contract, which is identical to the first contract provided. The `withdrawBalance()` function in this contract is not protected against reentrancy attacks, as it first sends Ether to the caller and then updates the balance. This allows for the possibility of reentrancy, where the caller calls the `withdrawBalance()` function again before the balance has been updated, leading to potential security issues.

The vulnerability lies in the following lines:
```solidity
(bool success, ) = msg.sender.call.value(amountToWithdraw)("""");
require(success);
userBalances[msg.sender] = 0;
```
To fix this vulnerability, you can follow the ""Checks-Effects-Interactions"" pattern, where you perform checks (like requiring `success`), update the state (set the balance to 0), and then interact with other contracts (send Ether). This ensures that the state is updated before any external calls are made.",reentrancy,3.0,647.0,6.0,2.8499200344085693
127,time manipulation," Yes, the provided code is vulnerable to timestamp manipulation. The contract TimedCrowdsale relies solely on the block timestamp to determine if the sale has finished, which can be manipulated by the miner. This means that the miner could potentially set the block timestamp to a value before 1546300800, allowing the sale to continue even after it should have finished.

The second contract, CustomToken, is not directly vulnerable to timestamp manipulation as it does not use block.timestamp in its current state. However, it's essential to ensure that any contracts interacting with CustomToken, especially if they use block.timestamp, are secured against timestamp manipulation.",time manipulation,4.0,560.0,6.0,3.1890482902526855
128,time manipulation," Yes, the smart contract code is vulnerable to time manipulation. The vulnerability lies in the following lines:

- if ( rand> 0 && now - rand > 24 hours ) in the payOut function (line 5).
- return block.timestamp; in the randomGen function (line 17).

The contract uses block.timestamp for generating random numbers and checking the time difference, which can be manipulated by miners. This can lead to security issues and unpredictable behavior in the contract.",time manipulation,3.0,530.0,6.0,2.456033706665039
129,time manipulation," Yes, the first contract (Governmental) is vulnerable to time manipulation. The `lastInvestmentTimestamp` variable is set to `block.timestamp` in the `invest` function, and then used in the `resetInvestment` function to check if one minute has passed since the last investment. A malicious miner could manipulate the block timestamp to be earlier than it actually is, allowing them to call the `resetInvestment` function before the required minute has passed.

The second contract (CustomToken) is not vulnerable to time manipulation in the provided code. It does not use `block.timestamp` or any other time-dependent functionality. However, it is important to note that the contract's constructor sets the balance of the `0x1052ed7429d00a45fff1dbc52c2a28e398fe81db` address to the total supply, which could potentially be a security issue depending on the use case of the contract.",time manipulation,4.0,623.0,6.0,2.751610517501831
130,time manipulation," The answer is: YES.

The vulnerability lies in the fact that the contract Roulette relies on the current block time (now) to be different from the pastBlockTime. However, there is no guarantee that the next block will not have the same or a very close timestamp to the current one. This is because the miner of the block can set the timestamp with some flexibility, potentially allowing for time manipulation attacks.

In this case, an attacker could potentially manipulate the time to make the contract send them ether in a way that is not intended by the contract creator. This is the same vulnerability as in the first contract provided.",time manipulation,3.0,558.0,6.0,2.744391918182373
131,time manipulation," Yes, the smart contract code is vulnerable. The vulnerability lies in the line 21 of the CustomToken contract: `totalSupply = 200000000000000000000000000;`. This number is too large and will cause an integer overflow in Solidity versions prior to 0.8.0. This can lead to security vulnerabilities and unpredictable contract behavior.",time manipulation,2.0,507.0,6.0,2.9687509536743164
132,short addresses," Answer:

Yes, the first smart contract code is vulnerable to a short address attack. The vulnerability lies in the use of tx.origin in line 7: balances[tx.origin] = 10000. This makes the contract susceptible to attacks where an attacker creates a contract with a fallback function that calls the sendCoin function of this contract. The tx.origin will point to the attacker's contract, allowing the attacker to bypass the access control.

The second smart contract code, on the other hand, is not vulnerable to short address attacks. However, it is important to note that the BaseToken and CustomToken contracts do not have any access control mechanisms in place. Therefore, any contract can access and modify the balanceOf mapping. It is recommended to add modifier functions to restrict access to certain functions.",short addresses,4.0,593.0,6.0,2.029054641723633
133,denial of service," Yes, the smart contract code is vulnerable to a denial of service attack. The vulnerability lies in the `emptyCreditors` function where the `creditorAddresses` array is reset when its length exceeds 1500. This can be exploited by an attacker to repeatedly call the `addCreditors` function, adding large numbers of addresses to the array until it exceeds the limit and is reset. This can cause the contract to become unresponsive and deny service to legitimate users. The 'CustomToken' contract is not directly related to this vulnerability, but it is an example of a contract with insecure practices, such as assigning a huge total supply value in the constructor.",denial of service,4.0,568.0,6.0,1.9304404258728027
134,denial of service," Yes, the smart contract code is vulnerable to a denial-of-service (DoS) attack. The vulnerability lies in the `insertNnumbers` function, specifically in the section where the array's length is increased by 1 (lines 18-21). This section of code does not adequately address the potential for a DoS attack because it does not properly check for array bounds. An attacker could potentially insert a large number in the `numbers` parameter, causing the function to iterate many times and consume excessive gas, leading to a denial-of-service attack.

Additionally, the `clear` and `clearDOS` functions have a requirement that `numElements` must be greater than 1500. This requirement does not provide any meaningful protection against a DoS attack, as an attacker could still insert a large number of elements into the array, causing the function to consume excessive gas.

Furthermore, the `CustomToken` contract is not directly related to the `DosNumber` contract, but it is vulnerable to a potential DoS attack due to the unlimited supply of tokens that can be created in the constructor function. This could lead to a potential denial-of-service attack on the Ethereum network as a whole, as the network would have to process an excessive number of transactions to handle the creation of such a large number of tokens.",denial of service,4.0,700.0,6.0,3.4205543994903564
135,denial of service," Yes, the smart contract code is vulnerable to denial of service attacks. The vulnerability lies in lines 68-70:

```
creditorAddresses = new address[](0);
creditorAmounts = new uint[](0);
round = 1;
```

These lines are executed every time the `lendGovernmentMoney` function is called, even if the condition `lastTimeOfNewCredit + TWELVE_HOURS < block.timestamp` is not met. This will reset the `creditorAddresses` and `creditorAmounts` arrays, effectively erasing all previous data. An attacker could repeatedly call this function to cause a denial of service by deleting the contract's data.

To fix this vulnerability, the lines of code that reset the `creditorAddresses` and `creditorAmounts` arrays should be placed inside the `if` statement, so that they are only executed when the condition is met. Additionally, it is recommended to use the `delete` keyword instead of reinitializing the arrays, as it will free up the memory used by the arrays. The fixed code would look like this:

```
if (lastTimeOfNewCredit + TWELVE_HOURS < block.timestamp) {
    //...
    delete creditorAddresses;
    delete",denial of service,3.0,687.0,6.0,2.287917137145996
136,denial of service," Yes, the smart contract code is vulnerable to a denial-of-service attack. The vulnerability is present in the `refundAll` function of the `Refunder` contract. The function iterates over all the addresses in the `refundAddresses` array and sends ether from the contract to each address using the `send` function. If a call to `send` fails for any reason (for example, if the recipient address is a contract that throws an exception), the `require` statement in the `refundAll` function will revert the entire transaction, and no further addresses in the array will be processed. This means that an attacker can deny service to all other addresses in the array by causing a single call to `refundAll` to fail.

The vulnerability is similar to the one in the original code provided. The `send` function can throw an exception for various reasons, such as if the recipient contract has run out of gas or if it explicitly throws an exception. By using a malicious contract as one of the addresses in the `refundAddresses` array, an attacker can cause the `refundAll` function to fail and deny service to all other addresses.

To fix this vulnerability, the `refundAll` function should use a pattern such as the following:

```
function refundAll() public {
    for (uint x = 0; x < refund",denial of service,3.0,708.0,6.0,2.555293560028076
137,denial of service," Yes, the second smart contract code is also vulnerable to denial of service attack. The vulnerability lies in the same line 18 of the `DosOneFunc` contract: `listAddresses.push(msg.sender);`

The reason is that this function does not have any restrictions on who can call it and how many times it can be called. An attacker can repeatedly call this function, adding millions of addresses to the array, causing it to grow very large. This could result in out-of-gas errors for other users trying to interact with the contract, effectively denying them service.

Additionally, the `CustomToken` contract in the same code does not have any vulnerabilities related to denial of service attacks. However, it is generally not recommended to initialize the total supply of a token to a very large number, as this could potentially lead to other issues such as integer overflows.",denial of service,4.0,608.0,6.0,3.482163667678833
138,denial of service," Yes, the smart contract code is vulnerable to denial of service attack. The vulnerability is in the same line as the previous contract:

require(currentFrontrunner.send(currentBid));

The reason is that if the `currentFrontrunner` contract is a contract that has a fallback function that uses up a lot of gas, then every time a bid is placed, the network will be consumed by the fallback function of the `currentFrontrunner` contract. This can lead to a denial of service attack.

In addition, there is another vulnerability in the `CustomToken` contract. The `totalSupply` variable is not initialized in the constructor of the `BaseToken` contract, but it is read in the `CustomToken` constructor. This will cause the `totalSupply` to be zero, which may not be the intended behavior.",denial of service,4.0,606.0,6.0,2.5412161350250244
