case_id,vuln_type,audit_report,gt,eval_score,eval_input_token_num,eval_output_token_num,eval_inference_time
177736,Bypass," Based on the provided code, the samldb_check_user_account_control_acl function is not directly related to the given vulnerability CVE-2015-8467. The vulnerability is related to the improper checking for administrative privileges during creation of machine accounts in Samba. Therefore, the samldb_check_user_account_control_acl function itself is not vulnerable.

However, it's always a good practice to follow secure coding guidelines when writing code. The code snippet you provided does not contain any obvious security vulnerabilities, but it's important to note that it's only a part of the larger context of the samldb.c file. It's essential to consider the entire codebase and the interactions between different functions and modules to ensure the overall security of the application.

In summary, the samldb_check_user_account_control_acl function is not vulnerable based on the provided code.","The code contains a Bypass vulnerability. 
The CVE-ID is CVE-2015-8467. The CWE-ID is CWE-264.
Vulnerability summary:
The samldb_check_user_account_control_acl function in dsdb/samdb/ldb_modules/samldb.c in Samba 4.x before 4.1.22, 4.2.x before 4.2.7, and 4.3.x before 4.3.3 does not properly check for administrative privileges during creation of machine accounts, which allows remote authenticated users to bypass intended access restrictions by leveraging the existence of a domain with both a Samba DC and a Windows DC, a similar issue to CVE-2015-2535.
",1.0,831.0,6.0,10.100609064102173
177740,DoS Exec Code Overflow Mem. Corr.," The given code for the function `asn1_time_to_time_t` is not directly related to the vulnerability described in the CVE-ID CVE-2013-6420. The vulnerability in the CVE-ID is related to the `openssl_x509_parse` function, which is not present in the given code. Therefore, the code is not vulnerable to the described vulnerability.

However, the code does contain some potential vulnerabilities, such as:

1. Buffer Overflow: The `strbuf` buffer is allocated based on the length of the input string `timestr->data`, but there is no check to ensure that the length is within the bounds of the buffer. This could potentially lead to a buffer overflow if the input string is larger than the allocated size of `strbuf`.
2. Use-After-Free: The `strbuf` pointer is freed after it is used to populate the `thetime` struct, but there is no check to ensure that the pointer is not used again after the free operation. This could potentially lead to a use-after-free vulnerability if the pointer is dereferenced after it has been freed.
3. Integer Overflow: The code does not check for integer overflow when converting the year value to a `tm_year` value. This could potentially lead to incorrect values being assigned to `the","The code contains a DoS_Exec_Code_Overflow_Mem._Corr. vulnerability. 
The CVE-ID is CVE-2013-6420. The CWE-ID is CWE-119.
Vulnerability summary:
The asn1_time_to_time_t function in ext/openssl/openssl.c in PHP before 5.3.28, 5.4.x before 5.4.23, and 5.5.x before 5.5.7 does not properly parse (1) notBefore and (2) notAfter timestamps in X.509 certificates, which allows remote attackers to execute arbitrary code or cause a denial of service (memory corruption) via a crafted certificate that is not properly handled by the openssl_x509_parse function.
",2.0,939.0,6.0,3.975205421447754
177741,DoS Overflow," The given code for `gnutls_session_get_data` function is not directly related to the code you provided for the `buildMatrix` function. However, I will evaluate the `buildMatrix` function for potential vulnerabilities.

The `buildMatrix` function appears to be implementing a topological sort on two given matrices (`rowConditions` and `colConditions`). Based on the given code, it does not contain any obvious buffer overflow, use-after-free, memory leak, or null pointer dereference vulnerabilities.

However, it is essential to note that the code's correctness and security depend on the input data (`rowConditions` and `colConditions`). If these matrices contain malicious data, it could potentially lead to unintended consequences.

Therefore, the answer is 'NO', but it is crucial to ensure that the input data is valid and free from any malicious content.","The code contains a DoS_Overflow vulnerability. 
The CVE-ID is CVE-2011-4128. The CWE-ID is CWE-119.
Vulnerability summary:
Buffer overflow in the gnutls_session_get_data function in lib/gnutls_session.c in GnuTLS 2.12.x before 2.12.14 and 3.x before 3.0.7, when used on a client that performs nonstandard session resumption, allows remote TLS servers to cause a denial of service (application crash) via a large SessionTicket.
",1.0,807.0,6.0,1.7918598651885986
177742,DoS Overflow," The second code snippet provided is not related to the first vulnerability discussed. It is a separate function called `buildMatrix` that appears to be used for matrix manipulation. Based on the provided code, it does not contain any obvious buffer overflow or memory management vulnerabilities. Therefore, the answer is 'NO'.","The code contains a DoS_Overflow vulnerability. 
The CVE-ID is CVE-2011-4128. The CWE-ID is CWE-119.
Vulnerability summary:
Buffer overflow in the gnutls_session_get_data function in lib/gnutls_session.c in GnuTLS 2.12.x before 2.12.14 and 3.x before 3.0.7, when used on a client that performs nonstandard session resumption, allows remote TLS servers to cause a denial of service (application crash) via a large SessionTicket.
",1.0,697.0,6.0,4.021275281906128
177743,DoS," Based on the given code, the `phar_make_dirstream` function does not appear to be directly vulnerable to the vulnerabilities listed in the provided steps. However, it does call other functions that may be vulnerable, so it's essential to evaluate those functions as well.

The code snippet provided is responsible for creating a directory stream for a PHP PHAR (Portable Archive) file. It processes the manifest table of the PHAR file and adds directory entries to the stream. The code does not involve any memory management, string manipulation, or arithmetic operations that could lead to the vulnerabilities mentioned.

However, it's important to note that the code snippet does not represent the entire program, and other parts of the codebase might contain vulnerabilities. Therefore, it's crucial to perform a thorough vulnerability assessment on the entire codebase to ensure its security.","The code contains a DoS vulnerability. 
The CVE-ID is CVE-2015-7804. The CWE-ID is CWE-189.
Vulnerability summary:
Off-by-one error in the phar_parse_zipfile function in ext/phar/zip.c in PHP before 5.5.30 and 5.6.x before 5.6.14 allows remote attackers to cause a denial of service (uninitialized pointer dereference and application crash) by including the / filename in a .zip PHAR archive.
",1.0,792.0,6.0,4.0350022315979
177747,DoS," The given code for `bgp_attr_unknown` function is not directly related to the provided vulnerability description (CVE-2013-6051). Therefore, I cannot determine if it is vulnerable based on the provided code alone.

However, I can evaluate the second code snippet you provided, which is a separate function `buildMatrix` written in C++. Based on the given code, it does not contain any apparent vulnerabilities. The code is following good practices, such as using a lambda function for topological sorting, and properly handling edge cases (e.g., checking if the size of the sorted vectors is equal to k).

So, the answer is 'NO'.","The code contains a DoS vulnerability. 
The CVE-ID is CVE-2013-6051. The CWE-ID is nan.
Vulnerability summary:
The bgp_attr_unknown function in bgp_attr.c in Quagga 0.99.21 does not properly initialize the total variable, which allows remote attackers to cause a denial of service (bgpd crash) via a crafted BGP update.
",1.0,736.0,6.0,3.5836598873138428
177750,DoS Exec Code," Based on the provided code, the `begin_softmask` function does not appear to contain any obvious use-after-free vulnerabilities. The code snippet provided does not involve dynamic memory allocation or pointer dereferencing after a free operation.

However, it is essential to note that the vulnerability mentioned in the context of the code snippet (CVE-2018-1000039) is related to a different part of the MuPDF codebase. The provided code snippet does not exhibit the same vulnerability.

Therefore, the answer is 'NO'.","The code contains a DoS_Exec_Code vulnerability. 
The CVE-ID is CVE-2018-1000039. The CWE-ID is CWE-416.
Vulnerability summary:
In MuPDF 1.12.0 and earlier, multiple heap use after free bugs in the PDF parser could allow an attacker to execute arbitrary code, read memory, or cause a denial of service via a crafted file.
",1.0,709.0,6.0,2.3619225025177
177766,DoS," Based on the given code, the `ldap_push_filter` function does not appear to be directly vulnerable to a Denial of Service (DoS) attack as described in the vulnerability summary provided. The code does not check return values from ASN.1 memory allocation functions, but it does not indicate that it allocates memory in an unbounded manner or that it fails to handle memory allocation errors properly.

Therefore, the answer is 'NO'.","The code contains a DoS vulnerability. 
The CVE-ID is CVE-2015-7540. The CWE-ID is CWE-399.
Vulnerability summary:
The LDAP server in the AD domain controller in Samba 4.x before 4.1.22 does not check return values to ensure successful ASN.1 memory allocation, which allows remote attackers to cause a denial of service (memory consumption and daemon crash) via crafted packets.
",1.0,698.0,6.0,3.437849998474121
177767,DoS," The given code for the function `decode_openldap_dereference` is not directly vulnerable to the DoS vulnerability described in the provided context. The vulnerability in the code you initially provided was due to the lack of checking return values from ASN.1 memory allocation functions, which could lead to memory exhaustion and a denial of service.

The code you provided here does not exhibit this behavior, as it checks the return values of various functions, including `asn1_load`, `talloc`, and `asn1_start_tag`. These checks ensure that memory is allocated successfully before proceeding, which mitigates the risk of a DoS vulnerability.

Therefore, the answer is 'NO'.","The code contains a DoS vulnerability. 
The CVE-ID is CVE-2015-7540. The CWE-ID is CWE-399.
Vulnerability summary:
The LDAP server in the AD domain controller in Samba 4.x before 4.1.22 does not check return values to ensure successful ASN.1 memory allocation, which allows remote attackers to cause a denial of service (memory consumption and daemon crash) via crafted packets.
",1.0,744.0,6.0,2.8861308097839355
177768,DoS," Based on the provided code snippet, the function `sparse_dump_region` does not appear to be directly vulnerable to the vulnerabilities listed in the steps you provided. However, it does call other functions (such as `lseek_or_error`, `safe_read`, and `blocking_write`) that could potentially contain vulnerabilities. Therefore, it is important to thoroughly review those functions as well.

Additionally, the code snippet you provided does not include the definition of the `tar_sparse_file` struct or the functions `find_next_block`, `set_next_block_after`, `tar_sparse_dump_header`, `tar_sparse_scan_file`, `pad_archive`, and `tar_sparse_done`. These functions could potentially contain vulnerabilities as well, so it is important to review their implementation as well.

Therefore, based on the provided code snippet alone, it is not possible to definitively determine if the code is vulnerable or not. A more thorough analysis would be required to make that determination.","The code contains a DoS vulnerability. 
The CVE-ID is CVE-2018-20482. The CWE-ID is CWE-835.
Vulnerability summary:
GNU Tar through 1.30, when --sparse is used, mishandles file shrinkage during read access, which allows local users to cause a denial of service (infinite read loop in sparse_dump_region in sparse.c) by modifying a file that is supposed to be archived by a different user's process (e.g., a system backup running as root).
",1.0,818.0,6.0,7.440219879150391
177770,Bypass," Based on the provided code snippet, the `read_ndx_and_attrs` function does not appear to be vulnerable to the Bypass vulnerability described in the given vulnerability summary. The function does not check for filenames in a data structure or apply any sanitize_paths protection mechanism to pathnames found in ""xname follows"" strings.

Therefore, the answer is 'NO'.","The code contains a Bypass vulnerability. 
The CVE-ID is CVE-2017-17434. The CWE-ID is nan.
Vulnerability summary:
The daemon in rsync 3.1.2, and 3.1.3-development before 2017-12-03, does not check for fnamecmp filenames in the daemon_filter_list data structure (in the recv_files function in receiver.c) and also does not apply the sanitize_paths protection mechanism to pathnames found in ""xname follows"" strings (in the read_ndx_and_attrs function in rsync.c), which allows remote attackers to bypass intended access restrictions.
",1.0,723.0,6.0,3.001689910888672
177771,," Based on the provided code, the `dns_read_name` function is vulnerable to a nan (Name Amplification) attack. The vulnerability arises from the recursive call to `dns_read_name` when a compressed pointer is encountered. An attacker can manipulate the compressed pointer to cause an infinite recursion or create a long chain of valid pointers, leading to stack exhaustion.

Therefore, the answer is 'YES'. The vulnerability is due to the lack of proper bounds checking and input validation when dealing with compressed pointers. This can result in infinite recursion or stack exhaustion, potentially leading to denial-of-service (DoS) attacks.","The code contains a nan vulnerability. 
The CVE-ID is CVE-2018-20103. The CWE-ID is CWE-835.
Vulnerability summary:
An issue was discovered in dns.c in HAProxy through 1.8.14. In the case of a compressed pointer, a crafted packet can trigger infinite recursion by making the pointer point to itself, or create a long chain of valid pointers resulting in stack exhaustion.
",3.0,728.0,6.0,2.742140531539917
177773,DoS Exec Code Overflow Mem. Corr.," The given code for `create_surface_from_thumbnail_data` function is not vulnerable to the mentioned vulnerabilities in the list. The code is mainly involved in converting image data format and creating a cairo surface. It does not involve any user input, dynamic memory allocation, or arithmetic operations that could lead to the mentioned vulnerabilities.

However, the second code snippet for `buildMatrix` function is not related to the given vulnerability discussion. It is a separate function that builds a matrix based on given conditions. It does not contain any vulnerable code.

Therefore, the answer is 'NO' for both code snippets.","The code contains a DoS_Exec_Code_Overflow_Mem._Corr. vulnerability. 
The CVE-ID is CVE-2009-3607. The CWE-ID is CWE-189.
Vulnerability summary:
Integer overflow in the create_surface_from_thumbnail_data function in glib/poppler-page.cc in Poppler 0.x allows remote attackers to cause a denial of service (memory corruption) or possibly execute arbitrary code via a crafted PDF document that triggers a heap-based buffer overflow.  NOTE: some of these details are obtained from third party information.
",1.0,750.0,6.0,6.116211175918579
177774,DoS Exec Code Overflow," Based on the provided code, there are no obvious buffer overflow, use-after-free, memory leak, or null pointer dereference vulnerabilities. However, there are integer overflows that could potentially lead to out-of-bounds access or incorrect results. For example, in the following line:

`n = 1 << colorMap->getBits();`

If `colorMap->getBits()` returns a value larger than the number of bits in an `int`, this could result in an integer overflow and potentially lead to unexpected behavior. To mitigate this risk, it's recommended to validate and limit the input to ensure it falls within the expected range.

Additionally, the code uses the `gmalloc` and `gmallocn` functions, which are not standard C++ library functions. These functions may not have proper bounds checking or memory management, so it's essential to ensure that they are used correctly and safely.

Lastly, the code uses the `splash->drawImage` function, which may have its own vulnerabilities. It's important to thoroughly review the implementation of this function and any related code to ensure it is secure.

In summary, while there are potential integer overflow vulnerabilities and the use of non-standard memory allocation functions, there is no clear evidence of buffer overflow, use-after-free, memory leak, or null pointer dereference vulnerabilities in the provided code. However","The code contains a DoS_Exec_Code_Overflow vulnerability. 
The CVE-ID is CVE-2009-3605. The CWE-ID is CWE-189.
Vulnerability summary:
Multiple integer overflows in Poppler 0.10.5 and earlier allow remote attackers to cause a denial of service (application crash) or possibly execute arbitrary code via a crafted PDF file, related to (1) glib/poppler-page.cc; (2) ArthurOutputDev.cc, (3) CairoOutputDev.cc, (4) GfxState.cc, (5) JBIG2Stream.cc, (6) PSOutputDev.cc, and (7) SplashOutputDev.cc in poppler/; and (8) SplashBitmap.cc, (9) Splash.cc, and (10) SplashFTFont.cc in splash/.  NOTE: this may overlap CVE-2009-0791.
",4.0,974.0,6.0,2.664000988006592
177775,DoS Exec Code Overflow," Based on the given code, the ArthurOutputDev::drawImage function does not appear to be directly vulnerable to the integer overflow vulnerability described in the CVE-2009-3605. However, it is important to note that the code may still be vulnerable to other types of vulnerabilities, such as buffer overflows, use-after-free errors, or race conditions, which are not addressed in the steps provided.

Therefore, the answer is 'NO', but with the caveat that a thorough vulnerability audit should be conducted on the entire codebase to ensure that all potential vulnerabilities are identified and addressed.","The code contains a DoS_Exec_Code_Overflow vulnerability. 
The CVE-ID is CVE-2009-3605. The CWE-ID is CWE-189.
Vulnerability summary:
Multiple integer overflows in Poppler 0.10.5 and earlier allow remote attackers to cause a denial of service (application crash) or possibly execute arbitrary code via a crafted PDF file, related to (1) glib/poppler-page.cc; (2) ArthurOutputDev.cc, (3) CairoOutputDev.cc, (4) GfxState.cc, (5) JBIG2Stream.cc, (6) PSOutputDev.cc, and (7) SplashOutputDev.cc in poppler/; and (8) SplashBitmap.cc, (9) Splash.cc, and (10) SplashFTFont.cc in splash/.  NOTE: this may overlap CVE-2009-0791.
",2.0,823.0,6.0,3.410853385925293
177777,DoS Exec Code Overflow," Based on the given code, the `CairoOutputDev::drawImage` function does not appear to be directly vulnerable to the mentioned vulnerabilities (DoS, Exec, Code, Overflow) as it does not involve any user input or unchecked arithmetic operations. However, it does allocate memory dynamically and handle image data, so it's essential to ensure that the memory allocation and image handling functions are secure.

To mitigate potential vulnerabilities, consider the following:

1. Ensure proper bounds checking when accessing image data and when copying data to the output buffer.
2. Validate and sanitize any input that is used to determine the dimensions or format of the image data.
3. Properly handle errors and exceptions when dealing with image data and memory allocation.
4. Use secure memory allocation functions, such as `std::vector` or `std::unique_ptr`, instead of `gmalloc` and `new`.
5. Ensure that the image data is properly checked and validated before being processed.

Based on the given code, it does not appear to be vulnerable to the mentioned vulnerabilities directly. However, it's essential to ensure that the functions called within the code, such as `gmalloc`, `new`, and image handling functions, are secure and properly handle potential vulnerabilities.","The code contains a DoS_Exec_Code_Overflow vulnerability. 
The CVE-ID is CVE-2009-3605. The CWE-ID is CWE-189.
Vulnerability summary:
Multiple integer overflows in Poppler 0.10.5 and earlier allow remote attackers to cause a denial of service (application crash) or possibly execute arbitrary code via a crafted PDF file, related to (1) glib/poppler-page.cc; (2) ArthurOutputDev.cc, (3) CairoOutputDev.cc, (4) GfxState.cc, (5) JBIG2Stream.cc, (6) PSOutputDev.cc, and (7) SplashOutputDev.cc in poppler/; and (8) SplashBitmap.cc, (9) Splash.cc, and (10) SplashFTFont.cc in splash/.  NOTE: this may overlap CVE-2009-0791.
",1.0,959.0,6.0,1.2586979866027832
177778,DoS Exec Code Overflow," Based on the given code, the `CairoOutputDev::drawMaskedImage` function does not appear to contain any obvious buffer overflow, use-after-free, memory leak, integer overflow/underflow, null pointer dereference, or improper input validation vulnerabilities. However, it does perform some memory allocations and deallocations, so it's important to ensure that these are done correctly to avoid potential memory-related vulnerabilities.

Additionally, the code uses several third-party libraries (such as cairo, glib, and Poppler), and any vulnerabilities in these libraries could potentially affect the security of the `drawMaskedImage` function. It's important to keep these libraries up-to-date to mitigate any known vulnerabilities.

The code also performs some image processing operations, so it's important to ensure that any image data is properly sanitized and validated to prevent potential injection attacks or other vulnerabilities.

Overall, based on the given code, it's difficult to definitively say whether or not it contains any vulnerabilities without a more thorough analysis. However, based on the code snippet provided, it does not appear to contain any obvious vulnerabilities related to the steps outlined in the question.

Regarding the second code snippet, it appears to be a separate function for building a matrix based on given conditions. This function does not appear to contain any obvious vulnerabilities","The code contains a DoS_Exec_Code_Overflow vulnerability. 
The CVE-ID is CVE-2009-3605. The CWE-ID is CWE-189.
Vulnerability summary:
Multiple integer overflows in Poppler 0.10.5 and earlier allow remote attackers to cause a denial of service (application crash) or possibly execute arbitrary code via a crafted PDF file, related to (1) glib/poppler-page.cc; (2) ArthurOutputDev.cc, (3) CairoOutputDev.cc, (4) GfxState.cc, (5) JBIG2Stream.cc, (6) PSOutputDev.cc, and (7) SplashOutputDev.cc in poppler/; and (8) SplashBitmap.cc, (9) Splash.cc, and (10) SplashFTFont.cc in splash/.  NOTE: this may overlap CVE-2009-0791.
",1.0,961.0,6.0,4.146677494049072
177779,DoS Exec Code Overflow," Based on the given code, the `CairoOutputDev::drawSoftMaskedImage` function does not appear to contain any obvious integer overflow vulnerabilities. However, it does allocate and manipulate large blocks of memory, so there could be potential memory-related vulnerabilities such as buffer overflows or memory leaks. It is important to carefully examine the memory handling in this function, especially when dealing with user input or external data streams.

To thoroughly evaluate the code for vulnerabilities, it is recommended to perform a static analysis using a tool like AddressSanitizer or Valgrind, or a dynamic analysis using a tool like GDB or a fuzzer. These tools can help identify memory-related vulnerabilities and other issues that may not be immediately apparent from a cursory code review.

In summary, the `CairoOutputDev::drawSoftMaskedImage` function may contain memory-related vulnerabilities, but it does not appear to have any obvious integer overflow vulnerabilities based on the provided code.

However, it is important to note that the code snippet provided may not be the entire implementation of the `drawSoftMaskedImage` function, and there could be other parts of the code that introduce vulnerabilities. Therefore, a thorough analysis of the entire codebase is necessary to ensure the security of the application.","The code contains a DoS_Exec_Code_Overflow vulnerability. 
The CVE-ID is CVE-2009-3605. The CWE-ID is CWE-189.
Vulnerability summary:
Multiple integer overflows in Poppler 0.10.5 and earlier allow remote attackers to cause a denial of service (application crash) or possibly execute arbitrary code via a crafted PDF file, related to (1) glib/poppler-page.cc; (2) ArthurOutputDev.cc, (3) CairoOutputDev.cc, (4) GfxState.cc, (5) JBIG2Stream.cc, (6) PSOutputDev.cc, and (7) SplashOutputDev.cc in poppler/; and (8) SplashBitmap.cc, (9) Splash.cc, and (10) SplashFTFont.cc in splash/.  NOTE: this may overlap CVE-2009-0791.
",2.0,956.0,6.0,2.0250961780548096
