case_id,vuln_type,audit_report,gt,eval_score,eval_input_token_num,eval_output_token_num,eval_inference_time
177898,+Info," The given code for the function `buildMatrix` does not directly involve parsing XML data or handling user input, so it is not vulnerable to the XML External Entity (XXE) issue described in the original vulnerability. Therefore, the answer is 'NO'.","The code contains a +Info vulnerability. 
The CVE-ID is CVE-2013-1824. The CWE-ID is CWE-200.
Vulnerability summary:
The SOAP parser in PHP before 5.3.22 and 5.4.x before 5.4.12 allows remote attackers to read arbitrary files via a SOAP WSDL file containing an XML external entity declaration in conjunction with an entity reference, related to an XML External Entity (XXE) issue in the soap_xmlParseFile and soap_xmlParseMemory functions.
",1.0,681.0,6.0,3.431938409805298
177899,+Info," The second code snippet provided is not directly related to the vulnerability described in the initial code example. It appears to be a separate function for building a matrix based on given conditions. This code does not involve any file I/O or XML parsing, so it is not vulnerable to the XXE issue described in the initial vulnerability.

Therefore, the answer is 'NO'.","The code contains a +Info vulnerability. 
The CVE-ID is CVE-2013-1824. The CWE-ID is CWE-200.
Vulnerability summary:
The SOAP parser in PHP before 5.3.22 and 5.4.x before 5.4.12 allows remote attackers to read arbitrary files via a SOAP WSDL file containing an XML external entity declaration in conjunction with an entity reference, related to an XML External Entity (XXE) issue in the soap_xmlParseFile and soap_xmlParseMemory functions.
",1.0,702.0,6.0,2.43851375579834
177900,+Info," The given code for the function `buildMatrix` does not directly involve parsing or handling user input, and it does not appear to contain any memory management issues, buffer overflows, or other common security vulnerabilities. Therefore, it is unlikely to be vulnerable based on the provided code alone. However, it's essential to keep in mind that the code's correctness and security depend on the correct usage and validation of the input `rowConditions` and `colConditions` passed to the function. If these inputs are not properly validated or sanitized, the function could still be vulnerable to attacks.","The code contains a +Info vulnerability. 
The CVE-ID is CVE-2013-1824. The CWE-ID is CWE-200.
Vulnerability summary:
The SOAP parser in PHP before 5.3.22 and 5.4.x before 5.4.12 allows remote attackers to read arbitrary files via a SOAP WSDL file containing an XML external entity declaration in conjunction with an entity reference, related to an XML External Entity (XXE) issue in the soap_xmlParseFile and soap_xmlParseMemory functions.
",1.0,744.0,6.0,4.632513999938965
177901,Overflow," The second code snippet provided, `buildMatrix()`, does not appear to contain any obvious buffer overflow vulnerabilities. The function is using standard library containers (`vector`) and does not involve any string manipulation functions that could potentially lead to buffer overflows. Therefore, the answer is 'NO'.","The code contains a Overflow vulnerability. 
The CVE-ID is CVE-2015-2806. The CWE-ID is CWE-119.
Vulnerability summary:
Stack-based buffer overflow in asn1_der_decoding in libtasn1 before 4.4 allows remote attackers to have unspecified impact via unknown vectors.
",1.0,643.0,6.0,3.235236167907715
177904,DoS," Based on the given code, the `Splash::blitMask` function does not appear to be vulnerable to the specific vulnerabilities listed in the steps provided. However, it is always important to ensure proper bounds checking and input validation in C++ code to prevent potential vulnerabilities. In this case, the code appears to be checking array bounds and using validated user inputs (`xDest`, `yDest`, and `clipRes`) before performing any operations. Therefore, my answer is 'NO'.","The code contains a DoS vulnerability. 
The CVE-ID is CVE-2013-1789. The CWE-ID is nan.
Vulnerability summary:
splash/Splash.cc in poppler before 0.22.1 allows context-dependent attackers to cause a denial of service (NULL pointer dereference and crash) via vectors related to the (1) Splash::arbitraryTransformMask, (2) Splash::blitMask, and (3) Splash::scaleMaskYuXu functions.
",1.0,719.0,6.0,3.1282665729522705
177905,DoS," Based on the given code, the Splash::arbitraryTransformMask function does not appear to be directly vulnerable to the listed vulnerabilities. However, there are some potential issues that should be addressed:

1. The code does not check the return value of imgCoordMungeUpperC and imgCoordMungeLowerC functions, which could potentially lead to out-of-bounds access if these functions return unexpected values.
2. The code does not check the return value of state->clip->testRect function, which could potentially lead to further processing if the clip test fails.
3. The code does not handle errors or exceptions properly, which could potentially lead to unintended behavior if an error occurs.

However, the provided code snippet does not contain the imgCoordMungeUpperC and imgCoordMungeLowerC function definitions, so it's impossible to determine if these functions are vulnerable to buffer overflows or other issues. Additionally, the code snippet does not include the state and clip objects, so it's unclear if these objects are properly initialized and managed.

Therefore, while the Splash::arbitraryTransformMask function itself may not be directly vulnerable based on the given code, there are potential issues that should be addressed to ensure the overall security and reliability of the code.

Regarding the second code snippet you provided, it is not related to the Splash::ar","The code contains a DoS vulnerability. 
The CVE-ID is CVE-2013-1789. The CWE-ID is nan.
Vulnerability summary:
splash/Splash.cc in poppler before 0.22.1 allows context-dependent attackers to cause a denial of service (NULL pointer dereference and crash) via vectors related to the (1) Splash::arbitraryTransformMask, (2) Splash::blitMask, and (3) Splash::scaleMaskYuXu functions.
",2.0,888.0,6.0,2.548593759536743
177906,DoS Exec Code Overflow," Based on the provided code, the `Splash::makeDashedPath` function does not appear to be directly vulnerable to the mentioned vulnerabilities (DoS, Exec, Code, Overflow) in the given context. However, it's essential to note that the code snippet provided is incomplete, and it's impossible to determine if there are any other vulnerabilities in the surrounding code.

Therefore, the answer is 'NO'. However, it's always a good practice to thoroughly review the entire codebase to ensure its security.","The code contains a DoS_Exec_Code_Overflow vulnerability. 
The CVE-ID is CVE-2013-1788. The CWE-ID is CWE-119.
Vulnerability summary:
poppler before 0.22.1 allows context-dependent attackers to cause a denial of service (crash) and possibly execute arbitrary code via vectors that trigger an ""invalid memory access"" in (1) splash/Splash.cc, (2) poppler/Function.cc, and (3) poppler/Stream.cc.
",1.0,724.0,6.0,5.493871688842773
177907,DoS Exec Code Overflow," The given `Splash::scaleMaskYuXd` function is not directly related to the vulnerabilities mentioned in the provided context. The code snippet does not contain any obvious buffer overflow, use-after-free, memory leak, or other vulnerabilities. However, it does contain some potential issues, such as unchecked array indices and potential integer overflows. These issues, however, do not directly lead to security vulnerabilities but could cause application crashes or incorrect behavior.

The second code snippet, `buildMatrix`, is a separate function and does not appear to contain any obvious security vulnerabilities. It is a well-structured function that performs topological sorting on given conditions and builds a matrix based on the sorted indices.

Therefore, the answer is 'NO' for both code snippets.","The code contains a DoS_Exec_Code_Overflow vulnerability. 
The CVE-ID is CVE-2013-1788. The CWE-ID is CWE-119.
Vulnerability summary:
poppler before 0.22.1 allows context-dependent attackers to cause a denial of service (crash) and possibly execute arbitrary code via vectors that trigger an ""invalid memory access"" in (1) splash/Splash.cc, (2) poppler/Function.cc, and (3) poppler/Stream.cc.
",1.0,774.0,6.0,3.4580795764923096
177909,DoS Exec Code Overflow," Based on the given code, the `Splash::scaleMaskYdXu` function is not directly vulnerable to the mentioned vulnerabilities (DoS, Exec, Code, Overflow) as described in the provided CVE-ID and CWE-ID. However, it does contain some potential issues, such as memory leaks and improper error handling. It's essential to ensure proper memory management and error handling in the function to avoid potential vulnerabilities.

The `buildMatrix` function, on the other hand, is not directly related to the `Splash::scaleMaskYdXu` function and does not contain any apparent vulnerabilities based on the provided code. It appears to be a separate function for building a matrix based on given conditions.","The code contains a DoS_Exec_Code_Overflow vulnerability. 
The CVE-ID is CVE-2013-1788. The CWE-ID is CWE-119.
Vulnerability summary:
poppler before 0.22.1 allows context-dependent attackers to cause a denial of service (crash) and possibly execute arbitrary code via vectors that trigger an ""invalid memory access"" in (1) splash/Splash.cc, (2) poppler/Function.cc, and (3) poppler/Stream.cc.
",2.0,765.0,6.0,2.6036174297332764
177910,DoS," The given code for `token_continue` function is not directly related to the `vector<vector<int>> buildMatrix` function. Therefore, I cannot determine if the `token_continue` function is vulnerable based on the provided code alone.

However, I can evaluate the `buildMatrix` function for potential vulnerabilities:

The `buildMatrix` function appears to be implementing a topological sort on two given vectors (`rowConditions` and `colConditions`). It seems to be correctly handling the input and returning an empty matrix if the input vectors do not have the expected size.

Based on the given code, the `buildMatrix` function does not appear to have any obvious vulnerabilities.

Therefore, my answer is: NO.","The code contains a DoS vulnerability. 
The CVE-ID is CVE-2017-11714. The CWE-ID is CWE-125.
Vulnerability summary:
psi/ztoken.c in Artifex Ghostscript 9.21 mishandles references to the scanner state structure, which allows remote attackers to cause a denial of service (application crash) or possibly have unspecified other impact via a crafted PostScript document, related to an out-of-bounds read in the igc_reloc_struct_ptr function in psi/igc.c.
",1.0,771.0,6.0,2.94195294380188
177911,Exec Code Overflow," The given `tt_cmap10_validate` function does not appear to be directly vulnerable to the Exec_Code_Overflow vulnerability described in the provided context. The function is primarily concerned with validating the format of a table, and does not involve executing arbitrary code or manipulating memory in a way that could lead to an overflow.

However, it is always important to ensure proper bounds checking and input validation in C++ code to prevent various types of vulnerabilities, including buffer overflows and integer overflows. In the given code, there are checks to ensure that the table and its components do not exceed the valid limit, and glyph indices are within the valid range. These checks help mitigate potential vulnerabilities, but it is still important to be vigilant and ensure that all code is properly validated and tested.

The second code snippet provided is not related to the vulnerability being discussed, and it appears to be a separate function for building a matrix. This code does not contain any obvious vulnerabilities based on the provided context.","The code contains a Exec_Code_Overflow vulnerability. 
The CVE-ID is CVE-2009-0946. The CWE-ID is CWE-189.
Vulnerability summary:
Multiple integer overflows in FreeType 2.3.9 and earlier allow remote attackers to execute arbitrary code via vectors related to large values in certain inputs in (1) smooth/ftsmooth.c, (2) sfnt/ttcmap.c, and (3) cff/cffload.c.
",2.0,815.0,6.0,2.5179171562194824
177912,Exec Code Overflow," The given `tt_cmap12_validate` function is not directly related to the provided `vector<vector<int>> buildMatrix` function. Therefore, I cannot determine if the `buildMatrix` function is vulnerable based on the provided code alone.

However, I can tell you that the `tt_cmap12_validate` function does not appear to be vulnerable to the specific integer overflow vulnerability described in the CVE-2009-0946. The code snippet provided does not contain any arithmetic operations on unsigned integers without proper bounds checking, which is a common cause of integer overflows.

So, the answer is 'NO', the `buildMatrix` function is not vulnerable to the Exec_Code_Overflow vulnerability based on the provided code.","The code contains a Exec_Code_Overflow vulnerability. 
The CVE-ID is CVE-2009-0946. The CWE-ID is CWE-189.
Vulnerability summary:
Multiple integer overflows in FreeType 2.3.9 and earlier allow remote attackers to execute arbitrary code via vectors related to large values in certain inputs in (1) smooth/ftsmooth.c, (2) sfnt/ttcmap.c, and (3) cff/cffload.c.
",1.0,765.0,6.0,3.645236015319824
177913,Exec Code Overflow," Based on the provided code snippet, the `tt_cmap8_validate` function does not appear to be directly vulnerable to integer overflows or any other type of vulnerability mentioned in the steps you've outlined. However, it does involve parsing and validating user data, so it's essential to ensure proper input validation is implemented to prevent other types of vulnerabilities, such as buffer overflows or injection attacks.

The second code snippet you've provided is not related to the `tt_cmap8_validate` function, and it doesn't contain any apparent vulnerabilities either. It's a separate function for building a matrix using given conditions.

Therefore, the answer is 'NO' for both code snippets. However, it's crucial to remember that proper input validation should always be implemented in any code that processes user data.","The code contains a Exec_Code_Overflow vulnerability. 
The CVE-ID is CVE-2009-0946. The CWE-ID is CWE-189.
Vulnerability summary:
Multiple integer overflows in FreeType 2.3.9 and earlier allow remote attackers to execute arbitrary code via vectors related to large values in certain inputs in (1) smooth/ftsmooth.c, (2) sfnt/ttcmap.c, and (3) cff/cffload.c.
",1.0,772.0,6.0,6.823179244995117
177915,Exec Code Overflow," Based on the provided code snippet, the `cff_charset_load` function does not appear to be directly vulnerable to integer overflows or Exec_Code_Overflow vulnerabilities. However, it does involve reading and parsing data from a stream, which could potentially lead to other vulnerabilities depending on the source of the data and how it is validated. It is always important to validate and sanitize user inputs and ensure proper error handling to mitigate risks.

The `buildMatrix` function is not related to the `cff_charset_load` function and does not contain any apparent vulnerabilities. It is a separate function that performs matrix row and column topological sorting.

Therefore, the answer is 'NO' for the given code snippet. However, it is essential to keep in mind that the entire codebase should be thoroughly reviewed for potential vulnerabilities, and the provided code snippet might not represent the entire context.","The code contains a Exec_Code_Overflow vulnerability. 
The CVE-ID is CVE-2009-0946. The CWE-ID is CWE-189.
Vulnerability summary:
Multiple integer overflows in FreeType 2.3.9 and earlier allow remote attackers to execute arbitrary code via vectors related to large values in certain inputs in (1) smooth/ftsmooth.c, (2) sfnt/ttcmap.c, and (3) cff/cffload.c.
",1.0,791.0,6.0,3.9516923427581787
177917,Exec Code," The given XGetFontPath function is not directly vulnerable based on the provided code. However, it does call other functions like _XReadPad and _XReply which could potentially have vulnerabilities. It's essential to ensure these functions are securely implemented and handle input correctly to prevent any potential issues.

The buildMatrix function, on the other hand, does not appear to have any apparent vulnerabilities based on the provided code. It performs a topological sort on the given conditions and returns a matrix based on the sorted indices. The function uses standard C++ libraries and no potentially vulnerable functions are called.","The code contains a Exec_Code vulnerability. 
The CVE-ID is CVE-2018-14600. The CWE-ID is CWE-787.
Vulnerability summary:
An issue was discovered in libX11 through 1.6.5. The function XListExtensions in ListExt.c interprets a variable as signed instead of unsigned, resulting in an out-of-bounds write (of up to 128 bytes), leading to DoS or remote code execution.
",1.0,731.0,6.0,2.537478446960449
177918,Exec Code," The second code snippet provided is not vulnerable to the Exec_Code vulnerability described in the first code snippet. The second code snippet is a different function, `buildMatrix`, which appears to be unrelated to the X11 library and the `XListExtensions` function. It does not involve interpreting a variable as signed instead of unsigned, and it does not involve reading or writing data outside of allocated memory. Therefore, it is not vulnerable to the Exec_Code vulnerability.","The code contains a Exec_Code vulnerability. 
The CVE-ID is CVE-2018-14600. The CWE-ID is CWE-787.
Vulnerability summary:
An issue was discovered in libX11 through 1.6.5. The function XListExtensions in ListExt.c interprets a variable as signed instead of unsigned, resulting in an out-of-bounds write (of up to 128 bytes), leading to DoS or remote code execution.
",1.0,705.0,6.0,8.662144422531128
177919,," Based on the provided code, the XListFonts function does not directly contain any vulnerabilities as listed in the steps you've provided. However, there are some potential issues that could arise from the use of third-party libraries like Xlib and X11, which the code relies on. These libraries may have their own vulnerabilities, and it's essential to ensure they are up-to-date and securely configured.

The code snippet you've provided is not vulnerable to buffer overflow, use-after-free, memory leaks, integer overflow/underflow, null pointer dereference, improper input validation, race conditions, insecure function usage, insecure resource management, or improper error handling. It does, however, allocate memory dynamically and handle errors, so it's crucial to ensure that memory is properly managed and errors are handled appropriately in the context of the larger application.

The second code snippet you've provided is not related to the vulnerability audit and appears to be an unrelated function definition for a matrix building utility. It does not contain any apparent vulnerabilities.","The code contains a nan vulnerability. 
The CVE-ID is CVE-2018-14599. The CWE-ID is CWE-682.
Vulnerability summary:
An issue was discovered in libX11 through 1.6.5. The function XListExtensions in ListExt.c is vulnerable to an off-by-one error caused by malicious server responses, leading to DoS or possibly unspecified other impact.
",1.0,799.0,6.0,3.3964710235595703
177920,," Based on the provided code, the `XGetFontPath` function is not vulnerable to the nan vulnerability described in the initial code snippet. The vulnerability in that code was related to an off-by-one error caused by malicious server responses, which is not present in the given code. The `XGetFontPath` function in the provided code appears to be handling the response data correctly, by checking the length of each string and null-terminating it before storing it in the `flist` array.","The code contains a nan vulnerability. 
The CVE-ID is CVE-2018-14599. The CWE-ID is CWE-682.
Vulnerability summary:
An issue was discovered in libX11 through 1.6.5. The function XListExtensions in ListExt.c is vulnerable to an off-by-one error caused by malicious server responses, leading to DoS or possibly unspecified other impact.
",1.0,703.0,6.0,2.754302740097046
177921,," The second code snippet provided is not vulnerable to the nan vulnerability described in the first code snippet. It is a different function with a different purpose. The second code snippet appears to be implementing a topological sort and constructing a matrix based on given conditions. It does not involve any network communication or unpacking of potentially malicious data, so it is not vulnerable to the nan vulnerability.","The code contains a nan vulnerability. 
The CVE-ID is CVE-2018-14599. The CWE-ID is CWE-682.
Vulnerability summary:
An issue was discovered in libX11 through 1.6.5. The function XListExtensions in ListExt.c is vulnerable to an off-by-one error caused by malicious server responses, leading to DoS or possibly unspecified other impact.
",1.0,677.0,6.0,3.787886381149292
177922,Exec Code Overflow, The given code for `add_param_to_argv` function is vulnerable. The reason is that it does not properly check the length of the `param_buffer` before appending characters to it. This can lead to a buffer overflow if the input string is longer than the allocated size of `param_buffer`. This vulnerability can be exploited to execute arbitrary code or cause a denial-of-service condition.,"The code contains a Exec_Code_Overflow vulnerability. 
The CVE-ID is CVE-2019-11360. The CWE-ID is CWE-119.
Vulnerability summary:
A buffer overflow in iptables-restore in netfilter iptables 1.8.2 allows an attacker to (at least) crash the program or potentially gain code execution via a specially crafted iptables-save file. This is related to add_param_to_argv in xshared.c.
",3.0,692.0,6.0,4.265638113021851
177923,Bypass," The given PHP code is not C++ code, so it is not directly related to the vulnerability audit task. The provided code is a PHP function named move_uploaded_file.

However, I can tell you that the move_uploaded_file function in the given code is vulnerable to a file name manipulation attack, as it does not properly check or sanitize user-supplied file names. This vulnerability can allow attackers to bypass intended file name restrictions and create files with unexpected names.

The vulnerability is described in CVE-2015-2348 and has a CWE-ID of CWE-264.

To mitigate this vulnerability, the code should validate and sanitize user-supplied file names before using them in the move_uploaded_file function. This can be done by using functions like basename() and dirname() to separate the file name and directory components, and then checking the file name component against a whitelist of allowed extensions.

Regarding the second code snippet you provided, it is a C++ function named buildMatrix. This code does not appear to be vulnerable to any of the security vulnerabilities listed in the task. It is a function that builds a matrix based on given conditions and returns it.","The code contains a Bypass vulnerability. 
The CVE-ID is CVE-2015-2348. The CWE-ID is CWE-264.
Vulnerability summary:
The move_uploaded_file implementation in ext/standard/basic_functions.c in PHP before 5.4.39, 5.5.x before 5.5.23, and 5.6.x before 5.6.7 truncates a pathname upon encountering a \x00 character, which allows remote attackers to bypass intended extension restrictions and create files with unexpected names via a crafted second argument.  NOTE: this vulnerability exists because of an incomplete fix for CVE-2006-7243.
",3.0,887.0,6.0,3.396127939224243
177926,Exec Code Overflow," The given code for `gst_vorbis_tag_add_coverart` function is not directly related to the vulnerability described in the provided CVE-ID and CWE-ID. The vulnerability mentioned in the CVE-ID is related to a heap-based buffer overflow in the `gst_tag_image_data_to_image_buffer` function, which is called later in the code.

However, the code does not contain any obvious buffer overflow vulnerabilities or other security issues based on the provided context. The code appears to be handling base64 decoding and image data conversion, but it does not involve any user input or unchecked arithmetic operations that could lead to integer overflows or underflows.

Therefore, the answer is 'NO'. The code does not appear to be vulnerable based on the provided context. However, it is always important to keep in mind that security vulnerabilities can be introduced in other parts of the codebase or in dependencies, so it is essential to follow secure coding practices and keep the software up-to-date with security patches.","The code contains a Exec_Code_Overflow vulnerability. 
The CVE-ID is CVE-2009-0586. The CWE-ID is CWE-189.
Vulnerability summary:
Integer overflow in the gst_vorbis_tag_add_coverart function (gst-libs/gst/tag/gstvorbistag.c) in vorbistag in gst-plugins-base (aka gstreamer-plugins-base) before 0.10.23 in GStreamer allows context-dependent attackers to execute arbitrary code via a crafted COVERART tag that is converted from a base64 representation, which triggers a heap-based buffer overflow.
",1.0,842.0,6.0,3.107598066329956
