case_id,vuln_type,audit_report,gt,eval_score,eval_input_token_num,eval_output_token_num,eval_inference_time
177816,Bypass," The given `get_checksum2` function is vulnerable. The reason is that in the MD4 case, the code does not properly handle the last block of data when computing the checksum. This can lead to incorrect checksum calculations and potential security vulnerabilities. Specifically, the code conditionally calls `mdfour_update` with the remaining data only if the length of the data is greater than the current index `i` or if the sum type is not `CSUM_MD4_BUSTED`. However, even when the data length is exactly equal to the index `i`, the last block of data should still be processed properly. This vulnerability is related to the CVE-2017-15994 and CWE-354.","The code contains a Bypass vulnerability. 
The CVE-ID is CVE-2017-15994. The CWE-ID is CWE-354.
Vulnerability summary:
rsync 3.1.3-development before 2017-10-24 mishandles archaic checksums, which makes it easier for remote attackers to bypass intended access restrictions. NOTE: the rsync development branch has significant use beyond the rsync developers, e.g., the code has been copied for use in various GitHub projects.
",3.0,767.0,6.0,3.1148874759674072
177821,DoS," The second code snippet provided, `IRCView::openTags` function, does not appear to be vulnerable based on the given information. It is just a function that generates HTML tags based on the input data.

The second code snippet, `buildMatrix` function, is not related to the first code snippet and is not a C++ code. It is a C++11 function written in C++11 syntax. It is not vulnerable as it does not involve any string manipulation or memory management that could lead to buffer overflows, use-after-free errors, or memory leaks. It is just a matrix construction function.","The code contains a DoS vulnerability. 
The CVE-ID is CVE-2017-15923. The CWE-ID is nan.
Vulnerability summary:
Konversation 1.4.x, 1.5.x, 1.6.x, and 1.7.x before 1.7.3 allow remote attackers to cause a denial of service (crash) via vectors related to parsing of IRC color formatting codes.
",1.0,732.0,6.0,2.829930067062378
177823,Exec Code Overflow," Based on the given code, the BufCompressedFill function does not directly involve any string or memory functions that are commonly associated with buffer overflow vulnerabilities, such as strcpy, sprintf, memcpy, or array access without proper bounds checking. However, the code does contain a complex logic flow, which could potentially hide other vulnerabilities. Therefore, it is recommended to perform a more thorough analysis using static analysis tools or dynamic analysis techniques to ensure that no buffer overflow or other vulnerabilities exist in the code.

In summary, based on the given code snippet, it is difficult to definitively determine if the code is vulnerable to a buffer overflow or other security vulnerabilities without further analysis. Therefore, the answer is 'UNDETERMINED'.

However, it is important to note that the code snippet provided does not represent the entire program, and there may be other parts of the code that could contain vulnerabilities. Therefore, it is always recommended to perform a thorough vulnerability assessment on the entire codebase to ensure that all potential vulnerabilities are identified and addressed.","The code contains a Exec_Code_Overflow vulnerability. 
The CVE-ID is CVE-2011-2895. The CWE-ID is CWE-119.
Vulnerability summary:
The LZW decompressor in (1) the BufCompressedFill function in fontfile/decompress.c in X.Org libXfont before 1.4.4 and (2) compress/compress.c in 4.3BSD, as used in zopen.c in OpenBSD before 3.8, FreeBSD, NetBSD 4.0.x and 5.0.x before 5.0.3 and 5.1.x before 5.1.1, FreeType 2.1.9, and other products, does not properly handle code words that are absent from the decompression table when encountered, which allows context-dependent attackers to trigger an infinite loop or a heap-based buffer overflow, and possibly execute arbitrary code, via a crafted compressed stream, a related issue to CVE-2006-1168 and CVE-2011-2896.
",1.0,940.0,6.0,3.1202516555786133
177825,DoS," The given code for the `extractPages` function does not appear to contain any obvious buffer overflow, use-after-free, memory leak, or format string vulnerabilities. However, it does contain a potential vulnerability related to input validation (CWE-20).

The code checks if the destination filename contains a '%d' format specifier for multiple pages, but it does not validate the input for the presence of a single '%d' specifier. If an attacker provides a malicious filename with a format string vulnerability, they could potentially cause a denial-of-service (DoS) condition or execute arbitrary code.

Therefore, the answer is 'YES', and the vulnerability is related to improper input validation (CWE-20). The code should be modified to validate the input filename for the presence of a single '%d' format specifier before proceeding with the snprintf function.","The code contains a DoS vulnerability. 
The CVE-ID is CVE-2013-4474. The CWE-ID is CWE-20.
Vulnerability summary:
Format string vulnerability in the extractPages function in utils/pdfseparate.cc in poppler before 0.24.3 allows remote attackers to cause a denial of service (crash) via format string specifiers in a destination filename.
",4.0,772.0,6.0,2.3666770458221436
177826,DoS Exec Code Overflow," The given code for the `extractPages` function does not appear to contain any obvious buffer overflow vulnerabilities. The `sprintf` function is used within a loop, but the format string `destFileName` is not user-supplied and the length of the `pathName` array is fixed at 1024 bytes. Therefore, it is unlikely that this code is vulnerable to a stack-based buffer overflow.

However, it is important to note that the code may still have other vulnerabilities, such as memory leaks, use-after-free errors, or race conditions. The provided analysis only focuses on buffer overflow vulnerabilities.

Regarding the second code snippet, it is not related to the vulnerability audit and does not contain any apparent buffer overflow vulnerabilities. It is a separate function for building a matrix using topological sorting.","The code contains a DoS_Exec_Code_Overflow vulnerability. 
The CVE-ID is CVE-2013-4473. The CWE-ID is CWE-119.
Vulnerability summary:
Stack-based buffer overflow in the extractPages function in utils/pdfseparate.cc in poppler before 0.24.2 allows remote attackers to cause a denial of service (crash) and possibly execute arbitrary code via a source filename.
",2.0,767.0,6.0,4.706911325454712
177827,," The given code snippet for `jffs2_get_acl` function is not directly related to the vulnerability described in the summary. The vulnerability mentioned in the summary is related to JFFS2 filesystem and its handling of POSIX ACLs.

The code snippet provided does not contain any buffer overflow, use-after-free, memory leak, integer overflow/underflow, null pointer dereference, improper input validation, race condition, insecure function usage, or insecure resource management vulnerabilities. It is safe from the perspective of the given list.

However, it is essential to note that the code snippet might still have other vulnerabilities or issues that are not covered in the given list. It is always a good practice to thoroughly review the code and follow secure coding practices.","The code contains a nan vulnerability. 
The CVE-ID is CVE-2007-4849. The CWE-ID is CWE-264.
Vulnerability summary:
JFFS2, as used on One Laptop Per Child (OLPC) build 542 and possibly other Linux systems, when POSIX ACL support is enabled, does not properly store permissions during (1) inode creation or (2) ACL setting, which might allow local users to access restricted files or directories after a remount of a filesystem, related to ""legacy modes"" and an inconsistency between dentry permissions and inode permissions.
",1.0,790.0,6.0,3.209671974182129
177831,," The given code snippet `mcid_char_imp` does not contain any obvious buffer overflow vulnerabilities, use-after-free errors, memory leaks, or integer overflow/underflow conditions. It appears to be editing strings and removing objects from a PDF context. However, it is still important to validate user inputs and ensure proper error handling to prevent other types of vulnerabilities.

The second code snippet `buildMatrix` is a standalone function and does not directly interact with user inputs or memory management. It appears to be implementing a topological sort and constructing a matrix based on given conditions. This code does not contain any apparent buffer overflow, use-after-free, memory leak, or integer overflow/underflow vulnerabilities.

Therefore, the answer is 'NO' for both code snippets.","The code contains a nan vulnerability. 
The CVE-ID is CVE-2019-14975. The CWE-ID is CWE-125.
Vulnerability summary:
Artifex MuPDF before 1.16.0 has a heap-based buffer over-read in fz_chartorune in fitz/string.c because pdf/pdf-op-filter.c does not check for a missing string.
",1.0,748.0,6.0,6.335046768188477
177832,," The `walk_string` function does not appear to be vulnerable based on the provided code. It does not contain any obvious buffer overflow vulnerabilities, as it uses the correct `strlen` function to determine the length of the string before performing the `memmove` operation. Additionally, it checks if `str->utf8` is null before proceeding with the function, which is a good practice to prevent null pointer dereferencing.

However, it's important to note that the `fz_chartorune` function used in the code is not defined in the provided code snippet, so its behavior and potential vulnerabilities cannot be determined from the given information. It's always a good idea to thoroughly understand the behavior of all functions used in your code before making any security assessments.

The second code snippet provided, `buildMatrix`, is not a C++ function, but rather a C++11 lambda function. It does not contain any apparent buffer overflow vulnerabilities or other security issues based on the provided code. It uses standard C++ libraries and follows good programming practices, such as topological sorting and error checking.

Therefore, the answer is 'NO' for both code snippets.","The code contains a nan vulnerability. 
The CVE-ID is CVE-2019-14975. The CWE-ID is CWE-125.
Vulnerability summary:
Artifex MuPDF before 1.16.0 has a heap-based buffer over-read in fz_chartorune in fitz/string.c because pdf/pdf-op-filter.c does not check for a missing string.
",1.0,825.0,6.0,3.2963414192199707
177833,DoS Overflow," The given `reds_handle_ticket` function does not appear to be vulnerable to buffer overflow attacks based on the provided code. The `password` array is declared with a fixed size `SPICE_MAX_PASSWORD_LENGTH`, and the `RSA_private_decrypt` function is responsible for decrypting the ticket data into the password array. There is no evidence of any bounds checking being bypassed or memory manipulation occurring within the function.

However, the `buildMatrix` function is not related to the `reds_handle_ticket` function and is not a part of the provided code. It is a separate function that performs matrix construction using topological sorting. This function does not involve any string or memory manipulation and is not related to the potential vulnerabilities in the `reds_handle_ticket` function. Therefore, it is not vulnerable to buffer overflow attacks.","The code contains a DoS_Overflow vulnerability. 
The CVE-ID is CVE-2013-4282. The CWE-ID is CWE-119.
Vulnerability summary:
Stack-based buffer overflow in the reds_handle_ticket function in server/reds.c in SPICE 0.12.0 allows remote attackers to cause a denial of service (crash) via a long password in a SPICE ticket.
",1.0,767.0,6.0,3.736264705657959
177839,+Info," Based on the provided code, the `next_codepoint_handle_ext` function does not appear to be vulnerable to the specific vulnerabilities listed in the steps you provided. However, it is always important to ensure proper bounds checking and input validation in C++ code to prevent various types of vulnerabilities. In this case, the code seems to be checking the length of the input string and the size of the output buffer, which is a good practice to prevent buffer overflows. However, it is still essential to validate user inputs and ensure proper error handling to mitigate other potential vulnerabilities.

The second code snippet you provided is not related to the `next_codepoint_handle_ext` function, and it does not contain any C++ code. Therefore, it is not possible to evaluate its vulnerability based on the given information.

Regarding the vulnerability mentioned in the text you provided (CVE-2015-5330), it is a vulnerability in the ldb library used by the AD LDAP server in Samba, and it is not related to the `next_codepoint_handle_ext` function you provided.","The code contains a +Info vulnerability. 
The CVE-ID is CVE-2015-5330. The CWE-ID is CWE-200.
Vulnerability summary:
ldb before 1.1.24, as used in the AD LDAP server in Samba 4.x before 4.1.22, 4.2.x before 4.2.7, and 4.3.x before 4.3.3, mishandles string lengths, which allows remote attackers to obtain sensitive information from daemon heap memory by sending crafted packets and then reading (1) an error message or (2) a database value.
",1.0,863.0,6.0,2.7012598514556885
177840,+Info," The second code snippet provided, `buildMatrix()` function, does not appear to contain any of the vulnerabilities listed in the initial instructions. It is written in C++ and focuses on matrix construction using topological sorting. The function does not involve string manipulation, memory management, or arithmetic operations that could lead to the identified vulnerabilities. Therefore, the answer is 'NO'.","The code contains a +Info vulnerability. 
The CVE-ID is CVE-2015-5330. The CWE-ID is CWE-200.
Vulnerability summary:
ldb before 1.1.24, as used in the AD LDAP server in Samba 4.x before 4.1.22, 4.2.x before 4.2.7, and 4.3.x before 4.3.3, mishandles string lengths, which allows remote attackers to obtain sensitive information from daemon heap memory by sending crafted packets and then reading (1) an error message or (2) a database value.
",1.0,723.0,6.0,3.298365831375122
177841,+Info," The given code for the function `strupper_talloc_n_handle` is not directly vulnerable to the vulnerabilities listed in the provided steps. However, it does allocate memory based on the input size `n`, which could potentially lead to a buffer overflow if the input size is not properly validated. It is essential to ensure that the input size is checked and limited to the expected maximum size to prevent potential buffer overflow vulnerabilities.

The second code snippet provided is not related to the vulnerability audit and is not C++ code. It is a C++11 lambda function written in the C++14 syntax. This code does not contain any apparent vulnerabilities.

Therefore, the answer is:

For the first code snippet:
YES, it has the potential to be vulnerable to buffer overflow if the input size is not properly validated.

For the second code snippet:
NO, it does not contain any apparent vulnerabilities.","The code contains a +Info vulnerability. 
The CVE-ID is CVE-2015-5330. The CWE-ID is CWE-200.
Vulnerability summary:
ldb before 1.1.24, as used in the AD LDAP server in Samba 4.x before 4.1.22, 4.2.x before 4.2.7, and 4.3.x before 4.3.3, mishandles string lengths, which allows remote attackers to obtain sensitive information from daemon heap memory by sending crafted packets and then reading (1) an error message or (2) a database value.
",2.0,825.0,6.0,3.3964712619781494
177842,+Info," The given code for the function `next_codepoint_handle_ext` is not vulnerable to the vulnerability described in the provided CVE-ID (CVE-2015-5330) and CWE-ID (CWE-200). The code does not involve mishandling string lengths or sensitive information exposure.

However, the second code snippet provided, which is a separate function `buildMatrix`, is not related to the vulnerability discussed in the question. It appears to be a different function that performs matrix construction based on given conditions. This code does not seem to have any apparent vulnerabilities based on the provided context.","The code contains a +Info vulnerability. 
The CVE-ID is CVE-2015-5330. The CWE-ID is CWE-200.
Vulnerability summary:
ldb before 1.1.24, as used in the AD LDAP server in Samba 4.x before 4.1.22, 4.2.x before 4.2.7, and 4.3.x before 4.3.3, mishandles string lengths, which allows remote attackers to obtain sensitive information from daemon heap memory by sending crafted packets and then reading (1) an error message or (2) a database value.
",1.0,769.0,6.0,3.349996328353882
177843,+Info," Based on the given code, the `strlen_m_ext_handle` function is not vulnerable to the specific vulnerabilities listed in the provided steps (Buffer Overflow, Use After Free, Memory Leaks, Integer Overflow/Underflow, Null Pointer Dereference, Improper Input Validation, Race Conditions, Insecure Function Usage, Insecure Resource Management, Improper Error Handling, Cryptographic Issues, and Sensitive Data Exposure).

However, it does have some potential issues:

1. The code does not check the return value of `next_codepoint_handle_ext` function, which could potentially lead to unchecked errors or unexpected behavior if the function call fails.
2. The code does not validate the input `s` before processing it, which could potentially lead to issues if `s` is a null pointer or contains invalid data.
3. The code does not handle errors or exceptions properly, which could potentially lead to unintended behavior or crashes if an error occurs.
4. The code does not check the validity of the `dst_charset` and `src_charset` inputs, which could potentially lead to issues if these values are not as expected.

These issues do not directly result in security vulnerabilities but could potentially lead to errors or unexpected behavior. It is recommended to address these issues to improve the robustness and reliability of the code.","The code contains a +Info vulnerability. 
The CVE-ID is CVE-2015-5330. The CWE-ID is CWE-200.
Vulnerability summary:
ldb before 1.1.24, as used in the AD LDAP server in Samba 4.x before 4.1.22, 4.2.x before 4.2.7, and 4.3.x before 4.3.3, mishandles string lengths, which allows remote attackers to obtain sensitive information from daemon heap memory by sending crafted packets and then reading (1) an error message or (2) a database value.
",2.0,908.0,6.0,5.1769373416900635
177844,+Info," The given code for the function `strupper_talloc_n_handle` is not directly vulnerable to the vulnerabilities listed in the provided steps. However, it does allocate memory based on the input size `n`, which could potentially lead to a buffer overflow if the input size is not properly validated. It is essential to ensure that the input size is checked and limited to a safe value before passing it to the `talloc_array` function.

The second code snippet provided is not related to the vulnerability assessment and is not C++ code. It is a C++11 lambda function written in the C++14 syntax. This code does not contain any apparent vulnerabilities.

Therefore, the answer is:

For the first code snippet: 'Maybe' - It could be vulnerable if the input size is not properly validated.
For the second code snippet: 'No'.","The code contains a +Info vulnerability. 
The CVE-ID is CVE-2015-5330. The CWE-ID is CWE-200.
Vulnerability summary:
ldb before 1.1.24, as used in the AD LDAP server in Samba 4.x before 4.1.22, 4.2.x before 4.2.7, and 4.3.x before 4.3.3, mishandles string lengths, which allows remote attackers to obtain sensitive information from daemon heap memory by sending crafted packets and then reading (1) an error message or (2) a database value.
",2.0,819.0,6.0,2.8170900344848633
177848,," The given code for `do_connect` function is not directly related to the vulnerability described in the CVE-2015-5296. The vulnerability is related to Samba's handling of encrypted connections, which is not apparent in the provided code. Therefore, the answer is 'NO'.","The code contains a nan vulnerability. 
The CVE-ID is CVE-2015-5296. The CWE-ID is CWE-20.
Vulnerability summary:
Samba 3.x and 4.x before 4.1.22, 4.2.x before 4.2.7, and 4.3.x before 4.3.3 supports connections that are encrypted but unsigned, which allows man-in-the-middle attackers to conduct encrypted-to-unencrypted downgrade attacks by modifying the client-server data stream, related to clidfs.c, libsmb_server.c, and smbXcli_base.c.
",1.0,704.0,6.0,2.6592965126037598
177850,DoS Overflow," Based on the given code, the `datum_to_json` function does not appear to be vulnerable to a DoS overflow vulnerability as described in the provided CVE-ID and CWE-ID. The function does not contain any obvious buffer overflow conditions, such as writing beyond the bounds of allocated memory or using functions like `sprintf` or `strcpy` without proper bounds checking.

However, it is important to note that the code snippet provided does not represent the entire program, and there may be other parts of the codebase that could contain vulnerabilities. It is always recommended to perform a thorough vulnerability assessment on the entire codebase to ensure the security of the application.","The code contains a DoS_Overflow vulnerability. 
The CVE-ID is CVE-2015-5289. The CWE-ID is CWE-119.
Vulnerability summary:
Multiple stack-based buffer overflows in json parsing in PostgreSQL before 9.3.x before 9.3.10 and 9.4.x before 9.4.5 allow attackers to cause a denial of service (server crash) via unspecified vectors, which are not properly handled in (1) json or (2) jsonb values.
",1.0,759.0,6.0,2.550727128982544
177851,DoS Overflow," The given `parse_array` function does not appear to be directly vulnerable to the mentioned vulnerabilities in the provided code snippet. However, it does call other functions (`parse_array_element`) that could potentially contain vulnerabilities. It is essential to review those functions as well.

The `buildMatrix` function is not related to the `parse_array` function and does not contain any apparent vulnerabilities. It is a separate function that constructs a matrix based on given conditions.

Therefore, the answer is 'NO' for the `parse_array` function, but it is crucial to review other related functions as well.","The code contains a DoS_Overflow vulnerability. 
The CVE-ID is CVE-2015-5289. The CWE-ID is CWE-119.
Vulnerability summary:
Multiple stack-based buffer overflows in json parsing in PostgreSQL before 9.3.x before 9.3.10 and 9.4.x before 9.4.5 allow attackers to cause a denial of service (server crash) via unspecified vectors, which are not properly handled in (1) json or (2) jsonb values.
",1.0,746.0,6.0,4.078662395477295
177852,DoS Overflow," The given `parse_object` function does not appear to be directly vulnerable to the mentioned vulnerabilities in the provided list. However, it does call other functions (`parse_object_field`) that could potentially contain vulnerabilities. It is essential to review those functions as well.

The `buildMatrix` function provided is not related to the `parse_object` function and does not contain any apparent vulnerabilities. It is a separate function that constructs a matrix based on given conditions.","The code contains a DoS_Overflow vulnerability. 
The CVE-ID is CVE-2015-5289. The CWE-ID is CWE-119.
Vulnerability summary:
Multiple stack-based buffer overflows in json parsing in PostgreSQL before 9.3.x before 9.3.10 and 9.4.x before 9.4.5 allow attackers to cause a denial of service (server crash) via unspecified vectors, which are not properly handled in (1) json or (2) jsonb values.
",1.0,718.0,6.0,3.1495981216430664
177853,DoS Overflow," Based on the given code, the `setPath` function does not appear to be directly vulnerable to buffer overflows, as it does not involve string or memory functions like `strcpy`, `sprintf`, `memcpy`, or array access without proper bounds checking. However, it does call other functions like `setPathArray` and `setPathObject`, which may contain their own buffer overflow vulnerabilities. Therefore, it is important to thoroughly review those functions as well.

The `buildMatrix` function does not contain any obvious buffer overflow vulnerabilities, as it does not involve string or memory functions that could lead to buffer overflows. It does involve topological sorting and matrix manipulation, but these operations do not inherently introduce buffer overflow vulnerabilities.

However, it is important to note that the given code snippet may not be the complete picture, and there may be other parts of the program that could contain vulnerabilities. Therefore, a thorough vulnerability assessment should be conducted on the entire codebase to ensure the security of the application.","The code contains a DoS_Overflow vulnerability. 
The CVE-ID is CVE-2015-5289. The CWE-ID is CWE-119.
Vulnerability summary:
Multiple stack-based buffer overflows in json parsing in PostgreSQL before 9.3.x before 9.3.10 and 9.4.x before 9.4.5 allow attackers to cause a denial of service (server crash) via unspecified vectors, which are not properly handled in (1) json or (2) jsonb values.
",1.0,830.0,6.0,3.175830364227295
