case_id,vuln_type,audit_report,gt,eval_score,eval_input_token_num,eval_output_token_num,eval_inference_time
177856,," Based on the provided code, there doesn't seem to be any obvious vulnerability related to the nan (CVE-2019-13638, CWE-78) vulnerability mentioned in the initial code snippet. The code you've shared appears to be unrelated to the ed script handling and doesn't involve any shell command injection or file manipulation that could lead to such vulnerabilities.

Therefore, my answer is 'NO'.","The code contains a nan vulnerability. 
The CVE-ID is CVE-2019-13638. The CWE-ID is CWE-78.
Vulnerability summary:
GNU patch through 2.7.6 is vulnerable to OS shell command injection that can be exploited by opening a crafted patch file that contains an ed style diff payload with shell metacharacters. The ed editor does not need to be present on the vulnerable system. This is different from CVE-2018-1000156.
",1.0,699.0,6.0,2.5948731899261475
177857,," The given code for `plan_a` function is not directly related to the `minAbsDifference` function provided in the second part of the code. Therefore, I cannot determine if the `minAbsDifference` function is vulnerable based on the given code alone.

However, I can evaluate the `plan_a` function for potential vulnerabilities as per the steps mentioned in the task.

1. Buffer Overflow: The `buffer` is allocated based on the file size, and the data is read into it. However, there is no check on the actual number of bytes read from the file. If the file contains more data than the allocated size, it may result in a buffer overflow.
2. Use After Free: The code does not check if the file is empty before reading it. If the file is empty, the `buffer` is allocated but not used, and later, when the file is closed, the `free(buffer)` call is made, which may lead to use-after-free vulnerabilities.
3. Memory Leaks: The code does not check for errors while reading the file, and if an error occurs, it does not free the allocated memory. This may result in memory leaks.
4. Integer Overflow/Underflow: The code does not check for integer overflow/underflow conditions.
5. Null Pointer Dereference: The code does not check for null pointers before derefer","The code contains a nan vulnerability. 
The CVE-ID is CVE-2019-13636. The CWE-ID is CWE-59.
Vulnerability summary:
In GNU patch through 2.7.6, the following of symlinks is mishandled in certain cases other than input files. This affects inp.c and util.c.
",2.0,875.0,6.0,1.42608642578125
177859,Exec Code Bypass," The given gs_nulldevice function does not directly contain any obvious vulnerabilities related to the provided list. However, it does call other functions (e.g., dev_proc, gs_copydevice, gs_setdevice_no_erase, etc.) that could potentially have vulnerabilities. It is essential to review those functions' implementations as well.

The minAbsDifference function, on the other hand, does not appear to have any direct security vulnerabilities. It is a standalone function that calculates the minimum absolute difference between a goal number and the sum of some numbers in a vector. It does not involve any input validation, memory management, or other operations that could lead to vulnerabilities.

Therefore, the answer is:

gs_nulldevice function: 'MAYBE' (It depends on the implementation of the called functions)
minAbsDifference function: 'NO'","The code contains a Exec_Code_Bypass vulnerability. 
The CVE-ID is CVE-2018-16863. The CWE-ID is CWE-78.
Vulnerability summary:
It was found that RHSA-2018:2918 did not fully fix CVE-2018-16509. An attacker could possibly exploit another variant of the flaw and bypass the -dSAFER protection to, for example, execute arbitrary shell commands via a specially crafted PostScript document. This only affects ghostscript 9.07 as shipped with Red Hat Enterprise Linux 7.
",1.0,804.0,6.0,2.639927625656128
177860,Exec Code Bypass," The given `zrestore` function does not appear to be directly related to the `minAbsDifference` function. Therefore, I cannot definitively say whether the `minAbsDifference` function is vulnerable based on the provided code alone.

However, I can tell you that the `zrestore` function does not seem to contain any obvious buffer overflow, use-after-free, memory leak, or null pointer dereference vulnerabilities based on the given code. It does contain some potential race conditions, as it modifies shared data (the stack entries) without proper synchronization. However, without more context, it's difficult to determine if these race conditions are exploitable.

As for the `minAbsDifference` function, it does not contain any obvious buffer overflow, use-after-free, memory leak, null pointer dereference, or race condition vulnerabilities based on the given code. It does use some advanced data structures and algorithms, but these do not appear to be used in a way that would introduce vulnerabilities.

Therefore, my answer is 'NO', the `minAbsDifference` function does not appear to be vulnerable based on the given code.","The code contains a Exec_Code_Bypass vulnerability. 
The CVE-ID is CVE-2018-16863. The CWE-ID is CWE-78.
Vulnerability summary:
It was found that RHSA-2018:2918 did not fully fix CVE-2018-16509. An attacker could possibly exploit another variant of the flaw and bypass the -dSAFER protection to, for example, execute arbitrary shell commands via a specially crafted PostScript document. This only affects ghostscript 9.07 as shipped with Red Hat Enterprise Linux 7.
",1.0,858.0,6.0,2.4770843982696533
177862,Exec Code," The given `restore_page_device` function does not appear to be directly related to the `minAbsDifference` function provided. Therefore, I cannot determine if the `restore_page_device` function is vulnerable based on the code snippet given.

However, I can evaluate the `minAbsDifference` function for potential vulnerabilities:

1. Buffer Overflow: The function does not involve any string or memory functions that could lead to buffer overflow vulnerabilities.
2. Use After Free: The function does not dynamically allocate memory that could lead to use-after-free vulnerabilities.
3. Memory Leaks: The function does not dynamically allocate memory that could lead to memory leaks.
4. Integer Overflow/Underflow: The function does not involve arithmetic operations on integers that could lead to integer overflow or underflow vulnerabilities.
5. Null Pointer Dereference: The function does not dereference pointers that could be null, as it does not involve pointers.
6. Improper Input Validation: The function does not involve user input, so it is not susceptible to improper input validation vulnerabilities.
7. Race Conditions: The function is not multi-threaded, so it is not susceptible to race conditions.
8. Insecure Function Usage: The function does not use any insecure or deprecated functions.
9. Insecure Resource Management","The code contains a Exec_Code vulnerability. 
The CVE-ID is CVE-2018-16802. The CWE-ID is nan.
Vulnerability summary:
An issue was discovered in Artifex Ghostscript before 9.25. Incorrect ""restoration of privilege"" checking when running out of stack during exception handling could be used by attackers able to supply crafted PostScript to execute code using the ""pipe"" instruction. This is due to an incomplete fix for CVE-2018-16509.
",1.0,877.0,6.0,3.281155586242676
177865,DoS," Based on the given code, the PatternMatch function is not directly related to the minAbsDifference function. The PatternMatch function is a separate function with its own vulnerabilities, as discussed earlier. The minAbsDifference function, on the other hand, appears to be a different function that calculates the minimum absolute difference between a goal number and the sum of some numbers in a vector. It does not contain any apparent vulnerabilities related to buffer overflows, use-after-free, memory leaks, or other security issues. Therefore, the answer is 'NO'.","The code contains a DoS vulnerability. 
The CVE-ID is CVE-2017-13720. The CWE-ID is CWE-125.
Vulnerability summary:
In the PatternMatch function in fontfile/fontdir.c in libXfont through 1.5.2 and 2.x before 2.0.2, an attacker with access to an X connection can cause a buffer over-read during pattern matching of fonts, leading to information disclosure or a crash (denial of service). This occurs because '\0' characters are incorrectly skipped in situations involving ? characters.
",1.0,746.0,6.0,3.8864481449127197
177867,," YES, The code is vulnerable to use-after-free (CWE-416) due to the lack of proper memory management when freeing the 'i_ctx_p' pointer after the call to 'interp_reclaim()'. This can lead to arbitrary code execution or crashes.","The code contains a nan vulnerability. 
The CVE-ID is CVE-2018-16541. The CWE-ID is CWE-416.
Vulnerability summary:
In Artifex Ghostscript before 9.24, attackers able to supply crafted PostScript files could use incorrect free logic in pagedevice replacement to crash the interpreter.
",3.0,641.0,6.0,2.6929028034210205
177869,," Based on the provided code snippet, the `zsetcolor` function does not appear to be directly vulnerable to the nan vulnerability described in the given context. However, it's important to note that the vulnerability may exist in other parts of the codebase, and the `zsetcolor` function could potentially be called with malicious input that triggers the vulnerability. Therefore, it's crucial to thoroughly analyze the entire codebase and all input handling mechanisms to ensure the absence of such vulnerabilities.

In the given `zsetcolor` function, there are no obvious signs of buffer overflows, use-after-free errors, memory leaks, or other vulnerabilities related to the nan vulnerability. The code appears to be handling memory allocation and deallocation properly, and there are no instances of unchecked arithmetic operations or null pointer dereferencing.

However, it's essential to remember that the absence of vulnerabilities in the given function does not guarantee the entire codebase is free of vulnerabilities. Thoroughly analyzing the entire codebase and all input handling mechanisms is necessary to ensure the absence of such vulnerabilities.","The code contains a nan vulnerability. 
The CVE-ID is CVE-2018-16513. The CWE-ID is CWE-704.
Vulnerability summary:
In Artifex Ghostscript before 9.24, attackers able to supply crafted PostScript files could use a type confusion in the setcolor function to crash the interpreter or possibly have unspecified other impact.
",1.0,802.0,6.0,2.6993329524993896
177870,," The second code snippet provided is not directly related to the first vulnerable code snippet. It is a separate function for finding the minimum absolute difference between a goal number and the sum of elements in a vector. This code does not contain any apparent vulnerabilities related to the given vulnerability types in the first code snippet.

Therefore, the answer is 'NO'.","The code contains a nan vulnerability. 
The CVE-ID is CVE-2018-16511. The CWE-ID is CWE-704.
Vulnerability summary:
An issue was discovered in Artifex Ghostscript before 9.24. A type confusion in ""ztype"" could be used by remote attackers able to supply crafted PostScript to crash the interpreter or possibly have unspecified other impact.
",1.0,669.0,6.0,2.492288827896118
177874,Exec Code Overflow," Based on the given code, the `aes_crypt_ecb` function does not appear to be vulnerable to Exec, Code, Overflow vulnerabilities as it does not involve user input or memory manipulation beyond the bounds of allocated memory. The function is solely responsible for performing AES encryption and decryption operations using pre-allocated memory.

Therefore, the answer is 'NO'.","The code contains a Exec_Code_Overflow vulnerability. 
The CVE-ID is CVE-2018-15911. The CWE-ID is CWE-119.
Vulnerability summary:
In Artifex Ghostscript 9.23 before 2018-08-24, attackers able to supply crafted PostScript could use uninitialized memory access in the aesdecode operator to crash the interpreter or potentially execute code.
",1.0,675.0,6.0,2.7814865112304688
177875,Exec Code Overflow," Based on the provided code, the `s_aes_process` function does not appear to be directly vulnerable to the Exec, Code, Overflow vulnerability described in the initial context. The function is primarily concerned with decrypting data using AES-CBCS mode, and does not contain any obvious buffer overflow conditions or unchecked memory accesses that could lead to arbitrary code execution.

However, it is important to note that the code snippet provided is only a part of the larger Ghostscript implementation, and other parts of the codebase may still contain vulnerabilities. It is always recommended to perform a thorough vulnerability assessment on the entire codebase to ensure the security of the application.

Therefore, the answer is 'NO', the `s_aes_process` function is not vulnerable to the Exec, Code, Overflow vulnerability as described in the initial context.","The code contains a Exec_Code_Overflow vulnerability. 
The CVE-ID is CVE-2018-15911. The CWE-ID is CWE-119.
Vulnerability summary:
In Artifex Ghostscript 9.23 before 2018-08-24, attackers able to supply crafted PostScript could use uninitialized memory access in the aesdecode operator to crash the interpreter or potentially execute code.
",1.0,766.0,6.0,2.5013949871063232
177879,DoS Exec Code Overflow," The given `fdctrl_read_data` function does not appear to be directly vulnerable to the mentioned vulnerabilities (DoS, Exec, Code, Overflow) based on the provided code snippet. However, it is always important to ensure proper bounds checking and input validation in all functions, even if they don't seem vulnerable at first glance.

The second function `minAbsDifference` is not related to the given vulnerabilities and is not a C++ code snippet. It is a C++11 function written in a more modern C++ style. This function does not contain any apparent vulnerabilities, but it does have a high time complexity of O(n * 2^(n/2)). This complexity can be improved using more efficient algorithms or data structures.","The code contains a DoS_Exec_Code_Overflow vulnerability. 
The CVE-ID is CVE-2015-3456. The CWE-ID is CWE-119.
Vulnerability summary:
The Floppy Disk Controller (FDC) in QEMU, as used in Xen 4.5.x and earlier and KVM, allows local guest users to cause a denial of service (out-of-bounds write and guest crash) or possibly execute arbitrary code via the (1) FD_CMD_READ_ID, (2) FD_CMD_DRIVE_SPECIFICATION_COMMAND, or other unspecified commands, aka VENOM.
",1.0,788.0,6.0,2.179067373275757
177880,Bypass," Based on the provided code snippet, the `check_file_permissions_reduced` function does not directly involve any memory management or string manipulation functions that are commonly associated with buffer overflow vulnerabilities. However, it does involve file path checking and string matching, which could potentially be exploited if the file path validation is not properly implemented.

The vulnerability described in the given context (CVE-2018-15908) is related to a bypass of.tempfile restrictions in Artifex Ghostscript, which is not directly related to the code snippet provided.

Therefore, based on the given code snippet, it is not clear if the code is vulnerable to any specific security vulnerabilities, such as buffer overflow or use-after-free errors. However, it is always a good practice to carefully validate and sanitize user inputs, especially when dealing with file paths or other external data.

So, my answer is 'NO', but with a caveat that the code should be carefully reviewed for proper input validation and file path checking.","The code contains a Bypass vulnerability. 
The CVE-ID is CVE-2018-15908. The CWE-ID is nan.
Vulnerability summary:
In Artifex Ghostscript 9.23 before 2018-08-23, attackers are able to supply malicious PostScript files to bypass .tempfile restrictions and write files.
",1.0,787.0,6.0,3.5235769748687744
177881,DoS, The second code snippet provided does not appear to contain any obvious vulnerabilities related to the given list. It is a separate function that calculates the minimum absolute difference between an array of integers and a goal integer. The function uses standard C++ library functions and does not involve any memory management or input validation that could lead to vulnerabilities.,"The code contains a DoS vulnerability. 
The CVE-ID is CVE-2019-12382. The CWE-ID is CWE-476.
Vulnerability summary:
An issue was discovered in drm_load_edid_firmware in drivers/gpu/drm/drm_edid_load.c in the Linux kernel through 5.1.5. There is an unchecked kstrdup of fwstr, which might allow an attacker to cause a denial of service (NULL pointer dereference and system crash).
",1.0,684.0,6.0,4.013392686843872
177883,," Based on the provided code, the `hook_print` function does not appear to contain any of the vulnerabilities listed in the steps you've outlined. It is primarily focused on memory allocation and adding a new hook to a list. However, it's important to note that the code snippet you've provided is incomplete and does not include the `gnutls_cb` function or the `HOOK_CONNECT` macro, which could potentially introduce vulnerabilities if not implemented correctly. Therefore, it's essential to review the entire codebase and not just individual functions in isolation.","The code contains a nan vulnerability. 
The CVE-ID is CVE-2011-1428. The CWE-ID is CWE-20.
Vulnerability summary:
Wee Enhanced Environment for Chat (aka WeeChat) 0.3.4 and earlier does not properly verify that the server hostname matches the domain name of the subject of an X.509 certificate, which allows man-in-the-middle attackers to spoof an SSL chat server via an arbitrary certificate, related to incorrect use of the GnuTLS API.
",1.0,729.0,6.0,2.141937255859375
177887,DoS Overflow," The given C++ code for `gs_heap_alloc_bytes` function does not directly involve the `minAbsDifference` function provided. Therefore, it is not possible to determine the vulnerability of the `minAbsDifference` function based on the provided `gs_heap_alloc_bytes` code alone.

However, I can evaluate the `gs_heap_alloc_bytes` function based on the steps you've provided. Based on the given code, the `gs_heap_alloc_bytes` function does not appear to be vulnerable to the specific vulnerabilities mentioned in the steps you've provided, such as buffer overflow, use-after-free, memory leak, integer overflow, null pointer dereference, improper input validation, race conditions, insecure function usage, insecure resource management, or improper error handling.

However, it is important to note that the code snippet you've provided may not be the complete implementation of the `gs_heap_alloc_bytes` function, and there could be other vulnerabilities or issues that are not apparent from the given code alone. Additionally, the code snippet may be using other libraries or functions that could introduce vulnerabilities. Therefore, a thorough vulnerability assessment would require a more comprehensive analysis of the entire system and its dependencies.","The code contains a DoS_Overflow vulnerability. 
The CVE-ID is CVE-2015-3228. The CWE-ID is CWE-189.
Vulnerability summary:
Integer overflow in the gs_heap_alloc_bytes function in base/gsmalloc.c in Ghostscript 9.15 and earlier allows remote attackers to cause a denial of service (crash) via a crafted Postscript (ps) file, as demonstrated by using the ps2pdf command, which triggers an out-of-bounds read or write.
",1.0,856.0,6.0,2.546036720275879
177891,DoS," The given RSA_PSS_PARAMS decoding function does not directly involve the minAbsDifference function provided. Therefore, the minAbsDifference function itself is not vulnerable based on the code snippet provided.","The code contains a DoS vulnerability. 
The CVE-ID is CVE-2015-3194. The CWE-ID is nan.
Vulnerability summary:
crypto/rsa/rsa_ameth.c in OpenSSL 1.0.1 before 1.0.1q and 1.0.2 before 1.0.2e allows remote attackers to cause a denial of service (NULL pointer dereference and application crash) via an RSA PSS ASN.1 signature that lacks a mask generation function parameter.
",1.0,664.0,6.0,1.900460958480835
177893,+Info," Based on the given code, the function `test_mod_exp` is not directly vulnerable to the vulnerability described in the provided vulnerability summary (CVE-2015-3193). However, it does call the function `BN_mod_exp` and `BN_mod_exp_mont_consttime` which are known to be vulnerable in certain OpenSSL versions. Therefore, if the OpenSSL library being used is affected by the CVE-2015-3193 vulnerability, then the `test_mod_exp` function could potentially be exploited indirectly.

However, it's important to note that the vulnerability summary provided mentions that the vulnerability is specific to the x86\_64 platform and OpenSSL 1.0.2 before 1.0.2e. If the OpenSSL library being used is not within this range, then the `test_mod_exp` function is not vulnerable.

Additionally, the code snippet provided does not show how the OpenSSL library is being initialized or used, so it's impossible to determine for certain if the vulnerable OpenSSL version is being used.

Therefore, the answer is:

'Maybe'

If the OpenSSL library being used is within the vulnerable range (x86\_64 platform and OpenSSL 1.0.2 before 1.0","The code contains a +Info vulnerability. 
The CVE-ID is CVE-2015-3193. The CWE-ID is CWE-200.
Vulnerability summary:
The Montgomery squaring implementation in crypto/bn/asm/x86_64-mont5.pl in OpenSSL 1.0.2 before 1.0.2e on the x86_64 platform, as used by the BN_mod_exp function, mishandles carry propagation and produces incorrect output, which makes it easier for remote attackers to obtain sensitive private-key information via an attack against use of a (1) Diffie-Hellman (DH) or (2) Diffie-Hellman Ephemeral (DHE) ciphersuite.
",3.0,922.0,6.0,3.439004898071289
177896,," The given 'become_daemon' function is not directly related to the vulnerability described in the CVE-2013-2007. This function appears to be a daemonization function, which is used to run a process in the background as a separate entity. It does not contain any obvious vulnerabilities based on the provided code snippet.

However, the'minAbsDifference' function, which is not provided in the code snippet, is a different function with its own potential vulnerabilities. It is essential to evaluate this function separately, following the steps mentioned earlier.

So, for the 'become_daemon' function, the answer is 'NO'.","The code contains a nan vulnerability. 
The CVE-ID is CVE-2013-2007. The CWE-ID is CWE-264.
Vulnerability summary:
The qemu guest agent in Qemu 1.4.1 and earlier, as used by Xen, when started in daemon mode, uses weak permissions for certain files, which allows local users to read and write to these files.
",1.0,730.0,6.0,2.697932481765747
177897,+Info," The first code snippet is vulnerable. The vulnerability is related to the XML External Entity (XXE) issue, as the code allows the loading of external entities from files. This can potentially lead to arbitrary file reading and other attacks.

The second code snippet is not directly related to the given vulnerability audit steps. It is a separate function for finding the minimum absolute difference between a goal number and the sum of some numbers in a vector. This code does not contain any apparent security vulnerabilities.","The code contains a +Info vulnerability. 
The CVE-ID is CVE-2013-1824. The CWE-ID is CWE-200.
Vulnerability summary:
The SOAP parser in PHP before 5.3.22 and 5.4.x before 5.4.12 allows remote attackers to read arbitrary files via a SOAP WSDL file containing an XML external entity declaration in conjunction with an entity reference, related to an XML External Entity (XXE) issue in the soap_xmlParseFile and soap_xmlParseMemory functions.
",3.0,725.0,6.0,1.7522931098937988
177898,+Info," The given C++ code for the function `minAbsDifference` does not directly involve any XML parsing or memory handling, so it is not vulnerable to the XML External Entity (XXE) issue or buffer overflow vulnerabilities mentioned in the original code. Therefore, the answer is 'NO'.","The code contains a +Info vulnerability. 
The CVE-ID is CVE-2013-1824. The CWE-ID is CWE-200.
Vulnerability summary:
The SOAP parser in PHP before 5.3.22 and 5.4.x before 5.4.12 allows remote attackers to read arbitrary files via a SOAP WSDL file containing an XML external entity declaration in conjunction with an entity reference, related to an XML External Entity (XXE) issue in the soap_xmlParseFile and soap_xmlParseMemory functions.
",1.0,687.0,6.0,3.006025552749634
177899,+Info," The provided `xmlDocPtr soap_xmlParseFile` function is not directly related to the given `minAbsDifference` function. Therefore, I cannot determine if the `minAbsDifference` function is vulnerable based on the provided code.

However, I can evaluate the `xmlDocPtr soap_xmlParseFile` function based on the information provided in the vulnerability summary. Based on the information provided, the `soap_xmlParseFile` function is vulnerable to XML External Entity (XXE) attacks.

Therefore, the answer is:

YES, the `xmlDocPtr soap_xmlParseFile` function is vulnerable to XML External Entity (XXE) attacks.","The code contains a +Info vulnerability. 
The CVE-ID is CVE-2013-1824. The CWE-ID is CWE-200.
Vulnerability summary:
The SOAP parser in PHP before 5.3.22 and 5.4.x before 5.4.12 allows remote attackers to read arbitrary files via a SOAP WSDL file containing an XML external entity declaration in conjunction with an entity reference, related to an XML External Entity (XXE) issue in the soap_xmlParseFile and soap_xmlParseMemory functions.
",3.0,759.0,6.0,3.5137388706207275
