case_id,vuln_type,audit_report,gt,eval_score,eval_input_token_num,eval_output_token_num,eval_inference_time
177816,Bypass," Based on the provided code, the `get_checksum2` function does not appear to be directly vulnerable to the Bypass vulnerability described in the initial code snippet. However, it does contain some potential issues:

1. Memory management: The function dynamically allocates memory for `buf1` and `len1` based on the input length. If the memory allocation fails, it does not handle the error condition properly. This could potentially lead to undefined behavior or crashes.

2. Buffer handling: The function uses `memcpy` to copy the input buffer into `buf1`. If the input buffer size is larger than expected, it could result in a buffer overflow.

3. Insecure function usage: The function uses the `mdfour_update` function without checking its return value. If the function call fails, the checksum calculation may not be performed correctly.

4. Race conditions: The function uses static variables `buf1` and `len1`. If the function is called concurrently from multiple threads, there is a risk of race conditions and data corruption.

5. Improper error handling: The function does not handle errors properly when allocating memory for `buf1`. If memory allocation fails, the function does not return an error code or throw an exception.

To mitigate these issues, consider the following:

1. Properly handle memory allocation errors by returning an error code","The code contains a Bypass vulnerability. 
The CVE-ID is CVE-2017-15994. The CWE-ID is CWE-354.
Vulnerability summary:
rsync 3.1.3-development before 2017-10-24 mishandles archaic checksums, which makes it easier for remote attackers to bypass intended access restrictions. NOTE: the rsync development branch has significant use beyond the rsync developers, e.g., the code has been copied for use in various GitHub projects.
",2.0,898.0,6.0,3.0268075466156006
177821,DoS," The first code snippet provided does not appear to be directly related to the second code snippet, and it has already been evaluated and determined to be vulnerable in a previous response. Therefore, I will focus on the second code snippet.

The second code snippet, `minAbsDifference`, is not vulnerable to the types of vulnerabilities listed in the initial set of instructions. It is a standalone function that calculates the minimum absolute difference between a goal integer and the sum of some integers in a vector. It does not involve string or memory functions, dynamic memory management, arithmetic operations, pointers, user input, multi-threading, or cryptography.

Therefore, the answer is 'NO'.","The code contains a DoS vulnerability. 
The CVE-ID is CVE-2017-15923. The CWE-ID is nan.
Vulnerability summary:
Konversation 1.4.x, 1.5.x, 1.6.x, and 1.7.x before 1.7.3 allow remote attackers to cause a denial of service (crash) via vectors related to parsing of IRC color formatting codes.
",1.0,743.0,6.0,2.271374464035034
177823,Exec Code Overflow," Based on the given code, the BufCompressedFill function does not directly involve user input or memory management functions that are commonly associated with buffer overflow vulnerabilities. However, the function does call the getcode function, which could potentially be vulnerable to a code injection attack if the input to the compression algorithm is not properly validated. This could lead to arbitrary code execution. Therefore, the code is vulnerable and the vulnerability type is 'Exec', 'Code', 'Injection'.

It is important to note that the vulnerability described in the CVE-2011-2895 and CWE-119 is related to a specific implementation of the LZW decompression algorithm, which is not directly related to the given code. However, the principle of input validation and sanitization applies to all code that processes user input or external data.","The code contains a Exec_Code_Overflow vulnerability. 
The CVE-ID is CVE-2011-2895. The CWE-ID is CWE-119.
Vulnerability summary:
The LZW decompressor in (1) the BufCompressedFill function in fontfile/decompress.c in X.Org libXfont before 1.4.4 and (2) compress/compress.c in 4.3BSD, as used in zopen.c in OpenBSD before 3.8, FreeBSD, NetBSD 4.0.x and 5.0.x before 5.0.3 and 5.1.x before 5.1.1, FreeType 2.1.9, and other products, does not properly handle code words that are absent from the decompression table when encountered, which allows context-dependent attackers to trigger an infinite loop or a heap-based buffer overflow, and possibly execute arbitrary code, via a crafted compressed stream, a related issue to CVE-2006-1168 and CVE-2011-2896.
",2.0,897.0,6.0,1.856316089630127
177825,DoS," Based on the given code, the `extractPages` function is not vulnerable to the format string vulnerability as there is no use of `sprintf` or `snprintf` with untrusted user input in the function. However, there are other potential vulnerabilities in the code, such as buffer overflows in the `snprintf` function call, use-after-free errors, and memory leaks. These vulnerabilities should be addressed by ensuring proper bounds checking, tracing pointer lifetimes, and proper memory management.","The code contains a DoS vulnerability. 
The CVE-ID is CVE-2013-4474. The CWE-ID is CWE-20.
Vulnerability summary:
Format string vulnerability in the extractPages function in utils/pdfseparate.cc in poppler before 0.24.3 allows remote attackers to cause a denial of service (crash) via format string specifiers in a destination filename.
",2.0,699.0,6.0,3.6329567432403564
177826,DoS Exec Code Overflow," The given code for the `extractPages` function does not appear to contain any obvious buffer overflow vulnerabilities. However, there are other potential vulnerabilities, such as use-after-free, memory leaks, and improper input validation, which should be addressed.

The `minAbsDifference` function provided in the second part of the question is not related to the `extractPages` function and does not contain any apparent buffer overflow vulnerabilities. It does, however, have a time complexity of O(n * 2^(n/2)), which may impact performance for large inputs.

Therefore, the answer for the `extractPages` function is 'NO', and there is no need to provide a reason for the `minAbsDifference` function since it is not related to the vulnerability audit.","The code contains a DoS_Exec_Code_Overflow vulnerability. 
The CVE-ID is CVE-2013-4473. The CWE-ID is CWE-119.
Vulnerability summary:
Stack-based buffer overflow in the extractPages function in utils/pdfseparate.cc in poppler before 0.24.2 allows remote attackers to cause a denial of service (crash) and possibly execute arbitrary code via a source filename.
",2.0,760.0,6.0,2.233232021331787
177827,," The given C++ code for the function `minAbsDifference` does not appear to contain any obvious security vulnerabilities based on the provided code alone. It is focused on finding the minimum absolute difference between a goal number and the sum of some numbers in a vector. The code does not involve any string or memory manipulation functions, file or network input handling, or other potential sources of security vulnerabilities as listed in the provided steps. Therefore, the answer is 'NO'.","The code contains a nan vulnerability. 
The CVE-ID is CVE-2007-4849. The CWE-ID is CWE-264.
Vulnerability summary:
JFFS2, as used on One Laptop Per Child (OLPC) build 542 and possibly other Linux systems, when POSIX ACL support is enabled, does not properly store permissions during (1) inode creation or (2) ACL setting, which might allow local users to access restricted files or directories after a remount of a filesystem, related to ""legacy modes"" and an inconsistency between dentry permissions and inode permissions.
",1.0,734.0,6.0,2.428755283355713
177831,," The given `mcid_char_imp` function does not directly contain any obvious buffer overflow vulnerabilities, as it does not involve any string copying functions like `strcpy` or `sprintf` that could lead to buffer overflows. However, it does call the `walk_string` function, which is not shown in the code snippet. If `walk_string` contains any buffer overflow vulnerabilities, then the `mcid_char_imp` function could be indirectly vulnerable.

Therefore, it is not possible to definitively determine if the `mcid_char_imp` function is vulnerable based on the given code alone. However, it is always a good practice to ensure that all functions called from the function are secure and do not contain any vulnerabilities.","The code contains a nan vulnerability. 
The CVE-ID is CVE-2019-14975. The CWE-ID is CWE-125.
Vulnerability summary:
Artifex MuPDF before 1.16.0 has a heap-based buffer over-read in fz_chartorune in fitz/string.c because pdf/pdf-op-filter.c does not check for a missing string.
",1.0,742.0,6.0,2.7998013496398926
177832,," The `walk_string` function in the provided code does not appear to be vulnerable to the mentioned vulnerabilities (Buffer Overflow, Use After Free, Memory Leaks, Integer Overflow/Underflow, Null Pointer Dereference, Improper Input Validation, Race Conditions, Insecure Function Usage, Insecure Resource Management, Improper Error Handling, Cryptographic Issues, or Sensitive Data Exposure) based on the given code snippet.

However, it is essential to note that the code snippet provided may not represent the entire program, and other parts of the codebase could potentially contain vulnerabilities. It is always recommended to perform a thorough vulnerability assessment on the entire codebase to ensure its security.","The code contains a nan vulnerability. 
The CVE-ID is CVE-2019-14975. The CWE-ID is CWE-125.
Vulnerability summary:
Artifex MuPDF before 1.16.0 has a heap-based buffer over-read in fz_chartorune in fitz/string.c because pdf/pdf-op-filter.c does not check for a missing string.
",1.0,730.0,6.0,2.109243631362915
177833,DoS Overflow," The given code for `reds_handle_ticket` function is not vulnerable to buffer overflow as it does not involve any string or memory functions that can lead to buffer overflow vulnerabilities. The code is only performing RSA decryption and password validation checks.

However, the code snippet for `minAbsDifference` function is not provided in the given C++ code. Therefore, it cannot be evaluated for vulnerabilities in this context.","The code contains a DoS_Overflow vulnerability. 
The CVE-ID is CVE-2013-4282. The CWE-ID is CWE-119.
Vulnerability summary:
Stack-based buffer overflow in the reds_handle_ticket function in server/reds.c in SPICE 0.12.0 allows remote attackers to cause a denial of service (crash) via a long password in a SPICE ticket.
",1.0,684.0,6.0,2.1234121322631836
177839,+Info," Based on the given code, the `next_codepoint_handle_ext` function is not directly vulnerable to the vulnerabilities listed in the provided steps. However, it does contain some unusual behavior that might indicate other potential issues, such as the repeated calls to `smb_iconv` with the same input and descriptor. It's essential to consider the context of this function within the larger codebase to determine if there are any related vulnerabilities.

As for the second code snippet, it is not related to the C++ code provided earlier, and it is not a C++ code. It is a C++11 code written in a different style. This code does not appear to have any apparent vulnerabilities based on the given function definition and implementation. However, it is essential to consider the context of this function within the larger codebase to determine if there are any related vulnerabilities.

Therefore, the answer for the first code snippet is 'NO', and for the second code snippet, it is not applicable since it is not C++ code.","The code contains a +Info vulnerability. 
The CVE-ID is CVE-2015-5330. The CWE-ID is CWE-200.
Vulnerability summary:
ldb before 1.1.24, as used in the AD LDAP server in Samba 4.x before 4.1.22, 4.2.x before 4.2.7, and 4.3.x before 4.3.3, mishandles string lengths, which allows remote attackers to obtain sensitive information from daemon heap memory by sending crafted packets and then reading (1) an error message or (2) a database value.
",1.0,852.0,6.0,2.002286672592163
177840,+Info," The given code for `ldb_dn_escape_internal` function is vulnerable. The vulnerability is due to the lack of proper bounds checking in the `memcpy` function call. The function copies a substring from the source string to the destination buffer without checking if the length of the substring is within the bounds of the destination buffer. This can lead to a buffer overflow vulnerability, allowing an attacker to write arbitrary data into the destination buffer.

The second code snippet is not related to the vulnerability audit and is not C++ code. It is a C++ implementation of the Minimum Absolute Difference problem, which is not vulnerable to any of the vulnerabilities mentioned in the initial list.","The code contains a +Info vulnerability. 
The CVE-ID is CVE-2015-5330. The CWE-ID is CWE-200.
Vulnerability summary:
ldb before 1.1.24, as used in the AD LDAP server in Samba 4.x before 4.1.22, 4.2.x before 4.2.7, and 4.3.x before 4.3.3, mishandles string lengths, which allows remote attackers to obtain sensitive information from daemon heap memory by sending crafted packets and then reading (1) an error message or (2) a database value.
",2.0,780.0,6.0,2.482205629348755
177841,+Info," The given code for `strupper_talloc_n_handle` function is not directly related to the vulnerability described in the provided CVE-ID and CWE-ID. The vulnerability in the code snippet you provided is not apparent.

However, the `minAbsDifference` function you added in the question is a different function and has a different context. This function does not involve any string manipulation or memory allocation, so it is not vulnerable to the buffer overflow or use-after-free vulnerabilities mentioned in the steps.

The `minAbsDifference` function appears to be implementing a brute-force approach to find the minimum absolute difference between a goal number and the sum of two numbers in a given vector. It has a time complexity of O(n * 2^(n/2)), which is not efficient for large inputs. However, it does not contain any apparent security vulnerabilities.

Therefore, the answer is 'NO'.","The code contains a +Info vulnerability. 
The CVE-ID is CVE-2015-5330. The CWE-ID is CWE-200.
Vulnerability summary:
ldb before 1.1.24, as used in the AD LDAP server in Samba 4.x before 4.1.22, 4.2.x before 4.2.7, and 4.3.x before 4.3.3, mishandles string lengths, which allows remote attackers to obtain sensitive information from daemon heap memory by sending crafted packets and then reading (1) an error message or (2) a database value.
",1.0,827.0,6.0,2.702296733856201
177842,+Info," The given code for `next_codepoint_handle_ext` function is not directly related to the provided vulnerability description. Therefore, I cannot determine if it is vulnerable based on the information provided.

However, I will evaluate the given `minAbsDifference` function for potential vulnerabilities:

1. Buffer Overflow: The function does not involve any string or memory functions that could lead to buffer overflow vulnerabilities.
2. Use After Free: The function does not dynamically allocate memory and then free it, so there are no pointers that could be used after they have been freed.
3. Memory Leaks: The function does not allocate memory dynamically and does not have any memory leaks.
4. Integer Overflow/Underflow: The function does not involve any arithmetic operations on integer types that could lead to overflow or underflow conditions.
5. Null Pointer Dereference: The function does not dereference pointers, so there are no null pointer dereferences.
6. Improper Input Validation: The function does not process user input, so there is no need for input validation.
7. Race Conditions: The function is not multi-threaded, so there are no race conditions.
8. Insecure Function Usage: The function does not use any insecure or deprecated functions.
9. Insecure Resource Management: The function does not handle any resources, so there are no","The code contains a +Info vulnerability. 
The CVE-ID is CVE-2015-5330. The CWE-ID is CWE-200.
Vulnerability summary:
ldb before 1.1.24, as used in the AD LDAP server in Samba 4.x before 4.1.22, 4.2.x before 4.2.7, and 4.3.x before 4.3.3, mishandles string lengths, which allows remote attackers to obtain sensitive information from daemon heap memory by sending crafted packets and then reading (1) an error message or (2) a database value.
",1.0,915.0,6.0,2.3161301612854004
177843,+Info," Based on the given code, the `strlen_m_ext_handle` function is not directly vulnerable to the vulnerabilities listed in the provided steps. However, it does process user input (the `s` parameter) and calls other functions that may have vulnerabilities. Therefore, it is essential to ensure proper input validation and error handling in those functions to prevent potential vulnerabilities.

The second function, `minAbsDifference`, is not directly related to the vulnerabilities mentioned in the provided steps. It appears to be a separate function that calculates the minimum absolute difference between a goal number and the sum of some numbers in a vector. It does not involve string handling or memory management, so it is not vulnerable to the vulnerabilities listed in the provided steps.","The code contains a +Info vulnerability. 
The CVE-ID is CVE-2015-5330. The CWE-ID is CWE-200.
Vulnerability summary:
ldb before 1.1.24, as used in the AD LDAP server in Samba 4.x before 4.1.22, 4.2.x before 4.2.7, and 4.3.x before 4.3.3, mishandles string lengths, which allows remote attackers to obtain sensitive information from daemon heap memory by sending crafted packets and then reading (1) an error message or (2) a database value.
",1.0,793.0,6.0,2.6967108249664307
177844,+Info," The given C++ code for the function `strupper_talloc_n_handle` is not directly related to the vulnerability described in the provided CVE-ID and CWE-ID. The vulnerability described in the CVE-ID and CWE-ID is related to an LDAP server in Samba, and the given C++ code does not appear to be related to that LDAP server or its vulnerability.

Therefore, the answer is 'NO'. The given C++ code is not vulnerable based on the information provided. However, it's always a good practice to follow secure coding guidelines and best practices when writing code, such as checking bounds, validating inputs, and handling errors properly.","The code contains a +Info vulnerability. 
The CVE-ID is CVE-2015-5330. The CWE-ID is CWE-200.
Vulnerability summary:
ldb before 1.1.24, as used in the AD LDAP server in Samba 4.x before 4.1.22, 4.2.x before 4.2.7, and 4.3.x before 4.3.3, mishandles string lengths, which allows remote attackers to obtain sensitive information from daemon heap memory by sending crafted packets and then reading (1) an error message or (2) a database value.
",1.0,777.0,6.0,2.702655076980591
177848,," The given code for `do_connect` function is not directly related to the vulnerability described in the CVE-2015-5296. The vulnerability is related to Samba's handling of encrypted connections, which is not apparent in the provided code. Therefore, the answer is 'NO'.","The code contains a nan vulnerability. 
The CVE-ID is CVE-2015-5296. The CWE-ID is CWE-20.
Vulnerability summary:
Samba 3.x and 4.x before 4.1.22, 4.2.x before 4.2.7, and 4.3.x before 4.3.3 supports connections that are encrypted but unsigned, which allows man-in-the-middle attackers to conduct encrypted-to-unencrypted downgrade attacks by modifying the client-server data stream, related to clidfs.c, libsmb_server.c, and smbXcli_base.c.
",1.0,704.0,6.0,3.2248427867889404
177850,DoS Overflow," Based on the given code, the `datum_to_json` function does not appear to be vulnerable to a DoS overflow vulnerability as described in the CVE-2015-5289. The function does not contain any unchecked string copies or memory allocations that could lead to a buffer overflow. However, it is important to note that this analysis is based on the provided code snippet alone and does not take into account the larger context of the PostgreSQL codebase or potential vulnerabilities in other parts of the system.","The code contains a DoS_Overflow vulnerability. 
The CVE-ID is CVE-2015-5289. The CWE-ID is CWE-119.
Vulnerability summary:
Multiple stack-based buffer overflows in json parsing in PostgreSQL before 9.3.x before 9.3.10 and 9.4.x before 9.4.5 allow attackers to cause a denial of service (server crash) via unspecified vectors, which are not properly handled in (1) json or (2) jsonb values.
",1.0,729.0,6.0,2.791787624359131
177851,DoS Overflow," The provided `parse_array` function does not directly contain any obvious buffer overflow vulnerabilities. However, it does call other functions (`parse_array_element`) that could potentially contain such vulnerabilities. Therefore, it is essential to examine those functions as well.

The `minAbsDifference` function, on the other hand, does not appear to have any buffer overflow vulnerabilities. It is a separate function that calculates the minimum absolute difference between a goal number and the sum of elements in a vector. It uses standard C++ libraries like `vector`, `unordered_set`, and `sort` without any apparent issues.","The code contains a DoS_Overflow vulnerability. 
The CVE-ID is CVE-2015-5289. The CWE-ID is CWE-119.
Vulnerability summary:
Multiple stack-based buffer overflows in json parsing in PostgreSQL before 9.3.x before 9.3.10 and 9.4.x before 9.4.5 allow attackers to cause a denial of service (server crash) via unspecified vectors, which are not properly handled in (1) json or (2) jsonb values.
",1.0,746.0,6.0,2.36452317237854
177852,DoS Overflow," The given `parse_object` function does not appear to be directly vulnerable to the mentioned vulnerabilities in the provided list. However, it does call other functions like `parse_object_field` which could potentially contain vulnerabilities. It's essential to review those functions as well.

The `minAbsDifference` function provided in the second part of the code snippet is not related to the `parse_object` function and does not seem to have any apparent vulnerabilities. It is an independent function that calculates the minimum absolute difference between a goal number and the sum of some numbers in a vector.

Therefore, the answer is 'NO' for both the `parse_object` function and the `minAbsDifference` function.","The code contains a DoS_Overflow vulnerability. 
The CVE-ID is CVE-2015-5289. The CWE-ID is CWE-119.
Vulnerability summary:
Multiple stack-based buffer overflows in json parsing in PostgreSQL before 9.3.x before 9.3.10 and 9.4.x before 9.4.5 allow attackers to cause a denial of service (server crash) via unspecified vectors, which are not properly handled in (1) json or (2) jsonb values.
",1.0,772.0,6.0,1.4049999713897705
177853,DoS Overflow," The given code for `setPath` function is not directly vulnerable to the mentioned vulnerabilities in the list. However, it does call other functions like `setPathArray` and `setPathObject` which could potentially contain buffer overflow vulnerabilities. It is essential to thoroughly audit those functions as well.

The `minAbsDifference` function is not related to the C++ code provided in the original question, so it is not relevant to the vulnerability assessment.

Therefore, the answer is:

For the given code of `setPath` function: NO.

However, it is crucial to audit the called functions `setPathArray` and `setPathObject` for potential buffer overflow vulnerabilities.","The code contains a DoS_Overflow vulnerability. 
The CVE-ID is CVE-2015-5289. The CWE-ID is CWE-119.
Vulnerability summary:
Multiple stack-based buffer overflows in json parsing in PostgreSQL before 9.3.x before 9.3.10 and 9.4.x before 9.4.5 allow attackers to cause a denial of service (server crash) via unspecified vectors, which are not properly handled in (1) json or (2) jsonb values.
",1.0,764.0,6.0,2.612630844116211
177855,Bypass," Based on the provided code snippet, it does not appear to be directly vulnerable to the Bypass vulnerability described in the given context. The code seems to be handling file paths and checking directory access, but it does not involve symlinks or substring relationships that could be exploited for bypassing intended access restrictions.

However, it is essential to note that the code might still have other vulnerabilities or issues, such as buffer overflows, use-after-free errors, memory leaks, or other security concerns. The provided code snippet should be thoroughly reviewed using the steps outlined in the question to ensure its security.

Therefore, the answer is 'NO', but it is crucial to perform a comprehensive vulnerability assessment on the code to ensure its security.","The code contains a Bypass vulnerability. 
The CVE-ID is CVE-2015-5252. The CWE-ID is CWE-264.
Vulnerability summary:
vfs.c in smbd in Samba 3.x and 4.x before 4.1.22, 4.2.x before 4.2.7, and 4.3.x before 4.3.3, when share names with certain substring relationships exist, allows remote attackers to bypass intended file-access restrictions via a symlink that points outside of a share.
",2.0,777.0,6.0,2.528237819671631
