case_id,vuln_type,audit_report,gt,eval_score,eval_input_token_num,eval_output_token_num,eval_inference_time
177736,Bypass," Based on the provided code, the samldb_check_user_account_control_acl function is not directly related to the minAbsDifference function. The samldb_check_user_account_control_acl function appears to be checking user account control flags in an Active Directory context, while the minAbsDifference function is a standalone function for finding the smallest absolute difference between a goal number and the sum of some integers.

Therefore, the minAbsDifference function itself is not vulnerable to any of the vulnerabilities listed in the initial instructions. It is just a function for finding the smallest absolute difference between a goal number and the sum of some integers.

So, the answer is 'NO'.","The code contains a Bypass vulnerability. 
The CVE-ID is CVE-2015-8467. The CWE-ID is CWE-264.
Vulnerability summary:
The samldb_check_user_account_control_acl function in dsdb/samdb/ldb_modules/samldb.c in Samba 4.x before 4.1.22, 4.2.x before 4.2.7, and 4.3.x before 4.3.3 does not properly check for administrative privileges during creation of machine accounts, which allows remote authenticated users to bypass intended access restrictions by leveraging the existence of a domain with both a Samba DC and a Windows DC, a similar issue to CVE-2015-2535.
",1.0,797.0,6.0,2.259613513946533
177740,DoS Exec Code Overflow Mem. Corr.," The given C++ code for the function `asn1_time_to_time_t` is not directly related to the code snippet you provided earlier, which was vulnerable to a DoS, Exec, Code, Overflow, Mem., Corr. vulnerability. The new code snippet provided is for a different function called `minAbsDifference`.

Based on the given code, the `minAbsDifference` function does not appear to be vulnerable to any of the vulnerabilities mentioned in the earlier steps. It is a standalone function that calculates the absolute difference between a given goal and the sum of some numbers in a vector. It does not involve any string manipulation, memory management, or input validation, which are common sources of vulnerabilities.

Therefore, the answer is 'NO'.","The code contains a DoS_Exec_Code_Overflow_Mem._Corr. vulnerability. 
The CVE-ID is CVE-2013-6420. The CWE-ID is CWE-119.
Vulnerability summary:
The asn1_time_to_time_t function in ext/openssl/openssl.c in PHP before 5.3.28, 5.4.x before 5.4.23, and 5.5.x before 5.5.7 does not properly parse (1) notBefore and (2) notAfter timestamps in X.509 certificates, which allows remote attackers to execute arbitrary code or cause a denial of service (memory corruption) via a crafted certificate that is not properly handled by the openssl_x509_parse function.
",1.0,823.0,6.0,1.8345823287963867
177741,DoS Overflow," The given gnutls_session_get_data function is vulnerable to a DoS attack via a large SessionTicket, as shown in the provided vulnerability summary. The code you've added at the end is not related to the vulnerability assessment of the gnutls_session_get_data function. Therefore, the answer for this code snippet is 'NO'.","The code contains a DoS_Overflow vulnerability. 
The CVE-ID is CVE-2011-4128. The CWE-ID is CWE-119.
Vulnerability summary:
Buffer overflow in the gnutls_session_get_data function in lib/gnutls_session.c in GnuTLS 2.12.x before 2.12.14 and 3.x before 3.0.7, when used on a client that performs nonstandard session resumption, allows remote TLS servers to cause a denial of service (application crash) via a large SessionTicket.
",3.0,703.0,6.0,2.5420939922332764
177742,DoS Overflow," The given gnutls_session_get_data function is vulnerable to a DoS attack via buffer overflow. The vulnerability arises from the lack of proper bounds checking on the size of the session_data buffer when copying the data from psession.data using memcpy. An attacker can exploit this by sending a large SessionTicket to the client, causing the session_data buffer to be overflowed and resulting in a denial of service (application crash).

The minAbsDifference function provided in the second code snippet is not vulnerable to any security issues mentioned in the given steps. It is a separate function that calculates the minimum absolute difference between a goal and a sum of elements in a vector.","The code contains a DoS_Overflow vulnerability. 
The CVE-ID is CVE-2011-4128. The CWE-ID is CWE-119.
Vulnerability summary:
Buffer overflow in the gnutls_session_get_data function in lib/gnutls_session.c in GnuTLS 2.12.x before 2.12.14 and 3.x before 3.0.7, when used on a client that performs nonstandard session resumption, allows remote TLS servers to cause a denial of service (application crash) via a large SessionTicket.
",3.0,767.0,6.0,2.432295799255371
177743,DoS," Based on the given code, the `phar_make_dirstream` function is not directly vulnerable to the vulnerabilities listed in the steps you provided. However, it does call other functions that may be vulnerable, so it's essential to ensure those functions are secure.

The `minAbsDifference` function, on the other hand, is not a C++ code snippet, but rather a C++11 function written in a scripting language (presumably C++11 or C++14). It doesn't contain any apparent security vulnerabilities, as it only involves basic arithmetic operations, array bounds, and standard library functions.

Therefore, the answer is:

For `phar_make_dirstream`: NO
For `minAbsDifference`: NO.","The code contains a DoS vulnerability. 
The CVE-ID is CVE-2015-7804. The CWE-ID is CWE-189.
Vulnerability summary:
Off-by-one error in the phar_parse_zipfile function in ext/phar/zip.c in PHP before 5.5.30 and 5.6.x before 5.6.14 allows remote attackers to cause a denial of service (uninitialized pointer dereference and application crash) by including the / filename in a .zip PHAR archive.
",1.0,772.0,6.0,2.5387673377990723
177747,DoS," The given bgp_attr_unknown function does not directly involve the minAbsDifference function provided. Therefore, the bgp_attr_unknown function is not vulnerable based on the provided code alone. However, it is always important to ensure proper bounds checking and input validation in C++ code to prevent potential vulnerabilities.","The code contains a DoS vulnerability. 
The CVE-ID is CVE-2013-6051. The CWE-ID is nan.
Vulnerability summary:
The bgp_attr_unknown function in bgp_attr.c in Quagga 0.99.21 does not properly initialize the total variable, which allows remote attackers to cause a denial of service (bgpd crash) via a crafted BGP update.
",1.0,668.0,6.0,1.3867676258087158
177750,DoS Exec Code," Based on the provided code snippet, the `begin_softmask` function does not appear to be directly vulnerable to the mentioned vulnerabilities (DoS, Exec, or Code). However, it does contain some potential memory management issues, such as setting `gstate->softmask` and `gstate->softmask_resources` to `NULL` before the function returns, which could potentially lead to use-after-free vulnerabilities if the softmask is later used.

To thoroughly evaluate the code for vulnerabilities, it would be necessary to examine the entire context in which the function is used, including how the `pdf_gstate` and `pdf_run_processor` structures are defined and managed, as well as the behavior of the calling code.

The second code snippet provided, `minAbsDifference`, is not a C++ function, but rather a C++11 function declaration. It does not involve any memory management or pointer manipulation, and thus it is not vulnerable to the mentioned vulnerabilities.","The code contains a DoS_Exec_Code vulnerability. 
The CVE-ID is CVE-2018-1000039. The CWE-ID is CWE-416.
Vulnerability summary:
In MuPDF 1.12.0 and earlier, multiple heap use after free bugs in the PDF parser could allow an attacker to execute arbitrary code, read memory, or cause a denial of service via a crafted file.
",1.0,803.0,6.0,1.2992832660675049
177766,DoS," Based on the given code, the `ldap_push_filter` function does not appear to be directly vulnerable to a DoS attack as it does not involve memory allocation or resource handling that could be exploited for memory consumption or daemon crashes. However, it is important to note that the code snippet provided is only a part of the larger system, and other parts of the codebase could still contain vulnerabilities. It is always recommended to perform a thorough vulnerability assessment on the entire codebase to ensure the security of the application.

Therefore, the answer is 'NO', but with the caveat that a comprehensive vulnerability assessment should be conducted on the entire codebase to ensure the absence of any potential security vulnerabilities.","The code contains a DoS vulnerability. 
The CVE-ID is CVE-2015-7540. The CWE-ID is CWE-399.
Vulnerability summary:
The LDAP server in the AD domain controller in Samba 4.x before 4.1.22 does not check return values to ensure successful ASN.1 memory allocation, which allows remote attackers to cause a denial of service (memory consumption and daemon crash) via crafted packets.
",1.0,747.0,6.0,3.0041098594665527
177767,DoS," The given code for `decode_openldap_dereference` function is not directly related to the vulnerability described in the provided context. However, based on the code snippet alone, it does not exhibit any obvious signs of buffer overflow, use-after-free, memory leak, or other common security vulnerabilities.

The code appears to be parsing ASN.1 data structures, which is a common task in many network protocols. It uses the `asn1_load`, `asn1_start_tag`, `asn1_tag_remaining`, `asn1_end_tag`, and other similar functions to parse the data. These functions are likely part of a library that handles ASN.1 parsing, and they are used correctly in the code.

The code also uses `talloc` to allocate memory for the `struct dsdb_openldap_dereference_result_control` and `struct dsdb_openldap_dereference_result` structures. The `talloc` function is a memory allocation function that is specifically designed for use with Talloc-enabled libraries. It automatically manages memory allocation and deallocation, and it is used correctly in the code.

Therefore, based on the given code snippet alone, it does not appear to be vulnerable to any of the common security vulnerabilities. However, it is always important to keep in","The code contains a DoS vulnerability. 
The CVE-ID is CVE-2015-7540. The CWE-ID is CWE-399.
Vulnerability summary:
The LDAP server in the AD domain controller in Samba 4.x before 4.1.22 does not check return values to ensure successful ASN.1 memory allocation, which allows remote attackers to cause a denial of service (memory consumption and daemon crash) via crafted packets.
",1.0,864.0,6.0,3.7375545501708984
177768,DoS," Based on the provided code snippet, the `sparse_dump_region` function does not appear to be directly vulnerable to the DoS vulnerability described in the given context. However, it's essential to note that the vulnerability might exist in other parts of the codebase, and the `sparse_dump_region` function could be indirectly involved.

The `sparse_dump_region` function seems to be responsible for reading and writing data from/to a file in a sparse format. It checks for errors, handles buffer sizes, and updates the file's metadata. However, it does not involve user input or file manipulation by other processes, which are key factors in the DoS vulnerability described.

Therefore, the answer is 'NO'. The `sparse_dump_region` function does not appear to be vulnerable to the DoS vulnerability described in the given context. However, it's crucial to keep in mind that the codebase as a whole might still contain vulnerabilities.","The code contains a DoS vulnerability. 
The CVE-ID is CVE-2018-20482. The CWE-ID is CWE-835.
Vulnerability summary:
GNU Tar through 1.30, when --sparse is used, mishandles file shrinkage during read access, which allows local users to cause a denial of service (infinite read loop in sparse_dump_region in sparse.c) by modifying a file that is supposed to be archived by a different user's process (e.g., a system backup running as root).
",1.0,815.0,6.0,3.8696980476379395
177770,Bypass," Based on the given code snippet, the `read_ndx_and_attrs` function does not appear to be directly vulnerable to the Bypass vulnerability described in the provided vulnerability summary. The function primarily deals with reading and processing file indices and related attributes, and it does not seem to involve handling or validating user-supplied filenames or paths.

However, it is essential to note that the vulnerability might still exist in other parts of the codebase, and the `read_ndx_and_attrs` function could be called with potentially malicious input. Therefore, it is crucial to thoroughly review the entire codebase and ensure that all functions and components handle user input and file access securely.

In summary, the `read_ndx_and_attrs` function itself does not appear to be vulnerable based on the provided code snippet. However, it is essential to consider the broader context of the codebase and ensure that all components handle user input and file access securely.","The code contains a Bypass vulnerability. 
The CVE-ID is CVE-2017-17434. The CWE-ID is nan.
Vulnerability summary:
The daemon in rsync 3.1.2, and 3.1.3-development before 2017-12-03, does not check for fnamecmp filenames in the daemon_filter_list data structure (in the recv_files function in receiver.c) and also does not apply the sanitize_paths protection mechanism to pathnames found in ""xname follows"" strings (in the read_ndx_and_attrs function in rsync.c), which allows remote attackers to bypass intended access restrictions.
",1.0,836.0,6.0,2.689751625061035
177771,," The first code snippet (dns_read_name function) is vulnerable. The vulnerability is related to buffer overflows due to the lack of proper bounds checking when reading compressed pointers. An attacker can exploit this vulnerability to cause stack exhaustion or infinite recursion.

The second code snippet (minAbsDifference function) is not vulnerable based on the provided code. It does not contain any obvious buffer overflow vulnerabilities or other security issues. However, it is essential to note that the function uses unordered_set and vector, which may have their own memory management issues if not used correctly. It is always a good practice to ensure that these data structures are used properly and that memory is allocated and deallocated correctly.","The code contains a nan vulnerability. 
The CVE-ID is CVE-2018-20103. The CWE-ID is CWE-835.
Vulnerability summary:
An issue was discovered in dns.c in HAProxy through 1.8.14. In the case of a compressed pointer, a crafted packet can trigger infinite recursion by making the pointer point to itself, or create a long chain of valid pointers resulting in stack exhaustion.
",4.0,742.0,6.0,2.5995514392852783
177773,DoS Exec Code Overflow Mem. Corr.," The given `create_surface_from_thumbnail_data` function does not appear to be vulnerable to the listed vulnerabilities in the provided code. The function is primarily involved in converting image data to a Cairo surface format, and there are no obvious signs of buffer overflows, use-after-free errors, memory leaks, or other vulnerabilities.

However, it's essential to note that the code snippet provided is incomplete, and it's impossible to make a definitive statement about the entire program's vulnerabilities without analyzing the entire codebase. The second function `minAbsDifference` is not related to the `create_surface_from_thumbnail_data` function, and it should be analyzed separately for potential vulnerabilities.","The code contains a DoS_Exec_Code_Overflow_Mem._Corr. vulnerability. 
The CVE-ID is CVE-2009-3607. The CWE-ID is CWE-189.
Vulnerability summary:
Integer overflow in the create_surface_from_thumbnail_data function in glib/poppler-page.cc in Poppler 0.x allows remote attackers to cause a denial of service (memory corruption) or possibly execute arbitrary code via a crafted PDF document that triggers a heap-based buffer overflow.  NOTE: some of these details are obtained from third party information.
",1.0,762.0,6.0,2.5985090732574463
177774,DoS Exec Code Overflow," Based on the given code, there are no obvious buffer overflow, use-after-free, memory leak, or integer overflow vulnerabilities. However, there are some potential issues:

1. The code does not check the return value of `gmalloc` and `gmallocn`, which could lead to memory leaks if the allocation fails.
2. The code does not check the return value of `new ImageStream(str, width, colorMap->getNumPixelComps(), colorMap->getBits())`, which could lead to a failure to allocate memory and an unhandled exception.
3. The code does not check the return value of `str->close()`, which could lead to a failure to close the stream and a potential resource leak.
4. The code does not check the return value of `splash->drawImage(src, &imgData, srcMode, maskColors? gTrue : gFalse, width, height, mat)`, which could lead to a failure to draw the image and an unhandled exception.
5. The code does not check the return value of `delete imgData.imgStr`, which could lead to a failure to deallocate memory and a memory leak.

These issues are not directly related to security vulnerabilities, but they could lead to application crashes or performance degradation. To mitigate these issues, the code should be modified to check the return values of these","The code contains a DoS_Exec_Code_Overflow vulnerability. 
The CVE-ID is CVE-2009-3605. The CWE-ID is CWE-189.
Vulnerability summary:
Multiple integer overflows in Poppler 0.10.5 and earlier allow remote attackers to cause a denial of service (application crash) or possibly execute arbitrary code via a crafted PDF file, related to (1) glib/poppler-page.cc; (2) ArthurOutputDev.cc, (3) CairoOutputDev.cc, (4) GfxState.cc, (5) JBIG2Stream.cc, (6) PSOutputDev.cc, and (7) SplashOutputDev.cc in poppler/; and (8) SplashBitmap.cc, (9) Splash.cc, and (10) SplashFTFont.cc in splash/.  NOTE: this may overlap CVE-2009-0791.
",2.0,982.0,6.0,2.332204580307007
177775,DoS Exec Code Overflow," Based on the given code, the ArthurOutputDev::drawImage function does not appear to contain any obvious buffer overflow vulnerabilities, use-after-free errors, memory leaks, or integer overflows. However, it does allocate memory with gmalloc and new, and then later free that memory. If the memory allocation fails, the code does not check the return value, which could lead to memory leaks or other issues. Additionally, the code does not validate user input, so it could be vulnerable to injection attacks if the input is not properly sanitized. The code also uses QImage and related classes, which could potentially have other vulnerabilities. Overall, the code appears to have some potential issues, but it is not clear from the given code alone whether there are any specific security vulnerabilities.

Regarding the second code snippet, it is not related to the first code snippet and does not appear to be C++ code. It is a function written in C++ style, but it is actually written in a different programming language, likely Python or a similar language based on the syntax and use of functions like vector, size, and sort. Therefore, it is not possible to evaluate its vulnerabilities based on the given code alone.","The code contains a DoS_Exec_Code_Overflow vulnerability. 
The CVE-ID is CVE-2009-3605. The CWE-ID is CWE-189.
Vulnerability summary:
Multiple integer overflows in Poppler 0.10.5 and earlier allow remote attackers to cause a denial of service (application crash) or possibly execute arbitrary code via a crafted PDF file, related to (1) glib/poppler-page.cc; (2) ArthurOutputDev.cc, (3) CairoOutputDev.cc, (4) GfxState.cc, (5) JBIG2Stream.cc, (6) PSOutputDev.cc, and (7) SplashOutputDev.cc in poppler/; and (8) SplashBitmap.cc, (9) Splash.cc, and (10) SplashFTFont.cc in splash/.  NOTE: this may overlap CVE-2009-0791.
",2.0,943.0,6.0,3.2014873027801514
177777,DoS Exec Code Overflow," Based on the given code, the `CairoOutputDev::drawImage` function does not appear to be directly vulnerable to integer overflows, buffer overflows, use-after-free, or other vulnerabilities mentioned in the provided list. However, it does allocate memory dynamically and handle image data, so it's essential to ensure that the input data is validated and that the memory is properly managed.

The code snippet provided does not contain any obvious signs of vulnerabilities, but it's essential to consider the context in which this function is used and the potential risks associated with the input data and memory management.

Therefore, the answer is 'NO', but it's crucial to keep in mind that the code's security depends on the context in which it is used and the proper handling of input data and memory management.","The code contains a DoS_Exec_Code_Overflow vulnerability. 
The CVE-ID is CVE-2009-3605. The CWE-ID is CWE-189.
Vulnerability summary:
Multiple integer overflows in Poppler 0.10.5 and earlier allow remote attackers to cause a denial of service (application crash) or possibly execute arbitrary code via a crafted PDF file, related to (1) glib/poppler-page.cc; (2) ArthurOutputDev.cc, (3) CairoOutputDev.cc, (4) GfxState.cc, (5) JBIG2Stream.cc, (6) PSOutputDev.cc, and (7) SplashOutputDev.cc in poppler/; and (8) SplashBitmap.cc, (9) Splash.cc, and (10) SplashFTFont.cc in splash/.  NOTE: this may overlap CVE-2009-0791.
",1.0,860.0,6.0,2.1321566104888916
177778,DoS Exec Code Overflow," Based on the given code, there are no obvious buffer overflow, use-after-free, memory leak, or integer overflow vulnerabilities. However, there are some potential issues:

1. The code does not check the return values of cairo_image_surface_create_for_data, cairo_pattern_create_for_surface, and cairo_surface_create_for_data. If these functions fail, the code continues execution, which could lead to undefined behavior.
2. The code does not check the return value of cairo_mask. If this function fails, the code continues execution, which could lead to unexpected results.
3. The code does not check the return value of cairo_pattern_set_matrix when setting the matrix for the maskPattern. If this function fails, the code continues execution, which could lead to unexpected results.
4. The code does not check the return value of cairo_set_source when setting the source to the pattern. If this function fails, the code continues execution, which could lead to unexpected results.
5. The code does not check the return value of cairo_fill when filling the shape. If this function fails, the code continues execution, which could lead to unexpected results.

These potential issues do not directly result in security vulnerabilities but could lead to unexpected behavior or crashes. It is essential to check the return values of these functions and handle any","The code contains a DoS_Exec_Code_Overflow vulnerability. 
The CVE-ID is CVE-2009-3605. The CWE-ID is CWE-189.
Vulnerability summary:
Multiple integer overflows in Poppler 0.10.5 and earlier allow remote attackers to cause a denial of service (application crash) or possibly execute arbitrary code via a crafted PDF file, related to (1) glib/poppler-page.cc; (2) ArthurOutputDev.cc, (3) CairoOutputDev.cc, (4) GfxState.cc, (5) JBIG2Stream.cc, (6) PSOutputDev.cc, and (7) SplashOutputDev.cc in poppler/; and (8) SplashBitmap.cc, (9) Splash.cc, and (10) SplashFTFont.cc in splash/.  NOTE: this may overlap CVE-2009-0791.
",2.0,965.0,6.0,2.344040632247925
177779,DoS Exec Code Overflow," Based on the given code, there are no obvious buffer overflow or integer overflow vulnerabilities. However, there are some potential memory leaks and resource management issues. For instance, the code does not properly release the memory allocated for'maskBuffer' and 'buffer'. Additionally, the'maskImgStr' and 'imgStr' objects are not deleted in the case of an error. These issues could potentially lead to memory leaks and resource exhaustion.

However, the code does not appear to contain any DoS, Exec, or Code vulnerabilities as described in the original vulnerability summary. The code only deals with image processing and does not involve any user input or external data that could be manipulated to execute arbitrary code or cause a denial of service.

Therefore, the answer is 'NO', the code is not vulnerable to the specified DoS, Exec, or Code vulnerabilities. However, it does contain some memory management issues that should be addressed to prevent potential memory leaks and resource exhaustion.","The code contains a DoS_Exec_Code_Overflow vulnerability. 
The CVE-ID is CVE-2009-3605. The CWE-ID is CWE-189.
Vulnerability summary:
Multiple integer overflows in Poppler 0.10.5 and earlier allow remote attackers to cause a denial of service (application crash) or possibly execute arbitrary code via a crafted PDF file, related to (1) glib/poppler-page.cc; (2) ArthurOutputDev.cc, (3) CairoOutputDev.cc, (4) GfxState.cc, (5) JBIG2Stream.cc, (6) PSOutputDev.cc, and (7) SplashOutputDev.cc in poppler/; and (8) SplashBitmap.cc, (9) Splash.cc, and (10) SplashFTFont.cc in splash/.  NOTE: this may overlap CVE-2009-0791.
",2.0,896.0,6.0,2.483494758605957
