case_id,vuln_type,audit_report,gt,eval_score,eval_input_token_num,eval_output_token_num,eval_inference_time
177826,DoS Exec Code Overflow," The given code for the `extractPages` function does not appear to contain any obvious buffer overflow vulnerabilities. The `sprintf` function is used within a loop, but it is used to construct a file path name, and the `pathName` array has a size of 1024 bytes, which should be sufficient for the expected input.

However, it is important to note that the code may still have other vulnerabilities, such as use-after-free errors, memory leaks, or integer overflows, which were not covered in the initial list. It is always recommended to perform a thorough vulnerability assessment on any code to ensure its security.

Regarding the second code snippet, it is not a C++ code, but rather a C++11 code. It appears to be a function that calculates the maximum sum of three distinct elements from a 2D vector. Based on the given code, it does not contain any apparent buffer overflow vulnerabilities.

Therefore, the answer is 'NO' for both code snippets.","The code contains a DoS_Exec_Code_Overflow vulnerability. 
The CVE-ID is CVE-2013-4473. The CWE-ID is CWE-119.
Vulnerability summary:
Stack-based buffer overflow in the extractPages function in utils/pdfseparate.cc in poppler before 0.24.2 allows remote attackers to cause a denial of service (crash) and possibly execute arbitrary code via a source filename.
",2.0,806.0,6.0,2.243159770965576
177827,," The given code for the function `long long maximumValueSum(vector<vector<int>>& board)` is not directly related to the vulnerability audit task. It appears to be an unrelated function that calculates the maximum sum of three distinct elements from a 2D vector. Therefore, it is not vulnerable based on the provided code alone.","The code contains a nan vulnerability. 
The CVE-ID is CVE-2007-4849. The CWE-ID is CWE-264.
Vulnerability summary:
JFFS2, as used on One Laptop Per Child (OLPC) build 542 and possibly other Linux systems, when POSIX ACL support is enabled, does not properly store permissions during (1) inode creation or (2) ACL setting, which might allow local users to access restricted files or directories after a remount of a filesystem, related to ""legacy modes"" and an inconsistency between dentry permissions and inode permissions.
",1.0,705.0,6.0,1.9864966869354248
177831,," The given code for `mcid_char_imp` function does not directly involve any memory manipulation or string handling functions that could lead to buffer overflow or use-after-free vulnerabilities. However, it does call `pdf_dict_del` and `pdf_drop_obj` functions which could potentially delete objects before they are supposed to be, leading to memory leaks or other unintended consequences. It is recommended to carefully review the context and usage of these functions to ensure proper handling of objects and memory.

The second code snippet provided is for a different function called `maximumValueSum` which is not related to the C++ code you initially provided. This function appears to be implementing a combination algorithm to find the maximum sum of three elements from a vector of vectors. It does not involve any memory manipulation or string handling functions, and thus it is not vulnerable to buffer overflow or use-after-free vulnerabilities.","The code contains a nan vulnerability. 
The CVE-ID is CVE-2019-14975. The CWE-ID is CWE-125.
Vulnerability summary:
Artifex MuPDF before 1.16.0 has a heap-based buffer over-read in fz_chartorune in fitz/string.c because pdf/pdf-op-filter.c does not check for a missing string.
",1.0,777.0,6.0,1.223891258239746
177832,," The first code snippet is vulnerable to a buffer overflow issue. The function `memmove` in the `if (remove)` block copies a length of `len+1` bytes from the source to the destination, but the source address `s+n` is not checked for bounds. This can lead to writing outside the allocated memory, resulting in a buffer overflow.

The second code snippet is not vulnerable to any obvious security issues. It is a function to find the maximum sum of three numbers from a vector of vectors. The code uses standard C++ libraries and follows good programming practices. There is no memory management, string manipulation, or user input involved, which are common sources of vulnerabilities.","The code contains a nan vulnerability. 
The CVE-ID is CVE-2019-14975. The CWE-ID is CWE-125.
Vulnerability summary:
Artifex MuPDF before 1.16.0 has a heap-based buffer over-read in fz_chartorune in fitz/string.c because pdf/pdf-op-filter.c does not check for a missing string.
",2.0,735.0,6.0,1.6090288162231445
177833,DoS Overflow, The second code snippet provided does not contain a buffer overflow vulnerability. It is a separate function that calculates the maximum sum of three distinct elements from a vector of vectors. The function uses standard C++ libraries and does not involve string or memory functions that could lead to buffer overflow vulnerabilities.,"The code contains a DoS_Overflow vulnerability. 
The CVE-ID is CVE-2013-4282. The CWE-ID is CWE-119.
Vulnerability summary:
Stack-based buffer overflow in the reds_handle_ticket function in server/reds.c in SPICE 0.12.0 allows remote attackers to cause a denial of service (crash) via a long password in a SPICE ticket.
",1.0,659.0,6.0,2.3955814838409424
177839,+Info," Based on the provided code, the `next_codepoint_handle_ext` function does not appear to be vulnerable to the specific vulnerability described in the given vulnerability summary (CVE-2015-5330, CWE-200). The code does not involve handling strings or lengths in a way that would allow remote attackers to obtain sensitive information from heap memory.

However, it is important to note that the code may still contain other vulnerabilities or issues, such as buffer overflows, use-after-free errors, memory leaks, or other types of vulnerabilities. The provided code audit focuses on the specific vulnerability mentioned in the question, and it is always recommended to perform a thorough vulnerability assessment to ensure the security of the code.","The code contains a +Info vulnerability. 
The CVE-ID is CVE-2015-5330. The CWE-ID is CWE-200.
Vulnerability summary:
ldb before 1.1.24, as used in the AD LDAP server in Samba 4.x before 4.1.22, 4.2.x before 4.2.7, and 4.3.x before 4.3.3, mishandles string lengths, which allows remote attackers to obtain sensitive information from daemon heap memory by sending crafted packets and then reading (1) an error message or (2) a database value.
",1.0,790.0,6.0,2.204240322113037
177840,+Info," The given code for `ldb_dn_escape_internal` function is not directly related to the vulnerability described in the CVE-2015-5330. The vulnerability in the CVE is related to the LDAP server in Samba, which is not present in the provided code.

Therefore, the answer is 'NO'. The provided code does not have the vulnerability described in CVE-2015-5330.","The code contains a +Info vulnerability. 
The CVE-ID is CVE-2015-5330. The CWE-ID is CWE-200.
Vulnerability summary:
ldb before 1.1.24, as used in the AD LDAP server in Samba 4.x before 4.1.22, 4.2.x before 4.2.7, and 4.3.x before 4.3.3, mishandles string lengths, which allows remote attackers to obtain sensitive information from daemon heap memory by sending crafted packets and then reading (1) an error message or (2) a database value.
",1.0,730.0,6.0,2.275797128677368
177841,+Info," The given code for the function `strupper_talloc_n_handle` is not directly related to the vulnerability described in the provided CVE-ID and summary. The vulnerability described in the CVE-ID is related to the ldb library, which is not used in the given code.

Therefore, the answer is 'NO'. The given code does not have the vulnerability described in the provided CVE-ID.","The code contains a +Info vulnerability. 
The CVE-ID is CVE-2015-5330. The CWE-ID is CWE-200.
Vulnerability summary:
ldb before 1.1.24, as used in the AD LDAP server in Samba 4.x before 4.1.22, 4.2.x before 4.2.7, and 4.3.x before 4.3.3, mishandles string lengths, which allows remote attackers to obtain sensitive information from daemon heap memory by sending crafted packets and then reading (1) an error message or (2) a database value.
",1.0,729.0,6.0,3.1324779987335205
177842,+Info," The given code for the function `next_codepoint_handle_ext` is not vulnerable to the vulnerability described in the provided context. The vulnerability described in the context is related to handling string lengths, while the given code does not involve string handling or length checking in the same way as the vulnerable code in the context.","The code contains a +Info vulnerability. 
The CVE-ID is CVE-2015-5330. The CWE-ID is CWE-200.
Vulnerability summary:
ldb before 1.1.24, as used in the AD LDAP server in Samba 4.x before 4.1.22, 4.2.x before 4.2.7, and 4.3.x before 4.3.3, mishandles string lengths, which allows remote attackers to obtain sensitive information from daemon heap memory by sending crafted packets and then reading (1) an error message or (2) a database value.
",1.0,711.0,6.0,2.5095267295837402
177843,+Info," The given code for the function `strlen_m_ext_handle` does not directly involve user input or string manipulation functions that are commonly associated with buffer overflow vulnerabilities. However, it does contain some checks on input parameters, which if not properly implemented, could potentially lead to other types of vulnerabilities. For instance, the `smb_panic` function call in the `#ifdef DEVELOPER` block could potentially be exploited if the check on the `dst_charset` and `src_charset` values is not thorough enough.

To determine if this code is vulnerable, a more in-depth analysis would be required, including a review of the implementation of the `smb_panic` function and the context in which it is called. Based on the given code snippet alone, it is not possible to definitively say whether it is vulnerable or not.

Therefore, the answer is: 'UNDETERMINED'.","The code contains a +Info vulnerability. 
The CVE-ID is CVE-2015-5330. The CWE-ID is CWE-200.
Vulnerability summary:
ldb before 1.1.24, as used in the AD LDAP server in Samba 4.x before 4.1.22, 4.2.x before 4.2.7, and 4.3.x before 4.3.3, mishandles string lengths, which allows remote attackers to obtain sensitive information from daemon heap memory by sending crafted packets and then reading (1) an error message or (2) a database value.
",2.0,830.0,6.0,2.710195302963257
177844,+Info," The given code for the function `strupper_talloc_n_handle` is not directly related to the vulnerability described in the provided CVE-ID and CWE-ID. The vulnerability described in the CVE-ID and CWE-ID is related to the ldb library, which is not used in the given code.

Therefore, the answer is 'NO'. The given code is not vulnerable to the described vulnerability.","The code contains a +Info vulnerability. 
The CVE-ID is CVE-2015-5330. The CWE-ID is CWE-200.
Vulnerability summary:
ldb before 1.1.24, as used in the AD LDAP server in Samba 4.x before 4.1.22, 4.2.x before 4.2.7, and 4.3.x before 4.3.3, mishandles string lengths, which allows remote attackers to obtain sensitive information from daemon heap memory by sending crafted packets and then reading (1) an error message or (2) a database value.
",1.0,735.0,6.0,1.6501693725585938
177848,," The second code snippet provided is not related to the vulnerability described in the initial code snippet or the vulnerability type mentioned. It appears to be an unrelated function for calculating the maximum sum of values from a 3D array. Based on the provided code, it does not contain any apparent security vulnerabilities. Therefore, the answer is 'NO'.","The code contains a nan vulnerability. 
The CVE-ID is CVE-2015-5296. The CWE-ID is CWE-20.
Vulnerability summary:
Samba 3.x and 4.x before 4.1.22, 4.2.x before 4.2.7, and 4.3.x before 4.3.3 supports connections that are encrypted but unsigned, which allows man-in-the-middle attackers to conduct encrypted-to-unencrypted downgrade attacks by modifying the client-server data stream, related to clidfs.c, libsmb_server.c, and smbXcli_base.c.
",1.0,714.0,6.0,2.2925865650177
177850,DoS Overflow," Based on the given code, the `datum_to_json` function does not appear to be vulnerable to a DoS overflow vulnerability as described in the provided CVE-ID and CWE-ID. The function does not contain any obvious buffer overflow conditions, as it does not directly manipulate strings or arrays with a size that can be controlled by an attacker.

However, it is important to note that the code snippet provided does not represent the entire program, and there may be other parts of the codebase that could be vulnerable. It is always recommended to perform a thorough vulnerability assessment on the entire codebase to ensure the security of the application.","The code contains a DoS_Overflow vulnerability. 
The CVE-ID is CVE-2015-5289. The CWE-ID is CWE-119.
Vulnerability summary:
Multiple stack-based buffer overflows in json parsing in PostgreSQL before 9.3.x before 9.3.10 and 9.4.x before 9.4.5 allow attackers to cause a denial of service (server crash) via unspecified vectors, which are not properly handled in (1) json or (2) jsonb values.
",1.0,753.0,6.0,2.1197447776794434
177851,DoS Overflow," The first code snippet provided is vulnerable to a DoS vulnerability due to a buffer overflow in the json parsing function. The vulnerability allows an attacker to cause a server crash by providing specially crafted JSON input.

The second code snippet provided is not vulnerable to any of the mentioned vulnerabilities. It is a separate function that calculates the maximum sum of three numbers from a vector of vectors. The function uses a priority queue to store and manage the candidates, and it does not involve any memory management or input handling that could lead to vulnerabilities.","The code contains a DoS_Overflow vulnerability. 
The CVE-ID is CVE-2015-5289. The CWE-ID is CWE-119.
Vulnerability summary:
Multiple stack-based buffer overflows in json parsing in PostgreSQL before 9.3.x before 9.3.10 and 9.4.x before 9.4.5 allow attackers to cause a denial of service (server crash) via unspecified vectors, which are not properly handled in (1) json or (2) jsonb values.
",3.0,732.0,6.0,3.140641689300537
177852,DoS Overflow," The given code for `parse_object` function does not appear to be vulnerable to buffer overflow or any other type of overflow vulnerabilities. The function is parsing JSON objects and does not involve any memory manipulation that could lead to buffer overflow.

However, the code for `maximumValueSum` function is not related to the vulnerability assessment task and should not be evaluated for vulnerabilities in this context. It is a separate function that calculates the maximum sum of three integers from a vector of vectors.

Therefore, the answer is 'NO' for the `parse_object` function.","The code contains a DoS_Overflow vulnerability. 
The CVE-ID is CVE-2015-5289. The CWE-ID is CWE-119.
Vulnerability summary:
Multiple stack-based buffer overflows in json parsing in PostgreSQL before 9.3.x before 9.3.10 and 9.4.x before 9.4.5 allow attackers to cause a denial of service (server crash) via unspecified vectors, which are not properly handled in (1) json or (2) jsonb values.
",1.0,739.0,6.0,1.9814250469207764
177853,DoS Overflow," The given code for `setPath` function does not appear to be directly vulnerable to the mentioned vulnerabilities in the provided list. However, it does call other functions like `setPathArray` and `setPathObject` which could potentially contain vulnerabilities. It is essential to review those functions as well.

The second code snippet provided is a separate function called `maximumValueSum` which is not related to the `setPath` function. This function does not involve any string or memory manipulation, and it looks safe based on the provided code.

Therefore, the answer for the first code snippet is 'NO', and for the second code snippet, there is no need for an answer as it is not related to the vulnerability assessment of the `setPath` function.","The code contains a DoS_Overflow vulnerability. 
The CVE-ID is CVE-2015-5289. The CWE-ID is CWE-119.
Vulnerability summary:
Multiple stack-based buffer overflows in json parsing in PostgreSQL before 9.3.x before 9.3.10 and 9.4.x before 9.4.5 allow attackers to cause a denial of service (server crash) via unspecified vectors, which are not properly handled in (1) json or (2) jsonb values.
",1.0,780.0,6.0,1.9110023975372314
177855,Bypass," Based on the provided code, it does not appear to be directly vulnerable to the Bypass vulnerability described in the given context. The code seems to be handling file paths and checking access permissions, but it does not involve symlinks or substring relationships that could be exploited for bypassing intended file-access restrictions.

However, it is essential to note that the code snippet provided does not represent the entire program, and other parts of the codebase could still contain vulnerabilities. It is always recommended to perform a thorough vulnerability assessment on the entire codebase to ensure its security.","The code contains a Bypass vulnerability. 
The CVE-ID is CVE-2015-5252. The CWE-ID is CWE-264.
Vulnerability summary:
vfs.c in smbd in Samba 3.x and 4.x before 4.1.22, 4.2.x before 4.2.7, and 4.3.x before 4.3.3, when share names with certain substring relationships exist, allows remote attackers to bypass intended file-access restrictions via a symlink that points outside of a share.
",1.0,745.0,6.0,2.8074722290039062
177856,, The given code does not contain the nan vulnerability as it is a different function with no shell command injection or ed script handling. The code provided is a separate function for calculating the maximum value sum of a given board. It is not vulnerable to the nan vulnerability.,"The code contains a nan vulnerability. 
The CVE-ID is CVE-2019-13638. The CWE-ID is CWE-78.
Vulnerability summary:
GNU patch through 2.7.6 is vulnerable to OS shell command injection that can be exploited by opening a crafted patch file that contains an ed style diff payload with shell metacharacters. The ed editor does not need to be present on the vulnerable system. This is different from CVE-2018-1000156.
",1.0,672.0,6.0,2.526309013366699
177857,," The given code for `plan_a` function is not directly related to the provided C++ code for the `maximumValueSum` function. Therefore, I cannot determine if the `maximumValueSum` function is vulnerable based on the given information.

However, I can provide some general information about the `maximumValueSum` function:

The `maximumValueSum` function appears to be implementing a 3-sum problem solution. It looks correct in terms of syntax and logic, but it does not follow the best practices for handling memory allocation and error checking. For instance, it does not check if the memory allocation for the `min_heaps` vector is successful. If the memory allocation fails, the function may continue executing, leading to undefined behavior.

To mitigate this risk, you should always check if memory allocation is successful before proceeding with further processing. In this case, you can add a check after the `min_heaps.resize()` statement to ensure that the memory allocation was successful. If it fails, you can return an error code or throw an exception.

Here's an example of how you can modify the code to check for memory allocation errors:

```cpp
min_heaps.resize(min_heaps.size() + size(board[0]));
if (min_heaps.size()!= min_heaps.capacity()) {
    //","The code contains a nan vulnerability. 
The CVE-ID is CVE-2019-13636. The CWE-ID is CWE-59.
Vulnerability summary:
In GNU patch through 2.7.6, the following of symlinks is mishandled in certain cases other than input files. This affects inp.c and util.c.
",2.0,853.0,6.0,2.7056455612182617
177859,Exec Code Bypass," The gs_nulldevice function in the provided code is not directly related to the given vulnerability. The vulnerability mentioned in the text is related to a different function and a different Ghostscript version.

The given code does not appear to be vulnerable to the Exec_Code_Bypass vulnerability described in the text. The code does not involve executing arbitrary code or bypassing security protections.

Therefore, the answer is 'NO'.","The code contains a Exec_Code_Bypass vulnerability. 
The CVE-ID is CVE-2018-16863. The CWE-ID is CWE-78.
Vulnerability summary:
It was found that RHSA-2018:2918 did not fully fix CVE-2018-16509. An attacker could possibly exploit another variant of the flaw and bypass the -dSAFER protection to, for example, execute arbitrary shell commands via a specially crafted PostScript document. This only affects ghostscript 9.07 as shipped with Red Hat Enterprise Linux 7.
",1.0,718.0,6.0,3.136039972305298
177860,Exec Code Bypass," The given code for the function `zrestore` is not directly related to the provided C++ code for the function `maximumValueSum`. Therefore, I cannot determine if the `maximumValueSum` function is vulnerable based on the provided code alone.

However, I can provide some general information about the `maximumValueSum` function:

The `maximumValueSum` function appears to be implementing a 3-sum problem solution using dynamic programming and a priority queue. It looks correct based on the given code, but it's important to note that this function does not involve any security-related functionality, so there are no obvious security vulnerabilities in this code.

Therefore, my answer is 'NO'. The `maximumValueSum` function is not vulnerable based on the provided code.","The code contains a Exec_Code_Bypass vulnerability. 
The CVE-ID is CVE-2018-16863. The CWE-ID is CWE-78.
Vulnerability summary:
It was found that RHSA-2018:2918 did not fully fix CVE-2018-16509. An attacker could possibly exploit another variant of the flaw and bypass the -dSAFER protection to, for example, execute arbitrary shell commands via a specially crafted PostScript document. This only affects ghostscript 9.07 as shipped with Red Hat Enterprise Linux 7.
",1.0,788.0,6.0,2.3090789318084717
177862,Exec Code," Based on the provided code, the `restore_page_device` function does not appear to be directly vulnerable to the Exec_Code vulnerability described in the initial code snippet. The `restore_page_device` function is not handling user input or executing arbitrary code, and it does not involve the use of potentially dangerous functions like `sprintf` or `strcpy`.

However, it is important to note that the vulnerability in the initial code snippet is a separate issue from the `restore_page_device` function. The vulnerability in the initial code snippet is related to the way Ghostscript handles PostScript code, and it is not directly related to the `restore_page_device` function.

Therefore, the answer is 'NO', the `restore_page_device` function is not vulnerable to the Exec_Code vulnerability described in the initial code snippet.","The code contains a Exec_Code vulnerability. 
The CVE-ID is CVE-2018-16802. The CWE-ID is nan.
Vulnerability summary:
An issue was discovered in Artifex Ghostscript before 9.25. Incorrect ""restoration of privilege"" checking when running out of stack during exception handling could be used by attackers able to supply crafted PostScript to execute code using the ""pipe"" instruction. This is due to an incomplete fix for CVE-2018-16509.
",1.0,783.0,6.0,2.2958507537841797
177865,DoS," The second code snippet provided does not appear to be directly related to the vulnerability described in the first code snippet. The second code snippet is a function called `maximumValueSum` that seems to be unrelated to the `PatternMatch` function in the first code snippet. Therefore, I cannot determine if the second code snippet is vulnerable based on the given information.

Answer: NO.","The code contains a DoS vulnerability. 
The CVE-ID is CVE-2017-13720. The CWE-ID is CWE-125.
Vulnerability summary:
In the PatternMatch function in fontfile/fontdir.c in libXfont through 1.5.2 and 2.x before 2.0.2, an attacker with access to an X connection can cause a buffer over-read during pattern matching of fonts, leading to information disclosure or a crash (denial of service). This occurs because '\0' characters are incorrectly skipped in situations involving ? characters.
",1.0,712.0,6.0,2.255457878112793
177867,," Based on the provided code, it appears that the `gs_main_finit` function is not directly related to the `maximumValueSum` function. Therefore, I cannot determine if the `gs_main_finit` function is vulnerable or not based on the given code alone.

However, I can tell you that the `maximumValueSum` function itself does not contain any apparent security vulnerabilities based on the provided code. It is a recursive function that calculates the maximum sum of three distinct elements from a given vector of vectors of integers. It uses a combination of `priority_queue`, `vector`, and `iota` to perform the calculation efficiently.

So, the answer is 'NO' for the `gs_main_finit` function, and 'NO' for the `maximumValueSum` function as well.","The code contains a nan vulnerability. 
The CVE-ID is CVE-2018-16541. The CWE-ID is CWE-416.
Vulnerability summary:
In Artifex Ghostscript before 9.24, attackers able to supply crafted PostScript files could use incorrect free logic in pagedevice replacement to crash the interpreter.
",1.0,750.0,6.0,2.626779794692993
