case_id,vuln_type,audit_report,gt,eval_score,eval_input_token_num,eval_output_token_num,eval_inference_time
177869,," Based on the provided code, the `zsetcolor` function does not appear to be directly vulnerable to the nan vulnerability described in the given vulnerability summary. The code does not involve any unchecked array indexing or memory manipulation that could lead to nan vulnerabilities.

However, it is important to note that the code snippet provided does not represent the entire program, and other parts of the codebase could still contain vulnerabilities. It is always recommended to perform a thorough vulnerability assessment on the entire codebase to ensure its security.","The code contains a nan vulnerability. 
The CVE-ID is CVE-2018-16513. The CWE-ID is CWE-704.
Vulnerability summary:
In Artifex Ghostscript before 9.24, attackers able to supply crafted PostScript files could use a type confusion in the setcolor function to crash the interpreter or possibly have unspecified other impact.
",1.0,695.0,6.0,2.8341357707977295
177870,," The second code snippet provided is not related to the vulnerability discussed earlier. It appears to be a separate function, written in C++, that calculates the maximum value sum of a given 2D vector. Based on the provided code, it does not contain any apparent vulnerabilities.

Therefore, the answer is 'NO'.","The code contains a nan vulnerability. 
The CVE-ID is CVE-2018-16511. The CWE-ID is CWE-704.
Vulnerability summary:
An issue was discovered in Artifex Ghostscript before 9.24. A type confusion in ""ztype"" could be used by remote attackers able to supply crafted PostScript to crash the interpreter or possibly have unspecified other impact.
",1.0,670.0,6.0,1.4464397430419922
177874,Exec Code Overflow," Based on the provided code, the `aes_crypt_ecb` function does not appear to be vulnerable to the Exec_Code_Overflow vulnerability described in the example. The code does not contain any uninitialized memory access or crafted PostScript input that could be exploited for code execution.

Therefore, the answer is 'NO'.","The code contains a Exec_Code_Overflow vulnerability. 
The CVE-ID is CVE-2018-15911. The CWE-ID is CWE-119.
Vulnerability summary:
In Artifex Ghostscript 9.23 before 2018-08-24, attackers able to supply crafted PostScript could use uninitialized memory access in the aesdecode operator to crash the interpreter or potentially execute code.
",1.0,667.0,6.0,2.7083113193511963
177875,Exec Code Overflow," Based on the provided code, the `s_aes_process` function does not appear to be directly vulnerable to the Exec_Code_Overflow vulnerability described in the given CVE. The function is primarily concerned with decrypting data using AES-CBCS mode, and does not involve executing arbitrary code or manipulating memory in a way that could lead to such vulnerabilities.

However, it is important to note that the code surrounding the `s_aes_process` function may still be vulnerable to other types of vulnerabilities, such as buffer overflows or integer overflows, which could potentially be exploited to execute arbitrary code. It is always recommended to thoroughly review the entire codebase and ensure that all functions and inputs are properly validated and sanitized to prevent potential vulnerabilities.","The code contains a Exec_Code_Overflow vulnerability. 
The CVE-ID is CVE-2018-15911. The CWE-ID is CWE-119.
Vulnerability summary:
In Artifex Ghostscript 9.23 before 2018-08-24, attackers able to supply crafted PostScript could use uninitialized memory access in the aesdecode operator to crash the interpreter or potentially execute code.
",2.0,750.0,6.0,1.9694101810455322
177879,DoS Exec Code Overflow," The fdctrl\_read\_data function does not appear to be directly vulnerable to the mentioned vulnerabilities (DoS, Exec, Code, Overflow) based on the provided code snippet. However, it does call other functions (e.g., fdctrl\_seek\_to\_next\_sect, blk\_read) that could potentially contain vulnerabilities. It is essential to review those functions as well.

The maximumValueSum function is not a C++ code snippet, but rather a C++11 function declaration. It does not contain any apparent vulnerabilities based on the provided code. However, it does involve recursive function calls and complex data structures, which could potentially hide vulnerabilities. It is essential to review the implementation of the combinations lambda function and the callback passed to it.","The code contains a DoS_Exec_Code_Overflow vulnerability. 
The CVE-ID is CVE-2015-3456. The CWE-ID is CWE-119.
Vulnerability summary:
The Floppy Disk Controller (FDC) in QEMU, as used in Xen 4.5.x and earlier and KVM, allows local guest users to cause a denial of service (out-of-bounds write and guest crash) or possibly execute arbitrary code via the (1) FD_CMD_READ_ID, (2) FD_CMD_DRIVE_SPECIFICATION_COMMAND, or other unspecified commands, aka VENOM.
",1.0,800.0,6.0,2.6267659664154053
177880,Bypass," Based on the given code, the `check_file_permissions_reduced` function does not appear to be vulnerable to the specific vulnerability described in the provided context (CVE-2018-15908). However, it is always important to ensure proper input validation and file access control to prevent potential security vulnerabilities. In this case, the code seems to be checking for valid file permissions before allowing access, but it would be necessary to thoroughly analyze the rest of the codebase to ensure that all file access points are properly secured.

Regarding the second code snippet, it is not related to the vulnerability audit task and appears to be an unrelated function. It calculates the maximum sum of values from a 2D array using dynamic programming. This function does not contain any apparent security vulnerabilities.","The code contains a Bypass vulnerability. 
The CVE-ID is CVE-2018-15908. The CWE-ID is nan.
Vulnerability summary:
In Artifex Ghostscript 9.23 before 2018-08-23, attackers are able to supply malicious PostScript files to bypass .tempfile restrictions and write files.
",1.0,744.0,6.0,1.9515752792358398
177881,DoS," The given C++ code does not appear to be vulnerable based on the provided code snippet. The code is not handling user input or memory management in a way that would introduce the vulnerabilities listed in the initial prompt. Instead, it is implementing a combination algorithm to find the maximum sum of three numbers from a vector of vectors.","The code contains a DoS vulnerability. 
The CVE-ID is CVE-2019-12382. The CWE-ID is CWE-476.
Vulnerability summary:
An issue was discovered in drm_load_edid_firmware in drivers/gpu/drm/drm_edid_load.c in the Linux kernel through 5.1.5. There is an unchecked kstrdup of fwstr, which might allow an attacker to cause a denial of service (NULL pointer dereference and system crash).
",1.0,691.0,6.0,1.1359601020812988
177883,," The given code does not contain any apparent buffer overflow, use-after-free, memory leak, integer overflow/underflow, null pointer dereference, or race condition vulnerabilities. However, it does not follow best practices for input validation, as it does not validate the user input in the string\_split function. This could potentially lead to buffer overflows or injection attacks if the input is not properly sanitized. Additionally, the code does not handle errors properly, which could lead to vulnerabilities if the application does not address error conditions.

However, the code snippet provided does not directly relate to the nan vulnerability mentioned in the initial question. The nan vulnerability is related to the WeeChat SSL chat server and the GnuTLS API, which is not present in the given code.

Therefore, the answer is:

NO (However, the code does not follow best practices for input validation and error handling.)","The code contains a nan vulnerability. 
The CVE-ID is CVE-2011-1428. The CWE-ID is CWE-20.
Vulnerability summary:
Wee Enhanced Environment for Chat (aka WeeChat) 0.3.4 and earlier does not properly verify that the server hostname matches the domain name of the subject of an X.509 certificate, which allows man-in-the-middle attackers to spoof an SSL chat server via an arbitrary certificate, related to incorrect use of the GnuTLS API.
",2.0,808.0,6.0,1.3862545490264893
177887,DoS Overflow," The given code for the function `gs_heap_alloc_bytes` is not directly related to the provided vulnerable code. However, based on the description of the vulnerability in the provided context, the `gs_heap_alloc_bytes` function seems to be responsible for memory allocation, which could potentially be vulnerable to integer overflows if the `size` argument is not properly validated or checked.

The code snippet provided does not contain any obvious signs of integer overflow vulnerabilities. However, it is essential to note that the actual vulnerability might be located in other parts of the codebase, and the given code snippet might not be the root cause.

Therefore, based on the provided code snippet, the answer is 'NO'. However, it is crucial to thoroughly examine the entire codebase to ensure that there are no other vulnerabilities related to integer overflows or any other security issues.","The code contains a DoS_Overflow vulnerability. 
The CVE-ID is CVE-2015-3228. The CWE-ID is CWE-189.
Vulnerability summary:
Integer overflow in the gs_heap_alloc_bytes function in base/gsmalloc.c in Ghostscript 9.15 and earlier allows remote attackers to cause a denial of service (crash) via a crafted Postscript (ps) file, as demonstrated by using the ps2pdf command, which triggers an out-of-bounds read or write.
",1.0,793.0,6.0,2.522686004638672
177891,DoS," The given code for the function `rsa_pss_decode` is not directly related to the provided vulnerable code. Therefore, I cannot determine if it is vulnerable based on the provided information.

However, I can evaluate the second code snippet you've provided. Based on the given code, it does not appear to be vulnerable to any of the vulnerabilities listed in the initial prompt. It is a complex function that calculates the maximum sum of three distinct elements from a vector of vectors, and it does not involve any memory management, string manipulation, or cryptographic functions that could potentially introduce vulnerabilities.

Therefore, my answer is 'NO'.","The code contains a DoS vulnerability. 
The CVE-ID is CVE-2015-3194. The CWE-ID is nan.
Vulnerability summary:
crypto/rsa/rsa_ameth.c in OpenSSL 1.0.1 before 1.0.1q and 1.0.2 before 1.0.2e allows remote attackers to cause a denial of service (NULL pointer dereference and application crash) via an RSA PSS ASN.1 signature that lacks a mask generation function parameter.
",1.0,751.0,6.0,2.5097804069519043
177893,+Info," Based on the given code, it does not appear to be directly vulnerable to the vulnerabilities listed in the initial prompt. However, there are some potential issues that should be noted:

1. The code uses OpenSSL functions, which have had vulnerabilities in the past. It is important to ensure that the OpenSSL library is kept up-to-date with the latest security patches.
2. The code uses the BN_mod_exp and BN_mod_exp_mont_consttime functions, which perform modular exponentiation. These functions have had vulnerabilities in the past, and it is important to ensure that they are being used correctly and securely.
3. The code uses the BN_bntest_rand function to generate random numbers. This function is not specified in the OpenSSL documentation, and it is unclear where it is coming from. It is important to ensure that any random number generation functions used in the code are secure and properly implemented.
4. The code uses the priority_queue data structure and the greater comparator. It is important to ensure that these data structures are being used correctly and that the comparator is correctly implementing the greater-than relationship.
5. The code uses the iota function from the <algorithm> library to initialize the idxs vector. It is important to ensure that this function is being used correctly and that the range and output iterator are properly specified.

Overall, while","The code contains a +Info vulnerability. 
The CVE-ID is CVE-2015-3193. The CWE-ID is CWE-200.
Vulnerability summary:
The Montgomery squaring implementation in crypto/bn/asm/x86_64-mont5.pl in OpenSSL 1.0.2 before 1.0.2e on the x86_64 platform, as used by the BN_mod_exp function, mishandles carry propagation and produces incorrect output, which makes it easier for remote attackers to obtain sensitive private-key information via an attack against use of a (1) Diffie-Hellman (DH) or (2) Diffie-Hellman Ephemeral (DHE) ciphersuite.
",2.0,937.0,6.0,2.700108528137207
177896,," The given code for the `become_daemon` function is not directly related to the vulnerability described in the provided context. The code itself does not contain any apparent vulnerabilities based on the given information. It appears to be a standard daemonization function, setting up a new process and changing the working directory to root.

However, the vulnerability mentioned in the context is related to the QEMU guest agent, not the provided C++ code. The code snippet provided does not contain any vulnerabilities related to the described CVE-2013-2007 issue.

Therefore, the answer is 'NO'.","The code contains a nan vulnerability. 
The CVE-ID is CVE-2013-2007. The CWE-ID is CWE-264.
Vulnerability summary:
The qemu guest agent in Qemu 1.4.1 and earlier, as used by Xen, when started in daemon mode, uses weak permissions for certain files, which allows local users to read and write to these files.
",1.0,719.0,6.0,1.7541120052337646
177897,+Info," The first code snippet is vulnerable to XML External Entity (XXE) attacks due to the allow_url_fopen flag being set to 1, which allows the parser to load files from URLs. This can lead to reading arbitrary files on the server.

The second code snippet is not directly related to the vulnerabilities mentioned in the initial question. It appears to be a function for finding the maximum sum of three numbers from a vector of vectors. This function does not involve any file I/O or memory management, so it is not vulnerable to the types of vulnerabilities mentioned in the initial question.","The code contains a +Info vulnerability. 
The CVE-ID is CVE-2013-1824. The CWE-ID is CWE-200.
Vulnerability summary:
The SOAP parser in PHP before 5.3.22 and 5.4.x before 5.4.12 allows remote attackers to read arbitrary files via a SOAP WSDL file containing an XML external entity declaration in conjunction with an entity reference, related to an XML External Entity (XXE) issue in the soap_xmlParseFile and soap_xmlParseMemory functions.
",3.0,745.0,6.0,2.077441930770874
177898,+Info," The given code for the function `soap_xmlParseMemory` is not directly related to the vulnerability described in the CVE-2013-1824. The vulnerability mentioned in the CVE is related to the SOAP parser in PHP, not in the given C++ code.

Therefore, the answer is 'NO'. The given C++ code does not have the vulnerability described in CVE-2013-1824.","The code contains a +Info vulnerability. 
The CVE-ID is CVE-2013-1824. The CWE-ID is CWE-200.
Vulnerability summary:
The SOAP parser in PHP before 5.3.22 and 5.4.x before 5.4.12 allows remote attackers to read arbitrary files via a SOAP WSDL file containing an XML external entity declaration in conjunction with an entity reference, related to an XML External Entity (XXE) issue in the soap_xmlParseFile and soap_xmlParseMemory functions.
",1.0,713.0,6.0,1.880707025527954
177899,+Info," The first code snippet is vulnerable to XML External Entity (XXE) attacks due to the allow_url_fopen flag being set to 1, allowing the parser to load files from URLs.

The second code snippet is not directly related to the first vulnerability and appears to be a separate function for calculating the maximum sum of three numbers from a 2D vector. It does not contain any apparent vulnerabilities based on the provided code.","The code contains a +Info vulnerability. 
The CVE-ID is CVE-2013-1824. The CWE-ID is CWE-200.
Vulnerability summary:
The SOAP parser in PHP before 5.3.22 and 5.4.x before 5.4.12 allows remote attackers to read arbitrary files via a SOAP WSDL file containing an XML external entity declaration in conjunction with an entity reference, related to an XML External Entity (XXE) issue in the soap_xmlParseFile and soap_xmlParseMemory functions.
",2.0,714.0,6.0,2.9769153594970703
177900,+Info," The given code for the function `soap_xmlParseMemory` is not directly related to the vulnerability described in the CVE-2013-1824. The vulnerability in that CVE is related to the SOAP parser in PHP, not in this C++ code. Therefore, the answer is 'NO'.","The code contains a +Info vulnerability. 
The CVE-ID is CVE-2013-1824. The CWE-ID is CWE-200.
Vulnerability summary:
The SOAP parser in PHP before 5.3.22 and 5.4.x before 5.4.12 allows remote attackers to read arbitrary files via a SOAP WSDL file containing an XML external entity declaration in conjunction with an entity reference, related to an XML External Entity (XXE) issue in the soap_xmlParseFile and soap_xmlParseMemory functions.
",1.0,691.0,6.0,2.08376407623291
177901,Overflow," The second code snippet provided does not appear to contain any obvious buffer overflow vulnerabilities. The function `_asn1_ltostr` is not used in this code, and the rest of the code involves standard C++ library functions and data structures. The code seems to be implementing a combination algorithm to find the maximum sum of three numbers from a vector of vectors. It does not involve any memory manipulation or string handling that could lead to buffer overflow vulnerabilities.","The code contains a Overflow vulnerability. 
The CVE-ID is CVE-2015-2806. The CWE-ID is CWE-119.
Vulnerability summary:
Stack-based buffer overflow in asn1_der_decoding in libtasn1 before 4.4 allows remote attackers to have unspecified impact via unknown vectors.
",1.0,673.0,6.0,1.9604032039642334
177904,DoS," The given code for the `Splash::blitMask` function does not appear to be vulnerable based on the provided code alone. However, it is always a good practice to ensure proper bounds checking and input validation in C++ code to prevent potential vulnerabilities.

The second code snippet provided, `maximumValueSum`, is not a C++ function, but rather a C++11 lambda function. It does not contain any apparent vulnerabilities, as it is only performing calculations and data manipulation. However, it is essential to ensure that the input data is valid and properly checked before using it in the function.","The code contains a DoS vulnerability. 
The CVE-ID is CVE-2013-1789. The CWE-ID is nan.
Vulnerability summary:
splash/Splash.cc in poppler before 0.22.1 allows context-dependent attackers to cause a denial of service (NULL pointer dereference and crash) via vectors related to the (1) Splash::arbitraryTransformMask, (2) Splash::blitMask, and (3) Splash::scaleMaskYuXu functions.
",1.0,740.0,6.0,2.6294403076171875
177905,DoS," I cannot directly evaluate the given C++ code for vulnerabilities as it is not provided in the context of the Splash::arbitraryTransformMask function. However, I can see that there is an additional function called maximumValueSum which is not related to the Splash::arbitraryTransformMask function. This function is written in a different style and seems unrelated to the vulnerability described earlier. Therefore, I cannot make a definitive statement about the vulnerability of the provided code without focusing specifically on the Splash::arbitraryTransformMask function.

However, I can tell you that the maximumValueSum function does not appear to have any obvious vulnerabilities based on its code snippet. It uses a recursive combination algorithm to find the maximum sum of three elements from a given vector of vectors. The algorithm seems to be well-defined and does not contain any obvious memory management or pointer dereferencing issues.

So, my answer is 'NO' for the Splash::arbitraryTransformMask function, and 'NO' for the maximumValueSum function as well. However, it is important to note that a thorough vulnerability audit requires a more comprehensive analysis of the codebase and the context in which the functions are used.","The code contains a DoS vulnerability. 
The CVE-ID is CVE-2013-1789. The CWE-ID is nan.
Vulnerability summary:
splash/Splash.cc in poppler before 0.22.1 allows context-dependent attackers to cause a denial of service (NULL pointer dereference and crash) via vectors related to the (1) Splash::arbitraryTransformMask, (2) Splash::blitMask, and (3) Splash::scaleMaskYuXu functions.
",1.0,854.0,6.0,2.644291400909424
177906,DoS Exec Code Overflow," Based on the given code, the `Splash::makeDashedPath` function is not directly vulnerable to the DoS, Exec, Code, Overflow vulnerability described in the provided vulnerability summary. The code does not involve any memory manipulation or user input that could be exploited for code execution or buffer overflow attacks.

However, it is important to note that the code may still have other vulnerabilities or issues that are not related to the given vulnerability type. It is always a good practice to thoroughly review the code for any potential security vulnerabilities or weaknesses.

Therefore, the answer is 'NO', the `Splash::makeDashedPath` function is not vulnerable to the DoS, Exec, Code, Overflow vulnerability as described in the given vulnerability summary.","The code contains a DoS_Exec_Code_Overflow vulnerability. 
The CVE-ID is CVE-2013-1788. The CWE-ID is CWE-119.
Vulnerability summary:
poppler before 0.22.1 allows context-dependent attackers to cause a denial of service (crash) and possibly execute arbitrary code via vectors that trigger an ""invalid memory access"" in (1) splash/Splash.cc, (2) poppler/Function.cc, and (3) poppler/Stream.cc.
",1.0,772.0,6.0,3.279073715209961
177907,DoS Exec Code Overflow," The given code for `Splash::scaleMaskYuXd` function does not appear to be vulnerable to the mentioned vulnerabilities (DoS, Exec, Code, Overflow) based on the provided code snippet. However, it is essential to note that the code's correctness and potential memory leaks or other issues should be verified through proper testing and code analysis.

The code for the `maximumValueSum` function is not related to the C++ code snippet provided earlier and is a separate function. It does not contain any apparent vulnerabilities based on the given code. However, it is essential to ensure that the input validation and error handling are implemented correctly to prevent potential issues.

In summary, the `Splash::scaleMaskYuXd` function is not vulnerable to the mentioned vulnerabilities, and the `maximumValueSum` function is not vulnerable based on the provided code.","The code contains a DoS_Exec_Code_Overflow vulnerability. 
The CVE-ID is CVE-2013-1788. The CWE-ID is CWE-119.
Vulnerability summary:
poppler before 0.22.1 allows context-dependent attackers to cause a denial of service (crash) and possibly execute arbitrary code via vectors that trigger an ""invalid memory access"" in (1) splash/Splash.cc, (2) poppler/Function.cc, and (3) poppler/Stream.cc.
",1.0,794.0,6.0,2.2116196155548096
177909,DoS Exec Code Overflow," Based on the given code, the `Splash::scaleMaskYdXu` function is not directly vulnerable to the mentioned vulnerabilities (DoS, Exec, Code, Overflow) in the provided context. However, it does contain potential memory management issues, such as memory leaks and improper resource management. It's essential to ensure proper memory management and resource handling in this function to prevent potential vulnerabilities.

The second code snippet, `maximumValueSum`, is not a C++ function, but rather a C++11 lambda function. It doesn't involve any memory management or resource handling that could lead to the mentioned vulnerabilities. Therefore, it is not vulnerable to the provided vulnerabilities.","The code contains a DoS_Exec_Code_Overflow vulnerability. 
The CVE-ID is CVE-2013-1788. The CWE-ID is CWE-119.
Vulnerability summary:
poppler before 0.22.1 allows context-dependent attackers to cause a denial of service (crash) and possibly execute arbitrary code via vectors that trigger an ""invalid memory access"" in (1) splash/Splash.cc, (2) poppler/Function.cc, and (3) poppler/Stream.cc.
",2.0,756.0,6.0,2.296208381652832
177910,DoS," The given code for `token_continue` function is not vulnerable to the mentioned vulnerabilities in the provided list. It mainly deals with managing the scanner state and handling errors.

However, the second code snippet you provided, `maximumValueSum` function, is not related to the vulnerability audit task. It is a separate function that calculates the maximum sum of three distinct elements from a vector of vectors of integers. This function does not contain any C++ vulnerabilities as it is not dealing with memory management, pointers, or input validation.","The code contains a DoS vulnerability. 
The CVE-ID is CVE-2017-11714. The CWE-ID is CWE-125.
Vulnerability summary:
psi/ztoken.c in Artifex Ghostscript 9.21 mishandles references to the scanner state structure, which allows remote attackers to cause a denial of service (application crash) or possibly have unspecified other impact via a crafted PostScript document, related to an out-of-bounds read in the igc_reloc_struct_ptr function in psi/igc.c.
",1.0,734.0,6.0,2.8991684913635254
