case_id,vuln_type,audit_report,gt,eval_score,eval_input_token_num,eval_output_token_num,eval_inference_time
177736,Bypass," The given code snippet `samldb_check_user_account_control_acl` is not directly related to the provided vulnerability description. Therefore, it is not vulnerable based on the information provided.

However, it is always a good practice to follow secure coding guidelines when writing code, such as:

1. Properly checking for errors and handling them appropriately.
2. Ensuring that all user inputs are validated and sanitized.
3. Using the latest libraries and functions to avoid known vulnerabilities.
4. Implementing access control mechanisms to restrict unauthorized access.
5. Following the principle of least privilege.

The code snippet you provided, `maximumValueSum`, is not related to the vulnerability discussion and appears to be a separate function. It does not contain any apparent security vulnerabilities based on the given code. However, it is always a good practice to follow secure coding guidelines when writing code.","The code contains a Bypass vulnerability. 
The CVE-ID is CVE-2015-8467. The CWE-ID is CWE-264.
Vulnerability summary:
The samldb_check_user_account_control_acl function in dsdb/samdb/ldb_modules/samldb.c in Samba 4.x before 4.1.22, 4.2.x before 4.2.7, and 4.3.x before 4.3.3 does not properly check for administrative privileges during creation of machine accounts, which allows remote authenticated users to bypass intended access restrictions by leveraging the existence of a domain with both a Samba DC and a Windows DC, a similar issue to CVE-2015-2535.
",1.0,839.0,6.0,2.560856819152832
177740,DoS Exec Code Overflow Mem. Corr.," The given code for the function `asn1_time_to_time_t` is not directly related to the code snippet you provided earlier, which was vulnerable to a DoS, Exec, Code, Overflow, Mem., Corr. vulnerability. The new code snippet appears to be a separate function for converting an ASN.1 UTC time string to a Unix timestamp.

Based on the provided code, it does not seem to contain any obvious vulnerabilities. However, it is always a good practice to ensure proper bounds checking when dealing with strings and memory operations. In this case, the code snippet appears to be using `estrdup` to allocate memory for `strbuf`, and it checks the length of `timestr->data` before proceeding. Additionally, it uses `atoi` to parse individual components of the time string, which should be within the bounds of the string.

Therefore, my answer is 'NO'. However, it is essential to keep in mind that this analysis is based on the provided code snippet alone, and the code may be part of a larger system where other vulnerabilities could exist. It is always recommended to perform thorough vulnerability assessments on the entire system to ensure its security.","The code contains a DoS_Exec_Code_Overflow_Mem._Corr. vulnerability. 
The CVE-ID is CVE-2013-6420. The CWE-ID is CWE-119.
Vulnerability summary:
The asn1_time_to_time_t function in ext/openssl/openssl.c in PHP before 5.3.28, 5.4.x before 5.4.23, and 5.5.x before 5.5.7 does not properly parse (1) notBefore and (2) notAfter timestamps in X.509 certificates, which allows remote attackers to execute arbitrary code or cause a denial of service (memory corruption) via a crafted certificate that is not properly handled by the openssl_x509_parse function.
",1.0,908.0,6.0,4.039801120758057
177741,DoS Overflow," The given code for the function `long long maximumValueSum(vector<vector<int>>& board)` does not appear to be vulnerable to the mentioned vulnerabilities in the provided list. It is not handling memory directly, and it is not using any of the functions or constructs that are known to be vulnerable to the types of issues listed. Therefore, the answer is 'NO'.","The code contains a DoS_Overflow vulnerability. 
The CVE-ID is CVE-2011-4128. The CWE-ID is CWE-119.
Vulnerability summary:
Buffer overflow in the gnutls_session_get_data function in lib/gnutls_session.c in GnuTLS 2.12.x before 2.12.14 and 3.x before 3.0.7, when used on a client that performs nonstandard session resumption, allows remote TLS servers to cause a denial of service (application crash) via a large SessionTicket.
",1.0,709.0,6.0,2.4513466358184814
177742,DoS Overflow," The given code for the function `long long maximumValueSum(vector<vector<int>>& board)` does not appear to be vulnerable to the mentioned vulnerabilities in the provided list. It does not involve string or memory functions, dynamic memory management, arithmetic operations, or pointer dereferencing that could lead to the identified vulnerabilities. Instead, it deals with vector manipulation and finding the maximum sum of three numbers from a list of candidates.","The code contains a DoS_Overflow vulnerability. 
The CVE-ID is CVE-2011-4128. The CWE-ID is CWE-119.
Vulnerability summary:
Buffer overflow in the gnutls_session_get_data function in lib/gnutls_session.c in GnuTLS 2.12.x before 2.12.14 and 3.x before 3.0.7, when used on a client that performs nonstandard session resumption, allows remote TLS servers to cause a denial of service (application crash) via a large SessionTicket.
",1.0,718.0,6.0,2.0743606090545654
177743,DoS," The given C++ code does not appear to be directly related to the vulnerability described in the initial message. The code provided is a function for finding the maximum sum of three numbers from a 2D array. It does not involve any file handling or string manipulation, and there is no evidence of buffer overflow, use-after-free, memory leak, or other common security vulnerabilities. Therefore, the answer is 'NO'.","The code contains a DoS vulnerability. 
The CVE-ID is CVE-2015-7804. The CWE-ID is CWE-189.
Vulnerability summary:
Off-by-one error in the phar_parse_zipfile function in ext/phar/zip.c in PHP before 5.5.30 and 5.6.x before 5.6.14 allows remote attackers to cause a denial of service (uninitialized pointer dereference and application crash) by including the / filename in a .zip PHAR archive.
",1.0,711.0,6.0,2.2456021308898926
177747,DoS," The given code for the function `bgp_attr_unknown` is not directly vulnerable to the vulnerabilities listed in the provided steps. However, it does contain a memory allocation issue where the `total` variable is not initialized before use. This could potentially lead to unintended behavior or crashes, but it does not directly result in a security vulnerability like a buffer overflow or use-after-free.

The second code snippet provided, `long long maximumValueSum(vector<vector<int>>& board)`, is not vulnerable to any of the mentioned vulnerabilities as it does not involve any memory management, string manipulation, or input validation that could lead to security vulnerabilities. It is just a recursive function to find the maximum sum of three numbers from a given vector of vectors.","The code contains a DoS vulnerability. 
The CVE-ID is CVE-2013-6051. The CWE-ID is nan.
Vulnerability summary:
The bgp_attr_unknown function in bgp_attr.c in Quagga 0.99.21 does not properly initialize the total variable, which allows remote attackers to cause a denial of service (bgpd crash) via a crafted BGP update.
",2.0,748.0,6.0,2.8756721019744873
177750,DoS Exec Code," The given code for `begin_softmask` function does not appear to be vulnerable to use-after-free (CWE-416) as there is no explicit freeing or deletion of pointers within the function. However, it is important to note that this analysis is based on the provided code snippet alone and does not consider the larger context of the MuPDF library or the rest of the codebase. Always ensure to perform a thorough vulnerability assessment on the entire codebase to ensure comprehensive security.","The code contains a DoS_Exec_Code vulnerability. 
The CVE-ID is CVE-2018-1000039. The CWE-ID is CWE-416.
Vulnerability summary:
In MuPDF 1.12.0 and earlier, multiple heap use after free bugs in the PDF parser could allow an attacker to execute arbitrary code, read memory, or cause a denial of service via a crafted file.
",1.0,699.0,6.0,4.350499391555786
177766,DoS," Based on the given code, the `ldap_push_filter` function does not appear to be directly vulnerable to a DoS attack as described in the vulnerability summary provided. The function processes LDAP filter expressions and pushes them onto an ASN.1 data structure. It does not involve any memory allocation that is not checked for success, nor does it involve any user input that could be manipulated to cause a DoS condition.

Therefore, the answer is 'NO'.","The code contains a DoS vulnerability. 
The CVE-ID is CVE-2015-7540. The CWE-ID is CWE-399.
Vulnerability summary:
The LDAP server in the AD domain controller in Samba 4.x before 4.1.22 does not check return values to ensure successful ASN.1 memory allocation, which allows remote attackers to cause a denial of service (memory consumption and daemon crash) via crafted packets.
",1.0,707.0,6.0,1.4202754497528076
177767,DoS," The given code for the function `decode_openldap_dereference` is not vulnerable to the DoS vulnerability described in the provided context. The vulnerability in the original code was due to the lack of checking the return values of ASN.1 memory allocation functions, which could lead to memory exhaustion and a denial of service. However, the given code snippet does not contain any such issue. It properly checks the return values of the `talloc` and `asn1_load` functions and returns false if they fail. Therefore, the answer is 'NO'.","The code contains a DoS vulnerability. 
The CVE-ID is CVE-2015-7540. The CWE-ID is CWE-399.
Vulnerability summary:
The LDAP server in the AD domain controller in Samba 4.x before 4.1.22 does not check return values to ensure successful ASN.1 memory allocation, which allows remote attackers to cause a denial of service (memory consumption and daemon crash) via crafted packets.
",1.0,721.0,6.0,3.240180492401123
177768,DoS," The given code for `sparse_dump_region` function does not appear to be directly vulnerable to the DoS vulnerability described in the provided context. The vulnerability in the context is related to the way GNU Tar handles file shrinkage during read access, which is not present in the given code.

However, it's important to note that the code might still have other vulnerabilities, such as buffer overflows, use-after-free errors, memory leaks, or other issues. The given code snippet does not provide enough context to evaluate these vulnerabilities.

Therefore, the answer is 'NO', but it's essential to keep in mind that the code might still have other vulnerabilities.","The code contains a DoS vulnerability. 
The CVE-ID is CVE-2018-20482. The CWE-ID is CWE-835.
Vulnerability summary:
GNU Tar through 1.30, when --sparse is used, mishandles file shrinkage during read access, which allows local users to cause a denial of service (infinite read loop in sparse_dump_region in sparse.c) by modifying a file that is supposed to be archived by a different user's process (e.g., a system backup running as root).
",2.0,757.0,6.0,2.8745980262756348
177770,Bypass," The given code for the function `read_ndx_and_attrs` does not appear to contain any obvious vulnerabilities based on the provided context. However, it is important to note that without a complete understanding of the context in which this function is used, it is impossible to make a definitive statement about its security.

The code appears to be handling file indices and related metadata, and it includes checks to ensure that indices are within valid ranges. It also includes error handling and logging functionality. While there are some potential edge cases and conditions that could potentially be exploited, such as buffer overflows or integer overflows, the code does not exhibit any obvious signs of these vulnerabilities.

Therefore, my answer is 'NO', and I do not believe that the given code is vulnerable based on the provided context. However, it is always important to keep in mind that security vulnerabilities can be subtle and difficult to detect, and that even seemingly innocuous code can contain hidden vulnerabilities. Therefore, it is always a good idea to perform thorough security testing and analysis on all code, especially code that handles user input or critical system functions.","The code contains a Bypass vulnerability. 
The CVE-ID is CVE-2017-17434. The CWE-ID is nan.
Vulnerability summary:
The daemon in rsync 3.1.2, and 3.1.3-development before 2017-12-03, does not check for fnamecmp filenames in the daemon_filter_list data structure (in the recv_files function in receiver.c) and also does not apply the sanitize_paths protection mechanism to pathnames found in ""xname follows"" strings (in the read_ndx_and_attrs function in rsync.c), which allows remote attackers to bypass intended access restrictions.
",1.0,870.0,6.0,2.1184706687927246
177771,," The second code snippet provided is not related to the DNS vulnerability discussed earlier. It is a different function called `maximumValueSum` that appears to be calculating the maximum sum of three elements from a vector of vectors. Based on the provided code, it does not contain any apparent buffer overflow, use-after-free, memory leak, or other vulnerabilities related to the steps outlined in the initial question. Therefore, the answer is 'NO'.","The code contains a nan vulnerability. 
The CVE-ID is CVE-2018-20103. The CWE-ID is CWE-835.
Vulnerability summary:
An issue was discovered in dns.c in HAProxy through 1.8.14. In the case of a compressed pointer, a crafted packet can trigger infinite recursion by making the pointer point to itself, or create a long chain of valid pointers resulting in stack exhaustion.
",1.0,694.0,6.0,1.5785822868347168
177773,DoS Exec Code Overflow Mem. Corr.," The given code for `create_surface_from_thumbnail_data` function is not directly related to the provided vulnerability CVE-2009-3607. However, it does contain a memory allocation issue where the size of the memory block is calculated based on the input `width` and `height`. If these values are not properly validated or checked for integer overflows, it could lead to an allocation of insufficient memory, causing a buffer underflow or a memory leak.

To mitigate this risk, it's essential to validate the input `width` and `height` values and check for integer overflows before calculating the memory size. Additionally, consider using modern C++ libraries like `std::vector` instead of manually managing memory with `g_malloc` and `g_free`.

Regarding the second code snippet, it appears to be a different function, and it doesn't contain any apparent vulnerabilities related to the steps mentioned in the question. It's a complex function that calculates the maximum value sum from a given 2D board using dynamic programming and a priority queue. It doesn't involve any string or memory functions, and it doesn't have any apparent bounds checking issues. Therefore, it's likely not vulnerable to the types of issues mentioned in the question.","The code contains a DoS_Exec_Code_Overflow_Mem._Corr. vulnerability. 
The CVE-ID is CVE-2009-3607. The CWE-ID is CWE-189.
Vulnerability summary:
Integer overflow in the create_surface_from_thumbnail_data function in glib/poppler-page.cc in Poppler 0.x allows remote attackers to cause a denial of service (memory corruption) or possibly execute arbitrary code via a crafted PDF document that triggers a heap-based buffer overflow.  NOTE: some of these details are obtained from third party information.
",2.0,874.0,6.0,2.7195591926574707
177774,DoS Exec Code Overflow," The given code for the function `SplashOutputDev::drawImage` does not appear to contain any obvious buffer overflow, use-after-free, memory leak, or integer overflow vulnerabilities based on the provided code snippet. However, it does allocate memory with `gmalloc` and `gmallocn` and later free it with `gfree`, which could potentially lead to memory leaks if not managed properly. Additionally, the code uses `str->close()` but does not check its return value, which could potentially hide errors or exceptions.

The second code snippet provided, `long long maximumValueSum(vector<vector<int>>& board)`, is not a C++ code snippet, but rather a C++11 code snippet. It does not contain any apparent vulnerabilities, as it only performs iterations and calculations on the given input vector.

Therefore, the answer is 'NO' for both code snippets. However, it's essential to note that a thorough vulnerability assessment requires analyzing the entire codebase and considering various attack vectors, not just the given code snippets.","The code contains a DoS_Exec_Code_Overflow vulnerability. 
The CVE-ID is CVE-2009-3605. The CWE-ID is CWE-189.
Vulnerability summary:
Multiple integer overflows in Poppler 0.10.5 and earlier allow remote attackers to cause a denial of service (application crash) or possibly execute arbitrary code via a crafted PDF file, related to (1) glib/poppler-page.cc; (2) ArthurOutputDev.cc, (3) CairoOutputDev.cc, (4) GfxState.cc, (5) JBIG2Stream.cc, (6) PSOutputDev.cc, and (7) SplashOutputDev.cc in poppler/; and (8) SplashBitmap.cc, (9) Splash.cc, and (10) SplashFTFont.cc in splash/.  NOTE: this may overlap CVE-2009-0791.
",1.0,910.0,6.0,2.4074299335479736
177775,DoS Exec Code Overflow," Based on the provided code, there are no obvious buffer overflow, use-after-free, memory leak, or null pointer dereference vulnerabilities. However, there are some potential integer overflow vulnerabilities. For instance, in the function `maximumValueSum`, the size of the vectors `min_heaps` and `candidates` are not checked against the expected size, which could lead to an integer overflow if the input size is larger than expected. Additionally, the condition `if (size(min_heap) == ((k - 1) * (2 * k - 1) + 1) + 1)` in the same function may also lead to an integer overflow if the value of `k` is large.

However, these potential integer overflows do not directly lead to security vulnerabilities such as code execution or denial of service. Instead, they could result in incorrect results or program crashes. To mitigate these vulnerabilities, proper bounds checking should be implemented to ensure that the size of the vectors does not exceed the expected size.

Therefore, the answer is:

YES (Potential integer overflow vulnerabilities)

Reason:
The code contains potential integer overflow vulnerabilities, which could lead to incorrect results or program crashes. Proper bounds checking should be implemented to ensure that the size of the vectors does not exceed the expected size.","The code contains a DoS_Exec_Code_Overflow vulnerability. 
The CVE-ID is CVE-2009-3605. The CWE-ID is CWE-189.
Vulnerability summary:
Multiple integer overflows in Poppler 0.10.5 and earlier allow remote attackers to cause a denial of service (application crash) or possibly execute arbitrary code via a crafted PDF file, related to (1) glib/poppler-page.cc; (2) ArthurOutputDev.cc, (3) CairoOutputDev.cc, (4) GfxState.cc, (5) JBIG2Stream.cc, (6) PSOutputDev.cc, and (7) SplashOutputDev.cc in poppler/; and (8) SplashBitmap.cc, (9) Splash.cc, and (10) SplashFTFont.cc in splash/.  NOTE: this may overlap CVE-2009-0791.
",2.0,962.0,6.0,4.000142335891724
177777,DoS Exec Code Overflow," The given C++ code for `CairoOutputDev::drawImage` function does not appear to contain any obvious buffer overflow vulnerabilities. However, it does allocate memory dynamically using `gmalloc` and `new` without checking the return values, which could potentially lead to memory leaks if the allocation fails. It is also important to ensure that the allocated memory is properly freed when it is no longer needed to avoid memory leaks.

The second code snippet provided is a separate function `maximumValueSum` that calculates the maximum sum of three elements in a 3x3 matrix (stored as a 2D vector). This function does not contain any apparent buffer overflow vulnerabilities either.

Therefore, the answer is 'NO'. However, it is essential to ensure proper memory management in the `CairoOutputDev::drawImage` function to avoid memory leaks.","The code contains a DoS_Exec_Code_Overflow vulnerability. 
The CVE-ID is CVE-2009-3605. The CWE-ID is CWE-189.
Vulnerability summary:
Multiple integer overflows in Poppler 0.10.5 and earlier allow remote attackers to cause a denial of service (application crash) or possibly execute arbitrary code via a crafted PDF file, related to (1) glib/poppler-page.cc; (2) ArthurOutputDev.cc, (3) CairoOutputDev.cc, (4) GfxState.cc, (5) JBIG2Stream.cc, (6) PSOutputDev.cc, and (7) SplashOutputDev.cc in poppler/; and (8) SplashBitmap.cc, (9) Splash.cc, and (10) SplashFTFont.cc in splash/.  NOTE: this may overlap CVE-2009-0791.
",1.0,881.0,6.0,1.3331091403961182
177778,DoS Exec Code Overflow," The given C++ code for `CairoOutputDev::drawMaskedImage` function does not appear to contain any obvious buffer overflow, use-after-free, memory leak, integer overflow/underflow, null pointer dereference, or sensitive data exposure vulnerabilities based on the provided code snippet. However, it does contain some potential race conditions, as it uses multiple threads and shared resources without proper synchronization. It is recommended to review the code in the context of the entire application and ensure that proper synchronization mechanisms like mutexes, locks, or atomic operations are used to prevent concurrent access to shared resources.

The second code snippet provided is not related to the vulnerability audit and is not a C++ code. It is a function called `maximumValueSum` written in C++11. This function does not contain any apparent vulnerabilities, as it only performs some calculations and uses standard C++ libraries.

Therefore, the answer is 'NO' for both code snippets.","The code contains a DoS_Exec_Code_Overflow vulnerability. 
The CVE-ID is CVE-2009-3605. The CWE-ID is CWE-189.
Vulnerability summary:
Multiple integer overflows in Poppler 0.10.5 and earlier allow remote attackers to cause a denial of service (application crash) or possibly execute arbitrary code via a crafted PDF file, related to (1) glib/poppler-page.cc; (2) ArthurOutputDev.cc, (3) CairoOutputDev.cc, (4) GfxState.cc, (5) JBIG2Stream.cc, (6) PSOutputDev.cc, and (7) SplashOutputDev.cc in poppler/; and (8) SplashBitmap.cc, (9) Splash.cc, and (10) SplashFTFont.cc in splash/.  NOTE: this may overlap CVE-2009-0791.
",1.0,893.0,6.0,2.4765408039093018
177779,DoS Exec Code Overflow," The given C++ code for `CairoOutputDev::drawSoftMaskedImage` function does not appear to contain any obvious buffer overflow vulnerabilities. However, it does allocate memory dynamically using `gmalloc` and manage that memory manually. This can potentially lead to memory leaks or other issues if not handled properly. It is recommended to use smart pointers or RAII (Resource Acquisition Is Initialization) techniques to manage dynamic memory allocation and deallocation.

However, the code snippet provided does not contain any code related to user input or file handling, so it is not vulnerable to the specific vulnerabilities mentioned in the initial prompt, such as buffer overflow, use-after-free, memory leaks, etc.

Therefore, the answer is 'NO'.","The code contains a DoS_Exec_Code_Overflow vulnerability. 
The CVE-ID is CVE-2009-3605. The CWE-ID is CWE-189.
Vulnerability summary:
Multiple integer overflows in Poppler 0.10.5 and earlier allow remote attackers to cause a denial of service (application crash) or possibly execute arbitrary code via a crafted PDF file, related to (1) glib/poppler-page.cc; (2) ArthurOutputDev.cc, (3) CairoOutputDev.cc, (4) GfxState.cc, (5) JBIG2Stream.cc, (6) PSOutputDev.cc, and (7) SplashOutputDev.cc in poppler/; and (8) SplashBitmap.cc, (9) Splash.cc, and (10) SplashFTFont.cc in splash/.  NOTE: this may overlap CVE-2009-0791.
",2.0,849.0,6.0,2.5955440998077393
177780,DoS Exec Code Overflow," Based on the given code, the `GfxImageColorMap::GfxImageColorMap` function does not appear to be directly vulnerable to integer overflows as the code does not involve user input or unchecked arithmetic operations. However, it does allocate memory dynamically and manage it, so there could be potential memory-related vulnerabilities such as use-after-free or memory leaks. It is recommended to perform a thorough memory management analysis to ensure proper handling of allocated memory.

However, the second code snippet provided, `long long maximumValueSum(vector<vector<int>>& board)`, is not related to the C++ code you initially provided, and it does not involve any C++ code at all. It is a separate function written in C++11 syntax. This code does not appear to be vulnerable to any specific C++ vulnerabilities as it involves only standard library functions and no user input. It calculates the maximum sum of three distinct elements from a 2D vector.

Therefore, the answer for the first code snippet is:

YES, the code is vulnerable to potential memory-related vulnerabilities such as use-after-free or memory leaks.

The answer for the second code snippet is:

NO, the code is not vulnerable to any specific C++ vulnerabilities.","The code contains a DoS_Exec_Code_Overflow vulnerability. 
The CVE-ID is CVE-2009-3605. The CWE-ID is CWE-189.
Vulnerability summary:
Multiple integer overflows in Poppler 0.10.5 and earlier allow remote attackers to cause a denial of service (application crash) or possibly execute arbitrary code via a crafted PDF file, related to (1) glib/poppler-page.cc; (2) ArthurOutputDev.cc, (3) CairoOutputDev.cc, (4) GfxState.cc, (5) JBIG2Stream.cc, (6) PSOutputDev.cc, and (7) SplashOutputDev.cc in poppler/; and (8) SplashBitmap.cc, (9) Splash.cc, and (10) SplashFTFont.cc in splash/.  NOTE: this may overlap CVE-2009-0791.
",2.0,948.0,6.0,2.412647008895874
