case_id,vuln_type,audit_report,gt,eval_score,eval_input_token_num,eval_output_token_num,eval_inference_time
177865,DoS," Based on the given code, the `PatternMatch` function is not directly vulnerable to the vulnerabilities listed in the initial instructions. However, the code snippet provided does not represent the entire program, and there could be other vulnerabilities or issues in the larger context.

The `PatternMatch` function appears to be implementing a regular expression matching algorithm, but it does not seem to have any buffer overflow or memory management vulnerabilities. It checks the string length before processing and does not write beyond the bounds of the allocated memory.

However, the function does contain a potential denial-of-service vulnerability. The recursive call to `PatternMatch` inside the `*` case does not check the remaining string length, which could potentially lead to an infinite loop if the input strings have certain patterns. This could cause the application to consume excessive resources and potentially crash or become unresponsive.

Additionally, the `z_function` and `minimumTimeToInitialState` functions are not related to the `PatternMatch` function and do not appear to have any vulnerabilities based on the provided code.

So, the answer is:

NO (However, there is a potential DoS vulnerability in the PatternMatch function due to an infinite loop condition.)","The code contains a DoS vulnerability. 
The CVE-ID is CVE-2017-13720. The CWE-ID is CWE-125.
Vulnerability summary:
In the PatternMatch function in fontfile/fontdir.c in libXfont through 1.5.2 and 2.x before 2.0.2, an attacker with access to an X connection can cause a buffer over-read during pattern matching of fonts, leading to information disclosure or a crash (denial of service). This occurs because '\0' characters are incorrectly skipped in situations involving ? characters.
",4.0,876.0,6.0,2.4369277954101562
177867,," Based on the provided code, it appears to be a separate function unrelated to the `gs_main_finit` function. The `minimumTimeToInitialState` function is not interacting with any dynamic memory or file resources, and it does not contain any suspicious function calls or pointer manipulations. Therefore, it is not vulnerable to the types of vulnerabilities mentioned in the steps you provided.

However, it is essential to note that the `minimumTimeToInitialState` function is not part of the `gs_main_finit` function, and the vulnerability analysis should focus on the `gs_main_finit` function as described in the task.","The code contains a nan vulnerability. 
The CVE-ID is CVE-2018-16541. The CWE-ID is CWE-416.
Vulnerability summary:
In Artifex Ghostscript before 9.24, attackers able to supply crafted PostScript files could use incorrect free logic in pagedevice replacement to crash the interpreter.
",1.0,715.0,6.0,3.9857611656188965
177869,," Based on the provided code, the `zsetcolor` function does not directly involve user input or string manipulation functions that are commonly associated with buffer overflow vulnerabilities. However, it does call other functions that could potentially have vulnerabilities, such as `dict_find_string`, `array_get`, and `get_space_object`. These functions should be examined in more detail to ensure they are handling inputs properly and checking bounds.

Additionally, the code does not appear to have any use-after-free, memory leak, integer overflow/underflow, null pointer dereference, or sensitive data exposure vulnerabilities based on the given code snippet.

However, it is important to note that the absence of vulnerabilities in the provided code does not guarantee that the entire program is free of vulnerabilities. It is always recommended to perform a thorough vulnerability assessment on the entire codebase to ensure the security of the application.

Therefore, the answer is: NO. However, it is important to note that the absence of vulnerabilities in the provided code does not guarantee that the entire program is free of vulnerabilities. It is always recommended to perform a thorough vulnerability assessment on the entire codebase to ensure the security of the application.","The code contains a nan vulnerability. 
The CVE-ID is CVE-2018-16513. The CWE-ID is CWE-704.
Vulnerability summary:
In Artifex Ghostscript before 9.24, attackers able to supply crafted PostScript files could use a type confusion in the setcolor function to crash the interpreter or possibly have unspecified other impact.
",1.0,825.0,6.0,2.7762057781219482
177870,," The second code snippet provided is not related to the first vulnerability discussed. It is a separate function that calculates the minimum time to reach the initial state of a string based on a given pattern length. This code does not contain any apparent security vulnerabilities.

Therefore, the answer is 'NO'.","The code contains a nan vulnerability. 
The CVE-ID is CVE-2018-16511. The CWE-ID is CWE-704.
Vulnerability summary:
An issue was discovered in Artifex Ghostscript before 9.24. A type confusion in ""ztype"" could be used by remote attackers able to supply crafted PostScript to crash the interpreter or possibly have unspecified other impact.
",1.0,658.0,6.0,2.3981001377105713
177874,Exec Code Overflow," Based on the provided code, it does not appear to be vulnerable to a buffer overflow or any other type of overflow vulnerability. The code is processing fixed-size arrays (input and output are both 16 bytes long) and there are no dynamic memory allocations or string manipulation functions (like strcpy or sprintf) that could lead to buffer overflows.

However, it is essential to note that the code snippet provided is incomplete and does not include the function definitions for AES_RROUND, AES_FROUND, GET_ULONG_LE, PUT_ULONG_LE, padlock_supports, padlock_xcryptecb, RSb, and FSb. These functions could potentially contain vulnerabilities, so it is crucial to review their implementation as well.

Additionally, the code snippet does not include any error handling or input validation, which could lead to other vulnerabilities if not addressed properly.

In summary, based on the provided code snippet, there is no evidence of a buffer overflow vulnerability. However, it is essential to review the implementation of the missing functions and ensure proper error handling and input validation are in place.","The code contains a Exec_Code_Overflow vulnerability. 
The CVE-ID is CVE-2018-15911. The CWE-ID is CWE-119.
Vulnerability summary:
In Artifex Ghostscript 9.23 before 2018-08-24, attackers able to supply crafted PostScript could use uninitialized memory access in the aesdecode operator to crash the interpreter or potentially execute code.
",1.0,818.0,6.0,3.521423101425171
177875,Exec Code Overflow," Based on the provided code, the `s_aes_process` function does not appear to be directly vulnerable to the Exec_Code_Overflow vulnerability described in the given context. The function is handling AES decryption and processing of data streams, but it does not involve the execution of untrusted user input or the manipulation of function pointers.

However, it is essential to note that the code snippet provided does not represent the entire program, and other parts of the codebase might contain vulnerabilities. It is always recommended to perform a thorough vulnerability assessment on the entire codebase to ensure its security.

Therefore, the answer is 'NO', and the `s_aes_process` function is not vulnerable to the Exec_Code_Overflow vulnerability as described in the given context.","The code contains a Exec_Code_Overflow vulnerability. 
The CVE-ID is CVE-2018-15911. The CWE-ID is CWE-119.
Vulnerability summary:
In Artifex Ghostscript 9.23 before 2018-08-24, attackers able to supply crafted PostScript could use uninitialized memory access in the aesdecode operator to crash the interpreter or potentially execute code.
",1.0,752.0,6.0,2.4917399883270264
177879,DoS Exec Code Overflow," The given fdctrl\_read\_data function does not appear to be directly vulnerable to the mentioned vulnerabilities (DoS, Exec, Code, Overflow) based on the provided code snippet. However, it does call other functions (e.g., fdctrl\_seek\_to\_next\_sect, blk\_read) that could potentially contain vulnerabilities. It is essential to review those functions as well.

The minimumTimeToInitialState function is not related to the given vulnerabilities and does not contain any apparent vulnerabilities in the provided code snippet.","The code contains a DoS_Exec_Code_Overflow vulnerability. 
The CVE-ID is CVE-2015-3456. The CWE-ID is CWE-119.
Vulnerability summary:
The Floppy Disk Controller (FDC) in QEMU, as used in Xen 4.5.x and earlier and KVM, allows local guest users to cause a denial of service (out-of-bounds write and guest crash) or possibly execute arbitrary code via the (1) FD_CMD_READ_ID, (2) FD_CMD_DRIVE_SPECIFICATION_COMMAND, or other unspecified commands, aka VENOM.
",1.0,755.0,6.0,2.21256160736084
177880,Bypass," Based on the provided code, the `check_file_permissions_reduced` function does not directly involve any string or memory functions that could lead to buffer overflow vulnerabilities. However, it does contain logic for handling file permissions and file paths, which could potentially be bypassed if the input is not properly validated. This could lead to unintended file access or other security vulnerabilities.

Therefore, the answer is: 'YES'. The vulnerability is related to improper input validation (CWE-20). The code does not check the user input (fname) for malicious or unexpected characters, which could allow an attacker to bypass the file permission checks. This could potentially lead to arbitrary file system access, as demonstrated in the CVE-2018-15908 vulnerability mentioned in the question.","The code contains a Bypass vulnerability. 
The CVE-ID is CVE-2018-15908. The CWE-ID is nan.
Vulnerability summary:
In Artifex Ghostscript 9.23 before 2018-08-23, attackers are able to supply malicious PostScript files to bypass .tempfile restrictions and write files.
",4.0,742.0,6.0,3.1173295974731445
177881,DoS, The second code snippet provided does not appear to contain any vulnerabilities related to the given list. It is a separate function that calculates the minimum time to bring a string to an initial state based on a given keyword length. The code does not involve any string manipulation functions or memory management that could lead to vulnerabilities.,"The code contains a DoS vulnerability. 
The CVE-ID is CVE-2019-12382. The CWE-ID is CWE-476.
Vulnerability summary:
An issue was discovered in drm_load_edid_firmware in drivers/gpu/drm/drm_edid_load.c in the Linux kernel through 5.1.5. There is an unchecked kstrdup of fwstr, which might allow an attacker to cause a denial of service (NULL pointer dereference and system crash).
",1.0,681.0,6.0,1.91102933883667
177883,," Based on the provided code, there are no obvious buffer overflow, use-after-free, memory leak, integer overflow/underflow, null pointer dereference, or race condition vulnerabilities. However, there are some potential issues:

1. Improper Input Validation: The code does not validate the input `tags` when calling `string_split()`. This could potentially lead to buffer overflows or other vulnerabilities if the input is malicious.

2. Insecure Resource Management: The code does not check the return value of `malloc()` and `strdup()`. If these functions fail, the code continues execution, which could lead to memory leaks or other issues.

3. Cryptographic Issues: The code does not appear to be related to cryptography, so there are no cryptographic issues present in the code.

4. Sensitive Data Exposure: The code does not handle sensitive data, so there are no sensitive data exposure vulnerabilities present in the code.

Based on the given code, the answer is: NO. However, there are some potential issues that should be addressed to improve the security of the code.","The code contains a nan vulnerability. 
The CVE-ID is CVE-2011-1428. The CWE-ID is CWE-20.
Vulnerability summary:
Wee Enhanced Environment for Chat (aka WeeChat) 0.3.4 and earlier does not properly verify that the server hostname matches the domain name of the subject of an X.509 certificate, which allows man-in-the-middle attackers to spoof an SSL chat server via an arbitrary certificate, related to incorrect use of the GnuTLS API.
",2.0,841.0,6.0,2.3730270862579346
177887,DoS Overflow," The given C++ code for the function `gs_heap_alloc_bytes` is not directly related to the `minimumTimeToInitialState` function provided. Therefore, I cannot evaluate the vulnerability of the `minimumTimeToInitialState` function based on the given code.

However, I can evaluate the `gs_heap_alloc_bytes` function based on the provided code.

Answer: YES

Reason: The `gs_heap_alloc_bytes` function is vulnerable to a buffer overflow attack. The function does not properly check the size argument `size` before allocating memory using `malloc(added)`. If an attacker provides a large enough value for `size`, they can cause an integer overflow, resulting in an allocation size larger than the available memory. This can lead to a denial-of-service attack by exhausting the available memory or causing the application to crash.","The code contains a DoS_Overflow vulnerability. 
The CVE-ID is CVE-2015-3228. The CWE-ID is CWE-189.
Vulnerability summary:
Integer overflow in the gs_heap_alloc_bytes function in base/gsmalloc.c in Ghostscript 9.15 and earlier allows remote attackers to cause a denial of service (crash) via a crafted Postscript (ps) file, as demonstrated by using the ps2pdf command, which triggers an out-of-bounds read or write.
",3.0,791.0,6.0,1.8340606689453125
177891,DoS," The given code for the function `rsa_pss_decode` is not directly related to the `int minimumTimeToInitialState` function. Therefore, I cannot determine if the `int minimumTimeToInitialState` function is vulnerable based on the provided code.

However, I can evaluate the `rsa_pss_decode` function for vulnerabilities as requested.

The `rsa_pss_decode` function appears to be decoding an RSA PSS parameter from an ASN.1 structure. It checks if the mask generation function parameter is present and decodes it if it is.

The vulnerability in this function is related to the NULL pointer dereference that can occur when the mask generation function parameter is missing. In this case, the `pmaskHash` pointer is initialized to NULL, and when the mask generation function parameter is not present, the code does not check if `pmaskHash` is null before dereferencing it. This can lead to a NULL pointer dereference and application crash.

Therefore, the answer is 'YES' and the vulnerability is a NULL pointer dereference.","The code contains a DoS vulnerability. 
The CVE-ID is CVE-2015-3194. The CWE-ID is nan.
Vulnerability summary:
crypto/rsa/rsa_ameth.c in OpenSSL 1.0.1 before 1.0.1q and 1.0.2 before 1.0.2e allows remote attackers to cause a denial of service (NULL pointer dereference and application crash) via an RSA PSS ASN.1 signature that lacks a mask generation function parameter.
",3.0,840.0,6.0,3.3726484775543213
177893,+Info," Based on the given code, the `test_mod_exp` function is not directly vulnerable to the vulnerability described in the provided vulnerability summary. However, it does call the `BN_mod_exp` and `BN_mod_exp_mont_consttime` functions, which were found to be vulnerable in the OpenSSL library. Therefore, the code using this function may still be at risk if the vulnerable OpenSSL library version is being used.

To mitigate this risk, make sure to use an updated OpenSSL library version that addresses the CVE-2015-3193 vulnerability. Additionally, consider using alternative libraries or functions for modular exponentiation to avoid relying on the potentially vulnerable OpenSSL implementation.

So, the answer is:

YES (with the condition that the vulnerable OpenSSL library version is being used)","The code contains a +Info vulnerability. 
The CVE-ID is CVE-2015-3193. The CWE-ID is CWE-200.
Vulnerability summary:
The Montgomery squaring implementation in crypto/bn/asm/x86_64-mont5.pl in OpenSSL 1.0.2 before 1.0.2e on the x86_64 platform, as used by the BN_mod_exp function, mishandles carry propagation and produces incorrect output, which makes it easier for remote attackers to obtain sensitive private-key information via an attack against use of a (1) Diffie-Hellman (DH) or (2) Diffie-Hellman Ephemeral (DHE) ciphersuite.
",3.0,825.0,6.0,2.727696657180786
177896,," The given code for the `become_daemon` function is not directly related to the vulnerability described in the provided CVE-ID and CWE-ID. The vulnerability mentioned in the CVE-ID is related to the QEMU guest agent in daemon mode, which has weak permissions for certain files, allowing local users to read and write to these files.

The `become_daemon` function in the provided code is a function for daemonizing a process, which is a common technique to run background services. It does not contain any obvious vulnerabilities related to the given CVE-ID.

Therefore, the answer is 'NO'.","The code contains a nan vulnerability. 
The CVE-ID is CVE-2013-2007. The CWE-ID is CWE-264.
Vulnerability summary:
The qemu guest agent in Qemu 1.4.1 and earlier, as used by Xen, when started in daemon mode, uses weak permissions for certain files, which allows local users to read and write to these files.
",1.0,724.0,6.0,3.7348873615264893
177897,+Info," The given C++ code for the function `minimumTimeToInitialState` is not related to the vulnerability described in the provided context. It is a separate function that calculates the minimum time to bring a string to its initial state based on a given pattern and length. This code does not involve any file I/O or XML parsing, so it is not vulnerable to the SOAP parser vulnerability.

Therefore, the answer is 'NO'.","The code contains a +Info vulnerability. 
The CVE-ID is CVE-2013-1824. The CWE-ID is CWE-200.
Vulnerability summary:
The SOAP parser in PHP before 5.3.22 and 5.4.x before 5.4.12 allows remote attackers to read arbitrary files via a SOAP WSDL file containing an XML external entity declaration in conjunction with an entity reference, related to an XML External Entity (XXE) issue in the soap_xmlParseFile and soap_xmlParseMemory functions.
",1.0,715.0,6.0,2.611494779586792
177898,+Info," The given C++ code for the function `soap_xmlParseMemory` is not directly related to the vulnerability described in the provided vulnerability summary. The vulnerability in the summary is related to a SOAP parser in PHP, not the given C++ code.

Therefore, the answer is 'NO'. The given C++ code does not appear to be vulnerable based on the information provided.","The code contains a +Info vulnerability. 
The CVE-ID is CVE-2013-1824. The CWE-ID is CWE-200.
Vulnerability summary:
The SOAP parser in PHP before 5.3.22 and 5.4.x before 5.4.12 allows remote attackers to read arbitrary files via a SOAP WSDL file containing an XML external entity declaration in conjunction with an entity reference, related to an XML External Entity (XXE) issue in the soap_xmlParseFile and soap_xmlParseMemory functions.
",1.0,703.0,6.0,3.398239850997925
177899,+Info," The given C++ code for the function `minimumTimeToInitialState` is not directly related to the vulnerability audit as it does not involve any input from external sources or file handling, and it does not use any libraries or functions that are known to have vulnerabilities. Therefore, it is not vulnerable.","The code contains a +Info vulnerability. 
The CVE-ID is CVE-2013-1824. The CWE-ID is CWE-200.
Vulnerability summary:
The SOAP parser in PHP before 5.3.22 and 5.4.x before 5.4.12 allows remote attackers to read arbitrary files via a SOAP WSDL file containing an XML external entity declaration in conjunction with an entity reference, related to an XML External Entity (XXE) issue in the soap_xmlParseFile and soap_xmlParseMemory functions.
",1.0,689.0,6.0,2.101458787918091
177900,+Info," The given C++ code for the function `soap_xmlParseMemory` is not directly related to the vulnerability described in the provided vulnerability summary. The vulnerability mentioned in the summary is related to a SOAP parser in PHP, not in the given C++ code.

Therefore, the answer is 'NO'. The given C++ code is not vulnerable to the XML External Entity (XXE) issue mentioned in the vulnerability summary.","The code contains a +Info vulnerability. 
The CVE-ID is CVE-2013-1824. The CWE-ID is CWE-200.
Vulnerability summary:
The SOAP parser in PHP before 5.3.22 and 5.4.x before 5.4.12 allows remote attackers to read arbitrary files via a SOAP WSDL file containing an XML external entity declaration in conjunction with an entity reference, related to an XML External Entity (XXE) issue in the soap_xmlParseFile and soap_xmlParseMemory functions.
",1.0,712.0,6.0,2.541712522506714
177901,Overflow," The second code snippet provided, `minimumTimeToInitialState(string word, int k)` function, is not directly related to the `_asn1_ltostr` function and does not contain any apparent buffer overflow vulnerabilities. It is safe to use.","The code contains a Overflow vulnerability. 
The CVE-ID is CVE-2015-2806. The CWE-ID is CWE-119.
Vulnerability summary:
Stack-based buffer overflow in asn1_der_decoding in libtasn1 before 4.4 allows remote attackers to have unspecified impact via unknown vectors.
",1.0,634.0,6.0,2.7303388118743896
177904,DoS," The given Splash::blitMask function does not appear to be vulnerable based on the provided code alone. However, it is always a good practice to ensure proper bounds checking and null pointer checks in the code to prevent potential vulnerabilities. In the given code, the pointers p are incremented properly after each iteration, and the pipe.shape is assigned from the valid memory location pointed by p. Additionally, the if condition in the inner for loop checks if the pixel value is non-zero and the clip test passes before processing the pixel. These checks help prevent potential buffer overflow, use-after-free, and null pointer dereference vulnerabilities.

However, it is essential to note that the code might still be vulnerable if other parts of the program have issues with memory management, input validation, or synchronization. Therefore, it is crucial to perform a thorough vulnerability assessment on the entire codebase to ensure its security.

The z_function and minimumTimeToInitialState functions provided in the second code snippet are not related to the Splash::blitMask function and do not appear to have any security vulnerabilities based on the given code.","The code contains a DoS vulnerability. 
The CVE-ID is CVE-2013-1789. The CWE-ID is nan.
Vulnerability summary:
splash/Splash.cc in poppler before 0.22.1 allows context-dependent attackers to cause a denial of service (NULL pointer dereference and crash) via vectors related to the (1) Splash::arbitraryTransformMask, (2) Splash::blitMask, and (3) Splash::scaleMaskYuXu functions.
",1.0,840.0,6.0,4.045855760574341
177905,DoS," Based on the provided code, there are no obvious vulnerabilities related to the given steps in the context of this specific function. However, it's important to note that this function may still have other vulnerabilities or issues unrelated to the steps mentioned. For instance, there are no checks for null pointers or out-of-bounds array accesses in this function. Additionally, the function'scaleMask' called at the end of the function might have its own vulnerabilities. Therefore, it's essential to thoroughly review the entire codebase and all related functions to ensure the application is secure.

In summary, the given code snippet does not appear to have any vulnerabilities related to the steps mentioned in the question. However, it's crucial to remember that this function might still have other vulnerabilities or issues. Always perform a comprehensive security analysis of the entire codebase to ensure the application is secure.","The code contains a DoS vulnerability. 
The CVE-ID is CVE-2013-1789. The CWE-ID is nan.
Vulnerability summary:
splash/Splash.cc in poppler before 0.22.1 allows context-dependent attackers to cause a denial of service (NULL pointer dereference and crash) via vectors related to the (1) Splash::arbitraryTransformMask, (2) Splash::blitMask, and (3) Splash::scaleMaskYuXu functions.
",1.0,789.0,6.0,1.945608139038086
177906,DoS Exec Code Overflow," Based on the provided code, the `SplashPath *Splash::makeDashedPath(SplashPath *path)` function does not appear to be directly vulnerable to the mentioned vulnerabilities (DoS, Exec, Code, Overflow). However, it does involve memory management and pointer manipulation, so it's essential to ensure that the rest of the codebase is secure.

The `minimumTimeToInitialState(string word, int k)` function is not related to the `SplashPath *Splash::makeDashedPath(SplashPath *path)` function, so it's not directly relevant to the vulnerability assessment of the given code.

However, it's important to note that the code snippet provided might not be the complete or accurate representation of the actual codebase. It's always recommended to perform a thorough vulnerability assessment on the entire codebase to ensure its security.","The code contains a DoS_Exec_Code_Overflow vulnerability. 
The CVE-ID is CVE-2013-1788. The CWE-ID is CWE-119.
Vulnerability summary:
poppler before 0.22.1 allows context-dependent attackers to cause a denial of service (crash) and possibly execute arbitrary code via vectors that trigger an ""invalid memory access"" in (1) splash/Splash.cc, (2) poppler/Function.cc, and (3) poppler/Stream.cc.
",1.0,791.0,6.0,1.920192003250122
