case_id,vuln_type,audit_report,gt,eval_score,eval_input_token_num,eval_output_token_num,eval_inference_time
177736,Bypass," Based on the provided code, the samldb_check_user_account_control_acl function is not directly related to the given vulnerability description. The code snippet provided does not contain any apparent buffer overflow, use-after-free, memory leak, integer overflow/underflow, null pointer dereference, improper input validation, race condition, insecure function usage, insecure resource management, or improper error handling vulnerabilities.

Therefore, the answer is 'NO'.","The code contains a Bypass vulnerability. 
The CVE-ID is CVE-2015-8467. The CWE-ID is CWE-264.
Vulnerability summary:
The samldb_check_user_account_control_acl function in dsdb/samdb/ldb_modules/samldb.c in Samba 4.x before 4.1.22, 4.2.x before 4.2.7, and 4.3.x before 4.3.3 does not properly check for administrative privileges during creation of machine accounts, which allows remote authenticated users to bypass intended access restrictions by leveraging the existence of a domain with both a Samba DC and a Windows DC, a similar issue to CVE-2015-2535.
",1.0,753.0,6.0,2.3045401573181152
177740,DoS Exec Code Overflow Mem. Corr.," The given C++ code for the function `asn1_time_to_time_t` is not directly related to the code you mentioned earlier that was vulnerable to a DoS, Exec, Code, Overflow, Mem., Corr. vulnerability. The provided code appears to be parsing a time string and converting it to a Unix timestamp.

However, there are still potential vulnerabilities in the given code. For instance, there is no bounds checking on the `timestr->length` variable, which could lead to a buffer overflow if the input string is maliciously crafted. Additionally, the memory allocated for `strbuf` is not checked against the size of the input string, which could also result in a buffer overflow.

Therefore, the answer is 'YES', and the vulnerability is due to the lack of proper bounds checking on the input strings. This could potentially lead to a buffer overflow, which could be exploited for code injection, denial of service, or other malicious purposes.","The code contains a DoS_Exec_Code_Overflow_Mem._Corr. vulnerability. 
The CVE-ID is CVE-2013-6420. The CWE-ID is CWE-119.
Vulnerability summary:
The asn1_time_to_time_t function in ext/openssl/openssl.c in PHP before 5.3.28, 5.4.x before 5.4.23, and 5.5.x before 5.5.7 does not properly parse (1) notBefore and (2) notAfter timestamps in X.509 certificates, which allows remote attackers to execute arbitrary code or cause a denial of service (memory corruption) via a crafted certificate that is not properly handled by the openssl_x509_parse function.
",2.0,872.0,6.0,1.202200174331665
177741,DoS Overflow," The given C++ code for the function `minimumTimeToInitialState` is not related to the vulnerability described in the provided context. It is a separate function that calculates the minimum time to bring a string back to its initial state using the Z-algorithm. This code does not involve any memory handling or string manipulation similar to the vulnerable `gnutls_session_get_data` function. Therefore, it is not vulnerable to the DoS overflow vulnerability.

Answer: NO.","The code contains a DoS_Overflow vulnerability. 
The CVE-ID is CVE-2011-4128. The CWE-ID is CWE-119.
Vulnerability summary:
Buffer overflow in the gnutls_session_get_data function in lib/gnutls_session.c in GnuTLS 2.12.x before 2.12.14 and 3.x before 3.0.7, when used on a client that performs nonstandard session resumption, allows remote TLS servers to cause a denial of service (application crash) via a large SessionTicket.
",1.0,731.0,6.0,3.5699615478515625
177742,DoS Overflow," The second code snippet provided is not directly related to the first vulnerable code snippet. It is a separate function that calculates the minimum time to restore a string to its initial state using the Z-algorithm. This function does not involve any memory handling or pointer manipulation, so it is not vulnerable to the buffer overflow or other memory-related vulnerabilities.

Therefore, the answer is 'NO'.","The code contains a DoS_Overflow vulnerability. 
The CVE-ID is CVE-2011-4128. The CWE-ID is CWE-119.
Vulnerability summary:
Buffer overflow in the gnutls_session_get_data function in lib/gnutls_session.c in GnuTLS 2.12.x before 2.12.14 and 3.x before 3.0.7, when used on a client that performs nonstandard session resumption, allows remote TLS servers to cause a denial of service (application crash) via a large SessionTicket.
",1.0,713.0,6.0,2.477531671524048
177743,DoS," The given C++ code for `phar_make_dirstream` function is not directly related to the `minimumTimeToInitialState` function. Therefore, I cannot evaluate the vulnerability of the `phar_make_dirstream` function based on the provided code.

However, I can tell you that the `minimumTimeToInitialState` function does not contain any apparent security vulnerabilities. It is just a function that calculates the minimum number of steps required to return a given string to its initial state (an empty string) when applying a given step size (k). It uses the Z-function algorithm to calculate the length of the longest prefix of the string that is also a suffix. This function is not vulnerable to any common security issues like buffer overflow, use-after-free, memory leaks, or integer overflow/underflow.","The code contains a DoS vulnerability. 
The CVE-ID is CVE-2015-7804. The CWE-ID is CWE-189.
Vulnerability summary:
Off-by-one error in the phar_parse_zipfile function in ext/phar/zip.c in PHP before 5.5.30 and 5.6.x before 5.6.14 allows remote attackers to cause a denial of service (uninitialized pointer dereference and application crash) by including the / filename in a .zip PHAR archive.
",1.0,792.0,6.0,2.3191020488739014
177747,DoS," The given code for the function `bgp_attr_unknown` is not directly related to the `minimumTimeToInitialState` function. Therefore, I cannot evaluate the vulnerability of the `bgp_attr_unknown` function based on the provided code for `minimumTimeToInitialState`.

However, I can evaluate the `bgp_attr_unknown` function based on the code you provided earlier. The vulnerability in the `bgp_attr_unknown` function is due to the lack of proper initialization of the `total` variable. This can lead to a denial-of-service (DoS) vulnerability as an attacker can craft a BGP update with a large length value, causing the `total` variable to exceed its intended bounds and causing the program to crash.

Therefore, the answer is:

YES, the `bgp_attr_unknown` function is vulnerable to a denial-of-service attack due to the lack of proper initialization of the `total` variable.","The code contains a DoS vulnerability. 
The CVE-ID is CVE-2013-6051. The CWE-ID is nan.
Vulnerability summary:
The bgp_attr_unknown function in bgp_attr.c in Quagga 0.99.21 does not properly initialize the total variable, which allows remote attackers to cause a denial of service (bgpd crash) via a crafted BGP update.
",3.0,789.0,6.0,2.526697874069214
177750,DoS Exec Code," The given C++ code for `begin_softmask` function does not directly contain any vulnerabilities related to the provided list. However, it does contain some potential issues:

1. It ignores errors when calling `fz_begin_mask` and `pdf_run_xobject`. Ignoring errors can lead to unexpected behavior and potential vulnerabilities.
2. It uses `fz_rethrow_if(ctx, FZ_ERROR_TRYLATER)` in the error handling block, but it is not clear if this is the intended behavior or not. If this is not the intended behavior, it could lead to unhandled errors and potential vulnerabilities.

However, these issues do not directly relate to the security vulnerabilities mentioned in the provided list. Therefore, the answer is 'NO'.","The code contains a DoS_Exec_Code vulnerability. 
The CVE-ID is CVE-2018-1000039. The CWE-ID is CWE-416.
Vulnerability summary:
In MuPDF 1.12.0 and earlier, multiple heap use after free bugs in the PDF parser could allow an attacker to execute arbitrary code, read memory, or cause a denial of service via a crafted file.
",2.0,751.0,6.0,4.476695537567139
177766,DoS," The given C++ code for the function `ldap_push_filter` does not appear to contain any obvious buffer overflow or use-after-free vulnerabilities based on the provided code snippet. However, it does call other functions (e.g., `asn1_push_tag`, `asn1_write_OctetString`, etc.) that could potentially have these vulnerabilities. Therefore, it is essential to review those functions' implementations as well.

Additionally, the code snippet provided does not contain any code related to the `int minimumTimeToInitialState(string word, int k)` function. Since the vulnerability assessment is focused on the `ldap_push_filter` function, there is no need to evaluate the `minimumTimeToInitialState` function in this context.

Therefore, the answer is 'NO' for the given `ldap_push_filter` function. However, it is crucial to remember that a thorough vulnerability assessment requires examining the entire codebase and all related functions.","The code contains a DoS vulnerability. 
The CVE-ID is CVE-2015-7540. The CWE-ID is CWE-399.
Vulnerability summary:
The LDAP server in the AD domain controller in Samba 4.x before 4.1.22 does not check return values to ensure successful ASN.1 memory allocation, which allows remote attackers to cause a denial of service (memory consumption and daemon crash) via crafted packets.
",1.0,796.0,6.0,3.0179450511932373
177767,DoS," The given code for the function `decode_openldap_dereference` is not directly related to the vulnerability described in the provided context. The vulnerability described in the context is related to the LDAP server in Samba 4.x before 4.1.22, which is not present in the given code.

Therefore, the answer is 'NO'. The given code is not vulnerable to the described DoS vulnerability.","The code contains a DoS vulnerability. 
The CVE-ID is CVE-2015-7540. The CWE-ID is CWE-399.
Vulnerability summary:
The LDAP server in the AD domain controller in Samba 4.x before 4.1.22 does not check return values to ensure successful ASN.1 memory allocation, which allows remote attackers to cause a denial of service (memory consumption and daemon crash) via crafted packets.
",1.0,691.0,6.0,2.8044016361236572
177768,DoS," Based on the provided code, the `sparse_dump_region` function does not appear to be directly vulnerable to the vulnerabilities listed in the steps you provided. However, it does call other functions (such as `lseek_or_error`, `safe_read`, and `blocking_write`) that could potentially contain vulnerabilities. Therefore, it is important to thoroughly review those functions as well.

Additionally, the code you provided for the `minimumTimeToInitialState` function is not related to the `sparse_dump_region` function, so it does not need to be evaluated for vulnerabilities in this context.","The code contains a DoS vulnerability. 
The CVE-ID is CVE-2018-20482. The CWE-ID is CWE-835.
Vulnerability summary:
GNU Tar through 1.30, when --sparse is used, mishandles file shrinkage during read access, which allows local users to cause a denial of service (infinite read loop in sparse_dump_region in sparse.c) by modifying a file that is supposed to be archived by a different user's process (e.g., a system backup running as root).
",1.0,746.0,6.0,3.841360092163086
177770,Bypass," Based on the provided code, the `read_ndx_and_attrs` function does not appear to be vulnerable to the Bypass vulnerability described in the given vulnerability summary. The function does not check for filenames in a data structure or apply any sanitize_paths mechanism to pathnames found in ""xname follows"" strings. Therefore, my answer is 'NO'.","The code contains a Bypass vulnerability. 
The CVE-ID is CVE-2017-17434. The CWE-ID is nan.
Vulnerability summary:
The daemon in rsync 3.1.2, and 3.1.3-development before 2017-12-03, does not check for fnamecmp filenames in the daemon_filter_list data structure (in the recv_files function in receiver.c) and also does not apply the sanitize_paths protection mechanism to pathnames found in ""xname follows"" strings (in the read_ndx_and_attrs function in rsync.c), which allows remote attackers to bypass intended access restrictions.
",1.0,721.0,6.0,1.9555573463439941
177771,, The second code snippet provided is not related to the DNS parsing function and does not appear to be vulnerable based on the given code alone. It is a separate function implementing the Z-algorithm for finding the longest prefix of a string that is also a suffix. This function does not involve any memory handling or pointer arithmetic that could lead to buffer overflows or other vulnerabilities.,"The code contains a nan vulnerability. 
The CVE-ID is CVE-2018-20103. The CWE-ID is CWE-835.
Vulnerability summary:
An issue was discovered in dns.c in HAProxy through 1.8.14. In the case of a compressed pointer, a crafted packet can trigger infinite recursion by making the pointer point to itself, or create a long chain of valid pointers resulting in stack exhaustion.
",1.0,688.0,6.0,1.384728193283081
177773,DoS Exec Code Overflow Mem. Corr.," The given C++ code for `create_surface_from_thumbnail_data` function is not directly related to the `minimumTimeToInitialState` function. Therefore, I cannot evaluate the vulnerability of the second code snippet based on the first one.

However, I can evaluate the `minimumTimeToInitialState` function. Based on the provided code, it does not seem to have any obvious vulnerabilities. The function uses a precomputed z-function to find the minimum time to reach an initial state for a given string and a given k value. The z-function is computed using a template function, which is not vulnerable on its own.

Therefore, my answer is 'NO'. The `minimumTimeToInitialState` function does not have any obvious vulnerabilities.","The code contains a DoS_Exec_Code_Overflow_Mem._Corr. vulnerability. 
The CVE-ID is CVE-2009-3607. The CWE-ID is CWE-189.
Vulnerability summary:
Integer overflow in the create_surface_from_thumbnail_data function in glib/poppler-page.cc in Poppler 0.x allows remote attackers to cause a denial of service (memory corruption) or possibly execute arbitrary code via a crafted PDF document that triggers a heap-based buffer overflow.  NOTE: some of these details are obtained from third party information.
",1.0,780.0,6.0,2.4888010025024414
177774,DoS Exec Code Overflow," Based on the given code, the `SplashOutputDev::drawImage` function is not directly vulnerable to the mentioned DoS, Exec, Code, Overflow vulnerability (CVE-2009-3605, CWE-189). However, it does contain integer operations and memory management, so there could be potential for other vulnerabilities, such as integer overflows or memory leaks. It is essential to thoroughly review the entire codebase and all related functions to ensure the absence of any vulnerabilities.

The `minimumTimeToInitialState` function provided is not related to the `SplashOutputDev::drawImage` function and does not contain any C++ code, so it cannot be evaluated for vulnerabilities in this context.","The code contains a DoS_Exec_Code_Overflow vulnerability. 
The CVE-ID is CVE-2009-3605. The CWE-ID is CWE-189.
Vulnerability summary:
Multiple integer overflows in Poppler 0.10.5 and earlier allow remote attackers to cause a denial of service (application crash) or possibly execute arbitrary code via a crafted PDF file, related to (1) glib/poppler-page.cc; (2) ArthurOutputDev.cc, (3) CairoOutputDev.cc, (4) GfxState.cc, (5) JBIG2Stream.cc, (6) PSOutputDev.cc, and (7) SplashOutputDev.cc in poppler/; and (8) SplashBitmap.cc, (9) Splash.cc, and (10) SplashFTFont.cc in splash/.  NOTE: this may overlap CVE-2009-0791.
",2.0,845.0,6.0,5.063778877258301
177775,DoS Exec Code Overflow," Based on the provided code, there are no obvious buffer overflow, use-after-free, memory leak, or null pointer dereference vulnerabilities. However, there are some potential integer overflow vulnerabilities. For instance, in the function `minimumTimeToInitialState`, the division operation `ceil_divide(size(word), k)` may result in an integer overflow if the size of the word is smaller than the given constant `k`. This could potentially lead to incorrect results or crashes.

Additionally, in the `ArthurOutputDev::drawImage` function, there are several integer operations that could potentially result in integer overflows, such as the calculations involving `width`, `height`, and the indices `x`, `y`, and `i`. However, it is not clear from the provided code whether these integer operations are being performed with user-supplied data or not. If the data is not user-supplied, then these integer overflows may not be exploitable vulnerabilities.

Therefore, the answer is:

YES, the code contains potential integer overflow vulnerabilities. However, the impact of these vulnerabilities depends on whether the integer operations are being performed with user-supplied data or not. If the data is not user-supplied, then these vulnerabilities may not be exploitable.","The code contains a DoS_Exec_Code_Overflow vulnerability. 
The CVE-ID is CVE-2009-3605. The CWE-ID is CWE-189.
Vulnerability summary:
Multiple integer overflows in Poppler 0.10.5 and earlier allow remote attackers to cause a denial of service (application crash) or possibly execute arbitrary code via a crafted PDF file, related to (1) glib/poppler-page.cc; (2) ArthurOutputDev.cc, (3) CairoOutputDev.cc, (4) GfxState.cc, (5) JBIG2Stream.cc, (6) PSOutputDev.cc, and (7) SplashOutputDev.cc in poppler/; and (8) SplashBitmap.cc, (9) Splash.cc, and (10) SplashFTFont.cc in splash/.  NOTE: this may overlap CVE-2009-0791.
",4.0,957.0,6.0,2.930288791656494
177777,DoS Exec Code Overflow," Based on the given code, the function `CairoOutputDev::drawImage` is not vulnerable to the DoS, Exec, Code, Overflow vulnerability described in the provided CVE and CWE IDs. The code does not contain any integer overflows that could lead to a denial of service or arbitrary code execution.

However, it is essential to note that the code snippet provided is incomplete and may not represent the entire vulnerability. The code snippet only shows a part of the function, and it is impossible to determine if there are other vulnerabilities in the rest of the code.

Therefore, the answer is 'NO', but it is crucial to keep in mind that the code snippet provided may not be representative of the entire vulnerability.","The code contains a DoS_Exec_Code_Overflow vulnerability. 
The CVE-ID is CVE-2009-3605. The CWE-ID is CWE-189.
Vulnerability summary:
Multiple integer overflows in Poppler 0.10.5 and earlier allow remote attackers to cause a denial of service (application crash) or possibly execute arbitrary code via a crafted PDF file, related to (1) glib/poppler-page.cc; (2) ArthurOutputDev.cc, (3) CairoOutputDev.cc, (4) GfxState.cc, (5) JBIG2Stream.cc, (6) PSOutputDev.cc, and (7) SplashOutputDev.cc in poppler/; and (8) SplashBitmap.cc, (9) Splash.cc, and (10) SplashFTFont.cc in splash/.  NOTE: this may overlap CVE-2009-0791.
",1.0,848.0,6.0,3.033219337463379
177778,DoS Exec Code Overflow," Based on the given code, the function `CairoOutputDev::drawMaskedImage` does not appear to be directly vulnerable to integer overflows or any other vulnerabilities mentioned in the provided list. However, it does allocate and manipulate memory dynamically, so it's essential to ensure proper bounds checking and memory management to prevent potential buffer overflows or memory leaks.

The code snippet provided does not show any obvious signs of these vulnerabilities. However, it's important to note that the entire context of the codebase and its interactions with other components should be considered when evaluating its security.

Therefore, the answer is 'NO', but with the caveat that proper memory management and bounds checking should be ensured throughout the codebase.","The code contains a DoS_Exec_Code_Overflow vulnerability. 
The CVE-ID is CVE-2009-3605. The CWE-ID is CWE-189.
Vulnerability summary:
Multiple integer overflows in Poppler 0.10.5 and earlier allow remote attackers to cause a denial of service (application crash) or possibly execute arbitrary code via a crafted PDF file, related to (1) glib/poppler-page.cc; (2) ArthurOutputDev.cc, (3) CairoOutputDev.cc, (4) GfxState.cc, (5) JBIG2Stream.cc, (6) PSOutputDev.cc, and (7) SplashOutputDev.cc in poppler/; and (8) SplashBitmap.cc, (9) Splash.cc, and (10) SplashFTFont.cc in splash/.  NOTE: this may overlap CVE-2009-0791.
",1.0,844.0,6.0,2.2157814502716064
177779,DoS Exec Code Overflow," Based on the given code, the `CairoOutputDev::drawSoftMaskedImage` function does not appear to be directly vulnerable to integer overflows. However, it does allocate memory dynamically and process user input (from the `str` and `maskStr` parameters), so it's essential to ensure proper bounds checking and input validation are implemented in the rest of the code that calls this function.

Therefore, the answer is:

NO (but with a caveat)

The code snippet provided does not contain any obvious integer overflow vulnerabilities. However, it's crucial to ensure that proper bounds checking and input validation are implemented in the rest of the code that calls this function.

The z-function implementation in the `minimumTimeToInitialState` function is not related to the `CairoOutputDev::drawSoftMaskedImage` function and does not contain any apparent vulnerabilities.","The code contains a DoS_Exec_Code_Overflow vulnerability. 
The CVE-ID is CVE-2009-3605. The CWE-ID is CWE-189.
Vulnerability summary:
Multiple integer overflows in Poppler 0.10.5 and earlier allow remote attackers to cause a denial of service (application crash) or possibly execute arbitrary code via a crafted PDF file, related to (1) glib/poppler-page.cc; (2) ArthurOutputDev.cc, (3) CairoOutputDev.cc, (4) GfxState.cc, (5) JBIG2Stream.cc, (6) PSOutputDev.cc, and (7) SplashOutputDev.cc in poppler/; and (8) SplashBitmap.cc, (9) Splash.cc, and (10) SplashFTFont.cc in splash/.  NOTE: this may overlap CVE-2009-0791.
",1.0,875.0,6.0,2.962632417678833
177780,DoS Exec Code Overflow," Based on the given code, the `GfxImageColorMap` constructor does not appear to contain any obvious integer overflow vulnerabilities. The code performs bounds checking on the `maxPixel` variable and uses the minimum of `maxPixel` and `255` when assigning values to `decodeLow` and `decodeRange`. Additionally, the code uses the `ceil_divide` helper function to ensure that integer divisions do not result in negative numbers.

Therefore, the answer is 'NO'.","The code contains a DoS_Exec_Code_Overflow vulnerability. 
The CVE-ID is CVE-2009-3605. The CWE-ID is CWE-189.
Vulnerability summary:
Multiple integer overflows in Poppler 0.10.5 and earlier allow remote attackers to cause a denial of service (application crash) or possibly execute arbitrary code via a crafted PDF file, related to (1) glib/poppler-page.cc; (2) ArthurOutputDev.cc, (3) CairoOutputDev.cc, (4) GfxState.cc, (5) JBIG2Stream.cc, (6) PSOutputDev.cc, and (7) SplashOutputDev.cc in poppler/; and (8) SplashBitmap.cc, (9) Splash.cc, and (10) SplashFTFont.cc in splash/.  NOTE: this may overlap CVE-2009-0791.
",1.0,802.0,6.0,4.34790825843811
177781,DoS Exec Code Overflow," The given `GfxImageColorMap::getGrayLine` function does not appear to be directly vulnerable to the mentioned vulnerabilities (DoS, Exec, Code, Overflow) based on the provided code snippet. However, it does call other functions (`colorSpace2->getGrayLine`) that could potentially have vulnerabilities. It's essential to audit those functions as well.

The second code snippet provided, `minimumTimeToInitialState`, is not related to the C++ code snippet you initially provided and does not seem to have any apparent vulnerabilities. It's just an unrelated function.","The code contains a DoS_Exec_Code_Overflow vulnerability. 
The CVE-ID is CVE-2009-3605. The CWE-ID is CWE-189.
Vulnerability summary:
Multiple integer overflows in Poppler 0.10.5 and earlier allow remote attackers to cause a denial of service (application crash) or possibly execute arbitrary code via a crafted PDF file, related to (1) glib/poppler-page.cc; (2) ArthurOutputDev.cc, (3) CairoOutputDev.cc, (4) GfxState.cc, (5) JBIG2Stream.cc, (6) PSOutputDev.cc, and (7) SplashOutputDev.cc in poppler/; and (8) SplashBitmap.cc, (9) Splash.cc, and (10) SplashFTFont.cc in splash/.  NOTE: this may overlap CVE-2009-0791.
",1.0,825.0,6.0,1.1558074951171875
177783,DoS Exec Code Overflow," The given `GfxImageColorMap::getRGBLine` function does not appear to be directly vulnerable to the mentioned vulnerabilities (DoS, Exec, Code, Overflow) based on the provided code snippet. However, it does call other functions (`colorSpace2->getRGBLine` and `colorSpace->getRGBLine`) which could potentially have vulnerabilities. It's essential to audit those functions as well.

The second code snippet provided, `minimumTimeToInitialState`, is not related to the C++ code snippet you initially provided and does not appear to have any vulnerabilities based on the given code.","The code contains a DoS_Exec_Code_Overflow vulnerability. 
The CVE-ID is CVE-2009-3605. The CWE-ID is CWE-189.
Vulnerability summary:
Multiple integer overflows in Poppler 0.10.5 and earlier allow remote attackers to cause a denial of service (application crash) or possibly execute arbitrary code via a crafted PDF file, related to (1) glib/poppler-page.cc; (2) ArthurOutputDev.cc, (3) CairoOutputDev.cc, (4) GfxState.cc, (5) JBIG2Stream.cc, (6) PSOutputDev.cc, and (7) SplashOutputDev.cc in poppler/; and (8) SplashBitmap.cc, (9) Splash.cc, and (10) SplashFTFont.cc in splash/.  NOTE: this may overlap CVE-2009-0791.
",1.0,825.0,6.0,2.301170825958252
