case_id,vuln_type,audit_report,gt,eval_score,eval_input_token_num,eval_output_token_num,eval_inference_time
177826,DoS Exec Code Overflow," The second code snippet provided is not directly related to the first vulnerable code. It is a separate function called `minimumTimeToInitialState` that calculates the minimum time to bring a string to its initial state with a given step size. This function does not involve any file I/O or memory management, so it is not vulnerable to the DoS, Exec, Code, Overflow vulnerability present in the first code snippet.

Therefore, the answer is 'NO'.","The code contains a DoS_Exec_Code_Overflow vulnerability. 
The CVE-ID is CVE-2013-4473. The CWE-ID is CWE-119.
Vulnerability summary:
Stack-based buffer overflow in the extractPages function in utils/pdfseparate.cc in poppler before 0.24.2 allows remote attackers to cause a denial of service (crash) and possibly execute arbitrary code via a source filename.
",1.0,699.0,6.0,2.951495885848999
177827,," The given C++ code does not appear to be directly related to the JFFS2 vulnerability described earlier. The code snippet provided is a function for calculating the minimum number of times a string must be repeated to form a palindrome. This code does not involve file system access, memory management, or other features that could lead to the types of vulnerabilities mentioned in the earlier vulnerability description. Therefore, the answer is 'NO'.","The code contains a nan vulnerability. 
The CVE-ID is CVE-2007-4849. The CWE-ID is CWE-264.
Vulnerability summary:
JFFS2, as used on One Laptop Per Child (OLPC) build 542 and possibly other Linux systems, when POSIX ACL support is enabled, does not properly store permissions during (1) inode creation or (2) ACL setting, which might allow local users to access restricted files or directories after a remount of a filesystem, related to ""legacy modes"" and an inconsistency between dentry permissions and inode permissions.
",1.0,726.0,6.0,2.8685083389282227
177831,," The given code snippet `mcid_char_imp` does not directly involve string manipulation functions like `strcpy`, `sprintf`, or array access, which are common causes of buffer overflow vulnerabilities. Instead, it uses `pdf_dict_del` and `pdf_drop_obj` functions to remove objects from a PDF context. These functions are not inherently vulnerable to buffer overflows.

However, the vulnerability CVE-2019-14975 mentioned in the explanation is related to a different part of the codebase (`fz_chartorune` in `fitz/string.c`). The provided code snippet does not exhibit the same vulnerability.

Therefore, the answer is 'NO'.","The code contains a nan vulnerability. 
The CVE-ID is CVE-2019-14975. The CWE-ID is CWE-125.
Vulnerability summary:
Artifex MuPDF before 1.16.0 has a heap-based buffer over-read in fz_chartorune in fitz/string.c because pdf/pdf-op-filter.c does not check for a missing string.
",1.0,729.0,6.0,3.1534271240234375
177832,," The given `walk_string` function does not appear to be vulnerable based on the provided code snippet. It does not contain any obvious buffer overflow vulnerabilities, as it properly checks the length of the string before performing any string manipulation. However, it does contain some potential security vulnerabilities, such as not checking the input `uni` for validity, which could potentially lead to unexpected behavior or crashes. It is always a good practice to validate user inputs and ensure they fall within acceptable ranges.","The code contains a nan vulnerability. 
The CVE-ID is CVE-2019-14975. The CWE-ID is CWE-125.
Vulnerability summary:
Artifex MuPDF before 1.16.0 has a heap-based buffer over-read in fz_chartorune in fitz/string.c because pdf/pdf-op-filter.c does not check for a missing string.
",2.0,692.0,6.0,2.1188406944274902
177833,DoS Overflow," The given code for the `reds_handle_ticket` function is not directly related to the `z_function` code you provided. Therefore, I will evaluate the vulnerability of the `reds_handle_ticket` function based on the information given in the code snippet.

YES, the `reds_handle_ticket` function is vulnerable to a stack-based buffer overflow. The vulnerability arises from the `password` array, which has a fixed size (`SPICE_MAX_PASSWORD_LENGTH`). If the length of the decrypted password is greater than this size, it will result in a buffer overflow, leading to a denial-of-service condition.

The CVE-ID for this vulnerability is CVE-2013-4282, and the CWE-ID is CWE-119.","The code contains a DoS_Overflow vulnerability. 
The CVE-ID is CVE-2013-4282. The CWE-ID is CWE-119.
Vulnerability summary:
Stack-based buffer overflow in the reds_handle_ticket function in server/reds.c in SPICE 0.12.0 allows remote attackers to cause a denial of service (crash) via a long password in a SPICE ticket.
",3.0,748.0,6.0,3.7304394245147705
177839,+Info," The given C++ code for the `next_codepoint_handle_ext` function is not directly related to the vulnerability described in the provided context. The vulnerability described in the context is related to the ldb library used in the AD LDAP server in Samba, which is not present in the given code.

Therefore, the answer is 'NO'. The given code does not have the vulnerability described in the context.","The code contains a +Info vulnerability. 
The CVE-ID is CVE-2015-5330. The CWE-ID is CWE-200.
Vulnerability summary:
ldb before 1.1.24, as used in the AD LDAP server in Samba 4.x before 4.1.22, 4.2.x before 4.2.7, and 4.3.x before 4.3.3, mishandles string lengths, which allows remote attackers to obtain sensitive information from daemon heap memory by sending crafted packets and then reading (1) an error message or (2) a database value.
",1.0,729.0,6.0,2.1896140575408936
177840,+Info," The given code for the function `ldb_dn_escape_internal` is not directly related to the vulnerability described in the provided CVE-ID (CVE-2015-5330) and its corresponding CWE-ID (CWE-200). The vulnerability in the CVE pertains to a mishandling of string lengths in the LDAP server in Samba, which is not present in the given code. Therefore, the code is not vulnerable based on the information provided.","The code contains a +Info vulnerability. 
The CVE-ID is CVE-2015-5330. The CWE-ID is CWE-200.
Vulnerability summary:
ldb before 1.1.24, as used in the AD LDAP server in Samba 4.x before 4.1.22, 4.2.x before 4.2.7, and 4.3.x before 4.3.3, mishandles string lengths, which allows remote attackers to obtain sensitive information from daemon heap memory by sending crafted packets and then reading (1) an error message or (2) a database value.
",1.0,740.0,6.0,2.6025638580322266
177841,+Info," The given C++ code for the function `strupper_talloc_n_handle` is not directly related to the vulnerability described in the provided vulnerability summary. The vulnerability described is related to the ldb library and its mishandling of string lengths.

The code you provided does not involve string handling in a way that would make it vulnerable to the described vulnerability. Therefore, the answer is 'NO'.","The code contains a +Info vulnerability. 
The CVE-ID is CVE-2015-5330. The CWE-ID is CWE-200.
Vulnerability summary:
ldb before 1.1.24, as used in the AD LDAP server in Samba 4.x before 4.1.22, 4.2.x before 4.2.7, and 4.3.x before 4.3.3, mishandles string lengths, which allows remote attackers to obtain sensitive information from daemon heap memory by sending crafted packets and then reading (1) an error message or (2) a database value.
",1.0,736.0,6.0,1.2343275547027588
177842,+Info," The given code snippet `next_codepoint_handle_ext` is not directly related to the vulnerability described in the provided CVE-ID and CWE-ID. The vulnerability mentioned in the CVE-ID is related to the LDAP server in Samba and string length mishandling.

The code snippet `next_codepoint_handle_ext` does not involve string length handling or any other vulnerable operations mentioned in the provided vulnerability description. Therefore, it is not vulnerable based on the given code.

However, it is essential to note that the code snippet might have other vulnerabilities or issues not related to the provided vulnerability description. It is always a good practice to thoroughly review and test the code for any potential vulnerabilities or issues.","The code contains a +Info vulnerability. 
The CVE-ID is CVE-2015-5330. The CWE-ID is CWE-200.
Vulnerability summary:
ldb before 1.1.24, as used in the AD LDAP server in Samba 4.x before 4.1.22, 4.2.x before 4.2.7, and 4.3.x before 4.3.3, mishandles string lengths, which allows remote attackers to obtain sensitive information from daemon heap memory by sending crafted packets and then reading (1) an error message or (2) a database value.
",1.0,786.0,6.0,2.413525342941284
177843,+Info," The given code for the function `strlen_m_ext_handle` is not directly vulnerable to the vulnerabilities listed in the provided steps. However, it does contain some potential issues:

1. The code uses the `smb_panic` function, which may not be properly handled, leading to potential crashes or unintended behavior.
2. The code does not check the return value of the `next_codepoint_handle_ext` function, which could potentially lead to buffer overflows or other issues if the function call fails.
3. The code does not validate the input `s` or `src_charset` and `dst_charset` pointers, which could potentially lead to use-after-free or null pointer dereference vulnerabilities if the pointers are invalid.

However, these potential issues do not directly relate to the security vulnerabilities listed in the provided steps. To specifically address the steps, the code does not contain any obvious buffer overflow vulnerabilities, use-after-free errors, memory leaks, integer overflows/underflows, null pointer dereferences, improper input validation, race conditions, insecure function usage, improper resource management, or sensitive data exposure.

Therefore, the answer is 'NO'.","The code contains a +Info vulnerability. 
The CVE-ID is CVE-2015-5330. The CWE-ID is CWE-200.
Vulnerability summary:
ldb before 1.1.24, as used in the AD LDAP server in Samba 4.x before 4.1.22, 4.2.x before 4.2.7, and 4.3.x before 4.3.3, mishandles string lengths, which allows remote attackers to obtain sensitive information from daemon heap memory by sending crafted packets and then reading (1) an error message or (2) a database value.
",2.0,879.0,6.0,3.3067617416381836
177844,+Info," The given C++ code for the function `strupper_talloc_n_handle` is not directly related to the vulnerability described in the provided CVE-ID and CWE-ID. The vulnerability mentioned in the CVE-ID is related to the LDAP server in Samba and involves mishandling of string lengths.

The code you provided does not involve string handling in the same way as the vulnerable code in the CVE-ID. Therefore, based on the given code, it is not vulnerable to the specific vulnerability described in the CVE-ID.

However, it's always a good practice to ensure proper bounds checking when dealing with strings and memory in C++ to prevent potential buffer overflow vulnerabilities. In the given code, the `dest` array is allocated with a size of 2*(n+1), where `n` is the input length. This should be sufficient to prevent buffer overflows as long as the input length is valid. But, it's still a good idea to validate the input length before processing it to ensure that it's not larger than expected.

So, the answer is 'NO', but it's important to follow best practices for string handling in C++ to prevent potential vulnerabilities.","The code contains a +Info vulnerability. 
The CVE-ID is CVE-2015-5330. The CWE-ID is CWE-200.
Vulnerability summary:
ldb before 1.1.24, as used in the AD LDAP server in Samba 4.x before 4.1.22, 4.2.x before 4.2.7, and 4.3.x before 4.3.3, mishandles string lengths, which allows remote attackers to obtain sensitive information from daemon heap memory by sending crafted packets and then reading (1) an error message or (2) a database value.
",1.0,889.0,6.0,1.8798129558563232
177848,," The given code snippet is not directly related to the vulnerability described in the provided context. The code snippet is a separate function for calculating the minimum time to reach the initial state of a string based on a given pattern length. It does not involve any network communication or memory management, which are the primary concerns for the vulnerability described. Therefore, the answer is 'NO'.","The code contains a nan vulnerability. 
The CVE-ID is CVE-2015-5296. The CWE-ID is CWE-20.
Vulnerability summary:
Samba 3.x and 4.x before 4.1.22, 4.2.x before 4.2.7, and 4.3.x before 4.3.3 supports connections that are encrypted but unsigned, which allows man-in-the-middle attackers to conduct encrypted-to-unencrypted downgrade attacks by modifying the client-server data stream, related to clidfs.c, libsmb_server.c, and smbXcli_base.c.
",1.0,720.0,6.0,2.20725154876709
177850,DoS Overflow," Based on the given code, the `datum_to_json` function does not appear to be directly vulnerable to buffer overflows. However, it does call other functions (such as `array_to_json_internal` and `composite_to_json`) that could potentially contain buffer overflow vulnerabilities. It is important to thoroughly review those functions as well.

Therefore, the answer is: 'Partially'. The `datum_to_json` function itself may not be vulnerable, but it calls other functions that could be vulnerable to buffer overflows.

It is essential to perform a thorough vulnerability assessment on all functions called within `datum_to_json` to ensure the entire codebase is secure.","The code contains a DoS_Overflow vulnerability. 
The CVE-ID is CVE-2015-5289. The CWE-ID is CWE-119.
Vulnerability summary:
Multiple stack-based buffer overflows in json parsing in PostgreSQL before 9.3.x before 9.3.10 and 9.4.x before 9.4.5 allow attackers to cause a denial of service (server crash) via unspecified vectors, which are not properly handled in (1) json or (2) jsonb values.
",2.0,760.0,6.0,1.946016550064087
177851,DoS Overflow," The provided `parse_array` function does not appear to be directly vulnerable to the mentioned vulnerabilities in the given list. However, it does call other functions (`parse_array_element`) that could potentially contain vulnerabilities. It is essential to review those functions as well.

The `parse_array` function itself does not involve string or memory functions like `strcpy`, `sprintf`, `memcpy`, or array access without proper bounds checking. It also does not involve dynamic memory management, user input validation, or multi-threading.

However, since the code snippet provided is incomplete, it is impossible to determine if there are any vulnerabilities in the `parse_array_element` function or other parts of the code. Therefore, a thorough vulnerability audit would require examining the entire codebase.

Answer: NO (but with the caveat that other parts of the codebase might contain vulnerabilities).","The code contains a DoS_Overflow vulnerability. 
The CVE-ID is CVE-2015-5289. The CWE-ID is CWE-119.
Vulnerability summary:
Multiple stack-based buffer overflows in json parsing in PostgreSQL before 9.3.x before 9.3.10 and 9.4.x before 9.4.5 allow attackers to cause a denial of service (server crash) via unspecified vectors, which are not properly handled in (1) json or (2) jsonb values.
",1.0,800.0,6.0,3.0084266662597656
177852,DoS Overflow," The given `parse_object` function does not appear to be directly vulnerable to the mentioned vulnerabilities in the provided list. However, it does call other functions like `parse_object_field` and `lex_expect` which could potentially contain vulnerabilities. It is essential to review those functions as well.

The `parse_object` function itself does not involve string or memory functions like `strcpy`, `sprintf`, `memcpy`, or array access without proper bounds checking, which are common causes of buffer overflow vulnerabilities. It also does not involve dynamic memory management or pointer dereferencing without proper checks, which could lead to use-after-free or null pointer dereference vulnerabilities.

However, it is important to note that the code snippet provided is incomplete and does not represent the entire program. It is always recommended to perform a thorough vulnerability assessment on the entire codebase to ensure the security of the application.","The code contains a DoS_Overflow vulnerability. 
The CVE-ID is CVE-2015-5289. The CWE-ID is CWE-119.
Vulnerability summary:
Multiple stack-based buffer overflows in json parsing in PostgreSQL before 9.3.x before 9.3.10 and 9.4.x before 9.4.5 allow attackers to cause a denial of service (server crash) via unspecified vectors, which are not properly handled in (1) json or (2) jsonb values.
",1.0,803.0,6.0,2.304306983947754
177853,DoS Overflow," The given `setPath` function does not appear to be directly vulnerable to the mentioned vulnerabilities in the provided code snippet. However, it does call other functions like `setPathArray` and `setPathObject` which could potentially contain vulnerabilities. It is essential to review those functions as well.

The `minimumTimeToInitialState` function is not related to the C++ code provided and does not contain any apparent vulnerabilities. It is a separate function that calculates the minimum number of steps required to return a string to its initial state using the Z-algorithm.","The code contains a DoS_Overflow vulnerability. 
The CVE-ID is CVE-2015-5289. The CWE-ID is CWE-119.
Vulnerability summary:
Multiple stack-based buffer overflows in json parsing in PostgreSQL before 9.3.x before 9.3.10 and 9.4.x before 9.4.5 allow attackers to cause a denial of service (server crash) via unspecified vectors, which are not properly handled in (1) json or (2) jsonb values.
",1.0,741.0,6.0,2.4565889835357666
177855,Bypass," Based on the provided code, it does not appear to be directly vulnerable to the Bypass vulnerability described in the initial code snippet. The code seems to be handling file paths and checking directory access, but it does not involve any symlink manipulation or bypassing intended access restrictions.

However, it is essential to note that the code snippet you provided is incomplete, and there might be other parts of the codebase that could introduce vulnerabilities. Always consider the entire system context when evaluating security.

Therefore, the answer is 'NO'.","The code contains a Bypass vulnerability. 
The CVE-ID is CVE-2015-5252. The CWE-ID is CWE-264.
Vulnerability summary:
vfs.c in smbd in Samba 3.x and 4.x before 4.1.22, 4.2.x before 4.2.7, and 4.3.x before 4.3.3, when share names with certain substring relationships exist, allows remote attackers to bypass intended file-access restrictions via a symlink that points outside of a share.
",1.0,738.0,6.0,2.6437313556671143
177856,," Based on the provided code, there doesn't seem to be any obvious vulnerability related to the nan (CVE-2019-13638, CWE-78) vulnerability mentioned in the initial context. The code snippet you've shared appears to be unrelated to the file handling and command injection vulnerability described in the vulnerability summary.

Therefore, my answer is 'NO'.","The code contains a nan vulnerability. 
The CVE-ID is CVE-2019-13638. The CWE-ID is CWE-78.
Vulnerability summary:
GNU patch through 2.7.6 is vulnerable to OS shell command injection that can be exploited by opening a crafted patch file that contains an ed style diff payload with shell metacharacters. The ed editor does not need to be present on the vulnerable system. This is different from CVE-2018-1000156.
",1.0,691.0,6.0,3.2092959880828857
177857,," The given code for `plan_a` function is not directly related to the vulnerability described in the provided context. The vulnerability mentioned in the context is related to a specific behavior in GNU patch, which is not present in the given code.

Therefore, the answer is 'NO'. The given code is not vulnerable to the described vulnerability.","The code contains a nan vulnerability. 
The CVE-ID is CVE-2019-13636. The CWE-ID is CWE-59.
Vulnerability summary:
In GNU patch through 2.7.6, the following of symlinks is mishandled in certain cases other than input files. This affects inp.c and util.c.
",1.0,656.0,6.0,3.035050630569458
177859,Exec Code Bypass," The given gs_nulldevice function does not directly involve user input or string manipulation functions, so it is not vulnerable to the mentioned vulnerabilities like buffer overflow, use-after-free, memory leaks, integer overflow/underflow, null pointer dereference, improper input validation, race conditions, insecure function usage, insecure resource management, or improper error handling. However, it is essential to ensure that the functions called within this function, such as gs_copydevice, dev_proc, rc_init, rc_increment, set_dev_proc, and gs_setdevice_no_erase, are used correctly and securely to prevent any potential vulnerabilities.

The second function, minimumTimeToInitialState, is not a C++ code snippet but a C++11 function declaration using a lambda function and a template function. It does not contain any C++ code that can be directly related to the mentioned vulnerabilities. It is a time complexity analysis function and does not involve any memory management, user input, or string manipulation functions. Therefore, it is not vulnerable to the mentioned vulnerabilities.","The code contains a Exec_Code_Bypass vulnerability. 
The CVE-ID is CVE-2018-16863. The CWE-ID is CWE-78.
Vulnerability summary:
It was found that RHSA-2018:2918 did not fully fix CVE-2018-16509. An attacker could possibly exploit another variant of the flaw and bypass the -dSAFER protection to, for example, execute arbitrary shell commands via a specially crafted PostScript document. This only affects ghostscript 9.07 as shipped with Red Hat Enterprise Linux 7.
",1.0,850.0,6.0,1.498290777206421
177860,Exec Code Bypass," The given code for the function `zrestore` does not contain any apparent vulnerabilities related to the provided list. However, it is important to note that the code snippet provided does not include the implementation of the functions `restore_check_operand`, `restore_check_stack`, `ivalidate_clean_spaces`, and `restore_fix_stack`. These functions could potentially contain vulnerabilities if not implemented correctly. Therefore, a thorough analysis of these functions is required to ensure the security of the code.

The second code snippet for the function `minimumTimeToInitialState` is not related to the vulnerability assessment task. It is an unrelated function that calculates the minimum time to reach the initial state of a string based on a given pattern length (k). This function does not contain any apparent vulnerabilities.

So, the answer is:

For the zrestore function: NO (but with the caveat that the called functions need to be analyzed)
For the minimumTimeToInitialState function: NO.","The code contains a Exec_Code_Bypass vulnerability. 
The CVE-ID is CVE-2018-16863. The CWE-ID is CWE-78.
Vulnerability summary:
It was found that RHSA-2018:2918 did not fully fix CVE-2018-16509. An attacker could possibly exploit another variant of the flaw and bypass the -dSAFER protection to, for example, execute arbitrary shell commands via a specially crafted PostScript document. This only affects ghostscript 9.07 as shipped with Red Hat Enterprise Linux 7.
",1.0,827.0,6.0,2.619598388671875
177862,Exec Code," The given `restore_page_device` function does not appear to be directly related to the vulnerability described in the provided CVE-ID (CVE-2018-16802). The vulnerability is related to an issue in Ghostscript's exception handling and stack management.

The `restore_page_device` function is not vulnerable to the described Exec_Code vulnerability. It is a utility function that compares two page devices and returns true if they are different.

Therefore, the answer is 'NO'.","The code contains a Exec_Code vulnerability. 
The CVE-ID is CVE-2018-16802. The CWE-ID is nan.
Vulnerability summary:
An issue was discovered in Artifex Ghostscript before 9.25. Incorrect ""restoration of privilege"" checking when running out of stack during exception handling could be used by attackers able to supply crafted PostScript to execute code using the ""pipe"" instruction. This is due to an incomplete fix for CVE-2018-16509.
",1.0,718.0,6.0,2.31996750831604
