case_id,vuln_type,audit_report,gt,eval_score,eval_input_token_num,eval_output_token_num,eval_inference_time
177786,DoS Exec Code Overflow," Based on the given code, the `SplashOutputDev::drawImage` function is not directly vulnerable to the DoS, Exec, Code, Overflow vulnerability described in the CVE-2009-3605. However, it does contain integer operations and memory management, so there could be potential for other vulnerabilities such as integer overflows or memory leaks. It is essential to thoroughly review the rest of the codebase and ensure proper input validation, error handling, and resource management to mitigate these risks.

Therefore, the answer is 'NO', but with the caveat that the code should be further evaluated for other potential vulnerabilities.","The code contains a DoS_Exec_Code_Overflow vulnerability. 
The CVE-ID is CVE-2009-3605. The CWE-ID is CWE-189.
Vulnerability summary:
Multiple integer overflows in Poppler 0.10.5 and earlier allow remote attackers to cause a denial of service (application crash) or possibly execute arbitrary code via a crafted PDF file, related to (1) glib/poppler-page.cc; (2) ArthurOutputDev.cc, (3) CairoOutputDev.cc, (4) GfxState.cc, (5) JBIG2Stream.cc, (6) PSOutputDev.cc, and (7) SplashOutputDev.cc in poppler/; and (8) SplashBitmap.cc, (9) Splash.cc, and (10) SplashFTFont.cc in splash/.  NOTE: this may overlap CVE-2009-0791.
",2.0,829.0,6.0,3.6206743717193604
177787,DoS Exec Code Overflow," Based on the given code, the SplashOutputDev::drawMaskedImage function does not appear to contain any obvious buffer overflow vulnerabilities. However, it does contain several integer overflows, which could potentially lead to denial-of-service (DoS) attacks or other issues. For example, in the if statement ""if (maskWidth > width || maskHeight > height)"", the width and height variables are compared to maskWidth and maskHeight, which could potentially allow for integer overflows if the input is not properly validated. Additionally, in the for loop ""for (i = 0; i < n; ++i)"", the value of n is determined by the number of pixel components and bits in the color map, which could potentially be large enough to cause integer overflows. It is important to ensure that all integer operations are properly validated and checked for overflow conditions to prevent potential vulnerabilities.

Therefore, the answer is: 'YES', the code contains integer overflow vulnerabilities.","The code contains a DoS_Exec_Code_Overflow vulnerability. 
The CVE-ID is CVE-2009-3605. The CWE-ID is CWE-189.
Vulnerability summary:
Multiple integer overflows in Poppler 0.10.5 and earlier allow remote attackers to cause a denial of service (application crash) or possibly execute arbitrary code via a crafted PDF file, related to (1) glib/poppler-page.cc; (2) ArthurOutputDev.cc, (3) CairoOutputDev.cc, (4) GfxState.cc, (5) JBIG2Stream.cc, (6) PSOutputDev.cc, and (7) SplashOutputDev.cc in poppler/; and (8) SplashBitmap.cc, (9) Splash.cc, and (10) SplashFTFont.cc in splash/.  NOTE: this may overlap CVE-2009-0791.
",3.0,897.0,6.0,3.326538324356079
177788,DoS Exec Code Overflow," Based on the given code, there are no obvious buffer overflow, use-after-free, memory leak, integer overflow/underflow, null pointer dereference, or sensitive data exposure vulnerabilities. However, there are some potential issues related to input validation and error handling that should be further investigated.

The code appears to be processing user input (maskStr, colorMap, and str) without proper validation or sanitation. This could potentially lead to buffer overflows, injection attacks, or other vulnerabilities. Additionally, there are several areas where exceptions or errors are ignored or mishandled, which could allow attackers to exploit the application if an error condition occurs.

It is recommended to perform a more thorough analysis of the code to identify and address these potential vulnerabilities. This may involve implementing input validation and sanitation mechanisms, proper error handling, and using secure alternatives to insecure or deprecated functions.

Therefore, the answer is: 'YES, but further analysis is required to identify and address the specific vulnerabilities.'","The code contains a DoS_Exec_Code_Overflow vulnerability. 
The CVE-ID is CVE-2009-3605. The CWE-ID is CWE-189.
Vulnerability summary:
Multiple integer overflows in Poppler 0.10.5 and earlier allow remote attackers to cause a denial of service (application crash) or possibly execute arbitrary code via a crafted PDF file, related to (1) glib/poppler-page.cc; (2) ArthurOutputDev.cc, (3) CairoOutputDev.cc, (4) GfxState.cc, (5) JBIG2Stream.cc, (6) PSOutputDev.cc, and (7) SplashOutputDev.cc in poppler/; and (8) SplashBitmap.cc, (9) Splash.cc, and (10) SplashFTFont.cc in splash/.  NOTE: this may overlap CVE-2009-0791.
",2.0,906.0,6.0,1.1320152282714844
177789,DoS Exec Code Overflow," The given code for `poppler_page_prepare_output_dev` function is not directly related to the provided C++ code for the `minimumTimeToInitialState` function. Therefore, I cannot determine if the `minimumTimeToInitialState` function is vulnerable based on the provided code.

However, I can evaluate the `poppler_page_prepare_output_dev` function for potential vulnerabilities as per the steps mentioned in the prompt.

1. Buffer Overflow: The code does not contain any obvious buffer overflow vulnerabilities as it uses `gmalloc` to allocate memory for `cairo_data` and `cairo_width` and `cairo_height` are calculated as integers.

2. Use After Free: The code does not contain any use-after-free vulnerabilities as it properly sets the output_dev_data->cairo_data and output_dev_data->surface to null after use.

3. Memory Leaks: The code does not contain any memory leaks as it properly deallocates the memory allocated for `cairo_data` and `surface` using `gfree` and `cairo_surface_destroy`.

4. Integer Overflow/Underflow: The code does not contain any integer overflow or underflow vulnerabilities as it uses `ceil` function to calculate `cairo_width` and `cairo_height`.
","The code contains a DoS_Exec_Code_Overflow vulnerability. 
The CVE-ID is CVE-2009-3605. The CWE-ID is CWE-189.
Vulnerability summary:
Multiple integer overflows in Poppler 0.10.5 and earlier allow remote attackers to cause a denial of service (application crash) or possibly execute arbitrary code via a crafted PDF file, related to (1) glib/poppler-page.cc; (2) ArthurOutputDev.cc, (3) CairoOutputDev.cc, (4) GfxState.cc, (5) JBIG2Stream.cc, (6) PSOutputDev.cc, and (7) SplashOutputDev.cc in poppler/; and (8) SplashBitmap.cc, (9) Splash.cc, and (10) SplashFTFont.cc in splash/.  NOTE: this may overlap CVE-2009-0791.
",1.0,961.0,6.0,2.1288883686065674
177792,DoS Exec Code Overflow," The given SplashBitmap constructor code is not directly related to the integer overflow vulnerability described in the CVE-2009-3605. The vulnerability in that case was due to integer overflows in various Poppler components, specifically in the handling of width and height values in different modes. In the provided code, there are no integer overflows occurring, as the width and height values are assigned from the constructor arguments, and there are no arithmetic operations that could potentially cause an overflow.

Therefore, the answer is 'NO'. The provided code is not vulnerable to the described integer overflow vulnerability.","The code contains a DoS_Exec_Code_Overflow vulnerability. 
The CVE-ID is CVE-2009-3605. The CWE-ID is CWE-189.
Vulnerability summary:
Multiple integer overflows in Poppler 0.10.5 and earlier allow remote attackers to cause a denial of service (application crash) or possibly execute arbitrary code via a crafted PDF file, related to (1) glib/poppler-page.cc; (2) ArthurOutputDev.cc, (3) CairoOutputDev.cc, (4) GfxState.cc, (5) JBIG2Stream.cc, (6) PSOutputDev.cc, and (7) SplashOutputDev.cc in poppler/; and (8) SplashBitmap.cc, (9) Splash.cc, and (10) SplashFTFont.cc in splash/.  NOTE: this may overlap CVE-2009-0791.
",1.0,828.0,6.0,1.5115816593170166
177793,DoS Exec Code Overflow," Based on the provided code, the `SplashFTFont::makeGlyph` function does not appear to be directly vulnerable to integer overflows. However, the code does call other functions that may contain integer overflows, as mentioned in the CVE-2009-3605 vulnerability description. Therefore, it is still important to ensure that all called functions are handling integers correctly to prevent potential DoS or code execution vulnerabilities.

However, the `minimumTimeToInitialState` function is not related to the `SplashFTFont::makeGlyph` function, and it does not contain any apparent integer overflow vulnerabilities.

So, the answer is:

For `SplashFTFont::makeGlyph`: NO (but be aware of potential integer overflow vulnerabilities in called functions)
For `minimumTimeToInitialState`: NO.","The code contains a DoS_Exec_Code_Overflow vulnerability. 
The CVE-ID is CVE-2009-3605. The CWE-ID is CWE-189.
Vulnerability summary:
Multiple integer overflows in Poppler 0.10.5 and earlier allow remote attackers to cause a denial of service (application crash) or possibly execute arbitrary code via a crafted PDF file, related to (1) glib/poppler-page.cc; (2) ArthurOutputDev.cc, (3) CairoOutputDev.cc, (4) GfxState.cc, (5) JBIG2Stream.cc, (6) PSOutputDev.cc, and (7) SplashOutputDev.cc in poppler/; and (8) SplashBitmap.cc, (9) Splash.cc, and (10) SplashFTFont.cc in splash/.  NOTE: this may overlap CVE-2009-0791.
",3.0,864.0,6.0,2.9772045612335205
177794,," Based on the provided code, the DynamicMetadataProvider constructor does not contain any obvious buffer overflow, use-after-free, memory leak, integer overflow/underflow, null pointer dereference, or sensitive data exposure vulnerabilities. However, it does contain some other potential issues:

1. Improper Input Validation: The code does not validate the input 'e' for null before calling e->getAttributeNS(nullptr, refreshDelayFactor). This could potentially lead to a null pointer dereference if 'e' is null.

2. Insecure Function Usage: The code uses the deprecated 'atof' function to convert a string to a float. It is recommended to use safer alternatives like'strtof' or'stof' to mitigate risks of buffer overflows and other vulnerabilities.

3. Race Conditions: The code creates and starts the cleanup_thread in the constructor. If the constructor is called concurrently, there could be race conditions between the creation and execution of the cleanup_thread, potentially leading to inconsistent program states or data corruption.

4. Insecure Resource Management: The code creates and starts the cleanup_thread in the constructor, but it does not ensure that the thread is properly closed and released when the DynamicMetadataProvider object is destroyed. This could potentially lead to memory leaks or other resource-related vulnerabilities.

5. Improper Error Handling: The code","The code contains a nan vulnerability. 
The CVE-ID is CVE-2017-16853. The CWE-ID is CWE-347.
Vulnerability summary:
The DynamicMetadataProvider class in saml/saml2/metadata/impl/DynamicMetadataProvider.cpp in OpenSAML-C in OpenSAML before 2.6.1 fails to properly configure itself with the MetadataFilter plugins and does not perform critical security checks such as signature verification, enforcement of validity periods, and other checks specific to deployments, aka CPPOST-105.
",2.0,896.0,6.0,2.750368356704712
177795,," The given code snippet `DynamicMetadataProvider::DynamicMetadataProvider(const DOMElement* e)` is not directly related to the nan vulnerability described in the provided context. This code appears to be parsing XML configuration files and setting up various member variables. It does not involve any cryptographic operations or metadata processing that could be susceptible to the nan vulnerability. Therefore, the answer is 'NO'.","The code contains a nan vulnerability. 
The CVE-ID is CVE-2017-16852. The CWE-ID is CWE-347.
Vulnerability summary:
shibsp/metadata/DynamicMetadataProvider.cpp in the Dynamic MetadataProvider plugin in Shibboleth Service Provider before 2.6.1 fails to properly configure itself with the MetadataFilter plugins and does not perform critical security checks such as signature verification, enforcement of validity periods, and other checks specific to deployments, aka SSPCPP-763.
",1.0,700.0,6.0,2.502964735031128
177796,Overflow," The second code snippet provided is not related to the first vulnerability discussed. It is a separate function that calculates the minimum time to bring a state back to its initial state based on a given word and a constant 'k'. This function does not involve any memory handling or string manipulation similar to the vulnerable code in the first snippet. Therefore, it is not vulnerable to the types of vulnerabilities mentioned in the initial list.

Answer: NO.","The code contains a Overflow vulnerability. 
The CVE-ID is CVE-2019-15938. The CWE-ID is CWE-119.
Vulnerability summary:
Pengutronix barebox through 2019.08.1 has a remote buffer overflow in nfs_readlink_req in fs/nfs.c because a length field is directly used for a memcpy.
",1.0,679.0,6.0,4.100535154342651
177799,Overflow," The given C++ code for `_XcursorReadImage` function is not directly vulnerable to integer overflow as the input values are read from the file and checked for bounds before processing. However, there are other potential vulnerabilities in the code, such as buffer overflow when reading data from the file, use-after-free, and memory leaks. These vulnerabilities are not directly related to integer overflow but should be addressed as part of a comprehensive vulnerability assessment.","The code contains a Overflow vulnerability. 
The CVE-ID is CVE-2017-16612. The CWE-ID is CWE-190.
Vulnerability summary:
libXcursor before 1.1.15 has various integer overflows that could lead to heap buffer overflows when processing malicious cursors, e.g., with programs like GIMP. It is also possible that an attack vector exists against the related code in cursor/xcursor.c in Wayland through 1.14.0.
",2.0,715.0,6.0,1.2352914810180664
177807,Bypass," The given code for `znumicc_components` function does not appear to be directly vulnerable to the mentioned vulnerabilities in the provided list. However, it does call other functions like `dict_find_string` and `gsicc_get_profile_handle_buffer` which could potentially have vulnerabilities. It is essential to review those functions' implementations as well.

The `znumicc_components` function itself does not contain any buffer overflow, use-after-free, memory leak, integer overflow/underflow, null pointer dereference, improper input validation, race conditions, insecure function usage, insecure resource management, or improper error handling vulnerabilities.

However, it does contain a switch statement with multiple cases, which could potentially be a source of vulnerabilities if the cases are not handled properly. It is essential to ensure that all cases are exhaustively covered and that the expected behavior is achieved in all cases.

The `minimumTimeToInitialState` function is not related to the given `znumicc_components` function and does not appear to contain any vulnerabilities based on the provided code.

Therefore, the answer is 'NO'.","The code contains a Bypass vulnerability. 
The CVE-ID is CVE-2018-19476. The CWE-ID is CWE-704.
Vulnerability summary:
psi/zicc.c in Artifex Ghostscript before 9.26 allows remote attackers to bypass intended access restrictions because of a setcolorspace type confusion.
",1.0,804.0,6.0,2.274735689163208
177809,Bypass," The given code for `restore_page_device` function is not directly related to the provided vulnerability description. The vulnerability described in the text is related to a different function `get_page_device` and its usage in the `restore_page_device` function.

However, I will evaluate the given code for potential vulnerabilities based on the provided steps:

1. Buffer Overflow: No, the given code does not contain any obvious buffer overflow vulnerabilities.
2. Use After Free: No, the given code does not contain any use-after-free vulnerabilities.
3. Memory Leaks: No, the given code does not contain any memory leaks.
4. Integer Overflow/Underflow: No, the given code does not contain any integer overflow or underflow vulnerabilities.
5. Null Pointer Dereference: No, the given code does not contain any null pointer dereferences.
6. Improper Input Validation: The given code does not involve user input, so it is not directly related to this vulnerability type.
7. Race Conditions: No, the given code does not contain any race conditions.
8. Insecure Function Usage: The given code does not use any insecure or deprecated functions.
9. Insecure Resource Management: No, the given code does not contain any obvious resource management vulnerabilities.
10. Improper Error Handling: No","The code contains a Bypass vulnerability. 
The CVE-ID is CVE-2018-19475. The CWE-ID is nan.
Vulnerability summary:
psi/zdevice2.c in Artifex Ghostscript before 9.26 allows remote attackers to bypass intended access restrictions because available stack space is not checked when the device remains the same.
",1.0,851.0,6.0,1.8179316520690918
177811,DoS," The given C++ code for the function `aspath_put` is vulnerable. The vulnerability is related to a denial-of-service (DoS) issue where long AS_PATH segments can cause an invalid message to be constructed, leading to session drops. The code calculates the size of AS_PATH segments incorrectly, allowing attackers to send malformed BGP UPDATE messages and cause denial-of-service conditions.

The vulnerability summary is as follows:

CVE-ID: CVE-2017-16227
CWE-ID: CWE-20

Vulnerability description:
The aspath_put function in bgpd/bgp_aspath.c in Quagga before 1.2.2 allows remote attackers to cause a denial of service (session drop) via BGP UPDATE messages, because AS_PATH size calculation for long paths counts certain bytes twice and consequently constructs an invalid message.

The given separate C++ code for the function `minimumTimeToInitialState` is not vulnerable. It is a standalone function that calculates the minimum time required to return an initial state from a given string and an integer value. It does not involve any network communication or memory management, and thus it does not have any vulnerabilities related to buffer overflows, use-after-free, memory","The code contains a DoS vulnerability. 
The CVE-ID is CVE-2017-16227. The CWE-ID is CWE-20.
Vulnerability summary:
The aspath_put function in bgpd/bgp_aspath.c in Quagga before 1.2.2 allows remote attackers to cause a denial of service (session drop) via BGP UPDATE messages, because AS_PATH size calculation for long paths counts certain bytes twice and consequently constructs an invalid message.
",3.0,860.0,6.0,2.7824954986572266
177812,Bypass," The sum_update function does not directly involve user input or string manipulation functions like strcpy, sprintf, or gets, which are common sources of buffer overflow vulnerabilities. However, it does involve memory manipulation using memcpy and pointer arithmetic.

The vulnerability in the given code is not directly related to buffer overflow or input validation. Instead, it is related to checksum handling and bypassing intended access restrictions, as described in the vulnerability summary provided.

Therefore, the sum_update function itself is not vulnerable to the types of vulnerabilities listed in the initial instructions. However, the overall system or application that uses this function may still be vulnerable to other issues, such as those related to checksum handling and access control.","The code contains a Bypass vulnerability. 
The CVE-ID is CVE-2017-15994. The CWE-ID is CWE-354.
Vulnerability summary:
rsync 3.1.3-development before 2017-10-24 mishandles archaic checksums, which makes it easier for remote attackers to bypass intended access restrictions. NOTE: the rsync development branch has significant use beyond the rsync developers, e.g., the code has been copied for use in various GitHub projects.
",3.0,759.0,6.0,2.212920665740967
177815,Bypass," The given `file_checksum` function is not directly related to the vulnerability described in the provided context. The vulnerability mentioned in the context is related to the rsync utility, not the C++ code snippet provided. Therefore, the `file_checksum` function is not vulnerable based on the given code.","The code contains a Bypass vulnerability. 
The CVE-ID is CVE-2017-15994. The CWE-ID is CWE-354.
Vulnerability summary:
rsync 3.1.3-development before 2017-10-24 mishandles archaic checksums, which makes it easier for remote attackers to bypass intended access restrictions. NOTE: the rsync development branch has significant use beyond the rsync developers, e.g., the code has been copied for use in various GitHub projects.
",1.0,690.0,6.0,1.194653034210205
177816,Bypass," The given `get_checksum2` function is vulnerable. The vulnerability lies in the MD4 checksum computation where the code does not properly handle the last block of data when the length of the data is a multiple of 64. This can lead to an incorrect MD4 checksum being computed, potentially allowing an attacker to bypass intended access restrictions.","The code contains a Bypass vulnerability. 
The CVE-ID is CVE-2017-15994. The CWE-ID is CWE-354.
Vulnerability summary:
rsync 3.1.3-development before 2017-10-24 mishandles archaic checksums, which makes it easier for remote attackers to bypass intended access restrictions. NOTE: the rsync development branch has significant use beyond the rsync developers, e.g., the code has been copied for use in various GitHub projects.
",3.0,691.0,6.0,2.613520383834839
177821,DoS," The second code snippet provided does not appear to be directly related to the first vulnerable code. It is a separate function implementing the Z-algorithm for finding the length of the longest prefix of a given string that is also a suffix. This function does not contain any apparent vulnerabilities.

Therefore, the answer is 'NO'.","The code contains a DoS vulnerability. 
The CVE-ID is CVE-2017-15923. The CWE-ID is nan.
Vulnerability summary:
Konversation 1.4.x, 1.5.x, 1.6.x, and 1.7.x before 1.7.3 allow remote attackers to cause a denial of service (crash) via vectors related to parsing of IRC color formatting codes.
",1.0,674.0,6.0,3.2695846557617188
177823,Exec Code Overflow," Based on the provided code, it does not appear to be directly vulnerable to the Exec, Code, Overflow vulnerability described in the CVE-2011-2895. The code snippet provided is a function called BufCompressedFill, which seems to be handling compressed data. However, it does not contain any obvious signs of the LZW decompressor vulnerability mentioned in the CVE.

Therefore, the answer is 'NO'.","The code contains a Exec_Code_Overflow vulnerability. 
The CVE-ID is CVE-2011-2895. The CWE-ID is CWE-119.
Vulnerability summary:
The LZW decompressor in (1) the BufCompressedFill function in fontfile/decompress.c in X.Org libXfont before 1.4.4 and (2) compress/compress.c in 4.3BSD, as used in zopen.c in OpenBSD before 3.8, FreeBSD, NetBSD 4.0.x and 5.0.x before 5.0.3 and 5.1.x before 5.1.1, FreeType 2.1.9, and other products, does not properly handle code words that are absent from the decompression table when encountered, which allows context-dependent attackers to trigger an infinite loop or a heap-based buffer overflow, and possibly execute arbitrary code, via a crafted compressed stream, a related issue to CVE-2006-1168 and CVE-2011-2896.
",1.0,822.0,6.0,2.527224063873291
177825,DoS," The given code for the `extractPages` function does not appear to contain any obvious buffer overflow, use-after-free, memory leak, or format string vulnerabilities. However, it does contain other potential vulnerabilities, such as improper input validation and race conditions.

The `snprintf` function in the loop is vulnerable to a format string attack if the `destFileName` string is not properly validated. The `snprintf` function is used to format the destination file name with the page number, but if the page number is not an integer or is maliciously crafted, it could lead to a format string vulnerability.

To mitigate this vulnerability, the input validation for the `destFileName` string should be improved. One possible solution is to use a safe format string function like `snprintf_s` or `sprintf_s` on platforms that support them, or to use a library function like `strformat` or `strftime` to format the string. Another solution is to validate the input and ensure that it is an integer before using it in the `snprintf` function.

Therefore, the answer is:

YES - The code is vulnerable to a format string attack due to the lack of proper input validation in the `snprintf` function call.","The code contains a DoS vulnerability. 
The CVE-ID is CVE-2013-4474. The CWE-ID is CWE-20.
Vulnerability summary:
Format string vulnerability in the extractPages function in utils/pdfseparate.cc in poppler before 0.24.3 allows remote attackers to cause a denial of service (crash) via format string specifiers in a destination filename.
",4.0,850.0,6.0,3.014193296432495
