case_id,vuln_type,audit_report,gt,eval_score,eval_input_token_num,eval_output_token_num,eval_inference_time
177736,Bypass," Based on the provided code snippet, the samldb_check_user_account_control_acl function does not appear to contain any obvious buffer overflow, use-after-free, memory leak, integer overflow/underflow, null pointer dereference, or improper input validation vulnerabilities. However, it does contain a complex logic flow and a number of hardcoded error strings, which could potentially hide other vulnerabilities. Additionally, the code snippet does not show the context in which the function is called or the data sources it accesses, which could be relevant to determining its security.

The oddString function, on the other hand, is not directly related to the samldb_check_user_account_control_acl function and does not contain any apparent vulnerabilities based on the provided code.

Therefore, my answer is 'NO' for the samldb_check_user_account_control_acl function, and 'NO' for the oddString function. However, it is important to note that a thorough vulnerability assessment would require a more comprehensive analysis of the entire codebase and its context.","The code contains a Bypass vulnerability. 
The CVE-ID is CVE-2015-8467. The CWE-ID is CWE-264.
Vulnerability summary:
The samldb_check_user_account_control_acl function in dsdb/samdb/ldb_modules/samldb.c in Samba 4.x before 4.1.22, 4.2.x before 4.2.7, and 4.3.x before 4.3.3 does not properly check for administrative privileges during creation of machine accounts, which allows remote authenticated users to bypass intended access restrictions by leveraging the existence of a domain with both a Samba DC and a Windows DC, a similar issue to CVE-2015-2535.
",1.0,868.0,6.0,3.837911605834961
177740,DoS Exec Code Overflow Mem. Corr.," The given C++ code for the function `asn1_time_to_time_t` is not directly related to the `oddString` function. Therefore, I cannot evaluate the vulnerability of the `asn1_time_to_time_t` function based on the provided context.

However, I can evaluate the `oddString` function for potential vulnerabilities. Based on the given code, the `oddString` function appears to be safe. It does not involve any memory management, string manipulation, or user input handling that could lead to common vulnerabilities like buffer overflows, use-after-free, memory leaks, or integer overflows.

Therefore, my answer is 'NO'. The `oddString` function does not appear to be vulnerable based on the given code.","The code contains a DoS_Exec_Code_Overflow_Mem._Corr. vulnerability. 
The CVE-ID is CVE-2013-6420. The CWE-ID is CWE-119.
Vulnerability summary:
The asn1_time_to_time_t function in ext/openssl/openssl.c in PHP before 5.3.28, 5.4.x before 5.4.23, and 5.5.x before 5.5.7 does not properly parse (1) notBefore and (2) notAfter timestamps in X.509 certificates, which allows remote attackers to execute arbitrary code or cause a denial of service (memory corruption) via a crafted certificate that is not properly handled by the openssl_x509_parse function.
",1.0,822.0,6.0,4.330471038818359
177741,DoS Overflow," The given gnutls_session_get_data function is vulnerable. The vulnerability is due to the lack of proper bounds checking on the session_data_size argument. An attacker can exploit this by sending a large SessionTicket to the client, causing the session_data buffer to be overwritten and leading to a denial-of-service condition.

The oddString function, on the other hand, does not appear to be vulnerable based on the provided code. It does not involve any memory handling or string manipulation that could lead to buffer overflows or other vulnerabilities.","The code contains a DoS_Overflow vulnerability. 
The CVE-ID is CVE-2011-4128. The CWE-ID is CWE-119.
Vulnerability summary:
Buffer overflow in the gnutls_session_get_data function in lib/gnutls_session.c in GnuTLS 2.12.x before 2.12.14 and 3.x before 3.0.7, when used on a client that performs nonstandard session resumption, allows remote TLS servers to cause a denial of service (application crash) via a large SessionTicket.
",3.0,741.0,6.0,3.020059823989868
177742,DoS Overflow," The second code snippet provided is not directly related to the first vulnerable code snippet or the vulnerability discussed. It appears to be a separate function, `oddString`, written in C++. Based on the given code, it does not exhibit any obvious signs of a buffer overflow or other security vulnerabilities. Therefore, the answer is 'NO'.","The code contains a DoS_Overflow vulnerability. 
The CVE-ID is CVE-2011-4128. The CWE-ID is CWE-119.
Vulnerability summary:
Buffer overflow in the gnutls_session_get_data function in lib/gnutls_session.c in GnuTLS 2.12.x before 2.12.14 and 3.x before 3.0.7, when used on a client that performs nonstandard session resumption, allows remote TLS servers to cause a denial of service (application crash) via a large SessionTicket.
",1.0,703.0,6.0,2.480396032333374
177743,DoS," The given C++ code snippet `phar_make_dirstream` is not directly related to the provided vulnerability description. However, based on the given code, it does not appear to contain any obvious security vulnerabilities such as buffer overflow, use-after-free, memory leak, or null pointer dereference. The code seems to be handling strings and memory properly by checking string lengths and using `safe_emalloc` for dynamic memory allocation.

Therefore, my answer is 'NO'. However, it's important to note that this analysis is based on the given code snippet alone and does not consider the larger context of the application or potential interactions with other components. Additionally, the code may still contain other vulnerabilities not covered in the provided list. Always ensure that your code is thoroughly tested and reviewed by security experts to ensure its security.","The code contains a DoS vulnerability. 
The CVE-ID is CVE-2015-7804. The CWE-ID is CWE-189.
Vulnerability summary:
Off-by-one error in the phar_parse_zipfile function in ext/phar/zip.c in PHP before 5.5.30 and 5.6.x before 5.6.14 allows remote attackers to cause a denial of service (uninitialized pointer dereference and application crash) by including the / filename in a .zip PHAR archive.
",1.0,789.0,6.0,3.579545736312866
177747,DoS," The given C++ code for the function `bgp_attr_unknown` is not directly related to the `oddString` function you provided. Therefore, I will evaluate the vulnerability of the `bgp_attr_unknown` function based on the information provided in the code snippet.

YES, the `bgp_attr_unknown` function is vulnerable. The vulnerability is due to the lack of proper initialization of the `total` variable, which can be exploited by a remote attacker to cause a denial of service (bgpd crash) via a crafted BGP update. This vulnerability is described in CVE-2013-6051 with a CWE-ID of nan.","The code contains a DoS vulnerability. 
The CVE-ID is CVE-2013-6051. The CWE-ID is nan.
Vulnerability summary:
The bgp_attr_unknown function in bgp_attr.c in Quagga 0.99.21 does not properly initialize the total variable, which allows remote attackers to cause a denial of service (bgpd crash) via a crafted BGP update.
",3.0,732.0,6.0,2.440426826477051
177750,DoS Exec Code," Based on the provided code snippet, the `begin_softmask` function does not appear to be directly vulnerable to the mentioned vulnerability (DoS, Exec, CWE-416). However, it does contain some potential issues, such as:

1. Use of NULL pointers: The function checks if `softmask` is NULL and returns `gstate` if it is. This could potentially lead to unintended behavior if an error occurs earlier in the function and `softmask` is not properly initialized.
2. Unchecked errors: The function catches exceptions and ignores them with a comment ""FIXME: Ignore error"". This could potentially hide errors that should be handled properly.
3. Resource management: The function sets `gstate->softmask` and `gstate->softmask_resources` to NULL after using them, which could potentially lead to issues if these resources are needed later.

However, these issues do not directly relate to the mentioned vulnerability (DoS, Exec, CWE-416). To determine if the code is vulnerable to that specific vulnerability, a more in-depth analysis would be required, focusing on the use and management of heap memory.

Regarding the second code snippet, it is not related to the vulnerability being discussed and does not appear to be vulnerable to the mentioned vulnerability (DoS, Exxec, CWE-4","The code contains a DoS_Exec_Code vulnerability. 
The CVE-ID is CVE-2018-1000039. The CWE-ID is CWE-416.
Vulnerability summary:
In MuPDF 1.12.0 and earlier, multiple heap use after free bugs in the PDF parser could allow an attacker to execute arbitrary code, read memory, or cause a denial of service via a crafted file.
",2.0,869.0,6.0,2.1614835262298584
177766,DoS," Based on the provided code, the `ldap_push_filter` function does not appear to be directly vulnerable to a Denial of Service (DoS) attack as described in the vulnerability summary you provided. The code does not contain any obvious memory allocation without proper checking of return values, which is a common characteristic of DoS vulnerabilities.

However, it's important to note that the vulnerability summary you provided refers to a specific implementation in Samba 4.x before 4.1.22. The code you've provided is not directly related to that implementation, and it's possible that other vulnerabilities could exist in the larger context of the Samba project.

Therefore, my answer is 'NO', but with the caveat that a thorough analysis of the entire Samba project and its dependencies would be necessary to ensure that no other vulnerabilities exist.","The code contains a DoS vulnerability. 
The CVE-ID is CVE-2015-7540. The CWE-ID is CWE-399.
Vulnerability summary:
The LDAP server in the AD domain controller in Samba 4.x before 4.1.22 does not check return values to ensure successful ASN.1 memory allocation, which allows remote attackers to cause a denial of service (memory consumption and daemon crash) via crafted packets.
",1.0,770.0,6.0,5.156797885894775
177767,DoS," The given C++ code for the function `decode_openldap_dereference` is not directly related to the vulnerability described in the provided context. The vulnerability mentioned in the context is related to the LDAP server in Samba 4.x before 4.1.22, which is not present in the given code.

Therefore, the answer is 'NO'. The given code is not vulnerable to the described DoS vulnerability.","The code contains a DoS vulnerability. 
The CVE-ID is CVE-2015-7540. The CWE-ID is CWE-399.
Vulnerability summary:
The LDAP server in the AD domain controller in Samba 4.x before 4.1.22 does not check return values to ensure successful ASN.1 memory allocation, which allows remote attackers to cause a denial of service (memory consumption and daemon crash) via crafted packets.
",1.0,693.0,6.0,4.565972089767456
177768,DoS," Based on the provided code snippet, the function `sparse_dump_region` does not appear to be directly vulnerable to the DoS vulnerability described in the given CVE-ID (CVE-2018-20482). The vulnerability in the CVE-ID is related to the way GNU Tar handles file shrinkage during read access, which is not directly related to the code snippet provided.

Therefore, the answer is 'NO'.","The code contains a DoS vulnerability. 
The CVE-ID is CVE-2018-20482. The CWE-ID is CWE-835.
Vulnerability summary:
GNU Tar through 1.30, when --sparse is used, mishandles file shrinkage during read access, which allows local users to cause a denial of service (infinite read loop in sparse_dump_region in sparse.c) by modifying a file that is supposed to be archived by a different user's process (e.g., a system backup running as root).
",1.0,714.0,6.0,2.8801534175872803
177770,Bypass," Based on the provided code snippet for `read_ndx_and_attrs()`, there doesn't seem to be any obvious vulnerability related to the steps mentioned in the question. However, it's essential to note that the code snippet provided is incomplete, and there might be other parts of the codebase that could introduce vulnerabilities.

Therefore, based on the given code snippet, the answer is 'NO'.","The code contains a Bypass vulnerability. 
The CVE-ID is CVE-2017-17434. The CWE-ID is nan.
Vulnerability summary:
The daemon in rsync 3.1.2, and 3.1.3-development before 2017-12-03, does not check for fnamecmp filenames in the daemon_filter_list data structure (in the recv_files function in receiver.c) and also does not apply the sanitize_paths protection mechanism to pathnames found in ""xname follows"" strings (in the read_ndx_and_attrs function in rsync.c), which allows remote attackers to bypass intended access restrictions.
",1.0,734.0,6.0,1.153132677078247
177771,," The second code snippet provided is not directly related to the first vulnerable code. It appears to be a separate function called `oddString` that takes a vector of strings as an argument. Based on the provided code, it does not contain any apparent vulnerabilities related to the ones listed in the initial instructions. Therefore, the answer is 'NO'.","The code contains a nan vulnerability. 
The CVE-ID is CVE-2018-20103. The CWE-ID is CWE-835.
Vulnerability summary:
An issue was discovered in dns.c in HAProxy through 1.8.14. In the case of a compressed pointer, a crafted packet can trigger infinite recursion by making the pointer point to itself, or create a long chain of valid pointers resulting in stack exhaustion.
",1.0,676.0,6.0,3.1066174507141113
177773,DoS Exec Code Overflow Mem. Corr.," The given C++ code for `create_surface_from_thumbnail_data` function does not appear to contain any obvious buffer overflow vulnerabilities, as it does not involve any string or memory functions that could potentially lead to buffer overflows, such as `strcpy`, `sprintf`, `memcpy`, or array access without proper bounds checking.

However, the code for the `oddString` function is not provided in the question, so it cannot be evaluated for vulnerabilities in this response.

Therefore, the answer is 'NO' for the `create_surface_from_thumbnail_data` function.","The code contains a DoS_Exec_Code_Overflow_Mem._Corr. vulnerability. 
The CVE-ID is CVE-2009-3607. The CWE-ID is CWE-189.
Vulnerability summary:
Integer overflow in the create_surface_from_thumbnail_data function in glib/poppler-page.cc in Poppler 0.x allows remote attackers to cause a denial of service (memory corruption) or possibly execute arbitrary code via a crafted PDF document that triggers a heap-based buffer overflow.  NOTE: some of these details are obtained from third party information.
",1.0,745.0,6.0,3.115083932876587
177774,DoS Exec Code Overflow," Yes, the code is vulnerable to integer overflows. The vulnerability lies in the calculation of 'n' in the switch statement, where it is set to 1 << colorMap->getBits(). If the value of colorMap->getBits() is not checked or validated beforehand, it could potentially result in an integer overflow, leading to unintended behavior or crashes. Additionally, there is no check on the loop condition for the for loop that iterates through the colorMap to fill the lookup array, which could also lead to an integer overflow if the size of the colorMap is not properly checked.","The code contains a DoS_Exec_Code_Overflow vulnerability. 
The CVE-ID is CVE-2009-3605. The CWE-ID is CWE-189.
Vulnerability summary:
Multiple integer overflows in Poppler 0.10.5 and earlier allow remote attackers to cause a denial of service (application crash) or possibly execute arbitrary code via a crafted PDF file, related to (1) glib/poppler-page.cc; (2) ArthurOutputDev.cc, (3) CairoOutputDev.cc, (4) GfxState.cc, (5) JBIG2Stream.cc, (6) PSOutputDev.cc, and (7) SplashOutputDev.cc in poppler/; and (8) SplashBitmap.cc, (9) Splash.cc, and (10) SplashFTFont.cc in splash/.  NOTE: this may overlap CVE-2009-0791.
",3.0,824.0,6.0,2.504183053970337
177775,DoS Exec Code Overflow," Based on the given code, the ArthurOutputDev::drawImage function does not appear to contain any obvious buffer overflow, use-after-free, memory leak, or null pointer dereference vulnerabilities. However, it does contain integer overflows when checking the pixel values against maskColors. This could potentially lead to incorrect image processing or even a crash. It is recommended to validate and sanitize the maskColors input to prevent such integer overflows.

Therefore, the answer is:

YES, the code is vulnerable to integer overflows when checking pixel values against maskColors. It is recommended to validate and sanitize the maskColors input to prevent such overflows.","The code contains a DoS_Exec_Code_Overflow vulnerability. 
The CVE-ID is CVE-2009-3605. The CWE-ID is CWE-189.
Vulnerability summary:
Multiple integer overflows in Poppler 0.10.5 and earlier allow remote attackers to cause a denial of service (application crash) or possibly execute arbitrary code via a crafted PDF file, related to (1) glib/poppler-page.cc; (2) ArthurOutputDev.cc, (3) CairoOutputDev.cc, (4) GfxState.cc, (5) JBIG2Stream.cc, (6) PSOutputDev.cc, and (7) SplashOutputDev.cc in poppler/; and (8) SplashBitmap.cc, (9) Splash.cc, and (10) SplashFTFont.cc in splash/.  NOTE: this may overlap CVE-2009-0791.
",3.0,831.0,6.0,2.1177406311035156
177777,DoS Exec Code Overflow," Yes, the code is vulnerable to integer overflow. The vulnerability lies in the if condition inside the for loop where the comparison is made between pix[i] and maskColors[2*i+1]. If the values of pix[i] and maskColors[2*i+1] are not properly checked or validated, an integer overflow can occur, leading to unexpected behavior or even code execution.","The code contains a DoS_Exec_Code_Overflow vulnerability. 
The CVE-ID is CVE-2009-3605. The CWE-ID is CWE-189.
Vulnerability summary:
Multiple integer overflows in Poppler 0.10.5 and earlier allow remote attackers to cause a denial of service (application crash) or possibly execute arbitrary code via a crafted PDF file, related to (1) glib/poppler-page.cc; (2) ArthurOutputDev.cc, (3) CairoOutputDev.cc, (4) GfxState.cc, (5) JBIG2Stream.cc, (6) PSOutputDev.cc, and (7) SplashOutputDev.cc in poppler/; and (8) SplashBitmap.cc, (9) Splash.cc, and (10) SplashFTFont.cc in splash/.  NOTE: this may overlap CVE-2009-0791.
",3.0,788.0,6.0,1.1192512512207031
177778,DoS Exec Code Overflow," Based on the given code, the function `CairoOutputDev::drawMaskedImage` is not vulnerable to the specific vulnerabilities listed in the steps provided, such as buffer overflow, use-after-free, memory leaks, integer overflow/underflow, null pointer dereference, improper input validation, race conditions, insecure function usage, insecure resource management, or improper error handling. However, it does allocate memory with `gmalloc` and does not check its return value, so there is a potential for memory leaks if the allocation fails. Additionally, there are no checks on the input parameters, so there is a risk of passing invalid or malicious data to the function, which could lead to various vulnerabilities depending on how the function handles such inputs. The code also uses Cairo functions without checking their return values, which could potentially hide errors or vulnerabilities.

Regarding the oddString function, it is not directly related to the C++ code provided, and it is not clear how it is used or what vulnerabilities it may have. Therefore, it is not possible to evaluate its vulnerability based on the given information.","The code contains a DoS_Exec_Code_Overflow vulnerability. 
The CVE-ID is CVE-2009-3605. The CWE-ID is CWE-189.
Vulnerability summary:
Multiple integer overflows in Poppler 0.10.5 and earlier allow remote attackers to cause a denial of service (application crash) or possibly execute arbitrary code via a crafted PDF file, related to (1) glib/poppler-page.cc; (2) ArthurOutputDev.cc, (3) CairoOutputDev.cc, (4) GfxState.cc, (5) JBIG2Stream.cc, (6) PSOutputDev.cc, and (7) SplashOutputDev.cc in poppler/; and (8) SplashBitmap.cc, (9) Splash.cc, and (10) SplashFTFont.cc in splash/.  NOTE: this may overlap CVE-2009-0791.
",2.0,921.0,6.0,2.401510000228882
177779,DoS Exec Code Overflow," Based on the given code, the function `CairoOutputDev::drawSoftMaskedImage` is not vulnerable to integer overflow or buffer overflow as there are no integer variables with unchecked arithmetic operations or array accesses with unchecked indices. However, there are some potential memory leaks in the code. The memory allocated for `maskBuffer` and `buffer` is not freed before the corresponding `cairo_surface_t` and `ImageStream` objects are destroyed. This can lead to memory leaks and potential denial-of-service (DoS) vulnerabilities.

To mitigate this issue, you should free the memory allocated for `maskBuffer` and `buffer` before destroying the corresponding `cairo_surface_t` and `ImageStream` objects.

Here's the corrected code snippet:

```cpp
free (maskBuffer);
cairo_surface_destroy (maskImage);
free (buffer);
cairo_surface_destroy (image);
```

Add these lines right before the last three lines in the function.

So, the answer is:

NO (but with a memory leak issue)","The code contains a DoS_Exec_Code_Overflow vulnerability. 
The CVE-ID is CVE-2009-3605. The CWE-ID is CWE-189.
Vulnerability summary:
Multiple integer overflows in Poppler 0.10.5 and earlier allow remote attackers to cause a denial of service (application crash) or possibly execute arbitrary code via a crafted PDF file, related to (1) glib/poppler-page.cc; (2) ArthurOutputDev.cc, (3) CairoOutputDev.cc, (4) GfxState.cc, (5) JBIG2Stream.cc, (6) PSOutputDev.cc, and (7) SplashOutputDev.cc in poppler/; and (8) SplashBitmap.cc, (9) Splash.cc, and (10) SplashFTFont.cc in splash/.  NOTE: this may overlap CVE-2009-0791.
",2.0,911.0,6.0,2.6744296550750732
177780,DoS Exec Code Overflow," Based on the given code, the `GfxImageColorMap::GfxImageColorMap` function does not appear to be directly vulnerable to integer overflows, DoS, Exec, Code, or Overflow vulnerabilities. However, there are several potential issues that should be addressed:

1. Memory management: The code allocates memory using `gmalloc` and `gmallocn` without checking for allocation failures. This can lead to memory leaks or undefined behavior if the allocation fails.
2. Input validation: The code does not validate user inputs or check the bounds of array indices. This can lead to buffer overflows, out-of-bounds access, or other vulnerabilities.
3. Race conditions: The code does not use synchronization mechanisms to prevent concurrent access to shared resources, which could lead to inconsistent program states or data corruption.
4. Insecure function usage: The code uses `gmalloc` and `gmallocn` without checking for allocation failures, which can lead to memory leaks. It is recommended to use RAII (Resource Acquisition Is Initialization) or smart pointers instead.
5. Improper error handling: The code does not handle errors properly, such as allocation failures or invalid inputs. This can lead to undefined behavior or vulnerabilities if the application doesn't properly address error conditions.

Therefore, while the code may not be directly vulnerable to the specific vulner","The code contains a DoS_Exec_Code_Overflow vulnerability. 
The CVE-ID is CVE-2009-3605. The CWE-ID is CWE-189.
Vulnerability summary:
Multiple integer overflows in Poppler 0.10.5 and earlier allow remote attackers to cause a denial of service (application crash) or possibly execute arbitrary code via a crafted PDF file, related to (1) glib/poppler-page.cc; (2) ArthurOutputDev.cc, (3) CairoOutputDev.cc, (4) GfxState.cc, (5) JBIG2Stream.cc, (6) PSOutputDev.cc, and (7) SplashOutputDev.cc in poppler/; and (8) SplashBitmap.cc, (9) Splash.cc, and (10) SplashFTFont.cc in splash/.  NOTE: this may overlap CVE-2009-0791.
",2.0,976.0,6.0,2.226672410964966
177781,DoS Exec Code Overflow," Based on the given code, the `GfxImageColorMap::getGrayLine` function does not appear to be directly vulnerable to the mentioned vulnerabilities (DoS, Exec, Code, Overflow) as it does not involve user input, dynamic memory allocation without proper bounds checking, or the use of insecure functions. However, it does contain nested loops and complex logic, so it's essential to ensure that the `byte_lookup` array and `nComps` and `nComps2` variables are properly initialized and bounded to prevent potential integer overflows or other vulnerabilities in the calling functions or the `colorSpace` and `colorSpace2` objects.

The second code snippet, `string oddString(vector<string>& words)`, is not related to the C++ code provided earlier and does not appear to be vulnerable to the mentioned vulnerabilities as it does not involve dynamic memory allocation, string manipulation, or the use of insecure functions. It does involve the use of `unordered_map` and `vector` data structures, but these are not inherently vulnerable if used correctly.

Therefore, the answer is 'NO' for both code snippets.","The code contains a DoS_Exec_Code_Overflow vulnerability. 
The CVE-ID is CVE-2009-3605. The CWE-ID is CWE-189.
Vulnerability summary:
Multiple integer overflows in Poppler 0.10.5 and earlier allow remote attackers to cause a denial of service (application crash) or possibly execute arbitrary code via a crafted PDF file, related to (1) glib/poppler-page.cc; (2) ArthurOutputDev.cc, (3) CairoOutputDev.cc, (4) GfxState.cc, (5) JBIG2Stream.cc, (6) PSOutputDev.cc, and (7) SplashOutputDev.cc in poppler/; and (8) SplashBitmap.cc, (9) Splash.cc, and (10) SplashFTFont.cc in splash/.  NOTE: this may overlap CVE-2009-0791.
",1.0,931.0,6.0,2.0181071758270264
