case_id,vuln_type,audit_report,gt,eval_score,eval_input_token_num,eval_output_token_num,eval_inference_time
177899,+Info," The given C++ code for the function `oddString` is not directly related to the vulnerability described in the provided context. It appears to be an unrelated function that processes a vector of strings and returns an odd string based on certain conditions. Therefore, it is not vulnerable to the XML External Entity (XXE) issue mentioned in the vulnerability summary.

However, it's important to note that the code snippet provided for the `soap_xmlParseFile` function is vulnerable to the XXE issue as described in the vulnerability summary.","The code contains a +Info vulnerability. 
The CVE-ID is CVE-2013-1824. The CWE-ID is CWE-200.
Vulnerability summary:
The SOAP parser in PHP before 5.3.22 and 5.4.x before 5.4.12 allows remote attackers to read arbitrary files via a SOAP WSDL file containing an XML external entity declaration in conjunction with an entity reference, related to an XML External Entity (XXE) issue in the soap_xmlParseFile and soap_xmlParseMemory functions.
",3.0,733.0,6.0,3.0161335468292236
177900,+Info," The given C++ code for the function `soap_xmlParseMemory` does not directly contain any obvious vulnerabilities based on the provided code snippet. However, it does call external functions like `xmlInitParser`, `xmlCreateMemoryParserCtxt`, `xmlParseDocument`, and `xmlFreeParserCtxt` which could potentially have vulnerabilities if not used correctly. It is essential to ensure that these functions are being used with proper input validation and error handling to prevent any potential security issues.

The second code snippet provided is an entirely different function called `oddString` which does not appear to have any direct security vulnerabilities. It is a simple function that processes a vector of strings and returns the odd string based on specific conditions.

Therefore, the answer is 'NO' for both code snippets. However, it is crucial to ensure that any external functions called from the code are being used securely to prevent potential vulnerabilities.","The code contains a +Info vulnerability. 
The CVE-ID is CVE-2013-1824. The CWE-ID is CWE-200.
Vulnerability summary:
The SOAP parser in PHP before 5.3.22 and 5.4.x before 5.4.12 allows remote attackers to read arbitrary files via a SOAP WSDL file containing an XML external entity declaration in conjunction with an entity reference, related to an XML External Entity (XXE) issue in the soap_xmlParseFile and soap_xmlParseMemory functions.
",1.0,810.0,6.0,2.3573265075683594
177901,Overflow," The second code snippet ""_asn1_ltostr"" function is not directly related to the given string function ""oddString"". The string function ""oddString"" does not involve any memory manipulation or string handling functions that could lead to buffer overflow vulnerabilities. Therefore, the answer is 'NO'.","The code contains a Overflow vulnerability. 
The CVE-ID is CVE-2015-2806. The CWE-ID is CWE-119.
Vulnerability summary:
Stack-based buffer overflow in asn1_der_decoding in libtasn1 before 4.4 allows remote attackers to have unspecified impact via unknown vectors.
",1.0,643.0,6.0,3.2348833084106445
177904,DoS," Based on the provided code for the `Splash::blitMask` function, I do not see any obvious vulnerabilities related to the steps you have outlined. However, there are still other vulnerabilities that could exist, such as integer overflows, race conditions, or insecure resource management, which were not specifically mentioned in your list.

The code appears to be initializing pipelines and iterating through the source bitmap data, applying the fill pattern to the destination image based on certain conditions. It does not seem to involve user input or dynamic memory allocation, which are common sources of vulnerabilities.

However, it is important to note that a thorough vulnerability assessment would require a more comprehensive analysis of the entire codebase and its dependencies. The code snippet provided may not be representative of the entire system and may not contain all vulnerabilities.

Therefore, my answer is 'NO', but with the caveat that a more thorough analysis would be required to ensure the absence of other vulnerabilities.","The code contains a DoS vulnerability. 
The CVE-ID is CVE-2013-1789. The CWE-ID is nan.
Vulnerability summary:
splash/Splash.cc in poppler before 0.22.1 allows context-dependent attackers to cause a denial of service (NULL pointer dereference and crash) via vectors related to the (1) Splash::arbitraryTransformMask, (2) Splash::blitMask, and (3) Splash::scaleMaskYuXu functions.
",2.0,817.0,6.0,1.6607377529144287
177905,DoS," Based on the given code, the function `Splash::arbitraryTransformMask` does not appear to be vulnerable to the specific vulnerabilities listed in the provided steps (Buffer Overflow, Use After Free, Memory Leaks, Integer Overflow/Underflow, Null Pointer Dereference, Improper Input Validation, Race Conditions, Insecure Function Usage, Insecure Resource Management, and Improper Error Handling). However, it does contain complex calculations and matrix transformations, so it's essential to ensure that the input data is valid and that the calculations are performed correctly to avoid potential issues.

The provided code snippet does not contain any obvious vulnerabilities related to the steps mentioned. However, it does call other functions like `imgCoordMungeLowerC`, `imgCoordMungeUpperC`, and `scaleMask`, which could potentially contain vulnerabilities. It's crucial to review those functions as well to ensure the overall codebase is secure.

Therefore, the answer is 'NO', but it's essential to remember that the entire codebase should be thoroughly reviewed to ensure its security.","The code contains a DoS vulnerability. 
The CVE-ID is CVE-2013-1789. The CWE-ID is nan.
Vulnerability summary:
splash/Splash.cc in poppler before 0.22.1 allows context-dependent attackers to cause a denial of service (NULL pointer dereference and crash) via vectors related to the (1) Splash::arbitraryTransformMask, (2) Splash::blitMask, and (3) Splash::scaleMaskYuXu functions.
",1.0,828.0,6.0,2.5651426315307617
177906,DoS Exec Code Overflow," Based on the provided code snippet, the `Splash::makeDashedPath` function does not appear to be directly vulnerable to the mentioned vulnerabilities (DoS, Exec, Code, Overflow) as it does not involve any user input, dynamic memory allocation, or string manipulation functions that could lead to these types of vulnerabilities. However, it is always important to keep in mind that vulnerabilities can exist in other parts of the codebase, and the `makeDashedPath` function could potentially be affected by them.

The second code snippet, `string oddString(vector<string>& words)`, is not related to the C++ code you initially provided, and it is not possible to determine its vulnerability status without a thorough analysis.

Therefore, the answer for the first code snippet is 'NO'.","The code contains a DoS_Exec_Code_Overflow vulnerability. 
The CVE-ID is CVE-2013-1788. The CWE-ID is CWE-119.
Vulnerability summary:
poppler before 0.22.1 allows context-dependent attackers to cause a denial of service (crash) and possibly execute arbitrary code via vectors that trigger an ""invalid memory access"" in (1) splash/Splash.cc, (2) poppler/Function.cc, and (3) poppler/Stream.cc.
",1.0,783.0,6.0,2.9711015224456787
177907,DoS Exec Code Overflow," Based on the given code, the `Splash::scaleMaskYuXd` function does not appear to be directly vulnerable to the mentioned vulnerabilities (DoS, Exec, Code, Overflow) as it does not involve any user input, dynamic memory allocation without proper bounds checking, or any insecure function usage. However, there are still potential vulnerabilities that could exist in the `(*src)(srcData, lineBuf)` call, which is not shown in the code snippet. It is essential to review the implementation of the `src` function to ensure proper input validation and bounds checking to prevent potential vulnerabilities.

Regarding the second code snippet, it is not related to the C++ code provided earlier and does not appear to be vulnerable to the mentioned vulnerabilities as it involves string manipulation using the C++ Standard Library and does not involve any dynamic memory allocation or user input.

Therefore, the answer is 'NO' for both code snippets.","The code contains a DoS_Exec_Code_Overflow vulnerability. 
The CVE-ID is CVE-2013-1788. The CWE-ID is CWE-119.
Vulnerability summary:
poppler before 0.22.1 allows context-dependent attackers to cause a denial of service (crash) and possibly execute arbitrary code via vectors that trigger an ""invalid memory access"" in (1) splash/Splash.cc, (2) poppler/Function.cc, and (3) poppler/Stream.cc.
",1.0,808.0,6.0,2.8124797344207764
177909,DoS Exec Code Overflow," Based on the given code, the `Splash::scaleMaskYdXu` function is not directly vulnerable to the mentioned vulnerabilities (DoS, Exec, Code, Overflow) in the provided context. However, it does contain potential memory management issues, such as memory leaks and uninitialized pointers. It's essential to ensure proper memory management and error handling in the function.

The second code snippet, `string oddString(vector<string>& words)`, is not related to the C++ code provided earlier and does not contain any apparent vulnerabilities. It appears to be a separate function that processes a vector of strings and returns the first odd-length string in the vector.","The code contains a DoS_Exec_Code_Overflow vulnerability. 
The CVE-ID is CVE-2013-1788. The CWE-ID is CWE-119.
Vulnerability summary:
poppler before 0.22.1 allows context-dependent attackers to cause a denial of service (crash) and possibly execute arbitrary code via vectors that trigger an ""invalid memory access"" in (1) splash/Splash.cc, (2) poppler/Function.cc, and (3) poppler/Stream.cc.
",2.0,755.0,6.0,2.6759629249572754
177910,DoS," Based on the provided code, the `token_continue` function does not appear to be directly related to the `oddString` function. The `oddString` function is defined below the `token_continue` function and does not seem to have any interaction with it. Therefore, the vulnerability of the `token_continue` function does not directly affect the `oddString` function.

However, without further context or information about the `gs_scan_handle_refill` function and its potential vulnerabilities, it is impossible to definitively say that the `token_continue` function is not vulnerable. The code snippet provided does not contain any obvious signs of a DoS vulnerability, but it is important to note that vulnerabilities can sometimes be hidden in complex control flow or in called functions.

Therefore, the answer is: NO, but with the caveat that the `token_continue` function may still be vulnerable, and a more thorough analysis of the `gs_scan_handle_refill` function is required to determine this.","The code contains a DoS vulnerability. 
The CVE-ID is CVE-2017-11714. The CWE-ID is CWE-125.
Vulnerability summary:
psi/ztoken.c in Artifex Ghostscript 9.21 mishandles references to the scanner state structure, which allows remote attackers to cause a denial of service (application crash) or possibly have unspecified other impact via a crafted PostScript document, related to an out-of-bounds read in the igc_reloc_struct_ptr function in psi/igc.c.
",1.0,828.0,6.0,2.7544565200805664
177911,Exec Code Overflow," Based on the given code snippet, the `tt_cmap10_validate` function does not appear to be directly vulnerable to integer overflows or any other security vulnerabilities mentioned in the provided list. The function is mainly responsible for validating the length and glyph indices of a CMAP table, and it checks the bounds of the table and validator limit before processing the data.

However, the `oddString` function you provided in the second code snippet is not related to the `tt_cmap10_validate` function, and it should be evaluated separately for potential vulnerabilities.

So, the answer for the `tt_cmap10_validate` function is 'NO'.","The code contains a Exec_Code_Overflow vulnerability. 
The CVE-ID is CVE-2009-0946. The CWE-ID is CWE-189.
Vulnerability summary:
Multiple integer overflows in FreeType 2.3.9 and earlier allow remote attackers to execute arbitrary code via vectors related to large values in certain inputs in (1) smooth/ftsmooth.c, (2) sfnt/ttcmap.c, and (3) cff/cffload.c.
",1.0,749.0,6.0,1.9508671760559082
177912,Exec Code Overflow," Based on the provided code snippet, the `tt_cmap12_validate` function itself does not appear to be vulnerable to the Exec_Code_Overflow vulnerability described in the given vulnerability summary. The code does not involve any arithmetic operations on user-supplied data or unchecked calculations that could lead to integer overflows or underflows.

However, the code does contain some potential issues that should be addressed:

1. The code does not check the return value of `TT_NEXT_ULONG` and `TT_NEXT_ULONG` functions, which could potentially lead to reading past the end of the table if these functions return an error or an incorrect value.
2. The code does not check the return value of the `TT_VALID_GLYPH_COUNT` function, which could potentially lead to an out-of-bounds condition if the function returns an incorrect value.
3. The code does not check the return value of the `FT_INVALID_TOO_SHORT` and `FT_INVALID_DATA` functions, which could potentially hide errors or make it difficult to diagnose issues.
4. The code does not use any synchronization mechanisms to protect against race conditions when accessing shared resources.
5. The code does not validate or sanitize user inputs, which could potentially lead to buffer overflows or injection attacks.

To mitigate these issues","The code contains a Exec_Code_Overflow vulnerability. 
The CVE-ID is CVE-2009-0946. The CWE-ID is CWE-189.
Vulnerability summary:
Multiple integer overflows in FreeType 2.3.9 and earlier allow remote attackers to execute arbitrary code via vectors related to large values in certain inputs in (1) smooth/ftsmooth.c, (2) sfnt/ttcmap.c, and (3) cff/cffload.c.
",2.0,876.0,6.0,5.182066202163696
177913,Exec Code Overflow," Based on the provided code snippet, the `tt_cmap8_validate` function does not appear to be directly vulnerable to integer overflows or buffer overflows. However, it does perform some bounds checking on input data, so if the input data is maliciously crafted, it could potentially lead to other vulnerabilities, such as invalid data or denial-of-service attacks.

The `oddString` function, on the other hand, is not related to the `tt_cmap8_validate` function and does not contain any apparent vulnerabilities.

Therefore, the answer is 'NO' for the `tt_cmap8_validate` function, and 'NO' with an explanation that the `oddString` function does not contain any apparent vulnerabilities.","The code contains a Exec_Code_Overflow vulnerability. 
The CVE-ID is CVE-2009-0946. The CWE-ID is CWE-189.
Vulnerability summary:
Multiple integer overflows in FreeType 2.3.9 and earlier allow remote attackers to execute arbitrary code via vectors related to large values in certain inputs in (1) smooth/ftsmooth.c, (2) sfnt/ttcmap.c, and (3) cff/cffload.c.
",1.0,764.0,6.0,3.2154958248138428
177915,Exec Code Overflow," Based on the provided code snippet, the function `cff_charset_load` itself does not appear to be vulnerable to the Exec_Code_Overflow vulnerability described in the given vulnerability summary. The code does not involve any integer overflows or unchecked arithmetic operations that could lead to such an issue.

However, the code does contain other potential vulnerabilities, such as buffer overflows in the `FT_FRAME_ENTER` and `FT_FRAME_EXIT` functions, which are not handled in the given code snippet. It is essential to ensure proper bounds checking and input validation when using these functions to prevent potential vulnerabilities.

Therefore, the answer is 'NO' for the Exec_Code_Overflow vulnerability in the given code snippet, but it is crucial to address other potential vulnerabilities in the code.","The code contains a Exec_Code_Overflow vulnerability. 
The CVE-ID is CVE-2009-0946. The CWE-ID is CWE-189.
Vulnerability summary:
Multiple integer overflows in FreeType 2.3.9 and earlier allow remote attackers to execute arbitrary code via vectors related to large values in certain inputs in (1) smooth/ftsmooth.c, (2) sfnt/ttcmap.c, and (3) cff/cffload.c.
",2.0,769.0,6.0,1.6745123863220215
177917,Exec Code," Based on the provided code, the XGetFontPath function does not appear to be directly vulnerable to the Exec_Code vulnerability described in the given CVE. The function is primarily concerned with allocating memory for and unpacking a list of strings received over a network connection. However, it does use the _XReadPad function to read data from the display, which could potentially be malicious if the data is not properly validated or sanitized. To mitigate this risk, it is recommended to ensure that all input data is properly validated and sanitized before being processed by the function. Additionally, the use of _XEatDataWords and _XReply functions should be examined to ensure they are being used correctly and securely.

Therefore, the answer is:

NO (but with conditions)

The code may still be vulnerable if the data read by _XReadPad is not properly validated or sanitized. To mitigate this risk, it is recommended to ensure that all input data is properly validated and sanitized before being processed by the function. Additionally, the use of _XEatDataWords and _XReply functions should be examined to ensure they are being used correctly and securely.","The code contains a Exec_Code vulnerability. 
The CVE-ID is CVE-2018-14600. The CWE-ID is CWE-787.
Vulnerability summary:
An issue was discovered in libX11 through 1.6.5. The function XListExtensions in ListExt.c interprets a variable as signed instead of unsigned, resulting in an out-of-bounds write (of up to 128 bytes), leading to DoS or remote code execution.
",2.0,842.0,6.0,2.413156270980835
177918,Exec Code," The given C++ code for the function `XListExtensions` is not directly related to the `oddString` function you provided. However, based on the analysis of the `XListExtensions` function provided earlier, it is vulnerable to a buffer overflow issue. The code does not properly check the length of the data being read and can write past the allocated memory, leading to a potential buffer overflow.

Therefore, the answer is: 'YES', it is vulnerable to a buffer overflow issue.","The code contains a Exec_Code vulnerability. 
The CVE-ID is CVE-2018-14600. The CWE-ID is CWE-787.
Vulnerability summary:
An issue was discovered in libX11 through 1.6.5. The function XListExtensions in ListExt.c interprets a variable as signed instead of unsigned, resulting in an out-of-bounds write (of up to 128 bytes), leading to DoS or remote code execution.
",3.0,720.0,6.0,1.1235477924346924
177919,," Based on the provided code, the vulnerability audit focuses on detecting security vulnerabilities in C++ code. The given code does not contain any apparent buffer overflow, use-after-free, memory leak, integer overflow/underflow, null pointer dereference, improper input validation, race condition, insecure function usage, improper resource management, or error handling issues. However, there is an additional function `string oddString(vector<string>& words)` defined at the end of the code, which is not related to the `XListFonts` function. This function seems to be using standard C++ library functions and does not contain any apparent vulnerabilities.

Therefore, the answer is 'NO'. The given code is not vulnerable to the mentioned security vulnerabilities.","The code contains a nan vulnerability. 
The CVE-ID is CVE-2018-14599. The CWE-ID is CWE-682.
Vulnerability summary:
An issue was discovered in libX11 through 1.6.5. The function XListExtensions in ListExt.c is vulnerable to an off-by-one error caused by malicious server responses, leading to DoS or possibly unspecified other impact.
",1.0,746.0,6.0,2.1628217697143555
177920,," Based on the provided code, the `XGetFontPath` function is not directly vulnerable to the nan vulnerability described in the given vulnerability summary. The code appears to be handling the response from the server correctly, by checking the `rep.nPaths` value and allocating memory accordingly. However, there are other potential vulnerabilities in the code, such as buffer overflows or use-after-free errors, which should be checked as per the steps outlined in the question.","The code contains a nan vulnerability. 
The CVE-ID is CVE-2018-14599. The CWE-ID is CWE-682.
Vulnerability summary:
An issue was discovered in libX11 through 1.6.5. The function XListExtensions in ListExt.c is vulnerable to an off-by-one error caused by malicious server responses, leading to DoS or possibly unspecified other impact.
",2.0,693.0,6.0,2.2989768981933594
177921,," The second code snippet provided is not related to the first vulnerability discussed. It appears to be a separate function written in C++, which is not related to the X11 library or the XListExtensions function.

Therefore, I cannot determine if this code is vulnerable or not without additional context.

Answer: NO.","The code contains a nan vulnerability. 
The CVE-ID is CVE-2018-14599. The CWE-ID is CWE-682.
Vulnerability summary:
An issue was discovered in libX11 through 1.6.5. The function XListExtensions in ListExt.c is vulnerable to an off-by-one error caused by malicious server responses, leading to DoS or possibly unspecified other impact.
",1.0,663.0,6.0,2.7739133834838867
177922,Exec Code Overflow," Yes, the `add_param_to_argv` function is vulnerable to a buffer overflow. The `param_buffer` array has a fixed size of 1024, but there is no check on the length of the parameter being parsed. If a large enough input is provided, it can cause the buffer to overflow, leading to arbitrary code execution or a crash.","The code contains a Exec_Code_Overflow vulnerability. 
The CVE-ID is CVE-2019-11360. The CWE-ID is CWE-119.
Vulnerability summary:
A buffer overflow in iptables-restore in netfilter iptables 1.8.2 allows an attacker to (at least) crash the program or potentially gain code execution via a specially crafted iptables-save file. This is related to add_param_to_argv in xshared.c.
",3.0,686.0,6.0,3.008202075958252
177923,Bypass," The given C++ code does not appear to be directly related to the PHP code provided earlier and does not involve any file handling or user input processing, which are common sources of vulnerabilities. Therefore, it is unlikely to be vulnerable based on the information provided.

However, it is essential to note that the code snippet you've shared is incomplete and does not represent a standalone program. It is a function definition named 'oddString' that takes a vector of strings as an argument. Without understanding the context and the rest of the code, it is impossible to make a definitive statement about its vulnerabilities.

In summary, based on the given information, the C++ code does not seem vulnerable.","The code contains a Bypass vulnerability. 
The CVE-ID is CVE-2015-2348. The CWE-ID is CWE-264.
Vulnerability summary:
The move_uploaded_file implementation in ext/standard/basic_functions.c in PHP before 5.4.39, 5.5.x before 5.5.23, and 5.6.x before 5.6.7 truncates a pathname upon encountering a \x00 character, which allows remote attackers to bypass intended extension restrictions and create files with unexpected names via a crafted second argument.  NOTE: this vulnerability exists because of an incomplete fix for CVE-2006-7243.
",1.0,798.0,6.0,1.3348922729492188
177926,Exec Code Overflow," Based on the provided code snippet, the `gst_vorbis_tag_add_coverart` function is not directly vulnerable to the mentioned vulnerabilities (Buffer Overflow, Use After Free, Memory Leaks, Integer Overflow/Underflow, Null Pointer Dereference, Improper Input Validation, Race Conditions, Insecure Function Usage, Insecure Resource Management, or Improper Error Handling).

However, the code does contain some potential issues:

1. The function does not check the return value of `g_base64_decode_step` and `gst_tag_image_data_to_image_buffer`. If these functions fail, the code continues execution, which could lead to unexpected behavior.
2. The function does not validate the input `base64_len` and `img_data_base64`. If these inputs are malicious, they could potentially cause issues.
3. The function does not check the return value of `gst_tag_list_add`. If this function fails, the code continues execution, which could lead to memory leaks or other issues.

It is recommended to add error checking and input validation to the function to mitigate potential risks.

Regarding the second code snippet, it is not related to the vulnerability audit and does not contain any C++ code. Therefore, it is not applicable to the current question.","The code contains a Exec_Code_Overflow vulnerability. 
The CVE-ID is CVE-2009-0586. The CWE-ID is CWE-189.
Vulnerability summary:
Integer overflow in the gst_vorbis_tag_add_coverart function (gst-libs/gst/tag/gstvorbistag.c) in vorbistag in gst-plugins-base (aka gstreamer-plugins-base) before 0.10.23 in GStreamer allows context-dependent attackers to execute arbitrary code via a crafted COVERART tag that is converted from a base64 representation, which triggers a heap-based buffer overflow.
",2.0,895.0,6.0,2.3118112087249756
