case_id,vuln_type,audit_report,gt,eval_score,eval_input_token_num,eval_output_token_num,eval_inference_time
177783,DoS Exec Code Overflow," Based on the given code, the `GfxImageColorMap::getRGBLine` function does not appear to be directly vulnerable to the mentioned vulnerabilities (DoS, Exec, Code, Overflow) as it does not involve user input, dynamic memory allocation without proper bounds checking, or the use of insecure functions. However, it does contain nested loops and complex logic, so it's essential to ensure that the `byte_lookup` array and `nComps` and `nComps2` variables are properly initialized and bounded to prevent potential integer overflows or underflows. Additionally, the `colorSpace` and `colorSpace2` pointers should be checked for null before being dereferenced.

The second code snippet, `oddString` function, is not related to the C++ code provided in the initial question, so it doesn't directly answer the question. However, it seems to be using `unordered_map` and `vector` data structures, so it's essential to ensure that the input data is properly validated and the data structures are used correctly to prevent potential vulnerabilities.

In summary, the `GfxImageColorMap::getRGBLine` function is not vulnerable to the mentioned vulnerabilities based on the given code, but it's essential to ensure proper bounds checking and input validation to prevent potential integer overflows or underflows and null pointer dereferencing. The","The code contains a DoS_Exec_Code_Overflow vulnerability. 
The CVE-ID is CVE-2009-3605. The CWE-ID is CWE-189.
Vulnerability summary:
Multiple integer overflows in Poppler 0.10.5 and earlier allow remote attackers to cause a denial of service (application crash) or possibly execute arbitrary code via a crafted PDF file, related to (1) glib/poppler-page.cc; (2) ArthurOutputDev.cc, (3) CairoOutputDev.cc, (4) GfxState.cc, (5) JBIG2Stream.cc, (6) PSOutputDev.cc, and (7) SplashOutputDev.cc in poppler/; and (8) SplashBitmap.cc, (9) Splash.cc, and (10) SplashFTFont.cc in splash/.  NOTE: this may overlap CVE-2009-0791.
",2.0,975.0,6.0,3.1045520305633545
177786,DoS Exec Code Overflow," Yes, the code is vulnerable to integer overflows. The vulnerability lies in the calculation of 'n' in the switch statement, where it is set to 1 << colorMap->getBits(). If the value of colorMap->getBits() is not checked for validity or is larger than the maximum representable value for an int, an integer overflow will occur, leading to undefined behavior and potential vulnerabilities such as DoS, Exec, or Code injection.","The code contains a DoS_Exec_Code_Overflow vulnerability. 
The CVE-ID is CVE-2009-3605. The CWE-ID is CWE-189.
Vulnerability summary:
Multiple integer overflows in Poppler 0.10.5 and earlier allow remote attackers to cause a denial of service (application crash) or possibly execute arbitrary code via a crafted PDF file, related to (1) glib/poppler-page.cc; (2) ArthurOutputDev.cc, (3) CairoOutputDev.cc, (4) GfxState.cc, (5) JBIG2Stream.cc, (6) PSOutputDev.cc, and (7) SplashOutputDev.cc in poppler/; and (8) SplashBitmap.cc, (9) Splash.cc, and (10) SplashFTFont.cc in splash/.  NOTE: this may overlap CVE-2009-0791.
",4.0,796.0,6.0,2.1551361083984375
177787,DoS Exec Code Overflow," Based on the given code, it appears that the provided code snippet is not directly related to the vulnerability described in the CVE-ID CVE-2009-3605 and CWE-ID CWE-189. The code snippet is a method definition for a class named SplashOutputDev, which seems to be handling image drawing operations. It does not contain any obvious buffer overflow or integer overflow vulnerabilities.

Therefore, the answer is 'NO'. The code snippet is not vulnerable to the described DoS, Exec, Code, Overflow vulnerability.","The code contains a DoS_Exec_Code_Overflow vulnerability. 
The CVE-ID is CVE-2009-3605. The CWE-ID is CWE-189.
Vulnerability summary:
Multiple integer overflows in Poppler 0.10.5 and earlier allow remote attackers to cause a denial of service (application crash) or possibly execute arbitrary code via a crafted PDF file, related to (1) glib/poppler-page.cc; (2) ArthurOutputDev.cc, (3) CairoOutputDev.cc, (4) GfxState.cc, (5) JBIG2Stream.cc, (6) PSOutputDev.cc, and (7) SplashOutputDev.cc in poppler/; and (8) SplashBitmap.cc, (9) Splash.cc, and (10) SplashFTFont.cc in splash/.  NOTE: this may overlap CVE-2009-0791.
",1.0,809.0,6.0,4.2303831577301025
177788,DoS Exec Code Overflow," Yes, the code is vulnerable to integer overflows. The vulnerability lies in the calculation of 'n' in the following line: 'n = 1 << maskColorMap->getBits();'. This calculation can lead to an integer overflow if the number of bits in the color map is larger than the maximum representable value for an integer. This can result in unexpected behavior, including crashes or potential code execution.","The code contains a DoS_Exec_Code_Overflow vulnerability. 
The CVE-ID is CVE-2009-3605. The CWE-ID is CWE-189.
Vulnerability summary:
Multiple integer overflows in Poppler 0.10.5 and earlier allow remote attackers to cause a denial of service (application crash) or possibly execute arbitrary code via a crafted PDF file, related to (1) glib/poppler-page.cc; (2) ArthurOutputDev.cc, (3) CairoOutputDev.cc, (4) GfxState.cc, (5) JBIG2Stream.cc, (6) PSOutputDev.cc, and (7) SplashOutputDev.cc in poppler/; and (8) SplashBitmap.cc, (9) Splash.cc, and (10) SplashFTFont.cc in splash/.  NOTE: this may overlap CVE-2009-0791.
",3.0,787.0,6.0,2.1210708618164062
177789,DoS Exec Code Overflow," Based on the provided code, the Poppler code is not directly vulnerable to the integer overflow vulnerability described in the CVE-2009-3605. The code snippet you've shared does not involve any arithmetic operations with user input or unchecked calculations that could lead to integer overflows.

However, it's essential to note that the code might still be vulnerable to other types of vulnerabilities, such as buffer overflows, use-after-free errors, or race conditions, as mentioned in the initial list. The code snippet provided does not exhibit these vulnerabilities, but it's crucial to consider the entire context of the application and the libraries it uses to ensure its security.

The second code snippet you've shared is not related to the Poppler code and does not appear to be vulnerable to any of the mentioned vulnerabilities. It's a custom function that processes a vector of strings and returns the first odd string based on specific conditions. This function does not involve any memory management, arithmetic operations, or user input, so it's not vulnerable to the mentioned vulnerabilities.","The code contains a DoS_Exec_Code_Overflow vulnerability. 
The CVE-ID is CVE-2009-3605. The CWE-ID is CWE-189.
Vulnerability summary:
Multiple integer overflows in Poppler 0.10.5 and earlier allow remote attackers to cause a denial of service (application crash) or possibly execute arbitrary code via a crafted PDF file, related to (1) glib/poppler-page.cc; (2) ArthurOutputDev.cc, (3) CairoOutputDev.cc, (4) GfxState.cc, (5) JBIG2Stream.cc, (6) PSOutputDev.cc, and (7) SplashOutputDev.cc in poppler/; and (8) SplashBitmap.cc, (9) Splash.cc, and (10) SplashFTFont.cc in splash/.  NOTE: this may overlap CVE-2009-0791.
",1.0,906.0,6.0,3.8662195205688477
177792,DoS Exec Code Overflow," Based on the given code, the SplashBitmap constructor is not directly vulnerable to the mentioned integer overflow vulnerability (CVE-2009-3605). However, the code may still be vulnerable to other types of vulnerabilities, such as buffer overflows, use-after-free errors, or memory leaks, as mentioned in the initial list. The oddString function, on the other hand, is not related to the SplashBitmap constructor and does not appear to contain any obvious vulnerabilities.","The code contains a DoS_Exec_Code_Overflow vulnerability. 
The CVE-ID is CVE-2009-3605. The CWE-ID is CWE-189.
Vulnerability summary:
Multiple integer overflows in Poppler 0.10.5 and earlier allow remote attackers to cause a denial of service (application crash) or possibly execute arbitrary code via a crafted PDF file, related to (1) glib/poppler-page.cc; (2) ArthurOutputDev.cc, (3) CairoOutputDev.cc, (4) GfxState.cc, (5) JBIG2Stream.cc, (6) PSOutputDev.cc, and (7) SplashOutputDev.cc in poppler/; and (8) SplashBitmap.cc, (9) Splash.cc, and (10) SplashFTFont.cc in splash/.  NOTE: this may overlap CVE-2009-0791.
",2.0,798.0,6.0,2.5536611080169678
177793,DoS Exec Code Overflow," Based on the given code, the SplashFTFont::makeGlyph function does not appear to contain any obvious buffer overflow, use-after-free, memory leak, or integer overflow vulnerabilities. However, it does call other functions that could potentially contain such vulnerabilities, such as FT_Load_Glyph and FT_Render_Glyph. Therefore, it is essential to review those functions' implementations as well.

Additionally, the oddString function in the provided code snippet is not related to the SplashFTFont::makeGlyph function and does not seem to have any apparent vulnerabilities.

So, the answer is:

For SplashFTFont::makeGlyph: NO
For oddString: NO.","The code contains a DoS_Exec_Code_Overflow vulnerability. 
The CVE-ID is CVE-2009-3605. The CWE-ID is CWE-189.
Vulnerability summary:
Multiple integer overflows in Poppler 0.10.5 and earlier allow remote attackers to cause a denial of service (application crash) or possibly execute arbitrary code via a crafted PDF file, related to (1) glib/poppler-page.cc; (2) ArthurOutputDev.cc, (3) CairoOutputDev.cc, (4) GfxState.cc, (5) JBIG2Stream.cc, (6) PSOutputDev.cc, and (7) SplashOutputDev.cc in poppler/; and (8) SplashBitmap.cc, (9) Splash.cc, and (10) SplashFTFont.cc in splash/.  NOTE: this may overlap CVE-2009-0791.
",1.0,835.0,6.0,2.460284471511841
177794,," Based on the provided code snippet, the DynamicMetadataProvider constructor does not contain any obvious buffer overflow, use-after-free, memory leak, integer overflow/underflow, null pointer dereference, or sensitive data exposure vulnerabilities. However, it does contain some other potential issues:

1. Improper Input Validation: The code does not validate the input 'e' for null before calling e->getAttributeNS(). This could potentially lead to a null pointer dereference if 'e' is null.

2. Insecure Resource Management: The code creates and starts a new thread without checking if the thread creation was successful. If the thread creation fails, the cleanup_thread pointer will still be set, potentially leading to a memory leak or other issues.

3. Insecure Function Usage: The code uses the deprecated 'auto_ptr_char' type instead of the recommended'std::string' or'std::vector<char>' types. This could potentially lead to issues with memory management and buffer overflows.

4. Race Conditions: The code creates and starts a new thread without any synchronization mechanisms to prevent concurrent access to shared resources. This could potentially lead to race conditions and inconsistent program states.

5. Cryptographic Issues: The code does not contain any obvious cryptographic functions or sensitive data handling, but it is still important to ensure that any cryptographic functions used elsewhere in the code","The code contains a nan vulnerability. 
The CVE-ID is CVE-2017-16853. The CWE-ID is CWE-347.
Vulnerability summary:
The DynamicMetadataProvider class in saml/saml2/metadata/impl/DynamicMetadataProvider.cpp in OpenSAML-C in OpenSAML before 2.6.1 fails to properly configure itself with the MetadataFilter plugins and does not perform critical security checks such as signature verification, enforcement of validity periods, and other checks specific to deployments, aka CPPOST-105.
",2.0,902.0,6.0,3.2119736671447754
177795,," Based on the provided code, the `DynamicMetadataProvider` constructor is not directly vulnerable to the mentioned vulnerabilities (Buffer Overflow, Use After Free, Memory Leaks, Integer Overflow/Underflow, Null Pointer Dereference, Improper Input Validation, Race Conditions, Insecure Function Usage, Insecure Resource Management, Improper Error Handling, Cryptographic Issues, or Sensitive Data Exposure).

However, the code does contain a separate function `oddString(vector<string>& words)` which is not shown in the constructor. It would be necessary to evaluate this function separately for potential vulnerabilities.

The constructor itself appears to be focused on parsing and initializing class variables based on XML input, and does not contain any obvious vulnerabilities.","The code contains a nan vulnerability. 
The CVE-ID is CVE-2017-16852. The CWE-ID is CWE-347.
Vulnerability summary:
shibsp/metadata/DynamicMetadataProvider.cpp in the Dynamic MetadataProvider plugin in Shibboleth Service Provider before 2.6.1 fails to properly configure itself with the MetadataFilter plugins and does not perform critical security checks such as signature verification, enforcement of validity periods, and other checks specific to deployments, aka SSPCPP-763.
",1.0,763.0,6.0,2.103166341781616
177796,Overflow," The second code snippet provided is not related to the first one and is written in C++11. It appears to be a function called `oddString` that takes a vector of strings as an argument and returns the first odd string based on some condition. This code does not involve any memory handling or network communication, so it is not vulnerable to the types of issues mentioned in the initial vulnerability audit.

Therefore, the answer is 'NO'.","The code contains a Overflow vulnerability. 
The CVE-ID is CVE-2019-15938. The CWE-ID is CWE-119.
Vulnerability summary:
Pengutronix barebox through 2019.08.1 has a remote buffer overflow in nfs_readlink_req in fs/nfs.c because a length field is directly used for a memcpy.
",1.0,682.0,6.0,2.3453550338745117
177799,Overflow," The given C++ code for _XcursorReadImage function is not directly vulnerable to integer overflow as the code snippet provided does not involve any arithmetic operations on user inputs or unchecked calculations. However, the code does contain checks for width and height values that, if not properly sanitized, could lead to buffer overflows if the values are larger than expected. Therefore, it is essential to ensure proper input validation is implemented to prevent malicious inputs from causing buffer overflows.

In summary, the code itself is not vulnerable to integer overflow, but it is crucial to validate user inputs to prevent potential buffer overflow vulnerabilities.","The code contains a Overflow vulnerability. 
The CVE-ID is CVE-2017-16612. The CWE-ID is CWE-190.
Vulnerability summary:
libXcursor before 1.1.15 has various integer overflows that could lead to heap buffer overflows when processing malicious cursors, e.g., with programs like GIMP. It is also possible that an attack vector exists against the related code in cursor/xcursor.c in Wayland through 1.14.0.
",2.0,741.0,6.0,2.177497148513794
177807,Bypass," Based on the provided code snippet, the function `znumicc_components` does not appear to be directly vulnerable to the mentioned vulnerabilities (Buffer Overflow, Use After Free, Memory Leaks, Integer Overflow/Underflow, Null Pointer Dereference, Improper Input Validation, Race Conditions, Insecure Function Usage, Insecure Resource Management, Improper Error Handling, Cryptographic Issues, or Sensitive Data Exposure).

However, it does call other functions like `check_type`, `check_dict_read`, `dict_find_string`, and `gsicc_get_profile_handle_buffer` which could potentially have vulnerabilities. It is essential to review those functions as well to ensure the overall codebase is secure.

The `oddString` function provided at the end of the code snippet is not related to the `znumicc_components` function and does not appear to have any security vulnerabilities.","The code contains a Bypass vulnerability. 
The CVE-ID is CVE-2018-19476. The CWE-ID is CWE-704.
Vulnerability summary:
psi/zicc.c in Artifex Ghostscript before 9.26 allows remote attackers to bypass intended access restrictions because of a setcolorspace type confusion.
",2.0,758.0,6.0,2.1836938858032227
177809,Bypass," The given `restore_page_device` function is not directly related to the `oddString` function provided. However, I will evaluate the `restore_page_device` function for vulnerabilities based on the provided code.

YES, the `restore_page_device` function is vulnerable to a stack overflow attack. The code checks the stack space before executing the `%grestorepagedevice` PostScript command, but it does not check if the required stack space is available for the current call stack. An attacker could exploit this vulnerability by providing crafted input that causes the stack to overflow before the check is performed. This could lead to arbitrary code execution or a denial-of-service condition.","The code contains a Bypass vulnerability. 
The CVE-ID is CVE-2018-19475. The CWE-ID is nan.
Vulnerability summary:
psi/zdevice2.c in Artifex Ghostscript before 9.26 allows remote attackers to bypass intended access restrictions because available stack space is not checked when the device remains the same.
",2.0,722.0,6.0,1.787691354751587
177811,DoS," The provided C++ code for the function `aspath_put` is vulnerable. The vulnerability is related to a Denial of Service (DoS) issue, where long AS_PATH segments can cause an invalid message to be constructed, leading to session drops. The code calculates the size of the AS_PATH segments incorrectly, counting certain bytes twice. This issue is documented in CVE-2017-16227 with a CWE-ID of CWE-20.","The code contains a DoS vulnerability. 
The CVE-ID is CVE-2017-16227. The CWE-ID is CWE-20.
Vulnerability summary:
The aspath_put function in bgpd/bgp_aspath.c in Quagga before 1.2.2 allows remote attackers to cause a denial of service (session drop) via BGP UPDATE messages, because AS_PATH size calculation for long paths counts certain bytes twice and consequently constructs an invalid message.
",3.0,712.0,6.0,1.0837664604187012
177812,Bypass," Based on the provided code snippet, the sum_update function does not appear to be directly vulnerable to the mentioned vulnerabilities in the list. However, it does contain some complex logic and memory handling, so it's essential to ensure that the functions called within it, such as md5_update and mdfour_update, are implemented securely.

The oddString function, on the other hand, is not related to the sum_update function or the C++ security vulnerabilities mentioned in the list. It appears to be a separate function that processes a vector of strings and returns the first odd-length substring that appears more than once in the vector. This function does not contain any apparent security vulnerabilities based on the given code.

Therefore, the answer is:

sum_update: NO
oddString: NO","The code contains a Bypass vulnerability. 
The CVE-ID is CVE-2017-15994. The CWE-ID is CWE-354.
Vulnerability summary:
rsync 3.1.3-development before 2017-10-24 mishandles archaic checksums, which makes it easier for remote attackers to bypass intended access restrictions. NOTE: the rsync development branch has significant use beyond the rsync developers, e.g., the code has been copied for use in various GitHub projects.
",1.0,778.0,6.0,2.7470831871032715
177815,Bypass," The given C++ code for `file_checksum` function is not directly related to the `oddString` function you provided. Therefore, I cannot determine if the `oddString` function is vulnerable based on the provided code.

Regarding the `file_checksum` function, it appears to be responsible for computing file checksums using MD5 or MD4 algorithms. Based on the given code, it does not seem to have any obvious vulnerabilities related to buffer overflow, use-after-free, memory leaks, integer overflow/underflow, null pointer dereference, improper input validation, race conditions, insecure function usage, insecure resource management, or improper error handling. However, it does call `md5_update` and `mdfour_update` with the remaining data when the file size is not a multiple of the chunk size. This behavior might not be ideal, but it does not seem to be a vulnerability on its own.

The vulnerability mentioned in the provided context (CVE-2017-15994) is related to rsync, not the given C++ code. The vulnerability in rsync is caused by mishandling archaic checksums, which makes it easier for remote attackers to bypass intended access restrictions. The given C++ code does not exhibit this behavior.

Therefore, my answer is 'NO'. The `file_","The code contains a Bypass vulnerability. 
The CVE-ID is CVE-2017-15994. The CWE-ID is CWE-354.
Vulnerability summary:
rsync 3.1.3-development before 2017-10-24 mishandles archaic checksums, which makes it easier for remote attackers to bypass intended access restrictions. NOTE: the rsync development branch has significant use beyond the rsync developers, e.g., the code has been copied for use in various GitHub projects.
",1.0,889.0,6.0,3.372304916381836
177816,Bypass," The provided C++ code for the `get_checksum2` function is not directly related to the `oddString` function you also included in the question. I'll focus on the `get_checksum2` function.

The `get_checksum2` function appears to be implementing checksum algorithms (MD5 and MD4) for a given input buffer. Based on the given code, it does not seem to have any obvious vulnerabilities related to the steps you've outlined in your question. However, there are still some potential issues that should be considered:

1. The code does not check the return values of `md5_begin`, `mdfour_begin`, `md5_update`, `mdfour_update`, and `md5_result`/`mdfour_result`. If these functions fail, the program may continue executing, potentially leading to unexpected behavior or data corruption.
2. The `buf1` pointer is allocated dynamically and its memory is not freed when it is no longer needed. This can lead to memory leaks and potential performance issues.
3. The `len1` variable is a static integer that is updated each time the function is called with a larger length than the previous call. This can lead to integer overflows or underflows if the input length is not carefully checked.
4. The `mdfour_update` function is called even when there are no","The code contains a Bypass vulnerability. 
The CVE-ID is CVE-2017-15994. The CWE-ID is CWE-354.
Vulnerability summary:
rsync 3.1.3-development before 2017-10-24 mishandles archaic checksums, which makes it easier for remote attackers to bypass intended access restrictions. NOTE: the rsync development branch has significant use beyond the rsync developers, e.g., the code has been copied for use in various GitHub projects.
",2.0,894.0,6.0,2.4569387435913086
177821,DoS," The given C++ code for the `IRCView::openTags` function does not appear to be directly vulnerable to the mentioned vulnerabilities in the provided list. However, the `oddString` function defined below the `openTags` function might have its own vulnerabilities, which are not addressed in the provided analysis.

The `openTags` function is responsible for generating HTML tags based on the given data. It checks the `openHtmlTags` vector and generates the corresponding HTML tags accordingly. The function does not involve any user input or memory management, so it is not directly vulnerable to buffer overflows, use-after-free errors, memory leaks, or integer overflows.

The `oddString` function, on the other hand, takes a vector of strings as an argument and returns the first string that matches a specific condition. The condition is based on the length of the substrings within the strings and the presence of specific characters. This function might be vulnerable to various issues, such as:

1. Integer overflows or underflows if the string lengths are not validated or checked properly.
2. Out-of-bounds access if the indexing logic is not correct.
3. Race conditions if the function is called concurrently from multiple threads.
4. Improper input validation if the input vector is not properly checked or sanitized.

To thoroughly evaluate the vulnerabilities of the `odd","The code contains a DoS vulnerability. 
The CVE-ID is CVE-2017-15923. The CWE-ID is nan.
Vulnerability summary:
Konversation 1.4.x, 1.5.x, 1.6.x, and 1.7.x before 1.7.3 allow remote attackers to cause a denial of service (crash) via vectors related to parsing of IRC color formatting codes.
",2.0,881.0,6.0,3.103595018386841
