case_id,vuln_type,audit_report,input_token_num,output_token_num,inference_time
177912,Exec Code Overflow," NO, the provided code is not vulnerable to the Exec Code Overflow (CVE-2009-0946) or CWE-189. The code you provided is a separate function called `dieSimulator` which is not related to the previous `tt_cmap12_validate` function. The new function does not have any obvious vulnerabilities like buffer overflows, use-after-free, or memory leaks based on the provided code. However, it is always important to thoroughly test and audit any code before deployment.",1491,119,12.587117910385132
177913,Exec Code Overflow," Answer:

NO.

The function tt_cmap8_validate doesn't show any clear signs of the Exec Code Overflow vulnerability mentioned in CVE-2009-0946. The code performs several checks to validate the input data and doesn't use any unsafe functions that could lead to the mentioned vulnerability. However, it is essential to thoroughly check other functions in the codebase to ensure there are no similar issues.

Regarding the dieSimulator function, it is not related to the original question and doesn't contain any of the mentioned vulnerabilities in the given code snippet. However, it is always a good practice to validate input parameters and ensure proper resource management.",2493,152,15.864055871963501
177915,Exec Code Overflow," NO, this code is not vulnerable to the same type of Exec Code Overflow vulnerability as the previous code. The potential integer overflow vulnerabilities present in the original code have been addressed in this version.",2073,43,5.180222749710083
177917,Exec Code," NO, the provided `dieSimulator` function is not vulnerable to the mentioned vulnerabilities. It is a separate function that does not contain any memory management or user input handling. It only performs calculations and array indexing, which are safe in this context.",1816,53,5.849324703216553
177918,Exec Code," NO, the second code snippet is not vulnerable to the same issue as the first one. The second code snippet does not contain the function XListExtensions, and it does not have the integer sign confusion issue that was present in the first code snippet. However, the second code snippet does have its own vulnerabilities, such as potential integer overflows in the `dieSimulator` function when calculating the `total` variable.",1866,92,9.783418655395508
177919,nan," NO, this code is not vulnerable to the specific vulnerability described (CVE-2018-14599, CWE-682). The vulnerability in the original code was due to an off-by-one error caused by malicious server responses, leading to a denial-of-service (DoS) or possibly unspecified other impact in the `XListExtensions` function in `ListExt.c`. The provided code is the `XListFonts` function, which is a different function, and there is no off-by-one error in the provided code.

However, the provided code still has some potential issues that should be addressed:

1. Memory allocation failure: In the `XListFonts` function, there is no proper error handling when allocating memory for `flist` and `ch`. If the memory allocation fails, the code should handle this gracefully and return an appropriate error message.

2. Integer overflow: In the `dieSimulator` function, there is a possibility of integer overflow when calculating `total`. To avoid this, you can use a wider integer type or a library that supports arbitrary-precision arithmetic.

3. Code organization: The `dieSimulator` function is included in the `XListFonts` function, which is not a good practice. It is recommended to separate unrelated code into different functions or",2411,301,29.762897729873657
177920,nan," NO, the provided `dieSimulator` function is not vulnerable to the nan vulnerability or any of the other vulnerabilities mentioned in the audit steps. It is a separate function that does not contain any network communication or dynamic memory allocation, so it does not contain any vulnerabilities related to buffer overflows, use-after-free errors, memory leaks, or race conditions. It does not contain any insecure function usage, improper error handling, or cryptographic issues. The function does not handle any sensitive data, so there is no risk of sensitive data exposure.

The function does contain some potential issues related to integer overflow/underflow and improper input validation, but these are not related to the nan vulnerability. The function uses a `MOD` constant of `1e9 + 7` for integer calculations, which could potentially overflow if the input values are too large. However, this is not a security vulnerability, as it would simply result in incorrect calculation results. The function does not contain any explicit input validation, but it is not clear from the provided code whether input validation is required or has been performed elsewhere.

In summary, the `dieSimulator` function is not vulnerable to the nan vulnerability or any of the other vulnerabilities mentioned in the audit steps. However, it does contain some potential issues related to integer overflow/underflow and improper input validation, which should be reviewed and addressed as necessary.",1801,297,30.38563823699951
177921,nan," NO.

The provided C++ code does not contain any of the vulnerabilities listed in the audit guidelines. It is a function for simulating dice rolls and handling modular arithmetic, and there are no security issues related to memory management, input validation, error handling, or cryptography in the code.",1885,65,7.344753980636597
177922,Exec Code Overflow," NO, the provided code is not vulnerable to the Exec Code Overflow vulnerability described. The `add_param_to_argv` function in the given code is similar to the vulnerable function in the description, but the provided code does not contain the same vulnerability.

However, there is a potential buffer overflow in the line:

`if (param_len >= sizeof(param_buffer))`

It should be:

`if (param_len >= sizeof(param_buffer) - 1)`

to leave room for the null terminator.

Additionally, the `add_argv` function might introduce vulnerabilities if it does not properly validate or sanitize the `param_buffer`. It is essential to review the `add_argv` function and other related code to ensure the overall security of the application.",2250,180,17.852153539657593
177923,Bypass," NO.

The provided C++ code is not vulnerable to the same issue as the original move\_uploaded\_file function. This code does not contain any file manipulation based on user input, so it cannot be bypassed or exploited in the same way. The vulnerability in the original function was due to the truncation of a pathname upon encountering a \x00 character, but this new code does not contain any equivalent behavior.",1854,95,10.768555641174316
177926,Exec Code Overflow," NO, the provided code is not vulnerable to the Exec Code Overflow vulnerability described. The code is a different function that does not contain any integer operations on user-supplied input related to memory allocation or buffer handling, which were the cause of the vulnerability in the original code. However, it is always important to validate and sanitize user inputs and ensure proper error handling, even if a specific vulnerability is not present.",1856,89,10.881183862686157
177927,nan," NO.

The provided C++ code is not vulnerable to the nan vulnerability (CVE-2017-11144, CWE-754) as it is not the same codebase. The vulnerability is related to the PHP interpreter's PEM sealing code, which is not present in this code snippet. However, it is still important to check for other potential vulnerabilities as mentioned in the original task.",3959,97,10.636516809463501
