case_id,vuln_type,audit_report,input_token_num,output_token_num,inference_time
177736,Bypass," NO, the provided code is not vulnerable to the same issue described for the CVE-2015-8467 and CWE-264. The given code snippet is a function declaration and definition of `samldb_check_user_account_control_acl` function, which is different from the original vulnerable function. It does not contain any code related to the creation of machine accounts or privilege checking.

However, the dieSimulator function provided in the question might have vulnerabilities. It is a good practice to perform a security audit on the entire codebase, including the dieSimulator function, to ensure there are no other vulnerabilities.",2553,141,14.793442726135254
177740,DoS Exec Code Overflow Mem. Corr.," NO, the provided code is not vulnerable to the mentioned vulnerability types. It is a function for simulating dice rolls and does not contain any of the vulnerabilities we are checking for. However, it is always important to validate and sanitize inputs, even if they seem harmless, to maintain good coding practices and prevent potential future vulnerabilities.",2040,71,7.9628005027771
177741,DoS Overflow," NO, the provided code is not vulnerable to the same type of DoS Overflow vulnerability. The given code is a function for simulating dice rolls and there are no memory allocation or copying operations that could lead to a buffer overflow or similar vulnerability.",1298,54,5.995599746704102
177742,DoS Overflow," NO, the second code snippet is not vulnerable to the same type of DoS Overflow vulnerability. The first code snippet has a potential buffer overflow vulnerability because it copies the `psession.data` to `session_data` without checking the size. However, the second code snippet does not have any memory copy operations without proper bounds checking. It only performs arithmetic operations on integers and vector indices, which do not have the same type of vulnerability.",1268,100,11.872998237609863
177743,DoS," Answer:

NO.

The provided code is a modified version of the original vulnerable code, with the off-by-one error fixed. The potential Denial of Service (DoS) vulnerability has been addressed, and the code should not cause a crash due to uninitialized pointer dereference anymore.",3888,65,7.589489936828613
177747,DoS," NO.

The code you provided for `bgp_attr_unknown` function is the same as the previous one, and it has already been analyzed. The vulnerability you mentioned, CVE-2013-6051, is due to the uninitialized `total` variable in the original code, which is not present in this code snippet. The `dieSimulator` function is not relevant to the vulnerability discussion.",2124,94,9.925520896911621
177750,DoS Exec Code," NO.

The function provided does not contain the CWE-416 vulnerability, as there are no use-after-free errors in the code. The code properly sets `gstate->softmask`, `gstate->softmask_resources`, and `gstate->ctm` to `NULL` or the appropriate value before using them in the `fz_begin_mask` function call. Therefore, there is no dangling pointer usage that could lead to a use-after-free vulnerability.",2141,110,11.88147234916687
177766,DoS," Answer:

NO

The given `ldap_push_filter` function does not have a Denial of Service (DoS) vulnerability like the one described in CVE-2015-7540 and CWE-399. The function does not allocate memory based on user input without proper checks, which is the cause of the vulnerability in the original code. Therefore, the function is not vulnerable to the described issue.

However, it is essential to thoroughly analyze the rest of the code, including the `asn1_push_tag`, `asn1_pop_tag`, `asn1_write_OctetString`, and other functions called within the switch cases, to ensure there are no other potential security issues.",4502,163,17.509846925735474
177767,DoS," Answer:

NO, the provided code is not vulnerable to the same type of Denial of Service (DoS) vulnerability as the original code. The reason is that this code does not allocate memory for ASN.1 structures without checking return values, unlike the original code. However, it is still important to note that this code does not contain any error checking for the talloc_zero() and talloc_realloc() functions. While this might not lead to a DoS vulnerability, it can still cause issues related to memory management and lead to unexpected behavior or crashes.",2146,122,13.21315050125122
177768,DoS," Answer:

NO.

The provided code snippet is the same as the previous one, but without the part that contains the vulnerability. The vulnerability in the original code was due to the infinite loop in the sparse_dump_region function, which is not present in this code snippet. Therefore, this code is not vulnerable to the described Denial of Service (DoS) attack.",2598,85,9.46813178062439
177770,Bypass," Answer:

NO.

The function you provided, `dieSimulator`, does not contain the same vulnerability as the original `read_ndx_and_attrs` function. The `dieSimulator` function is a completely different function, implementing its own logic, and it does not contain any flaw related to bypassing access restrictions or not applying sanitization mechanisms.",3412,81,8.885764598846436
177771,nan," Answer:

NO.

The function dns\_read\_name() you provided is the same as the one you mentioned in the vulnerability description, and it is indeed vulnerable to the nan issue described by CVE-2018-20103 and CWE-835. However, the second function, dieSimulator(), is a completely different function that deals with matrix calculations and modulo operations. It does not contain any of the vulnerabilities listed in the 12 points you provided or the nan vulnerability mentioned in the description. Therefore, the answer is NO, dieSimulator() is not vulnerable.",1837,134,15.162392377853394
177773,DoS Exec Code Overflow Mem. Corr.," NO, the second code is not vulnerable to the same issue as the first one. The second code does not have any memory allocation or access based on user-supplied input within the loop that could cause an integer overflow leading to a buffer overflow. It is a simulation of dice rolls and does not contain any vulnerabilities related to memory corruption or arbitrary code execution.",1595,74,8.009841680526733
177774,DoS Exec Code Overflow," Answer:

NO.

The function you provided, `dieSimulator`, does not contain any of the vulnerabilities listed in the steps provided. It is a separate function that does not handle any user input, memory management, or complex control flow that could lead to the vulnerabilities mentioned. It is a simple calculation function that uses a vector of vectors to calculate a result based on input parameters and returns the result.",3273,87,9.641139268875122
177775,DoS Exec Code Overflow," NO, this code snippet is not vulnerable to the mentioned DoS_Exec_Code_Overflow vulnerability. The given code is a drawing function that does not contain any integer overflows or other vulnerabilities mentioned in the original code. However, it is still essential to check other parts of the code for potential vulnerabilities.",2511,68,7.45541524887085
177777,DoS Exec Code Overflow," NO, this code snippet is not vulnerable to the mentioned DoS Exec Code Overflow vulnerability (CVE-2009-3605, CWE-189). The provided code is different from the one causing the vulnerability. However, it is essential to check for other potential vulnerabilities as mentioned in the initial instructions.

For example, the code snippet does not show proper error handling for memory allocation. If the `gmalloc` or `new` operations fail, there is no error handling, which could lead to a null pointer dereference or other issues. It is also necessary to check for potential buffer overflows, use-after-free errors, and memory leaks in the remaining unreviewed code.",3041,158,15.645416259765625
177778,DoS Exec Code Overflow," NO.

The provided code does not contain any of the vulnerabilities listed in the initial audit steps. It is a function for drawing a masked image and does not contain any unsafe memory operations, unchecked arithmetic operations, or insecure resource management. However, it is still important to perform a thorough code review and test the code to ensure it behaves as expected.",3325,79,8.906378030776978
177779,DoS Exec Code Overflow," Answer:

NO.

The given code does not exhibit the DoS Exec Code Overflow vulnerability as described in CVE-2009-3605 and CWE-189. The code provided is a different function from the vulnerable one, and it does not contain any integer overflows related to the issue. However, it is still essential to check the rest of the codebase for similar vulnerabilities.",3385,94,10.104713439941406
177780,DoS Exec Code Overflow," Answer:

NO.

The provided code does not contain any of the vulnerabilities mentioned in the steps for detecting security vulnerabilities. It is a constructor for the GfxImageColorMap class, and it contains proper bounds checking and error handling. The code does not have any buffer overflow, use-after-free, memory leaks, integer overflow/underflow, null pointer dereference, or input validation issues. The code does not have any race conditions, insecure function usage, insecure resource management, or improper error handling. The code does not handle cryptographic functions or sensitive data, so Cryptographic Issues and Sensitive Data Exposure are not applicable.

In conclusion, the code is not vulnerable according to the given steps.",3607,159,16.373332023620605
177781,DoS Exec Code Overflow," NO, the second code snippet is not vulnerable to the DoS Exec Code Overflow vulnerability. The code is a different function that does not contain any integer overflows related to the length or array indices. However, it's always important to validate input and ensure error handling in any code snippet.",1425,66,7.438395738601685
177783,DoS Exec Code Overflow," NO, the second code snippet is not vulnerable to the DoS Exec Code Overflow vulnerability. This code does not contain any string or memory functions that can lead to buffer overflow vulnerabilities, and it does not have any use-after-free errors or memory leaks. The code does not contain any arithmetic operations that can cause integer overflows or underflows, and it checks pointers for null before dereferencing them.

The code does not contain any user input processing, so it is not vulnerable to improper input validation or injection attacks. The code does not contain any multi-threaded code, so it is not vulnerable to race conditions. The code does not use any insecure or deprecated functions, and it handles resources securely.

The code does not contain any error handling mechanisms, so it is not vulnerable to improper error handling. The code does not contain any cryptographic functions, so it is not vulnerable to cryptographic issues. The code does not contain any sensitive data exposure, so it is not vulnerable to sensitive data exposure.

However, the code does contain a potential performance issue. The use of the modulo operator (%) in the code can lead to a significant performance penalty, especially if the value being modded is large. It would be more efficient to use bitwise operations to achieve the same result.

In summary, the second code snippet is not vulnerable to the DoS Ex",1419,301,32.05912375450134
177786,DoS Exec Code Overflow," Answer:

NO.

The provided code does not contain any of the vulnerabilities listed in the steps for the vulnerability audit. It is a function for drawing an image and handling image data, and while it does use dynamic memory allocation, it does not contain any obvious security vulnerabilities. However, without a complete codebase and context, it is impossible to say for certain that there are no vulnerabilities.",3269,86,9.673553466796875
177787,DoS Exec Code Overflow," NO.

The function you provided is not vulnerable to the described DoS_Exec_Code_Overflow vulnerability. It is a different function with different functionality. However, it is still important to check this function for other potential vulnerabilities using the steps you provided in your question.",4375,59,7.258448362350464
177788,DoS Exec Code Overflow," Answer:

NO.

The provided code does not contain the DoS_Exec_Code_Overflow vulnerability mentioned in the CVE-2009-3605. The code snippet is different from the one given in the vulnerability description, and there are no signs of integer overflows or other mentioned vulnerabilities in this specific code. However, it is still essential to check the rest of the codebase for potential vulnerabilities.",4081,97,10.572555541992188
177789,DoS Exec Code Overflow," NO, the provided code is not vulnerable to the mentioned DoS Exec Code Overflow (CVE-2009-3605, CWE-189) vulnerability. The code snippet is a function for simulating dice rolls and calculating probabilities, which is unrelated to the Poppler library vulnerabilities. It does not contain any buffer overflows, memory leaks, or other common vulnerabilities mentioned in the initial audit steps. However, it is essential to thoroughly test and audit all code, especially when integrating external libraries or functions.",1847,121,12.613534688949585
177792,DoS Exec Code Overflow," NO, the provided `dieSimulator` function is not vulnerable to the mentioned vulnerabilities. It is a separate function that does not involve memory management, user input, or any of the other potential vulnerabilities listed. However, it is always important to thoroughly test and audit all code to ensure there are no potential security issues.",1515,67,7.693691253662109
177793,DoS Exec Code Overflow," Answer:

NO, the provided code is not vulnerable to the mentioned DoS Exec Code Overflow vulnerability. The code segment is an implementation of a glyph-making function in SplashFTFont class, and it does not contain any integer overflows or other vulnerabilities mentioned in the given CWE-ID. However, it is still important to ensure that the functions and libraries used in this code, such as FT_Load_Glyph and FT_Render_Glyph, are secure and do not have any hidden vulnerabilities.",2651,115,12.502850770950317
177794,nan," NO.

The provided code snippet does not contain any of the vulnerabilities mentioned in the steps. It is a constructor for the `DynamicMetadataProvider` class, initializing various member variables using function calls for XML attribute retrieval and other utility functions. The code does not contain any buffer manipulation, pointer handling, input validation, synchronization, or cryptographic functions that would typically be associated with the mentioned vulnerabilities.

The second code snippet is a function for simulating dice rolls and calculating probabilities. It does not contain any of the mentioned vulnerabilities either. It uses a vector of vectors, static variables, and arithmetic operations, but no security-sensitive functions are present.",1763,147,14.642317056655884
177795,nan," NO.

The provided code snippet is a constructor for the `DynamicMetadataProvider` class, and it does not contain any of the vulnerabilities mentioned in the steps. It initializes various member variables based on the input XML element but does not perform any dynamic memory allocation, complex pointer manipulation, or input validation that could lead to the mentioned vulnerabilities.

The `dieSimulator` function at the end of the code snippet is unrelated to the `DynamicMetadataProvider` constructor and is also free of the mentioned vulnerabilities. It calculates a value based on a vector of integers and does not contain any security-related issues.

Therefore, the answer is NO, the code snippet is not vulnerable according to the given steps.",1911,158,15.637163162231445
177796,Overflow," NO.

The code you provided is not vulnerable to a buffer overflow as it does not use any insecure memory operations based on user input. It initializes a fixed-size array `data` and fills it using functions like `rpc_add_credentials` and `nfs_add_fh3`, but it does not take any user input directly. The length of the data to be copied is calculated as `len = p - &(data[0])`, which is based on the size of the array and the position of the pointer `p` within the array, not on user input. Therefore, there is no possibility of a buffer overflow due to user input.",1652,142,14.357914686203003
177799,Overflow," NO.

The function _XcursorReadImage() seems to have been repaired after the vulnerabilities were found in the previous version. The main issue in the previous version was the lack of input validation and sanitation, which could lead to buffer overflows and other vulnerabilities. However, in the provided code, the input is being validated and sanitized properly, as seen in the following lines:

```cpp
if (!_XcursorFileReadChunkHeader (file, fileHeader, toc, &chunkHeader))
    return NULL;
...
if (head.width >= 0x10000 || head.height > 0x10000)
    return NULL;
...
if (head.width == 0 || head.height == 0)
    return NULL;
```

These checks ensure that the input values are within acceptable bounds, preventing buffer overflows and other related vulnerabilities.

The dieSimulator() function provided is not related to the _XcursorReadImage() function, and it does not contain any vulnerabilities related to buffer overflows or underflows. It uses proper bounds checking and sanitation for its input and internal variables.",1783,263,25.777596712112427
177807,Bypass," NO, this version of the code is not vulnerable to the described bypass vulnerability. The only difference between the two versions of the code is the removal of the `if (picc_profile == NULL)` check, which does not impact the vulnerability itself. The vulnerability is caused by type confusion in the `gscms_get_profile_data_space` function, which is not visible in the provided code. However, the code provided does not contain any other vulnerabilities based on the provided list.

The vulnerability in the original code (CVE-2018-19476, CWE-704) is due to type confusion in the `gscms_get_profile_data_space` function, which is not part of the provided code. The function is supposed to return a `gs_color_space` enumeration value, but it can return an incorrect value due to a type confusion vulnerability. The `switch` statement in the provided code then assumes that the returned value is always a valid enumeration value, which leads to the bypass vulnerability.

In the given code, the vulnerability is not present because the code does not rely on the correctness of the `gscms_get_profile_data_space` function. Instead, it directly assigns the result to `picc_profile->data_cs`, which is then used later in the",1932,301,32.380632162094116
177809,Bypass," NO, the provided code is not vulnerable to the bypass vulnerability mentioned in the CVE-2018-19475. The code includes checks for available stack space before proceeding with operations that could potentially cause a stack overflow. However, the dieSimulator function provided at the end of the question is not related to the vulnerability and is a separate piece of code.",2293,82,9.184024095535278
177811,DoS," NO, the provided code is not vulnerable to the same issue as the original `aspath_put` function. The reason being is that it does not perform the same calculation error where it counts certain bytes twice in the calculation of the AS_PATH size. Therefore, it will not construct an invalid message leading to a denial of service. However, it is always important to thoroughly test and review code to ensure there are no other potential vulnerabilities.",2252,92,9.950301885604858
177812,Bypass," NO, the function `sum_update` is not vulnerable to the same issue as the first code snippet you provided. However, it is important to note that the function does not check for buffer overflows in the `memcpy` calls, so if the `len` variable contains a value larger than the allocated memory for the `md.buffer`, it could result in a buffer overflow. Additionally, the `sumresidue` variable is not checked for negative values, which could lead to underflow issues.

The `dieSimulator` function, on the other hand, does not contain any obvious vulnerabilities based on the provided code. It uses constant values and does not perform any dynamic memory allocation or input validation, so there are no clear opportunities for security issues to arise. However, it is always important to thoroughly test and review all code to ensure that there are no hidden vulnerabilities.",1457,185,20.846498727798462
177815,Bypass," Answer:

NO, the provided code is not vulnerable to the same issue as the original code. The reason is that the vulnerable part in the original code was related to the handling of the CSUM_MD4 case, which is not present in the provided code. The provided code only has the CSUM_MD5 case, which does not contain the vulnerability. However, it is still important to ensure that the code follows best practices for error handling, input validation, and other security measures as mentioned in the vulnerability audit steps.",2087,111,11.831380367279053
177816,Bypass," NO, this code is not vulnerable to the same issue as the original code. The vulnerability in the original code was related to the handling of archaic checksums, which is not present in this code. This code only calculates a checksum using MD5 and MD4 algorithms, with proper bounds checking and error handling. However, it's important to note that MD4 is considered insecure and should not be used in new applications.",2147,93,10.501107454299927
177821,DoS," NO, the provided code is not vulnerable to the described DoS vulnerability. The code is a completely different function that doesn't process IRC color formatting codes. It is a function for simulating dice rolls with a vector of rollMax values and a MOD constant.",1195,57,6.4884326457977295
177823,Exec Code Overflow," NO, the provided code is not vulnerable to Exec Code Overflow (CVE-2011-2895) or CWE-119. The code you provided is a different implementation from the one described in the vulnerability summary. The vulnerable implementation is related to LZW decompression, while the given code is not performing any decompression or handling compressed data.

However, I would like to point out that the dieSimulator function has a potential integer overflow issue. In the following lines:

```c++
while (--n) {
    //...
    new_dp[j][0] = (new_dp[j][0] + dp[i][k]) % MOD;
}
```

The addition `new_dp[j][0] + dp[i][k]` might result in an integer overflow, as `new_dp[j][0]` and `dp[i][k]` are both `int` types. To fix this, you can use a larger integer type, like `long long`, or use a wider integer type provided by your platform, like `int64_t`.",2316,254,26.24365997314453
177825,DoS," NO, the provided `dieSimulator` function is not vulnerable to the format string vulnerability or any of the other vulnerabilities mentioned in the audit steps. It is a separate function that does not involve user input handling or any of the other potential vulnerability sources. However, the audit steps should still be applied to the rest of the codebase to ensure overall security.",1614,76,7.828528165817261
177826,DoS Exec Code Overflow," NO, the function `dieSimulator` is not vulnerable to the mentioned vulnerabilities. It does not contain any network or file I/O operations, does not allocate dynamic memory, and does not perform any arithmetic operations on unvalidated user input. It only performs complex calculations based on pre-defined constants and pre-validated vectors.",1485,72,7.602014780044556
177827,nan," NO.

The provided code snippet is a different function than the original one, and it does not contain any of the vulnerabilities mentioned in the CWE-ID or CVE-ID. It is a function to simulate dice rolls and calculate the probabilities using a dynamic programming approach.",1923,62,7.093336582183838
177831,nan," NO, the provided code is not vulnerable to the mentioned CWE-125 (Heap-based buffer over-read) or CVE-2019-14975. The code snippet does not contain any string manipulation functions that could cause a buffer over-read. Instead, it deals with managing data structures like dictionaries and strings. The vulnerability you mentioned is related to the fitz/string.c file, which is not provided in the code snippet.

However, I would like to point out that the code you provided for the dieSimulator function has a potential memory leak. In the function, you are using a vector of vectors (dp) that is being resized in each iteration of the while loop. Since you are not using move semantics to transfer ownership of the vectors in the new_dp variable, the memory allocated for the previous iteration's dp vector is not being released. To avoid this, you can use the push_back function to add rows to the dp vector in each iteration, or use a different approach to avoid reallocating memory in each iteration.

Here is an example of how you can modify the dieSimulator function to avoid the potential memory leak:

```cpp
int dieSimulator(int n, vector<int>& rollMax) {
    static const int MOD = 1e9 + 7;
    vector<vector<",1665,301,30.280506134033203
