case_id,vuln_type,audit_report,input_token_num,output_token_num,inference_time
177832,nan," NO, the provided `walk_string` function is not vulnerable to the same issue as the original code. The vulnerability in the original code was due to a lack of bounds checking when accessing the string, which is not present in this version.

However, the new code snippet you provided, `dieSimulator`, contains a different vulnerability. In the following lines:

```c++
if (i == j) {
    if (k < rollMax[i] - 1) {  // 0-indexed
        new_dp[j][k + 1] = (new_dp[j][k + 1] + dp[i][k]) % MOD;
    }
} else {
    new_dp[j][0] = (new_dp[j][0] + dp[i][k]) % MOD;
}
```

There is a potential integer overflow issue in the calculation of `new_dp[j][k + 1]` or `new_dp[j][0]`. If the sum of `new_dp[j][k + 1]` or `new_dp[j][0]` and `dp[i][k]` exceeds the maximum value representable by the integer type used, it will result in an integer overflow.

To fix this issue, you should ensure that",1511,301,30.63353729248047
177833,DoS Overflow," NO, the second code snippet is not vulnerable to the same DoS_Overflow vulnerability. The first code snippet has a vulnerability because it uses the `strncmp` function to compare the passwords, but the comparison length is not limited to the actual length of the password. Instead, it uses `SPICE_MAX_PASSWORD_LENGTH`, which can lead to a buffer overflow if the password is longer than expected. The second code snippet, however, does not contain any string comparison or user input handling, so it is not vulnerable to the same type of vulnerability.",1529,123,12.283608675003052
177839,+Info," NO, the provided code is not vulnerable to the CVE-2015-5330 and CWE-200 as described. The code does not handle any network communication or external inputs directly, and it does not expose sensitive information from daemon heap memory. However, it is essential to ensure that the functions used in this code, such as `smb_iconv`, are implemented correctly and do not have their own vulnerabilities.",2185,95,10.002029657363892
177840,+Info," NO, the second code snippet is not vulnerable to CVE-2015-5330 (CWE-200) or any of the vulnerabilities mentioned in the given steps. It is a different function that does not have any buffer handling issues, memory management problems, or input validation vulnerabilities. It is a function for simulating dice rolls and calculating probabilities.",1853,83,8.664921998977661
177841,+Info," NO, the provided `dieSimulator` function is not vulnerable to the vulnerabilities listed in the steps, assuming that the `dp`, `new_dp`, and `rollMax` vectors are correctly initialized and do not contain any vulnerabilities themselves. This function deals primarily with integer arithmetic and vector operations, and does not contain any user input validation, memory management, or concurrency issues.",1483,82,8.156358003616333
177842,+Info," NO, the second code snippet is not vulnerable according to the given CVE-2015-5330 and CWE-200. The vulnerability in the first code snippet is related to mishandling string lengths and obtaining sensitive information from daemon heap memory. The second code snippet is a completely different function calculating a result based on vectors, rollMax, and MOD. It does not have any similarities to the first code snippet in terms of handling strings or memory.",1397,108,11.568447828292847
177843,+Info," NO, the provided code is not vulnerable to the CVE-2015-5330 and CWE-200 as described in the given vulnerability summary. The code does not handle any network communication or user input directly, and it does not expose sensitive data in any way. The code is only performing calculations based on the input parameters and does not have any security vulnerabilities based on the given context.",2201,88,9.060681819915771
177844,+Info," NO, the provided code is not vulnerable to CVE-2015-5330 and CWE-200. The code you provided is different from the initial example, and it does not contain any string handling or length mishandling that could lead to sensitive information leakage. Instead, it is a function for simulating dice rolls and calculating probabilities using a dynamic programming approach.",1503,86,9.024869918823242
177848,nan," NO, the provided code is not vulnerable to the CVE-2015-5296 and CWE-20 vulnerabilities mentioned. It is because the code does not contain any SMB or encryption-related functionality, but instead, it is focused on handling connections and user authentication. The vulnerability in the original code was related to Samba, which is not present in this code.

However, the provided code does have some issues that should be addressed:

1. Buffer Overflow: The code does not perform any bounds checking when accessing `sharename`, which is obtained from `strchr_m(sharename, '\\')`. If the input string does not contain a backslash, the code will access memory out of bounds, causing undefined behavior.

2. Memory Leak: The code allocates memory for `servicename` using `talloc_strdup` but does not release it before returning. This can lead to a memory leak if the function is called multiple times without freeing the allocated memory.

3. Integer Overflow: The code uses `% MOD` to avoid integer overflows, but it is essential to ensure that the intermediate results do not overflow. In the code, `(a + b)` may cause an overflow before the modulo operation is applied.

4. Input Validation: The code does not validate the input parameters, such as `ctx`,",1420,301,31.67874765396118
177850,DoS Overflow," NO, this code is not vulnerable to the mentioned Denial of Service (DoS) Overflow vulnerability. The reason is that it does not involve any JSON parsing or handling of user-provided data, which were the sources of the original vulnerability. This function only formats and outputs data in JSON format, without any potential for buffer overflows.",4125,75,8.857438802719116
177851,DoS Overflow," NO, the provided `dieSimulator` function is not vulnerable to the mentioned DoS Overflow vulnerability. The function does not involve JSON parsing or any user input handling, so it does not match the conditions for the CVE-2015-5289 vulnerability. It is a simple simulation of dice rolls and calculating the total sum using dynamic programming.",1375,80,8.883085012435913
177852,DoS Overflow," NO, the provided `parse_object` function is not vulnerable to the described Denial of Service (DoS) Overflow vulnerability. The function does not contain any buffer manipulation code, so it cannot have a buffer overflow vulnerability. However, it is always important to review the entire codebase, as vulnerabilities can be introduced through function calls or data flows.

As for the `dieSimulator` function, it does not contain any vulnerabilities related to the provided list. It is a pure algorithm for calculating probabilities based on input vectors and does not interact with external resources or user input, so it is not exposed to the vulnerabilities mentioned in the list.",1577,141,14.190670490264893
177853,DoS Overflow," NO, the provided `setPath` function is not vulnerable to the described Denial of Service (DoS) Overflow vulnerability. The function does not contain any buffer manipulation or allocation that could lead to a buffer overflow. However, it is still important to review the functions called within this function (such as `pushJsonbValue` and `setPathArray`, `setPathObject`) to ensure they do not contain any vulnerabilities.

As for the `dieSimulator` function, it does not contain any of the vulnerabilities mentioned in the original list. It is a function that calculates the number of possible dice rolls based on input parameters, without any security-related issues.",1691,144,15.455913066864014
177855,Bypass," Answer:

NO.

The function check_reduced_name_with_privilege() itself does not contain the bypass vulnerability (CVE-2015-5252, CWE-264) as it is not performing any operations related to symlinks or share names with certain substring relationships. However, the vulnerability could be due to improper implementation or usage of this function in the larger codebase.",3152,97,10.501888036727905
177856,nan," Answer:

NO.

The function do_ed_script() does not contain any vulnerabilities related to the issues listed in the vulnerability audit. It is responsible for writing an ed script to a temporary file and executing it. The function does not have any unsafe operations such as buffer overflows, use-after-free, memory leaks, or improper input validations. It also does not contain any race conditions, insecure function usage, or insecure resource management. The function does not handle any cryptographic functions, sensitive data, or error handling mechanisms, so CWE-327, CWE-200, CWE-522, and CWE-248 do not apply.

The only function that might be vulnerable is the dieSimulator() function, but it is not directly related to the do_ed_script() function. However, after analyzing the dieSimulator() function, it does not contain any of the vulnerabilities mentioned in the audit. It calculates the number of dice rolls based on the input parameters and returns the result. The function uses a vector of vectors to store intermediate results, but it does not lead to any memory-related vulnerabilities.

In conclusion, the do_ed_script() function is not vulnerable to any of the listed vulnerabilities in the vulnerability audit.",2983,285,28.919085025787354
177857,nan," NO, the provided code does not contain any of the vulnerabilities listed in the audit steps. It is a memory allocation and file handling code, but it does not have any obvious vulnerabilities related to buffer overflow, use-after-free, memory leaks, integer overflows, null pointer dereferences, input validation, race conditions, insecure function usage, resource management, error handling, cryptographic issues, or sensitive data exposure.

However, it is important to note that a thorough vulnerability assessment should include testing the code with various inputs, edge cases, and scenarios to ensure that it behaves correctly and securely under all conditions. The provided code snippet might not be vulnerable in isolation, but it could still be part of a larger system that contains vulnerabilities.",1530,160,16.067816972732544
177859,Exec Code Bypass," NO, the function `gs_nulldevice` does not contain any Exec Code Bypass vulnerability as described in CVE-2018-16863. The provided code is not related to the vulnerability description.

The given code `dieSimulator` is a function for simulating dice rolls and has no connection to the Ghostscript library or the vulnerability in question. It is a separate function that calculates the sum of all possible dice roll combinations based on the provided `rollMax` vector.",1519,115,11.408003807067871
177860,Exec Code Bypass," NO, the function `zrestore` does not contain any obvious vulnerabilities based on the provided code snippet. It contains some checks and operations on data structures but does not involve user input validation, memory management, or other operations that could lead to the vulnerabilities mentioned.

However, the second function `dieSimulator` is provided, and it does not seem to be related to the first function. I will check it for vulnerabilities:

NO, the `dieSimulator` function does not contain any obvious vulnerabilities based on the provided code snippet. It uses a constant modulus for integer arithmetic, initializes a 2D vector, and performs calculations based on its input without any apparent issues.

Please note that this assessment is based on the provided code snippet, and potential vulnerabilities may exist in other parts of the codebase.",1553,180,17.706066846847534
177862,Exec Code," NO, the provided `restore_page_device` function is not vulnerable to the CVE-2018-16802 vulnerability. The vulnerability you described is related to an incorrect privilege checking issue during exception handling and the execution of crafted PostScript using the ""pipe"" instruction. However, the provided code does not contain any privilege checking, exception handling, or PostScript parsing. It is a device handling function, and the vulnerability described is not directly related to this function.

The second code snippet `dieSimulator` is also unrelated to the vulnerability you described, and it is not vulnerable to the CVE-2018-16802 vulnerability. It is a function for simulating dice rolls and calculating the probabilities using a dynamic programming approach.",1577,173,18.67348623275757
177865,DoS," NO, the code is not vulnerable according to the provided vulnerability types. The given code is a different function named `dieSimulator` that does not contain any pattern matching or string manipulation operations. It calculates the result of a dice simulation using a vector of integers and a modulo operation, which does not introduce any of the mentioned vulnerabilities.",1669,74,9.549803018569946
177867,nan," NO.

The function `gs_main_finit` does not contain any vulnerabilities related to CVE-2018-16541 or CWE-416. The vulnerability in the given context is due to incorrect free logic in pagedevice replacement, which is not present in this function.",4665,72,8.247310638427734
177869,nan," Answer:

NO.

The provided code for the `zsetcolor` function does not show any signs of the nan (type confusion) vulnerability mentioned in the CVE-2018-16513. The code initializes variables properly, checks for pattern color spaces, gathers numeric operands, and passes the color to the graphic library. There are no obvious issues related to the nan vulnerability in this code snippet.

However, it is essential to audit the entire application to ensure there are no other vulnerabilities, as the nan vulnerability might be present in other functions or parts of the codebase.",2874,136,13.918434619903564
177870,nan," NO, the second code snippet is not vulnerable to the same issue described for the first one. The second code snippet is a completely different function that deals with vectors, loops, and mathematical operations, which do not contain any of the vulnerabilities listed in the steps provided.",1374,57,5.975773334503174
177874,Exec Code Overflow," NO.

The function `aes_crypt_ecb` does not contain any obvious security vulnerabilities based on the provided code snippet. It is a function for performing AES encryption or decryption on a 16-byte block of data using an AES context. The function uses fixed-size buffers and does not contain any unsafe operations like unchecked array access, unvalidated user input, or insecure memory management.

However, it is essential to ensure that the functions called within this function, such as `GET_ULONG_LE`, `PUT_ULONG_LE`, `AES_RROUND`, `AES_FROUND`, and the RSb/FSb arrays, are implemented safely and do not contain any vulnerabilities. Additionally, the AES context and its associated `rk` pointer should be managed correctly to avoid issues like use-after-free or uninitialized memory access.",3649,198,20.05035161972046
177875,Exec Code Overflow," NO, this code is not vulnerable to Exec Code Overflow (CVE-2018-15911, CWE-119). The reason is that the provided code does not contain any functionality to execute arbitrary code, unlike the original vulnerable code. It only performs AES decryption and writes the decrypted data to the output buffer. However, it is still essential to ensure proper input validation, error handling, and other security best practices in this code.",2719,101,10.762840032577515
177879,DoS Exec Code Overflow," NO, the provided `fdctrl_read_data` function is not vulnerable to the described DoS Exec Code Overflow vulnerability. The function does not contain any unsafe memory operations or unchecked user inputs that could lead to the described vulnerabilities.

However, the `dieSimulator` function contains a potential vulnerability related to integer overflow. Specifically, the inner loop that updates `new_dp` uses unchecked arithmetic operations that could result in integer overflow, which would lead to incorrect results or buffer miscalculations. This is not the same vulnerability as the one described in the question, but it is still a potential security issue that should be addressed.",1942,142,14.94653034210205
177880,Bypass," NO, this version of the function is not vulnerable to the bypass vulnerability described in CVE-2018-15908. The vulnerability in the previous version was due to insufficient validation of the `permitgroup` parameter, which could lead to bypassing file permission checks. In this version, the function only checks for file accesses related to the `iodev_default(imemory)` device, making it more secure against the described attack.

However, it is still important to ensure that the `permitgroup` parameter is properly validated and sanitized before passing it to this function to prevent other potential vulnerabilities.",2352,143,14.594818115234375
177881,DoS," NO, the provided code is not vulnerable in the same way as the initial code. The initial code had a vulnerability due to an unchecked kstrdup operation, which is not present in this code. This code defines a function to perform some calculations using vectors and does not contain any of the vulnerabilities listed in the given steps.",1380,69,7.9473114013671875
177883,nan," NO, the provided `dieSimulator` function is not vulnerable in the context of the previous code and the given CVE-2011-1428 and CWE-20 (Improper Input Validation) vulnerabilities. The `dieSimulator` function does not process user input, and it does not have any security issues related to the certificate verification or GnuTLS API. It is a separate function that calculates the result of a dice simulation, and it does not interact with the vulnerable code.",1608,110,12.367237329483032
177887,DoS Overflow," Answer:

NO, the given code is not vulnerable to the same issue as the previous one. The potential integer overflow vulnerability in the line ""uint added = size + sizeof(gs_malloc_block_t);"" has been addressed by checking if the addition will exceed the limit in the following line: ""if (mmem->limit - added < mmem->used)"". This check ensures that the addition does not result in an integer overflow, which makes the code safer in this particular context.",2269,105,10.812410593032837
177891,DoS," NO, the function `dieSimulator` is not vulnerable to the vulnerabilities listed in the audit steps. It is a separate function that does not contain any network communication, user input, or dynamic memory management. It only performs calculations on provided vectors and constants, and handles errors by returning a result.",1379,62,6.658214330673218
177893,+Info," NO, the provided code is not vulnerable to the CVE-2015-3193 vulnerability. The vulnerable part of the original code was in the Montgomery squaring implementation in crypto/bn/asm/x86_64-mont5.pl, which is not present in this code. This code only contains BN_mod_exp and related function calls, and there are no issues found related to the given vulnerability.

However, it is essential to check the rest of the codebase for the mentioned vulnerabilities and ensure proper error handling, input validation, and secure memory management.",2978,130,13.524339199066162
177896,nan," Answer:

NO.

The provided code is a function for simulating dice rolls and calculating the total sum of all possible outcomes. It does not contain any of the vulnerabilities mentioned in the steps for the vulnerability audit. It is a separate function that does not interact with files, network resources, or user inputs, so it is not vulnerable to the listed vulnerabilities.",1277,80,8.495003700256348
177897,+Info," NO, the second code snippet is not vulnerable to the XML External Entity (XXE) issue as described in CVE-2013-1824 and CWE-200. The code has removed the XML_PARSE_DTDLOAD option, which prevents loading external DTD files, thus mitigating the XML External Entity (XXE) vulnerability.",1610,84,9.085344076156616
177898,+Info," NO, the second code snippet is not vulnerable to the XML External Entity (XXE) issue as described in CVE-2013-1824 and CWE-200. The code snippet does not include any SOAP parsing or WSDL file handling, which were the root cause of the vulnerability in the first code snippet. The provided code is a function for parsing memory using the libxml2 library, and it does not contain any known vulnerabilities from the list provided.

However, it is still essential to follow the steps mentioned in the vulnerability audit to ensure the security of the entire codebase.",1528,139,14.137449979782104
177899,+Info," NO, the second code snippet is not vulnerable to the XML External Entity (XXE) issue mentioned in the CVE-2013-1824 vulnerability. The second code snippet does not contain any XML parsing functions, unlike the first code snippet. It is a completely different function that calculates the result of a dice game.",1554,77,7.770131349563599
177900,+Info," NO, the provided `soap_xmlParseMemory` function is the same as the vulnerable code you showed before, but it is not being used in the `dieSimulator` function. The `dieSimulator` function is a separate, non-vulnerable function that calculates a dice simulation and has no XML parsing or file access operations.",1444,74,7.872580051422119
177901,Overflow," NO.

The function `_asn1_ltostr` does not contain any obvious vulnerabilities related to buffer overflow. It uses a fixed-size buffer `temp` with a size defined by `LTOSTR_MAX_SIZE`, and the `do-while` loop calculates the required space before writing to the buffer. The `for` loop at the end copies the calculated string to the output `str` without exceeding the calculated length.

However, it is important to note that the input `v` is not validated or sanitized, which could lead to issues if it contains unexpected values. But in terms of buffer overflow, the function appears safe.",1131,144,14.316309690475464
177904,DoS," NO, the function `Splash::blitMask` does not contain the same vulnerability as described in CVE-2013-1789. It has been refactored to remove the vulnerable code.

Regarding the second function `dieSimulator`, it is not vulnerable to the mentioned vulnerabilities in the original question. It is a separate function that deals with a different task, unrelated to the previous vulnerable function. The function calculates a result based on a vector of integers and does not contain any security vulnerabilities based on the provided code.",2000,122,12.876151084899902
177905,DoS," NO, this code segment is not vulnerable to the described DoS attack. The vulnerability in the previous code was due to the division by 'det' without checking if it was zero. In this code, there is no such division operation, so it should not have the same vulnerability. However, it is still important to check other potential vulnerabilities as mentioned in the initial steps.",3538,79,8.974348306655884
177906,DoS Exec Code Overflow," NO, the provided code is not vulnerable to the mentioned DoS_Exec_Code_Overflow vulnerability. The code is a modification of the original vulnerable code, but the vulnerability has been removed as there are no operations that could lead to an ""invalid memory access"". However, the code could still have other vulnerabilities as the provided list suggests.",3025,72,8.639341354370117
177907,DoS Exec Code Overflow," NO, the provided `Splash::scaleMaskYuXd` function is not vulnerable to the described DoS Exec Code Overflow vulnerability. The function does not contain any user input validation issues, memory management errors, or unchecked arithmetic operations that could lead to the identified vulnerabilities.

However, the provided `dieSimulator` function has some issues unrelated to the mentioned vulnerabilities:

1. The function has a missing include statement for the `vector` class, which should be `#include <vector>`.
2. The function has a missing include statement for the `accumulate` function, which should be `#include <numeric>`.
3. The function has a missing include statement for the `uint64_t` type, which should be `#include <cstdint>`.

These issues are not security vulnerabilities but will cause compilation errors.",1811,193,19.79106903076172
177909,DoS Exec Code Overflow," NO, the provided code is not vulnerable to the mentioned DoS Exec Code Overflow vulnerability. The code is a different implementation from the one you described, and it does not contain any buffer overflow or memory corruption vulnerabilities based on the provided code snippet. However, it is essential to review the rest of the codebase and the functions called within this function to ensure there are no other vulnerabilities.",1797,84,9.135773420333862
177910,DoS," NO, the `dieSimulator` function is not vulnerable to the same type of vulnerability as the `token_continue` function. It is a separate function that does not contain any references to the scanner state structure or any other potential sources of the denial of service vulnerability. It is a standalone function that calculates the result of a dice simulation and does not interact with any external resources or data that could be manipulated to cause a crash or unspecified other impact.",1390,101,10.295367240905762
177911,Exec Code Overflow," NO, the provided `dieSimulator` function is not vulnerable to the Exec Code Overflow (CVE-2009-0946) or any other vulnerabilities mentioned in the given list. It is a separate function that does not have any interaction with the `tt_cmap10_validate` function. The `dieSimulator` function is working with integer arithmetic, vector manipulations, and loops, but it does not contain any risky operations such as memory allocation, deallocation, or pointer arithmetic, which could lead to vulnerabilities.",1253,124,12.94244384765625
