case_id,vuln_type,audit_report,input_token_num,output_token_num,inference_time
177839,+Info," NO, the second code snippet is not vulnerable according to the given CVE-2015-5330 and CWE-200. The vulnerability in the first code is related to mishandling string lengths in a different context, while the second code snippet deals with a vector of pairs and has no relation to string handling or the vulnerability in the first code.",2112,84,9.307558059692383
177840,+Info," NO, the second code snippet is not vulnerable to CVE-2015-5330 and CWE-200. The vulnerability in the first code snippet is related to handling crafted packets and reading from daemon heap memory, which is not present in the second code snippet. The second code snippet is a function for finding k smallest pairs from two vectors, and it does not contain any vulnerabilities mentioned in the prompt.",1780,97,11.091713905334473
177841,+Info," NO, the second code snippet is not vulnerable in the same way as the first one. It does not contain any string manipulation functions that could lead to a CWE-200 (Sensitive Data Exposure) vulnerability like the first code snippet. The second code snippet is focused on finding k smallest pairs of elements from two vectors, and it does not contain any vulnerabilities based on the provided code.",1410,89,9.570640802383423
177842,+Info," NO, the second code snippet is not vulnerable. It is a function for finding k smallest pairs in two arrays and does not contain any of the vulnerabilities mentioned in the steps.",1324,38,4.2503979206085205
177843,+Info," NO, the second code snippet is not vulnerable in the same way as the first one. It does not contain any string handling functions that could lead to a CVE-2015-5330 (CWE-200) vulnerability. The second code snippet is a function for finding k smallest pairs of elements from two vectors, and it does not contain any string handling vulnerabilities.",2128,86,9.173573970794678
177844,+Info," NO, the second code snippet is not vulnerable in the context of the given CVE-2015-5330 and CWE-200 (Sensitive Data Exposure). The second code snippet is an implementation of the k-smallest pairs problem and does not contain any vulnerabilities related to leaking sensitive data from heap memory.",1430,77,9.159580945968628
177848,nan," NO, the provided code is not vulnerable to the mentioned vulnerability CVE-2015-529",1347,25,3.046187162399292
177850,DoS Overflow," NO, this code is not vulnerable to the mentioned DoS Overflow vulnerability. The function `datum_to_json` does not contain any stack-based buffer overflows. It mainly consists of switches to handle different JSON types and does not have any unsafe string manipulation that could lead to a buffer overflow.

However, it is still important to check the functions called within the switches for potential vulnerabilities, but based on the provided code, there is no evidence of a DoS Overflow vulnerability in this specific function.",4052,114,12.421464443206787
177851,DoS Overflow," NO, this code is not vulnerable to the mentioned DoS Overflow vulnerability. The provided code is a function to find k smallest pairs from two integer arrays, which does not contain any JSON parsing code. However, it's always important to validate and sanitize inputs, handle errors, and ensure secure memory management in any code.",1302,70,7.585888385772705
177852,DoS Overflow," NO, the provided code is not vulnerable to the mentioned DoS Overflow vulnerability. The code is a different implementation and does not contain any stack-based buffer overflows as in the original code. It is a sorting function that creates pairs of two integer vectors based on their sum and stores them in a priority queue.",1504,68,6.870858192443848
177853,DoS Overflow," NO, the provided `setPath` function is not vulnerable to the described Denial of Service (DoS) Overflow vulnerability. The function does not contain any buffer manipulation or allocation that could lead to a buffer overflow. However, it is still important to review the code for other potential vulnerabilities as mentioned in the initial vulnerability audit steps.

Regarding the `kSmallestPairs` function, it is also not vulnerable to the mentioned DoS Overflow vulnerability. It is a sorting and priority queue implementation, and it does not contain any buffer manipulation or allocation that could lead to a buffer overflow.",1618,131,13.694499015808105
177855,Bypass," Answer: NO

The provided C++ code snippet does not contain the same vulnerability as the original code. The vulnerability in the original code was due to a bypass issue in the Samba VFS layer, specifically in the `check_reduced_name_with_privilege` function, which affected the access control when share names with certain substring relationships existed. However, the given code snippet is a different function that calculates the k smallest pairs of elements from two vectors, and it does not contain any access control logic or share name handling.",3079,119,12.638026237487793
177856,nan," Answer: YES

The function do_ed_script() is vulnerable because it concatenates the editor_program, verbosity value, and outname variables to form the buf string, which is then used in an exec call with user-supplied outname. This can lead to OS shell command injection if the outname variable contains shell metacharacters. The vulnerability is similar to the one described in the CVE-2019-13638 with CWE-78 (OS Command Injection).

The vector-based kSmallestPairs function is not directly related to the vulnerability in the do_ed_script function. However, it is essential to thoroughly check all functions in the code for vulnerabilities. In this case, the kSmallestPairs function does not contain any obvious vulnerabilities based on the provided code snippet.",2910,185,18.41587543487549
177857,nan," NO, the provided `plan_a` function is not vulnerable to the nan (CVE-2019-13636, CWE-59) vulnerability. The nan vulnerability is related to the mishandling of symbolic links in certain cases other than input files. The given `plan_a` function does not process symbolic links or handle any user input that could cause a symbolic link to be created or followed. It simply reads the contents of a file specified by the `filename` parameter.

However, the `plan_a` function does have some issues that should be addressed:

1. Memory leaks: If the function fails to open the file, it calls `free(buffer)`, but it does not close the file descriptor `ifd`. This can lead to a memory leak.

2. Error handling: The function does not handle errors properly in some cases. For example, if `buffered` is not initialized and the `read` function fails, the program will have undefined behavior.

3. Code duplication: The function has some code duplication that could be refactored to improve readability and maintainability.

The `kSmallestPairs` function is not directly related to the nan vulnerability and is not vulnerable to it. However, it is important to ensure that the function handles edge cases and errors properly. For example, if the `",1457,301,30.274284839630127
177859,Exec Code Bypass," NO, the second code snippet is not vulnerable to the Exec Code Bypass vulnerability (CVE-2018-16863, CWE-78). This is because the second code snippet is an implementation of the kSmallestPairs function, which deals with sorting pairs of integers and does not contain any of the vulnerable functions or operations related to the given vulnerability.",1446,89,9.041258335113525
177860,Exec Code Bypass," NO, the second code snippet is not vulnerable to Exec Code Bypass (CWE-78) or any other vulnerabilities mentioned in the steps. It is a different function that does not contain any user input handling or dynamic memory management. It is a function for finding k smallest pairs of numbers from two vectors, which does not have any inherent security vulnerabilities in its logic.",1480,82,9.212807655334473
177862,Exec Code," NO, the provided function `restore_page_device` is not vulnerable to the Exec_Code vulnerability as described in CVE-2018-16802. The function does not contain any stack manipulation, exception handling, or crafted PostScript input handling. It is a simple device handling function without any security vulnerabilities mentioned in the original question.

However, the `kSmallestPairs` function has a buffer overflow vulnerability in the `push` lambda function. The `nums1` and `nums2` vectors are not checked for bounds before accessing their elements with `nums1[i]` and `nums2[j]`. If the indexes `i` and `j` are out of bounds, it can lead to a buffer overflow. To fix this, add bounds checking before accessing the vector elements.

In conclusion, the `restore_page_device` function is not vulnerable, but the `kSmallestPairs` function has a buffer overflow vulnerability.",1504,221,22.948963403701782
177865,DoS," NO, the provided `PatternMatch` function is not vulnerable to the same issue as described in CVE-2017-13720. The given vulnerability description is related to the incorrect handling of '\0' characters in specific situations involving '?' characters. However, the provided code does not contain any '?' character handling or any '\0' character skipping.

The `kSmallestPairs` function is not related to the `PatternMatch` function and is not vulnerable as it handles different operations.",1596,111,12.477185487747192
177867,nan," NO, this code is not vulnerable to the specific issue you mentioned (CVE-2018-16541, CWE-416). The provided code snippet is different from the vulnerable code, and I don't see any use-after-free errors in this version. However, it is essential to thoroughly analyze all code paths and potential modifications to ensure the absence of the vulnerability. The code you provided should still be checked for the other vulnerabilities mentioned in the initial vulnerability audit list.

The code you provided is a function for finalizing Ghostscript's main instance, handling memory reclamation, closing devices, and cleaning up temporary files. It does not contain any obvious vulnerabilities based on the provided code snippet.",4592,160,16.99146008491516
177869,nan," NO, this code is not vulnerable to the nan vulnerability mentioned in CVE-2018-16513 and CWE-704. The code provided is different from the previous one, and I do not see any type confusion in the setcolor function in this version. However, I cannot guarantee the absence of other vulnerabilities as the task is to focus solely on the mentioned vulnerabilities and not to check for all possible security issues.",2801,96,10.54596471786499
177870,nan," NO, this second code is not vulnerable to the same issue as the first one. The second code is an implementation of a function to find k smallest pairs from two integer arrays, while the first code is related to type handling in Ghostscript. The two pieces of code are unrelated, and the vulnerability in the first code does not exist in the second one.",1301,75,7.96905517578125
177874,Exec Code Overflow," NO.

The given C++ code is a function for AES encryption and decryption, and it does not contain any of the vulnerabilities mentioned in the steps. It uses fixed-size buffers and does not have any unsafe memory operations, unchecked user inputs, or error handling issues. Therefore, it is not vulnerable to the mentioned attacks.

As for the vector and priority_queue operations in the second code snippet, they are unrelated to the AES function and are also safe, as they do not contain any of the mentioned vulnerabilities.",3576,116,12.289376974105835
177875,Exec Code Overflow," NO, this code is not vulnerable to the Exec Code Overflow vulnerability described. The function `s_aes_process` does not contain any unsafe memory operations that could be exploited to execute arbitrary code. It does have some potential issues like buffer overflow in the `memcpy` function, but it is not the same as the Exec Code Overflow vulnerability.",2646,78,8.272087335586548
177879,DoS Exec Code Overflow," NO, this code is not vulnerable to the described DoS Exec Code Overflow vulnerability. The provided code is a different function that does not contain the same vulnerability as the original code you described. However, it is always important to validate and sanitize inputs, handle errors robustly, and follow secure coding practices to minimize the risk of introducing other vulnerabilities.",1869,76,9.040057182312012
177880,Bypass," NO, this code is not vulnerable to the bypass vulnerability described in CVE-2018-15908. The provided code is a different function that checks file permissions based on a list of permitted strings and does not contain any specific logic for handling or bypassing.tempfile restrictions. However, it is still important to ensure that the function properly validates user input and handles errors as described in the initial vulnerability audit steps.",2279,95,9.713196039199829
177881,DoS," NO, the provided `kSmallestPairs` function is not vulnerable to the vulnerabilities mentioned in the given steps. It is a sorting function that creates pairs of two integer vectors based on their sum and does not contain any dynamic memory management, user input handling, or multi-threading.",1307,62,7.032139539718628
177883,nan," NO, the provided `hook_print` function is not vulnerable to the nan vulnerability (CVE-2011-1428, CWE-20) or any of the other vulnerabilities mentioned in the audit steps. The function does not handle SSL/TLS connections or certificates, so it is unrelated to the given vulnerability summary.

However, the `kSmallestPairs` function has a potential buffer overflow vulnerability in the line:

`q.emplace(nums1[i] + nums2[j], make_pair(i, j));`

If the sum of `nums1[i]` and `nums2[j]` exceeds the maximum value representable by an `int`, it can lead to an integer overflow, causing unexpected behavior or a buffer overflow. To fix this, you should ensure that the sum is within the representable range of an `int` or use a larger integer type like `long long`.

In addition, the function assumes that `nums1` and `nums2` have at least one element. If they are empty, accessing the first element (`nums1[0]` or `nums2[0]`) will result in undefined behavior (CWE-129). To avoid this, you should check if `nums1` and `nums2` are",1535,301,31.106374979019165
177887,DoS Overflow," Answer:

NO.

The provided code for `gs_heap_alloc_bytes` function is the same as the previous vulnerable code, but the question is about a different function, `kSmallestPairs`. This new function is not vulnerable to the same Denial of Service (DoS) Overflow issue as the `gs_heap_alloc_bytes` function.

The `kSmallestPairs` function is a sorting function that creates pairs of elements from two vectors (`nums1` and `nums2`) and returns the `k` smallest pairs based on their sum. It does not have any memory allocation or pointer manipulation issues that could lead to a buffer overflow or other vulnerabilities mentioned in the steps.

Therefore, the `kSmallestPairs` function is not vulnerable to the CVE-2015-3228 vulnerability based on the provided code.",2196,197,21.07062339782715
177891,DoS," NO, this code is not vulnerable according to the given vulnerability summary. It is a function for finding k smallest pairs from two vectors, and it does not contain any cryptographic operations or resource management that could lead to the described DoS vulnerability.",1306,52,6.579840660095215
177893,+Info," NO.

The given C++ code is a function for modular exponentiation using the OpenSSL library. It does not contain any of the vulnerabilities mentioned in the steps for the vulnerability audit. It uses the OpenSSL library's functions for modular exponentiation and does not have any obvious security flaws like buffer overflows, use-after-free, memory leaks, or improper input validation. However, it is still essential to ensure that the OpenSSL library being used is up-to-date and free from any known vulnerabilities.",2905,117,12.492859601974487
177896,nan," NO, the provided code `kSmallestPairs` function is not vulnerable. It is a sorting function that creates pairs of elements from two vectors and sorts them based on their sum. There are no security vulnerabilities in this code based on the provided list.",1204,55,6.120628833770752
177897,+Info," NO, the second code snippet is not vulnerable to the XML External Entity (XXE) issue mentioned in the CVE-2013-1824 vulnerability. The code is a different function that does not contain the same vulnerability.",1537,55,5.7513298988342285
177898,+Info," NO, the second code snippet is not vulnerable to the XML External Entity (XXE) issue mentioned in the CVE-2013-1824 vulnerability. The second code snippet is an implementation of the k-smallest pairs problem and does not contain any XML parsing functionality. Therefore, it does not have the same vulnerability as the first code snippet.",1455,83,8.904215812683105
177899,+Info," NO, the second code snippet is not vulnerable to the XML External Entity (XXE) issue mentioned in the CVE-2013-1824 vulnerability. This is because the second code snippet is an implementation of a function to find k smallest pairs of elements from two arrays, and it does not contain any XML parsing code.",1481,76,8.003974437713623
177900,+Info," NO, the second code snippet is not vulnerable to the XML External Entity (XXE) issue described in CVE-2013-1824 and CWE-200. This code snippet does not involve any SOAP parsing or XML processing. It is a function for finding k smallest pairs from two vectors, which is unrelated to the vulnerability in the first code snippet.",1371,88,9.137499809265137
177901,Overflow," NO, the second code is not vulnerable to the same type of overflow vulnerability. The first code has a potential buffer overflow issue in the _asn1_ltostr function due to the array temp not being properly bounded by the variable count. However, the second code does not contain any similar operations that could lead to a buffer overflow. It is a different algorithm that creates pairs of smallest numbers from two vectors, and it does not have any obvious vulnerabilities based on the provided code.",1058,101,10.67425799369812
177904,DoS," NO, this code is not vulnerable to the previously discussed DoS vulnerability. The function has been provided as-is, without any context or relationship to the previous vulnerable code. The provided code does not contain any NULL pointer dereferences or other immediately obvious vulnerabilities. However, a thorough security audit should still involve checking the rest of the codebase for potential issues, as mentioned in the original list.",1927,82,9.696494579315186
177905,DoS," Answer:

NO.

The provided code for `Splash::arbitraryTransformMask` does not contain any vulnerabilities related to the checklist you provided. It is a different function from the one mentioned in the vulnerability summary, and it does not contain any overt errors that could lead to a denial of service (DoS) or other security issues. However, without the full context of the code and its dependencies, it is impossible to rule out all potential vulnerabilities.",3465,104,11.347230195999146
177906,DoS Exec Code Overflow," Answer:

NO.

The provided code snippet does not contain any of the vulnerabilities listed in the steps for the vulnerability audit. It is a function that creates a dashed path based on some input parameters and does not contain any unsafe memory operations, unchecked arithmetic operations, or insecure input handling. Therefore, it is not vulnerable to the mentioned types of attacks.",2952,81,9.384659051895142
177907,DoS Exec Code Overflow," NO.

The provided code is a different implementation compared to the initial vulnerable code. It does not contain any buffer operations, pointer arithmetic, or dynamic memory management that could lead to the mentioned vulnerabilities. Instead, it is an implementation of the k-smallest pairs problem using a priority queue.",1738,64,7.268992900848389
177909,DoS Exec Code Overflow," NO, this code is not vulnerable to the described DoS Exec Code Overflow vulnerability. The provided code snippet is a different function that does not contain any of the suspicious functionalities mentioned in the vulnerability description. However, it is still important to ensure that the rest of the application follows secure coding practices.",1724,66,7.893275737762451
177910,DoS," NO, the provided `token_continue` function is the same as the one in the previous example, and it does not contain the vulnerability related to the `kSmallestPairs` function. The vulnerability in the `token_continue` function is a denial-of-service (DoS) vulnerability (CVE-2017-11714, CWE-125) due to an out-of-bounds read in the `igc_reloc_struct_ptr` function in `psi/igc.c`. However, the provided code snippet does not include the vulnerable function.

The `kSmallestPairs` function is not vulnerable to the described denial-of-service vulnerability. It is a function to find the k smallest pairs of elements from two vectors, and it does not contain any memory management issues or denial-of-service vulnerabilities based on the provided code.",1317,201,21.180968761444092
177911,Exec Code Overflow," NO, this code is not vulnerable according to the given CVE-2",1180,16,2.2252352237701416
177912,Exec Code Overflow," NO, the provided code is not vulnerable to the Exec Code Overflow vulnerability (CVE-2009-0946, CWE-189) specifically. However, it is always important to perform proper input validation and error handling, as well as to ensure that arithmetic operations do not result in integer overflows or underflows. The code snippet you provided does not contain any obvious issues related to the mentioned vulnerability, but it is essential to analyze the entire codebase and its usage to ensure there are no vulnerabilities.

The code you provided is a function for validating a TrueType (TT) font's 'cmap' table, and it does not contain any cryptographic functions, sensitive data exposure, or insecure resource management. Therefore, it is not directly related to the additional vulnerabilities you mentioned. However, it is still crucial to follow best practices for security and robustness in all parts of the codebase.",1418,204,20.705761909484863
177913,Exec Code Overflow," NO, this code is not vulnerable to the same issue as the previous one. The potential integer overflow vulnerabilities in the first code snippet were due to insufficient bounds checking when indexing arrays with large values. In this version of the function, the bounds checking appears to be implemented correctly, so there is no immediate evidence of the same vulnerability. However, it is still important to thoroughly check the rest of the codebase for similar issues, as well as the other vulnerability types mentioned in the original audit instructions.",2420,106,10.622191190719604
177915,Exec Code Overflow," NO, the provided code is not vulnerable to the Exec Code Overflow vulnerability (CVE-2009-0946, CWE-189). The code shared is a part of the function `cff_charset_load`, but the vulnerability is related to the functions `ftsmooth.c`, `ttcmap.c`, and `cffload.c`, which are not provided in the code snippet. However, it is essential to thoroughly check the entire codebase for the mentioned vulnerabilities.",2000,116,12.03875732421875
177917,Exec Code," NO, the second code snippet is not vulnerable to the same issue as the first one. The second code does not contain any signs of interpreting a variable as signed instead of unsigned, which could lead to an out-of-bounds write. The second code snippet is safe from the CVE-2018-14600 and CWE-787 vulnerabilities.",1743,84,10.150659561157227
177918,Exec Code," NO.

The provided C++ code is not vulnerable to the Exec_Code vulnerability described for the previous code snippet. This code does not contain the function XListExtensions, and it does not have the issue of interpreting a variable as signed instead of unsigned, which was the root cause of the vulnerability in the previous code.",1793,73,8.220229864120483
177919,nan," NO, the provided code is not vulnerable to the described issue CVE-2018-14599 (CWE-682). The vulnerability in the original code was due to an off-by-one error caused by malicious server responses, leading to a DoS or possibly unspecified other impact in the function XListExtensions in ListExt.c. However, the provided code is a different function XListFonts, and it does not contain the same vulnerability.

However, the provided code does have some issues that should be addressed:

1. Memory leaks: If the call to _XReply fails, the code allocates memory using Xmalloc for 'flist' and 'ch' but does not free them in case of an error.

2. Insecure function usage: The code uses the insecure function _XSend instead of a safer alternative like Data.

3. Improper error handling: The code does not handle errors properly. For example, if the call to _XReadPad fails, the code does not handle the error and continues execution, which can lead to unpredictable behavior or memory corruption.

4. Buffer overflow: The code does not check if the length variable is within the bounds of the allocated memory for the 'ch' buffer, which can lead to a buffer overflow.

5. Null pointer dereference: The code does not check if",2338,301,29.38023090362549
177920,nan," NO.

The provided C++ code is a function for finding the k smallest pairs between two vectors `nums1` and `nums2`. It does not contain any of the vulnerabilities mentioned in the audit steps. It is a different piece of code and does not share the same vulnerabilities as the initial code with the CVE-2018-14599 and CWE-682.",1728,90,9.204511880874634
