case_id,vuln_type,audit_report,input_token_num,output_token_num,inference_time
177921,nan," NO, the second code snippet is not vulnerable to the same issue as the first one. The second code snippet is an implementation of the k-smallest pairs problem and does not contain any buffer handling or memory allocation vulnerabilities as in the first code snippet.",1812,56,6.615828037261963
177922,Exec Code Overflow," NO, the provided C++ code is not vulnerable to the Exec Code Overflow vulnerability. The vulnerability you described is related to the iptables-restore program and the netfilter iptables, not the provided code snippet.

The provided code snippet is a function for adding parameters to argv, and it does not contain any vulnerabilities related to buffer overflow or code execution. It uses a fixed-size buffer, `param_buffer`, with a size of 1024, and checks if the length of the parameter being added exceeds the buffer size using `if (param_len >= sizeof(param_buffer))`. If the length exceeds the buffer size, it throws an error.

Therefore, the provided code snippet is not vulnerable to the Exec Code Overflow vulnerability.",2177,173,17.45498490333557
177923,Bypass," NO.

The provided C++ code has no direct relation to the vulnerability described for the `move_uploaded_file` function. The vulnerability in the original code was due to the truncation of a pathname upon encountering a \x00 character, which allowed remote attackers to bypass intended extension restrictions and create files with unexpected names via a crafted second argument. The new code provided is an implementation of the `kSmallestPairs` function, which has no similar functionality or potential vulnerabilities as the original `move_uploaded_file` function.",1781,122,12.573296785354614
177926,Exec Code Overflow," NO.

The provided code snippet for the `gst_vorbis_tag_add_coverart` function is the same as the one in the vulnerability description. However, the vulnerability is related to an integer overflow in the `g_base64_decode_step` function, which is not shown in the provided code.

The `vector<pair<int, int>> kSmallestPairs` function is not related to the `gst_vorbis_tag_add_coverart` function and does not contain any known vulnerabilities based on the provided code.",1783,127,12.525062561035156
177927,nan," NO.

The given C++ code is the updated version of the previous code, and it addresses the CVE-2017-11144 vulnerability (CWE-754). The code now checks the return value of the OpenSSL sealing function, preventing the crash of the PHP interpreter.",3886,70,7.984195709228516
