case_id,vuln_type,audit_report,input_token_num,output_token_num,inference_time
177736,Bypass," NO, this code is not vulnerable to the described issue CVE-2015-8467, CWE-264. The provided code snippet is a function definition for `samldb_check_user_account_control_acl` and a map for `uac_to_guid`. It does not contain any vulnerabilities related to bypassing intended access restrictions during creation of machine accounts.

However, the code could still have other vulnerabilities as mentioned in your initial list. To ensure the security of the code, you should still check for the issues mentioned in the list.",2480,129,13.054554224014282
177740,DoS Exec Code Overflow Mem. Corr.," NO, this code is not vulnerable to the mentioned vulnerability type. It is a different implementation and does not involve any parsing of X.509 certificates or handling of user-supplied inputs. It is a function for finding k smallest pairs of numbers from two given vectors.",1967,60,6.845250129699707
177741,DoS Overflow," NO.

The provided C++ code is not vulnerable to the same type of DoS Overflow vulnerability as the initial code snippet. This code is implementing a function to find the k smallest pairs between two vectors, and it does not contain any memory handling or buffer manipulation that could lead to a buffer overflow or other similar vulnerabilities.",1225,72,7.415757417678833
177742,DoS Overflow," NO, this code is not vulnerable to the same type of DoS Overflow vulnerability. The given code is a different function that does not contain the same issue as the original vulnerable function. However, it is always important to thoroughly check all code for vulnerabilities, even if it is a different function.",1195,63,7.051547288894653
177743,DoS," Answer:

NO.

The provided C++ code is a function for creating a directory stream for a PHP extension. It does not contain any of the vulnerabilities mentioned in the steps for the vulnerability audit. It is a different function from the one you mentioned as vulnerable, so it should be analyzed separately.",3815,66,7.527099132537842
177747,DoS," NO.

The code you provided is not vulnerable to the described denial of service vulnerability. It is a different function that deals with vector manipulation and has no relation to the bgp_attr_unknown function. The vulnerability you described is due to the uninitialized total variable in the bgp_attr_unknown function, but this variable does not exist in the provided vector manipulation function.",2051,84,9.432515859603882
177750,DoS Exec Code," NO, this code is not vulnerable to CVE-2018-1000039 (CWE-416) or DoS_Exec_Code vulnerability. The code snippet provided is different from the one associated with the CVE-ID, and there are no signs of use-after-free vulnerabilities in this code.

However, I would like to point out that the code does not follow best practices for error handling (CWE-248). In the `fz_try` block, if an error occurs, it is ignored, and the error state is not properly handled. It is recommended to handle errors gracefully, such as propagating the error or logging it for further investigation.

Also, the code does not follow the best practice for input validation (CWE-20). In the `push` function, there is no validation of the indices (i, j) before using them to access the `nums1` and `nums2` vectors. Although this is not directly related to the given vulnerability, it is still a security concern.",2068,236,23.209901809692383
177766,DoS," Answer:

NO.

The provided `ldap_push_filter` function does not have the same vulnerability as the first code snippet you provided. The vulnerability in the first snippet was due to the lack of checking return values for successful ASN.1 memory allocation, which is not present in this function.

However, I did notice that the `ldap_push_filter` function is not checking the return value of `asn1_write_OctetString` and `asn1_write_DATA_BLOB_LDAPString`. If these functions could fail and the failure needs to be handled, then checking their return values would be necessary.

Regarding the `kSmallestPairs` function, it does not contain any obvious vulnerabilities based on the provided code. It is a sorting and priority queue implementation that returns the k smallest pairs of elements from two given vectors.",4429,195,19.91437864303589
177767,DoS," NO, the second code snippet is not vulnerable to the same Denial of Service (DoS) vulnerability as the first one. The second code snippet is a function to find k smallest pairs of elements from two arrays, while the first one is an LDAP packet parser. The vulnerability in the first code snippet is due to insufficient error checking and memory allocation handling during the parsing of LDAP packets, which is not present in the second code snippet.",2073,99,10.641258955001831
177768,DoS," NO.

The provided C++ code is not vulnerable to the same issue as the previous one. It does not contain the function `sparse_dump_region`'s implementation, but based on the provided code, it does not contain any glaring vulnerabilities like the previous one. The code snippet provided is a different function `kSmallestPairs` which does not have any direct relation to the vulnerable function. Therefore, it is not vulnerable according to the given context.",2525,101,10.737981081008911
177770,Bypass," NO.

The function `read_ndx_and_attrs` does not contain any vulnerabilities related to the bypass issue described in CVE-2017-17434. The function deals with file indexes and input/output flags, and it does not contain any logic that would bypass intended access restrictions based on filenames.

The vulnerability in the original code is located in a different part of the program, where the daemon_filter_list data structure is not properly checked for fnamecmp filenames, and the sanitize_paths protection mechanism is not applied to pathnames found in ""xname follows"" strings. However, the provided function `read_ndx_and_attrs` does not contain any such logic.",3339,164,16.687192678451538
177771,nan," NO, the second code snippet is not vulnerable to the nan vulnerability described in the CVE-2018-20103 and CWE-835. The code is a different function that does not contain the same logic for handling compressed pointers in DNS packets. The first code snippet is vulnerable because it has a recursive function call with a pointer that can point to a previous position in the buffer, causing an infinite recursion or stack exhaustion. The second code snippet does not have this vulnerability.",1764,115,12.979879379272461
177773,DoS Exec Code Overflow Mem. Corr.," NO, the second code is not vulnerable to the mentioned vulnerability. The first code is vulnerable because it uses unsafe arithmetic operations without proper checks, leading to an integer overflow. However, the second code does not contain any such operations, so it is not susceptible to the same type of vulnerability.",1522,64,6.523279428482056
177774,DoS Exec Code Overflow," NO, this code snippet is not vulnerable to the mentioned DoS Exec Code Overflow vulnerability. The code you provided is a copy of the initial one, but without the specific vulnerability-prone parts mentioned in the CVE-2009-3605 report. The code you provided does not contain any integer overflows or other vulnerabilities mentioned in the report.

However, I would like to point out that the code you provided at the end of the message, which is a function for finding k smallest pairs, is not related to the initial question and is located outside of the vulnerable SplashOutputDev class. It is a separate function that does not contain any known vulnerabilities.",3200,150,15.81534457206726
177775,DoS Exec Code Overflow," NO, this code snippet is not directly vulnerable to the DoS_Exec_Code_Overflow vulnerability mentioned in CVE-2009-3605 and CWE-189. The reason is that the code snippet provided does not contain any integer overflows related to the issues described in the vulnerability summary. However, it is still essential to ensure that the rest of the codebase follows secure coding practices as well.

Additionally, the code snippet provided is a function for drawing an image, and it does not seem to have any direct relation to the vector-based function `kSmallestPairs` provided at the end. It is essential to analyze the relevant code related to the vulnerability.",2438,155,16.196415901184082
177777,DoS Exec Code Overflow," Answer:

NO, the provided function is not vulnerable to the DoS Exec Code Overflow vulnerability (CVE-2009-3605, CWE-189) mentioned in the question. The function does not have any integer overflows that could lead to a security vulnerability. However, it is essential to check other functions called within this function and the overall design to ensure there are no other vulnerabilities.

That being said, the function does have potential memory issues and possible performance problems. For instance, it does not check if there is enough memory available before allocating `buffer` using `gmalloc`. If `width`, `height`, or `colorMap->getNumPixelComps()` have large values, this could exhaust the available memory, leading to a denial of service.

Furthermore, the function allocates memory for `imgStr` using `new`, but it does not check if the allocation was successful. If the allocation fails, a `std::bad_alloc` exception could be thrown, causing the function to terminate abruptly.

Lastly, the function copies the image data in a loop, which might be inefficient for large images. It could be optimized using `memcpy` or `memmove`.

In conclusion, the provided function is not vulnerable to the specific DoS Exec Code Overflow vulnerability (CVE-200",2968,301,29.216559410095215
177778,DoS Exec Code Overflow," NO, this code snippet does not contain the DoS_Exec_Code_Overflow vulnerability described earlier. It does not have any integer overflows that could lead to a security issue. However, it is always important to validate and sanitize user inputs (CWE-20) and ensure proper error handling (CWE-248) as a general best practice.",3252,80,9.802156925201416
177779,DoS Exec Code Overflow," NO.

The given code does not contain the DoS Exec Code Overflow vulnerability as described in CVE-2009-3605 and CWE-189. The vulnerability is related to integer overflows in specific files (Poppler 0.10.5 and earlier) that are not part of the provided code. The provided code is a method for drawing soft-masked images and does not contain any of the listed vulnerabilities.",3312,103,10.999378204345703
177780,DoS Exec Code Overflow," Answer:

NO.

The provided code does not contain the DoS_Exec_Code_Overflow vulnerability as in the previous example. It does not have any integer overflows that could lead to a denial of service or arbitrary code execution. The calculation of `maxPixel` is done safely and there are no unvalidated user inputs or unchecked calculations that can cause integers to wrap around.",3534,87,9.700914144515991
177781,DoS Exec Code Overflow," NO, this code is not vulnerable to the mentioned DoS Exec Code Overflow vulnerability. The code you provided is a different implementation and does not contain any signs of integer overflows or buffer overflows. However, it is always important to ensure that the variables `length`, `nComps`, and `nComps2` are validated and do not exceed the allocated memory.",1352,83,8.766834020614624
177783,DoS Exec Code Overflow," NO, this code is not vulnerable to the mentioned DoS Exec Code Overflow vulnerability. The code does not contain any arithmetic operations that can lead to an integer overflow or underflow. It also does not contain any buffer operations that can lead to a buffer overflow. The code is working with memory allocation and deallocation, but it does not contain any use-after-free or memory leak vulnerabilities. The code also does not contain any null pointer dereferencing, improper input validation, race conditions, insecure function usage, insecure resource management, or improper error handling. The code is also working with data, but it does not contain any cryptographic issues or sensitive data exposure.",1346,146,14.894071817398071
177786,DoS Exec Code Overflow," NO, this code snippet is not vulnerable to the mentioned DoS Exec Code Overflow vulnerability. The code in the snippet is different from the one you provided earlier, and I do not see any integer overflows or other vulnerabilities based on the provided code. However, I would still recommend checking the rest of the application for the mentioned vulnerabilities as they might be present in other parts of the code.",3196,87,9.677471399307251
177787,DoS Exec Code Overflow," Answer:

NO.

The provided code is the same as the previous one, with the same variable names and structure, but without the vulnerable operations. The potential vulnerabilities you mentioned earlier, such as the lack of input validation or the unchecked array access, do not exist in this specific code snippet. Therefore, based on the provided code, I cannot identify any security vulnerabilities.",4302,82,9.139552354812622
177788,DoS Exec Code Overflow," Answer:

NO.

The provided code does not contain the DoS_Exec_Code_Overflow vulnerability as described in CVE-2009-3605 and CWE-189. The code snippet is different from the one mentioned in the vulnerability summary. However, it is still important to check the rest of the code for the mentioned vulnerabilities in the 12-point checklist.",4008,93,10.530754327774048
177789,DoS Exec Code Overflow," NO, this code is not vulnerable to the mentioned DoS Exec Code Overflow vulnerability. It does not contain any integer overflows or other vulnerabilities mentioned in the original code. It is a different function that does not perform any operations on untrusted input or perform any risky memory operations.",1774,64,7.086826801300049
177792,DoS Exec Code Overflow," NO, the provided `SplashBitmap` constructor does not contain any of the vulnerabilities listed in the steps. It does not have any buffer overflow, use-after-free, memory leak, integer overflow/underflow, null pointer dereference, or improper input validation issues. However, it is still essential to check the rest of the codebase for the mentioned vulnerabilities.

Regarding the `kSmallestPairs` function, it is not vulnerable based on the provided code. It is a well-structured function that calculates the k smallest pairs of elements from two vectors using a priority queue. The function does not contain any of the vulnerabilities listed in the steps.",1442,144,15.721792936325073
177793,DoS Exec Code Overflow," NO.

The function you provided is a different implementation compared to the original vulnerable code. It does not contain any integer operations on user-provided inputs that can lead to an integer overflow or underflow. Therefore, it is not vulnerable to the DoS Exec Code Overflow vulnerability (CVE-2009-3605, CWE-189) based on the provided code.

However, I noticed that there is another piece of code provided for `kSmallestPairs`. While this code is not directly related to the original question, it is still important to ensure its security. I did not find any obvious vulnerabilities in this code, but I would still recommend the following best practices:

1. Input validation: Ensure that the inputs (nums1 and nums2) are validated before passing them to the function. Check for conditions like empty vectors or invalid k values.

2. Error handling: Add proper error handling for cases where the inputs are invalid or the function cannot complete its execution as expected.

3. Code comments: Add comments to the code to improve readability and maintainability.

4. Unit testing: Write unit tests to verify the correctness of the function and to catch potential issues early in the development cycle.",2578,271,26.80553650856018
177794,nan," NO, the second code snippet is not vulnerable to the same issue as the first one. It does not involve the DynamicMetadataProvider class or any of the problematic security checks mentioned in the CVE summary. It is a different function that deals with vector manipulation and has no direct relation to the vulnerability in the first code snippet.",1690,72,7.87474513053894
177795,nan," NO.

The provided code snippet is a constructor for the `DynamicMetadataProvider` class, and it does not contain any of the vulnerabilities listed in the steps you provided. It is a simple class constructor that initializes various member variables based on the input XML element. The code does not have any buffer overflow, use-after-free, memory leak, integer overflow/underflow, null pointer dereference, or improper input validation issues. It does not contain any multi-threaded code, insecure function usage, or insecure resource management issues. The error handling in the code is also adequate.

However, the code snippet does not include cryptographic functions or sensitive data handling, so it is impossible to evaluate those aspects based on the provided code. Nonetheless, the code snippet is not vulnerable according to the given list of vulnerabilities.",1838,179,18.747551918029785
177796,Overflow," NO, this code is not vulnerable to the same issue as the previous one. The given code snippet does not contain any buffer operations based on user input or data received from an untrusted source. It only processes internal data structures and does not exhibit any signs of a buffer overflow vulnerability.",1579,61,6.890725612640381
177799,Overflow," NO, this code is not vulnerable to the same issue as the first one. The first code has a potential integer overflow when calculating the number of bytes to read for the pixels array, as it does not check if the multiplication of width and height exceeds the maximum value of an integer. However, the second code does not read any pixels, so there is no such calculation or potential overflow.

The second code snippet you provided is a function for finding the k smallest pairs of elements from two arrays, and it does not contain any dynamic memory allocation or file I/O operations, which are common sources of vulnerabilities. Therefore, it is not vulnerable to the issues mentioned in the steps provided.

However, it is essential to note that this answer only considers the provided code snippet and not the entire codebase. Other parts of the code might still contain vulnerabilities, and a thorough security audit should consider all relevant code.",1710,193,21.238991260528564
177807,Bypass," NO, this code is not vulnerable to the same type of bypass vulnerability as the previous code. The changes made to the code effectively address the issue related to CVE-2018-19476 and CWE-704. The function now checks for the presence of the ""DataSource"" entry in the dictionary, and it does not proceed with the creation of the ICC profile if the entry is not found. This ensures that the intended access restrictions are in place and not bypassable through the provided code.

The vector<pair<int, int>> kSmallestPairs function is not related to the previous vulnerability and is not vulnerable to the same or similar types of attacks. It is a separate function that calculates the k smallest pairs of elements from two given vectors, and it does not contain any known security vulnerabilities based on the provided code.",1859,185,20.40888214111328
177809,Bypass," NO, the provided code is not vulnerable according to the given CVE-2018-19475 description. The vulnerability in the original code was related to the unchecked stack space when the device remains the same. However, in the given code, there are checks for stack overflow in the 'if (LockSafetyParams &&!samepagedevice)' block, which ensures that the stack space is checked, making it not vulnerable to the described issue.

The vector-based code you provided at the end of the question is not related to the provided vulnerability and is not part of the question. It is a separate function for finding the k smallest pairs of elements from two vectors, and it does not contain any known vulnerabilities based on the provided information.",2220,164,16.76411724090576
177811,DoS," NO, the provided code is not vulnerable to the same issue as the original `aspath_put` function. This new code snippet defines a function `kSmallestPairs` that calculates the k smallest pairs of elements from two vectors. It does not contain any of the functions or logic that led to the vulnerability in the original `aspath_put` function. Therefore, it is not vulnerable to the same Denial of Service (DoS) vulnerability.",2179,99,11.387593746185303
177812,Bypass," NO, the second code snippet is not vulnerable to the same issue as the first one. The second code is implementing a different functionality that deals with pairs of integers and a priority queue, and there is no bypass vulnerability in this code.",1384,52,6.621398687362671
177815,Bypass," NO, the provided `file_checksum` function is not vulnerable to the same issue as described in CVE-2017-15994. The vulnerability in the original code was due to improper handling of archaic checksums, which is not present in this version.

However, the `kSmallestPairs` function has no relation to the `file_checksum` function, and it is not vulnerable based on the provided code. It is a function that calculates the k smallest pairs of elements from two vectors, and it does not contain any obvious security vulnerabilities.",2014,130,14.641960382461548
177816,Bypass," NO, the provided `get_checksum2` function is not vulnerable to the bypass vulnerability described for the original code. The vulnerability in the original code was due to mishandling of archaic checksums, which is not reflected in this function. This function only contains code for computing MD5 and MD4 checksums and does not contain any vulnerabilities mentioned in the given vulnerability audit steps.

However, the `kSmallestPairs` function provided has no relation to the `get_checksum2` function and should be reviewed separately for any vulnerabilities. In this case, the `kSmallestPairs` function does not contain any of the vulnerabilities mentioned in the given vulnerability audit steps.",2074,156,15.906465768814087
177821,DoS, NO. The provided code is not vulnerable to the described DoS vulnerability. It is a different function that does not process IRC color formatting codes.,1122,33,3.784017324447632
177823,Exec Code Overflow," NO, the provided code is not vulnerable to Exec Code Overflow (CVE-2011-2895, CWE-119) as it is a different function. The vulnerable function is in the decompression code, while the provided function is related to buffering and has no similar vulnerabilities as the original code.",2243,73,9.267595291137695
177825,DoS," NO, this code is not vulnerable to the same format string vulnerability as the previous one. It does not use user-supplied input directly in a formatted string, so it does not meet the criteria for CWE-20 (Improper Input Validation). The code does use `snprintf` safely by specifying the buffer size and using `pageNo` as a formatting argument, not a user input.

However, it is essential to note that this code snippet is not related to the previous one, and it is always necessary to evaluate each piece of code individually for vulnerabilities.",1541,127,13.623815536499023
177826,DoS Exec Code Overflow," NO.

The provided code does not contain any of the vulnerabilities listed in the steps for the vulnerability audit. It is a function for finding the k smallest pairs of elements from two arrays, and it does not contain any unsafe memory management, unvalidated user input, or other common vulnerabilities.",1412,64,8.064835548400879
177827,nan," NO.

The provided code has no direct relation to the vulnerability described in CVE-2007-4849 and CWE-264. The vulnerability is related to the JFFS2 filesystem's POSIX ACL support, while the given code is about finding k smallest pairs of elements from two vectors.",1850,76,8.027016878128052
177831,nan," NO, this code is not vulnerable to the nan vulnerability mentioned in the previous example. It does not involve string manipulation or memory allocation functions that could lead to a buffer over-read. It is a function for removing components of a tag record in a PDF file, and it does not contain any obvious security vulnerabilities based on the provided code.

However, it is still important to review the rest of the codebase and ensure that proper security measures are in place, such as input validation, error handling, and memory management.",1592,110,11.47691798210144
177832,nan," NO, the provided `walk_string` function is not vulnerable to the same issue as the original code. The vulnerability in the original code was due to a missing check for a null string in the calling function. In this code, there is no such vulnerability because the check for `str->utf8 == NULL` is present at the beginning of the function.

However, the new code snippet at the end of your message is a different function, `kSmallestPairs`, which is not vulnerable to the same issue either, as it doesn't have any string manipulation or memory allocation. It is a sorting function that sorts pairs of integers based on their sum.",1438,144,14.727109432220459
177833,DoS Overflow," Answer:

NO.

The function reds_handle_ticket does not contain any of the vulnerabilities listed in the audit steps. It has a correct usage of the RSA_private_decrypt function and checks for the password length. However, it is not clear from the provided code if the length of the encrypted_data is checked before passing it to RSA_private_decrypt.

The second code snippet is not related to the reds_handle_ticket function and is a different function that finds k smallest pairs from two given arrays. It does not contain any of the vulnerabilities listed in the audit steps.",1456,137,14.44534969329834
