case_id,vuln_type,audit_report,input_token_num,output_token_num,inference_time
177907,DoS Exec Code Overflow," NO, the provided code is not vulnerable to the mentioned DoS Exec Code Overflow vulnerability (CVE-2013-1788, CWE-119). The code snippet is different from the previous one and does not contain any suspicious operations that could lead to a similar vulnerability. However, it is still important to check for other potential vulnerabilities as mentioned in the original list.",1600,88,8.806280136108398
177909,DoS Exec Code Overflow," NO, this code is not vulnerable to the described DoS Exec Code Overflow vulnerability. The given code snippet is a function for scaling a mask and does not contain any of the vulnerabilities listed in the steps provided.

However, the code snippet you provided at the end, `maxUpgrades`, has no relation to the vulnerabilities discussed. I will check it for the vulnerabilities listed in the steps:

1. Buffer Overflow: No, there are no string or memory functions that could lead to buffer overflow vulnerabilities.
2. Use After Free: No, there are no dynamic memory allocations and deallocations in this function.
3. Memory Leaks: Not applicable, as there are no dynamic memory allocations in this function.
4. Integer Overflow/Underflow: It's possible, but not explicitly visible in this code. It depends on the input values and the implementation of `ceil_divide`.
5. Null Pointer Dereference: No, there are no dereferenced pointers in this function.
6. Improper Input Validation: Can't be determined without knowing the input sources.
7. Race Conditions: Not applicable, as this function doesn't involve multi-threading or shared resources.
8. Insecure Function Usage: Not applicable, as there are no insecure functions used in this function.
9. Insecure Resource Management: Not",1586,301,34.73198223114014
177910,DoS," NO, the second code snippet is not vulnerable to the same issue as the first one. The second code snippet is a function for calculating the maximum number of upgrades based on certain conditions, while the first code snippet is related to scanner state management in Ghostscript. The two pieces of code handle different functionalities, and the vulnerability in the first code snippet is not present in the second one.",1179,87,10.133039236068726
177911,Exec Code Overflow," NO.

The provided C++ code does not contain any of the vulnerabilities listed in the audit steps. It is a simple function that validates a font table by checking glyph indices against a valid glyph count. The code correctly uses bounds checking and dereferencing checks, and it does not contain any of the other vulnerabilities listed.

The second code snippet is a function that calculates the maximum number of upgrades for a set of servers based on their current count, upgrade cost, sell price, and available money. This code also does not contain any of the vulnerabilities listed in the audit steps. It uses integer arithmetic and bounds checking correctly, and it does not contain any insecure function usage or resource management issues.",1042,155,15.111958980560303
177912,Exec Code Overflow," NO, this code is not vulnerable to the Exec Code Overflow vulnerability (CWE-189) as described in CVE-2009-0946. The provided code is a different function that does not contain any integer overflows related to the issue. However, the code should still be checked for other potential vulnerabilities as mentioned in the original audit guidelines.",1280,83,8.760015487670898
177913,Exec Code Overflow," NO, this code is not vulnerable to the same type of Exec Code Overflow vulnerability as the previous code. The integer overflows in the previous code were due to incorrect calculations with user-provided input, but this code does not contain any such calculations. It does perform arithmetic operations, but they are all on local variables or function parameters, not on user input. However, it is still important to validate and sanitize user inputs before passing them to this function to prevent other types of vulnerabilities.",2282,107,10.86439299583435
177915,Exec Code Overflow," NO, this code is not vulnerable to the Exec Code Overflow vulnerability with CVE-2009-0946 and CWE-189. The given code snippet is different from the vulnerable code provided earlier. However, it is essential to continue checking the rest of the code for other potential vulnerabilities.

The new code snippet contains a function for calculating upgrades based on given parameters, which is unrelated to the previous vulnerable code. Therefore, it is not vulnerable to the Exec Code Overflow vulnerability.",1862,117,14.78739595413208
177917,Exec Code," NO, the provided code is not vulnerable to the Exec_Code vulnerability described. The code does not contain any operations that interpret a variable as signed instead of unsigned, which was the root cause of the vulnerability in the original code. However, it is still important to check for other potential vulnerabilities as mentioned in the initial steps.",1605,70,9.001746416091919
177918,Exec Code," NO, the provided code is not vulnerable to the Exec_Code vulnerability (CVE-2018-14600, CWE-787). The issue in the original code was related to interpreting a variable as signed instead of unsigned, causing an out-of-bounds write. However, the given code does not contain this specific issue. It is always important to carefully examine the code in question and compare it to the vulnerability description to ensure a proper assessment.",1655,105,13.06656551361084
177919,nan," NO, this code is not vulnerable to the described issue CVE-2018-14599 (CWE-682). The vulnerability in the original code was due to an off-by-one error caused by malicious server responses, leading to DoS or possibly unspecified other impact in the function XListExtensions in ListExt.c. However, the provided code is for the XListFonts function in a different source file, so it does not contain the vulnerable code.

However, the provided code does have a memory leak in the case where memory is allocated for 'ch' but an error occurs before it is fully used. In this case, the allocated memory is not freed before returning.

To fix this, you should free the memory for 'ch' before returning in the error case:

```cpp
if ((! flist) || (! ch)) {
    Xfree(flist);
    Xfree(ch); // Free 'ch' here
    _XEatDataWords(dpy, rep.length);
    *actualCount = 0;
    UnlockDisplay(dpy);
    SyncHandle();
    return (char **) NULL;
}
```

Also, consider using RAII (Resource Acquisition Is Initialization) techniques, such as smart pointers, to manage memory automatically and",2200,301,29.132142543792725
177920,nan," NO, this code is not vulnerable to the same issue as the given code. The given code is vulnerable to an off-by-one error caused by malicious server responses, but the provided code does not have any interaction with server responses or any network communication. It only performs local memory allocations and manipulations. However, it is essential to note that the provided code has other potential issues, such as memory leaks and improper error handling, which should be addressed.",1590,97,9.898292541503906
177921,nan," NO, the provided code is not vulnerable to the same issue as the original code. The code you provided is implementing a different functionality and does not contain the off-by-one error from the original vulnerable function `XListExtensions`. However, it is important to ensure that the input vectors (count, upgrade, sell, money) are validated and sanitized before passing them to this function to prevent other potential vulnerabilities.",1674,88,11.026917695999146
177922,Exec Code Overflow," Answer: YES

The function add\_param\_to\_argv is vulnerable to a buffer overflow (CWE-119). The code uses a fixed-size buffer (param\_buffer) of 1024 characters to store the parsed parameters. However, there is no bound checking when copying characters to this buffer with param\_buffer[param\_len++]. If the input string contains more than 1023 characters, it will result in a buffer overflow, leading to undefined behavior, including potential code execution (CVE-2019-11360).

The vector calculations and the maxUpgrades function are not related to the vulnerability and are not causing any security issues in the provided code.",2039,156,15.214897155761719
177923,Bypass," Answer:

NO.

The provided code for the `move_uploaded_file` function is the same as the vulnerable code you've given, but it is not the relevant code for the vector calculation function `maxUpgrades`. The `maxUpgrades` function does not have any apparent vulnerabilities related to the CVE-2015-2348 and CWE-264. It calculates and returns the vector `result` based on the input vectors `count`, `upgrade`, `sell`, and `money`.",1643,120,14.806780576705933
177926,Exec Code Overflow," NO, the provided code is not vulnerable to the same Exec Code Overflow vulnerability. The given code is a different function that does not contain any arithmetic operations or user inputs that could lead to an overflow. However, it is still important to check other potential vulnerabilities as mentioned in the initial steps.",1645,65,6.762321472167969
177927,nan," NO.

The given C++ code is the same as the previous one, but with a different function that doesn't seem to be related to the vulnerability. The nan vulnerability is not present in this code snippet. The vulnerability is related to the OpenSSL library and the PHP interpreter, not the provided code itself.",3748,71,8.679479837417603
