case_id,vuln_type,audit_report,input_token_num,output_token_num,inference_time
177736,Bypass," NO, this code is not vulnerable to the described issue CVE-2015-8467, CWE-264. The provided code snippet is a function definition for `samldb_check_user_account_control_acl` and an array of `uac_to_guid` structs. It does not contain any vulnerabilities related to bypassing intended access restrictions during creation of machine accounts.

However, the code might still have other vulnerabilities as per the 12 points mentioned in the question. To ensure the security of the code, it should be thoroughly checked for the mentioned vulnerabilities.",2342,136,15.42813515663147
177740,DoS Exec Code Overflow Mem. Corr.," NO, the provided code is not vulnerable to the mentioned vulnerability type (DoS Exec Code Overflow Mem. Corr.). The code does not contain any functionality related to parsing or handling X.509 certificates, which was the root cause of the vulnerability in the original code. The function `asn1_time_to_time_t` deals with time parsing but not certificate parsing.

However, the code still has some potential issues that should be addressed:

1. Input validation: The code does not validate the input `timestr`. It is assumed to be of a certain length, but there is no check for this. It is a good practice to validate inputs before processing them.

2. Memory management: The code uses `estrdup` to duplicate the input string, but there is no check if the memory allocation was successful. It is a good practice to check if the memory allocation was successful before using the allocated memory.

3. Code readability: The code is difficult to read due to the lack of comments and inconsistent indentation. It is a good practice to make the code more readable by adding comments and consistent indentation.

4. Integer overflow: The code uses `static_cast<int64_t>` to avoid integer overflow, but it is still a good practice to validate the inputs and ensure that the calculation does not result in an overflow.
",1829,301,32.650240898132324
177741,DoS Overflow," NO, the provided code is not vulnerable to the same type of DoS Overflow vulnerability. The given code is a vector calculation function and does not contain any memory handling or copying operations that could lead to a buffer overflow or denial-of-service vulnerability. The function maxUpgrades calculates the minimum number of upgrades based on given vectors and does not have any direct security implications.",1087,83,9.456340312957764
177742,DoS Overflow," NO, the second code snippet is not vulnerable to the same issue as the first one. The second code snippet does not contain any buffer operations or memory allocation that could be exploited to cause a buffer overflow or denial of service. It is a different function that performs integer calculations and array indexing based on user-provided input, but it does not have the same vulnerability as the first code snippet.",1057,87,8.547754287719727
177743,DoS," Answer:

NO.

The provided C++ code snippet does not contain any of the vulnerabilities mentioned in the steps for the vulnerability audit. It is a function for creating a directory stream and does not contain any error-prone operations that could lead to the mentioned vulnerabilities.",3677,62,8.048567771911621
177747,DoS," NO, the provided code for the function `bgp_attr_unknown` does not contain the same vulnerability as the first code snippet. The total variable is now defined as `bgp_size_t total;` and is initialized before it is used in the `memcpy` function. Therefore, it is not vulnerable to a denial of service (bgpd crash) via a crafted BGP update.

The second code snippet you provided is a function for calculating the maximum number of upgrades for servers, and it does not contain any obvious security vulnerabilities related to the tasks mentioned in the vulnerability audit.",1913,133,15.647279500961304
177750,DoS Exec Code," NO, the provided code is not vulnerable to the CVE-2018-1000039 vulnerability. The code you analyzed earlier and the code you provided in the question are the same. The vulnerability is related to a heap use-after-free bug in the PDF parser, and since this code is not part of the PDF parser, it is not vulnerable to that specific issue.

However, it is essential to analyze the rest of the codebase, especially the PDF parser, to ensure there are no vulnerabilities. The code snippet you provided does not contain any of the vulnerabilities mentioned in the 12-step vulnerability audit.",1930,141,14.520319938659668
177766,DoS," Answer:

NO.

The provided code is a reimplementation of the previous vulnerable function, but with necessary modifications to avoid the memory consumption and daemon crash issue. The code now checks the return values of ASN.1 memory allocation and handles potential errors, thus mitigating the vulnerability.",4291,65,7.856639862060547
177767,DoS," NO, this code is not vulnerable to the described DoS vulnerability. The given code is a different function, and the vulnerability described is related to the LDAP server in the AD domain controller in Samba 4.x before 4.1.22, which is not present in this code.

However, the code you provided for `maxUpgrades` function should be checked for other potential vulnerabilities using the steps mentioned in the original question.",1935,97,10.30449891090393
177768,DoS," NO.

The provided C++ code is not directly related to the vulnerability in the initial code snippet. The vulnerability in the initial code is due to mishandling file shrinkage during read access in the `sparse_dump_region` function. However, the provided code is an implementation of the `maxUpgrades` function, which deals with vector manipulations and has no relation to the vulnerability.",2387,90,9.288772583007812
177770,Bypass," NO.

The function you provided is a completely different function from the one you mentioned as vulnerable. It is a function for calculating the maximum number of upgrades for servers, based on counts, upgrade costs, sell values, and available money. It does not contain any of the vulnerabilities present in the original `read_ndx_and_attrs` function.",3201,77,9.689244747161865
177771,nan," NO, the provided code is not vulnerable to the nan vulnerability mentioned in the CVE-2018-20103 and CWE-835. The code snippet does not contain any recursive function calls or pointer arithmetic that could lead to stack exhaustion or infinite recursion. It is a different implementation than the previous vulnerable code.

However, it is still essential to check the rest of the vulnerabilities mentioned in the initial list.

1. Buffer Overflow: Not applicable in this code snippet.
2. Use After Free: Not applicable in this code snippet.
3. Memory Leaks: Not applicable in this code snippet.
4. Integer Overflow/Underflow: Not applicable in this code snippet.
5. Null Pointer Dereference: Not applicable in this code snippet.
6. Improper Input Validation: Not applicable in this code snippet.
7. Race Conditions: Not applicable in this code snippet.
8. Insecure Function Usage: Not applicable in this code snippet.
9. Insecure Resource Management: Not applicable in this code snippet.
10. Improper Error Handling: Not applicable in this code snippet.
11. Cryptographic Issues: Not applicable in this code snippet.
12. Sensitive Data Exposure: Not applicable in this code snippet.",1626,301,29.77375030517578
177773,DoS Exec Code Overflow Mem. Corr.," NO, the provided function `maxUpgrades` is not vulnerable to the same type of memory corruption vulnerability as `create_surface_from_thumbnail_data`. The `maxUpgrades` function is working with integer arithmetic and vector indexing, which do not have the same risks of buffer overflows or memory corruption as the previous function. However, it is still important to validate input vectors and ensure error handling in the calling code.",1384,94,9.255886793136597
177774,DoS Exec Code Overflow," Answer:

NO.

The function does not contain any of the vulnerabilities listed in the audit steps. It is a function for drawing an image and handling image data, and it does not contain any unsafe memory operations, unvalidated inputs, or insecure cryptographic practices.",3062,60,6.975701570510864
177775,DoS Exec Code Overflow," NO, this code snippet is not directly vulnerable to the DoS Exec Code Overflow vulnerability you described. The provided code is a drawing function for an image, and it does not contain any integer overflows or other vulnerabilities mentioned in your CVE and CWE IDs. However, it is essential to ensure that all functions and libraries called within this function are secure and do not contain any vulnerabilities.",2300,87,9.603922605514526
177777,DoS Exec Code Overflow," NO, this code snippet is not directly vulnerable to the described DoS_Exec_Code_Overflow vulnerability (CVE-2009-3605, CWE-189). The provided code is different from the previously analyzed vulnerable code. However, it is essential to ensure that the rest of the application follows secure coding practices as well.",2830,77,9.621642351150513
177778,DoS Exec Code Overflow," NO, this code snippet is not vulnerable to the mentioned DoS_Exec_Code_Overflow vulnerability (CVE-2009-3605, CWE-189). The given code is a modified version of the original vulnerable code, and the issue has been addressed in this version. The vulnerability in the original code was due to integer overflows in multiple locations, but the provided code does not contain those issues.

However, it is essential to perform a thorough security review of the entire codebase, as the code snippet you provided might be using functions or libraries that could contain other vulnerabilities.",3114,134,13.371871709823608
177779,DoS Exec Code Overflow," NO, this code is not vulnerable to the mentioned DoS Exec Code Overflow vulnerability (CVE-2009-3605, CWE-189). The provided code snippet does not contain any integer overflows related to the vulnerabilities listed in the given CVE summary. However, it is still essential to check the rest of the codebase for similar vulnerabilities.",3174,86,10.852665901184082
177780,DoS Exec Code Overflow," Answer:

NO.

The provided code does not contain any of the vulnerabilities listed in the steps for detecting security vulnerabilities. It is a constructor for a class that initializes various member variables based on input parameters and other objects. While there are some potential issues related to error handling and resource management, they do not fall under the categories of vulnerabilities specified in the steps.",3396,81,8.58069109916687
177781,DoS Exec Code Overflow," NO, this code is not vulnerable to the mentioned DoS Exec Code Overflow vulnerability (CVE-2009-3605, CWE-189). The provided code is a simple function for handling color maps and does not contain any of the mentioned vulnerabilities.

However, I cannot analyze the vulnerability of the `maxUpgrades` function without knowing the data provided to the function. I would recommend checking the following:

1. Ensure that the `count`, `upgrade`, `sell`, and `money` vectors are validated and sanitized before being passed to the `maxUpgrades` function.
2. Check if the values in the vectors are within expected ranges to prevent integer overflows or underflows.
3. Ensure that the division operation in the `ceil_divide` lambda function does not result in integer overflows or underflows.

By addressing these points, you can minimize the risk of introducing vulnerabilities in the `maxUpgrades` function.",1214,221,26.04210901260376
177783,DoS Exec Code Overflow," Answer:

NO, the provided code is not vulnerable to the mentioned DoS Exec Code Overflow vulnerability. The code you provided is a different function from the vulnerable one described. However, I will analyze it for other potential vulnerabilities:

1. Buffer Overflow: There are no signs of buffer overflow vulnerabilities in this function.

2. Use-After-Free: There are no use-after-free issues in this function.

3. Memory Leaks: There are no memory leaks in this function.

4. Integer Overflow/Underflow: The code uses `static_cast<int64_t>` to prevent integer overflows in the calculation. However, there is a potential risk if the input vectors (count, upgrade, sell, money) contain negative values or values larger than `INT_MAX`.

5. Null Pointer Dereference: There are no null pointer dereferences in this function.

6. Improper Input Validation: The function does not validate or sanitize its inputs, which could lead to issues if the input vectors contain invalid data.

7. Race Conditions: The function does not involve multi-threading, so there are no race conditions.

8. Insecure Function Usage: The function does not use any insecure or deprecated functions.

9. Insecure Resource Management: The function does not manage any resources",1208,301,31.63791561126709
177786,DoS Exec Code Overflow," Answer:

NO.

The function you provided does not contain any of the vulnerabilities listed in the steps for the audit. It is a function for handling image data, and while it does use dynamic memory allocation, it does not contain any glaring security issues. The function does not perform any error-prone arithmetic operations, input validations, or resource management that could lead to the vulnerabilities mentioned in the audit steps.",3058,92,10.354886054992676
177787,DoS Exec Code Overflow," Answer:

NO.

The vulnerability in the original code is due to multiple integer overflows in the Poppler library, specifically in the handling of image data. However, the provided code is just a modified version of the drawMaskedImage function, without any integer operations that could lead to an overflow. Therefore, it is not vulnerable to the same type of attack.

However, it is essential to note that the question only provides a part of the code, and the actual vulnerability might be in another part of the library or application. It is always necessary to thoroughly analyze the entire codebase and test the application to ensure there are no vulnerabilities.",4164,139,15.534762620925903
177788,DoS Exec Code Overflow," Answer:

NO.

The provided code does not contain the DoS_Exec_Code_Overflow vulnerability mentioned in the CVE-2009-3605. The code snippet is different from the one given in the vulnerability description. However, it is still important to check for other potential vulnerabilities as mentioned in the 12-step guide provided at the beginning.",3870,86,9.469791650772095
177789,DoS Exec Code Overflow," NO, this code snippet does not contain the DoS Exec Code Overflow vulnerability. The code you provided is a different function than the one described in the vulnerability summary. This function is calculating the minimum number of servers that can be upgraded based on certain conditions, and it does not contain any integer overflows or other vulnerabilities mentioned in the original code.",1636,79,9.639354467391968
177792,DoS Exec Code Overflow," NO, the SplashBitmap constructor is not vulnerable to the described DoS Exec Code Overflow vulnerability directly. The given code is the same as the previous example, and the vulnerability you described is related to other parts of the Poppler and Splash libraries.

However, I will analyze the vector<int> maxUpgrades function for potential vulnerabilities:

1. Integer Overflow/Underflow (CWE-190, CWE-191): In the lambda function 'ceil_divide', there is a possibility of integer overflow or underflow when calculating the division result. It is essential to ensure that the multiplication result does not exceed the maximum value of 'int64_t'.

2. Improper Input Validation (CWE-20): In the maxUpgrades function, there is no validation of the input vectors 'count', 'upgrade','sell', and'money'. If these vectors contain negative values or excessively large values, it could lead to unexpected behavior or errors.

So, the maxUpgrades function is not directly vulnerable to the original CVE-2009-3605 vulnerability, but it does have potential issues that should be addressed.",1304,264,25.35973072052002
177793,DoS Exec Code Overflow," NO, this code is not vulnerable to the mentioned DoS_Exec_Code_Overflow vulnerability. The vulnerable part of the original code was related to memory allocation and integer overflows, but the provided code snippet does not contain any memory allocation or arithmetic operations involving user input that could lead to an overflow. However, it is still essential to check the rest of the codebase for similar vulnerabilities.",2440,86,10.53169322013855
177794,nan," NO, the provided code is not vulnerable to the mentioned CWE-347 (Incorrect Calculation) vulnerability. It is a different code snippet and does not contain any arithmetic operations that could lead to an integer overflow or underflow. However, it is always important to validate and sanitize user inputs to prevent other potential vulnerabilities.",1552,75,8.659240245819092
177795,nan," NO, the provided code is not vulnerable to the mentioned CVE-2017-16852 and CWE-347. The code snippet is different from the previous one and does not contain any metadata provider-related functionality. It is a function for calculating the maximum upgrades based on given parameters.",1700,70,9.094766616821289
177796,Overflow," NO, the provided `nfs_readlink_req` function is not vulnerable to the same overflow vulnerability as in the original code. The length of the data being copied is obtained from the `len` variable, which is calculated correctly based on the number of `uint32_t` elements written to the `data` array. The length is then used in the `xzalloc` function to allocate memory for the `target` buffer.

However, the code you provided at the end, `maxUpgrades`, is not related to the `nfs_readlink_req` function and is a completely different function. It is not vulnerable to the overflow vulnerability discussed earlier. However, it is important to note that this function has its own logic and potential issues, such as integer division and potential overflow in the lambda function `ceil_divide`. The function may have other vulnerabilities or issues that are not directly related to the overflow vulnerability in the `nfs_readlink_req` function.",1441,212,25.059488534927368
177799,Overflow," Answer:

NO, the provided code is not vulnerable to the same issue as the original code. The reason is that there are no arithmetic operations performed on user inputs or untrusted data that can lead to an integer overflow in this part of the code. However, it is essential to ensure that the functions _XcursorFileReadChunkHeader, _XcursorReadUInt, and the vectors count, upgrade, sell, and money are secure and do not contain any vulnerabilities.",1572,101,10.185013771057129
177807,Bypass," NO, the provided code is not vulnerable to the same type of bypass vulnerability as the original code. The section of code you provided does not contain any direct comparison or checks related to the ""DataSource"" entry in the dictionary, unlike the original code where a bypass vulnerability was found due to type confusion.

However, it is still essential to review the rest of the codebase for similar vulnerabilities and ensure proper input validation, error handling, and secure resource management.",1721,99,10.980047464370728
177809,Bypass," NO, this version of the `restore_page_device` function is not vulnerable to the same bypass vulnerability described earlier. The primary reason is that the code now checks for stack overflow conditions when certain parameters are not equal, which prevents the bypass. However, it is essential to thoroughly test and review all code paths to ensure there are no other vulnerabilities present.

The `vector<int> maxUpgrades` function does not seem to be related to the original `restore_page_device` function, so it is not assessed in this response.",2082,118,11.868557929992676
177811,DoS," NO, the provided code is not vulnerable to the same issue as the original code with CVE-2017-16227. The new code calculates the length of the segments and packed segments more accurately, avoiding the double-counting issue. However, it is still important to ensure proper error handling, input validation, and other security best practices as mentioned in the initial vulnerability audit guidelines.",2041,86,10.831642866134644
177812,Bypass," NO, the `sum_update` function is not vulnerable to the same issue as described in CVE-2017-15994. The given code is a different implementation. However, I will analyze the function for other potential vulnerabilities.

1. Buffer Overflow: Not applicable since there are no string or memory functions with potential bounds issues.
2. Use-After-Free: Not applicable since there are no dynamic allocations or deallocations.
3. Memory Leaks: Not applicable since there are no dynamic allocations.
4. Integer Overflow/Underflow: The code does not perform any arithmetic operations that could lead to integer overflows or underflows.
5. Null Pointer Dereference: Not applicable since there are no dereferences of pointers that could be null.
6. Improper Input Validation: The function does not process user input directly, so it is not vulnerable to this type of issue.
7. Race Conditions: The function does not involve multi-threading or shared resources, so it is not vulnerable to race conditions.
8. Insecure Function Usage: The function uses `memcpy`, which is not insecure by itself.
9. Insecure Resource Management: Not applicable since there are no resources being managed.
10. Improper Error Handling: The function does not handle errors or exceptions.
11. Cryptographic",1246,301,34.79413104057312
177815,Bypass," NO, the provided code is not vulnerable to the same issue as the original code. The vulnerability in the original code was due to mishandling archaic checksums, which made it easier for remote attackers to bypass intended access restrictions. However, the provided code does not contain any checksum bypass vulnerabilities. It is a different function that calculates a file's checksum using various algorithms based on the `checksum_type` variable.",1876,98,11.437491178512573
177816,Bypass," NO, the provided code is not vulnerable to the same issue as the original code. The vulnerability in the original code was related to the mishandling of archaic checksums, which made it easier for remote attackers to bypass intended access restrictions. However, the provided code does not contain any checksum mishandling or access restriction bypass issues.

The provided code calculates a checksum using either MD5 or MD4 algorithms based on the `xfersum_type` variable. It checks for certain conditions and updates the context accordingly. While there might be other issues in the code, it is not vulnerable to the same type of vulnerability as the original code.",1936,145,14.59178876876831
177821,DoS," NO, the second code snippet is not vulnerable to the described denial-of-service vulnerability. The vulnerability in the first code snippet is due to insufficient input validation and sanitization when processing IRC color formatting codes, which is not present in the second code snippet. The second code snippet deals with a different problem related to vector operations and has no apparent connection to the first code snippet's vulnerability.",984,93,9.925010681152344
177823,Exec Code Overflow," NO, this code is not vulnerable to the Exec Code Overflow vulnerability as described in CVE-2011-2895. The provided code is the same as the initial vulnerable code, but with different variable names. However, the vulnerability is due to the improper handling of specific code words during decompression, not due to the code style or variable names. The given code, after being renamed, does not contain the vulnerability.

However, it is essential to review the actual changes made to the vulnerable functions to ensure the vulnerability has been adequately addressed.",2105,125,15.187523365020752
177825,DoS," NO, this code is not vulnerable to the same issue as the previous one. The format string vulnerability in the previous code was due to the use of unchecked user input in a printf-style function. In this code, there is no such usage, so it is not vulnerable to a format string attack. However, it is always important to validate and sanitize user inputs to prevent other types of vulnerabilities.",1403,85,8.91890549659729
177826,DoS Exec Code Overflow," NO, the second code is not vulnerable to the mentioned vulnerabilities. It does not contain any string or memory functions that could lead to buffer overflow, and it does not have any dynamic memory management, use-after-free, or null pointer dereferencing issues. It also does not have any obvious input validation issues or race conditions. However, it is always important to thoroughly test and analyze the code to ensure there are no hidden vulnerabilities.",1274,91,11.41460108757019
177827,nan," NO.

The provided C++ code has no direct relation to the vulnerability in the initial JFFS2 code. The vulnerability in the JFFS2 code is related to the inconsistency between dentry permissions and inode permissions during inode creation or ACL setting, which is not reflected in the given C++ code. The C++ code is calculating the minimum number of servers to upgrade based on given parameters, and it does not contain any of the vulnerability patterns mentioned in the initial steps.",1712,106,11.730640411376953
177831,nan," NO, this code is not vulnerable to the nan vulnerability mentioned earlier (CVE-2019-14975, CWE-125). It is a different function, and it does not contain any buffer operations or string manipulation that could lead to a heap-based buffer over-read. However, it is still important to check for other vulnerabilities using the steps provided in the original question.",1454,89,10.893381834030151
