case_id,vuln_type,audit_report,input_token_num,output_token_num,inference_time
177832,nan," NO, the provided `walk_string` function is not vulnerable to the same issue as the original code. The original vulnerability was due to a lack of input validation in the `pdf-op-filter.c` file, which is not present in the `walk_string` function.

However, I'd like to review the `maxUpgrades` function to check for potential vulnerabilities:

1. The function seems to be safe from buffer overflow, use-after-free, memory leaks, and null pointer dereference as it does not perform any dynamic memory allocation or deallocation, and there are no direct pointer operations.

2. Integer overflow/underflow: In the lambda function `ceil_divide`, there is a possibility of integer overflow/underflow in the expression `(a + b - 1) / b`. If `a` and `b` are both the maximum value for `int`, the result might not be correct. However, this is unlikely in this context, as the inputs are from the `count`, `upgrade`, `sell`, and `money` vectors, which should not contain such extreme values.

3. Input validation: The function assumes that the input vectors have valid values. If the input vectors contain negative values or values larger than `INT_MAX`, the function might produce incorrect results or throw an exception. It is essential to validate the input vectors before passing",1300,301,31.368858575820923
177833,DoS Overflow," Answer:

NO.

The function reds_handle_ticket doesn't have any obvious vulnerabilities based on the provided list. It does have a fixed-size buffer for the password, but it uses RSA_private_decrypt to decrypt the encrypted_data, which should limit the size of the password.

However, the vector calculation code provided later in the post is vulnerable to integer overflow. The expression `(a + b - 1) / b` can overflow when `b` is negative, leading to incorrect results. This is not directly related to the reds_handle_ticket function, but I'm mentioning it for completeness.",1318,146,14.212809085845947
177839,+Info," NO, the provided code is not vulnerable to CVE-2015-5330 and CWE-200. The vulnerability in the original code was due to mishandling string lengths in a different function (ldb) that was not provided in the code snippet. The given code is about handling codepoints and does not have any string length mishandling issues.

However, there are some potential issues in the given code:

1. Buffer Overflow: The code assumes that the buffer 'buf' can hold up to 4 bytes in UTF16 format. If a larger codepoint is encountered, it may result in a buffer overflow.

2. Integer Overflow: The calculation of 'olen' in the formula 'olen = 4 - olen;' may result in an integer overflow if 'olen' is equal to 4.

3. Null Pointer Dereference: The code does not check for null pointers before dereferencing'str' in'smb_iconv(descriptor, &str, &ilen, &outbuf, &olen);'.

4. Improper Input Validation: The code does not validate or sanitize the input'str'.

5. Race Conditions: The code does not show any multi-threaded operations, but if it exists elsewhere, race conditions might be a concern.

6. Insecure",1974,301,33.47696137428284
177840,+Info," NO, the provided code is not vulnerable to the same issue as the initial code. The initial code was vulnerable to CVE-2015-5330 (CWE-200) due to mishandling string lengths, which allowed remote attackers to obtain sensitive information from daemon heap memory. The new code does not have any string length mishandling or memory allocation issues. It is a simple function to escape certain characters in a string, and it does not contain any vulnerabilities based on the provided information.

However, it is essential to evaluate the rest of the codebase and the implementation of the functions that use the `ldb_dn_escape_internal` function to ensure there are no other vulnerabilities.",1642,157,17.015217781066895
177841,+Info," NO, the provided code is not vulnerable to the CVE-2015-5330 and CWE-200 vulnerabilities. The code does not handle LDAP packets or database values, and it does not have any issues with error messages or crafted packets. It deals with string conversion using custom functions, so it does not have the same vulnerabilities as the previous code.

However, I will analyze the second code snippet for other potential vulnerabilities:

1. Buffer Overflow: Not applicable, as there is no direct memory manipulation.
2. Use After Free: Not applicable, as there is no explicit memory deallocation.
3. Memory Leaks: Not applicable, as there is no dynamic memory allocation without deallocation.
4. Integer Overflow/Underflow: Not apparent in the given code, but it's essential to validate inputs and check for overflows in other parts of the code.
5. Null Pointer Dereference: Not applicable, as there are no dereferenced null pointers.
6. Improper Input Validation: Not directly visible, but input validation should be performed for the 'count', 'upgrade','sell', and'money' vectors in the function parameters.
7. Race Conditions: Not applicable, as there is no multi-threading or concurrent access.
8. Insecure Function Usage: Not apparent",1272,300,33.16536021232605
177842,+Info," NO, the provided code is not vulnerable to the CVE-2015-5330 and CWE-200 vulnerabilities mentioned. The code you provided is a different function, and it does not contain any string handling or packet parsing logic that could lead to sensitive information disclosure. However, the code still has other potential issues that should be addressed, such as:

1. Buffer Overflow: The code does not check the size of the `outbuf` when copying data into it, which could lead to a buffer overflow if the destination buffer is not large enough.
2. Integer Overflow: The code uses `static_cast<int64_t>` to prevent integer overflow, but it is not clear if the input values are validated and sanitized before being passed to this function.
3. Error Handling: The function does not handle errors or exceptions that may occur during execution.

It is essential to ensure that the code is thoroughly tested and validated before being deployed in a production environment.",1186,221,22.945557117462158
177843,+Info," NO, the provided code is not vulnerable to the CVE-2015-5330 and CWE-200 (Sensitive Data Exposure) vulnerabilities. The code is a simple string length calculation function, and it does not handle any sensitive data or perform any operations that could lead to information leaks.",1990,71,8.084555387496948
177844,+Info," NO, the provided code is not vulnerable to CVE-2015-5330 and CWE-200 as described in the given vulnerability summary. The vulnerability in the summary is related to mishandling string lengths in the context of LDAP packets, while the given code is about string manipulation using iconv_handle, which is a different context.

The given code does not have any buffer overflow, use-after-free, memory leak, integer overflow/underflow, null pointer dereference, or input validation issues. It does not have any race conditions, insecure function usage, or insecure resource management issues. The error handling in the code is also robust.

The code does not handle any cryptographic functions or sensitive data, so it is not vulnerable to cryptographic issues or sensitive data exposure.

Therefore, the answer is NO, the code is not vulnerable.",1292,194,18.37277102470398
177848,nan," NO, the provided code is not vulnerable to the CVE-2015-529",1209,22,2.7693631649017334
177850,DoS Overflow," NO, this code is not vulnerable to the mentioned DoS Overflow vulnerability. The code snippet provided does not perform any JSON parsing, but rather processes JSON data that is already parsed. The potential vulnerability in the original code was due to improper handling of user-supplied JSON data, which is not present in this case. However, it is still important to validate and sanitize inputs in other parts of the code where user input is processed before passing it to this function.",3914,101,11.025205373764038
177851,DoS Overflow," NO, the provided `parse_array` function is not vulnerable to the described Denial of Service (DoS) Overflow vulnerability. The function does not contain any stack-based buffer overflows or other vulnerabilities that could lead to a Denial of Service attack. However, the function's implementation is incomplete, as it only contains the code for parsing the start and elements of an array, but not the array elements themselves.

The `maxUpgrades` function provided in the second part of your question is also not vulnerable to the described Denial of Service (DoS) Overflow vulnerability. It contains no buffer overflows or other vulnerabilities that could lead to a Denial of Service attack. It is a function that calculates the maximum number of upgrades that can be made to a set of servers, given the number of servers, the cost of upgrades, the revenue from selling servers, and the available money. The function uses integer arithmetic and does not contain any unsafe operations that could lead to a buffer overflow or other vulnerabilities.",1164,224,22.46699833869934
177852,DoS Overflow," NO, the function `parse_object` is not vulnerable to the same type of DoS Overflow vulnerability as described in CVE-2015-5289 with CWE-ID CWE-119. The given code does not contain any JSON parsing operations that could lead to a buffer overflow. However, it is essential to audit the functions `parse_object_field`, `lex_expect`, `lex_peek`, and `report_parse_error` to ensure they do not contain any vulnerabilities.

The `maxUpgrades` function is unrelated to the JSON parsing function, and it does not contain any apparent vulnerabilities related to buffer overflows or memory management. It calculates the maximum number of upgrades based on given vectors and returns the result in a new vector.",1366,175,21.125484943389893
177853,DoS Overflow," NO, the provided code is not vulnerable to the mentioned DoS Overflow vulnerability. The code snippet does not contain any json parsing logic, which was the root cause of the vulnerability in the original code. This code is a function for handling upgrades, and it does not have any direct security vulnerabilities based on the provided context. However, it is essential to evaluate the rest of the codebase for similar vulnerabilities and follow best practices for secure coding.",1480,97,9.956017255783081
177855,Bypass," Answer: YES

The function `check_reduced_name_with_privilege` is vulnerable to the same issue as described in CVE-2015-5252 and CWE-264. The vulnerability is due to insufficient access control checks, which could allow an attacker to bypass intended file-access restrictions via a symlink that points outside of a share.

The provided code snippet does not include the full function, but the vulnerability is related to the way the function handles paths and access control, not directly to the provided code. Therefore, the vulnerability still exists in the given code excerpt.",2941,142,16.557679414749146
177856,nan," Answer: YES

The code is vulnerable because it uses the `execl` function to execute a command constructed from user-supplied input (`outname`) without proper input validation or sanitization. This can lead to OS shell command injection vulnerabilities (CWE-78), as demonstrated in the original CVE-2019-13638. An attacker can craft a malicious input containing shell metacharacters to execute arbitrary commands on the vulnerable system.",2772,106,10.860435962677002
177857,nan," NO, the provided code is not vulnerable to the nan (CVE-2019-13636, CWE-59) issue. The nan vulnerability is related to the mishandling of symbolic links in certain cases other than input files, specifically in inp.c and util.c. The given code does not contain any symbolic link handling or related functionality, so it is not vulnerable to this issue.

However, the provided code should still be checked for other potential vulnerabilities as mentioned in the initial steps.",1319,117,14.115782976150513
177859,Exec Code Bypass," NO, the provided code is not vulnerable to Exec Code Bypass (CWE-78) or any of the other vulnerabilities mentioned in the audit steps. It is a different function with a different purpose than the initial vulnerable code snippet. This function calculates the maximum number of upgrades for servers based on given parameters, without any security-related operations or user inputs.",1308,80,8.491884469985962
177860,Exec Code Bypass," NO, the function zrestore does not contain any obvious vulnerabilities based on the provided code snippet. It has some error checking and stack checking, but without knowing the implementation details of the functions called within it, it's hard to say for certain.

However, the vector calculation function provided does not seem to have any direct security vulnerabilities. It does have a potential integer overflow issue in the division operation, but that is not a security vulnerability by itself. It is always a good idea to validate input data and handle exceptions properly, but the provided code does not show any issues related to security vulnerabilities.",1342,127,14.301236152648926
177862,Exec Code," NO, the provided function `restore_page_device` is not vulnerable to the Exec_Code vulnerability described. The function does not contain any logic related to exception handling, stack management, or the execution of external code. It only performs some basic device management tasks.

However, the vector calculation function `maxUpgrades` provided in the second part of the question has its own vulnerabilities, but they are not related to the Exec_Code vulnerability. It is important to evaluate each function or code snippet independently for vulnerabilities.",1366,114,11.44136667251587
177865,DoS," NO, the provided code is not vulnerable to the previously discussed Denial of Service (DoS) vulnerability. The code snippet does not contain any '\0' characters incorrectly skipped in situations involving '?' characters, which was the root cause of the vulnerability in the original code. However, it is essential to evaluate the rest of the codebase for similar issues and other potential vulnerabilities.",1458,83,9.814981698989868
177867,nan," NO.

The function provided does not exhibit the behavior of the CVE-2018-16541 vulnerability, which is related to incorrect free logic in pagedevice replacement causing the interpreter to crash with crafted PostScript files. The given function is a cleanup function for Ghostscript and does not contain any logic that would free or handle pagedevices.",4454,83,9.539975881576538
177869,nan," NO, this version of the zsetcolor function does not appear to be vulnerable to the nan attack described. The main difference I see is that the problematic line:

",2663,37,4.435518503189087
177870,nan," NO.

The provided code snippet is a different function than the initial one (ztype), and it does not contain any of the vulnerabilities listed in the steps. It is a function for calculating the maximum number of upgrades based on given parameters, and it does not contain any buffer overflow, use-after-free, memory leak, integer overflow/underflow, null pointer dereference, or other mentioned vulnerabilities.",1163,90,10.121000289916992
177874,Exec Code Overflow," NO, this code is not vulnerable to Exec Code Overflow (CVE-2018-15911, CWE-119). The vulnerability in the original code was due to uninitialized memory access in the aesdecode operator, which is not present in this code. This code is a modified version of the original aes_crypt_ecb function, and it does not contain any glaring security vulnerabilities based on the provided information. However, it is always recommended to perform thorough testing and code review to ensure the absence of any potential security issues.",3438,124,13.56420612335205
177875,Exec Code Overflow," NO, the provided code is not vulnerable to Exec Code Overflow (CVE-2018-15911, CWE-119). The vulnerability in the original code was due to uninitialized memory access, but the given code has no such issue. It initializes all necessary data before using it. However, it is still important to check for other vulnerabilities as mentioned in the initial steps.",2508,90,9.474711418151855
177879,DoS Exec Code Overflow," NO, the provided code is not vulnerable to the mentioned DoS Exec Code Overflow vulnerability (CVE-2015-345",1731,33,4.114613056182861
177880,Bypass," NO, this version of the function is not vulnerable to the same bypass vulnerability as the previous one. The main difference is that the `iodev` check is performed before the permissions check, which prevents the bypass. However, there could still be other vulnerabilities in the code, as the provided list suggests.",2141,67,6.992177724838257
177881,DoS," NO, the second code snippet is not vulnerable to the same issue as the first one. It is a different piece of code that does not contain any unchecked calls to `kstrdup` or any null pointer dereferences. It is a function that calculates the maximum number of upgrades for a set of servers based on their count, upgrade cost, sell price, and available money.",1169,81,9.384874820709229
177883,nan," NO.

The given code snippet does not contain any vulnerabilities related to the CVE-2011-1428 and CWE-20 (Improper Input Validation) as it does not process any user inputs or network data. The code is merely allocating memory and setting up a hook structure. However, it is important to note that the code you provided earlier, `hook_print`, is indeed vulnerable, as explained in your summary.

Regarding the new code snippet, the `maxUpgrades` function does not contain any obvious vulnerabilities based on the provided context. It calculates the result vector based on the input vectors `count`, `upgrade`, `sell`, and `money`. The function uses constant expressions, integer arithmetic, and the `min` function, which do not introduce any vulnerabilities in this context.

However, it is essential to ensure that the input vectors are properly validated and sanitized before passing them to this function, as unvalidated user inputs could introduce vulnerabilities in other parts of the code.",1397,231,25.387875080108643
177887,DoS Overflow," NO.

The given code is not vulnerable to the same issue as the previous one. In this version, the code correctly checks if the limit is exceeded before allocating memory. It also uses the `ceiling division` technique to avoid integer overflows in the calculation. Therefore, it does not have the same DoS overflow vulnerability as the previous code.",2058,77,8.234320402145386
177891,DoS," NO, the provided code for `rsa_pss_decode` function is not vulnerable to the same issue as described in CVE-2015-3194. The vulnerability in the original code was due to the lack of checking for `maskGenAlgorithm` presence before accessing it, which is not the case in this code.

However, the second code snippet about `maxUpgrades` function is unrelated to the first one, and it is not possible to determine if it has any vulnerabilities without knowing the context and the rest of the code. It does not contain any obvious signs of common vulnerabilities mentioned in the initial list, but further analysis would be needed to confirm its security.",1168,151,15.798687934875488
177893,+Info," NO, the provided code is not vulnerable to the CVE-2015-3193 and CWE-200 vulnerabilities mentioned. The code you provided is a different function, `maxUpgrades`, which does not contain any OpenSSL functions that were vulnerable in the original code. It is a separate function that calculates the maximum number of upgrades based on given parameters.",2767,83,9.242342948913574
177896,nan," NO.

The provided code snippet does not contain the vulnerability described for the original code. The `become_daemon` function in this snippet sets the umask to 0, creates a new session, and changes the working directory to the root directory, but it does not have any vulnerabilities related to file permissions or sensitive data exposure.

The vulnerability in the original code is due to the weak permissions for certain files when the qemu guest agent starts in daemon mode. However, the given code snippet does not contain any file handling or permission checks, so it is not vulnerable to the described issue.",1066,132,15.009558916091919
177897,+Info," NO, this code is not vulnerable to the XML External Entity (XXE) issue mentioned in CVE-2013-1824 and CWE-200. The code has properly disabled DTD loading by using `ctxt->options -= XML_PARSE_DTDLOAD;`. This prevents XML entities from being loaded and processed, mitigating the XML External Entity (XXE) vulnerability.

However, the code does not seem to be related to the `maxUpgrades` function provided at the end of the question. The `maxUpgrades` function does not contain any known vulnerabilities based on the provided code. It calculates the maximum number of upgrades for each server based on the given conditions.",1399,157,16.100325345993042
177898,+Info," NO, the second code snippet is not vulnerable to the XML External Entity (XXE) issue mentioned in CVE-2013-1824 and CWE-200. The code snippet disables DTD loading by setting `ctxt->options -= XML_PARSE_DTDLOAD;`, which prevents XML entities from being loaded and processed. This mitigates the risk of arbitrary file reading via XML external entities.

The `maxUpgrades` function is not related to the XML parsing and has no vulnerabilities in the provided code. However, it is essential to ensure that the input vectors `count`, `upgrade`, `sell`, and `money` are validated and sanitized before passing them to the `maxUpgrades` function to avoid other potential vulnerabilities.",1317,174,17.775480031967163
177899,+Info," NO, the second code snippet is not vulnerable to the XML External Entity (XXE) issue mentioned in CVE-2013-1824 and CWE-200. The second code snippet does not contain the soap_xmlParseFile function, which was the root cause of the vulnerability in the first code snippet. The second code snippet is a function for calculating the maximum upgrades, which is unrelated to XML parsing or SOAP.",1343,104,11.790873527526855
177900,+Info," NO, the provided `soap_xmlParseMemory` function is not vulnerable to the XML External Entity (XXE) issue mentioned in the CVE-2013-1824. The vulnerability in the original code is due to the lack of proper configuration to disable external entities. In the given code, the `xmlCreateMemoryParserCtxt` function is used, which does not have the same vulnerability.

However, the new code snippet `vector<int> maxUpgrades(vector<int>& count, vector<int>& upgrade, vector<int>& sell, vector<int>& money)` is unrelated and does not contain any known vulnerabilities based on the provided code.",1233,150,16.662864208221436
177901,Overflow," NO.

The `_asn1_ltostr` function does not contain any obvious vulnerabilities related to buffer overflow. It uses a fixed-size buffer `temp` with a size defined by `LTOSTR_MAX_SIZE`, and the `do-while` loop calculates the length of the string correctly. The `for` loop then copies the calculated string to the `str` buffer, ensuring that it does not exceed the calculated length.

However, it is important to note that the `str` buffer must be large enough to hold the resulting string, and it is the caller's responsibility to ensure that the buffer is large enough.

Regarding the second part of the question, the `maxUpgrades` function does not contain any obvious vulnerabilities related to buffer overflow or other types of vulnerabilities. It uses `std::vector` to handle memory management, and the arithmetic operations are performed using `std::int64_t` to avoid integer overflow.

Therefore, the answer is NO, the `maxUpgrades` function is not vulnerable.",920,231,21.922743797302246
177904,DoS," NO, the provided code is not vulnerable to the previously discussed DoS vulnerability. The only difference between the two codes is the removal of the vectorAntialias && clipRes!= splashClipAllInside condition, which does not introduce any new vulnerabilities. However, the code should still be checked for the other vulnerabilities mentioned in the initial audit steps.

Regarding the second code snippet, it is a function for calculating the maximum number of upgrades based on given parameters. It does not contain any of the vulnerabilities mentioned in the initial audit steps. However, it is always important to check the correctness of the input validation and error handling in the surrounding code.",1789,142,15.29119086265564
177905,DoS," NO, the provided code is not vulnerable to the described DoS vulnerability. The code you provided is a different function, and it does not contain any NULL pointer dereferences or any other vulnerabilities mentioned in the original description. However, it is still important to ensure that the functions called within this function do not contain any of these vulnerabilities.",3327,71,9.33519196510315
177906,DoS Exec Code Overflow," Answer:

NO.

The function SplashPath *Splash::makeDashedPath(SplashPath *path) does not contain any of the vulnerabilities listed in the 12 points you provided. It is a complex function but it does not have any obvious security issues such as buffer overflows, use-after-free, memory leaks, etc. It does not perform any dynamic memory allocation or deallocation, so there are no issues related to memory management. It does not perform any arithmetic operations that could lead to integer overflows or underflows. It does not dereference any pointers that could be null. It does not use any insecure functions or handle any sensitive data. It does not have any error handling mechanisms that could be mishandled. It does not use any cryptographic functions or handle any sensitive data. Therefore, based on the provided code and the 12 points you listed, the function is not vulnerable.",2814,207,21.08958148956299
