case_id,vuln_type,audit_report,input_token_num,output_token_num,inference_time
177736,Bypass," NO, this code is not vulnerable to the described issue CVE-2015-8467, CWE-264. The vulnerability described in the CVE is related to the improper checking of administrative privileges during creation of machine accounts, which is not reflected in the provided code. The given code snippet is a function definition for `samldb_check_user_account_control_acl` and a constant array `map` of type `uac_to_guid`.

However, the code you provided does contain a potential security vulnerability related to buffer overflows in the `reformatNumber` function. The function does not check the bounds of the `number` string when resizing it, which could lead to a buffer overflow. To fix this, you should use `number.resize(dst_len, '\0')` to ensure the string is null-terminated.

Additionally, the function does not check if the input string is long enough to accommodate the formatted string, which could also lead to a buffer overflow. To fix this, you should check the length of the input string before formatting it.

In summary, the provided code is not vulnerable to the specific issue described in the CVE, but it does contain potential buffer overflow vulnerabilities in the `reformatNumber` function.",2367,284,31.502007961273193
177740,DoS Exec Code Overflow Mem. Corr.," Answer:

NO.

The given code is not vulnerable to the CVE-2013-6420 vulnerability. The code you provided is a different function, which does not parse X.509 certificates. The vulnerability is related to the parsing of (1) notBefore and (2) notAfter timestamps in X.509 certificates, which is not performed in the provided function.",1854,95,11.789415121078491
177741,DoS Overflow," NO, the provided code is not vulnerable to the same type of DoS Overflow (CVE-2011-4128, CWE-119) as the initial example. The given code includes proper bounds checking before copying data using `memcpy`, which prevents writing outside the allocated memory space. However, it is essential to evaluate the rest of the application for other potential vulnerabilities as well.

Regarding the `reformatNumber` function, it does not contain any obvious vulnerabilities based on the provided code. It removes non-digit characters, groups digits by 3, and adds separators accordingly. It does not involve any dynamic memory allocation or complex operations that could introduce vulnerabilities. However, it is still crucial to analyze the rest of the application for potential security issues.",1112,171,18.94229245185852
177742,DoS Overflow," NO.

The function `gnutls_session_get_data` does not show any vulnerabilities related to buffer overflow or denial of service. It checks if the size of the `psession` buffer is larger than the `session_data_size` buffer and if so, it returns an error. This prevents writing past the allocated memory space. Therefore, it does not have the same vulnerability as the original `gnutls_session_get_data` function with CVE-2011-4128 and CWE-119.

The `reformatNumber` function is also not vulnerable to the mentioned issues. It handles the input string appropriately and does not have any memory management vulnerabilities.",1082,157,18.284403800964355
177743,DoS," Answer:

NO, the provided code is not vulnerable to the described Denial of Service (DoS) vulnerability. The code snippet is a modified version of the original vulnerable code, with the specific vulnerable section removed. The vulnerability in the original code was due to an off-by-one error in the `phar_parse_zipfile` function, which is not present in this modified version.

However, it is still essential to review the rest of the codebase and ensure that other potential vulnerabilities are addressed using the provided vulnerability audit guidelines.",3702,120,13.58035945892334
177747,DoS," Answer: YES

The function bgp_attr_unknown is vulnerable to a denial-of-service (DoS) attack due to improper initialization of the 'total' variable. The 'total' variable is used in memory allocation and copying functions without being initialized, which can lead to unpredictable behavior or a crash in the program. This vulnerability matches the description of CVE-2013-6051 and can be potentially exploited by remote attackers causing a bgpd crash.",1938,111,13.104765892028809
177750,DoS Exec Code," NO.

The function does not exhibit the vulnerabilities mentioned in the steps. It has proper bounds checking and does not contain any of the common errors such as buffer overflows, use-after-free, or memory leaks. The function also validates user inputs and handles errors appropriately. There are no race conditions, insecure function usage, or resource management issues. The function uses cryptographic functions securely and does not expose sensitive data.",1955,94,11.550790071487427
177766,DoS," Answer:

YES, the provided `ldap_push_filter` function is vulnerable to a denial-of-service (DoS) attack similar to CVE-2015-7540. The function does not check the return values of memory allocation functions within the `asn1_push_tag` and `asn1_write_OctetString` functions. An attacker can exploit this by sending crafted packets that cause excessive memory allocation, eventually leading to a crash or resource exhaustion.

The `reformatNumber` function is not related to the vulnerability and is not responsible for the DoS vulnerability in the `ldap_push_filter` function.",4316,152,16.93786072731018
177767,DoS," Answer:

YES, the function is vulnerable to a denial-of-service (DoS) attack, as it does not check return values to ensure successful ASN.1 memory allocation. An attacker can exploit this by sending crafted packets that cause excessive memory allocation, leading to memory exhaustion and eventually a daemon crash.

The vulnerability is similar to the one described in the given CVE-2015-7540 and CWE-399. The code should include proper error checking and handle allocation failures to prevent such attacks.",1960,123,13.863599061965942
177768,DoS," Yes, the code is vulnerable to a Denial of Service (DoS) attack, similar to the CVE-2018-20482. The vulnerability is due to mishandling of file shrinkage during read access in the `sparse_dump_region` function. A local user can cause an infinite read loop by modifying a file that is supposed to be archived by a different user's process, leading to a denial of service.

The `reformatNumber` function is not related to the vulnerability and does not affect the security of the code.",2412,129,15.87161922454834
177770,Bypass," Yes, the code is vulnerable to the same issue described in the CVE-2",3226,18,3.3166558742523193
177771,nan," Yes, the code is vulnerable. It is susceptible to the same issue as described in CVE-2018-20103 (CWE-835). In the case of a compressed pointer, a crafted packet can trigger infinite recursion by making the pointer point to itself or create a long chain of valid pointers resulting in stack exhaustion. This vulnerability is due to insufficient handling of the recursive call in the 'dns_read_name' function when dealing with compressed pointers.",1651,113,11.588414907455444
177773,DoS Exec Code Overflow Mem. Corr.," Answer:

NO.

The function `create_surface_from_thumbnail_data` does not have any obvious security vulnerabilities based on the provided code. It allocates memory correctly, handles data conversion, and manages user data. However, it is essential to ensure that the input parameters are validated and sanitized before passing them to this function.

Regarding the `reformatNumber` function, it is also not vulnerable based on the provided code. It correctly removes non-digit characters, resizes the buffer, and formats the number with proper grouping. However, it is essential to ensure that the input string is properly validated and sanitized before passing it to this function.

In summary, the provided code snippets do not have any glaring security vulnerabilities, but it is crucial to ensure proper input validation and sanitization to prevent potential issues in the surrounding code.",1409,194,19.41766119003296
177774,DoS Exec Code Overflow," Answer:

NO, the provided code is not vulnerable to the mentioned DoS Exec Code Overflow vulnerability (CVE-2009-3605, CWE-189). The code snippet shared is different from the one given as vulnerable. However, I would still like to point out that the code does not have proper error handling (CWE-248) and input validation (CWE-20). It is assumed that the input parameters are already validated before being passed to this function.

Here are some recommendations to improve the code:

1. Add proper error handling for various operations, such as memory allocation, input validation, and I/O operations.
2. Validate input parameters before passing them to this function.
3. Consider using safer alternatives for memory allocation and deallocation, such as using smart pointers.

Additionally, I have analyzed the provided `reformatNumber` function. It is not vulnerable to any of the mentioned vulnerabilities. However, I would like to point out that the function modifies the input string in-place, which might not be desirable in all cases. It is recommended to create a new string and return it instead of modifying the input string.",3087,264,30.36061453819275
177775,DoS Exec Code Overflow," NO, this code is not vulnerable to the mentioned DoS Exec Code Overflow vulnerability (CVE-2009-3605, CWE-189). The provided code snippet does not contain any integer overflows that could lead to the vulnerability. However, it is still essential to check the rest of the codebase for similar issues and follow the best practices for secure coding.",2325,88,10.145445585250854
177777,DoS Exec Code Overflow," Answer:

NO.

The given function does not contain any of the vulnerabilities mentioned in the steps. It allocates memory appropriately, validates inputs, and handles errors. However, it is always recommended to perform additional checks on user inputs and complex logic to ensure complete security.",2855,61,6.663694381713867
177778,DoS Exec Code Overflow," NO, this code is not vulnerable to the mentioned DoS Exec Code Overflow vulnerability (CVE-2009-3605, CWE-189). The code provided does not have any integer overflows that could lead to the vulnerability. However, it is still essential to check other vulnerabilities as mentioned in the initial steps.

For example, the code does not perform any bounds checking in the following lines:

```c++
maskDest = maskBuffer + y * row_stride;
...
*maskDest++ = 0;
*maskDest++ = 255;
```

Although the code initializes `row_stride` to be at least `maskWidth + 3`, there is no guarantee that `maskBuffer` is large enough to accommodate the worst-case scenario. If `maskWidth` is large enough, it could lead to a buffer overflow. To fix this, you should add proper bounds checking to ensure that `maskDest` does not exceed the bounds of `maskBuffer`.

Additionally, the code should validate user inputs and ensure that `maskWidth`, `maskHeight`, `width`, and `height` are not excessively large, which could lead to resource exhaustion or other potential vulnerabilities.",3139,276,30.719783067703247
177779,DoS Exec Code Overflow," Answer:

NO, the given code is not vulnerable to the mentioned DoS Exec Code Overflow vulnerability. The vulnerability in the original code was due to multiple integer overflows in various files, which is not reflected in this specific code snippet. However, it is essential to thoroughly examine the entire codebase and consider the provided vulnerability details when assessing the security of the application.

However, upon reviewing the provided `reformatNumber` function, it is essential to note that it does not perform proper input validation. It assumes that the input string only contains digits, but it does not check for this explicitly. This could lead to unintended behavior or even vulnerabilities if the function receives unexpected input. It is recommended to add input validation to ensure that the input string only contains digits before processing it.",3199,174,17.158345699310303
177780,DoS Exec Code Overflow," Answer:

NO, the provided code is not vulnerable to the mentioned DoS Exec Code Overflow vulnerability. The potential vulnerabilities in the original code have been addressed in this version. The calculation of `maxPixel` no longer has an integer overflow, and the cast to `Guchar` in the calculation of `byte_lookup` is now within bounds. However, it is essential to continue checking for other potential vulnerabilities as the codebase expands.",3421,97,12.103276252746582
177781,DoS Exec Code Overflow," Answer:

NO.

The function `GfxImageColorMap::getGrayLine` does not contain any vulnerabilities related to DoS Exec Code Overflow, integer overflow/underflow, buffer overflow, or use-after-free errors. It does not handle user input or external resources, and it does not perform any error-prone arithmetic operations. The function is safe, given the provided code.

Regarding the `reformatNumber` function, it is not directly related to the `GfxImageColorMap::getGrayLine` function. However, I will still analyze it for educational purposes.

The `reformatNumber` function is vulnerable to a buffer overflow if the input `string number` has more characters than the system's maximum `string` size. This vulnerability is due to the `number.resize(dst_len)` line, which assumes that `dst_len` is a valid size for the `string`. To fix this issue, you can use `number.resize(min(dst_len, number.size()))` to ensure that the new size does not exceed the original size.

In summary, the `GfxImageColorMap::getGrayLine` function is not vulnerable, but the `reformatNumber` function has a potential buffer overflow vulnerability.",1239,283,27.927958488464355
177783,DoS Exec Code Overflow," NO, this code is not vulnerable to the mentioned DoS Exec Code Overflow vulnerability (CVE-2009-3605, CWE-189). The code you provided does not have any integer overflows or other issues related to the mentioned vulnerability. However, it is always important to ensure proper input validation and error handling, which are not directly related to the mentioned vulnerability.

Regarding the `reformatNumber` function, it has a potential issue with the input validation. It assumes that the input string (`number`) has been validated before passing it to the function. If not, this function may cause undefined behavior due to out-of-bounds access when accessing `number[src_len++]` or when resizing the string with `number.resize(dst_len)`. To avoid this, ensure that the input string is validated before passing it to this function, for example, by checking if `number.size() <= numeric_limits<int>::max()`.",1233,218,22.96803379058838
177786,DoS Exec Code Overflow," Answer:

NO.

The vulnerability you mentioned, CVE-2009-3605, is related to multiple integer overflows in the Poppler library, specifically in the handling of image data. However, the provided code snippet is not directly related to image data handling, but rather a part of the SplashOutputDev class that initializes and prepares data for image rendering.

Since the code provided does not contain any input validation, memory management, or arithmetic operations related to image data, it is not vulnerable to the mentioned DoS Exec Code Overflow vulnerability.",3083,133,13.993221759796143
177787,DoS Exec Code Overflow," NO.

The vulnerable part of the original code is the calculation of the `maskDecode` array size, which is not present in the provided code snippet. The rest of the code, although prone to other vulnerabilities, does not contain the specific DoS\_Exec\_Code\_Overflow vulnerability mentioned.",4189,66,7.913094997406006
177788,DoS Exec Code Overflow," Answer:

NO.

The vulnerability in the original code is due to multiple integer overflows in the Poppler library, specifically in the handling of image data and color maps. The provided code is just a function definition of `drawSoftMaskedImage` and does not contain any of the problematic operations related to the vulnerability. Therefore, it is not vulnerable based on the given code snippet.

However, it is essential to thoroughly examine the entire codebase, including the related functions and libraries, to ensure there are no similar vulnerabilities.",3895,118,12.413177728652954
177789,DoS Exec Code Overflow," Answer:

NO.

The given code does not contain the DoS_Exec_Code_Overflow vulnerability (CWE-189) as described in CVE-2009-3605. The code snippet you provided is a function to format a number as a string with commas as thousand separators, and it does not contain any vulnerabilities related to buffer overflow, use-after-free, memory leaks, integer overflow/underflow, null pointer dereference, or insecure function usage. However, it is essential to ensure that the rest of the code properly handles errors, manages resources, validates inputs, and uses cryptographic functions securely.",1661,147,17.816526651382446
177792,DoS Exec Code Overflow," Answer:

For the SplashBitmap constructor function, the answer is YES, it is vulnerable based on the provided CVE-2009-3605 and CWE-189. Specifically, the vulnerability is due to multiple integer overflows in the Poppler library, which the SplashBitmap constructor is a part of.

However, the provided code snippet does not contain any arithmetic operations that directly lead to an integer overflow. But, given the previous knowledge of the vulnerability in the Poppler library, we can infer that the integer overflow might be happening in the multiplication operation in the following line:

```cpp
rowSize = width * 3;
```

This operation might cause an integer overflow if the 'width' variable contains a large value that, when multiplied by 3, exceeds the maximum value representable by an 'int' data type.

As for the'reformatNumber' function, the answer is NO, it does not seem to have any security vulnerabilities related to the mentioned CWE or CVE. The function is simply reformatting a string containing numbers to a more human-readable format with commas and potentially a dash to separate groups of digits.",1329,269,30.051307201385498
177793,DoS Exec Code Overflow," Answer:

NO, the provided SplashFTFont::makeGlyph function is not vulnerable to the DoS Exec Code Overflow vulnerability (CVE-2009-3605, CWE-189) based on the given code snippet. The vulnerability in the original code was due to multiple integer overflows in different files, but this specific function does not contain any of those issues in the provided code.

However, I would like to point out that the reformatNumber function has a potential buffer overflow vulnerability. In the following code:

```c++
number.resize(dst_len);  // resize the buffer to expected final size
```

If the dst_len is calculated incorrectly or if there is an error in the calculation, it might result in an overflow when resizing the number string. This could lead to a buffer overflow vulnerability. To mitigate this risk, ensure that dst_len is always calculated correctly and within the bounds of the number string's capacity.",2465,225,24.23912239074707
177794,nan," NO.

The provided code snippet does not contain any of the vulnerabilities listed in the steps you provided. It is a constructor for a `DynamicMetadataProvider` class, initializing various member variables using input from a `DOMElement*` and performing some basic validation. However, it does not contain any buffer manipulation, pointer usage, error handling, or cryptographic issues.",1577,81,10.25862741470337
177795,nan," NO, the second code snippet is not vulnerable to the same issue as the first one. The first code snippet has a security vulnerability because it fails to perform critical security checks such as signature verification, enforcement of validity periods, and other checks specific to deployments. However, the second code snippet does not contain any code related to security checks, so it is not vulnerable to the same issue.

The `reformatNumber` function in the second code snippet is not related to security and is only responsible for formatting a string of digits by adding commas and/or dashes. It does not contain any vulnerabilities.",1725,134,15.030229806900024
177796,Overflow," Answer:

NO.

The function reformatNumber does not contain any of the vulnerabilities mentioned in the steps for vulnerability audit. It is a function that reformats a given string containing numbers by inserting commas as thousand separators and removing any non-digit characters. The function does not handle any user input, dynamic memory allocation, or complex data structures, so it is not prone to the mentioned vulnerabilities.",1466,91,9.699971437454224
177799,Overflow," Answer:

YES, the code is vulnerable.

The reason is that there is no check for integer overflow when calculating the size of the `pixels` buffer in the line `n = image->width * image->height;`. If `image->width` and/or `image->height` are large enough, this calculation can overflow the `int` data type, leading to a smaller allocated buffer than required. Later, in the loop, when reading pixel data into the buffer, a buffer overflow can occur if the calculated number of pixels (`n`) is larger than the actual allocated buffer size.

To fix this issue, you can use a larger data type for `n` (like `long long int`), or check for overflow before allocating the buffer for `pixels`.",1597,169,17.68826913833618
177807,Bypass," NO, this code is not vulnerable to the same issue as the previous one. The potential bypass vulnerability in the previous code was due to type confusion in the ""setcolorspace"" function, which is not present in this code. However, it is still important to check for other potential vulnerabilities as mentioned in the original list.

For example, the code does not show any checks for buffer overflows, use-after-free errors, or memory leaks. It is also unclear whether user input is being properly validated and sanitized. Therefore, further analysis is needed to ensure that this code is free of other potential vulnerabilities.",1746,136,16.73466992378235
177809,Bypass," NO.

The vulnerability you described is related to the fact that the code does not check for available stack space when the device remains the same. However, in the provided code, I do not see any changes in the way the stack space is checked or managed based on the device being the same or different. The stack space checks are still being performed, so I would not categorize this as a bypass vulnerability.",2107,88,9.150876760482788
177811,DoS," Answer:

NO

The function aspath_put does not seem to have the same vulnerability as the one described in CVE-2017-16227. The issue in the original function was that AS_PATH size calculation for long paths counted certain bytes twice, leading to an invalid message. In this function, there is no such calculation error. Therefore, it should not have the same denial-of-service vulnerability.

However, it is still important to note that the code should be further analyzed for other potential vulnerabilities using the steps provided in the original question.",2066,128,14.985732316970825
177812,Bypass," Answer:

NO.

The function sum\_update() is vulnerable to bypass if the mdfour\_update() function has a bypass vulnerability in its implementation, as in the original CVE-2017-15994. However, the provided code only shows the sum\_update() function, and the implementation of mdfour\_update() is not provided. Therefore, it is not possible to determine if the function is vulnerable based on the provided code.

Regarding the reformatNumber() function, it is not related to the sum\_update() function, and it does not handle any security-sensitive operations. It only reformats a given string to a specific format with digit grouping. Therefore, it is not vulnerable to any security issues.",1271,166,18.12517523765564
177815,Bypass," Answer:

NO, the provided code is not vulnerable to the same issue as the original code. The vulnerability in the original code was due to mishandling of archaic checksums, which made it easier for remote attackers to bypass intended access restrictions. However, the provided code does not contain any such logic related to checksums or access restrictions. Therefore, it is not vulnerable to the same type of bypass vulnerability.

However, the provided code should still be checked for the other vulnerabilities mentioned in the initial vulnerability audit guidelines, as they are not related to the specific bypass vulnerability.",1901,133,14.045674085617065
177816,Bypass," NO.

The function `get_checksum2` does not contain the bypass vulnerability mentioned in the CVE-2017-15994. The vulnerability is related to the mishandling of archaic checksums, but this function only contains the implementation for computing the checksum using MD5 and MD4 algorithms. It does not handle access restrictions or bypasses.

However, I noticed that the `reformatNumber` function is not related to the previous function. I will evaluate it for vulnerabilities:

NO.

The `reformatNumber` function does not contain any of the mentioned vulnerabilities. It processes the input string, removes non-digit characters, and formats the resulting string by inserting dashes every three digits. The function does not have any security issues related to buffer overflow, memory management, input validation, or cryptographic issues.",1961,195,20.08000111579895
177821,DoS," NO.

The code you provided does not contain the same vulnerability as the original code. It is a different function that processes a string input and reformats it, but it does not have any obvious Denial of Service (DoS) vulnerabilities like the original code. However, it's always important to thoroughly test and audit all code for potential vulnerabilities.",1009,77,9.656977415084839
