case_id,vuln_type,audit_report,input_token_num,output_token_num,inference_time
177736,Bypass,"  YES, the code is vulnerable to a Bypass vulnerability. The CVE-ID is CVE-2015-8467. The CWE-ID is CWE-264.

The vulnerability arises from the fact that the function does not properly check for administrative privileges during creation of machine accounts. This allows remote authenticated users to bypass intended access restrictions by leveraging the existence of a domain with both a Samba DC and a Windows DC, a similar issue to CVE-2015-2535.",2585,123,5.234858989715576
177740,DoS Exec Code Overflow Mem. Corr.,"  NO, the given code is not vulnerable to any of the security vulnerabilities you mentioned.

The code is a function that takes an ASN1_UTCTIME structure as input and returns a time_t value. It appears to be parsing the time string in the ASN1_UTCTIME structure and converting it to a time_t value.

The code does not appear to have any buffer overflow vulnerabilities, as it does not involve any string or memory functions that could potentially cause a buffer overflow. It also does not appear to have any use-after-free errors, as it does not involve any pointers that are used after they are deallocated.

The code does not appear to have any memory leaks, as it does not involve any dynamic memory management that could potentially cause a memory leak.

The code does not appear to have any integer overflow or underflow vulnerabilities, as it does not involve any arithmetic operations that could potentially cause an integer overflow or underflow.

The code does not appear to have any null pointer dereference vulnerabilities, as it does not involve any pointers that are dereferenced without being checked for null first.

The code does not appear to have any improper input validation vulnerabilities, as it does not involve any user input that is processed.

The code does not appear to have any race condition vulnerabilities, as it does not involve any multi-threaded code that",2054,301,11.712061882019043
177741,DoS Overflow,"  NO. The code is not vulnerable to a DoS overflow. The function takes a `session_data` parameter, which is a pointer to a buffer that is allocated by the caller. The function then copies the session data into this buffer, without performing any bounds checking. However, the function does check that the buffer is large enough to hold the session data, and it returns an error if the buffer is too small. Therefore, the function is not vulnerable to a DoS overflow.",1327,102,4.129920244216919
177742,DoS Overflow,"  NO. The code is not vulnerable to a DoS overflow. The function takes a `session_data` parameter, which is a pointer to a buffer that is allocated by the caller. The function then copies the session data into this buffer, without checking the size of the buffer. This could lead to a buffer overflow if the session data is larger than the buffer. However, the function also returns an error code if the buffer is too small, so the vulnerability is not exploitable in this case.",1297,105,4.034966945648193
177743,DoS,"  NO, the given code is not vulnerable to any security vulnerabilities.

The code is a C++ function that takes a string and an integer as input, and returns the minimum number of changes required to make the string a palindrome. It uses a dynamic programming approach to solve the problem, and the code is well-structured and easy to understand.

There is no obvious vulnerability in the code, and it does not contain any syntax errors. Therefore, I would say that the code is not vulnerable to any security vulnerabilities.",3931,116,5.508517265319824
177747,DoS,"  NO, the given code is not vulnerable to a DoS attack.

The code is a function that parses BGP attributes and stores them in a data structure. It does not have any obvious vulnerabilities related to buffer overflows, use after free, memory leaks, integer overflow/underflow, null pointer dereferences, improper input validation, race conditions, insecure function usage, insecure resource management, or improper error handling.

However, the code does have a potential vulnerability related to the use of the `stream_forward_getp` function, which forwards the read pointer of the input stream. If the input stream is not properly validated, this could lead to a buffer overflow or other vulnerability. However, the code does not appear to have any obvious vulnerabilities related to this.

Overall, the code appears to be well-written and does not have any obvious vulnerabilities.",2214,196,7.856816291809082
177750,DoS Exec Code,"  NO, the given code is not vulnerable to a DoS_Exec_Code vulnerability.

The code does not contain any obvious vulnerabilities, and it appears to be a legitimate function that is used to handle soft masks in a PDF document. The function takes a context, a run processor, and a softmask save as input, and it performs some operations on the softmask before returning the gstate.

The function does not contain any obvious buffer overflows, use after free errors, memory leaks, integer overflows, null pointer dereferences, improper input validation, race conditions, insecure function usage, insecure resource management, or improper error handling.

However, it is possible that the function could be vulnerable to other types of attacks, such as a denial-of-service (DoS) attack or a buffer overflow attack. However, without more information about the context in which the function is being used, it is difficult to determine the specific vulnerabilities that may exist.",2175,213,8.599127292633057
177766,DoS,"  NO, the given code is not vulnerable to any security vulnerabilities. It appears to be a function that takes in a struct as an argument and performs various operations on it, but it does not contain any code that could potentially lead to a security vulnerability.",4516,55,3.136958599090576
177767,DoS,"  NO, the given code is not vulnerable to a DoS attack.

The code is using the `talloc` library to allocate memory for the `control` and `r` variables. The `talloc` library is designed to handle memory allocation and deallocation safely, and it is not vulnerable to a DoS attack.

Furthermore, the code is using the `asn1_load` function to load the input data into the `data` structure, and it is not vulnerable to a DoS attack. The `asn1_load` function is designed to handle ASN.1 data safely, and it is not vulnerable to a DoS attack.

Therefore, the code is not vulnerable to a DoS attack.",2174,165,6.911592483520508
177768,DoS,"  NO, the given code is not vulnerable to a DoS attack.

The code is a function that takes a file descriptor and a pointer to a `struct tar_stat_info` as input, and it performs some operations on the file. However, it does not appear to have any vulnerabilities related to buffer overflow, use after free, memory leaks, integer overflow/underflow, null pointer dereference, improper input validation, race conditions, insecure function usage, insecure resource management, improper error handling, cryptographic issues, or sensitive data exposure.

The only potential vulnerability I can see is if the `tar_sparse_dump_region` function is called with a large value of `i`, which could cause the function to enter an infinite loop. However, this is not a DoS vulnerability, as it does not cause the server to crash or become unresponsive. It is simply a potential infinite loop that could be exploited by a malicious user.",2642,212,8.173380851745605
177770,Bypass,"  NO. The code is not vulnerable to a bypass vulnerability. The vulnerability you mentioned is related to the rsync daemon, and the code you provided is not related to that.",3486,42,2.1098694801330566
177771,nan,"  NO. The code is not vulnerable to any of the vulnerabilities you mentioned.

The code is a function that reads a DNS name from a buffer and returns the number of bytes read. It uses a recursive approach to read the name, and it checks for buffer overflows and proper pointer usage. It also performs proper error handling and input validation.

The code does not contain any of the vulnerabilities you mentioned, such as buffer overflows, use-after-free errors, memory leaks, integer overflow/underflow, null pointer dereferences, improper input validation, race conditions, insecure function usage, insecure resource management, improper error handling, cryptographic issues, or sensitive data exposure.

Therefore, the code is not vulnerable to any of the vulnerabilities you mentioned.",1857,170,7.016005039215088
177773,DoS Exec Code Overflow Mem. Corr.,"  NO. The code is not vulnerable to any of the security vulnerabilities you mentioned.

The code is using the `cairo_image_surface_create_for_data` function to create a new surface from the given data, and it is properly checking the return value of the function to ensure that the surface is created successfully. The code is also properly checking the `rowstride` parameter to ensure that it is not negative.

The code is not using any of the functions you mentioned, such as `strcpy`, `sprintf`, `memcpy`, or `array access`, to manipulate the data. Instead, it is using the `cairo_image_surface_create_for_data` function to create a new surface from the given data, and it is properly checking the return value of the function to ensure that the surface is created successfully.

Therefore, the code is not vulnerable to any of the security vulnerabilities you mentioned.",1648,205,7.98303747177124
177774,DoS Exec Code Overflow,"  YES, the given code is vulnerable to a DoS_Exec_Code_Overflow vulnerability. The CVE-ID is CVE-2009-3605. The CWE-ID is CWE-189.

The vulnerability arises from the use of the `ImageStream` class, which is used to read image data from a stream. The `ImageStream` class has a `getLine` method that reads a line of data from the stream and returns it as a string. However, the `getLine` method does not perform any bounds checking on the length of the string, which can lead to a buffer overflow if the string is too long.

An attacker can exploit this vulnerability by sending a crafted PDF file that contains a large image with a malicious string. The malicious string can cause the `getLine` method to read beyond the end of the buffer, leading to a buffer overflow and potentially executing arbitrary code.

To fix this vulnerability, the `ImageStream` class should be modified to perform bounds checking on the length of the string returned by the `getLine` method. This can be done by adding a check to ensure that the string is not longer than the maximum allowed length, and if it is, then return an error or truncate the string to the maximum allowed length.",3326,287,11.763575792312622
177775,DoS Exec Code Overflow,"  YES, the given code is vulnerable to a DoS_Exec_Code_Overflow vulnerability. The CVE-ID is CVE-2009-3605. The CWE-ID is CWE-189.

The vulnerability arises from the use of the `gets` function, which can cause a buffer overflow if the input string is too long. The `gets` function does not perform any bounds checking, and it does not provide any mechanism for the user to specify the maximum length of the input string. This means that an attacker can potentially input a very long string, causing a buffer overflow and potentially leading to a denial of service or other security vulnerabilities.

To fix this vulnerability, the `gets` function should be replaced with a safer function that performs bounds checking and provides a mechanism for the user to specify the maximum length of the input string. For example, the `fgets` function can be used instead, which provides a maximum length parameter that can be used to prevent buffer overflows.",2548,223,8.622509002685547
177777,DoS Exec Code Overflow,"  YES, the given code is vulnerable to a DoS_Exec_Code_Overflow vulnerability. The CVE-ID is CVE-2009-3605. The CWE-ID is CWE-189.

The vulnerability arises from the use of the `cairo_matrix_init_translate` function, which takes a `height` parameter that is not properly validated. An attacker can exploit this vulnerability by providing a large value for `height`, which can cause a buffer overflow and potentially execute arbitrary code.

The code also uses the `cairo_matrix_scale` function, which also takes a `height` parameter that is not properly validated. An attacker can exploit this vulnerability by providing a large value for `height`, which can cause a buffer overflow and potentially execute arbitrary code.

Additionally, the code uses the `cairo_pattern_set_matrix` function, which takes a `matrix` parameter that is not properly validated. An attacker can exploit this vulnerability by providing a malicious `matrix` value, which can cause a buffer overflow and potentially execute arbitrary code.

Overall, the code is vulnerable to a DoS_Exec_Code_Overflow vulnerability due to the use of unvalidated user input and improper memory management.",3102,289,12.298107147216797
177778,DoS Exec Code Overflow,"  YES, the given code is vulnerable to a DoS_Exec_Code_Overflow vulnerability. The CVE-ID is CVE-2009-3605. The CWE-ID is CWE-189.

The vulnerability arises from the use of the `cairo_mask` function, which takes a `cairo_pattern_t` as an argument. The `cairo_pattern_t` is created from a `cairo_surface_t` using the `cairo_pattern_create_for_surface` function. The `cairo_surface_t` is created from a `buffer` using the `cairo_image_surface_create_for_data` function.

The `cairo_image_surface_create_for_data` function takes a `buffer` as an argument, which is a pointer to a block of memory that contains the image data. The `buffer` is created using the `gmalloc` function, which allocates memory using the `malloc` function.

The `malloc` function allocates memory from the heap, which is a shared resource that can be accessed by multiple threads. If the `malloc` function is used in a way that causes a buffer overflow, it can lead to a DoS_Exec_Code_Overflow vulnerability.

For example, if the `",3382,301,12.594957828521729
177779,DoS Exec Code Overflow,"  YES, the given code is vulnerable to a DoS_Exec_Code_Overflow vulnerability. The CVE-ID is CVE-2009-3605. The CWE-ID is CWE-189.

The vulnerability arises from the use of the `cairo_mask` function, which takes a `cairo_pattern_t` as an argument. The `cairo_pattern_t` is created from a `cairo_surface_t` using the `cairo_pattern_create_for_surface` function. The `cairo_surface_t` is created from a buffer of data using the `cairo_image_surface_create_for_data` function.

The vulnerability occurs when the buffer of data is too large, causing an integer overflow. This can lead to a buffer overflow attack, which can execute arbitrary code.

To exploit this vulnerability, an attacker would need to send a specially crafted PDF file to the application, which would cause the buffer to overflow and execute arbitrary code.

The fix for this vulnerability is to ensure that the buffer of data is not too large, and to properly validate and sanitize user input to prevent buffer overflow attacks.",3462,276,11.366456508636475
177780,DoS Exec Code Overflow,"  YES, the given code is vulnerable to a DoS_Exec_Code_Overflow vulnerability. The CVE-ID is CVE-2009-3605. The CWE-ID is CWE-189.

The vulnerability arises from the use of integer overflows in the code. The function takes an integer input 'bitsA' and uses it to calculate the maximum value of a pixel (maxPixel). If the value of 'bitsA' is too large, it can cause an integer overflow, leading to a buffer overflow. This can potentially lead to an exploitable crash or arbitrary code execution.

Additionally, the function also uses the 'decodeLow' and 'decodeRange' arrays to calculate the mapped value of a pixel. If the values in these arrays are too large, it can also cause an integer overflow, leading to a buffer overflow.

The vulnerability can be exploited by sending a crafted PDF file with a large value for 'bitsA', which can cause the function to overflow and crash the application.",3652,228,9.634662866592407
177781,DoS Exec Code Overflow,"  YES, the given code is vulnerable to a DoS Exec Code Overflow vulnerability. The CVE-ID is CVE-2009-3605. The CWE-ID is CWE-189.

The vulnerability arises from the use of the `strcpy` function, which can cause a buffer overflow if the destination buffer is not large enough to hold the source string. In this case, the destination buffer is `tmp_line`, which is allocated with a size of `length * nComps2`. However, the source string is `in`, which can be of any size. If the source string is larger than the destination buffer, it can cause a buffer overflow, leading to a crash or arbitrary code execution.

To exploit this vulnerability, an attacker needs to send a crafted PDF file with a large string in the `in` parameter, which can cause the buffer overflow and execute arbitrary code. This can lead to a denial-of-service (DoS) vulnerability, as the application may crash or behave unexpectedly.",1446,231,8.763118743896484
177783,DoS Exec Code Overflow,"  YES, the given code is vulnerable to a DoS Exec Code Overflow vulnerability. The CVE-ID is CVE-2009-3605. The CWE-ID is CWE-189.

The vulnerability arises from the use of the `strcpy` function, which can cause a buffer overflow if the destination buffer is not large enough to hold the source string. In this case, the destination buffer is `tmp_line`, which is allocated with a size of `length * nComps2`. However, the source string is `in`, which can be of any size. If the source string is larger than the destination buffer, it can cause a buffer overflow, leading to a crash or arbitrary code execution.

To exploit this vulnerability, an attacker needs to send a crafted PDF file with a large string in the `in` parameter, which can cause the buffer overflow and execute arbitrary code. This can lead to a denial-of-service (DoS) vulnerability, as the application may crash or behave unexpectedly.",1440,231,8.867780447006226
177786,DoS Exec Code Overflow,"  YES, the given code is vulnerable to a DoS_Exec_Code_Overflow vulnerability. The CVE-ID is CVE-2009-3605. The CWE-ID is CWE-189.

The vulnerability arises from the use of the `ImageStream` class, which is used to read image data from a stream. The `ImageStream` class has a `getLine` method that reads a line of data from the stream and returns it as a string. However, the method does not perform any bounds checking on the length of the string, which can lead to a buffer overflow if the string is too long.

An attacker can exploit this vulnerability by sending a crafted PDF file that contains a large image with a malicious string. The string can be made large enough to overflow the buffer and cause a buffer overflow. Once the buffer overflow occurs, an attacker can execute arbitrary code on the system.

This vulnerability is similar to CVE-2009-0791, but it is specific to the `ImageStream` class and the `getLine` method.",3322,247,10.162270784378052
177787,DoS Exec Code Overflow,"  YES, the given code is vulnerable to a DoS_Exec_Code_Overflow vulnerability. The CVE-ID is CVE-2009-3605. The CWE-ID is CWE-189.

The vulnerability arises from the use of the ImageStream class, which can cause a buffer overflow if the image data is maliciously crafted. The code does not properly check the size of the image data, which can lead to a buffer overflow and potentially execute arbitrary code.

The vulnerability is caused by the following line of code:
```
imgData.imgStr = new ImageStream(str, width,
				     colorMap->getNumPixelComps(),
				     colorMap->getBits());
```
The ImageStream class does not properly check the size of the image data, which can lead to a buffer overflow if the image data is maliciously crafted. This can cause the application to crash or execute arbitrary code.

To fix this vulnerability, the code should properly check the size of the image data before allocating memory for it. This can be done by using the ImageStream::getSize() method to get the size of the image data and then allocating memory for it.

Additionally, the code should also properly check the size of the mask data before allocating memory for it.",4428,301,13.143552780151367
177788,DoS Exec Code Overflow,"  YES, the given code is vulnerable to a DoS_Exec_Code_Overflow vulnerability. The CVE-ID is CVE-2009-3605. The CWE-ID is CWE-189.

The vulnerability arises from the use of the ImageStream class, which can cause a buffer overflow if the input stream contains a crafted PDF file. The ImageStream class uses a fixed-size buffer to read data from the input stream, and if the buffer is not large enough to hold the entire image, it can cause a buffer overflow. This can lead to a denial of service (application crash) or possibly execute arbitrary code.

The vulnerability is caused by the following line of code:
```
imgData.imgStr = new ImageStream(str, width,
                                colorMap->getNumPixelComps(),
                                colorMap->getBits());
```
The ImageStream class uses the width, height, and bits parameters to determine the size of the buffer to be allocated. However, these parameters are not properly validated, which can lead to a buffer overflow if the input stream contains a crafted PDF file.

To exploit this vulnerability, an attacker can send a crafted PDF file with a large width, height, and bits parameter, which can cause the ImageStream class to allocate a large buffer and read data from the",4140,301,12.880193948745728
177789,DoS Exec Code Overflow,  NO. The given code is not vulnerable to a DoS_Exec_Code_Overflow vulnerability. The code does not contain any integer overflows that can cause a denial of service or arbitrary code execution. The code is well-written and does not contain any vulnerabilities.,1898,60,2.7217226028442383
177792,DoS Exec Code Overflow,"  NO, the given code is not vulnerable to a DoS Exec Code Overflow.

The code is using a switch statement to determine the size of the rowSize variable based on the value of the mode variable. The switch statement is properly bounded and there is no possibility of buffer overflow.

Furthermore, the code is using the gmalloc function to allocate memory for the data variable, which is a secure way of allocating memory in C++.

Therefore, the code is not vulnerable to a DoS Exec Code Overflow.",1534,116,4.760828256607056
177793,DoS Exec Code Overflow,"  YES, the given code is vulnerable to a DoS_Exec_Code_Overflow vulnerability. The CVE-ID is CVE-2009-3605. The CWE-ID is CWE-189.

The vulnerability arises from the use of the FT_Load_Glyph function, which can cause a buffer overflow if the input string is too long. The function takes a FT_UInt as input, which is an unsigned integer type. However, the function does not perform any bounds checking on the input value, which can lead to an integer overflow if the input value is too large.

To exploit this vulnerability, an attacker can craft a specially crafted PDF file that contains a very large value for the gid parameter in the FT_Load_Glyph function. This can cause the function to overflow the buffer and write to memory outside of the allocated space, leading to a crash or arbitrary code execution.

The vulnerability can be mitigated by properly checking the input value for the gid parameter and preventing it from exceeding the maximum value that can be stored in the FT_UInt type.",2748,254,10.322458982467651
177794,nan,"  YES, the given code is vulnerable to a nan vulnerability. The CVE-ID is CVE-2017-16853. The CWE-ID is CWE-347.

The vulnerability arises from the fact that the `atof` function is used to convert a string to a floating-point number, without proper validation. If the input string is not a valid floating-point number, the `atof` function will return a NaN value, which will be assigned to the `m_refreshDelayFactor` variable. This can lead to unexpected behavior in the program, including crashes or incorrect results.

To fix this vulnerability, the code should properly validate the input string before passing it to the `atof` function. This can be done by using a regular expression to check if the input string is a valid floating-point number, or by using a safer alternative like `strtod` or `stof`.",1821,207,7.908017635345459
177795,nan,"  YES, the code is vulnerable to a buffer overflow vulnerability. The function takes a string as input and uses the strcpy function to copy the string into a buffer. However, the buffer is not properly sized, which means that the function can write past the end of the buffer, potentially leading to a buffer overflow. This can allow an attacker to execute arbitrary code, including code to bypass memory safety mechanisms and execute malicious code.",1946,94,3.9410600662231445
177796,Overflow,"  NO, the given code is not vulnerable to buffer overflow.

The code is using a fixed-size buffer to store the data, and the buffer is not being overflowed. The buffer is being used to store the data in a specific format, and the data is being read from the buffer in the same format. There is no possibility of buffer overflow.

However, there are other vulnerabilities in the code, such as use-after-free, memory leaks, and improper input validation. These vulnerabilities can lead to crashes, arbitrary code execution, or other security issues.",1714,124,5.347787380218506
