case_id,vuln_type,audit_report,input_token_num,output_token_num,inference_time
177896,nan,"  NO. The code is not vulnerable to any of the vulnerabilities you mentioned.

The code is using the `fork` system call to create a new process, which is a common way to daemonize a process in Unix-like systems. The `setsid` system call is then used to create a new session and process group, which is also a common way to daemonize a process.

The code is also checking if the `pidfile` parameter is not null, and if it is not null, it is creating a new pidfile using the `ga_open_pidfile` function. This function is not vulnerable to any of the vulnerabilities you mentioned.

The code is also checking if the `chdir` system call is successful, and if it is not successful, it is exiting with an error message.

Overall, the code is not vulnerable to any of the vulnerabilities you mentioned.",1326,200,7.426335334777832
177897,+Info,"  NO, the given code is not vulnerable to any security vulnerabilities.

The code is a C++ function that parses an XML file using the libxml2 library. It does not contain any obvious security vulnerabilities, such as buffer overflows, use-after-free errors, memory leaks, integer overflows, null pointer dereferences, improper input validation, race conditions, insecure function usage, insecure resource management, improper error handling, cryptographic issues, or sensitive data exposure.

However, it is important to note that the code may still contain security vulnerabilities that are not immediately apparent. For example, the code may contain unvalidated user inputs or unchecked calculations that can cause integers to wrap around, leading to incorrect results or buffer miscalculations. Additionally, the code may not properly handle errors or exceptions, which can lead to vulnerabilities if the application doesn't properly address error conditions.

Therefore, it is recommended to conduct a thorough security audit of the code to identify any potential security vulnerabilities.",1650,222,8.39557957649231
177898,+Info,"  NO. The code is not vulnerable to any of the security vulnerabilities listed. It is a valid C++ code that parses an XML document from a memory buffer. It does not contain any buffer overflow, use after free, memory leak, integer overflow/underflow, null pointer dereference, improper input validation, race condition, insecure function usage, insecure resource management, improper error handling, cryptographic issues, or sensitive data exposure vulnerabilities.",1568,99,3.898725748062134
177899,+Info,"  NO, the given code is not vulnerable to any security vulnerabilities.

The code is a C++ function that parses an XML file using the libxml2 library. It does not contain any obvious security vulnerabilities, such as buffer overflows, use-after-free errors, or memory leaks.

However, it is important to note that the code is using the `xmlCreateFileParserCtxt` function, which can be vulnerable to XXE attacks if the XML file being parsed contains external entity references. This is because the `xmlCreateFileParserCtxt` function does not perform any validation on the XML file, and it can be exploited to read arbitrary files on the system.

To mitigate this vulnerability, the code should use the `xmlCreateFileParserCtxtWithData` function instead, which takes an additional `data` parameter that can be used to specify a custom entity loader. This can be used to load the XML file in a secure manner, without allowing the possibility of reading arbitrary files on the system.",1592,223,8.716668605804443
177900,+Info,"  NO. The code is not vulnerable to any of the security vulnerabilities listed. It is a valid C++ code that parses an XML document from a memory buffer. It does not contain any syntax errors and it does not contain any vulnerabilities related to buffer overflow, use after free, memory leaks, integer overflow/underflow, null pointer dereference, improper input validation, race conditions, insecure function usage, insecure resource management, improper error handling, cryptographic issues, or sensitive data exposure.",1480,110,4.4154698848724365
177901,Overflow,"  NO. The code is not vulnerable to buffer overflow. The function takes two parameters, `v` and `str`, and the buffer size is determined by the size of the `str` parameter. The function does not attempt to write beyond the bounds of the `str` parameter, and it does not attempt to read beyond the bounds of the `v` parameter. Therefore, there is no buffer overflow vulnerability.",1146,87,3.369051694869995
177904,DoS,  NO. The code is not vulnerable to a DoS attack.,2036,16,1.042391061782837
177905,DoS,"  YES, the given code is vulnerable to a DoS attack. The vulnerability is caused by the use of the `imgCoordMungeLowerC` and `imgCoordMungeUpperC` functions, which can cause a buffer overflow if the input string is too long. This can lead to a crash or a denial of service.

The reason for this vulnerability is that the `imgCoordMungeLowerC` and `imgCoordMungeUpperC` functions do not perform any bounds checking on the input string, which means that they can write beyond the end of the allocated memory buffer. This can cause the program to overwrite other parts of the memory, potentially leading to a crash or a denial of service.

To fix this vulnerability, the code should perform bounds checking on the input string to ensure that it does not exceed the allocated memory buffer. This can be done by using the `strlen` function to determine the length of the input string and then checking if it exceeds the maximum allowed length. If it does, then the code should return an error or take some other appropriate action.",3618,236,9.933709621429443
177906,DoS Exec Code Overflow,"  YES, the given code is vulnerable to a DoS_Exec_Code_Overflow vulnerability. The CVE-ID is CVE-2013-1788. The CWE-ID is CWE-119.

The vulnerability arises from the use of the `splashFloor` function, which is used to calculate the index of the line dash pattern. The function takes a floating-point number as input and returns the largest integer less than or equal to that number. However, the function does not check for overflows, which can occur if the input value is too large.

If the input value is too large, the function will return a value that is not the largest integer less than or equal to the input value, but rather a value that is too large to be represented by the integer type. This can cause the program to crash or execute arbitrary code.

For example, if the input value is 2^31 (which is the largest integer that can be represented by a 32-bit signed integer), the function will return 2^31 - 1, which is a valid integer. However, if the input value is 2^31 + 1, the function will return 2^31, which is not the largest integer less than or equal to the input value. This can cause the program to crash or execute arbitrary code.

",3103,301,12.438073873519897
177907,DoS Exec Code Overflow,"  NO, the given code is not vulnerable to a DoS_Exec_Code_Overflow vulnerability.

The code does not contain any buffer overflow vulnerabilities, as it does not involve any user-supplied input or unvalidated user input. The code also does not contain any use-after-free errors, as the memory is properly deallocated and the pointers are not used after the memory has been deallocated.

The code does contain some potential security vulnerabilities, such as integer overflow/underflow, null pointer dereference, improper input validation, race conditions, insecure function usage, insecure resource management, and improper error handling. However, these vulnerabilities are not related to the DoS_Exec_Code_Overflow vulnerability.

Therefore, the code is not vulnerable to a DoS_Exec_Code_Overflow vulnerability.",1835,184,7.253313302993774
177909,DoS Exec Code Overflow,"  NO. The code is not vulnerable to a DoS_Exec_Code_Overflow vulnerability. The reason is that the code does not contain any user-input data, and it does not use any user-input data in a way that could lead to a buffer overflow or other security vulnerability.",1839,64,2.803511619567871
177910,DoS,  NO. The code is not vulnerable to a DoS attack. The function `palindromePartition` is not related to the vulnerability in the first code snippet.,1407,38,1.6695411205291748
177911,Exec Code Overflow,"  NO. The code is not vulnerable to Exec Code Overflow. The function takes two parameters, `table` and `valid`, and it does not appear to have any buffer overflow vulnerabilities. The function checks the length of the `table` and the `valid` pointer, and it also checks the length of the `table` and the `valid` pointer. It also checks the glyph indices.

The function does not appear to have any other vulnerabilities.",1301,98,3.6797451972961426
177912,Exec Code Overflow,"  NO. The code is not vulnerable to Exec Code Overflow. The function `palindromePartition` does not involve any memory allocation or deallocation, and it does not have any buffer overflow vulnerabilities.",1549,45,2.0190844535827637
177913,Exec Code Overflow,"  NO. The code is not vulnerable to Exec Code Overflow. The function is not using any user input, and it is not using any external data. It is only using the input data to calculate the length of the table and the number of groups.

The function is using the `TT_NEXT_ULONG` macro to read the values from the table, which ensures that the values are read correctly and safely. The function is also checking the bounds of the table and the number of groups, which ensures that the function does not access memory outside the allocated memory space.

Therefore, the function is not vulnerable to Exec Code Overflow.",2587,138,5.778425693511963
177915,Exec Code Overflow,"  YES, the given code is vulnerable to an Exec Code Overflow vulnerability. The CVE-ID is CVE-2009-0946. The CWE-ID is CWE-189.

The vulnerability arises from the use of the `palindromePartition` function, which takes a string `s` and an integer `k` as input. The function calculates the minimum number of changes required to make the string a palindrome by partitioning it into `k` palindromes. The function uses a dynamic programming approach, where it stores the results of previous calculations in a 2D array `dp1` and `dp2`.

The vulnerability is caused by the fact that the `palindromePartition` function uses a recursive approach to calculate the minimum number of changes required to make the string a palindrome. This means that the function can cause a stack overflow if the input string is too large, as the function will recursively call itself with increasingly larger input strings until it reaches the maximum stack size.

To exploit this vulnerability, an attacker can send a specially crafted input string that causes the `palindromePartition` function to recurse too deeply, leading to a stack overflow and an execution of arbitrary code. This can be done by sending a string with a large number of characters, which will cause the function",2137,301,11.731233358383179
177917,Exec Code,"  NO, the given code is not vulnerable to Exec_Code. The code is a function that retrieves a list of font paths from the X server and returns it as a null-terminated string array. It does not contain any code that could be used to execute arbitrary code on the system.",1850,63,2.6553878784179688
177918,Exec Code,  NO. The code is not vulnerable to Exec_Code.,1894,15,1.0260100364685059
177919,nan,  NO. The code is not vulnerable to a nan vulnerability.,2439,16,1.041081190109253
177920,nan,  NO. The code is not vulnerable to a nan vulnerability.,1839,16,1.011627197265625
177921,nan,  NO. The code is not vulnerable to a nan vulnerability.,1915,16,0.9822173118591309
177922,Exec Code Overflow,  NO. The code is not vulnerable to Exec Code Overflow.,2319,15,0.9880926609039307
177923,Bypass,"  NO, the given code is not vulnerable to a bypass vulnerability. The code checks the input parameters for null or empty values before using them, and it also checks the input parameters for proper length before using them. Additionally, the code uses the `zend_parse_parameters` function to parse the input parameters, which checks for the correct number and types of parameters.

Therefore, the code is not vulnerable to a bypass vulnerability.",1921,97,4.189625263214111
177926,Exec Code Overflow,"  NO, the given code is not vulnerable to Exec Code Overflow.

The code is a function that takes a string and an integer as input, and it returns the minimum number of changes needed to make the string a palindrome. The function uses a dynamic programming approach to solve the problem, and it has a time complexity of O(n^2) and a space complexity of O(n).

The function does not involve any user input or external data, and it does not have any vulnerabilities related to buffer overflow, use after free, memory leaks, integer overflow/underflow, null pointer dereference, improper input validation, race conditions, insecure function usage, insecure resource management, or improper error handling.

Therefore, the code is not vulnerable to Exec Code Overflow.",1894,171,6.889827251434326
177927,nan,"  NO, the given code is not vulnerable to any of the security vulnerabilities listed in the previous steps.

The code is a PHP function that implements the OpenSSL sealing functionality. It takes in a data string, a public key array, and a method string as input, and returns a sealed data string and an array of encrypted keys. The function uses the OpenSSL library to perform the sealing operation.

The code does not contain any of the vulnerabilities listed in the previous steps, such as buffer overflow, use after free, memory leak, integer overflow/underflow, null pointer dereference, improper input validation, race condition, insecure function usage, insecure resource management, or improper error handling.

Therefore, the code is not vulnerable to any of the security vulnerabilities listed in the previous steps.",4053,177,8.124824047088623
