case_id,vuln_type,audit_report,gt,eval_score,eval_input_token_num,eval_output_token_num,eval_inference_time
177736,Bypass," Answer: NO

The function `samldb_check_user_account_control_acl` does not contain the specific vulnerability CVE-2015-8467, CWE-264. It is responsible for checking user account control ACLs based on the provided SID and user account control flags, but it does not contain any access control bypass or privilege escalation issues in the given code snippet.","The code contains a Bypass vulnerability. 
The CVE-ID is CVE-2015-8467. The CWE-ID is CWE-264.
Vulnerability summary:
The samldb_check_user_account_control_acl function in dsdb/samdb/ldb_modules/samldb.c in Samba 4.x before 4.1.22, 4.2.x before 4.2.7, and 4.3.x before 4.3.3 does not properly check for administrative privileges during creation of machine accounts, which allows remote authenticated users to bypass intended access restrictions by leveraging the existence of a domain with both a Samba DC and a Windows DC, a similar issue to CVE-2015-2535.
",1.0,742.0,6.0,3.026257276535034
177740,DoS Exec Code Overflow Mem. Corr.," NO, this code is not vulnerable to the mentioned vulnerability types. It is a function to convert an ASN1_UTCTIME structure to a time_t value, and it does not contain any dynamic memory allocation or complex control flow that could lead to the vulnerabilities mentioned. However, it is always important to validate inputs and handle errors properly, even if the code does not contain any obvious vulnerabilities.","The code contains a DoS_Exec_Code_Overflow_Mem._Corr. vulnerability. 
The CVE-ID is CVE-2013-6420. The CWE-ID is CWE-119.
Vulnerability summary:
The asn1_time_to_time_t function in ext/openssl/openssl.c in PHP before 5.3.28, 5.4.x before 5.4.23, and 5.5.x before 5.5.7 does not properly parse (1) notBefore and (2) notAfter timestamps in X.509 certificates, which allows remote attackers to execute arbitrary code or cause a denial of service (memory corruption) via a crafted certificate that is not properly handled by the openssl_x509_parse function.
",1.0,753.0,6.0,3.2075088024139404
177741,DoS Overflow," NO, this code is not vulnerable to the mentioned vulnerabilities. It is a different function with different functionality, and it does not contain any obvious buffer overflow, use-after-free, memory leak, or null pointer dereference issues. It also does not have any obvious input validation issues or race conditions. However, it is still important to thoroughly test the function and ensure that the input string is properly sanitized and that error handling is robust. The function may also have cryptographic issues or sensitive data exposure, but based on the provided code, it is not possible to determine that.","The code contains a DoS_Overflow vulnerability. 
The CVE-ID is CVE-2011-4128. The CWE-ID is CWE-119.
Vulnerability summary:
Buffer overflow in the gnutls_session_get_data function in lib/gnutls_session.c in GnuTLS 2.12.x before 2.12.14 and 3.x before 3.0.7, when used on a client that performs nonstandard session resumption, allows remote TLS servers to cause a denial of service (application crash) via a large SessionTicket.
",1.0,750.0,6.0,4.203452110290527
177742,DoS Overflow," NO.

The `gnutls_session_get_data` function in the provided code does not contain the same vulnerability as the original code. In this version, the code checks if `psession.size` is larger than `*session_data_size` before copying the data using `memcpy`. This prevents writing outside the allocated memory space, mitigating the buffer overflow vulnerability.

Now, let's check the `wordPattern` function for vulnerabilities:

1. Buffer Overflow: Not applicable, as there are no direct memory operations.
2. Use After Free: Not applicable, as there are no dynamic memory allocations or deallocations.
3. Memory Leaks: Not applicable, as there are no dynamic memory allocations.
4. Integer Overflow/Underflow: Not apparent from the provided code.
5. Null Pointer Dereference: Not applicable, as there are no pointers.
6. Improper Input Validation: The function validates the input strings to some extent, but it does not sanitize them. It assumes that spaces are the only word separators, which might not be true in all cases.
7. Race Conditions: Not applicable, as the function is not multi-threaded.
8. Insecure Function Usage: Not applicable, as there are no insecure functions used.
9. Insecure Resource Management: Not applicable,","The code contains a DoS_Overflow vulnerability. 
The CVE-ID is CVE-2011-4128. The CWE-ID is CWE-119.
Vulnerability summary:
Buffer overflow in the gnutls_session_get_data function in lib/gnutls_session.c in GnuTLS 2.12.x before 2.12.14 and 3.x before 3.0.7, when used on a client that performs nonstandard session resumption, allows remote TLS servers to cause a denial of service (application crash) via a large SessionTicket.
",1.0,895.0,6.0,2.8263490200042725
177743,DoS," Answer:

NO, the provided C++ code is not vulnerable to the mentioned Denial of Service (DoS) vulnerability (CVE-2015-7804, CWE-189). The code you provided is a different function from the initial example, and it does not contain any off-by-one error in the phar\_parse\_zipfile function. It is a different implementation that does not have the same issue.

However, it is essential to continue checking the rest of the codebase for the mentioned vulnerabilities and any other potential security issues.","The code contains a DoS vulnerability. 
The CVE-ID is CVE-2015-7804. The CWE-ID is CWE-189.
Vulnerability summary:
Off-by-one error in the phar_parse_zipfile function in ext/phar/zip.c in PHP before 5.5.30 and 5.6.x before 5.6.14 allows remote attackers to cause a denial of service (uninitialized pointer dereference and application crash) by including the / filename in a .zip PHAR archive.
",3.0,739.0,6.0,2.7460947036743164
177747,DoS," Answer:

NO.

The vulnerability in the first code snippet is due to the uninitialized variable `total`, which is used in memory allocation and `memcpy`. However, in the second code snippet, the `total` variable is not used in the `bgp_attr_unknown` function at all, so there is no vulnerability related to it.

The `wordPattern` function in the second code snippet has a different logic and functionality compared to the `bgp_attr_unknown` function, and it does not contain any memory vulnerabilities like buffer overflow or use-after-free.","The code contains a DoS vulnerability. 
The CVE-ID is CVE-2013-6051. The CWE-ID is nan.
Vulnerability summary:
The bgp_attr_unknown function in bgp_attr.c in Quagga 0.99.21 does not properly initialize the total variable, which allows remote attackers to cause a denial of service (bgpd crash) via a crafted BGP update.
",3.0,715.0,6.0,4.612184286117554
177750,DoS Exec Code," Answer:

NO.

The provided code for `begin_softmask` does not exhibit the specific vulnerabilities related to CVE-2018-1000039, CWE-416, or DoS_Exec_Code as described. The vulnerabilities in the original code were due to heap use-after-free bugs in the PDF parser, which are not present in this function.

However, I noticed that the `wordPattern` function was also given. Let's analyze that for common vulnerabilities:

1. Buffer Overflow: The code does not have any operations that directly manipulate memory or arrays, so buffer overflow vulnerabilities are unlikely.
2. Use After Free: There are no dynamic memory allocations or deallocations, so use-after-free errors are not present.
3. Memory Leaks: There are no dynamic memory allocations or deallocations, so memory leaks are not present.
4. Integer Overflow/Underflow: The code does not perform any arithmetic operations that could result in integer overflows or underflows.
5. Null Pointer Dereference: There are no pointer dereferences in the code, so null pointer dereferencing vulnerabilities are unlikely.
6. Improper Input Validation: The code does not validate or sanitize inputs, which could lead to issues if the input string is not properly form","The code contains a DoS_Exec_Code vulnerability. 
The CVE-ID is CVE-2018-1000039. The CWE-ID is CWE-416.
Vulnerability summary:
In MuPDF 1.12.0 and earlier, multiple heap use after free bugs in the PDF parser could allow an attacker to execute arbitrary code, read memory, or cause a denial of service via a crafted file.
",1.0,855.0,6.0,4.779743909835815
177766,DoS," Answer:

NO.

The provided `ldap_push_filter` function does not have the same vulnerability as the first function you mentioned. The vulnerability in the first function was due to the lack of checking return values for successful ASN.1 memory allocation, which is not present in this function.

However, it is essential to check other parts of the code where ASN.1 memory allocation is performed and ensure proper error handling to avoid similar vulnerabilities.","The code contains a DoS vulnerability. 
The CVE-ID is CVE-2015-7540. The CWE-ID is CWE-399.
Vulnerability summary:
The LDAP server in the AD domain controller in Samba 4.x before 4.1.22 does not check return values to ensure successful ASN.1 memory allocation, which allows remote attackers to cause a denial of service (memory consumption and daemon crash) via crafted packets.
",3.0,695.0,6.0,5.9939587116241455
177767,DoS," Answer:

NO, the provided `decode_openldap_dereference` function is not vulnerable to the Denial of Service (DoS) vulnerability mentioned in the question. The reason is that the vulnerability in the original code was due to the lack of checking return values for successful ASN.1 memory allocation, which is not present in this code.

However, I would like to point out that the code contains a potential buffer overflow vulnerability in the `asn1_read_OctetString_talloc` function calls. There is no length check for the source_attribute and dereferenced_dn buffers before reading into them. If the input data has a larger size than the buffer, it will result in a buffer overflow. To fix this, you should check the length of the data before reading into the buffer.

For the `wordPattern` function, it does not contain any obvious security vulnerabilities related to the provided vulnerability types. However, it is always a good practice to validate user inputs and ensure proper error handling in all cases.","The code contains a DoS vulnerability. 
The CVE-ID is CVE-2015-7540. The CWE-ID is CWE-399.
Vulnerability summary:
The LDAP server in the AD domain controller in Samba 4.x before 4.1.22 does not check return values to ensure successful ASN.1 memory allocation, which allows remote attackers to cause a denial of service (memory consumption and daemon crash) via crafted packets.
",2.0,812.0,6.0,5.023637056350708
177768,DoS," Answer:

NO.

The provided code snippet does not contain the vulnerability described in CVE-2018-20482 and CWE-835. The vulnerability is related to mishandling file shrinkage during read access, but this code snippet does not contain any logic related to handling file shrinkage or reading files. It is a separate function that deals with sparse file handling, so it is not vulnerable.","The code contains a DoS vulnerability. 
The CVE-ID is CVE-2018-20482. The CWE-ID is CWE-835.
Vulnerability summary:
GNU Tar through 1.30, when --sparse is used, mishandles file shrinkage during read access, which allows local users to cause a denial of service (infinite read loop in sparse_dump_region in sparse.c) by modifying a file that is supposed to be archived by a different user's process (e.g., a system backup running as root).
",3.0,708.0,6.0,3.6145923137664795
177770,Bypass," Answer:

YES, the code is vulnerable. It is the same code as the original vulnerable version, with the same issue in the `read_ndx_and_attrs` function. The function does not check for fnamecmp filenames in the `daemon_filter_list` data structure and does not apply the sanitize_paths protection mechanism to pathnames found in ""xname follows"" strings. This allows remote attackers to bypass intended access restrictions.","The code contains a Bypass vulnerability. 
The CVE-ID is CVE-2017-17434. The CWE-ID is nan.
Vulnerability summary:
The daemon in rsync 3.1.2, and 3.1.3-development before 2017-12-03, does not check for fnamecmp filenames in the daemon_filter_list data structure (in the recv_files function in receiver.c) and also does not apply the sanitize_paths protection mechanism to pathnames found in ""xname follows"" strings (in the read_ndx_and_attrs function in rsync.c), which allows remote attackers to bypass intended access restrictions.
",3.0,734.0,6.0,3.6399834156036377
177771,," NO, this second code snippet is not vulnerable to the nan vulnerability described. The code provided is a different function called `wordPattern`, which does not contain any recursive function calls or pointer arithmetic that could lead to stack exhaustion or infinite recursion. It is a completely different function that checks for a pattern in a string, and it does not have any relation to the DNS packet parsing code that was vulnerable in the first code snippet.","The code contains a nan vulnerability. 
The CVE-ID is CVE-2018-20103. The CWE-ID is CWE-835.
Vulnerability summary:
An issue was discovered in dns.c in HAProxy through 1.8.14. In the case of a compressed pointer, a crafted packet can trigger infinite recursion by making the pointer point to itself, or create a long chain of valid pointers resulting in stack exhaustion.
",1.0,692.0,6.0,5.295553684234619
177773,DoS Exec Code Overflow Mem. Corr.," NO, the provided code is not vulnerable to the mentioned vulnerability type (DoS Exec Code Overflow Mem. Corr.). The code is a function to convert image data into a different format and there are no integer overflows or memory corruption issues present in the code.

However, the code does not handle the case when `str` does not contain any words (i.e., it is an empty string or only contains spaces). In this case, the function will return `false`, but it might be desirable to handle this case separately.","The code contains a DoS_Exec_Code_Overflow_Mem._Corr. vulnerability. 
The CVE-ID is CVE-2009-3607. The CWE-ID is CWE-189.
Vulnerability summary:
Integer overflow in the create_surface_from_thumbnail_data function in glib/poppler-page.cc in Poppler 0.x allows remote attackers to cause a denial of service (memory corruption) or possibly execute arbitrary code via a crafted PDF document that triggers a heap-based buffer overflow.  NOTE: some of these details are obtained from third party information.
",1.0,738.0,6.0,4.390760183334351
177774,DoS Exec Code Overflow," Answer:

NO.

The function does not contain any of the vulnerabilities listed in the audit steps. It is a function for drawing an image and handling color maps, and while it does use dynamic memory allocation, it does not contain any unchecked arithmetic operations, input validations, or resource management that could lead to the vulnerabilities mentioned.","The code contains a DoS_Exec_Code_Overflow vulnerability. 
The CVE-ID is CVE-2009-3605. The CWE-ID is CWE-189.
Vulnerability summary:
Multiple integer overflows in Poppler 0.10.5 and earlier allow remote attackers to cause a denial of service (application crash) or possibly execute arbitrary code via a crafted PDF file, related to (1) glib/poppler-page.cc; (2) ArthurOutputDev.cc, (3) CairoOutputDev.cc, (4) GfxState.cc, (5) JBIG2Stream.cc, (6) PSOutputDev.cc, and (7) SplashOutputDev.cc in poppler/; and (8) SplashBitmap.cc, (9) Splash.cc, and (10) SplashFTFont.cc in splash/.  NOTE: this may overlap CVE-2009-0791.
",1.0,768.0,6.0,3.6398282051086426
177775,DoS Exec Code Overflow," NO.

The given code does not contain the DoS_Exec_Code_Overflow vulnerability mentioned in CVE-2009-3605 and CWE-189. The code snippet provided is different from the ones listed in the vulnerability summary. However, it is still important to check for other potential vulnerabilities using the steps mentioned in the original question.","The code contains a DoS_Exec_Code_Overflow vulnerability. 
The CVE-ID is CVE-2009-3605. The CWE-ID is CWE-189.
Vulnerability summary:
Multiple integer overflows in Poppler 0.10.5 and earlier allow remote attackers to cause a denial of service (application crash) or possibly execute arbitrary code via a crafted PDF file, related to (1) glib/poppler-page.cc; (2) ArthurOutputDev.cc, (3) CairoOutputDev.cc, (4) GfxState.cc, (5) JBIG2Stream.cc, (6) PSOutputDev.cc, and (7) SplashOutputDev.cc in poppler/; and (8) SplashBitmap.cc, (9) Splash.cc, and (10) SplashFTFont.cc in splash/.  NOTE: this may overlap CVE-2009-0791.
",1.0,772.0,6.0,4.36082911491394
177777,DoS Exec Code Overflow," Answer:

NO.

The code you provided is not vulnerable to the DoS Exec Code Overflow (CVE-2009-3605, CWE-189) vulnerability. The vulnerability in the original code was due to multiple integer overflows in various files, which is not reflected in the provided code. The given function has no integer overflows, so it is not vulnerable.

However, it is essential to thoroughly check the rest of the codebase for similar vulnerabilities, as the given function may interact with other functions that could contain the mentioned integer overflows.","The code contains a DoS_Exec_Code_Overflow vulnerability. 
The CVE-ID is CVE-2009-3605. The CWE-ID is CWE-189.
Vulnerability summary:
Multiple integer overflows in Poppler 0.10.5 and earlier allow remote attackers to cause a denial of service (application crash) or possibly execute arbitrary code via a crafted PDF file, related to (1) glib/poppler-page.cc; (2) ArthurOutputDev.cc, (3) CairoOutputDev.cc, (4) GfxState.cc, (5) JBIG2Stream.cc, (6) PSOutputDev.cc, and (7) SplashOutputDev.cc in poppler/; and (8) SplashBitmap.cc, (9) Splash.cc, and (10) SplashFTFont.cc in splash/.  NOTE: this may overlap CVE-2009-0791.
",3.0,815.0,6.0,3.7485599517822266
177778,DoS Exec Code Overflow," Answer:

NO, the given code is not vulnerable to the mentioned DoS Exec Code Overflow vulnerability (CVE-2009-3605, CWE-189). The code provided is a function definition for `drawMaskedImage`, and it does not contain any integer overflows related to the vulnerabilities mentioned in the CVE and CWE. However, it is essential to check other parts of the code where the function is being called or used, as the vulnerability could be due to improper usage.

It is always necessary to thoroughly analyze the entire codebase and its usage to ensure there are no vulnerabilities.","The code contains a DoS_Exec_Code_Overflow vulnerability. 
The CVE-ID is CVE-2009-3605. The CWE-ID is CWE-189.
Vulnerability summary:
Multiple integer overflows in Poppler 0.10.5 and earlier allow remote attackers to cause a denial of service (application crash) or possibly execute arbitrary code via a crafted PDF file, related to (1) glib/poppler-page.cc; (2) ArthurOutputDev.cc, (3) CairoOutputDev.cc, (4) GfxState.cc, (5) JBIG2Stream.cc, (6) PSOutputDev.cc, and (7) SplashOutputDev.cc in poppler/; and (8) SplashBitmap.cc, (9) Splash.cc, and (10) SplashFTFont.cc in splash/.  NOTE: this may overlap CVE-2009-0791.
",1.0,823.0,6.0,3.8064918518066406
177779,DoS Exec Code Overflow," Answer:

NO.

The given code does not exhibit the DoS Exec Code Overflow vulnerability as described in CVE-2009-3605 and CWE-189. The code provided is a function for rendering a soft-masked image using the Cairo library, and it does not contain any integer overflows or other vulnerabilities mentioned in the question. However, it is still essential to ensure proper error handling, input validation, and other security best practices in the rest of the codebase.","The code contains a DoS_Exec_Code_Overflow vulnerability. 
The CVE-ID is CVE-2009-3605. The CWE-ID is CWE-189.
Vulnerability summary:
Multiple integer overflows in Poppler 0.10.5 and earlier allow remote attackers to cause a denial of service (application crash) or possibly execute arbitrary code via a crafted PDF file, related to (1) glib/poppler-page.cc; (2) ArthurOutputDev.cc, (3) CairoOutputDev.cc, (4) GfxState.cc, (5) JBIG2Stream.cc, (6) PSOutputDev.cc, and (7) SplashOutputDev.cc in poppler/; and (8) SplashBitmap.cc, (9) Splash.cc, and (10) SplashFTFont.cc in splash/.  NOTE: this may overlap CVE-2009-0791.
",3.0,800.0,6.0,4.035101890563965
177780,DoS Exec Code Overflow," Answer:

NO.

The given code does not contain the DoS_Exec_Code_Overflow vulnerability as in the previous example. It has some error handling issues and potential memory leaks, but it does not contain any arithmetic operations that could lead to an integer overflow or underflow.","The code contains a DoS_Exec_Code_Overflow vulnerability. 
The CVE-ID is CVE-2009-3605. The CWE-ID is CWE-189.
Vulnerability summary:
Multiple integer overflows in Poppler 0.10.5 and earlier allow remote attackers to cause a denial of service (application crash) or possibly execute arbitrary code via a crafted PDF file, related to (1) glib/poppler-page.cc; (2) ArthurOutputDev.cc, (3) CairoOutputDev.cc, (4) GfxState.cc, (5) JBIG2Stream.cc, (6) PSOutputDev.cc, and (7) SplashOutputDev.cc in poppler/; and (8) SplashBitmap.cc, (9) Splash.cc, and (10) SplashFTFont.cc in splash/.  NOTE: this may overlap CVE-2009-0791.
",1.0,759.0,6.0,3.4422879219055176
177781,DoS Exec Code Overflow," Answer:

NO, the second code snippet is not vulnerable according to the given vulnerability types. It does not contain any buffer overflow, use-after-free, memory leak, integer overflow/underflow, null pointer dereference, or input validation issues. However, it is always a good idea to perform additional checks for race conditions, insecure function usage, insecure resource management, improper error handling, cryptographic issues, and sensitive data exposure.","The code contains a DoS_Exec_Code_Overflow vulnerability. 
The CVE-ID is CVE-2009-3605. The CWE-ID is CWE-189.
Vulnerability summary:
Multiple integer overflows in Poppler 0.10.5 and earlier allow remote attackers to cause a denial of service (application crash) or possibly execute arbitrary code via a crafted PDF file, related to (1) glib/poppler-page.cc; (2) ArthurOutputDev.cc, (3) CairoOutputDev.cc, (4) GfxState.cc, (5) JBIG2Stream.cc, (6) PSOutputDev.cc, and (7) SplashOutputDev.cc in poppler/; and (8) SplashBitmap.cc, (9) Splash.cc, and (10) SplashFTFont.cc in splash/.  NOTE: this may overlap CVE-2009-0791.
",1.0,790.0,6.0,3.070891857147217
177783,DoS Exec Code Overflow," Answer:

NO, the second code snippet is not vulnerable according to the given vulnerability type DoS Exec Code Overflow. This question is related to the first code snippet's vulnerability, but the second code snippet is a different function, `wordPattern`, which does not contain any similar vulnerabilities as the first one.","The code contains a DoS_Exec_Code_Overflow vulnerability. 
The CVE-ID is CVE-2009-3605. The CWE-ID is CWE-189.
Vulnerability summary:
Multiple integer overflows in Poppler 0.10.5 and earlier allow remote attackers to cause a denial of service (application crash) or possibly execute arbitrary code via a crafted PDF file, related to (1) glib/poppler-page.cc; (2) ArthurOutputDev.cc, (3) CairoOutputDev.cc, (4) GfxState.cc, (5) JBIG2Stream.cc, (6) PSOutputDev.cc, and (7) SplashOutputDev.cc in poppler/; and (8) SplashBitmap.cc, (9) Splash.cc, and (10) SplashFTFont.cc in splash/.  NOTE: this may overlap CVE-2009-0791.
",1.0,765.0,6.0,3.082996368408203
177786,DoS Exec Code Overflow," Answer:

NO.

The function does not contain any of the vulnerabilities listed in the audit steps. It is a function for drawing an image and handling color maps, and while it does use dynamic memory allocation, it has proper error handling and deallocation. There are no unsafe functions, unvalidated user inputs, or race conditions. The function does not perform any arithmetic operations that could lead to overflows or underflows, and there are no null pointers or sensitive data issues.","The code contains a DoS_Exec_Code_Overflow vulnerability. 
The CVE-ID is CVE-2009-3605. The CWE-ID is CWE-189.
Vulnerability summary:
Multiple integer overflows in Poppler 0.10.5 and earlier allow remote attackers to cause a denial of service (application crash) or possibly execute arbitrary code via a crafted PDF file, related to (1) glib/poppler-page.cc; (2) ArthurOutputDev.cc, (3) CairoOutputDev.cc, (4) GfxState.cc, (5) JBIG2Stream.cc, (6) PSOutputDev.cc, and (7) SplashOutputDev.cc in poppler/; and (8) SplashBitmap.cc, (9) Splash.cc, and (10) SplashFTFont.cc in splash/.  NOTE: this may overlap CVE-2009-0791.
",1.0,798.0,6.0,3.292682409286499
177787,DoS Exec Code Overflow," Answer:

NO.

The vulnerability you mentioned, CVE-2","The code contains a DoS_Exec_Code_Overflow vulnerability. 
The CVE-ID is CVE-2009-3605. The CWE-ID is CWE-189.
Vulnerability summary:
Multiple integer overflows in Poppler 0.10.5 and earlier allow remote attackers to cause a denial of service (application crash) or possibly execute arbitrary code via a crafted PDF file, related to (1) glib/poppler-page.cc; (2) ArthurOutputDev.cc, (3) CairoOutputDev.cc, (4) GfxState.cc, (5) JBIG2Stream.cc, (6) PSOutputDev.cc, and (7) SplashOutputDev.cc in poppler/; and (8) SplashBitmap.cc, (9) Splash.cc, and (10) SplashFTFont.cc in splash/.  NOTE: this may overlap CVE-2009-0791.
",1.0,718.0,6.0,2.8105382919311523
